0,фото в карелии спасатели помогли выбраться из снежного плена автомобилистам из архангельска подробнее,2019-02-02 10:10:01,29378821,[]
1,видео женщина попала под колеса гонщика в беломорске страшные кадры подробнее,2019-02-02 09:50:02,29378821,[]
2,видео в поселке карелии местные жители сами построили мост подробнее,2019-02-02 09:30:02,29378821,[]
3,куда пойти в петрозаводске февраля сказки для детей пижамная вечеринка и встречи одноклассников подробнее,2019-02-02 09:05:02,29378821,[]
4,какие события ожидаются в петрозаводске и карелии сегодня подробнее,2019-02-02 08:30:01,29378821,[]
5,прогноз погоды на субботу подробнее,2019-02-02 07:05:02,29378821,[]
6,в карелии суд обязал освободить незаконно занятые земельные участки в заказнике подробнее,2019-02-02 02:50:02,29378821,[]
7,совбез модернизация онежского завода в петрозаводске практически не ведется подробнее,2019-02-02 02:05:02,29378821,[]
8,арт объект в петрозаводске установят ветряк подробнее,2019-02-02 01:25:02,29378821,[]
9,его усыпили и погубили дело о смерти в больнице петрозаводска дошло до суда подробнее,2019-02-02 00:45:02,29378821,[]
10,в петрозаводске ищут тех кто обезобразил территорию пляжа в песках подробнее,2019-02-02 00:05:02,29378821,[]
11,в петрозаводске бухгалтера медучреждения осудили за хищение более полумиллиона рублей подробнее,2019-02-01 23:50:02,29378821,[]
12,главный сексолог страны назвал пятерку лучших авто для любовных утех подробнее,2019-02-01 23:30:02,29378821,[]
13,догулялась директор турагентства петрозаводска прокутившая деньги клиентов ждет суда подробнее,2019-02-01 23:25:02,29378821,[]
14,новый облик мирошник допустила появление космической композиции на площади гагарина подробнее,2019-02-01 22:55:02,29378821,[]
15,что случилось в петрозаводске и карелии сегодня подробнее,2019-02-01 22:25:02,29378821,[]
16,ищут по всему городу полиция петрозаводска разыскивает пару подозреваемую в краже подробнее,2019-02-01 22:15:02,29378821,[]
17,на что россияне потратили больше всего денег в январе подробнее,2019-02-01 22:00:02,29378821,[]
18,разве это жизнь в карелии многодетная семья замерзает в аварийном доме подробнее,2019-02-01 21:45:02,29378821,[]
19,вера брежнева устроила фотосессию в купальнике подробнее,2019-02-01 21:30:02,29378821,[]
20,почему в карелии выросли тарифы на вывоз мусора подробнее,2019-02-01 21:15:02,29378821,[]
21,кадры в петрозаводске назначен новый директор пмуп городской транспорт подробнее,2019-02-01 21:10:03,29378821,[]
22,в россии хотят в раз увеличить штрафы для уклоняющихся от призыва подробнее,2019-02-01 21:10:02,29378821,[]
23,главные новости этой недели заминированный петрозаводск снос биг бена гибель профессора петргу подробнее,2019-02-01 21:05:02,29378821,[]
24,предпенсионеры составляют десятую часть всех безработных карелии подробнее,2019-02-01 21:00:01,29378821,[]
25,с февраля в россии проиндексировали социальные выплаты подробнее,2019-02-01 20:40:02,29378821,[]
26,готовятся к обновлению власти петрозаводска рассказали о планах по ремонту трех мостов подробнее,2019-02-01 20:20:03,29378821,[]
27,муж наташи королевой показал ее неудачную фотографию подробнее,2019-02-01 20:20:02,29378821,[]
28,бывший руководитель ао кондопога возглавил компанию фактически владеющую комбинатом подробнее,2019-02-01 20:15:02,29378821,[]
29,планы планы планы власти петрозаводска планируют построить дублер карельского проспекта и сквозной проезд от балтийской подробнее,2019-02-01 20:00:02,29378821,[]
30,какие события ожидаются в петрозаводске и карелии завтра подробнее,2019-02-01 20:00:01,29378821,[]
31,бузова кардинально изменила имидж подробнее,2019-02-01 19:45:02,29378821,[]
32,куда пойти в петрозаводске февраля сказки для детей пижамная вечеринка и встречи одноклассников подробнее,2019-02-01 19:40:01,29378821,[]
33,в минсельхозе карелии объяснили куда пойдут дополнительные деньги подробнее,2019-02-01 19:35:02,29378821,[]
34,больной раком юдашкин почти не говорит подробнее,2019-02-01 19:15:02,29378821,[]
35,криминал в регионе житель карелии зарезал своего знакомого ночью на улице подробнее,2019-02-01 19:10:02,29378821,[]
36,начали действовать новые правила потребительского кредитования подробнее,2019-02-01 19:10:02,29378821,[]
37,сегежский цбк получил приоритетное право на аренду леса в карелии подробнее,2019-02-01 19:00:01,29378821,[]
38,власти предпенсионеры карелии полностью устраивают работодателей подробнее,2019-02-01 18:55:02,29378821,[]
39,в карелии пройдут рейды пешеход подробнее,2019-02-01 18:40:01,29378821,[]
40,в петрозаводске пьяная гостья обокрала хозяев подробнее,2019-02-01 18:20:02,29378821,[]
41,прокуратура оценит нарушения мэрии петрозаводска при расчетах аренды земли подробнее,2019-02-01 18:05:01,29378821,[]
42,в петрозаводске запустили дрон для земельного контроля подробнее,2019-02-01 18:00:01,29378821,[]
43,россияне получили доступ к персональному кредитному рейтингу подробнее,2019-02-01 17:45:02,29378821,[]
44,лоухское дрсу попалось на нарушении закона подробнее,2019-02-01 17:40:02,29378821,[]
45,петрозаводчанку обокрали на рабочем месте подробнее,2019-02-01 17:20:01,29378821,[]
46,в карелии предпенсионеры пока не захотели заниматься бизнесом подробнее,2019-02-01 17:15:02,29378821,[]
47,суд отправил под домашний арест гендиректора ооо ремстройкомплект николая рыкова по обвинению в мошенничестве при ремонте дорог в петрозаводске подробнее,2019-02-01 17:10:02,29378821,[]
48,мороз мало осадков прогноз погоды на февраля подробнее,2019-02-01 17:00:02,29378821,[]
49,его усыпили и погубили дело о смерти в больнице петрозаводска дошло до суда подробнее,2019-02-01 16:55:02,29378821,[]
50,,2019-02-01 16:54:09,29378821,
51,парфенчиков увеличил штатный предел уксу при минстрое карелии подробнее,2019-02-01 16:50:01,29378821,[]
52,отзывает тысячи автомобилей подробнее,2019-02-01 16:30:02,29378821,[]
53,полиция петрозаводска разыскивает мужчину подозреваемого в краже детского конструктора подробнее,2019-02-01 16:25:02,29378821,[]
54,,2019-02-01 16:18:02,29378821,
55,на дорогах петрозаводска три дня будут ловить пьяных водителей подробнее,2019-02-01 16:10:02,29378821,[]
56,,2019-02-01 16:05:56,29378821,
57,в карелии женщину осудили на четыре года за хищение почти млн рублей подробнее,2019-02-01 16:00:02,29378821,[]
58,гендиректора фирмы по ремонту дорог ооо ремстройкомплект николая рыкова хотят арестовать в петрозаводске подробнее,2019-02-01 15:45:02,29378821,[]
59,житель карелии хотел накормить собаку деликатесами подробнее,2019-02-01 15:40:02,29378821,[]
60,,2019-02-01 14:56:58,29378821,
61,гибдд проконтролирует безопасную перевозку детей автобусами подробнее,2019-02-01 14:40:01,29378821,[]
62,жительнице карелии знакомая вернула долг наркотиками подробнее,2019-02-01 13:50:01,29378821,[]
63,в петрозаводске назначен новый директор пмуп городской транспорт подробнее,2019-02-01 13:45:01,29378821,[]
64,в петрозаводске ищут тех кто обезобразил территорию пляжа в песках создатели свалок не только обезображивают территорию города но и в буквальном смысле воруют деньги которые могут быть использованы на благоустройство общественных территорий подробнее,2019-02-01 13:20:02,29378821,[]
65,новый жилой комплекс жемчужина от строительной компании век жк жемчужина это идеальный выбор для амбициозных людей ценящих свое время и предпочитающих динамичный образ жизни,2019-02-01 13:00:10,29378821,[]
66,фото в карелии многодетная семья замерзает в аварийном доме подробнее,2019-02-01 13:00:02,29378821,[]
67,в петрозаводске появилась новая услуга связанная с экспертизой недвижимости подробнее,2019-02-01 12:55:02,29378821,[]
68,энергетическая компания в карелии снизила потери электроэнергии на в году подробнее,2019-02-01 12:50:02,29378821,[]
69,директор турагентства петрозаводска прокутившая деньги клиентов ждет суда подробнее,2019-02-01 12:45:02,29378821,[]
70,глухонемой петрозаводчанин совершил серию краж на сумму свыше тысяч рублей подробнее,2019-02-01 12:40:02,29378821,[]
71,манский привез свидетелей путина в финляндию подробнее,2019-02-01 12:35:02,29378821,[]
72,,2019-02-01 12:18:09,29378821,
73,ветряк украсит петрозаводск подробнее,2019-02-01 12:15:02,29378821,[]
74,,2019-02-01 12:07:03,29378821,
75,мчс назвало лучшее предприятие года в карелии подробнее,2019-02-01 12:05:02,29378821,[]
76,,2019-02-01 11:38:11,29378821,
77,совбез модернизация онежского завода в петрозаводске практически не ведется подробнее,2019-02-01 11:30:01,29378821,[]
78,,2019-02-01 11:01:13,29378821,
79,в петрозаводске бухгалтера медучреждения осудили за хищение более полумиллиона рублей подробнее,2019-02-01 11:00:02,29378821,[]
80,в карелии обокрали сотрудника жкх подробнее,2019-02-01 10:55:02,29378821,[]
81,,2019-02-01 10:53:24,29378821,
82,,2019-02-01 10:45:06,29378821,
83,власти петрозаводска рассказали о планах по ремонту трех мостов подробнее,2019-02-01 10:25:02,29378821,[]
84,в карелии суд обязал освободить незаконно занятые земельные участки в заказнике подробнее,2019-02-01 10:20:02,29378821,[]
85,водитель во время обгона сбил женщину в беломорске подробнее,2019-02-01 10:15:01,29378821,[]
86,камаз вылетел с трассы в суоярвском районе подробнее,2019-02-01 10:10:02,29378821,[]
87,водителей снегоходов будут ловить и наказывать инспекция гостехнадзора с февраля по марта будет проводить в карелии профилактическую операцию снегоход сообщает пресс служба регионального минсельхоза,2019-02-01 10:08:52,29378821,[]
88,полиция петрозаводска разыскивает пару подозреваемую в краже подробнее,2019-02-01 10:05:02,29378821,[]
89,врачи офтальмологического центра карелии возобновят выезды в районы подробнее,2019-02-01 10:00:02,29378821,[]
90,в районе карелии произошел пожар в жилом доме подробнее,2019-02-01 09:50:02,29378821,[]
91,,2019-02-01 09:49:13,29378821,
92,власти петрозаводска планируют построить дублер карельского проспекта и сквозной проезд от балтийской подробнее,2019-02-01 09:35:02,29378821,[]
93,в карелии горел подробнее,2019-02-01 09:30:02,29378821,[]
94,пенсионер в костомукше присвоил чужие деньги из банкомата подробнее,2019-02-01 09:25:02,29378821,[]
95,,2019-02-01 09:20:56,29378821,
96,мирошник допустила появление космической композиции на площади гагарина подробнее,2019-02-01 09:15:01,29378821,[]
97,юных дизайнеров карелии приглашают поучаствовать в конкурсе подробнее,2019-02-01 08:20:02,29378821,[]
98,работы фотографа из карелии представлены на фотобиеннале в санкт петербурге подробнее,2019-02-01 08:05:01,29378821,[]
99,какие события ожидаются в петрозаводске и карелии сегодня подробнее,2019-02-01 07:55:01,29378821,[]
100,администрация петрозаводска просит горожан остерегаться сосулек подробнее,2019-02-01 07:15:02,29378821,[]
101,прогноз погоды на пятницу подробнее,2019-02-01 07:05:02,29378821,[]
102,житель карелии зарезал своего знакомого ночью на улице подробнее,2019-02-01 06:40:02,29378821,[]
103,ужасы нашего городка в петрозаводске мужчина несколько лет насиловал ребенка подробнее,2019-02-01 01:35:02,29378821,[]
104,страшная история дело о смерти в больнице петрозаводска дошло до суда подробнее,2019-02-01 01:00:02,29378821,[]
105,чп в петрозаводске кладовщик умер на рабочем месте подробнее,2019-02-01 00:35:02,29378821,[]
106,внимание розыск в петрозаводске без вести пропала летняя женщина подробнее,2019-02-01 00:00:02,29378821,[]
107,погода на завтра подробнее,2019-01-31 23:45:00,29378821,[]
108,заявление карелия недостаточно защищена от террористов заявил прокурор региона подробнее,2019-01-31 23:30:03,29378821,[]
109,какие мысли помогут достичь оргазма подробнее,2019-01-31 23:30:02,29378821,[]
110,мир не без добрых людей сотрудники еддс петрозаводска помогли маленькой девочке плачущей на остановке подробнее,2019-01-31 23:00:02,29378821,[]
111,залатают власти определили какие дороги отремонтируют в петрозаводске в году подробнее,2019-01-31 22:30:03,29378821,[]
112,что делать при подозрительных звонках от имени банка подробнее,2019-01-31 22:30:02,29378821,[]
113,важные новости которые вы могли пропустить подробнее,2019-01-31 22:25:02,29378821,[]
114,иконка не поможет представитель путина рассказал что делать чиновникам карелии при соблазне получить взятку подробнее,2019-01-31 22:00:02,29378821,[]
115,найден способ взломать по номеру телефона подробнее,2019-01-31 22:00:01,29378821,[]
116,вскрылись сенсационные данные о молодой невесте цекало подробнее,2019-01-31 21:35:01,29378821,[]
117,охотникам на заметку в карелии объявлен размер вознаграждения за голову волка подробнее,2019-01-31 21:30:02,29378821,[]
118,опыт борьбы с производственным травматизмом в карелии признан одним из лучших в россии подробнее,2019-01-31 21:30:01,29378821,[]
119,в россии начали менять систему измерения бедности подробнее,2019-01-31 21:05:02,29378821,[]
120,прощай холдинг парфенчиков образовал рабочую группу по приватизации кареллеспрома подробнее,2019-01-31 21:00:02,29378821,[]
121,в госдуме заявили о возможном отключении от интернета подробнее,2019-01-31 20:40:02,29378821,[]
122,участок леса на севере карелии передадут в аренду под пчеловодство подробнее,2019-01-31 20:35:01,29378821,[]
123,трагедия на дороге смертельное дтп произошло на трассе кола в карелии подробнее,2019-01-31 20:30:03,29378821,[]
124,в карелии фирм заподозрены в организации нелегальной занятости подробнее,2019-01-31 20:30:02,29378821,[]
125,актрису избили из за парковочного места подробнее,2019-01-31 20:20:02,29378821,[]
126,фонд капремонта приступит к ремонту многоэтажек в карелии подробнее,2019-01-31 20:15:02,29378821,[]
127,земский доктор ну что коллега полечим правильно подробнее,2019-01-31 20:00:03,29378821,[]
128,какие события ожидаются в петрозаводске и карелии завтра подробнее,2019-01-31 20:00:01,29378821,[]
129,в карелии заключили незаконные контракты в рамках программы формирование комфортной городской среды подробнее,2019-01-31 19:55:02,29378821,[]
130,айза анохина выложила страшное фото подробнее,2019-01-31 19:40:02,29378821,[]
131,ошибочка вышла в карелии администрация поселения провела незаконный аукцион подробнее,2019-01-31 19:30:02,29378821,[]
132,в карелии объявлен размер вознаграждения за голову волка подробнее,2019-01-31 19:20:02,29378821,[]
133,в карелии появились поселения с профицитом бюджета подробнее,2019-01-31 19:15:02,29378821,[]
134,ани лорак официально развелась подробнее,2019-01-31 19:10:02,29378821,[]
135,попал на миллион суд оштрафовал бывшего арбитражного управляющего за взятку чиновнику в карелии подробнее,2019-01-31 19:00:03,29378821,[]
136,карелия выделит млн рублей на поддержку бизнеса подробнее,2019-01-31 19:00:02,29378821,[]
137,в карелии пройдет международный форелевый форум подробнее,2019-01-31 18:40:02,29378821,[]
138,в декабре снизился индекс оптимизма промышленного бизнеса в карелии подробнее,2019-01-31 18:35:02,29378821,[]
139,в петрозаводске состоится презентация бесплатное образование в чехии центр инициатива приглашает на презентацию бесплатное обучение в вузах чехии презентация состоится февраля участие бесплатное по предварительной записи вход свободный,2019-01-31 18:30:02,29378821,[]
140,в поселке карелии пропал летний подросток подробнее,2019-01-31 18:25:01,29378821,[]
141,в карелии родственник обокрал пенсионерку ради компьютерных игр подробнее,2019-01-31 18:20:02,29378821,[]
142,в петрозаводске стабилизировались цены на бензин подробнее,2019-01-31 18:15:01,29378821,[]
143,жар птица и вяйнямейнен изо льда появятся на фестивале гиберборея в петрозаводске подробнее,2019-01-31 18:00:02,29378821,[]
144,почему в карелии массово срываются рейсы пассажирских автобусов подробнее,2019-01-31 17:55:02,29378821,[]
145,житель карели украл оставленные в банкомате деньги подробнее,2019-01-31 17:40:02,29378821,[]
146,автомобили будут продавать дороже одного млн рублей подробнее,2019-01-31 17:25:02,29378821,[]
147,школьники из карелии прошли подготовку в образовательном центре в сочи подробнее,2019-01-31 17:20:01,29378821,[]
148,,2019-01-31 17:05:05,29378821,
149,похолодание туман прогноз погоды на февраля подробнее,2019-01-31 17:00:02,29378821,[]
150,научный сотрудник национального музея карелии встала на защиту калевалы подробнее,2019-01-31 16:55:02,29378821,[]
151,житель карелии застрелил мужчину из охотничьего ружья подробнее,2019-01-31 16:45:02,29378821,[]
152,детская школа искусств в петрозаводске отметила новоселье подробнее,2019-01-31 16:40:02,29378821,[]
153,,2019-01-31 16:37:15,29378821,
154,петрозаводчанин украл медные трубы в сетевом магазине подробнее,2019-01-31 16:25:02,29378821,[]
155,,2019-01-31 16:24:06,29378821,
156,,2019-01-31 16:04:17,29378821,
