1148,маразмы нашего городка сегодня мы как обычно пошли гулять с ребенком в парк циолковского и на детскую площадку на территории икц придя туда оказалось что обе площадки закрыты на замок тогда мы зашли в здание икц и спросили на ресепшен у молодого человека кто отвечает за эти площадки и почему они закрыты на часах было утра в радиусе площадок собралось уже много детей и многие хотели как и мы покататься с горок молодой человек очень вежливо сказал что площадки относятся к икц и сейчас он уточнит у руководства почему те закрыты вернувшись он пояснил что площадки закрыты в связи с морозами на улице на тот момент было градусов что они сделаны из очень хрупкого материала и что ими не безопасно пользоваться я сказать честно была очень удивлена как такое может быть детская площадка в может не выдержать ребенка и зачем тогда вообще нужны такие площадки мне вот интересно это действительно так или каким то бредом попахивает фото от подписчицы,2018-12-02 13:55:23,47908301,[]
1149,зимняя сказка фото,2018-12-02 11:26:00,47908301,[]
1150,колхозный рынок е годы уже история,2018-12-02 10:30:03,47908301,[]
1151,,2018-12-02 09:31:00,47908301,
1152,вчерашний гейзер на маяковского и заводской сегодня превратился в реку затопило большую часть улицы маяковского в сторону бушмановки аварийку вызвали видео от подписчицы,2018-12-02 09:22:00,47908301,[]
1153,где все коммунальщики фото от подписчика,2018-12-02 08:48:51,47908301,[]
1154,вчера на трассе калуга таруса сильная авария деу нексия и газель отделались синяками и садинами нексию на помойку фото сделать не успел анонимно,2018-12-02 08:41:39,47908301,[]
1155,снежная калуга фото от подписчицы насти,2018-12-01 20:53:00,47908301,[]
1156,свалили мусор в лесу недалеко от д чижовки и убежали осторожно мат видео от подписчика,2018-12-01 19:40:39,47908301,[]
1157,циолковский победил при выборе имени для калужского аэропорта за него отдали голоса более проголосовавших подробнее,2018-12-01 16:43:25,47908301,[]
1158,на перекрестке маяковского заводская открылся гейзер почти термы фото от подписчика,2018-12-01 15:16:37,47908301,[]
1159,,2018-12-01 14:03:02,47908301,
1160,волонтеры нашли на калужской трассе замерзающую бабушку калужанин спасая свою жизнь во время резни прыгнул с пятого этажа водитель такси показал летней девочке половой орган калужане снова прославились на всю страну на федеральном канале калужская область намерена получить с самозанятых миллионов рублей как украсят калугу к новому году и другие новости калуги за неделю,2018-12-01 13:00:13,47908301,[]
1161,,2018-12-01 12:00:11,47908301,
1162,на хрусталке калужанин пырнул соседа ножом защищая себя и собаку соседа в последнее время стал раздражать соседский доберман встречаясь с владельцем собаки почти ежедневно он выражал недовольство в грубой форме пугая при этом собаку подробнее,2018-12-01 11:12:45,47908301,[]
1163,,2018-12-01 10:02:02,47908301,
1164,ока морозам поддалась,2018-12-01 09:43:28,47908301,[]
1165,зима в калугу пришли холода ул взлетная фото от подписчика,2018-12-01 09:01:00,47908301,[]
1166,ночная калуга из окна самолета фото от подписчика,2018-11-30 22:01:00,47908301,[]
1167,украинские националисты захватили фуру с калужскими номерами солдат срочник из калужской области пытался покончить с собой угрозы поджоги и вооруженные нападения под калугой началась война ритуальных контор фото утренней изморози укутавшей калугу и другие новости калуги за сегодня,2018-11-30 21:36:06,47908301,[]
1168,крик души от подписчицы достали водилы прогревающие свои развалюхи под окнами живем на первом этаже с грудным ребенком постоянная вонища достала причем прогревают под окнами и доисторические грузовики которые и без прогрева воняют начинается все это дело в утра несмотря на пластиковые окна запах проходит в квартиру каждое утро просыпаемся от токсичной вони ни выходных ни праздников взывание к разуму автомобилистов не помогает листовки о том что они нарушают закон тоже кроме дерьма на свои замечания ничего не слышу бесконечная вонь уже надоела там же токсичные выхлопные газы а не запах душистых прерий можно и астму заработать ребят куда обращаться если человек настолько тупой что не понимает слов я уже в отчаянии,2018-11-30 20:01:00,47908301,[]
1169,,2018-11-30 19:01:00,47908301,
1170,солдат срочник из калужской области пытался покончить с собой парня доставили в психиатрическое отделение подробнее,2018-11-30 18:22:01,47908301,[]
1171,угрозы поджоги и вооруженные нападения под калугой началась война ритуальных контор пострадавший предприниматель который строит новый похоронный дом уверен что все это дело рук конкурентов в подробностях этой истории разбирался экстренный вызов,2018-11-30 17:40:01,47908301,[]
1172,,2018-11-30 16:40:00,47908301,
1173,это детская больница на салтыкова щедрина корпус отделение пульмонологии жалюзи сломанные матрасы рваные паутина на окнах и на лампах кровати сломанные и грязные вроде и ремонт хороший сделали но не следят за ним кто это должен делать фото от подписчицы,2018-11-30 16:01:00,47908301,[]
1174,начался прием заявок на путевки в детские оздоровительные лагеря на зимние каникулы подробнее,2018-11-30 15:31:00,47908301,[]
1175,прямо сейчас что то нехило горит фото от подписчика,2018-11-30 15:23:17,47908301,[]
1176,сегодня калугу укутала изморозь красота,2018-11-30 14:58:08,47908301,[]
1177,,2018-11-30 14:01:00,47908301,
1178,калужская полиция задержала египтянина закладчика с кг наркотиков подробнее,2018-11-30 13:08:28,47908301,[]
1179,на зерновой заработал новый светофор подробнее,2018-11-30 12:33:00,47908301,[]
1180,,2018-11-30 11:31:00,47908301,
1181,дтп на московской догнал на подъеме на кубякинскую горку фото от подписчика,2018-11-30 11:05:47,47908301,[]
1182,украинские националисты захватили фуру с калужскими номерами подробнее,2018-11-30 10:47:00,47908301,[]
1183,сегодня ночью на маяковке переулок песчаный сгорел опель из людей никто не пострадал фото мчс,2018-11-30 10:28:15,47908301,[]
1184,подробности вчерашнего дтп в центре калуги спровоцировал аварию летний мужчина на рено выехавший на перекресток на красный подробнее,2018-11-30 10:08:15,47908301,[]
1185,,2018-11-30 09:05:01,47908301,
1186,утро начинается не с кофе дтп на ленина фото дорожный патруль,2018-11-30 08:39:28,47908301,[]
1187,вот это да сегодня в в калуге мороз с все завелись,2018-11-30 08:28:07,47908301,[]
1188,самый популярный комментарий лайка за сегодня,2018-11-29 23:00:06,47908301,[]
1189,спокойной ночи калуга,2018-11-29 22:56:00,47908301,[]
1190,на ул ленина возле педа столкнулись два внедорожника мицубиси и рено фото мчс,2018-11-29 21:47:48,47908301,[]
1191,правительство отменило знак шипы для автомобилей стрельба в роще мужчина рассказал почему стрелял в собаку калужская область намерена получить с самозанятых миллионов рублей мороз в калуге сменится снегопадами и потеплением на следующей неделе и другие новости калуги за сегодня,2018-11-29 21:43:58,47908301,[]
1192,в центре калуги полицейские задержали автомобиль с партией наркотиков подробнее,2018-11-29 19:21:05,47908301,[]
1193,,2018-11-29 18:20:02,47908301,
1194,стрельба в роще мужчина рассказал почему стрелял в собаку подробнее,2018-11-29 17:59:29,47908301,[]
1195,молодцы калужские коммунальщики шуршат даже если снегопадов нет а только нытье в их адрес слышно фото от подписчицы,2018-11-29 17:26:00,47908301,[]
1196,,2018-11-29 16:27:00,47908301,
1197,мороз в калуге сменится снегопадами и потеплением на следующей неделе обещают до подробнее,2018-11-29 15:48:00,47908301,[]
1198,правительство отменило знак шипы для автомобилей подробнее,2018-11-29 15:12:44,47908301,[]
1199,,2018-11-29 14:55:49,47908301,[]
1200,водителей просят убрать автомобили с улицы тульской в противном случае будут эвакуировать подробнее,2018-11-29 14:16:01,47908301,[]
1201,,2018-11-29 13:18:00,47908301,
1202,школьнику закладчику грозит лет за попытку сбыта крупной партии наркотиков информацию о возможности заработка таким путем подросток увидел на одном из зданий города подробнее,2018-11-29 12:47:00,47908301,[]
1203,калужская область намерена получить с самозанятых миллионов рублей по мнению артамонова поддержавшего введение налога человек который не платит налоги не имеет и морального права рассчитывать на поддержку государства подробнее,2018-11-29 12:05:12,47908301,[]
1204,кг роллов всего за рублей скидка на ультрасет закажи сейчас,2018-11-29 11:05:02,47908301,[]
1205,полиция разыскивает частного детектива летняя калужанка заподозрив своего избранника в неверности решила обратиться к помощи детективов подробнее,2018-11-29 10:31:00,47908301,[]
1206,сегодня около часов ночи на ул терепецкая сгорела лада калина фото мчс,2018-11-29 09:35:53,47908301,[]
1207,юридическое бюро право и защита это команда активных правозащитников которые всегда готовы помочь вам разобраться в сложившейся сложной юридической ситуации мы внимательно и полно изучаем каждую проблему чтобы найти законное и верное решение консультации абсолютно бесплатны пишите звоните приходите к нам ссылка на нашу группу сайт номер телефона,2018-11-29 07:00:01,47908301,[]
1208,скончалась летняя мама анатолия артамонова калужане опять прославились на всю страну на федеральном канале бабушку второй раз за неделю нашли на дороге в калуге пропал летний мужчина и другие новости калуги за сегодня,2018-11-28 21:44:37,47908301,[]
1209,путин подписал закон о налоге для самозанятых эксперимент пройдет в калужской области и еще регионах страны подробнее,2018-11-28 19:59:10,47908301,[]
1210,сегодняшний закат на угре видео геннадий чебеляев,2018-11-28 19:11:06,47908301,[]
1211,,2018-11-28 18:12:03,47908301,
1212,тысяч калужан получат новый статус предпенсионера им оставят все транспортные и прочие льготы и дадут два оплачиваемых выходных для диспансеризации подробнее,2018-11-28 17:02:05,47908301,[]
1213,площадь победы за день до выпадения снега,2018-11-28 16:31:00,47908301,[]
1214,,2018-11-28 15:31:00,47908301,
1215,от подписчика дтп в районе поворота на калуга пробка в сторону города фото от подписчика и дорожного патруля,2018-11-28 15:08:17,47908301,[]
1216,улица кирова весна середины х еще близко соседствует новое и старое но уже скоро перед строящимся девятиэтажным домом встанет новый памятник кирову а деревянные домики будут снесены,2018-11-28 14:43:00,47908301,[]
1217,бабушку второй раз за неделю нашли на дороге бабуля была напугана и опять кроме своего имени ничего не помнила подробнее,2018-11-28 13:42:39,47908301,[]
1218,обнинский супермаркет оштрафовали на тысяч рублей за уборщицу иностранку подробнее,2018-11-28 13:02:01,47908301,[]
1219,завтра с калужских улиц эвакуируют брошенные автомобили есть еще время убрать свой автохлам подробнее,2018-11-28 12:16:00,47908301,[]
1220,скончалась летняя мама анатолия артамонова подробнее,2018-11-28 11:33:12,47908301,[]
1221,нутрия красивый практичный мех он отлично подходит для климата россии в шубе из нутрии вам не страшны ни снег ни ветер ни дождь новинка на новоторжской ярмарке мех нутрии стриженый под норку остевой волос состригается до уровня подпуши и мех становится мягким и бархатистым спешите за шубой из нутрии на новоторжскую ярмарку в калугу в арену ктз с ноября по декабря будьте красивыми получите скидку на любую шубу тут ноября декабря арена ктз этаж калуга московская,2018-11-28 11:01:00,47908301,[]
1222,сотрудники фсб обезвредили террористов захвативших атомный институт в обнинске подробнее,2018-11-28 10:26:00,47908301,[]
1223,калужане снова прославились на всю страну жители калужской области снялись в программе днк итак брошенная бывшая проститутка из обнинска уверяет что герой программы обещал жениться на ней ведь она ждала от него ребенка но оказывается у жениха есть еще и законная жена интересно сколько им платят что можно так позориться на всю страну,2018-11-28 10:01:00,47908301,[]
1224,,2018-11-28 09:00:02,47908301,
1225,в калуге пропал летний мужчина ноября вышел из дома и не вернулся подробнее,2018-11-28 08:54:41,47908301,[]
1226,спокойной ночи калуга фото,2018-11-27 23:02:05,47908301,[]
1227,калужанин спасая свою жизнь во время резни прыгнул с пятого этажа калужские школы избавят от учителей старше лет как украсят калугу к новому году на пестеля асфальт положили прямо в снег и другие новости калуги за сегодня,2018-11-27 22:04:17,47908301,[]
1228,заснеженный парк циолковского фото эдуард сычев,2018-11-27 20:31:00,47908301,[]
1229,в козельске опять установили неподкупного гаишника напомним в прошлом году он смог простоять несколько дней см интересно сколько он продержится в этом году,2018-11-27 19:08:04,47908301,[]
1230,старейший в калуге свадебный салон стал сетевым магазином приехали подробнее,2018-11-27 18:30:05,47908301,[]
1231,,2018-11-27 17:30:01,47908301,
1232,калужанин спасая свою жизнь во время резни прыгнул с пятого этажа насмерть еще одного зарезали двое пострадали подробнее,2018-11-27 16:39:00,47908301,[]
1233,вот так положили асфальт на улице пестеля асфальт уже же даже не в дождь а прям на снег кладут все по госту фото алексей димов,2018-11-27 16:12:04,47908301,[]
1234,,2018-11-27 15:13:02,47908301,
1235,памятник воинам афганцам,2018-11-27 14:17:03,47908301,[]
1236,калужские школы избавят от учителей старше лет к году в школах калуги останется не более возрастных педагогов интересно а остальных куда денут подробнее,2018-11-27 13:32:03,47908301,[]
1237,солнечная и морозная погода без снега придет в калугу подробнее,2018-11-27 12:47:00,47908301,[]
1238,калужских автошкол приостановили работу преподаватели проходят переаттестацию т к на долю водителей с минимальным стажем приходится около половины аварий в которых погибли или пострадали люди подробнее,2018-11-27 12:05:05,47908301,[]
1239,кг роллов всего за рублей скидка на ультрасет закажи сейчас,2018-11-27 11:05:00,47908301,[]
1240,как украсят калугу к новому году подробнее,2018-11-27 10:36:00,47908301,[]
1241,шубы из мутона хит сезона мутоновые шубы на новоторжской ярмарке теплые и красивые в отделках норка песец каракуль размеры от до только дней в калуге с ноября по декабря в арене ктз на новоторжской ярмарке выбирайте и покупайте свою шубу из мутона и будьте в тепле получите скидку на любую шубу тут ноября декабря арена ктз этаж калуга московская,2018-11-27 09:42:00,47908301,[]
1242,судебный пристав из калуги стала чемпионкой европы по кикбоксингу подробнее,2018-11-27 08:52:00,47908301,[]
1243,доброй ночи калуга,2018-11-26 23:30:26,47908301,[]
1244,волонтеры нашли на калужской трассе замерзающую бабушку стали известны подробности расстрела собаки на глазах хозяйки в роще водитель такси показал летней девочке половой орган анатолий артамонов предложил запретить в школах мобильники макияж и ногти по полметра и другие новости калуги за сегодня,2018-11-26 22:47:00,47908301,[]
1245,сегодня утром калужанин помог потушить автомобиль,2018-11-26 22:40:05,47908301,[]
1246,,2018-11-26 21:37:00,47908301,
1247,театральная площадь год фото леонида чиркова,2018-11-26 20:29:00,47908301,[]
1248,,2018-11-26 19:30:03,47908301,
1249,волонтеры нашли на калужской трассе замерзающую бабушку отогревшись она рассказала что ехала в калугу к сыну в автобусе у нее украли деньги подробнее,2018-11-26 17:26:00,47908301,[]
1250,калуга заняла ое место в рейтинге городов с самым высоким качеством жизни по мнению экспертов у нас очень хорошо работают городские власти очень высокая оценка удобства города для жизни неплохой доход но есть проблемы связаны они с медициной образованием и культурой с дорогами подробнее,2018-11-26 16:33:00,47908301,[]
1251,водитель такси показал летней девочке половой орган подробнее,2018-11-26 15:47:00,47908301,[]
1252,калужских продавцов бензина уличили в картельном сговоре подробнее,2018-11-26 15:00:14,47908301,[]
1253,,2018-11-26 14:00:02,47908301,
1254,анатолий артамонов предложил запретить в школах мобильники макияж и ногти по полметра подробнее,2018-11-26 13:31:17,47908301,[]
