0,,2019-02-01 16:00:04,107816149,
1,не знаете как ответить на вопросы детей о работе внутренних органов человека а может ваш ребенок мечтает стать врачом и вы уже сбились со счета от его почему тогда советуем посетить выставку внутри человека в гаук рб национальный музей республики бурятия на куйбышева тел много интересных фактов о строении человека и процессах происходящих внутри него интерактивная современная и полезная выставка ответит на все вопросы даже самых любопытных почемучек ждем вас с января по марта в гаук рб национальный музей республики бурятия на куйбышева режим работы ежедневно с до четверг с до понедельник выходной стоимость билетов взрослые рублей дети с до лет включительно рублей пенсионеры при предъявлении удостоверения рублей военнослужащие проходящие военную службу по призыву рублей лица осуществляющие сопровождение ветеранов вов достигших лет рублей члены многодетных семей рублей групповое посещение от чел рублей с человека бесплатно дети до лет включительно ветераны боевых действий военной службы труда инвалиды группы ветераны вов герои советского союза герои рф граждане являющиеся полными кавалерами ордена славы дети сироты дети оставшиеся без попечения родителей внутричеловекауланудэ внутрименяуланудэ кудапойтиуланудэ кудасходитьуланудэ,2019-02-01 15:00:04,107816149,"['внутричеловекауланудэ', 'внутрименяуланудэ', 'кудапойтиуланудэ', 'кудасходитьуланудэ']"
2,что интересного и необычного посетить в городе в этом месяце в улан удэ до февраля включительно работает уникальная выставка выставка ван гог оживающие полотна в гаук рб национальный музей республики бурятия по адресу улан удэ ул куйбышева тел эта выставка понравится детям и взрослым здесь нет привычных музейных стен с картинами вы сидите в центре зала на удобных креслах мешках вокруг вас на огромных экранах оживают полотна великого голландского художника ван гога под классическую музыку детям также особенно нравится творческая зона где можно порисовать самостоятельно или с родителями ежедневно с до четверг с до понедельник выходной билеты взрослый руб дети пенсионеры студенты руб дети до лет бесплатно школьные группы от человек руб чел многодетные семьи руб чел ветераны войны инвалиды групп бесплатно вангогуланудэ кудапойтиуланудэ артмост,2019-02-01 14:00:01,107816149,"['вангогуланудэ', 'кудапойтиуланудэ', 'артмост']"
3,в новосибирске школьник после соревнований по мма оказался в больнице как сообщает комсомольская правда летний дима бабин третий год занимается мужским спортом смешанные единоборства на очередном первенстве новосибирской области школьник хотел победить но вместо этого получил сотрясение и сейчас находится в больнице папа димы во время поединка находился рядом с рингом отец не скрывает своего возмущения по поводу всего того что происходило во время боя по правилам в возрастной категории детей годов рождения удары в голову когда соперник лежит на ринге запрещены но рефери в схватке за выход в финал почему то не остановил бой он просто стоял и смотрел как соперник мальчика наносил удары,2019-02-01 08:05:02,107816149,[]
4,в добрые руки мальчик мес кастрирован будет крупный,2019-02-01 06:16:14,107816149,[]
5,в среду в зал совета федерации вошли люди в масках перед этим с трибуны выступил генпрокурор россии юрий чайка сообщивший сенаторам о снятии с рауфа арашукова сенаторской неприкосновенности и предъявлении ему обвинения по нескольким статьям ук после этого арашуков был задержан по данным следственного комитета россии установлена причастность сенатора к заказным убийствам и другим особо тяжким преступлениям,2019-01-31 05:52:11,107816149,[]
6,,2019-01-30 20:40:58,107816149,
7,пропал человек с местонахождение неизвестно красиков иван лет всем кто знает его место нахождения или связь с ним прошу сообщить по тел или в л с помогите распространить,2019-01-30 17:21:27,107816149,[]
8,куда сходить в будни в улан удэ на выставку ван гога в улан удэ работает уникальная выставка выставка ван гог оживающие полотна в гаук рб национальный музей республики бурятия по адресу улан удэ ул куйбышева тел эта выставка изменит все представления о посещении музея здесь не нужно ходить по залам все полотна представлены на огромных экранах на которые проецируются картины художника в огромном размере от до метров вы сможете рассмотреть мельчайшие детали проследить взмахи кисти художника в его невероятно красивых ярких и насыщенных шедеврах часть картин приведены в движение при помощи технологий анимации на полотнах летят птицы опадают лепестки цветов летят облака и крутятся его знаменитые мельницы также вас ждет творческая зона для рисования ежедневно с до четверг с до понедельник выходной билеты руб дети до лет участники вов и инвалиды групп бесплатно вангогуланудэ артмост,2019-01-30 14:00:01,107816149,"['вангогуланудэ', 'артмост']"
9,жители бурятии об очередном дтп в вахмистрово пора тросы убирать на этот раз разделительные столбики собрал автомобиль такси новая авария произошла близ вахмистрово водитель такси собрал столбики которые как было заявлено ранее призваны защищать от дтп авария произошла накануне в сети по этому поводу открылись жаркие споры пользователи дискутировали как о безопасности проезда в такси так и о безопасности разделительных тросов которые установили здесь после капитального ремонта автодороги напомним конструкция представляет собой металлические столбики соединенные между собой тросом таким образом дорожники вероятно решили что это спасет автолюбителей от лобового столкновения ранее в минтрансе бурятии заявили что конструкция ни что иное как ноу хау на наших дорогах,2019-01-29 06:24:42,107816149,[]
10,отдам в добрые руки девочка месяца подкинули в подъезд соседи ругаются то что она там живет жалко ее заберите кто нибудь писать в лс ребята максимальный репост пожалуйста ж д район,2019-01-29 06:06:59,107816149,[]
11,на выставки с детьми можно и даже нужно ходить верите вы или нет но выставка то место куда можно пойти и с маленькими детьми и не стоит бояться и думать что выставки и дети несовместимы а если вы хотите с нежного возраста прививать вашему малышу чувство прекрасного то такие походы очень даже рекомендуются а на нашей выставке будет не только интересно но и полезно отличительной выставки внутри человека является возможность все потрогать пощупать покрутить и фотографировать ждем вас с января по марта в гаук рб национальный музей республики бурятия на куйбышева тел режим работы ежедневно с до четверг с до понедельник выходной стоимость билетов взрослые рублей дети с до лет включительно рублей пенсионеры при предъявлении удостоверения рублей военнослужащие проходящие военную службу по призыву рублей лица осуществляющие сопровождение ветеранов вов достигших лет рублей члены многодетных семей рублей групповое посещение от чел рублей с человека бесплатно дети до лет включительно ветераны боевых действий военной службы труда инвалиды группы ветераны вов герои советского союза герои рф граждане являющиеся полными кавалерами ордена славы дети сироты дети оставшиеся без попечения родителей внутричеловекауланудэ внутрименяуланудэ кудапойтиуланудэ кудасходитьуланудэ,2019-01-28 15:30:00,107816149,"['внутричеловекауланудэ', 'внутрименяуланудэ', 'кудапойтиуланудэ', 'кудасходитьуланудэ']"
12,меньше месяца осталось до закрытия мультимедийной выставки выставка ван гог оживающие полотна в гаук рб национальный музей республики бурятия по адресу улан удэ ул куйбышева категория тел выставка работает до февраля включительно ежедневно с до четверг с до понедельник выходной эта выставка изменит все представления о посещения музея здесь не нужно ходить по залам все полотна представлены на огромных экранах благодаря чему вы сможете рассмотреть мельчайшие детали проследить взмахи кисти художника в его невероятно красивых ярких и насыщенных шедеврах часть картин приведены в движение при помощи технологий анимации на полотнах летят птицы опадают лепестки цветов летят облака и крутятся его знаменитые мельницы билеты руб дети до лет участники вов и инвалиды групп бесплатно также вас ждет творческая зона для рисования вангогуланудэ артмост,2019-01-28 14:00:03,107816149,"['вангогуланудэ', 'артмост']"
13,вице премьер поддержал снижение не штрафуемого порога превышения скорости с до км ч,2019-01-28 06:17:13,107816149,[]
14,подкинули щенят к магазину белый мальчик остальные девочки пожалуйста помогите спасти их видимо только от мамки оторвали чистенькие такие славные звоните скорее оюна,2019-01-28 03:29:00,107816149,[]
15,удивительный лед байкала,2019-01-27 11:37:03,107816149,[]
16,три спортсменки из бурятии стали призерами международного турнира по боксу международный турнир кубок нации прошел в сербии среди юниорок юлия арефьева заняла второе место в весовой категории свыше кг виолетта енина выиграла бронзу в весовой категории до кг а среди девочек лет серебро заработала жанна бадмаева девушки вы великолепны,2019-01-27 11:19:35,107816149,[]
17,сменил имя и вновь вернулся на олимп перезагрузить свою спортивную карьеру удалось боксеру из бурятии тамиру галанову после того как он по совету хамбо ламы из иволгинского дацана отказался от имени бэлик в интервью комсомолке спортсмен рассказал как после смены имени вернул титул чемпиона россии завоевал бронзу чемпионата мира и стал одним из главных претендентов на поездку на олимпиаду,2019-01-27 10:05:37,107816149,[]
18,во владивостоке сейчас жарко несмотря на зиму здесь начался полуфинал конкурса лидеры россии на который собрались управленцев из регионов дальневосточного федерального округа в том числе из республики бурятия чтобы в напряженной конкурентной борьбе завоевать себе право на выход в финал причем это первая стадия проекта на которой участники встречаются лично до сих пор соперничество шло в заочном режиме претенденты на гордое звание лидеров россии проходили тесты на способности знания и лидерские качества по результатам которых и определялось кто достоин большего а кому предстоит пробовать заново через год полуфинал для участников начнется с повторного тестирования на котором отсеют тех кто оказался не вполне честен на предварительном отборе а остальные разделятся на команды и будут пробовать силы в интеллектуальных состязаниях моделирующих управленческую деятельность стоит напомнить что конкурс лидерыроссии это визитная карточка платформы россия страна возможностей он создан по поручению президента владимира путина чтобы помочь запустить новые социальные лифты которых по общему мнению общества и власти сейчас недостаточно в этом смысле конкурс уже оправдывает свое существование в годах его победителей получили высокие назначения в том числе на посты губернаторов и заместителей федеральных министров как минимум отчасти это стало результатом мощной накачки управленческими компетенциями и связями происходящей на конкурсе например с его финалистами работает многочисленная группа наставников среди которых руководители уровня администрации президента ключевых министерств крупных регионов именитых бизнес структур а в нынешнем году конкурс дополнительно усилился за счет привлечения партнерских организаций в их число вошли сбербанк лукойл аэрофлот ростех роскосмос и целый ряд других компаний которых эксперты называют лидерами соответствующих рынков у каждой из них для успешных участников проекта есть свой набор вкусных карьерных предложений вот почему за баталиями на очных этапах лидеров россии есть смысл следить а лучше уже сейчас начать подготовку и в сезоне подать собственную заявку на участие в главном управленческом конкурсе страны,2019-01-26 08:00:02,107816149,['лидерыроссии']
19,почемучки ликуйте в улан удэ открылась детская интерактивная выставка внутри человека в гаук рб национальный музей республики бурятия на куйбышева тел сколько в брови волосинок почему человек чихает какой объем памяти хранится в мозге сколько групп крови на самом деле у кого был самый длинный нос сколько весят почки каков диаметр глазного яблока а диаметр волоса сколько времени требуется организму чтобы полностью переварить пищу анатомия может быть не скучной добро пожаловать во внутренний мир человека ждем вас с января по марта в гаук рб национальный музей республики бурятия на куйбышева режим работы ежедневно с до четверг с до понедельник выходной стоимость билетов взрослые рублей дети с до лет включительно рублей пенсионеры при предъявлении удостоверения рублей военнослужащие проходящие военную службу по призыву рублей лица осуществляющие сопровождение ветеранов вов достигших лет рублей члены многодетных семей рублей групповое посещение от чел рублей с человека бесплатно дети до лет включительно ветераны боевых действий военной службы труда инвалиды группы ветераны вов герои советского союза герои рф граждане являющиеся полными кавалерами ордена славы дети сироты дети оставшиеся без попечения родителей внутричеловекауланудэ внутрименяуланудэ кудапойтиуланудэ кудасходитьуланудэ,2019-01-25 15:30:00,107816149,"['внутричеловекауланудэ', 'внутрименяуланудэ', 'кудапойтиуланудэ', 'кудасходитьуланудэ']"
20,на выходных всей семьей на новый мультимедийный проект выставка ван гог оживающие полотна в гаук рб национальный музей республики бурятия по адресу улан удэ ул куйбышева который уже покорил своей красотой первых зрителей категория тел полотна великого постимпрессиониста ван гога представлены в огромном формате на экранах по всему залу некоторые картины приведены в движение при помощи технологий анимации что смотрится особенно чарующе на полотнах летят птицы опадают лепестки цветов летят облака и крутятся его знаменитые мельницы также вас ждет творческая зона для рисования ежедневно с до четверг с до понедельник выходной билеты руб дети до лет участники вов и инвалиды групп бесплатно вангогуланудэ артмост,2019-01-25 14:00:06,107816149,"['вангогуланудэ', 'артмост']"
