3804,юридическое бюро право и защита это команда активных правозащитников которые всегда готовы помочь вам разобраться в сложившейся сложной юридической ситуации мы внимательно и полно изучаем каждую проблему чтобы найти законное и верное решение консультации абсолютно бесплатны пишите звоните приходите к нам ссылка на нашу группу номер телефона,2018-07-17 07:00:04,47908301,[]
3805,ночная калуга,2018-07-16 23:16:00,47908301,[]
3806,самый популярный комментарий лайков за сегодня,2018-07-16 23:07:00,47908301,[]
3807,самые читаемые новости дня,2018-07-16 22:47:00,47908301,[]
3808,,2018-07-16 21:47:00,47908301,
3809,в людиново плита раздавила насмерть работника чугунолитейного завода работнику было всего лет у него осталось двое деток следователи проводят проверку подробнее,2018-07-16 21:00:10,47908301,[]
3810,,2018-07-16 20:00:09,47908301,
3811,первый регулярный рейс в ростов на дону отправился из калуги напомним цена авиабилета от рублей время полета час минут подробнее,2018-07-16 19:00:11,47908301,[]
3812,оригиналы и по ценам ниже чем в официальном интернет магазине более тыс благодарных покупателей присоединяйся боитесь покупать через интернет у нас есть оплата при получении экспресс доставка в калугу,2018-07-16 18:00:04,47908301,[]
3813,несколько часов назад в мещовске столкнулись семерка и кроссовый мотоцикл фото мчс,2018-07-16 17:45:55,47908301,[]
3814,калугу ждет неделя ливней и жары подробнее,2018-07-16 16:45:00,47908301,[]
3815,калужанин осужден за возбуждение ненависти и вражды года за видеоролики экстремистского содержания в соцсети подробнее,2018-07-16 16:26:03,47908301,[]
3816,рублей больших роллов от фарфор доставка суши и пиццы калуга устоять невозможно акция действует с понедельника по четверг заказать онлайн через приложение в,2018-07-16 15:15:00,47908301,[]
3817,фокус влетел в столб под мостом на московской фото подписчика мчс и калужский троллейбус,2018-07-16 14:03:04,47908301,[]
3818,блогер илья варламов приедет в обнинск мэр обнинска владислав шапша согласился принять участие в новом проекте варламова прогулка с мэром в процессе прогулки он вместе с главой города будет изучать инфраструктуру и общаться с жителями вот бы в калугу приехал,2018-07-16 13:55:00,47908301,[]
3819,распродажа интернета и цифрового телевидения до конца месяца в макснете продолжается акция летний интернета и тв подключитесь к макснету до июля года и получите скидку в размере на выбранный тарифный план обратите внимание мы даем гарантию что цена не изменится в течение х лет если вы уже абонент макснет и хотите воспользоваться специальным предложением летний интернета и тв пожалуйста расскажите о нашем предложении своим родственникам друзьям и знакомым и если один из них подключится к макснет до июля г то мы переключим ваш тариф на условиях текущей акции главное чтобы при оформлении заявки на подключение нам сообщили ваш номер договора при оформлении заявки онлайн на сайте попросите вашего друга в графе пожелания и комментарии указать ваш номер договора рекомендация от абонента по договору за подробностями идем по ссылкам распродажа интернета распродажа интернета тв офис продаж калуга улица кирова телефон,2018-07-16 12:55:00,47908301,[]
3820,ребят куда обращаться в парке циолковского лежит собакен видно что ранена лапка не агрессивна абсолютно лежит прямо сейчас на центральной аллее все проходят мимо кому позвонить написать видно что псу очень плохо ни на кого не нападает его трясет,2018-07-16 12:11:00,47908301,[]
3821,прямо сейчас дтп на гагарина рено пробил ограждение перепрыгнул встречку и заехал на тротуар собиралась пробка в сторону сквера мира фото от подписчиков и мчс,2018-07-16 11:51:11,47908301,[]
3822,великое стояние на угре п дворцы фото катерина лаврентьева,2018-07-16 11:39:34,47908301,[]
3823,видео момента жесткого дтп на дороге калуга серпухов в этой аварии погибли три человека еще четверо получили травмы,2018-07-16 10:22:48,47908301,[]
3824,вот такая табличка со статистикой утонувших людей появилась в белкино как вам идея фото администрация города обнинска,2018-07-16 10:02:02,47908301,[]
3825,сегодня ночью на пионерской загорелся порше фото мчс,2018-07-16 09:41:47,47908301,[]
3826,живодерка силкина галина из калуги никогда не отдавайте ей животных в четверг в очередной раз с милицией был вскрыт один из ее складов гаражей вывезено около собак мелких пород вечером вскрывали с понятыми ее квартиру вывезли в приют х котов британцев х сфинксов е морских свинки одна из них голая е шиншиллы по домам разобрали около десятка попугаев животных даже пересчитать трудно о состоянии животных судите сами по фото и видео ситуация со здоровьем критическая обезвоживание истощение кожные проблемы животные жили с ней в одном доме и она спокойно смотрела на то как они превращались вы скелеты смотрите внимательно может узнаете своего сколько еще десятилетий и сотен загубленных невинных жизней нужно чтобы люди наконец то осознали что именно они причина той ужасной ситуации которая сложилась с животными в стране в целом с года живет за счет перепродажи взятых бесплатно у населения животных отслеживает группы потеряшек животные даром авито и т д трупы мешками выгребает зоозащита несколько лет ее концлагеря вычисляют и ликвидируют с милицией а вот посадить не могут никак нет закона репост автор,2018-07-15 22:58:49,47908301,[]
3827,от подписчика офигевшие хозяева автомойки самообслуживания в турынино жетоны продает автомат жетон рублей купюру руб принял жетон выдал и уснул сотрудник мойки сообщил что сдачу автомат не выдает рентабельность у бизнеса запредельная,2018-07-15 21:37:00,47908301,[]
3828,фото с фестиваля косплея в калуге фото калуга,2018-07-15 21:00:09,47908301,[]
3829,,2018-07-15 20:01:00,47908301,
3830,,2018-07-15 19:30:02,47908301,
3831,опасные съемки в бору как бы эти съемки переломом обеих ног не кончились как в случае с барышнями на кирова фото от подписчика,2018-07-15 18:45:48,47908301,[]
3832,заехал в банкомат блин анон фото от подписчика,2018-07-15 18:06:42,47908301,[]
3833,к поискам пропавшей калужанки подключился следственный комитет женщину ищут уже пятый день подробнее,2018-07-15 17:26:40,47908301,[]
3834,туманный шарф над утренней окой фото,2018-07-15 16:00:09,47908301,[]
3835,калужане оценили заборчик но внесли свои изменения мичурина автор юрий юрьев,2018-07-15 13:51:08,47908301,[]
3836,ночная гроза над пучково фото григорий кириллов,2018-07-15 12:20:00,47908301,[]
3837,вот такая красота была сегодня ночью над калугой фото марина ступакова,2018-07-15 11:31:00,47908301,[]
3838,,2018-07-15 10:31:00,47908301,
3839,прямо сейчас на спичечной происходит что то странное приехали две пожарные машины но пожара нет никого не эвакуируют скорее всего ложный вызов фото от подписчика,2018-07-15 09:56:34,47908301,[]
3840,от подписчика вот так на наши налоги освещают улицы район нефтебазы,2018-07-15 09:25:29,47908301,[]
3841,на тульском переулке сгорел дом фото от подписчиков,2018-07-15 08:39:04,47908301,[]
3842,доброе утро калужане рассвет на северном как всегда красив,2018-07-15 08:36:46,47908301,[]
3843,магия правого фото,2018-07-14 22:01:00,47908301,[]
3844,,2018-07-14 21:00:05,47908301,
3845,калуга во время заката,2018-07-14 20:28:00,47908301,[]
3846,наша подписчица сообщает что час назад в районе воробьевки мчсовцы спасли женщину из воды она купаясь в не оборудованном для этого месте начала тонуть женщина оказавшаяся жительницей ульяновска от госпитализации отказалась берегите себя,2018-07-14 19:55:05,47908301,[]
3847,помогите найти человека ищем уже четвертый день июля пропала сергеева оксана ивановна лет вышла на прогулку с собакой из дома в районе ул жукова по сообщениям родственников женщина может находится в лесополосе от улицы хрустальной до нефтебазы нужны добровольцы инфорг шкода вера репортаж ника тв о пропавшей,2018-07-14 18:19:35,47908301,[]
3848,правый фото,2018-07-14 17:11:00,47908301,[]
3849,с раннего утра на правом выкачивают канализацию из колодца и сливают в грунт рядом с парком далеко ходить не надо можно было и на асфальт и таких луж с говном вдоль по этой улице полно идешь гулять воняет невозможно береги природу мать вашу автор кристина чернышова,2018-07-14 16:10:00,47908301,[]
3850,,2018-07-14 15:10:00,47908301,
3851,сергей собянин похвалил калужскую область за развитие транспортной системы подробнее,2018-07-14 15:08:22,47908301,[]
3852,шамордино фото,2018-07-14 14:30:02,47908301,[]
3853,первый автосервис федеральной сети открылся на ул болотникова а в честь открытия диагностика подвески и ходовой части бесплатно запишись в мобильном приложении по телефону или по ссылке,2018-07-14 13:30:00,47908301,[]
3854,как сообщают наши подписчики малиники и ольговка остались без воды из за аварии на водоводе устранить проблему и вернуть воду обещают сегодня к вечеру крепитесь,2018-07-14 13:00:09,47908301,[]
3855,калужане помогите опознать хулиганов в ночь на пятницу июля на ул стеклянников сад двое неизвестных закидали дом надувными шарами которые были наполнены зеленой краской в итоге повреждено покрытие забора крыльца фасада брусчатки на простое хулиганство не похоже мы вроде никого не обижали может парни адресом ошиблись автор борис тупицын,2018-07-14 11:28:00,47908301,[]
3856,,2018-07-14 10:30:01,47908301,
3857,главные новости калуги за неделю,2018-07-14 09:10:10,47908301,[]
3858,доброй ночи калуга фото,2018-07-13 23:18:00,47908301,[]
3859,самые читаемые новости дня,2018-07-13 22:41:00,47908301,[]
3860,,2018-07-13 21:47:00,47908301,
3861,грузовик и аудюшка решили выяснить кто круче трасса калуга тула,2018-07-13 21:20:00,47908301,[]
3862,,2018-07-13 20:20:00,47908301,
3863,троицкий собор,2018-07-13 20:00:10,47908301,[]
3864,ваш ребенок будет в восторге от такого подарка мы дарим супер акцию бесплатная доставка закажите кроватку машинку и ваш ребенок в первую же ночь будет спать один кроватки машинки от производителя без посредников и наценок низкие цены и гарантия качества гарантировано официальный сайт группа вк аккаунт,2018-07-13 19:00:04,47908301,[]
3865,в сквере волкова забил фонтан кто освежится желает кстати разговоры о реконструкции сквера ведутся уже много лет но дело с мертвой точки все никак не сдвинется видео от подписчика,2018-07-13 18:41:25,47908301,[]
3866,авиакомпания руслайн открыла продажу билетов на рейс калуга симферополь от рублей в одну сторону подробнее,2018-07-13 17:43:17,47908301,[]
3867,калужане напоминаем завтра и послезавтра перекроют улицы из за ремонта теплосети в субботу с до для движение автотранспорта закроют улицу азаровскую на участке от ого карьерного переулка до станционной улицы в воскресенье с до будет перекрыт старичков переулок подробнее,2018-07-13 17:09:25,47908301,[]
3868,в калуге активисты обнаружили опасные детские площадки впрочем ничего нового подробнее,2018-07-13 16:12:00,47908301,[]
3869,поворот на д будаково уже третий день свет днем горит экономия фото от подписчика,2018-07-13 15:57:00,47908301,[]
3870,млн рублей потратят на ремонт калужского белого дома подробнее,2018-07-13 15:03:01,47908301,[]
3871,коротко о детской площадке недалеко от болотникова местные жители какие же вы свиньи как вы вообще тут живете как гуляете с детьми фото от подписчицы,2018-07-13 14:30:04,47908301,[]
3872,,2018-07-13 13:30:01,47908301,
3873,в калуге третий день ищут пропавшую женщину июля ушла из дома и не вернулась летняя оксана сергеева с ней была собака по кличке бакс предположительно может находится в районах черемушки хрустальная бушмановка дубрава,2018-07-13 12:47:55,47908301,[]
3874,жаркую и дождливую погоду обещают калужанам на выходных подробнее,2018-07-13 12:03:01,47908301,[]
3875,калужская горуправа решила потратить кучу денег на снос уже снесенных домов в новом парке подробнее,2018-07-13 11:15:01,47908301,[]
3876,ваш уютный магазинчик с интерес готов снова удивить мы существенно увеличили ассортимент книг комиксов артбуков и фигурок а также мы выделили целый стеллаж под виниловые пластинки и аксессуары к ним заходите в с интерес или оформляйте заказы на сайте с бесплатной доставкой в трц торговый квартал ул московская д а схема проезда,2018-07-13 10:15:00,47908301,[]
3877,перед дамбой в сторону города ремонт дороги и огромная пробка до самых анненок ищите пути объезда фото от нашей подписчицы ольги финк,2018-07-13 09:39:21,47908301,[]
3878,гагарин циолковский маск попали в боровский космический ковчег подробнее,2018-07-13 09:18:15,47908301,[]
3879,началось в жукове цены на проезд поднимают из за повышения цен на гсм скоро ждем и в калуге фото подслушано жуков,2018-07-13 08:33:42,47908301,[]
3880,три самых популярных слогана от наших подписчиков калужане как всегда,2018-07-12 23:00:11,47908301,[]
3881,экспрессивный этюд заката на кирова фото,2018-07-12 21:28:00,47908301,[]
3882,самые читаемые новости дня,2018-07-12 21:03:34,47908301,[]
3883,,2018-07-12 20:00:04,47908301,
3884,никола ленивец фото,2018-07-12 19:37:00,47908301,[]
3885,калужские парламентарии предложили запретить продажу вейпов несовершеннолетним подробнее,2018-07-12 19:08:00,47908301,[]
3886,завтра калужских улиц останутся без электричества подробнее,2018-07-12 18:30:03,47908301,[]
3887,,2018-07-12 17:30:00,47908301,
3888,добрый день калуга пишу по поводу мошенничества оно же не дремлет всегда что то у них новое так вот произошла такая ситуация стук в дверь я открываю стоит молодой человек с бумагами в руках говорит здравствуйте проверка связи интернет вы подключены я говорю да у нас билайн он такой сделал вид что не понимает и говорит а вас у нас в базе нет если не переподписать документы то при подключении соседей вас могут отключить оставьте свой номер телефона мы вам позвоним на следующий день звонок и вопрос когда можно прийти к вам в квартиру и подписать бумаги на что я ответила что у нас все официально зарегистрировано что в квартиру никого пускать не буду и пусть обманывает других после решила позвонить в билайн спросить ходят ли от них сотрудники на что ответ был только если у вас заявка так что люди не верьте никому всем добра,2018-07-12 16:58:00,47908301,[]
3889,,2018-07-12 16:03:00,47908301,
3890,калужские следователи раскрыли все зарегистрированные изнасилования подробнее,2018-07-12 15:46:00,47908301,[]
3891,от подписчицы на пухова сливают бенз это писец товарищи район пухова водители в районе дома будте внимательны машине стоит не мешает но возвращаясь с прогулки днем с ребенком такая картина крышка от бензобака на багажнике те пи дюки и выродки которые ездят без прав или на скутерах так знайте сволочи сто рублей которые вы тратите на коктейли и сигареты заправьте свои дрондулеты и ездите я конечно не обеднею от двух литров но сука почему я должна пахать за свою зарплату на работе а вы тупо наживаться накипело,2018-07-12 15:29:00,47908301,[]
3892,,2018-07-12 14:36:00,47908301,
3893,ребятушки на баррикад около школы походу нефть ищут без особой нужды туда не суйтесь уделаете машину полностью фото автоледи калуга,2018-07-12 14:29:17,47908301,[]
3894,появилось видео момента вчерашнего дтп на глаголева ребят не гоняйте как сумасшедшие видео андрея сычикова,2018-07-12 14:00:12,47908301,[]
3895,магазин уцененной цифровой техники байт теперь и в калуге это сеть магазинов распродаж уцененных товаров суть нашей работы в том что мы забираем уцененные товары из российских торговых сетей и продаем их с хорошей скидкой и гарантией в итоге довольны все торговые сети клиенты и мы вступай тут будет много хороших предложений тут еще больше немного о нас если у тебя слабые нервы то лучше не заходи в инсту нашел понравившийся товар в другом городе привезем со следующей поставкой воронеж орел липецк белгород старый оскол тула тамбов краснодар,2018-07-12 13:00:05,47908301,[]
