235,в бурятии готовятся раздавать дальневосточные гектары в правительстве рассказали что сулит жителям республики присоединение к дальнему востоку вот уже третий день в бурятии и забайкалье бурно обсуждают отделение от сибирского федерального округа и присоединение к дальневосточному далее дфо напомним соответствующий указ подписал го ноября президент страны владимир путин по этому поводу уже высказались глава республики алексей цыденов сенатор вячеслав наговицын и о губернатора соседнего региона александр осипов председатель думского комитета по региональной политике и проблемам севера и дальнего востока дв николай харитонов а также ряд политологов и экспертов по мнению некоторых специалистов основной мотив такого решения попытка дать толчок экономическому развитию двух дотационных регионов с помощью их вовлечения в специальные инвестиционные программы для дв как была так и останется не остались в стороне и бурятские чиновники накануне они провели пресс конференцию на которой рассказали что сулит жителям региона слияние с дфо дальневосточный гектар субсидирование авиаперелетов налоговые преференции новые поступления в бюджет в правительстве уверены от реформы федеральных округов бурятия только выиграет она как была самостоятельным субъектом россии находилась в составе восточной сибири и заботилась о мировой жемчужине байкале так и будет заверил первый зампред республиканского правительства игорь шутенков этот указ дает только возможности использовать дополнительные механизмы для развития нашей республики существует фонд развития дальнего востока фрдв корпорация по развитию дальнего востока возможности по привлечению инвестиций льготному кредитованию есть налоговые льготы и упрощенная система определения территорий опережающего развития торы там уже действуют свои преференции по словам шутенкова для опережающего развития бурятии теперь должны вырасти и поступления в бюджет региона самое крупное из них дотация на выравнивание бюджетной обеспеченности не изменится но субсидии на различные сферы в связи с переходом в дфо должны увеличиться пояснил зампред напомним страну поделили на федеральные округа в м году по указу владимира путина они созданы по аналогии с военным округами и экономическими районами при этом фо не являются субъектами или иной конституционной частью административно территориального деления россии у них нет правительства парламента судов и бюджетов каждый субъект напрямую подчиняется москве а округа созданы как инструмент для работы полномочного представительства президента россии на местах подпреды контролируют исполнение органами власти решений законов и задач определенных российской федерацией отметил игорь шутенков по гектару в руки сегодня в правительстве бурятии готовят почву и для так называемого дальневосточного гектара напомним с го февраля го года каждый россиянин вправе рассчитывать на сто соток земли в любом регионе дальнего востока распоряжаться которой можно как угодно будь то фермерство предпринимательство или индивидуальное жилищное строительство единственное обязательное условие начать осваивать участок в течение пяти лет а после пяти безвозмездного пользования есть возможность получить в собственность или длительную аренду на лет чтобы отхватить кусочек дальнего востока достаточно зайти на специальный сайт выбрать на карте нужный регион и конкретный участок свободные отмечены зеленым цветом и подать онлайн заявку документы рассмотрят в течение ти дней после нужно подать пакет документов правда жители республики и соседнего региона смогут сделать это только после того как бурятию с забкраем внесут в перечень субъектов на которые распространяется федеральный закон сама концепция закона для нас очень привлекательная потому что предусматривает упрощенный порядок предоставления земельных участков подчеркнула маргарита магомедова надеюсь что включение бурятии позволит использовать максимальные механизмы сейчас будем отрабатывать территории которые потенциально могут быть и не могут быть предоставлены у нас есть байкальская природная территория центральная экологическая зона включенные в объект всемирного наследия юнеско там действует ограничение предусмотренное статьей земельного кодекса согласно ей земли находящиеся в государственной и муниципальной собственности но расположенные на территории объектов всемирного природного наследия не могут предоставляться в частную по мнению министра в бурятии необходимо принять закон устанавливающий перечень территорий где земли нельзя выдавать как дальневосточный гектар и обосновать эти ограничения все барьеры сняты полпред президента в сфо сергей меняйло в чьем подчинении теперь находятся не а федеральных округов заявил что присоединение бурятии и забайкалья к дальнему востоку требование времени это самый оптимальный вариант на сегодня чтобы не терять время и не создавать лишние структуры министерство по развитию дальнего востока является главным распределителем бюджетных средств оно не может выделять средства структурам а фонд развития дальнего востока субъектам которые не под их юрисдикцией сегодня все эти барьеры сняты цитирует меняйло тасс он отметил что федеральная целевая программа фцп по развитию дальнего востока и байкальского региона действует уже десять лет и за это время дала определенные плоды на дв в отличие от бывших сибирских регионов схема очень сложная надо было финансирование из программы из фонда вытаскивать отдавать на федеральный уровень и оттуда целевыми субсидиями отдавать на каждый из наших регионов а потом по преференциям по каждому субъекту издавать отдельные постановления правительства пояснил меняйло как отмечает тасс включение двух регионов в состав дфо сняло с нормативно правовой точки зрения барьеры по их социально экономическому развитию,2018-11-08 06:11:00,107816149,[]
236,доброе утро улан удэ,2018-11-08 03:05:00,107816149,[]
237,бурятские каратисты привезли медалей с соревнований в иркутске с по октября во дворце спорта труд в иркутске состоялись первенство и чемпионат иркутской области по каратэ в соревновании приняли участие около спортсменов из иркутска шелехова братска бурятии и забайкальского края представители республики завоевали медали в личном первенстве и одно общекомандное серебро республику представляло человек выступавших в разных возрастных категориях от лет до категории и более отметим что соревнования по каратэ проводились по версии олимпийской версии этого боевого искусства,2018-11-07 14:17:00,107816149,[]
238,с праздником товарищи,2018-11-07 12:59:54,107816149,[]
239,свердловскую чиновницу ольгу глацких отстранили от должности после слов о молодежной госполитике после высказывания ольги глацких о том что государство молодым людям ничего не должно проводится служебная проверка директор департамента молодежной политики свердловской области ольга глацких заявила на встрече с общественностью что государство ничего не должно молодежи поскольку не просило их рожать такое заявление чиновница сделала на в ответ на вопрос о финансировании детских проектов в городе по ее словам подрастающему поколению надо менять представление о том что государство им все должно вам государство вообще в принципе ничего не должно вам должны ваши родители которые вас родили уверена глацких губернатор области уже принес извинения за этот инцидент а мы тогда почему что то должны такому государству позднее глацких объяснила что ее заявление это проявление любви к детям которое должно побудить молодежь к самосовершенствованию может быть вся проблема в том что мы неправильно понимаем чиновников вот глацких говорит что государство не просило нас рожать а имеет ввиду что государство должно не рыбу раздавать а удочки помогать добывать не сразу ведь догадаешься или например власть обещает нам социальное государство и заботу о стариках а имеет ввиду повышение пенсионного возраста отсюда и недопонимание возникает,2018-11-07 07:28:00,107816149,[]
240,глава бурятии алексей цыденов о переходе рб в двфо а что вы думаете по этому поводу,2018-11-07 06:01:00,107816149,[]
241,доброе утро улан удэ,2018-11-07 03:10:00,107816149,[]
242,найден котенок девочка в подъезде по ул сухэ батора б на вид месяца очень ласковая видно что ручная очень красивая к лотку приучена отдам новым хозяевам звонить по номеру или в лс срочно заберите пожалуйста надолго в общежитии она не задержится животные,2018-11-06 12:20:12,107816149,['животные']
243,узнали,2018-11-06 03:56:00,107816149,[]
244,помогите найти брата репост,2018-11-05 19:15:55,107816149,[]
245,приглашаем на стоматологические туры в хэйхэ почему мы приглашаем вас лечить зубы именно в хэйхэ потому что наша стоматология имеет лицензию и является одной из лучших и ведущих клиник города хэйхэ в нашей клинике ваши зубы будут в надежных руках наших опытных врачей стоматологов высшей категории имеющих сертификаты международного стандарта мы используем только самые качественные материалы производства китая японии и германии а также вас приятно удивят выгодные цены металлокерамика руб безметалловая керамика от руб и гарантия приятным бонусом для наших клиентов будет бесплатный проезд и проживание при установке от и более коронок инстаграм вконтакте,2018-11-05 13:52:19,107816149,[]
246,доброе утро,2018-11-05 03:19:00,107816149,[]
247,вот это поворот,2018-11-04 18:17:11,107816149,[]
248,любимый улан удэ,2018-11-04 14:08:00,107816149,[]
249,животные предлагаем вашему вниманию вот такое очарование красавица охранница и просто собака улыбака она смотрит на мир своими красивыми глазками в поисках того единственного человека которому будет верной подругой ищем для нее дом и ответственных родителей готовых весело проводить время с этой замечательной девчонкой она не даст вам хандрить и будет верным другом для вас и вашей семьи девочка стерильная по всем вопросам обращайтесь по телефону,2018-11-04 09:13:00,107816149,[]
250,в кафе масленица ул ленина забыли свидетельство о рождении малыша назарова демида денисовича,2018-11-03 23:12:19,107816149,[]
251,,2018-11-03 05:31:00,107816149,[]
252,очень срочно сегодня в маршрутке автобус потеряла паспорт имя першина анжела олеговна прошу если найдете позвоните на этот номер заранее спасибо,2018-11-02 16:54:18,107816149,[]
253,доброго дня улан удэ,2018-11-02 07:43:53,107816149,[]
254,пост на удачу верю в судьбу ищу свою сестру по отцу знаю что жила живет она по адресу борсоева кв может кто то является соседом по подъезду или дому можете написать можно мне в личку кто живет в квартире знаю что в году она в ней жила до смерти отца заранее спасибо имя сестры знаю но из соображений защиты ее частной жизни сказать открыто не могу кто знает о ком я буду признательна за помощь сама я живу в ярославле поэтому узнать ничего лично не смогу улан удэ очень далеко,2018-11-02 07:18:09,107816149,[]
255,,2018-11-01 11:54:41,107816149,
256,хочувсад дайтедетямдетскийсад никтокроменас мамымогутвсе вы все равно ничего не добьетесь октября г уж сколько раз нам говорили что все эти наши телодвижения в области доступности дошкольного образования ни к чему не приведут никого с насиженных мест не подвинут вот и сейчас когда был начат сбор подписей за отставку председателя комитета по образованию афанасьевой у с нас прям окружили скептицизмом но факт того что мамы улан удэ намерены добиться отставки госпожи афанасьевой не мог остаться незамечен уже попытки изъять подписи из пункта сбора звонят неизвестные останавливают сбор и говорят что сейчас подьедут и заберут листы с подписями некоторые сотрудники доу др учреждений также хотели бы поставить свою подпись под данной жалобой наверное даже больше чем другие мамы но опасаются давления и последующего увольнения система будь она не ладна как думаете могут ли в данной ситуации прибегнуть к административному ресурсу например заручиться поддержкой заведующих доу так или иначе жалоба обязательно будет отправлена для справки главным оппонентом нынешнего министра образования в г была афанасьева у с если по статьям из сми кресло под министром шатается то кто его займет в будущем,2018-11-01 07:07:16,107816149,"['хочувсад', 'дайтедетямдетскийсад', 'никтокроменас', 'мамымогутвсе']"
257,вчера в локомотивном депо города улан удэ была украдена черная барсетка с документами на имя степанов михаил николаевич и ключами от машины просьба вернуть за вознаграждение,2018-10-31 07:57:13,107816149,[]
258,люди помогите пожалуйста вчера в трц пионер по улице корабельная была потеряна камера с зеленоватой селфи палкой внутри была карта памяти на кто найдет огромная просьба вернуть за вознаграждение,2018-10-31 06:23:35,107816149,[]
259,,2018-10-31 03:08:00,107816149,
260,в бурятии пропал летний мальчик геннадий журавлев сбежал из центра временного содержания несовершеннолетних правонарушителей мвд республики в улан удэ туда мальчик попал октября приметы европейской внешности смуглый рост средний волосы темно русые глаза светло карие лицо ромбовидное лоб низкий брови дугообразные курносый в день исчезновения на нем была серая шапка темно синяя куртка с капюшоном трико синего цвета темно серые кроссовки с белыми вставками особые приметы шрам на лице шрам на левой руке шрам на затылке как сообщили в пресс службе мвд бурятии по данным на утра ребенок все еще не найден всех кто видел мальчика просят сообщить в полицию по номеру или,2018-10-30 07:18:16,107816149,[]
261,доброй ночи улан удэ,2018-10-29 17:47:12,107816149,[]
262,ретро улан удэ,2018-10-29 07:08:38,107816149,[]
263,думаю предысторию о моих найденышах вы знаете и воооот нам уже месяц растут красивыми плюшевыми мишками со светлыми глазками принцессы и богатырь ооочень хочется отдать их в самые добрые руки прикормке поддаются хорошо уже кушают сами бутылочку не даю совсем очень игривые и смешные если хотите стать хозяевами плюшевым комочкам с не простой судьбой мы очень вас ждем,2018-10-28 12:52:04,107816149,[]
264,доброе утро улан удэ,2018-10-28 02:33:00,107816149,[]
265,утерян паспорт на имя швецова виктория владимировна в районе сотых кварталов нашедшему просьба вернуть за вознаграждение пожалуйста репост,2018-10-27 17:24:43,107816149,[]
266,,2018-10-27 12:56:31,107816149,[]
