1242,,2019-01-18 16:03:17,29378821,
1243,петиция в защиту школы в нюхче собрала свыше тысяч подписей подробнее,2019-01-18 15:30:02,29378821,[]
1244,,2019-01-18 15:14:23,29378821,
1245,тело жителя карелии найдено в подвале дома в санкт петербурге подробнее,2019-01-18 15:05:01,29378821,[]
1246,,2019-01-18 14:52:26,29378821,
1247,стратегия развития карелии не производит впечатления подробнее,2019-01-18 14:50:02,29378821,[]
1248,видео в петрозаводске дети проехали по пешеходному переходу на лыжах подробнее,2019-01-18 14:20:02,29378821,[]
1249,,2019-01-18 13:04:32,29378821,
1250,из карелии за год выгнали мигрантов подробнее,2019-01-18 12:50:01,29378821,[]
1251,уже сегодня крещенские купания впервые пройдут на набережной петрозаводска толщина льда см подробнее,2019-01-18 12:45:02,29378821,[]
1252,мужчина обокрал бывшую жену в канун нового года подробнее,2019-01-18 12:20:02,29378821,[]
1253,отец в карелии задушил плачущую дочку подробнее,2019-01-18 11:45:02,29378821,[]
1254,,2019-01-18 11:42:26,29378821,
1255,за красивыми сюжетами скрывалась банальная истина нас просто грабят подробнее,2019-01-18 11:40:02,29378821,[]
1256,мэр петрозаводска поручила усилить работу по уборке от снега тротуаров и пешеходных переходов подробнее,2019-01-18 11:05:01,29378821,[]
1257,,2019-01-18 11:03:59,29378821,
1258,петрозаводчанин купил любимой пальто а себе куртку на украденные деньги подробнее,2019-01-18 11:00:02,29378821,[]
1259,ушел из жизни борис покрамович проработавший зампрокурора карелии почти лет подробнее,2019-01-18 10:40:01,29378821,[]
1260,синоптики рассказали когда в карелии закончится снегопад подробнее,2019-01-18 10:35:01,29378821,[]
1261,пкс водоканал перешли на бесцеховую структуру управления подробнее,2019-01-18 10:30:02,29378821,[]
1262,жительница карелии пострадала в дтп в вытегре подробнее,2019-01-18 10:25:02,29378821,[]
1263,,2019-01-18 10:22:22,29378821,
1264,в карелии бывший эксперт управтодора обвиняется во взяточничестве подробнее,2019-01-18 10:20:01,29378821,[]
1265,в моногороде карелии планируют построить гостиницу на номеров подробнее,2019-01-18 09:55:02,29378821,[]
1266,рассеянный водитель протаранил припаркованный в петрозаводске автомобиль подробнее,2019-01-18 09:50:01,29378821,[]
1267,неизвестный автомобиль сбил школьника в петрозаводске подробнее,2019-01-18 09:45:02,29378821,[]
1268,афк система планирует вложить млрд рублей в туризм карелии подробнее,2019-01-18 09:40:02,29378821,[]
1269,,2019-01-18 09:39:11,29378821,
1270,трое человек пострадали при столкновении двух иномарок в петрозаводске подробнее,2019-01-18 09:35:01,29378821,[]
1271,в карелии горел деревянный дом подробнее,2019-01-18 09:30:02,29378821,[]
1272,в петрозаводске нашли мужчину подозреваемого в краже подробнее,2019-01-18 09:20:01,29378821,[]
1273,на трассе в карелии сгорел трактор подробнее,2019-01-18 09:15:02,29378821,[]
1274,,2019-01-18 09:11:11,29378821,
1275,,2019-01-18 09:10:33,29378821,
1276,на программу комфортная городская среда в карелии потратят около млн рублей подробнее,2019-01-18 09:00:02,29378821,[]
1277,власти карелии выделят деньги на приобретение музыкальных инструментов подробнее,2019-01-18 08:40:01,29378821,[]
1278,в карелии осудили водителя насмерть сбившего летнего мальчика подробнее,2019-01-18 08:20:01,29378821,[]
1279,как сэкономить на ремонте с по января покупайте товары для строительства отделки и обустройства в супермаркете со скидкой,2019-01-18 08:14:09,29378821,[]
1280,,2019-01-18 08:08:00,29378821,
1281,какие события ожидаются в петрозаводске и карелии сегодня подробнее,2019-01-18 07:55:02,29378821,[]
1282,в районе карелии мужчина обстрелял магазин из винтовки подробнее,2019-01-18 07:25:02,29378821,[]
1283,бывшего рыбинспектора в карелии осудили за служебный подлог подробнее,2019-01-18 07:15:02,29378821,[]
1284,прогноз погоды на пятницу подробнее,2019-01-18 07:05:02,29378821,[]
1285,женщину в тяжелом состоянии на вертолете доставили в больницу петрозаводска подробнее,2019-01-18 06:40:01,29378821,[]
1286,снег и метель ночью прогноз погоды на января подробнее,2019-01-18 00:10:00,29378821,[]
1287,гости в студии боднарчук и мирошник расскажут о комфортной городской среде на россии подробнее,2019-01-17 23:55:02,29378821,[]
1288,аварийное состояние объявлен аукцион на продажу участка со зданием бывшей школы в петрозаводске подробнее,2019-01-17 23:35:02,29378821,[]
1289,как женщины выбирают мужчин для секса подробнее,2019-01-17 23:30:02,29378821,[]
1290,последствие дтп пробка образовалась на лососинском шоссе из за мелких аварий подробнее,2019-01-17 23:10:02,29378821,[]
1291,суд идет адвокат дмитриев не оказывал давления на приемную дочь подробнее,2019-01-17 22:50:02,29378821,[]
1292,целебная республика певица слава похудела на три килограмма в карелии подробнее,2019-01-17 22:30:02,29378821,[]
1293,что происходило сегодня в петрозаводске и карелии подробнее,2019-01-17 22:25:01,29378821,[]
1294,вакантное место фонд капремонта объявил конкурс на должность гендиректора подробнее,2019-01-17 22:10:02,29378821,[]
1295,компания сана проиграла суд против журналистов подробнее,2019-01-17 22:05:01,29378821,[]
1296,опрос показал чего россияне больше всего стыдятся подробнее,2019-01-17 22:00:02,29378821,[]
1297,погибла несовершеннолетняя перед судом предстанет мужчина совершивший смертельное дтп в петрозаводске подробнее,2019-01-17 21:50:02,29378821,[]
1298,в правительстве обсудили проект социальной нормы на электроэнергию подробнее,2019-01-17 21:35:01,29378821,[]
1299,новое направление в карелии решили развивать авиатуризм подробнее,2019-01-17 21:30:02,29378821,[]
1300,глюкоза поделилась секретом своей соблазнительной попы подробнее,2019-01-17 21:30:01,29378821,[]
1301,вакансии министерство культуры карелии ищет пять бухгалтеров подробнее,2019-01-17 21:15:02,29378821,[]
1302,аварийное расселение минстрой в карелии расселят более многоквартирных домов подробнее,2019-01-17 21:10:02,29378821,[]
1303,отслужившим срочную службу россиянам запретят соцсети подробнее,2019-01-17 21:05:02,29378821,[]
1304,уровень регистрируемой безработицы в карелии составил почти подробнее,2019-01-17 20:55:02,29378821,[]
1305,беспредел видео чиновники хотят ликвидировать аэропорт пески отдав площадку под строительство коттеджей подробнее,2019-01-17 20:50:02,29378821,[]
1306,сбор валежника в карелии позволит снизить число лесных пожаров заявляют власти подробнее,2019-01-17 20:45:02,29378821,[]
1307,чистый отток капитала из россии в году вырос в раза подробнее,2019-01-17 20:40:02,29378821,[]
1308,смертельная авария один человек погиб при столкновении и грузовика в карелии подробнее,2019-01-17 20:20:02,29378821,[]
1309,возлюбленной ведущего русского лото после гибели жены стала студентка подробнее,2019-01-17 20:20:01,29378821,[]
1310,министерство культуры карелии ищет пять бухгалтеров подробнее,2019-01-17 20:10:01,29378821,[]
1311,ужасная трагедия водитель снегохода разбился насмерть в карелии подробнее,2019-01-17 20:00:03,29378821,[]
1312,какие события ожидаются в петрозаводске и карелии завтра подробнее,2019-01-17 20:00:02,29378821,[]
1313,полуобнаженный сергей шнуров показал фото с новой женой подробнее,2019-01-17 19:40:02,29378821,[]
1314,святые мощи карельская епархия сообщила о чуде в крестовоздвиженском соборе подробнее,2019-01-17 19:30:02,29378821,[]
1315,депутаты обеспокоились реакцией общества на оптимизацию школ в карелии подробнее,2019-01-17 19:20:02,29378821,[]
1316,стало известно кто представит россию на евровидении подробнее,2019-01-17 19:10:02,29378821,[]
1317,жестокое убийство в карелии зверское преступление произошло в канун рождества подробнее,2019-01-17 19:00:02,29378821,[]
1318,в карелии ликвидировали петрозаводский ритц банка подробнее,2019-01-17 18:55:01,29378821,[]
1319,в карелии девятиклассникам нужно вовремя подать заявления на участие в итоговом собеседовании по русскому языку подробнее,2019-01-17 18:40:02,29378821,[]
1320,житель карелии незаметно лишился тысяч рублей с банковской карты подробнее,2019-01-17 18:20:02,29378821,[]
1321,в карелии выросла стоимость жку подробнее,2019-01-17 18:10:01,29378821,[]
1322,в карелии пройдет фестиваль скандинавской ходьбы подробнее,2019-01-17 18:05:02,29378821,[]
1323,продукты в карелии в году подорожали в среднем на подробнее,2019-01-17 18:00:02,29378821,[]
1324,в карелии безработные могут узнать о пособиях через интернет подробнее,2019-01-17 17:50:01,29378821,[]
1325,в карелии спасатели помогли лыжникам из петербурга добраться до ж д вокзала подробнее,2019-01-17 17:40:01,29378821,[]
1326,в карелии начальник подразделения организации по лесохозяйственным работам присвоил более полумиллиона рублей подробнее,2019-01-17 17:35:02,29378821,[]
1327,,2019-01-17 17:22:01,29378821,
1328,двое подростков могут сесть на лет за угон подробнее,2019-01-17 17:20:01,29378821,[]
1329,в петрозаводске стабилизировались цены на бензин подробнее,2019-01-17 17:10:01,29378821,[]
1330,снег и метель ночью прогноз погоды на января подробнее,2019-01-17 17:00:02,29378821,[]
1331,,2019-01-17 16:29:49,29378821,
1332,собрание в нюхче станет встречей жителей села подробнее,2019-01-17 16:15:01,29378821,[]
1333,в районе карелии семей получили ключи от новых квартир подробнее,2019-01-17 16:10:02,29378821,[]
1334,,2019-01-17 16:06:58,29378821,
1335,полиция петрозаводска разыскивает мужчину подозреваемого в краже подробнее,2019-01-17 15:45:02,29378821,[]
1336,,2019-01-17 15:37:40,29378821,
1337,,2019-01-17 15:20:53,29378821,
1338,,2019-01-17 15:03:04,29378821,
1339,один человек погиб при столкновении и грузовика в карелии подробнее,2019-01-17 14:50:01,29378821,[]
1340,адвокат дмитриев не оказывал давления на приемную дочь подробнее,2019-01-17 14:10:02,29378821,[]
1341,объявлен аукцион на продажу участка со зданием бывшей школы в петрозаводске подробнее,2019-01-17 13:55:02,29378821,[]
1342,пьяный петрозаводчанин преследовал юношу в надежде украсть что то ценное подробнее,2019-01-17 13:15:01,29378821,[]
1343,минстрой в карелии расселят более многоквартирных домов подробнее,2019-01-17 12:45:02,29378821,[]
1344,бесплатные уроки по иностранным языкам пройдут в петрозаводске,2019-01-17 12:45:00,29378821,[]
1345,,2019-01-17 12:10:48,29378821,
1346,депутаты петросовета обсудили изменения в правила благоустройства подробнее,2019-01-17 12:10:02,29378821,[]
1347,петрозаводчанка украла из магазина куртку почти за тысяч рублей подробнее,2019-01-17 11:55:02,29378821,[]
1348,,2019-01-17 11:51:23,29378821,
1349,боднарчук и мирошник расскажут о комфортной городской среде на россии подробнее,2019-01-17 11:50:01,29378821,[]
1350,чиновники мэрии проверяют уборку дорожек и спусков от снега подробнее,2019-01-17 11:45:02,29378821,[]
1351,перед судом предстанет мужчина совершивший смертельное дтп в петрозаводске подробнее,2019-01-17 11:40:02,29378821,[]
1352,карельская епархия сообщила о чуде в крестовоздвиженском соборе подробнее,2019-01-17 11:15:02,29378821,[]
1353,жителя карелии приговорили к годам колонии за попытку сжечь возлюбленную подробнее,2019-01-17 10:50:02,29378821,[]
1354,в карелии решили развивать авиатуризм подробнее,2019-01-17 10:30:01,29378821,[]
1355,фонд капремонта объявил конкурс на должность гендиректора подробнее,2019-01-17 10:20:02,29378821,[]
1356,житель карелии задолжал более млн рублей подробнее,2019-01-17 10:15:01,29378821,[]
1357,в день крещения господня пкс водоканал подвезет воду для освящения подробнее,2019-01-17 10:00:02,29378821,[]
1358,,2019-01-17 09:52:23,29378821,
1359,в районе карелии открыли ледовую переправу подробнее,2019-01-17 09:50:02,29378821,[]
1360,певица слава похудела на три килограмма в карелии подробнее,2019-01-17 09:45:02,29378821,[]
1361,безработный обокрал дачу жителя карелии подробнее,2019-01-17 09:40:02,29378821,[]
1362,пробка образовалась на лососинском шоссе из за мелких аварий подробнее,2019-01-17 09:35:02,29378821,[]
1363,водитель снегохода разбился насмерть в карелии подробнее,2019-01-17 09:30:02,29378821,[]
1364,,2019-01-17 09:25:06,29378821,
1365,на пожаре в карелии спасли ребенка подробнее,2019-01-17 09:25:02,29378821,[]
1366,в петрозаводске в одном из домов загорелся мусоропровод подробнее,2019-01-17 09:10:02,29378821,[]
1367,,2019-01-17 09:06:57,29378821,
1368,,2019-01-17 09:03:41,29378821,
1369,видео чиновники хотят ликвидировать аэропорт пески отдав площадку под строительство коттеджей подробнее,2019-01-17 08:20:02,29378821,[]
1370,фото в петрозаводске вырастают сосульки убийцы горожане предупреждают об опасности подробнее,2019-01-17 08:05:01,29378821,[]
1371,какие события ожидаются в петрозаводске и карелии сегодня подробнее,2019-01-17 07:55:01,29378821,[]
1372,видео в петрозаводске два автомобиля столкнулись на перекрестке подробнее,2019-01-17 07:25:02,29378821,[]
1373,в петрозаводске из за массовых мероприятий на крещение перекроют движение в центре города подробнее,2019-01-17 07:15:02,29378821,[]
1374,прогноз погоды на четверг подробнее,2019-01-17 07:05:02,29378821,[]
1375,в карелии зверское преступление произошло в канун рождества подробнее,2019-01-17 06:40:01,29378821,[]
1376,слово не воробей мазуровский назвал депутатов карелии беззубыми и обвинил их в убийстве медицины и образования подробнее,2019-01-17 00:10:02,29378821,[]
1377,изменятся правила списания комиссии за банковские переводы подробнее,2019-01-16 23:55:01,29378821,[]
1378,забавное видео необычная кормушка для птиц появилась в карелии подробнее,2019-01-16 23:50:02,29378821,[]
1379,экс прокурор петрозаводска аскерова готовится к экзаменам на получение статуса адвоката подробнее,2019-01-16 23:45:02,29378821,[]
1380,громкое дело в карелии водителя сбившего насмерть летнего ребенка отправили в колонию подробнее,2019-01-16 23:30:03,29378821,[]
1381,чего боятся мужчины при интимной связи подробнее,2019-01-16 23:30:02,29378821,[]
1382,мазуровский назвал депутатов карелии беззубыми и обвинил их в убийстве медицины и образования подробнее,2019-01-16 23:20:02,29378821,[]
1383,правительство увеличило господдержку ипотеки для семей с детьми подробнее,2019-01-16 23:10:02,29378821,[]
1384,откуда деньги власти назвали источники рекордных налоговых поступлений в бюджет карелии подробнее,2019-01-16 23:05:02,29378821,[]
1385,инвестор готов вложить млрд рублей в модернизацию котельных карелии подробнее,2019-01-16 23:00:02,29378821,[]
1386,фото дня в карелии появился экскаватор с кинг конгом подробнее,2019-01-16 22:50:02,29378821,[]
1387,так и живем в карелии до сих пор не создан нормативный запас топлива и вряд ли уже будет подробнее,2019-01-16 22:35:01,29378821,[]
1388,все что случилось сегодня подробнее,2019-01-16 22:25:02,29378821,[]
1389,безопасность на трех перекрестках петрозаводска появятся светофоры подробнее,2019-01-16 22:10:02,29378821,[]
1390,в минстрое карелии очередная смена кадров подробнее,2019-01-16 22:05:02,29378821,[]
1391,путин не увидел ничего неожиданного в росте цен с начала года подробнее,2019-01-16 22:00:02,29378821,[]
1392,видео дня в петрозаводске ваз выехал под мигающий зеленый и снес бампер иномарке подробнее,2019-01-16 21:50:03,29378821,[]
1393,директор карелэнергоресурса заявил об отсутствии оснований для банкротства подробнее,2019-01-16 21:50:02,29378821,[]
1394,новые люди в минстрое карелии очередная смена кадров подробнее,2019-01-16 21:30:03,29378821,[]
1395,порно предложили изучать в школе во благо детей подробнее,2019-01-16 21:30:03,29378821,[]
1396,политолог корпорация развития карелии не воплощает планы в жизнь подробнее,2019-01-16 21:15:02,29378821,[]
1397,преступление и наказание в карелии осудили экс начальника сегежской колонии подробнее,2019-01-16 21:05:03,29378821,[]
1398,в россии массово внедрят систему распознавания лиц подробнее,2019-01-16 21:05:02,29378821,[]
1399,власти карелии назвали срок погашения долгов по зарплате на медвежьегорском молокозаводе подробнее,2019-01-16 21:00:02,29378821,[]
1400,коррекционная школа интернат может появиться в петрозаводске подробнее,2019-01-16 20:55:02,29378821,[]
1401,заплати налоги старейшую строительную компанию карелии хотят признать банкротом подробнее,2019-01-16 20:50:02,29378821,[]
1402,старейшую строительную компанию карелии хотят признать банкротом подробнее,2019-01-16 20:50:02,29378821,[]
1403,ученые выяснили какие профессии могут исчезнуть в ближайшем будущем подробнее,2019-01-16 20:40:02,29378821,[]
1404,эксперт чем грозит закон о самозанятых подробнее,2019-01-16 20:35:02,29378821,[]
1405,растут и расширяются парфенчиков увеличил штатную численность ведомства в карелии подробнее,2019-01-16 20:30:02,29378821,[]
1406,подруга жанны фриске избила шепелева подробнее,2019-01-16 20:20:02,29378821,[]
1407,бывает же такое в петрозаводске бизнесмен оплатил миллионный долг за себя и за того парня подробнее,2019-01-16 20:00:03,29378821,[]
1408,какие события ожидаются в петрозаводске и карелии завтра подробнее,2019-01-16 20:00:02,29378821,[]
