2456,от подписчика пока калужская бабушка мечтает встретиться путиным хочу поделиться вот этим две заправки в одно и тоже время на одной ой бензин рубля на другой расстояние между ними метров на одной улице,2018-09-21 15:02:01,47908301,[]
2457,автомобилистов освободили от платы за парковку на улице достоевского подробнее,2018-09-21 14:31:00,47908301,[]
2458,ехала на днях с работы водитель болтает без умолку по телефону и попутно смотрит захватывающий документальный фильм при этом успевает грызть семечки и собирать деньги с пассажиров час пик центр калуги маршрутка набита до отказа пассажирами что скажите представители контрольно надзорных органов вы ведь тоже здесь и мониторите эту группу не проходите мимо автор наталия жилина,2018-09-21 13:46:00,47908301,[]
2459,косуля выбежавшая из бора погибла под колесами трактора животное напугали мотоциклисты подробнее,2018-09-21 12:51:00,47908301,[]
2460,,2018-09-21 11:51:00,47908301,
2461,мужчина требовал квартиру угрожая прыгнуть с вышки квартиру ему конечно же не дали подробнее,2018-09-21 11:07:00,47908301,[]
2462,сегодня около утра на хрустальной около школы сбили школьника который перебегал дорогу в неположенном месте мальчик жив фото мчс,2018-09-21 10:48:05,47908301,[]
2463,летняя калужанка обчистила камеру хранения к преступлению бабуля готовилась заранее подробнее,2018-09-21 10:20:00,47908301,[]
2464,осенние выходные радуют солнечной погодой а русские гвозди радуют осенними скидками с по сентября дарим скидку на все товары для стройки и ремонта кроме стоп цен а также напоминаем об отличных акциях скидка на все интерьерное освещение скидка до на пропитки для дерева бесплатная доставка по городу и в область при покупке на сумму от тыс встречайте осень с нами выгодно,2018-09-21 09:20:00,47908301,[]
2465,когда окна выходят на оку туман сегодня утром всем отличной пятницы и хорошего настроения,2018-09-21 08:18:37,47908301,[]
2466,в кирове калужской области пропал ребенок бабак ксения года рождения вчера в после занятий ушла из школы домой не вернулась кто обладает какой либо информацией сообщить по номеру телефона нашли сидела колодезном кольце не смогла выбраться,2018-09-21 07:32:00,47908301,[]
2467,доброе утро калуга вид на стройку дворца спорта,2018-09-21 07:09:29,47908301,[]
2468,калужская бабушка мечтает встретиться с путиным репост автоледи вонзила нож в задницу пешеходу видео на перекрестке грабцевского шоссе и платова сбили велосипедиста теплосеть заставляет установивших в квартирах индивидуальное отопление жителей платить по всем счетам и другие новости калуги за сегодня,2018-09-20 22:00:08,47908301,[]
2469,вечерняя калуга,2018-09-20 20:32:00,47908301,[]
2470,на закате дня фото,2018-09-20 19:46:00,47908301,[]
2471,в производство инсулина в грабцево инвестировали более миллиардов рублей подробнее,2018-09-20 19:01:00,47908301,[]
2472,хочешь чтобы машина никогда не ломалась вовремя меняй запчасти все что нужно твоей машине уже на сайте заходи на сайт и выбирай марку своего авто в каталоге,2018-09-20 18:01:00,47908301,[]
2473,мачеха хотела развеселить летнюю падчерицу порнушкой подробнее,2018-09-20 17:53:19,47908301,[]
2474,из за зимних реагентов погибла трава деревья и кустарники организацию занимавшуюся посыпкой калужских дорог песчано соляной смесью оштрафовали на тысяч подробнее,2018-09-20 17:33:00,47908301,[]
2475,братская могила в деревне романово стал местом распития алкоголя народ воинские мемориалы а уж тем более братская могила не место для тусовок,2018-09-20 17:05:01,47908301,[]
2476,,2018-09-20 16:05:00,47908301,
2477,от подписчика вот так ведут себя на дорогах велосипедисты у которых девять жизней ехал пренебрегая всеми возможными правилами а потом еще и жалуются берегите себя и своих близких,2018-09-20 15:33:00,47908301,[]
2478,осень в центральном парке фото,2018-09-20 15:03:01,47908301,[]
2479,,2018-09-20 14:06:00,47908301,
2480,давайте поможем калужской бабушке обрести свою мечту полина королева она единственная ныне живущая свидетельница и участница освобождения калуги от немецко фашистских захватчиков сегодня ей исполнилось лет деревня устиновка км от калуги ветеран награждена медалью за боевые заслуги за взятие кенигсберга за победу над германией в великой отечественной войне ее самая заветная мечта увидеть президента давайте поможем репостами может быть нас услышат влиятельные люди и помогут организовать участнику вов встречу с владимиром путиным,2018-09-20 13:53:00,47908301,[]
2481,на улице кирова появится еще один комплекс фиксации нарушений пдд подробнее,2018-09-20 13:27:00,47908301,[]
2482,шкода снесла велосипедиста перекресток грабцевского шоссе и платова,2018-09-20 12:56:00,47908301,[]
2483,калугатеплосеть заставляет установивших в квартирах индивидуальное отопление жителей платить по всем счетам вот такой вот абсурд подробнее,2018-09-20 12:23:00,47908301,[]
2484,сегодня утвердили праздничные и выходные дни на год майские праздники увеличили до дней на новый год отдыхаем целых дней с декабря года по января года,2018-09-20 12:12:00,47908301,[]
2485,кг роллов всего за рублей закажи сейчас,2018-09-20 11:12:00,47908301,[]
2486,калужская достопримечательность экодук на киевской трассе в россии посчитали что животным одного на всю страну перехода через трассу достаточно зато он единственный и неповторимый фото кто не в курсе что это такое смотрите,2018-09-20 11:00:09,47908301,[]
2487,,2018-09-20 10:00:05,47908301,
2488,автоледи вонзила нож в задницу пешеходу подробнее,2018-09-20 09:26:00,47908301,[]
2489,комплексы фиксации нарушений пдд пополнили калужский бюджет на млрд рублей до конца года введут в эксплуатацию еще комплексов подробнее,2018-09-20 08:42:00,47908301,[]
2490,от подписчицы я под приятным впечатлением очередь в маркете магнит на никитина перед кассой рассчитывается старенькая бабушка за ней два мужика еще и я она набрала на руб хлеб макароны чай сахар пряники масло выгребла руб что ли и дальше ищет долго по карманам видно замешательство мужик за ней просит сделать безнал и рассчитывается за нее своей картой всю сумму кассир отдает ей деньги чек и говорит что за нее рассчитались бабушка растерянно начала смотреть по сторонам спасибо спасибо а кто а мужик брал печеньки и сок быстро щелкнул картой и ушел честно я сама начала в уме считать хватит ли мне ей докинуть до нужной суммы и тут такое мужик счастья тебе здоровья и любви за твою человечность,2018-09-20 07:34:10,47908301,[]
2491,калужское нло спокойной ночи калужане,2018-09-19 23:23:59,47908301,[]
2492,здравствуйте это наверное странный вопрос но где находится вулкан в калуге по биологии задали найти,2018-09-19 22:21:00,47908301,[]
2493,полицейские спасли жизнь грудного ребенка таксистам калуги оставили только цвета появилось видео момента как поезд сбил летнего парня видео ученики б школы города калуги звонят свои родителям и говорят что любят их и другие новости калуги за сегодня,2018-09-19 21:54:12,47908301,[]
2494,ученики б школы города калуги звонят свои родителям и говорят что любят их получилось очень трогательное видео советуем посмотреть,2018-09-19 20:53:00,47908301,[]
2495,прекрасный сентябрьский закат фото,2018-09-19 20:12:00,47908301,[]
2496,,2018-09-19 19:13:00,47908301,
2497,гибдд рассказала о низком уровне подготовки водителей калужскими автошколами подробнее,2018-09-19 18:53:00,47908301,[]
2498,от подписчицы на дворе почти лето а в домах на московской площади ул окружная и московская уже включили отопление это чтобы побольше денег собрать с калужан живем с открытыми окнами и балконами а за тепло придется платить сегодня на улице было с,2018-09-19 18:14:01,47908301,[]
2499,наш подписчик ищет свидетелей дтп выручайте сегодня передвигаясь на автомобиле марки опель астра номер в утра остановившись на светофоре перед пешеходным переходом по улице глаголева ожидал зеленого сигнала светофора слева не находясь в полосе попутного направления пристроился автомобиль тойота красного цвета вроде хетчбек за рулем находилась девушка когда загорелся зеленый сигнал светофора девушка попыталась меня опередить но допустила столкновение с моей машиной и скрылась с места дтп удар пришелся в левое крыло выручайте звоните по номеру либо пишите сюда,2018-09-19 17:42:00,47908301,[]
2500,таксистам калуги оставили только цвета подробнее,2018-09-19 17:20:00,47908301,[]
2501,,2018-09-19 16:20:00,47908301,
2502,ехали сейчас с сыном на троллейбусе маршрут оплачиваю проезд картой т к наличные в моем кошельке бывают крайне редко и сегодняшний день не стал исключением кондуктор прикладывает карту к своему оборудованию и первый билет появляется без проблем попытка получить второй билет оказывается безуспешной далее еще одна попытка и еще еще не коннектится что то кондуктор отдает мне карту намекая на то что пора бы уже расплатиться за проезд как люди наличными извините говорю но наличных у меня нет и далее начинается самое интересное женщина кондуктор меняется в лице и с вызовом произносит вы в америке тут что ли без наличных ездите удивляюсь вместе с другими пассажирами и говорю что проезд оплачивать не отказываюсь а проблемы с оборудованием я решать не должна кстати с двенадцатой наверное попытки второй билет мы все таки получили а кондуктор на которую я кстати обещала пожаловаться еще долго недоумевала ну откуда берутся такие бестолковые пассажиры без наличных кто прав кто виноват сейчас не хочется выяснять хочется человеческого отношения автор ирина личутина аксенова,2018-09-19 15:43:00,47908301,[]
2503,на марата при ремонте сдуло каркас кровли на припаркованные снизу автомобили фото наташа кот и,2018-09-19 15:10:43,47908301,[]
2504,в скандальной мещовской школе без пола и батарей вспыхнул пожар один из рабочих бросил не затушенную сигарету на спортивные маты и они загорелись пожарная сигнализация в школе отсутствовала по рассказу родителей о пожаре детям сообщила уборщица она же и помогла детям эвакуироваться подробнее,2018-09-19 15:01:00,47908301,[]
2505,снорклинг в реке суходрев релакс полотняный завод имение гончаровых,2018-09-19 13:34:00,47908301,[]
2506,калужане платят за коммуналку меньше чем в среднем по рф необъяснимо но факт подробнее,2018-09-19 12:53:00,47908301,[]
2507,момент когда поезд сбивает летнего парня на переезде попал на видео напомним погибший попытался перебежать ж д переезд на запрещающий сигнал светофора и ступил на железнодорожное полотно непосредственно перед двигающимся поездом в результате мужчина погиб на месте см пост,2018-09-19 12:19:32,47908301,[]
2508,,2018-09-19 11:20:00,47908301,
2509,полицейские спасли жизнь грудного ребенка подробнее,2018-09-19 10:43:00,47908301,[]
2510,три человека погибли в лобовом столкновении двух рено подробнее,2018-09-19 10:12:00,47908301,[]
2511,пожалуй лучший вариант калужской рекламы за последнее время а как вы считаете а еще мы подсмотрели крутую акцию у авторов видео пепперони см всего за рублей невероятная скидка на пепперони диаметра при заказе любой большой пиццы см на доставку подробности и заказ на сайте или по,2018-09-19 09:12:00,47908301,[]
2512,в кто видел в небе что то желтое быстро пролетело камера или что то еще очень интересно услышать мнения сам не знаю что это,2018-09-19 07:50:20,47908301,[]
2513,спокойной ночи калуга,2018-09-18 23:02:04,47908301,[]
2514,парковаться во дворах жилых домов заставят по новому с каменного моста упал мужчина в калуге не хватает мест на кладбищах и другие новости калуги за сегодня,2018-09-18 21:49:15,47908301,[]
2515,зарево над калугой,2018-09-18 21:06:00,47908301,[]
2516,,2018-09-18 20:08:00,47908301,
2517,калуга прямо сейчас фото,2018-09-18 19:37:41,47908301,[]
2518,ребята дорожники спасибо за выделенные полосы для поворота в анненках я вас,2018-09-18 19:00:10,47908301,[]
2519,,2018-09-18 18:01:00,47908301,
2520,летний мальчик попал в больницу после дтп на улице жукова подробнее,2018-09-18 17:33:21,47908301,[]
2521,слияние оки с угрой и южный обход калуги удивительно насколько разная вода в реках,2018-09-18 17:07:58,47908301,[]
2522,затор на гагаринском мосту в сторону правого из за дтп актуально на фото от подписчика поехали,2018-09-18 16:40:00,47908301,[]
2523,,2018-09-18 15:40:00,47908301,
2524,от подписчика с каменного моста прыгнул мужчина на вид лет жив или нет не знаю погиб был без документов сейчас устанавливают лчиность,2018-09-18 15:17:58,47908301,[]
2525,летний парень бросился под поезд в малоярославце подробнее,2018-09-18 14:37:00,47908301,[]
2526,прямо сейчас на киевке на ерденевском светофоре перевернулся грузовик со щебнем со слов очевидцев водитель жив но его зажало в кабине видео с места дтп от нашего подписчика,2018-09-18 13:51:21,47908301,[]
2527,в калуге не хватает мест на кладбищах подробнее,2018-09-18 13:36:00,47908301,[]
2528,такое может быть только в россии а точнее в калуге на правом фото от подписчика,2018-09-18 12:48:00,47908301,[]
2529,калужанин раза выстрелил в соседа за просьбу сделать музыку потише под обстрел попал наш подписчик сама история подробнее,2018-09-18 12:12:00,47908301,[]
2530,кг роллов всего за рублей закажи сейчас,2018-09-18 11:12:00,47908301,[]
2531,поворот на анненки нашему подписчику под колеса вылетели два вот этих чудилы на тот свет торопились р автор ехал на зеленый свет оставалось еще секунд,2018-09-18 10:02:04,47908301,[]
2532,задний план просто жуткий вот вам и калужская областная филармония,2018-09-18 09:36:00,47908301,[]
2533,парковаться во дворах жилых домов заставят по новому министр назвал ненормальной ситуацию когда во дворе квартирного дома припарковано автомобилей это нарушает право граждан на благоустроенное жилье и портит городское пространство подробнее,2018-09-18 09:01:00,47908301,[]
2534,чьи то машинки эвакуатор забирает к либкнехта фото от подписчицы,2018-09-18 08:42:02,47908301,[]
2535,туманное утро на оке фото эдуард сычев,2018-09-18 08:00:03,47908301,[]
2536,юридическое бюро право и защита это команда активных правозащитников которые всегда готовы помочь вам разобраться в сложившейся сложной юридической ситуации мы внимательно и полно изучаем каждую проблему чтобы найти законное и верное решение консультации абсолютно бесплатны пишите звоните приходите к нам ссылка на нашу группу сайт номер телефона,2018-09-18 07:00:00,47908301,[]
2537,спокойной ночи калуга,2018-09-17 23:24:45,47908301,[]
2538,массовое дтп на тарутинской спровоцировала летняя женщина водитель калугу ожидает вторая волна бабьего лета повара сушисты избили и покусали полицейских мотоциклист сломал обе руки и ногу в аварии на зерновой и другие новости калуги за сегодня,2018-09-17 22:47:00,47908301,[]
2539,,2018-09-17 21:47:00,47908301,
2540,котик греется у вечного огня на площади победы он же фото прислал михаил веревченко,2018-09-17 21:26:00,47908301,[]
2541,от подписчицы девушку сбили на пешеходном переходе в центре калуги водитель скрылся с места дтп уважаемые водители и пешеходы калуги вчера в воскресенье примерно в девушка блондинка переходила дорогу по ул кирова от магазина фуджи к детскому миру шла на зеленый сигнал светофора и совершая этот маневр была задета машиной черного цвета марку не запомнила которая поворачивала с ул ленина и на кирова девушка получила многочисленные ушибы и вывихи просьба к водителям кто был в этот момент рядом и у кого есть видеорегистратор или внимательный пешеходы которые запомнили номера свяжитесь через личные сообщения с ой,2018-09-17 21:00:10,47908301,[]
2542,,2018-09-17 20:00:01,47908301,
2543,,2018-09-17 18:54:00,47908301,
