2507,интервью роман гольцев хуже всего придется тем кто за стабильность подробнее,2018-12-28 21:00:02,29378821,[]
2508,сильная и независимая замглавы петрозаводска сама выгнала дрифтера с площади кирова подробнее,2018-12-28 20:45:02,29378821,[]
2509,в россии запретили порошковый алкоголь подробнее,2018-12-28 20:40:02,29378821,[]
2510,серьезный пожар в петрозаводске сгорел дом подробнее,2018-12-28 20:25:02,29378821,[]
2511,юлия ковальчук показала фото без макияжа подробнее,2018-12-28 20:20:02,29378821,[]
2512,в карелии растет число жителей работающих после лет подробнее,2018-12-28 20:10:02,29378821,[]
2513,выяснили почему главу госкомитета по ценам и тарифам карелии ждет отставка подробнее,2018-12-28 20:00:02,29378821,[]
2514,какие события ожидаются в петрозаводске и карелии завтра подробнее,2018-12-28 20:00:02,29378821,[]
2515,остались без крова нужна помощь многодетной семье у которой все сгорело на пожаре в карелии подробнее,2018-12-28 19:45:02,29378821,[]
2516,волочкова необычно украсила елку подробнее,2018-12-28 19:40:02,29378821,[]
2517,минэк финнов заинтересовала будущая экономическая зона в карелии подробнее,2018-12-28 19:30:02,29378821,[]
2518,владельца магазина в карелии рядом с историческим зданием хотят лишить собственности подробнее,2018-12-28 19:25:02,29378821,[]
2519,установили личность в петрозаводске сбежавшим с места дтп водителем оказалась летняя девушка подробнее,2018-12-28 19:20:02,29378821,[]
2520,певица бьянка подала на развод спустя четыре месяца после свадьбы подробнее,2018-12-28 19:10:02,29378821,[]
2521,место для катания в петрозаводске появился новый каток подробнее,2018-12-28 19:00:02,29378821,[]
2522,билеты на январские спектакли музтеатра карелии можно купить на дешевле подробнее,2018-12-28 18:40:02,29378821,[]
2523,петрозаводчанин обокрал строительную фирму подробнее,2018-12-28 18:20:02,29378821,[]
2524,почему в карелии будет расти количество рабочих мест подробнее,2018-12-28 18:15:02,29378821,[]
2525,школьников наградили за рисунки на тему освещения петрозаводска подробнее,2018-12-28 18:00:01,29378821,[]
2526,правительство пенсии начнут расти подробнее,2018-12-28 17:55:02,29378821,[]
2527,главу госкомитета по ценам и тарифам карелии ждет отставка подробнее,2018-12-28 17:50:02,29378821,[]
2528,мужчина вынес из съемной квартиры в петрозаводске телевизор подробнее,2018-12-28 17:40:02,29378821,[]
2529,в петрозаводске открыто голосование на выбор лучшей новогодней иллюминации подробнее,2018-12-28 17:25:02,29378821,[]
2530,в дтп в карелии погибли двое мужчин подробнее,2018-12-28 17:20:02,29378821,[]
2531,срочно один ребенок погиб двое детей травмированы в дтп в карелии подробнее,2018-12-28 17:15:01,29378821,[]
2532,плюсовая температура прогноз погоды на декабря подробнее,2018-12-28 17:00:02,29378821,[]
2533,умер один из обгоревших на заводе в карелии рабочих подробнее,2018-12-28 16:50:02,29378821,[]
2534,фото на катке в петрозаводске отсыпали пешеходную дорожку чтобы путь сокращать подробнее,2018-12-28 16:45:01,29378821,[]
2535,в суоярви возобновлена подача тепла подробнее,2018-12-28 16:30:01,29378821,[]
2536,в петрозаводске уже подготовили ледовые площадки для массовых катаний подробнее,2018-12-28 16:25:01,29378821,[]
2537,,2018-12-28 16:05:40,29378821,
2538,фото появились кадры с места дтп в котором пострадала семья с детьми подробнее,2018-12-28 16:05:02,29378821,[]
2539,лесные ресурсы иссякают а лесное хозяйство пребывает в упадке подробнее,2018-12-28 15:45:01,29378821,[]
2540,,2018-12-28 15:37:29,29378821,
2541,,2018-12-28 15:05:21,29378821,
2542,в карелии плита упавшая с грузовика спровоцировала дтп в котором пострадала семья с детьми появилось фото с места происшествия подробнее,2018-12-28 14:15:02,29378821,[]
2543,фото полиция петрозаводска разыскивает мужчину не вернувшегося домой подробнее,2018-12-28 14:10:02,29378821,[]
2544,из за пьяных водителей за год в карелии погибли человек подробнее,2018-12-28 14:00:02,29378821,[]
2545,срочно президиум верховного суда рф отменил собственное решение по делу алиханова его снова забрали в сизо подробнее,2018-12-28 13:50:02,29378821,[]
2546,в новый год без долгов подробнее,2018-12-28 13:05:02,29378821,[]
2547,экс сотрудник кареллеспрома пойдет под суд за махинации с лесом подробнее,2018-12-28 13:00:02,29378821,[]
2548,,2018-12-28 12:55:49,29378821,
2549,в петрозаводске предприниматель заплатит тысяч рублей за причинение вреда ребенку подробнее,2018-12-28 12:40:02,29378821,[]
2550,в карелии нашли пропавшего мужчину без зубов со шрамом на носу подробнее,2018-12-28 12:15:02,29378821,[]
2551,обвиняемый во взяточничестве косарев решил учиться на медика подробнее,2018-12-28 12:00:02,29378821,[]
2552,в карелии прокуратура пригрозила уголовным преследованием за холод в суоярви подробнее,2018-12-28 11:50:02,29378821,[]
2553,власти карелии заявили о завершении программы по переселению из аварийного жилья подробнее,2018-12-28 11:45:01,29378821,[]
2554,вербовщик террористов обнаружен в колонии карелии подробнее,2018-12-28 11:40:02,29378821,[]
2555,жительница карелии отдала ясновидящей все деньги подробнее,2018-12-28 11:30:02,29378821,[]
2556,,2018-12-28 11:28:36,29378821,
2557,видео появились кадры как маленькие дети попали в дтп подробнее,2018-12-28 11:15:02,29378821,[]
2558,в петрозаводске снесли сарай где жила бездомная собака подробнее,2018-12-28 11:10:02,29378821,[]
2559,в карелии педофил пытался изнасиловать подростка подробнее,2018-12-28 11:05:01,29378821,[]
2560,видео автомобиль без водителя устроил дтп в центре петрозаводска подробнее,2018-12-28 11:00:02,29378821,[]
2561,в петрозаводске столкнулись два автомобиля есть пострадавшие подробнее,2018-12-28 10:35:02,29378821,[]
2562,фото замглавы петрозаводска сама выгнала дрифтера с площади кирова юлия мизинкова прогнала гонщика от главной елки петрозаводска на площади кирова подробнее,2018-12-28 10:25:02,29378821,[]
2563,роман гольцев хуже всего придется тем кто за стабильность подробнее,2018-12-28 10:20:02,29378821,[]
2564,в петрозаводске маленькие дети пострадали в дтп подробнее,2018-12-28 10:15:01,29378821,[]
2565,женщину госпитализировали после дтп на трассе в карелии подробнее,2018-12-28 10:10:02,29378821,[]
2566,совет калевальского райпо поздравляет всех с новым годом и рождеством подробнее,2018-12-28 10:05:01,29378821,[]
2567,,2018-12-28 09:56:57,29378821,
2568,мужчину достали из перевернувшегося в петрозаводске автомобиля подробнее,2018-12-28 09:50:02,29378821,[]
2569,в петрозаводске горит дом подробнее,2018-12-28 09:35:02,29378821,[]
2570,,2018-12-28 09:30:35,29378821,
2571,нужна помощь многодетной семье у которой все сгорело на пожаре в карелии подробнее,2018-12-28 09:15:01,29378821,[]
2572,,2018-12-28 09:11:08,29378821,
2573,,2018-12-28 09:03:11,29378821,
2574,в петрозаводске сбежавшим с места дтп водителем оказалась летняя девушка подробнее,2018-12-28 08:20:02,29378821,[]
2575,власти петрозаводска предлагают владельцам самостроя добровольно снести свои павильоны и гаражи подробнее,2018-12-28 08:05:02,29378821,[]
2576,какие события ожидаются в петрозаводске и карелии сегодня подробнее,2018-12-28 07:55:01,29378821,[]
2577,фото в петрозаводске появился новый каток подробнее,2018-12-28 07:25:02,29378821,[]
2578,жители суоярви мерзнут в своих квартирах из за снижения параметров отопления в котельной подробнее,2018-12-28 07:15:01,29378821,[]
2579,погода в петрозаводске сегодня декабря подробнее,2018-12-28 07:05:01,29378821,[]
2580,в карелии нарушителям правил безопасности при ведении работ на заводе где обгорели трое рабочих грозит пять лет тюрьмы подробнее,2018-12-28 06:40:02,29378821,[]
2581,погода на завтра подробнее,2018-12-27 23:45:00,29378821,[]
2582,новость дня парфенчиков сократил штат еще в одном министерстве карелии подробнее,2018-12-27 23:40:02,29378821,[]
2583,чем хорош утренний и вечерний секс подробнее,2018-12-27 23:30:01,29378821,[]
2584,отсудили фирма купила помещение популярного ночного клуба в петрозаводске подробнее,2018-12-27 23:20:02,29378821,[]
2585,дорожные хроники видео в петрозаводске столкнулись два автомобиля подробнее,2018-12-27 23:00:02,29378821,[]
2586,все сначала верховный суд карелии пересмотрит решение об аресте экс министра дмитрия матвийца подробнее,2018-12-27 22:40:02,29378821,[]
2587,что случилось в петрозаводске и карелии декабря подробнее,2018-12-27 22:25:01,29378821,[]
2588,как смогли фото жители суоярви смеются над новогодним украшением елки в городе подробнее,2018-12-27 22:20:02,29378821,[]
2589,будьте бдительны в магазине карелии обнаружили более кг опасного мяса подробнее,2018-12-27 22:00:03,29378821,[]
2590,кому больше всего доверяют россияне подробнее,2018-12-27 22:00:02,29378821,[]
2591,власти обещают два детских сада планируют открыть в петрозаводске в году подробнее,2018-12-27 21:40:02,29378821,[]
2592,жителей питкяранты просят запастись холодной водой подробнее,2018-12-27 21:35:02,29378821,[]
2593,дочь гузеевой намекнула на нетрадиционную сексуальную ориентацию киркорова подробнее,2018-12-27 21:30:01,29378821,[]
2594,не злите бабушку в карелии пенсионерка молотком раскурочила чужой автомобиль подробнее,2018-12-27 21:20:01,29378821,[]
2595,мвд предложило внести изменения в паспорта россиян подробнее,2018-12-27 21:10:02,29378821,[]
2596,гнетова прокуратура нашла коррупциогенные факторы в решениях мэрии петрозаводска подробнее,2018-12-27 21:05:01,29378821,[]
2597,горим в районе карелии произошел серьезный пожар подробнее,2018-12-27 21:00:02,29378821,[]
2598,стоимость проезда в пригородных автобусах подорожает с января подробнее,2018-12-27 20:55:01,29378821,[]
2599,в чьих руках богатство карельские экологи назвали крупнейших арендаторов лесфонда республики подробнее,2018-12-27 20:40:03,29378821,[]
2600,минтруд рассказал кого могут сократить в году подробнее,2018-12-27 20:40:02,29378821,[]
2601,пока гром не грянет в сортавале может случиться социальный взрыв из за проблем с вывозом мусора заявила депутат подробнее,2018-12-27 20:20:04,29378821,[]
2602,татьяна навка рассказала о разводе подробнее,2018-12-27 20:20:02,29378821,[]
2603,креатив по петрозаводски жители петрозаводска смогут пройтись по облепиховой свернуть на клюквенную подробнее,2018-12-27 20:00:03,29378821,[]
2604,какие события ожидаются в петрозаводске и карелии завтра подробнее,2018-12-27 20:00:02,29378821,[]
2605,парфенчиков сократил штат еще в одном министерстве карелии подробнее,2018-12-27 19:45:01,29378821,[]
2606,все по плану правительство карелии провалило план по приватизации акций подробнее,2018-12-27 19:40:02,29378821,[]
2607,инвалид хочет судиться с басковым из за денег подробнее,2018-12-27 19:40:01,29378821,[]
2608,фирма купила помещение популярного ночного клуба в петрозаводске подробнее,2018-12-27 19:30:01,29378821,[]
2609,подарок стоимость проезда в пригородных автобусах подорожает с января подробнее,2018-12-27 19:20:02,29378821,[]
2610,марата башарова подозревают в рукоприкладстве подробнее,2018-12-27 19:10:02,29378821,[]
2611,кара в карелии суд признал сотрудника управтодора виновным в получении взятки подробнее,2018-12-27 19:00:02,29378821,[]
2612,петрозаводчан приглашают побегать утром января подробнее,2018-12-27 18:40:02,29378821,[]
2613,все сотрудники компании техрент это жители петрозаводска которым не все равно что происходит в городе подробнее,2018-12-27 18:25:01,29378821,[]
2614,в карелии растет популярность разведения кроликов и пчел подробнее,2018-12-27 18:20:01,29378821,[]
2615,в петрозаводске установят мусорных контейнеров для сбора пластика подробнее,2018-12-27 18:00:01,29378821,[]
2616,петрозаводчанин обманул доверчивого незнакомца в баре подробнее,2018-12-27 17:40:02,29378821,[]
2617,бензин в петрозаводске продолжает дешеветь подробнее,2018-12-27 17:30:02,29378821,[]
2618,цифровая телесеть в карелии заработала в полном объеме заявили власти подробнее,2018-12-27 17:20:02,29378821,[]
2619,доходы карелии выросли почти на млрд рублей подробнее,2018-12-27 17:15:01,29378821,[]
2620,потепление гололед прогноз погоды на декабря подробнее,2018-12-27 17:00:01,29378821,[]
2621,теплоснабжение древлянки возобновлено подробнее,2018-12-27 16:50:01,29378821,[]
2622,карелия рискует лишиться почти тысяч гектаров защитных лесов подробнее,2018-12-27 16:40:01,29378821,[]
2623,группа депутатов покинула сессию горсовета медвежьегорска подробнее,2018-12-27 16:20:02,29378821,[]
2624,,2018-12-27 16:14:22,29378821,
2625,,2018-12-27 15:55:55,29378821,
2626,фото жители суоярви смеются над новогодним украшением елки в городе подробнее,2018-12-27 15:45:02,29378821,[]
2627,верховный суд карелии пересмотрит решение об аресте экс министра дмитрия матвийца подробнее,2018-12-27 15:35:02,29378821,[]
2628,,2018-12-27 15:26:54,29378821,
2629,в карелии рецидивисты украли у пенсионера снегоуборочную машину подробнее,2018-12-27 14:50:02,29378821,[]
2630,,2018-12-27 14:48:36,29378821,
2631,в сортавале может случиться социальный взрыв из за проблем с вывозом мусора заявила депутат подробнее,2018-12-27 14:30:01,29378821,[]
2632,жители петрозаводска смогут пройтись по облепиховой свернуть на клюквенную подробнее,2018-12-27 14:00:02,29378821,[]
2633,в карелии суд признал сотрудника управтодора виновным в получении взятки подробнее,2018-12-27 13:25:01,29378821,[]
2634,в карелии администрация одного из районов судилась с приставами подробнее,2018-12-27 13:10:02,29378821,[]
2635,сампо ру улетный интернет и тв без границ,2018-12-27 13:00:12,29378821,[]
2636,как благодаря офтальмологическому центру карелии в нашей республике развивается медицинский туризм подробнее,2018-12-27 12:25:02,29378821,[]
2637,правительство карелии провалило план по приватизации акций подробнее,2018-12-27 12:10:02,29378821,[]
2638,,2018-12-27 11:58:43,29378821,
2639,,2018-12-27 11:36:26,29378821,
2640,видео в петрозаводске столкнулись два автомобиля подробнее,2018-12-27 11:30:01,29378821,[]
2641,,2018-12-27 11:20:17,29378821,
2642,в магазине карелии обнаружили более кг опасного мяса подробнее,2018-12-27 10:55:01,29378821,[]
2643,в петрозаводске появится новый лестничный спуск подробнее,2018-12-27 10:50:02,29378821,[]
2644,,2018-12-27 09:56:41,29378821,
2645,карельские экологи назвали крупнейших арендаторов лесфонда республики подробнее,2018-12-27 09:50:01,29378821,[]
2646,в петрозаводске бывший зек украл для сына телефон на новый год подробнее,2018-12-27 09:30:01,29378821,[]
2647,мужчина украл млн рублей у пожилой жительницы карелии подробнее,2018-12-27 09:25:01,29378821,[]
2648,хозпостройка сгорела в карелии подробнее,2018-12-27 09:20:02,29378821,[]
2649,,2018-12-27 09:18:25,29378821,
2650,в районе карелии произошел серьезный пожар подробнее,2018-12-27 09:15:02,29378821,[]
2651,,2018-12-27 08:55:33,29378821,
2652,на пожаре в петрозаводске спасли двух человек подробнее,2018-12-27 08:50:01,29378821,[]
2653,в карелии пропал мужчина без зубов и со шрамом на носу подробнее,2018-12-27 08:20:02,29378821,[]
2654,два детских сада планируют открыть в петрозаводске в году подробнее,2018-12-27 08:05:02,29378821,[]
2655,какие события ожидаются в петрозаводске и карелии сегодня подробнее,2018-12-27 07:55:01,29378821,[]
2656,в петрозаводске за год по вине водителей автобусов пострадали человека подробнее,2018-12-27 07:35:01,29378821,[]
2657,страсть к спиртному толкнула петрозаводчанина на преступление подробнее,2018-12-27 07:25:02,29378821,[]
2658,минобороны намерено расторгнуть договор аренды с фирмой добывавшей песок в зоне сибиреязвенного скотомогильника в петрозаводске подробнее,2018-12-27 07:15:02,29378821,[]
2659,прогноз погоды для петрозаводска на сегодня декабря подробнее,2018-12-27 07:05:02,29378821,[]
2660,газета мк в карелии в году выходить не будет подробнее,2018-12-27 06:50:02,29378821,[]
2661,в карелии пенсионерка молотком раскурочила чужой автомобиль подробнее,2018-12-27 06:40:02,29378821,[]
2662,небольшой снег скользко прогноз погоды на декабря подробнее,2018-12-27 02:09:35,29378821,[]
2663,будем знать мфц петрозаводска начнут выдавать загранпаспорта подробнее,2018-12-27 01:00:01,29378821,[]
2664,поживем увидим мэрия петрозаводска заявила о готовности к заморозкам и нештатным ситуациям в праздники подробнее,2018-12-27 00:10:02,29378821,[]
2665,дожили петрозаводск назван в числе самых неэффективно управляемых городов россии подробнее,2018-12-27 00:00:02,29378821,[]
2666,внимание в четверг часть древлянки отключат от тепла и горячей воды подробнее,2018-12-26 23:30:03,29378821,[]
2667,к чему приводит порнозависимость подробнее,2018-12-26 23:30:02,29378821,[]
2668,есть идея адвокат попросил оправдать решетову по делу о гибели детей на сямозере подробнее,2018-12-26 23:00:02,29378821,[]
2669,смерть на работе мужчина погиб во время работ на карьере в прионежье подробнее,2018-12-26 22:30:02,29378821,[]
2670,самое важное за сегодня подробнее,2018-12-26 22:25:01,29378821,[]
