0,в калуге опять минируют здания по всему городу идет эвакуация похоже новая волна телефонных минеров сейчас эвакуируют трц европейский здание регионального правительства больницу больницу больница в сосновой роще травмпункт бсмп онкология в анненках железнодорожная больница районный суд фото от подписчиков дорожный патруль и правда калуги,2019-01-30 11:01:27,47908301,[]
1,после того как в калуге растаял снег,2019-02-01 16:47:00,47908301,[]
2,за вчерашний вечер в калуге на зебре сбили двух пешеходов напоминаем в темное время суток и в пасмурную погоду у водителей очень плохая видимость подробнее,2019-02-01 16:15:01,47908301,[]
3,,2019-02-01 15:15:01,47908301,
4,калуга загрузка весны начало фото от подписчика,2019-02-01 14:53:46,47908301,[]
5,парень шантажировал своего товарища его интимными фото подробнее,2019-02-01 13:16:00,47908301,[]
6,под купол бывшего крытого рынка переедет тюз огромного бассейна в центре города не будет подробнее,2019-02-01 12:30:03,47908301,[]
7,калуга улица кирова начало х годов видимо тоже все растаяло фото ф м егоровой,2019-02-01 12:00:13,47908301,[]
8,скидка на все тюльпаны в калуге тюльпаны по цене рублей вместо рублей самое время для приятных неожиданностей любимым тюльпанов ваша выгода тюльпанов ваша выгода тюльпанов ваша выгода акция действует с по февраля включительно в студии флористики и декора пыльца есть доставка адрес калуга ул к либкнехта чтобы получить промокод жми,2019-02-01 11:00:05,47908301,[]
9,очередное дтп на тарутинской минут назад собирается пробочка фото от подписчика,2019-02-01 10:38:01,47908301,[]
10,летняя калужанка пыталась ограбить храм святых бессребреников космы и дамиана подробнее,2019-02-01 10:17:00,47908301,[]
11,подходя к европейскому увидела такой ужас интересно лед сам с крыши сошел или нет фото от подписчицы,2019-02-01 09:54:38,47908301,[]
12,в жукове бешеная кошка напала на трех человек подробнее,2019-02-01 09:00:08,47908301,[]
13,как вам небо на кубяка фото кеша петелькин,2019-01-31 23:34:00,47908301,[]
14,среднесуточная температура на этой неделе будет выше нормы на,2019-01-31 22:30:02,47908301,[]
15,на мужчину с крыши упала глыба льда видео еще одна калужанка решила участвовать в кастинге ведущих в передачу орел и решка на площади победы девушка сбила пенсионера калужанин устроил драку в магазине на середе и другие новости калуги за сегодня,2019-01-31 22:00:10,47908301,[]
16,на тульской сбили пешехода фото мчс,2019-01-31 21:24:39,47908301,[]
17,почистили крышу ул московская возле магазина спутник видео от подписчика,2019-01-31 19:23:29,47908301,[]
18,улицы подвойского и воскресенскую предложили сделать пешеходными подробнее,2019-01-31 18:39:00,47908301,[]
19,дом циолковского именно в таком вот запущенном виде сейчас находится дом в котором жил великий советский пионер космонавтики фото,2019-01-31 18:00:17,47908301,[]
20,что подарить как удивить человека как сделать так чтобы было полезно и красиво не знаете ответы на эти вопросы не можете определиться с подарком мы знаем что вам необходимо заказать вкусный и оригинальный подарок можно у,2019-01-31 17:00:05,47908301,[]
21,у калужанина изъяли целый арсенал старинного оружия мужчина на протяжении ряда лет занимался раскопками в местах боевых действий времен великой отечественной войны подробнее,2019-01-31 16:08:08,47908301,[]
22,еще одна калужанка решила участвовать в кастинге ведущих в передачу орел и решка хочуврешку калужане поддержите репостом,2019-01-31 15:21:00,47908301,['хочуврешку']
23,калужанин устроил драку в магазине на середе все из за корзинки с едой подробнее,2019-01-31 14:33:00,47908301,[]
24,калужские дороги превращаются в реки видео павел вепринцев,2019-01-31 13:55:00,47908301,[]
25,макснет системы калуга обнинск балабаново подготовил специальное зимнее предложение абонентам макснет оплатившим годовой абонемент мы с радостью предоставим существенную скидку на услуги связи а также подарим один из классных подарков из лимитированной серии созданной с любовью и теплом специально для людей макснет подробности предложения уже на сайте,2019-01-31 12:55:00,47908301,[]
26,прямо сейчас на дедушку с крыши упала глыба льда видео прислал андрей алистаров осторожно мат,2019-01-31 12:24:59,47908301,[]
27,дтп на тарутинской в сторону холодильника пробка в обе стороны фото сергей кромский,2019-01-31 12:04:02,47908301,[]
28,кг роллов со скидкой огромный сочный гигасетище просто кусочков сего за рублей вместо нереально выгодно заказать онлайн,2019-01-31 11:04:01,47908301,[]
29,привет всем участникам группы нужен ваш совет ситуация такая в далекой далекой деревне калужской области сухиничского района живет моя бабушка лет ветеран труда ежемесячно ей и многим другим жителям деревни положены ветеранские выплаты в размере рублей проблема в том что эти выплаты уже который месяц не приносят ни ей ни остальным обладателям этого статуса деньги оседают в кармане заведующей отделением почты которая уже давно прокручивает непонятные схемы в отношении этих денег и судя по всему распоряжается ими на свое усмотрение никакие разговоры результата не дали человек хамит повышает тон в отношении стариков буквально доводя их до слез лично моей бабушке был задан вопрос тебе что пенсии мало бабушка пыталась лично разобраться многократно звонила в вышестоящие инстанции по сухиничскому району вопрос решался медленно но за ноябрь удалось выпросить свои же деньги принесли только ей и еще нескольким ветеранам информация достоверная поскольку в деревне все всех знают и у них сейчас это проблема номер преобладающему же большинству и по сей день эти выплаты не приносят в том числе и бабушке за крайние месяцы пожалуйста посоветуйте куда обращаться в этой ситуации нужно найти управу на заведующую почтой пожалуйста анонимно,2019-01-31 10:49:35,47908301,[]
30,на площади победы девушка сбила пенсионера подробнее,2019-01-31 10:30:04,47908301,[]
31,,2019-01-31 09:30:01,47908301,
32,бабушек и дедушек начали сдавать напрокат правда пока только в людиново и жиздре подробнее,2019-01-31 09:02:03,47908301,[]
33,сегодня гибдд устроит массовые проверки на трезвость для проверки будут останавливать все транспортные средства без исключения подробнее,2019-01-31 08:00:06,47908301,[]
34,если ваши отношения перешли все границы семейных отношений а совместная жизнь закончилась со всеми вытекающими проблемами мы окажем вам помощь по следующим направлениям расторжение брака раздел имущества кредитов супругов взыскание уменьшение алиментов установление оспаривание отцовства любые споры о детях определение места жительства и порядка общения с ребенком лишение родительских прав при этом оценим перспективу судебного решения подготовим все необходимые документы защитим ваши интересы в ходе судебного процесса ссылка на нашу группу сайт номер телефона,2019-01-31 07:00:01,47908301,[]
35,спокойной ночи калуга,2019-01-30 23:11:00,47908301,[]
36,массовая эвакуация в калуге игрок спартака георгий джикия помог калужскому собачьему приюту спасителю ребенка вручили грамоту прокуратура проверила калужский детский сад из которого летняя девочка смогла уйти без взрослых крик о помощи от подписчицы и другие новости калуги за сегодня,2019-01-30 22:00:13,47908301,[]
37,официальный комментарий полиции по поводу массового минирования зданий в калуге по итогам проверок информация указанная в сообщениях не подтвердились в настоящее время проводятся оперативные мероприятия по установлению инициаторов сообщений подробнее,2019-01-30 21:07:33,47908301,[]
38,в этот день лет назад родился известный советский режиссер леонид иович гайдай каждая его комедия настоящий шедевр полный юмора и в то же время имеющий социальное звучание любимыми героями фильмов гайдая является знаменитая троица балбес трус и бывалый в исполнении актеров юрия никулина георгия вицина и евгения моргунова а мы сегодня собрали для вас самые интересные и смешные кинокартины гайдая,2019-01-30 20:48:00,47908301,[]
39,,2019-01-30 19:47:00,47908301,
40,в россии вступили в силу поправки в закон о потребительском кредите и микрофинансовых организациях знать о них должен каждый подробнее,2019-01-30 19:23:00,47908301,[]
41,от анонимного подписчика из неподтвержденного источника стало известно что также был заминирован региональный центр скорой медицинской помощи и медицины катастроф или проще говоря скорая помощь находящаяся на улице кирова вопрос к руководителям данной организации почему не стали эвакуировать персонал и даже не сообщили сотрудникам об этом или на скорой помощи работают люди которых не жалко в случае таких ситуаций,2019-01-30 18:44:00,47908301,[]
42,массовые эвакуации идут по всей россии мы не одни такие подробнее,2019-01-30 18:07:04,47908301,[]
43,,2019-01-30 17:07:01,47908301,
44,эвакуация рядом с роддом в аннеках фото от подписчицы,2019-01-30 16:15:01,47908301,[]
45,крик о помощи от подписчицы семь деревень в дзержинском районе задыхаются от дыма все окутано едим дымом с резким запахом жженых перьев на птицефабрике что то жгут дети кашляют у взрослых голова болит кто смог уехал а кому некуда ехать барикадируются в домах ужас,2019-01-30 16:08:05,47908301,[]
46,,2019-01-30 15:08:01,47908301,
47,оцепление возле тц европейский для тех кто не в курсе видео от подписчицы,2019-01-30 14:33:16,47908301,[]
48,площадь победы год установка метровой статуи родины матери держащей в руках серебряную ленту реки оки и первый искусственный спутник земли как символ победы советского народа и в освоении космического пространства,2019-01-30 14:10:00,47908301,[]
49,,2019-01-30 13:10:01,47908301,
50,прокуратура проверила калужский детский сад из которого летняя девочка смогла уйти без взрослых трем должностным лицам вынесены выговоры подробнее,2019-01-30 12:05:07,47908301,[]
51,внимание только до конца января клубная карта на год фитнеса с сауной и хамамом за два огромных зала групповых программ просторный тренажерный зал с современным оборудованием детский центр сауны и хамамы мотивирующие и неравнодушные опытные тренеры и инструкторы достойный сервис собственный крытый паркинг лето не за горами пора готовиться узнать подробности можно онлайн или по телефону,2019-01-30 11:05:01,47908301,[]
52,в калуге автобусы не смогли вовремя выйти на маршруты автобусы работающие на метане не смогли вовремя пополнить запасы топлива простояв в километровой очереди на газовой заправке на силикатном подробнее,2019-01-30 10:24:06,47908301,[]
53,игрок спартака георгий джикия помог калужскому собачьему приюту подробнее,2019-01-30 09:23:00,47908301,[]
54,внимание в калуге пропала чуносова светлана владимировна лет вчера ушла в неизвестном направлении нуждается в медицинской помощи,2019-01-30 08:28:00,47908301,[]
55,награда нашла героя на днях в тарусе вручили грамоту игорю шамарину из саратова за гражданский подвиг игорь будучи в гостях у друга в тарусе декабря спас ребенка который попал в полынью на реке оке кто не в курсе игорь шамарин герой,2019-01-30 07:13:00,47908301,[]
56,около полуночи на гагарина из за неубранной снежной каши занесло и развернуло ваз в результате чего ваз зацепил микроавтобус казалось бы улица первой категории парадный въезд выезд из города высоту каши смотрите сами стыдоба фото сергей мальцев,2019-01-30 05:32:00,47908301,[]
57,доброй ночи калужане,2019-01-29 23:03:03,47908301,[]
58,в калуге летняя девочка сама ушла из детского садика названы адреса семи домов которые расселят в году зону платной парковки в центре калуги расширят до тысяч мест нарушений выявили газовщики в квартирах калужан калужский стоматолог покалечил видео и другие новости калуги за сегодня,2019-01-29 22:00:12,47908301,[]
59,в году в ремонт дорог в калуге было вложено миллионов рублей а вы все недовольные подробнее,2019-01-29 21:03:06,47908301,[]
60,калужский стоматолог покалечил от подписчицы калужане нужна помощь в распространении инфо калужский стоматолог загубил здоровье женщины которая теперь в отчаянии ей никто не может помочь все врачи отварачиваются минздрав тоже бездействует вика уже не знает что делать она борется за свою жизнь но никто не может помочь врачи как одна банда сговорились и между собой распространили инфо чтобы вику никто не принимал в клиниках калуги обнинска и даже в москве не проходите мимо нужно распространить инфо и самим не попасть в подобное может инфо дойдет куда выше и результатом будет реальная помощь здоровью вики,2019-01-29 19:05:50,47908301,[]
61,очередь за газом на силикатном наши подписчики жалуются что в калуге происходит что то странное с общественным транспортом автобусы городские и межгород не дождаться как оказалось все они стоят на силикатном на газовой заправке в очереди там же хлебокомбинатовские грузовики а причина этой очередищи простая одна из двух газовых заправок калуги та что на зерновой закрылась на ребрендинг,2019-01-29 18:37:00,47908301,[]
62,владелица резиновой квартиры пыталась откупиться от участкового за тысяч рублей не получилось подробнее,2019-01-29 18:17:00,47908301,[]
63,как вы уже знаете в калуге угорело три человека кто не в курсе что то они с вытяжкой колонки газовой напутали хотя не факт после чего губернатор распорядился провести тотальную проверку газового оборудования по квартирам пошли слесари и сопровождаюшие их лица я насчитал шесть человек на наш подъезд результат через квартиру нарушения отключены колонки надо менять хомуты гофр трубы и т п а теперь внимание чтобы подключить колонку обратно надо звонить газовикам те сообщают что надо заключать договор на обслуживание рублей оставлять заявку потом к вам придет слесарь который осуществит подключение за что тоже нужно заплатить это при том что за газ народ платит исправно газ подается в квартиры что собственно и является договором между потребителем и поставщиком с какого бодуна я должен еще куда то ехать чтобы заплатить им деньги может сами за деньгами то приедут автор виталий черников,2019-01-29 17:35:29,47908301,[]
64,подаренные москвой эвакуаторы станут донорами из х эвакуаторов полученных калугой в дар от московской мэрии оказались непригодны к эксплуатации подробнее,2019-01-29 16:52:00,47908301,[]
65,через года в калуге исчезнет очередь в детские сады а через вторая смена в школах подробнее,2019-01-29 16:05:04,47908301,[]
66,внимание только до конца января клубная карта на год фитнеса с сауной и хамамом за два огромных зала групповых программ просторный тренажерный зал с современным оборудованием детский центр сауны и хамамы мотивирующие и неравнодушные опытные тренеры и инструкторы достойный сервис собственный крытый паркинг лето не за горами пора готовиться узнать подробности можно онлайн или по телефону,2019-01-29 15:05:00,47908301,[]
67,оперативники перекрыли крупный канал сбыта наркотиков в калужскую область в гараже который злоумышленники использовали для хранения и фасовки наркотических веществ обнаружено выше кг метилэфедрон и кг индола подробнее,2019-01-29 14:47:00,47908301,[]
68,в калуге за отлов бродячих собак заплатят более млн рублей подробнее,2019-01-29 14:22:00,47908301,[]
69,как сообщает наш подписчик на гагарина встали троллейбусы движение затруднено причина дтп около б ц гагаринского с участием троллейбуса и внедорожника фото калуга инцидент и от подписчицы траллики маршрута разворачивается через сквер мира,2019-01-29 13:47:18,47908301,[]
