3900,видео во время детского конкурса талантов полуобнаженная девушка станцевала на пилоне подробнее,2018-12-11 21:30:03,29378821,[]
3901,дорожные войны в петрозаводске автомобиль сбил двух пешеходов подробнее,2018-12-11 21:15:02,29378821,[]
3902,мэр оказался не на той дороге иномарка сбила мэра питкяранты подробнее,2018-12-11 21:10:02,29378821,[]
3903,умные счетчики на газ обойдутся россиянам в млрд рублей подробнее,2018-12-11 21:05:02,29378821,[]
3904,что мог сделал директор мусорного регоператора в карелии ооо автоспецтранс решил уволиться подробнее,2018-12-11 20:50:02,29378821,[]
3905,половина россиянок заявили об угрозе стать жертвой насилия в семье подробнее,2018-12-11 20:40:01,29378821,[]
3906,шмаеник рассказала что власти карелии мешают многодетным семьям строить дома подробнее,2018-12-11 20:25:02,29378821,[]
3907,российский хоккеист умер прямо во время матча подробнее,2018-12-11 20:20:02,29378821,[]
3908,требуют наказать прокурор потребовал для экс депутата карелии гаврилова срок подробнее,2018-12-11 20:10:02,29378821,[]
3909,какие события ожидаются в петрозаводске и карелии завтра подробнее,2018-12-11 20:00:02,29378821,[]
3910,карелия не смогла потратить млн рублей на капремонт жилья подробнее,2018-12-11 19:50:02,29378821,[]
3911,кругом мошенники завершилось расследование уголовного дела в котором фигурирует карелия о хищении более млн рублей подробнее,2018-12-11 19:40:03,29378821,[]
3912,дана борисова ищет мужа подробнее,2018-12-11 19:40:02,29378821,[]
3913,самбурская и дробыш пожаловались на угрозы подробнее,2018-12-11 19:10:02,29378821,[]
3914,переходим на цифру стала известна точная дата отключения аналогового телевидения в карелии подробнее,2018-12-11 19:05:03,29378821,[]
3915,в карелии бизнесмены планируют увеличить инвестиции в замену изношенной техники подробнее,2018-12-11 19:05:02,29378821,[]
3916,,2018-12-11 19:00:12,29378821,
3917,инфляция в карелии ниже чем во многих регионах сзфо подробнее,2018-12-11 18:55:02,29378821,[]
3918,в петрозаводске женщина обокрала коллегу подробнее,2018-12-11 18:40:01,29378821,[]
3919,минстрой карелии объяснил почему собирается уходить директор ооо автоспецтранс подробнее,2018-12-11 18:35:02,29378821,[]
3920,директор карелэнерго уволился через месяца после назначения подробнее,2018-12-11 18:30:02,29378821,[]
3921,в карелии у мужчины отобрали рыбу подробнее,2018-12-11 18:20:02,29378821,[]
3922,в петрозаводске установят дополнительные контейнеры для раздельного сбора мусора подробнее,2018-12-11 18:00:02,29378821,[]
3923,доходы бюджета карелии выросли на млрд рублей подробнее,2018-12-11 17:50:02,29378821,[]
3924,в петрозаводске объявлен конкурс на лучшую новогоднюю иллюминацию подробнее,2018-12-11 17:40:02,29378821,[]
3925,лекцию о поп арте проведут в петрозаводске подробнее,2018-12-11 17:20:02,29378821,[]
3926,мороз гололедица прогноз погоды на декабря подробнее,2018-12-11 17:00:02,29378821,[]
3927,,2018-12-11 16:30:22,29378821,
3928,власти карелии решили провести комплексную экспертизу детсада на ленинградской за млн рублей подробнее,2018-12-11 16:30:02,29378821,[]
3929,в петрозаводске к новому году установят елей подробнее,2018-12-11 16:15:02,29378821,[]
3930,,2018-12-11 16:09:10,29378821,
3931,,2018-12-11 15:47:12,29378821,
3932,прокуратура добилась выплаты зарплаты работникам лечебно оздоровительного центра в карелии подробнее,2018-12-11 15:35:02,29378821,[]
3933,москалькова вручила юлии тубис из карелии награду подробнее,2018-12-11 15:20:02,29378821,[]
3934,,2018-12-11 15:11:17,29378821,
3935,политолог из карелии наблюдал за парламентскими выборами в армении подробнее,2018-12-11 14:55:02,29378821,[]
3936,жительница мурманской области нашла в поезде телефон жителя лоухского района и попала под суд подробнее,2018-12-11 14:50:02,29378821,[]
3937,в карелии к году завершится оценка ресурсов алмазов подробнее,2018-12-11 14:15:01,29378821,[]
3938,парфенчиков встретится с президентом республики беларусь подробнее,2018-12-11 14:10:01,29378821,[]
3939,в петрозаводске рецидивист пытался украсть из магазина бутылку водки подробнее,2018-12-11 13:45:02,29378821,[]
3940,энергетиков в карелии оштрафовали на тысяч рублей подробнее,2018-12-11 13:25:02,29378821,[]
3941,министр спорта из карелии попал на страницы финской газеты подробнее,2018-12-11 13:05:01,29378821,[]
3942,,2018-12-11 13:00:05,29378821,
3943,в перинатальном центре карелии родились двойняшки подробнее,2018-12-11 13:00:01,29378821,[]
3944,,2018-12-11 12:57:58,29378821,
3945,в петрозаводске поймали мужчину находившегося в федеральном розыске подробнее,2018-12-11 12:50:01,29378821,[]
3946,в петрозаводске обнаружили рыбу неизвестного происхождения подробнее,2018-12-11 12:35:01,29378821,[]
3947,около млн рублей потратят на освещение дорог в карелии подробнее,2018-12-11 12:25:02,29378821,[]
3948,,2018-12-11 12:15:19,29378821,
3949,возбуждено дело о мошенничестве при реконструкции детсада в петрозаводске подробнее,2018-12-11 12:05:02,29378821,[]
3950,в карелии приставы взыскали с должников более полумиллиона рублей за неделю подробнее,2018-12-11 12:00:01,29378821,[]
3951,джентельмен из бара обокрал петрозаводчанку подробнее,2018-12-11 11:50:02,29378821,[]
3952,,2018-12-11 11:35:44,29378821,
3953,скончалась экс глава территориального фонда омс карелии подробнее,2018-12-11 11:35:02,29378821,[]
3954,прокуратура объявила предостережение директору детсада петрозаводска где детей могли отчислить за плохое поведение подробнее,2018-12-11 11:25:02,29378821,[]
3955,власти намерены урезать выдачу древесины жителям карелии подробнее,2018-12-11 11:10:01,29378821,[]
3956,в петрозаводске мужчины пытались разобрать ж д пути подробнее,2018-12-11 11:05:01,29378821,[]
3957,,2018-12-11 11:00:32,29378821,
3958,запуск туристической ласточки ударит по жителям карельского приладожья работающим в ленобласти подробнее,2018-12-11 11:00:02,29378821,[]
3959,,2018-12-11 10:53:29,29378821,
3960,иномарка сбила мэра питкяранты вышедшую из администрации подробнее,2018-12-11 10:40:01,29378821,[]
3961,завершаются учения энергетиков карелия подробнее,2018-12-11 10:25:02,29378821,[]
3962,видео ужасное дтп произошло в районе карелии подробнее,2018-12-11 10:15:02,29378821,[]
3963,в карелии лесовоз съехал в кювет пострадал один человек подробнее,2018-12-11 10:10:02,29378821,[]
3964,в петрозаводске автомобиль сбил двух пешеходов подробнее,2018-12-11 09:50:02,29378821,[]
3965,юные рецидивисты украли наборы конструктора в петрозаводске чтобы поиграть дома подробнее,2018-12-11 09:45:01,29378821,[]
3966,,2018-12-11 09:43:02,29378821,
3967,таможенники будут проводить ветеринарный и фитосанитарный контроль в вяртсиля подробнее,2018-12-11 09:40:02,29378821,[]
3968,видео полиция петрозаводска разыскивает двух мужчин подозреваемых в краже подробнее,2018-12-11 09:35:02,29378821,[]
3969,видео в центре петрозаводска столкнулись два автомобиля подробнее,2018-12-11 09:30:01,29378821,[]
3970,,2018-12-11 09:28:41,29378821,
3971,в карелии врачи санавиации доставили в больницу беременную женщину с кровотечением подробнее,2018-12-11 09:25:02,29378821,[]
3972,директор мусорного регоператора ооо автоспецтранс уволился подробнее,2018-12-11 09:20:02,29378821,[]
3973,,2018-12-11 09:15:07,29378821,
3974,,2018-12-11 09:05:43,29378821,
3975,житель карелии случайно поджег себя подробнее,2018-12-11 09:05:01,29378821,[]
3976,карелия не вошла в число регионов лидеров по отсутствию вредных привычек подробнее,2018-12-11 09:00:02,29378821,[]
3977,завершилось расследование уголовного дела в котором фигурирует карелия о хищении более млн рублей подробнее,2018-12-11 08:40:02,29378821,[]
3978,прокурор потребовал для экс депутата карелии гаврилова срок подробнее,2018-12-11 08:20:02,29378821,[]
3979,парфенчиков обсудил с секретарем совбеза подготовку к юбилею карелии подробнее,2018-12-11 08:05:01,29378821,[]
3980,,2018-12-11 08:00:04,29378821,
3981,какие события ожидаются в петрозаводске и карелии сегодня подробнее,2018-12-11 07:55:02,29378821,[]
3982,в карелии за год выявили более нарушений коррупционного характера подробнее,2018-12-11 07:25:02,29378821,[]
3983,стала известна точная дата отключения аналогового телевидения в карелии подробнее,2018-12-11 07:15:01,29378821,[]
3984,погода в петрозаводске сегодня декабря подробнее,2018-12-11 07:05:01,29378821,[]
3985,на ремонт мемориальных комплексов в карелии потратят более млн рублей подробнее,2018-12-11 06:40:02,29378821,[]
3986,халатность в петрозаводске начальник полиции уволился после истории с маньяком подробнее,2018-12-11 01:05:02,29378821,[]
3987,мокрый снег туман прогноз погоды на декабря подробнее,2018-12-11 01:04:00,29378821,[]
3988,свершилось чудо парфенчиков сообщил о первых родах в новом перинатальном центре петрозаводска подробнее,2018-12-11 00:45:02,29378821,[]
3989,издевательство над детьми в детсаду петрозаводска родителям угрожают отчислить детей за плохое поведение подробнее,2018-12-11 00:20:02,29378821,[]
3990,огромная потеря умер кот фото которого облетели все сми карелии и экспонировались в музее подробнее,2018-12-10 23:55:02,29378821,[]
3991,еще один коррупционер экс начальник управления автодорог карелии отправляется под суд за систематическое взяточничество подробнее,2018-12-10 23:35:02,29378821,[]
3992,ученые рассказали о женщинах любящих жесткий секс подробнее,2018-12-10 23:30:02,29378821,[]
3993,деньги не вернем суд отменил решение о возврате денег экс замминистра карелии подробнее,2018-12-10 23:10:02,29378821,[]
3994,новая должность рогалевич стал работать в подведомственном мэрии петрозаводска учреждении подробнее,2018-12-10 22:50:02,29378821,[]
3995,новый маршрут в ржд раскрыли стоимость билета на ласточку от петербурга до рускеалы подробнее,2018-12-10 22:45:02,29378821,[]
3996,важные новости декабря подробнее,2018-12-10 22:25:02,29378821,[]
3997,удобное передвижение двухэтажный поезд запустят по маршруту петрозаводск москва подробнее,2018-12-10 22:05:02,29378821,[]
3998,почти российских врачей получали указания навязывать платные услуги подробнее,2018-12-10 22:00:02,29378821,[]
3999,обидели пенсионеров в карелии снизился реальный размер пенсии подробнее,2018-12-10 21:35:02,29378821,[]
4000,порноактриса елена беркова развелась с пятым мужем подробнее,2018-12-10 21:30:01,29378821,[]
4001,ужасная авария две иномарки столкнулись у леруа мерлен в петрозаводске подробнее,2018-12-10 21:10:02,29378821,[]
4002,правительство запретило продавать боярышник дешевле алкоголя подробнее,2018-12-10 21:05:02,29378821,[]
4003,новый подход в минфине карелии назвали причины отмены налоговых льгот подробнее,2018-12-10 20:45:02,29378821,[]
4004,врачам и учителям хотят запретить принимать подарки подробнее,2018-12-10 20:40:02,29378821,[]
4005,обслуживание карт банки готовятся к отключению от систем и с подробнее,2018-12-10 20:35:03,29378821,[]
4006,алексей панин попал в аварию в москве подробнее,2018-12-10 20:25:02,29378821,[]
4007,эксперты из карелии назвали последствия иллюзии лесного изобилия подробнее,2018-12-10 20:20:01,29378821,[]
4008,спасли детей крупный пожар произошел ночью в жилом доме петрозаводска подробнее,2018-12-10 20:15:03,29378821,[]
4009,в карелии лишь треть дорог находится в нормативном состоянии подробнее,2018-12-10 20:15:02,29378821,[]
4010,какие события ожидаются в петрозаводске и карелии завтра подробнее,2018-12-10 20:00:02,29378821,[]
4011,работа полным ходом сегодня в новом здании республиканского перинатального центра примут первые роды подробнее,2018-12-10 19:50:02,29378821,[]
4012,яндекс назвал самые популярные запросы года подробнее,2018-12-10 19:40:02,29378821,[]
4013,снова в путешествие парфенчиков уехал в москву а потом отправится в беларусь подробнее,2018-12-10 19:25:02,29378821,[]
4014,на заблокированы выпуски шоу басты подробнее,2018-12-10 19:10:02,29378821,[]
4015,смотри как это было в петрозаводске на перекрестке жестко столкнулись два автомобиля подробнее,2018-12-10 19:00:02,29378821,[]
4016,обанкроченный отз продолжит отапливать петрозаводск подробнее,2018-12-10 18:55:02,29378821,[]
4017,суд отменил решение о возврате денег экс замминистра карелии подробнее,2018-12-10 18:45:02,29378821,[]
4018,гражданин финляндии пытался ввезти в карелию копыто лося с костью подробнее,2018-12-10 18:40:02,29378821,[]
4019,уровень заболеваемости орви в карелии превышен на подробнее,2018-12-10 18:20:02,29378821,[]
4020,в карелии снизился реальный размер пенсии подробнее,2018-12-10 18:05:02,29378821,[]
4021,житель карелии насмерть забил собственную жену подробнее,2018-12-10 18:00:02,29378821,[]
4022,сотрудников мвд в карелии уличили в незаконном присвоении денег подробнее,2018-12-10 17:55:01,29378821,[]
4023,аэропорт петрозаводск рассматривает возможность запуска рейсов в турцию египет и на кипр подробнее,2018-12-10 17:50:02,29378821,[]
4024,чиновники мэрии петрозаводска отчитаются за работы по благоустройству подробнее,2018-12-10 17:45:02,29378821,[]
4025,в минфине карелии назвали причины отмены налоговых льгот подробнее,2018-12-10 17:40:02,29378821,[]
4026,банки готовятся к отключению от систем и с подробнее,2018-12-10 17:25:02,29378821,[]
4027,самая известная финская исполнительница на декакорде впервые выступит в петрозаводске подробнее,2018-12-10 17:20:01,29378821,[]
4028,мокрый снег туман прогноз погоды на декабря подробнее,2018-12-10 17:00:02,29378821,[]
4029,в карелии за год нашли и захоронили более советских воинов подробнее,2018-12-10 16:55:02,29378821,[]
4030,разыскиваемый полицией мужчина украл из магазина петрозаводска набор автотоваров подробнее,2018-12-10 16:35:02,29378821,[]
4031,,2018-12-10 16:23:39,29378821,
4032,финские пограничники изъяли у россиян ножи подробнее,2018-12-10 16:20:02,29378821,[]
4033,пьяному дебоширу из карелии вызвали скорую помощь подробнее,2018-12-10 16:15:01,29378821,[]
4034,петрозаводск в ближайшие года станет безопасней и комфортней благодаря народной программе подробнее,2018-12-10 16:00:02,29378821,[]
4035,,2018-12-10 15:35:48,29378821,
4036,в ржд раскрыли стоимость билета на ласточку от петербурга до рускеалы подробнее,2018-12-10 15:30:02,29378821,[]
4037,жители сортавалы отправились под арест за кражу тонны форели подробнее,2018-12-10 15:20:01,29378821,[]
4038,в петрозаводске начальник полиции уволился после истории с серийным убийцей подробнее,2018-12-10 15:10:02,29378821,[]
4039,,2018-12-10 15:02:01,29378821,
4040,,2018-12-10 14:53:53,29378821,
4041,,2018-12-10 14:50:19,29378821,
4042,сотрудники мэрии не могут удалить наледь вокруг родника в петрозаводске подробнее,2018-12-10 14:30:01,29378821,[]
4043,санаторий марциальные воды рассказал почему сложилась негативная ситуация с отоплением поселка подробнее,2018-12-10 14:25:01,29378821,[]
4044,в карелии сгорел частный дом подробнее,2018-12-10 14:20:02,29378821,[]
4045,уважаемые петрозаводчане и гости столицы в магазине салоне дом дверей пополнение складской программы снижение цены от производителя на записаться на замер можно по телефону современный двухэтажный магазин салон дом дверей приглашает за покупкам и и предлагает воспользоваться специальными предложениями приходите и оцените огромный ассортимент дверей из пвх покрытий и натурального шпона а также новинку коллекцию уникальных дверей с покрытием в наличии стальные входные двери межкомнатные арки фурнитура достоинства наших дверей высокое качество всей продукции современный дизайн применение экологически чистых материалов влагостойкость покрытия отсутствие разнотона у полотен и погонажа устойчивость к загрязнениям используется коробка с уплотнителем что повышает тепло и шумоизоляцию дверной конструкции возможность выбора цвета привлекательные цены,2018-12-10 14:10:00,29378821,[]
4046,власти инициируют проверку карелэнергоресурса после остановки котельных в лоухском районе подробнее,2018-12-10 13:45:01,29378821,[]
4047,энергетики продолжают ремонты по увеличению надежности работы лэп подробнее,2018-12-10 13:20:01,29378821,[]
4048,пьяный мужчина запугал продавщицу осколком стекла и обокрал магазин в карелии подробнее,2018-12-10 13:15:02,29378821,[]
4049,парфенчиков сообщил о первых родах в новом перинатальном центре петрозаводска подробнее,2018-12-10 13:10:02,29378821,[]
4050,правительство карелии передает в федеральную собственность бывшие здания природного парка валаамский архипелаг подробнее,2018-12-10 13:05:02,29378821,[]
4051,акция от сампо ру год интернета и цифровое тв бесплатно,2018-12-10 13:00:12,29378821,[]
4052,три компании будут вывозить мусор в петрозаводске подробнее,2018-12-10 13:00:02,29378821,[]
4053,в детсаду петрозаводска родителям угрожают отчислить детей за плохое поведение подробнее,2018-12-10 12:55:02,29378821,[]
