Вниманию автолюбителей: кольцо у танка снова главная дорога  http://lipetskcity.ru/iblock/news/e/vnimaniju_avtoljubitelej_kolco_u_tanka_snova_glavnaja_doroga_26-01-2019/№%:№%:2019-01-26 12:18:21№%:№%:60460495
#здоровыйрегион #липецкаяобласть #ЗдоровыйрегионгородЛипецк#ЭтоНужноЗнатьКаждому Липчане выйдут на «Лыжню России - 2019» http://lipetskcity.ru/iblock/news/e/lipchane_vijdut_na__lizhnju_rossii__2019__01-02-2019/№%:№%:2019-02-01 17:00:01№%:№%:60460495
В рамках аварийного ремонта привели в порядок свыше 2 тысяч м2 липецких дорог  http://lipetskcity.ru/iblock/news/e/v_ramkah_avarijnogo_remonta_priveli_v_porjadok_svishe_2_tisjach_m2_lipeckih_dorog__01-02-2019/№%:№%:2019-02-01 16:44:50№%:№%:60460495
#здоровыйрегион #липецкаяобласть #ЗдоровыйрегионгородЛипецк#ЭтоНужноЗнатьКаждому Легендарная фигуристка Ирина Роднина встретится с тренерами юных липецких спортсменов  http://lipetskcity.ru/iblock/news/e/legendarnaja_figuristka_irina_rodnina_vstretitsja_s_trenerami_junih_lipeckih_sportsmenov_01-02-2019/№%:№%:2019-02-01 15:40:15№%:№%:60460495
Юных липчан приглашают на День Пришвина http://lipetskcity.ru/iblock/news/e/junih_lipchan_priglashajut_na_den_prishvina_01-02-2019/№%:№%:2019-02-01 15:28:46№%:№%:60460495
Частный сектор районов ЛТЗ и Заречья останется без электричества http://lipetskcity.ru/iblock/news/e/chastnij_sektor_rajonov_ltz_i_zarechja_ostanetsja_bez_jelektrichestva01-02-2019/№%:№%:2019-02-01 14:43:20№%:№%:60460495
Стартовал очередной конкурс по выдаче субсидий НКО  http://lipetskcity.ru/iblock/news/e/startoval_ocherednoj_konkurs_po_vidache_subsidij_nko_01-02-2019/№%:№%:2019-02-01 14:25:29№%:№%:60460495
Большие перемены в микрорайоне «Университетский» вынесли на публичные слушания  http://lipetskcity.ru/iblock/news/e/bolshie_peremeni_v_mikrorajone_universitetskij_vinesli_na_publichnie_slushanija_31-01-2019/№%:№%:2019-01-31 17:23:15№%:№%:60460495
#здоровыйрегион #липецкаяобласть #ЗдоровыйрегионгородЛипецк#ЭтоНужноЗнатьКаждому Липчанам предлагают выбрать место для будущего скейт-парка http://lipetskcity.ru/iblock/news/e/lipchanam_predlagajut_vibrat_mesto_dlja__budushhego_skejtparka__31-01-2019/№%:№%:2019-01-31 16:56:44№%:№%:60460495
Московский виртуоз привезёт в Липецк романтику Франции http://lipetskcity.ru/iblock/news/e/moskovskij_virtuoz_privezjot_v_lipeck_romantiku_francii_31-01-2019/№%:№%:2019-01-31 14:15:40№%:№%:60460495
В 2019 году преобразятся 35 дворов Липецка  http://lipetskcity.ru/iblock/news/e/v_2019_godu_preobrazjatsja_35__dvorov_lipecka31-01-2019/№%:№%:2019-01-31 13:40:15№%:№%:60460495
Объёмы работ по капитальному ремонту МКД на 2019 год обсудили в администрации Липецка http://lipetskcity.ru/iblock/news/e/objomi_rabot_po_kapitalnomu_remontu_mkd_na_2019_god_obsudili_v_administracii_lipecka30-01-2019/№%:№%:2019-01-31 08:43:07№%:№%:60460495
Какой театр интересен современному зрителю? http://lipetskcity.ru/iblock/news/e/kakoj__teatr_interesen_sovremennomu_zritelju_30-01-2019/№%:№%:2019-01-30 17:51:41№%:№%:60460495
Рыболовов призывают помочь предотвратить замор рыбы на водоемах города  http://lipetskcity.ru/iblock/news/e/ribolovov_prizivajut_pomoch_predotvratit_zamor_ribi_na_vodoemah_goroda_30-01-2019/№%:№%:2019-01-30 17:29:18№%:№%:60460495
Без холодной воды останутся несколько улиц и ряд учреждений Липецка http://lipetskcity.ru/iblock/news/e/bez_holodnoj_vodi_ostanutsja_neskolko_ulic_i_rjad_uchrezhdenij_lipecka_30-01-2019/№%:№%:2019-01-30 15:39:57№%:№%:60460495
Сергей Иванов: Это провокация, которая подтвердила профессионализм профильных служб и руководителей учреждений  http://lipetskcity.ru/iblock/news/e/sergej_ivanov_jeto_provokacija_kotoraja_podtverdila_professionalizm_profilnih_sluzhb_i_rukovoditelej_uchrezhdenij_30-01-2019/№%:№%:2019-01-30 15:01:01№%:№%:60460495
Липчан призывают быть бдительнее  http://lipetskcity.ru/iblock/news/e/lipchan_prizivajut_bit_bditelnee_30-01-2019/№%:№%:2019-01-30 11:34:44№%:№%:60460495
Через 2,5 месяца Липецк перейдёт на цифровое телевещание. В мэрии обсудили, насколько горожане готовы к переменам http://lipetskcity.ru/iblock/news/e/cherez_25_mesjaca_lipeck_perejdjot_na_cifrovoe_televeshhanie_v_mjerii_obsudili_naskolko_gorozhane_gotovi_k_peremenam_29-01-2019/№%:№%:2019-01-29 17:59:54№%:№%:60460495
В Липецке выберут лучшего учителя http://lipetskcity.ru/iblock/news/e/v_lipecke_viberut_luchshego_uchitelja29-01-2019/№%:№%:2019-01-29 17:56:25№%:№%:60460495
Прием заявлений на обучение в первом классе начнется 1 февраля  http://lipetskcity.ru/iblock/news/e/priem_zajavlenij_na_obuchenie_v_pervom_klasse_nachnetsja_1_fevralja_29-01-2019/№%:№%:2019-01-29 17:20:37№%:№%:60460495
Микробы для очистки отопительных систем и онлайн проверка домашних заданий - встреча с резидентами Сколково состоялась в мэрии http://lipetskcity.ru/iblock/news/e/mikrobi_dlja_ochistki_otopitelnih_sistem_i_onlajn_proverka_domashnih_zadanij__vstrecha_s_rezidentami_skolkovo_sostojalas_v_mjerii_29-01-2019/№%:№%:2019-01-29 16:45:16№%:№%:60460495
Сотни тонн песка, десятки единиц техники и целый штат специалистов – Липецк готовится к пропуску паводковых вод  http://lipetskcity.ru/iblock/news/e/sotni_tonn_peska_desjatki_edinic_tehniki_i_celij_shtat_specialistov__lipeck_gotovitsja_k_propusku_pavodkovih_vod_29-01-2019/№%:№%:2019-01-29 16:17:44№%:№%:60460495
Изменилась стоимость услуги по обращению с твердыми коммунальными отходами для жителей частных домов http://lipetskcity.ru/iblock/news/e/izmenilas_stoimost_uslugi_po_obrashheniju_s_tverdimi_kommunalnimi_othodami_dlja_zhitelej_chastnih_domov29-01-2019/№%:№%:2019-01-29 15:22:20№%:№%:60460495
Продолжить обновление спецтехники для уборки города планируют в Липецке http://lipetskcity.ru/iblock/news/e/prodolzhit_obnovlenie_spectehniki_dlja_uborki_goroda_planirujut_v_lipecke28-01-2019/№%:№%:2019-01-29 08:53:05№%:№%:60460495
В городе готовятся к большому весеннему паводку http://lipetskcity.ru/iblock/news/e/v_gorode_gotovjatsja_k_bolshomu_vesennemu_pavodku_28-01-2019/№%:№%:2019-01-29 08:51:43№%:№%:60460495
Липчан приглашают на выставку французского кружева http://lipetskcity.ru/iblock/news/e/lipchan_priglashajut_na_vistavku_francuzskogo_kruzheva__28-01-2019/№%:№%:2019-01-28 17:31:34№%:№%:60460495
Формируется пятый состав Молодежного правительства Липецка http://lipetskcity.ru/iblock/news/e/formiruetsja_pjatij_sostav_molodezhnogo_pravitelstva_lipecka28-01-2019/№%:№%:2019-01-28 17:15:27№%:№%:60460495
Подвиг Ленинграда вспоминали в библиотеках Липецка  http://lipetskcity.ru/iblock/news/e/podvig_leningrada_vspominali_v_bibliotekah_lipecka___28-01-2019/№%:№%:2019-01-28 14:58:42№%:№%:60460495
#здоровыйрегион #липецкаяобласть #ЗдоровыйрегионгородЛипецк#ЭтоНужноЗнатьКаждому Липецкие спортсмены проплыли 265 км  http://lipetskcity.ru/iblock/news/e/lipeckie_sportsmeni_proplili_265_km_28-01-2019/№%:№%:2019-01-28 14:16:19№%:№%:60460495
№%:№%:2019-01-28 13:58:08№%:№%:60460495
Отключения электроэнергии и питьевой воды: адреса http://lipetskcity.ru/iblock/news/e/otkljuchenija_jelektrojenergii_i_pitevoj_vodi_adresa28-01-2019/№%:№%:2019-01-28 13:37:49№%:№%:60460495
Липчан приглашают на краеведческую конференцию в честь юбилея региона http://lipetskcity.ru/iblock/news/e/lipchan_priglashajut_na_kraevedcheskuju_konferenciju_v_chest_jubileja_regiona_28-01-2019/№%:№%:2019-01-28 11:19:43№%:№%:60460495
Городские службы в круглосуточном режиме устраняют последствия снегопада  http://lipetskcity.ru/iblock/news/e/gorodskie_sluzhbi_v_kruglosutochnom_rezhime_ustranjajut_posledstvija_snegopada__28-01-2019/№%:№%:2019-01-28 10:53:50№%:№%:60460495
#здоровыйрегион #липецкаяобласть #ЗдоровыйрегионгородЛипецк#ЭтоНужноЗнатьКаждому "Умники 48" сразятся за шахматной доской http://lipetskcity.ru/iblock/news/zdorovij_region/e/umniki_48_srazjatsja_za_shahmatnoj_doskoj_28-01-2019/№%:№%:2019-01-28 10:33:05№%:№%:60460495
#здоровыйрегион #липецкаяобласть #ЗдоровыйрегионгородЛипецк#ЭтоНужноЗнатьКаждому Школьники города выйдут на лыжную гонку http://lipetskcity.ru/iblock/news/zdorovij_region/e/shkolniki_goroda_vijdut_na_lizhnuju_gonku_28-01-2019/№%:№%:2019-01-28 10:30:27№%:№%:60460495
#здоровыйрегион #липецкаяобласть #ЗдоровыйрегионгородЛипецк#ЭтоНужноЗнатьКаждому Где, когда и сколько стоит покататься на коньках? http://lipetskcity.ru/iblock/news/zdorovij_region/e/gde_kogda_i_skolko_stoit_pokatatsja_na_konkah_28-01-2019/№%:№%:2019-01-28 10:25:11№%:№%:60460495
#здоровыйрегион #липецкаяобласть #ЗдоровыйрегионгородЛипецк#ЭтоНужноЗнатьКаждому «Студеновский» приглашает липчан поиграть в пинг-понг и дартс http://lipetskcity.ru/iblock/news/zdorovij_region/e/studenovskij_priglashaet_lipchan_poigrat_v_pingpong_i_darts_28-01-2019/№%:№%:2019-01-28 10:21:55№%:№%:60460495
27 января - День полного освобождения советскими войсками города Ленинграда от блокады его немецко-фашистскими войсками (1944 год).Подробнее об этой и других славных страницах истории Отечества на сайте Российского военно-исторического общества https://histrf.ru/lenta-vremeni/event/view/dien-sniatiia-blokady-ghoroda-lieninghrada№%:№%:2019-01-27 20:44:59№%:№%:60460495
Городские службы готовятся к сильному снегопаду lipetskcity.ru/iblock/news/e/gorslyzhb/№%:№%:2019-01-25 19:12:42№%:№%:60460495
В администрации Липецка ищут способы решения проблемы неприятного запаха в районе ЛТЗ http://lipetskcity.ru/iblock/news/e/v_administracii_lipecka_ishhut_sposobi_reshenija_problemi_neprijatnogo_zapaha_v_rajone_ltz25-01-2019/№%:№%:2019-01-25 15:44:50№%:№%:60460495
В работу маршрутов № 7 и 2Т вносят изменения http://lipetskcity.ru/iblock/news/e/v_rabotu_marshrutov__7_i_2t_vnosjat_izmenenija_25-01-2019/№%:№%:2019-01-25 14:57:47№%:№%:60460495
Отключение холодной воды: адреса на завтра http://lipetskcity.ru/iblock/news/e/otkljuchenie_holodnoj_vodi_adresa_na_zavtra25-01-2019/№%:№%:2019-01-25 11:54:42№%:№%:60460495
В художественной школе имени Виктора Сорокина проведут противоаварийный ремонт  http://lipetskcity.ru/iblock/news/e/v_hudozhestvennoj_shkole_imeni_viktora_sorokina_provedut_protivoavarijnij_remont_25-01-2019/№%:№%:2019-01-25 11:54:12№%:№%:60460495
Липецкие библиотекари составили рейтинг самых популярных книг http://lipetskcity.ru/iblock/news/e/lipeckie_bibliotekari_sostavili_rejting_samih_populjarnih_knig25-01-2019/№%:№%:2019-01-25 11:48:01№%:№%:60460495
Градостроители и активные липчане обсудили реконструкцию проспекта Победы http://lipetskcity.ru/iblock/news/e/gradostroiteli_i_aktivnie_lipchane_obsudili_rekonstrukciju_prospekta_pobedi24-01-2019/№%:№%:2019-01-24 18:10:57№%:№%:60460495
Тротуар - не парковка. Сотрудники управлений ГИБДД и Советским округом провели рейд в центре города  http://lipetskcity.ru/iblock/news/e/trotuar__ne_parkovka_sotrudniki_upravlenij_gibdd_i_sovetskim_okrugom_proveli_rejd_v_centre_goroda_24-01-2019/№%:№%:2019-01-24 17:00:07№%:№%:60460495
#здоровыйрегион #липецкаяобласть #ЗдоровыйрегионгородЛипецк#ЭтоНужноЗнатьКаждому В Липецке началась подготовка к «Лыжне России-2019» http://lipetskcity.ru/iblock/news/e/v_lipecke_nachalas_podgotovka_k_lizhne_rossii2019_24-01-2019/№%:№%:2019-01-24 15:46:01№%:№%:60460495
👍🏻 Поддержи трех липецких предпринимателей в голосовании за победу в национальной премии «Немалый Бизнес», которые по результатам  отбора жюри вошли в топ - 100.    📅Голосование продлится до 27 января!    Поддержим наших ребят и Липецкую область! Они достойны победы🏆  💥Номинация "Добрый бизнес" - Евгений Литаврин https://vote.nemaliy.biz/kind-business/evgeniy-litavrin  💥Номинация "Инновационный прорыв" - Виктор Никифоров https://vote.nemaliy.biz/innovation-breakthrough/vikt..  💥Номинация "Стремительный рост" - Кирилл Петров https://vote.nemaliy.biz/fast-growth/kirill-petrov    #голосуемзаЛипецкихпредпринимателей #поддержимлипецких #немалыйбизнес№%:№%:2019-01-24 15:05:05№%:№%:60460495
Квест «С чего начинается Родина?» объединит порядка ста юных липчан  http://lipetskcity.ru/iblock/news/e/kvest__s_chego_nachinaetsja_rodina_obedinit_porjadka_sta_junih_lipchan_24-01-2019/№%:№%:2019-01-24 11:46:55№%:№%:60460495
Последствия снегопада устраняют более ста единиц спецтехники  http://lipetskcity.ru/iblock/news/e/posledstvija_snegopada_ustranjajut_bolee_sta_edinic_spectehniki_24-01-2019/№%:№%:2019-01-24 10:44:29№%:№%:60460495
Музей народного и декоративно-прикладного искусства открывает Год театра http://lipetskcity.ru/iblock/news/e/muzej_narodnogo_i_dekorativnoprikladnogo_iskusstva_otkrivaet_god_teatra__24-01-2019/№%:№%:2019-01-24 09:18:43№%:№%:60460495
#здоровыйрегион #липецкаяобласть #ЗдоровыйрегионгородЛипецк#ЭтоНужноЗнатьКаждому Мобильный клуб молодых семей в гостях у регионального Союза женщин http://lipetskcity.ru/iblock/news/e/mobilnij_klub_molodih_semej_v_gostjah_u_regionalnogo_sojuza_zhenshhin_23-01-2019/№%:№%:2019-01-23 17:24:57№%:№%:60460495
Липецкий Дом музыки приглашает полистать «Золотые страницы»  http://lipetskcity.ru/iblock/news/e/lipeckij_dom_muziki_priglashaet_polistat_zolotie_stranici23-01-2019/№%:№%:2019-01-23 17:19:52№%:№%:60460495
Юбилей региона, ЗОЖ и Год театра – липецкие умники и умницы сразились в интеллектуальном турнире http://lipetskcity.ru/iblock/news/e/jubilej_regiona_zozh_i_god_teatra__lipeckie_umniki_i_umnici_srazilis_v_intellektualnom_turnire23-01-2019/№%:№%:2019-01-23 17:03:25№%:№%:60460495
Председателем департамента градостроительства и архитектуры назначен Александр Ковалев  http://lipetskcity.ru/iblock/news/e/predsedatelem_departamenta_gradostroitelstva_i_arhitekturi_naznachen_aleksandr_kovalev_23-01-2019/№%:№%:2019-01-23 15:25:58№%:№%:60460495
Заявление на социальную выплату участники подпрограммы «Ипотечное жилищное кредитование» могут подать до 28 февраля  http://lipetskcity.ru/iblock/news/e/zajavlenie_na_socialnuju_viplatu_uchastniki_podprogrammi_ipotechnoe_zhilishhnoe_kreditovanie_mogut_podat_do_28_fevralja_23-01-2019/№%:№%:2019-01-23 15:08:44№%:№%:60460495
В Липецке начали демонтировать новогоднюю иллюминацию http://lipetskcity.ru/iblock/news/e/v_lipecke_nachali_demontirovat_novogodnjuju_illjuminaciju23-01-2019/№%:№%:2019-01-23 13:00:00№%:№%:60460495
Новый год в МУП «Липецкий пассажирский транспорт» начинается с вручения ключей от новой техники  http://lipetskcity.ru/iblock/news/e/novij_god_v_mup_lipeckij_passazhirskij_transport_nachinaetsja_s_vruchenija_kljuchej_ot_novoj_tehniki_23-01-2019/№%:№%:2019-01-23 12:46:58№%:№%:60460495
#здоровыйрегион #липецкаяобласть #ЗдоровыйрегионгородЛипецк#ЭтоНужноЗнатьКаждому Липчане успешно выступили на соревнованиях по спортивному туризму http://lipetskcity.ru/iblock/news/zdorovij_region/e/lipchane_uspeshno_vistupili_na_sorevnovanijah_po_sportivnomu_turizmu__23-01-2019/№%:№%:2019-01-23 10:35:13№%:№%:60460495
В мэрии наградили лучших энергетиков и работников ЖКХ http://lipetskcity.ru/iblock/news/e/v_mjerii_nagradili_luchshih_jenergetikov_i_rabotnikov_zhkh_23-01-2019/№%:№%:2019-01-23 09:55:00№%:№%:60460495
Скидки на госпошлины при заказе госуслуг онлайн продлены до конца 2020 года http://lipetskcity.ru/iblock/news/e/skidki_na_gosposhlini_pri_zakaze_gosuslug_onlajn_prodleni_do_konca_2020_goda23-01-2019/№%:№%:2019-01-23 09:46:52№%:№%:60460495
#здоровыйрегион #регион48 #липецкаяобласть #зож#ЗдоровыйрегионгородЛипецк Руководителей предприятий и организаций приглашают к участию в конкурсе http://lipetskcity.ru/iblock/news/e/rukovoditelej_predprijatij_i_organizacij_priglashajut_k_uchastiju_v_konkurse23-01-2019/№%:№%:2019-01-23 09:27:57№%:№%:60460495
В 11 классах 7 школ города частично приостановлены занятия  http://lipetskcity.ru/iblock/news/e/v_11_klassah_7_shkol_goroda_chastichno_priostanovleni_zanjatija_22-01-2019/№%:№%:2019-01-22 17:10:54№%:№%:60460495
На трёх улицах областного центра не будет холодной воды http://lipetskcity.ru/iblock/news/e/na_trjoh_ulicah_oblastnogo_centra_ne_budet_holodnoj_vodi22-01-2019/№%:№%:2019-01-22 16:42:52№%:№%:60460495
Содержанию городских территорий в зимний период посвятили совещание в администрации Липецка http://lipetskcity.ru/iblock/news/e/soderzhaniju_gorodskih_territorij_v_zimnij_period_posvjatili_soveshhanie_v_administracii_lipecka22-01-2019/№%:№%:2019-01-22 16:08:20№%:№%:60460495
#здоровыйрегион #липецкаяобласть #ЗдоровыйрегионгородЛипецк#ЭтоНужноЗнатьКаждому О самых популярных книгах 2018 года липчанам расскажут в Есенинке http://lipetskcity.ru/iblock/news/e/o_samih_populjarnih_knigah_2018_goda_lipchanam_rasskazhut_v_eseninke22-01-2019/№%:№%:2019-01-22 15:48:32№%:№%:60460495
#здоровыйрегион #липецкаяобласть #ЗдоровыйрегионгородЛипецк#ЭтоНужноЗнатьКаждому Географы из МГУ обследуют урбогеосистемы Липецка http://lipetskcity.ru/iblock/news/e/geografi_iz_mgu_obsledujut_urbogeosistemi__lipecka__22-01-2019/№%:№%:2019-01-22 14:40:44№%:№%:60460495
Липчан призывают высказать свое мнение о том, как повысить безопасность использования бытового газа http://lipetskcity.ru/iblock/news/e/lipchan_prizivajut_viskazat_svoe_mnenie_o_tom_kak_povisit_bezopasnost_ispolzovanija_bitovogo_gaza_22-01-2019/№%:№%:2019-01-22 13:13:26№%:№%:60460495
Энергетики готовы к пиковым нагрузкам в сильные морозы http://lipetskcity.ru/iblock/news/e/jenergetiki_gotovi_k_pikovim_nagruzkam_v_silnie_morozi_22-01-2019/№%:№%:2019-01-22 10:24:59№%:№%:60460495
«Я, конечно, вернусь...». Липчане споют песни и прочтут стихи Владимира Высоцкого  http://lipetskcity.ru/iblock/news/e/ja_konechno_vernus_lipchane_spojut_pesni_i_prochtut_stihi_vladimira_visockogo_22-01-2019/№%:№%:2019-01-22 10:11:15№%:№%:60460495
#здоровыйрегион #регион48 #липецкаяобласть #зож#ЗдоровыйрегионгородЛипецк Молочная продукция - в зоне внимания Роспотребнадзора http://lipetskcity.ru/iblock/news/e/molochnaja_produkcija__v_zone_vnimanija__rospotrebnadzora__22-01-2019/№%:№%:2019-01-22 09:04:14№%:№%:60460495
Юным талантам Липецка вручили именные стипендии http://lipetskcity.ru/iblock/news/e/junim_talantam_lipecka_vruchili_imennie_stipendii21-01-2019/№%:№%:2019-01-21 17:27:35№%:№%:60460495
#здоровыйрегион #липецкаяобласть #ЗдоровыйрегионгородЛипецк#ЭтоНужноЗнатьКаждому Определились победители муниципального этапа «Золотой шайбы» http://lipetskcity.ru/iblock/news/e/opredelilis_pobediteli_municipalnogo_jetapa_zolotoj_shajbi_21-01-2019/№%:№%:2019-01-21 16:46:55№%:№%:60460495
Введена новая мера социальной поддержки молодых семей при рождении первого ребенка http://lipetskcity.ru/iblock/news/e/vvedena__novaja_mera_socialnoj_podderzhki_molodih_semej_pri_rozhdenii_pervogo_rebenka_21-01-2019/№%:№%:2019-01-21 15:16:31№%:№%:60460495
Липецкая область отпраздновала юбилей салютом, народными гуляниями и спортивным праздником  http://lipetskcity.ru/iblock/news/e/lipeckaja_oblast_otprazdnovala_jubilej_saljutom_narodnimi_guljanijami_i_sportivnim_prazdnikom_21-01-2019/№%:№%:2019-01-21 15:10:31№%:№%:60460495
Движение транспорта через железнодорожный переезд по ул. Орловской будет временно ограничено  http://lipetskcity.ru/iblock/news/e/dvizhenie_transporta_cherez_zheleznodorozhnij_pereezd_po_ul_orlovskoj_budet_vremenno_ogranicheno_21-01-2019/№%:№%:2019-01-21 14:21:04№%:№%:60460495
Екатерина Белокопытова: «2019 год станет важным этапом в реализации концепции «Умный город Липецк» http://lipetskcity.ru/iblock/news/e/ekaterina_belokopitova_2019_god_stanet_vazhnim_jetapom_v_realizacii_koncepcii_umnij_gorod_lipeck21-01-2019/№%:№%:2019-01-21 14:06:13№%:№%:60460495
#здоровыйрегион #липецкаяобласть #ЗдоровыйрегионгородЛипецк#ЭтоНужноЗнатьКаждому  «Шиповка юных» определит сильнейшие школьные команды города http://lipetskcity.ru/iblock/news/zdorovij_region/e/_shipovka_junih_opredelit_silnejshie_shkolnie_komandi_goroda__21-01-2019/№%:№%:2019-01-21 14:00:37№%:№%:60460495
#здоровыйрегион #липецкаяобласть #ЗдоровыйрегионгородЛипецк#ЭтоНужноЗнатьКаждому Юбилейный марафон в бассейне http://lipetskcity.ru/iblock/news/zdorovij_region/e/jubilejnij_marafon_v_bassejne_21-01-2019/№%:№%:2019-01-21 13:48:53№%:№%:60460495
#здоровыйрегион #липецкаяобласть #ЗдоровыйрегионгородЛипецк#ЭтоНужноЗнатьКаждому Любителей коньков ждут катки города http://lipetskcity.ru/iblock/news/zdorovij_region/e/ljubitelej_konkov_zhdut_katki_goroda_21-01-2019/№%:№%:2019-01-21 13:43:02№%:№%:60460495
#здоровыйрегион #липецкаяобласть #ЗдоровыйрегионгородЛипецк#ЭтоНужноЗнатьКаждому Зима: культура и здоровье http://lipetskcity.ru/iblock/news/zdorovij_region/e/zima_kultura__i_zdorove_21-01-2019/№%:№%:2019-01-21 13:41:54№%:№%:60460495
В апробации итогового собеседования по русскому языку приняли участие порядка 5 тысяч старшеклассников   http://lipetskcity.ru/iblock/news/e/v_aprobacii_itogovogo_sobesedovanija_po_russkomu_jaziku_prinjali_uchastie_porjadka_5_tisjach_starsheklassnikov_21-01-2019/№%:№%:2019-01-21 12:01:01№%:№%:60460495
В ледяные иордани Липецка окунулись более 3,7 тысяч липчан http://lipetskcity.ru/iblock/news/e/v_ledjanie_iordani_lipecka_okunulis_bolee_37_tisjach_lipchan21-01-2019/№%:№%:2019-01-21 10:17:46№%:№%:60460495
Руководители города и региона проинспектировали работу управляющих компаний Липецка http://lipetskcity.ru/iblock/news/e/rukovoditeli_goroda_i_regiona_proinspektirovali_rabotu_upravljajushhih_kompanij_lipecka_19-01-2019/№%:№%:2019-01-19 17:17:59№%:№%:60460495
В областном центре снова состоялась «Крещенская елка добра»  http://lipetskcity.ru/iblock/news/e/v_oblastnom_centre_snova_sostojalas_kreshhenskaja_elka_dobra_19-01-2019/№%:№%:2019-01-19 15:36:49№%:№%:60460495
Ремонтные работы станут причиной отключения электроэнергии в районе Свободный Сокол http://lipetskcity.ru/iblock/news/e/remontnie_raboti_stanut_prichinoj_otkljuchenija_jelektrojenergii_v_rajone_svobodnij_sokol18-01-2019/№%:№%:2019-01-18 14:11:31№%:№%:60460495
Липецким пенсионерам предлагают освоить «Планшет, смартфон с нуля»  http://lipetskcity.ru/iblock/news/e/lipeckim_pensioneram_predlagajut_osvoit_planshet_smartfon_s_nulja_18-01-2019/№%:№%:2019-01-18 12:37:18№%:№%:60460495
Медали «Во славу Липецкой области» вручили в городской администрации http://lipetskcity.ru/iblock/news/e/medali_vo_slavu_lipeckoj_oblasti_vruchili_v_gorodskoj_administracii_18-01-2019/№%:№%:2019-01-18 11:55:32№%:№%:60460495
Для проверки герметичности в системы теплоснабжения добавят уранин http://lipetskcity.ru/iblock/news/e/dlja_proverki_germetichnosti_v_sistemi_teplosnabzhenija_dobavjat_uranin18-01-2019/№%:№%:2019-01-18 11:54:18№%:№%:60460495
Руководители профильных департаментов проинспектировали уборку дворов и межквартальных проездов  http://lipetskcity.ru/iblock/news/e/rukovoditeli_profilnih_departamentov_proinspektirovali_uborku_dvorov_i_mezhkvartalnih_proezdov_18-01-2019/№%:№%:2019-01-18 11:38:03№%:№%:60460495
#здоровыйрегион #липецкаяобласть #ЗдоровыйрегионгородЛипецк#ЭтоНужноЗнатьКаждому Санитарные врачи предупреждают: крещенские купания в реке Воронеж небезопасны для здоровья http://lipetskcity.ru/iblock/news/e/sanitarnie_vrachi_preduprezhdajut_kreshhenskie_kupanija_v_reke_voronezh_nebezopasni_dlja_zdorovja18-01-2019/№%:№%:2019-01-18 11:24:27№%:№%:60460495
#здоровыйрегион #липецкаяобласть #ЗдоровыйрегионгородЛипецк#ЭтоНужноЗнатьКаждому Стартовал прием заявок на Спартакиаду трудовых коллективов http://lipetskcity.ru/iblock/news/e/startoval_priem_zajavok_na_spartakiadu_trudovih_kollektivov18-01-2019/№%:№%:2019-01-18 10:59:41№%:№%:60460495
Дворец культуры «Сокол» обрел исторический вид http://lipetskcity.ru/iblock/news/e/dvorec_kulturi_sokol_obrel_istoricheskij_vid18-01-2019/№%:№%:2019-01-18 10:00:34№%:№%:60460495
Из-за празднования юбилея области незначительно сократится выпуск автобусов на некоторых маршрутах http://lipetskcity.ru/iblock/news/e/izza_prazdnovanija_jubileja_oblasti_neznachitelno_sokratitsja_vipusk_avtobusov_na_nekotorih_marshrutah18-01-2019/№%:№%:2019-01-18 09:06:14№%:№%:60460495
Главная крещенская купель появилась на Центральном городском пляже http://lipetskcity.ru/iblock/news/e/glavnaja_kreshhenskaja_kupel_pojavilas_na_centralnom_gorodskom_pljazhe17-01-2019/№%:№%:2019-01-17 18:02:54№%:№%:60460495
Голосование за лучший вариант гимна Липецка продолжается  http://lipetskcity.ru/iblock/news/e/golosovanie_za_luchshij_variant_gimna_lipecka_prodolzhaetsja_17-01-2019/№%:№%:2019-01-17 14:00:46№%:№%:60460495
Спасатели предупреждают липчан о сильном ветре http://lipetskcity.ru/iblock/news/e/spasateli_preduprezhdajut_lipchan_o_silnom_vetre17-01-2019/№%:№%:2019-01-17 13:15:39№%:№%:60460495
Из-за ремонтных работ на нескольких улицах в частном секторе Липецка отключат свет http://lipetskcity.ru/iblock/news/e/izza_remontnih_rabot_na_neskolkih_ulicah_v_chastnom_sektore_lipecka_otkljuchat_svet17-01-2019/№%:№%:2019-01-17 12:10:57№%:№%:60460495
#здоровыйрегион #липецкаяобласть #ЗдоровыйрегионгородЛипецк#ЭтоНужноЗнатьКаждому Липчан приглашают на лыжную гонку в честь юбилея региона http://lipetskcity.ru/iblock/news/zdorovij_region/e/lipchan_priglashajut_na_lizhnuju_gonku_v_chest_jubileja_regiona_17-01-2019/№%:№%:2019-01-17 12:04:08№%:№%:60460495
#здоровыйрегион #липецкаяобласть #ЗдоровыйрегионгородЛипецк#ЭтоНужноЗнатьКаждому Сегодня в Липецке стартует фестиваль «За здоровый образ жизни» http://lipetskcity.ru/iblock/news/e/segodnja_v_lipecke_startuet_festival_za_zdorovij_obraz_zhizni17-01-2019/№%:№%:2019-01-17 11:53:14№%:№%:60460495
В областном центре снова состоится «Крещенская елка добра»  http://lipetskcity.ru/iblock/news/e/v_oblastnom_centre_snova_sostoitsja_kreshhenskaja_elka_dobra_17-01-2019/№%:№%:2019-01-17 10:29:18№%:№%:60460495
#здоровыйрегион #липецкаяобласть #ЗдоровыйрегионгородЛипецк#ЭтоНужноЗнатьКаждому Липчан приглашают на «крещенский вечерок» в музее http://lipetskcity.ru/iblock/news/e/lipchan_priglashajut_na_kreshhenskij_vecherok_v_muzee__17-01-2019/№%:№%:2019-01-17 10:06:26№%:№%:60460495
#здоровыйрегион #липецкаяобласть #ЗдоровыйрегионгородЛипецк#ЭтоНужноЗнатьКаждому Команда «Липецк» сразится с уфимской «Самрау-УГНТУ» http://lipetskcity.ru/iblock/news/zdorovij_region/e/komanda_lipeck_srazitsja_s_ufimskoj_samrauugntu_17-01-2019/№%:№%:2019-01-17 09:07:09№%:№%:60460495
Территорию областного центра начали готовить к безопасному пропуску паводковых вод  http://lipetskcity.ru/iblock/news/e/territoriju_oblastnogo_centra_nachali_gotovit_k_bezopasnomu_propusku_pavodkovih_vod__16-01-2019/№%:№%:2019-01-16 17:17:30№%:№%:60460495
Вопросы реконструкции Быханова сада руководители города обсудили с инвесторами http://lipetskcity.ru/iblock/news/e/voprosi_rekonstrukcii_bihanova_sada_rukovoditeli_goroda_obsudili_s_investorami16-01-2019/№%:№%:2019-01-16 16:06:29№%:№%:60460495
Завтра на двух улицах города отключат электроэнергию http://lipetskcity.ru/iblock/news/e/zavtra_na_dvuh_ulicah_goroda_otkljuchat_jelektrojenergiju_16-01-2019/№%:№%:2019-01-16 15:54:37№%:№%:60460495
Ветераны вспоминают масштабные стройки Липецка http://lipetskcity.ru/iblock/news/e/veterani_vspominajut_masshtabnie_strojki_lipecka_16-01-2019/№%:№%:2019-01-16 13:58:17№%:№%:60460495
Липецк выдвигает кандидатов на областную Доску почета http://lipetskcity.ru/iblock/news/e/lipeck_vidvigaet__kandidatov_na_oblastnuju_dosku_pocheta__16-01-2019/№%:№%:2019-01-16 13:34:11№%:№%:60460495
#здоровыйрегион #липецкаяобласть #ЗдоровыйрегионгородЛипецк#ЭтоНужноЗнатьКаждому Волейбол на снегу в честь юбилея региона http://lipetskcity.ru/iblock/news/e/volejbol_na_snegu_v_chest_jubileja_regiona__16-01-2019/№%:№%:2019-01-16 09:56:25№%:№%:60460495
Липецкую практику по укреплению межнациональных и межрелигиозных отношений признали лучшей в стране http://lipetskcity.ru/iblock/news/e/lipeckuju_praktiku_po_ukrepleniju_mezhnacionalnih_i_mezhreligioznih_otnoshenij_priznali_luchshej_v_strane15-01-2019/№%:№%:2019-01-15 17:59:19№%:№%:60460495
Вопросы проверки газового оборудования в центре внимания руководства города и профильных служб  http://lipetskcity.ru/iblock/news/e/voprosi_proverki_gazovogo_oborudovanija_v_centre_vnimanija_rukovodstva_goroda_i_profilnih_sluzhb_15-01-2019/№%:№%:2019-01-15 17:30:10№%:№%:60460495
#здоровыйрегион #липецкаяобласть #ЗдоровыйрегионгородЛипецк#ЭтоНужноЗнатьКаждому Липчан приглашают на ледовое сражение в честь юбилея региона http://lipetskcity.ru/iblock/news/e/lipchan_priglashajut_na_ledovoe_srazhenie_v_chest_jubileja_regiona_15-01-2019/№%:№%:2019-01-15 16:34:14№%:№%:60460495
В районах Дачный и НЛМК отключат холодную воду http://lipetskcity.ru/iblock/news/e/v_rajonah_dachnij_i_nlmk_otkljuchat_holodnuju_vodu15-01-2019/№%:№%:2019-01-15 15:37:46№%:№%:60460495
Точку Кипения Липецк отметили на федеральном уровне http://lipetskcity.ru/iblock/news/e/kipenija_lipeck_otmetili_na_federalnom_urovne_15-01-2019/№%:№%:2019-01-15 15:32:48№%:№%:60460495
#здоровыйрегион #липецкаяобласть #ЗдоровыйрегионгородЛипецк#ЭтоНужноЗнатьКаждому Липчанам нравятся зимние развлечения с детьми по месту жительства http://lipetskcity.ru/iblock/news/e/lipchanam_nravjatsja_zimnie_razvlechenija_s_detmi_po_mestu_zhitelstva_15-01-2019/№%:№%:2019-01-15 15:16:30№%:№%:60460495
С 21 января отменят утренний рейс автобуса №8 http://lipetskcity.ru/iblock/news/e/s_21_janvarja_otmenjat_utrennij_rejs_avtobusa_815-01-2019/№%:№%:2019-01-15 14:20:35№%:№%:60460495
Вопросы жизнедеятельности города обсуждали на еженедельном совещании в мэрии http://lipetskcity.ru/iblock/news/e/voprosi_zhiznedejatelnosti_goroda_obsuzhdali_na_ezhenedelnom_soveshhanii_v_mjerii_14-01-2019/№%:№%:2019-01-15 08:55:34№%:№%:60460495
Липецкой области 65 лет: праздничные мероприятия на основных городских площадках http://lipetskcity.ru/iblock/news/e/lipeckoj_oblasti_65_let_prazdnichnie_meroprijatija_na_osnovnih_gorodskih_ploshhadkah14-01-2019/№%:№%:2019-01-14 17:29:29№%:№%:60460495
На компенсацию взносов на капремонт в регионе направили 90 миллионов рублей http://lipetskcity.ru/iblock/news/e/na_kompensaciju_vznosov_na_kapremont_v_regione_napravili_90_millionov_rublej14-01-2019/№%:№%:2019-01-14 17:12:25№%:№%:60460495
Региональное управление ЖКХ предупреждает: неплатежи за вывоз мусора опасны для вашего бюджета http://lipetskcity.ru/iblock/news/e/regionalnoe_upravlenie_zhkh_preduprezhdaet_neplatezhi_za_vivoz_musora_opasni_dlja_vashego_bjudzheta_14-01-2019/№%:№%:2019-01-14 16:07:51№%:№%:60460495
#здоровыйрегион #липецкаяобласть #ЗдоровыйрегионгородЛипецк#ЭтоНужноЗнатьКаждому Ледовые площадки города открыты для любителей коньков http://lipetskcity.ru/iblock/news/zdorovij_region/e/ledovie_ploshhadki_goroda_zhdut_ljubitelej_konkov14-01-2019/№%:№%:2019-01-14 14:41:47№%:№%:60460495
#здоровыйрегион #липецкаяобласть #ЗдоровыйрегионгородЛипецк#ЭтоНужноЗнатьКаждому Помочь создать виртуальную карту «Быханова сада» – городские экологи объявляют конкурс http://lipetskcity.ru/iblock/news/e/pomoch_sozdat_virtualnuju_kartu_bihanova_sada__gorodskie_jekologi_objavljajut_konkurs14-01-2019/№%:№%:2019-01-14 14:05:51№%:№%:60460495
#здоровыйрегион #липецкаяобласть #ЗдоровыйрегионгородЛипецк#ЭтоНужноЗнатьКаждому «Золотую шайбу» разыграют в спорткомплексе «Звездный» http://lipetskcity.ru/iblock/news/zdorovij_region/e/zolotuju_shajbu_razigrajut_v_sportkomplekse_zvezdnij_14-01-2019/№%:№%:2019-01-14 14:04:41№%:№%:60460495
#здоровыйрегион #липецкаяобласть #ЗдоровыйрегионгородЛипецк#ЭтоНужноЗнатьКаждому В Липецке пройдет волейбольный турнир среди школьников http://lipetskcity.ru/iblock/news/zdorovij_region/e/v_lipecke_projdet_volejbolnij_turnir_sredi_shkolnikov_14-01-2019/№%:№%:2019-01-14 14:01:58№%:№%:60460495
Липецкие спасатели готовятся к крещенским купаниям горожан и весеннему паводку http://lipetskcity.ru/iblock/news/e/_lipeckie_spasateli_gotovjatsja_k_kreshhenskim_kupanijam_gorozhan_i_vesennemu_pavodku14-01-2019/№%:№%:2019-01-14 14:01:29№%:№%:60460495
В работу муниципального маршрута №9 вносятся изменения http://lipetskcity.ru/iblock/news/e/v_rabotu_municipalnogo_marshruta_9_vnosjatsja_izmenenija14-01-2019/№%:№%:2019-01-14 12:30:42№%:№%:60460495
Испытание для молодых интеллектуалов – очередной турнир по игре «Что? Где? Когда?» посвятят 65-летию региона http://lipetskcity.ru/iblock/news/e/ispitanie_dlja_molodih_intellektualov__ocherednoj_turnir_po_igre_chto_gde_kogda_posvjatjat_65letiju_regiona14-01-2019/№%:№%:2019-01-14 11:54:14№%:№%:60460495
#здоровыйрегион #липецкаяобласть #ЗдоровыйрегионгородЛипецк#ЭтоНужноЗнатьКаждому Главный каток города приглашает липчан покататься бесплатно http://lipetskcity.ru/iblock/news/e/glavnij_katok__goroda_priglashaet_lipchan_pokatatsja_besplatno_14-01-2019/№%:№%:2019-01-14 11:39:39№%:№%:60460495
За выходные дни по вопросам уборки снега в департамент ЖКХ обратилось 17 липчан http://lipetskcity.ru/iblock/news/e/za_vihodnie_dni_po_voprosam_uborki_snega_v_departament_zhkh_obratilos_17_lipchan14-01-2019/№%:№%:2019-01-14 11:38:20№%:№%:60460495
Новогодняя иллюминация в Липецке будет работать до конца января lipetskcity.ru/iblock/news/e/_novogodnjaja_illjuminacija_v_lipecke_budet_rabotat_do_konca_janvarja11-01-2019/№%:№%:2019-01-11 20:13:22№%:№%:60460495
Крещенская ночь в Липецке должна пройти организованно и безопасно http://lipetskcity.ru/iblock/news/e/kreshhenskaja_noch_v_lipecke_dolzhna_projti_organizovanno_i_bezopasno__11-01-2019/№%:№%:2019-01-11 16:40:15№%:№%:60460495
Переход на цифровое телевидение в Липецке№%:№%:2019-01-11 16:24:23№%:№%:60460495
Соблюдайте правила безопасности при выходе на лед   По данным управления по делам ГО и ЧС, в настоящий момент толщина ледового покрытия на реке Воронеж составляет в среднем 30 см, на Матырском водохранилище – 35-37 см.    Несмотря на то, что лед сейчас относительно крепкий, спасатели предупреждают - из-за неравномерности ледового покрытия нередко встречаются опасные участки. Чрезвычайно ненадежен лед под снегом, особенно в местах с быстрым течением, там, где бьют ключи или впадает в реку ручей, а также около стока вод. Опасность также представляют полыньи, проруби, лунки, трещины.    Спасатели настоятельно рекомендуют гражданам соблюдать правила безопасного поведения на льду, быть предельно осторожными и внимательными.    Родителей призывают не допускать детей к реке без надзора взрослых, предупредите их об опасности нахождения на замерзших водоемах.    При возникновении чрезвычайных ситуаций обращайтесь за помощью по телефону «112».№%:№%:2019-01-11 15:47:32№%:№%:60460495
В частном секторе отключат электроэнергию http://lipetskcity.ru/iblock/news/e/v_chastnom_sektore_otkljuchat_jelektrojenergiju_11-01-2019/№%:№%:2019-01-11 15:32:42№%:№%:60460495
Взнос на капремонт для липчан не вырастет http://lipetskcity.ru/iblock/news/e/vznos_na_kapremont_dlja_lipchan_ne_virastet_11-01-2019/№%:№%:2019-01-11 15:29:47№%:№%:60460495
Управляющие компании переходят на работу в усиленном режиме  http://lipetskcity.ru/iblock/news/e/upravljajushhie_kompanii_perehodjat_na_rabotu_v_usilennom_rezhime_11-01-2019/№%:№%:2019-01-11 14:55:08№%:№%:60460495
В микрорайоне «Победа» появилась IT-школа  http://lipetskcity.ru/iblock/news/e/v_mikrorajone_pobeda_pojavilas_itshkola_11-01-2019/№%:№%:2019-01-11 13:34:15№%:№%:60460495
#здоровыйрегион #липецкаяобласть #ЗдоровыйрегионгородЛипецк#ЭтоНужноЗнатьКаждому№%:№%:2019-01-11 10:33:56№%:№%:60460495
Липчан приглашают на Рождественский концерт http://lipetskcity.ru/iblock/news/e/lipchan_priglashajut_na__rozhdestvenskij_koncert11-01-2019/№%:№%:2019-01-11 10:24:40№%:№%:60460495
Подведены итоги фестиваля компьютерного творчества "Поколение IT" http://lipetskcity.ru/iblock/news/e/podvedeni_itogi_festivalja_kompjuternogo_tvorchestva_pokolenie_it_11-01-2019/№%:№%:2019-01-11 10:23:54№%:№%:60460495
Треть январских свадеб в Липецке придётся на символическую дату «19.01.19» http://lipetskcity.ru/iblock/news/e/tret_janvarskih_svadeb_v_lipecke_pridjotsja_na_simvolicheskuju_datu_190119_10-01-2019/№%:№%:2019-01-11 09:25:06№%:№%:60460495
Жители улицы Московская и переулка Кувшинова останутся без воды http://lipetskcity.ru/iblock/news/e/zhiteli_ulici_moskovskaja_i_pereulka_kuvshinova_ostanutsja_bez_vodi10-01-2019/№%:№%:2019-01-10 16:45:47№%:№%:60460495
Использовать Комсомольский пруд как каток не будут http://lipetskcity.ru/iblock/news/e/ispolzovat_komsomolskij_prud_kak_katok_ne_budut10-01-2019/№%:№%:2019-01-10 16:04:20№%:№%:60460495
Сергей Иванов ответит на вопросы зрителей канала «Россия 24» в прямом эфире    Итогам новогодних праздников и планам на 2019 год будет посвящена программа «Вести-интервью», которая выйдет в эфир сегодня, 10 января, на телеканале «Россия 24» в семь часов вечера. Её гостем станет глава Липецка Сергей Иванов. Вопросы можно задать по телефону 72-20-61.№%:№%:2019-01-10 15:26:47№%:№%:60460495
#здоровыйрегион #липецкаяобласть #ЗдоровыйрегионгородЛипецк#ЭтоНужноЗнатьКаждому Шахматный турнир «Белая ладья» определит лучших среди липецких школьников http://lipetskcity.ru/iblock/news/zdorovij_region/e/shahmatnij_turnir_belaja_ladja_opredelit_luchshih_sredi_lipeckih_shkolnikov10-01-2019/№%:№%:2019-01-10 13:52:57№%:№%:60460495
Спасатели предупреждают липчан о сильном снегопаде http://lipetskcity.ru/iblock/news/e/spasateli_preduprezhdajut_lipchan_o_silnom_snegopade10-01-2019/№%:№%:2019-01-10 13:16:10№%:№%:60460495
#здоровыйрегион #липецкаяобласть #ЗдоровыйрегионгородЛипецк#ЭтоНужноЗнатьКаждому В Липецке пройдут «Ледовые баталии» http://lipetskcity.ru/iblock/news/zdorovij_region/e/v_lipecke_projdut_ledovie_batalii10-01-2019/№%:№%:2019-01-10 12:24:00№%:№%:60460495
Работу городских служб в дни новогодних каникул обсудили на первом в 2019 году оперативном совещании у главы Липецка  http://lipetskcity.ru/iblock/news/e/rabotu_gorodskih_sluzhb_v_dni_novogodnih_kanikul_obsudili_na_pervom_v_2019_godu_operativnom_soveshhanii_u_glavi_lipecka_09-01-2019/№%:№%:2019-01-09 17:16:40№%:№%:60460495
№%:№%:2019-01-09 17:13:05№%:№%:60460495
№%:№%:2019-01-09 17:11:49№%:№%:60460495
#здоровыйрегион #липецкаяобласть #ЗдоровыйрегионгородЛипецк#ЭтоНужноЗнатьКаждому Декада спорта и здоровья-2019 объединила более 40 тысяч липчан http://lipetskcity.ru/iblock/news/e/dekada_sporta_i_zdorovja2019_obedinila_bolee_40_tisjach_lipchan09-01-2019/№%:№%:2019-01-09 14:32:11№%:№%:60460495
Ремонтные работы станут причиной перебоев в водоснабжении http://lipetskcity.ru/iblock/news/e/remontnie_raboti_stanut_prichinoj_pereboev_v_vodosnabzhenii09-01-2019/№%:№%:2019-01-09 13:52:31№%:№%:60460495
В праздничные дни с улиц города вывезли свыше 26 тысяч кубометров снега  http://lipetskcity.ru/iblock/news/e/v_prazdnichnie_dni_s_ulic_goroda_vivezli_svishe_26_tisjach_kubometrov_snega_09-01-2019/№%:№%:2019-01-09 12:05:34№%:№%:60460495
#здоровыйрегион #липецкаяобласть #ЗдоровыйрегионгородЛипецк#ЭтоНужноЗнатьКаждому Липчан приглашают на музыкальные «Зимние забавы»  http://lipetskcity.ru/iblock/news/e/lipchan_priglashajut_na_muzikalnie_zimnie_zabavi_09-01-2019/№%:№%:2019-01-09 11:13:28№%:№%:60460495
#здоровыйрегион #липецкаяобласть #ЗдоровыйрегионгородЛипецк#ЭтоНужноЗнатьКаждому   «Елка на воде» и «Спортивное долголетие» - в Липецке продолжаются мероприятия Декады спорта и здоровья  http://lipetskcity.ru/iblock/news/e/elka_na_vode_i_sportivnoe_dolgoletie__v_lipecke_prodolzhajutsja_meroprijatija_dekadi_sporta_i_zdorovja_04-01-2019/№%:№%:2019-01-04 10:18:44№%:№%:60460495
#здоровыйрегион #липецкаяобласть #ЗдоровыйрегионгородЛипецк#ЭтоНужноЗнатьКаждому  В Липецке от снега расчищают спортивные объекты    В дни новогодних каникул по всей стране проходит Декада спорта и здоровья. Спортивные учреждения города Липецка стремятся обеспечить горожанам все условия для активного зимнего отдыха, а спортсменам – для успешных тренировок.    Все спортивные учреждения в усиленном режиме проводят уборку катков, открытых хоккейных площадок от снега, следят за состоянием лыжни, расчищают подъездные и пешеходные пути возле учреждений.    На ледовых катках СК «Сокол», ФОК «Пламя» снег расчищают с помощью снегоуборочных машин и бригад.    Силами педагогов городского детско-юношеского центра «Спортивный» проводится расчистка хоккейной коробки в микрорайоне «Силикатный».    Муниципальное автономное учреждение «Спортивный город» ведет активную расчистку от снега дворовых хоккейных коробок. В уборке снега принимают участие бригады ремонтировщиков МАУ «Спортивный город».    Вчера и сегодня проведена расчистка от снега на хоккейных коробках по адресам: ул. 60 лет СССР, 6, ул. Стаханова,8, ул. Циолковского, 37/2, ул. Космонавтов 6, ул. Первомайская, 38, ул. 50 лет НЛМК,3, пер. Виноградный, 1.    Всего в рамках зимнего оздоровительного сезона на территории города Липецка запланирована работа более 30 ледовых площадок, в том числе и катки массового катания с пунктами проката инвентаря.    Стоит отметить, что катки на базе спортивных сооружений пользуются популярностью среди жителей города. А хоккейные коробки во дворах – это прекрасная возможность заняться спортом в шаговой доступности.№%:№%:2019-01-03 20:51:09№%:№%:60460495
Свыше 20 тысяч липчан стали участниками основных городских мероприятий новогодней ночи  http://lipetskcity.ru/iblock/news/e/svishe_20_tisjach_lipchan_stali_uchastnikami_osnovnih_gorodskih_meroprijatij_novogodnej_nochi_02-01-2019/№%:№%:2019-01-02 14:32:14№%:№%:60460495
#здоровыйрегион #липецкаяобласть #ЗдоровыйрегионгородЛипецк#ЭтоНужноЗнатьКаждому Декада спорта и здоровья - 2019 стартовала в Липецке  http://lipetskcity.ru/iblock/news/e/dekada_sporta_i_zdorovja__2019__startovala_v_lipecke_02-01-2019/№%:№%:2019-01-02 13:51:31№%:№%:60460495
Часы-арка стали украшением "Тоннеля желаний" в сквере на улице Ворошилова№%:№%:2018-12-29 20:47:49№%:№%:60460495
Руководители города поздравляют липчан с новым 2019 годом http://lipetskcity.ru/iblock/news/e/rukovoditeli_goroda_pozdravljajut_lipchan_s_novim_2019_godom29-12-2018/№%:№%:2018-12-29 13:40:57№%:№%:60460495
Липецкий Дом музыки приглашает на детскую сказку с органом http://lipetskcity.ru/iblock/news/e/lipeckij_dom_muziki_priglashaet_na_detskuju_skazku_s_organom_29-12-2018/№%:№%:2018-12-29 13:00:11№%:№%:60460495
Липчане смогут оценить работу такси и каршеринга http://lipetskcity.ru/iblock/news/e/lipchane_smogut_ocenit_rabotu_taksi_i_karsheringa_29-12-2018/№%:№%:2018-12-29 12:58:45№%:№%:60460495
№%:№%:2018-12-29 12:54:05№%:№%:60460495
№%:№%:2018-12-29 12:53:39№%:№%:60460495
№%:№%:2018-12-29 12:52:43№%:№%:60460495
Проезжая часть улицы Ленина будет восстановлена в ближайшее время  http://lipetskcity.ru/iblock/news/e/proezzhaja_chast_ulici_lenina_budet_vosstanovlena_v_blizhajshee_vremja_29-12-2018/№%:№%:2018-12-29 12:24:19№%:№%:60460495
В новогоднюю ночь в девяти районах Липецка пройдут дискотеки на снегу http://lipetskcity.ru/iblock/news/e/v_novogodnjuju_noch_v_devjati_rajonah_lipecka_projdut_diskoteki_na_snegu29-12-2018/№%:№%:2018-12-29 11:41:59№%:№%:60460495
Из-за ремонтных работ на улице Ленина меняется схемы движения некоторых маршрутов http://lipetskcity.ru/iblock/news/e/izza_remontnih_rabot_na_ulice_lenina_menjaetsja_shemi_dvizhenija_nekotorih_marshrutov29-12-2018/№%:№%:2018-12-29 10:07:03№%:№%:60460495
«Рождественское многоголосие» откроет цикл январских концертов http://lipetskcity.ru/iblock/news/e/rozhdestvenskoe_mnogogolosie_otkroet_cikl_janvarskih_koncertov_29-12-2018/№%:№%:2018-12-29 09:51:07№%:№%:60460495
Сергей Иванов потребовал ускорить расчистку липецких дворов от снега и наледи http://lipetskcity.ru/iblock/news/e/sergej_ivanov_potreboval_uskorit_raschistku_lipeckih_dvorov_ot_snega_i_naledi28-12-2018/№%:№%:2018-12-29 09:03:28№%:№%:60460495
Уникальная елка и «Тоннель желаний» - в Липецке завершается монтаж новогодней иллюминации  http://lipetskcity.ru/iblock/news/e/unikalnaja_elka_i_tonnel_zhelanij___v_lipecke_zavershaetsja_montazh_novogodnej_illjuminacii_28-12-2018/№%:№%:2018-12-28 20:06:23№%:№%:60460495
#здоровыйрегион #липецкаяобласть #ЗдоровыйрегионгородЛипецк#ЭтоНужноЗнатьКаждому К Новому году в липецких дворах зальют более 10 хоккейных площадок http://lipetskcity.ru/iblock/news/e/k_novomu_godu_v_lipeckih_dvorah_zaljut_bolee_hokkejnih_ploshhadok28-12-2018/№%:№%:2018-12-28 17:00:02№%:№%:60460495
Лучшего муниципального дворника выбрали в Липецке  http://lipetskcity.ru/iblock/news/e/luchshego_municipalnogo_dvornika_vibrali_v_lipecke_28-12-2018/№%:№%:2018-12-28 11:54:27№%:№%:60460495
#здоровыйрегион #липецкаяобласть #ЗдоровыйрегионгородЛипецк#ЭтоНужноЗнатьКаждому Липчане выбирают форматы зимнего досуга http://lipetskcity.ru/iblock/news/e/lipchane_vibirajut_formati_zimnego_dosuga_28-12-2018/№%:№%:2018-12-28 11:42:32№%:№%:60460495
№%:№%:2018-12-28 09:45:43№%:№%:60460495
#здоровыйрегион #липецкаяобласть #ЗдоровыйрегионгородЛипецк#ЭтоНужноЗнатьКаждому Итоги спортивного года подвели в Липецке http://lipetskcity.ru/iblock/news/e/itogi_sportivnogo_goda_podveli_v_lipecke27-12-2018/№%:№%:2018-12-27 17:52:16№%:№%:60460495
#здоровыйрегион #липецкаяобласть #ЗдоровыйрегионгородЛипецк#ЭтоНужноЗнатьКаждому Центр «Спортивный» приглашает липчан отправиться в «Новогоднее путешествие» http://lipetskcity.ru/iblock/news/zdorovij_region/e/centr_sportivnij_priglashaet_lipchan_otpravitsja_v_novogodnee_puteshestvie27-12-2018/№%:№%:2018-12-27 17:33:46№%:№%:60460495
#здоровыйрегион #липецкаяобласть #ЗдоровыйрегионгородЛипецк#ЭтоНужноЗнатьКаждому Декада спорта и здоровья пройдет в Липецке с 28 декабря по 8 января http://lipetskcity.ru/iblock/news/e/dekada_sporta_i_zdorovja_projdet_v_lipecke__s_28_dekabrja_po_8_janvarja_27-12-2018/№%:№%:2018-12-27 17:32:15№%:№%:60460495
Липецкие дворы приводят в порядок более 500 дворников и 25 единиц техники  http://lipetskcity.ru/iblock/news/e/lipeckie_dvori_privodjat_v_porjadok_bolee_500_dvornikov_i_25_edinic_tehniki_27-12-2018/№%:№%:2018-12-27 17:22:12№%:№%:60460495
В праздники спасатели будут работать в режиме повышенной готовности http://lipetskcity.ru/iblock/news/e/v_prazdniki_spasateli_budut_rabotat_v_rezhime_povishennoj_gotovnosti27-12-2018/№%:№%:2018-12-27 16:41:51№%:№%:60460495
100-летие дополнительного образования отметили в Липецке http://lipetskcity.ru/iblock/news/e/100letie_dopolnitelnogo_obrazovanija_otmetili_v_lipecke_27-12-2018/№%:№%:2018-12-27 16:25:10№%:№%:60460495
#здоровыйрегион #липецкаяобласть #ЗдоровыйрегионгородЛипецк#ЭтоНужноЗнатьКаждому Катки в городских парках и у спорткомплекса «Звёздный» приглашают липчан http://lipetskcity.ru/iblock/news/e/katki_v_gorodskih_parkah_i_u_sportkompleksa_zvjozdnij_priglashajut_lipchan27-12-2018/№%:№%:2018-12-27 15:37:45№%:№%:60460495
Дедушка Мороз приглашает в гости маленьких липчан http://lipetskcity.ru/iblock/news/e/dedushka_moroz_priglashaet_v_gosti_malenkih_lipchan27-12-2018/№%:№%:2018-12-27 14:44:45№%:№%:60460495
В садоводческих товариществах областного центра отключат свет http://lipetskcity.ru/iblock/news/e/v_sadovodcheskih_tovarishhestvah_oblastnogo_centra_otkljuchat_svet_27-12-2018/№%:№%:2018-12-27 14:02:15№%:№%:60460495
В мэрии наградили участников городской благотворительной акции «Новогоднее чудо» http://lipetskcity.ru/iblock/news/e/v_mjerii_nagradili_uchastnikov_gorodskoj_blagotvoritelnoj_akcii_novogodnee_chudo27-12-2018/№%:№%:2018-12-27 11:59:03№%:№%:60460495
#здоровыйрегион #липецкаяобласть #ЗдоровыйрегионгородЛипецк#ЭтоНужноЗнатьКаждому В Липецк приедут спартанки из Нижнего Новгорода http://lipetskcity.ru/iblock/news/zdorovij_region/e/v_lipeck_priedut_spartanki_iz_nizhnego_novgoroda_27-12-2018/№%:№%:2018-12-27 11:39:59№%:№%:60460495
Лучшим педагогам вручили юбилейные медали «Во славу Липецкой области» http://lipetskcity.ru/iblock/news/e/luchshim_pedagogam_vruchili_jubilejnie_medali_vo_slavu_lipeckoj_oblasti_27-12-2018/№%:№%:2018-12-27 11:36:48№%:№%:60460495
Инвестиционное послание главы города обсудили в «Точке Кипения» http://lipetskcity.ru/iblock/news/e/investicionnoe_poslanie_glavi_goroda_obsudili_v_tochke_kipenija_26-12-2018/№%:№%:2018-12-26 18:28:16№%:№%:60460495
Городское управление ЗАГС информирует о работе отделов в период новогодних каникул http://lipetskcity.ru/iblock/news/e/gorodskoe_upravlenie_zags_informiruet_o_rabote_otdelov_v_period_novogodnih_kanikul26-12-2018/№%:№%:2018-12-26 16:11:27№%:№%:60460495
Световые колонны, волшебный лед гирлянд и горячие сердца липчан - в администрации подвели итоги предновогоднего конкурса благоустройства  http://lipetskcity.ru/iblock/news/e/svetovie_kolonni_volshebnij_led_girljand_i_gorjachie_serdca_lipchan____v_administracii_podveli_itogi_prednovogodnego_konkursa_blagoustrojstva__26-12-2018/№%:№%:2018-12-26 16:03:51№%:№%:60460495
Из-за ремонтных работ движение через переезд на улице Орловской будет ограничено http://lipetskcity.ru/iblock/news/e/izza_remontnih_rabot_dvizhenie_cherez_pereezd_na_ulice_orlovskoj_budet_ogranicheno26-12-2018/№%:№%:2018-12-26 15:02:32№%:№%:60460495
В новогодние праздники изменится движение общественного транспорта http://lipetskcity.ru/iblock/news/e/v_novogodnie_prazdniki_izmenitsja_dvizhenie_obshhestvennogo_transporta26-12-2018/№%:№%:2018-12-26 12:48:15№%:№%:60460495
#здоровыйрегион #липецкаяобласть #ЗдоровыйрегионгородЛипецк#ЭтоНужноЗнатьКаждому Липчан приглашают на открытый каток у спорткомплекса «Звездный» http://lipetskcity.ru/iblock/news/e/lipchan_priglashajut_na_otkritij_katok_u_zvezdnij26-12-2018/№%:№%:2018-12-26 12:47:42№%:№%:60460495
Реконструкция Петровского моста завершена – глава Липецка поблагодарил строителей http://lipetskcity.ru/iblock/news/e/rekonstrukcija_petrovskogo_mosta_zavershena__glava_lipecka_poblagodaril_stroitelej26-12-2018/№%:№%:2018-12-26 12:14:35№%:№%:60460495
График работы медицинских учреждений Липецка в дни новогодних каникул Управление здравоохранения Липецкой области информирует жителей города Липецка о порядке работы государственных медицинских организаций в новогодние каникулы.    29 декабря 2018 года в медучреждениях обычный рабочий день. 30, 31 декабря 2018 года, 2, 4, 6, и 8 января 2019 года поликлиники, обслуживающие взрослое и детское население, а также стоматологические поликлиники работают по графику субботнего дня. Прием вызовов на дом до 12.00. Амбулаторный прием врачей терапевтов, врачей общей практики, врачей педиатров и обслуживание вызовов на дому до 15.00.    1, 3, 5, 7 января в поликлиниках выходной день.    Травмпункты города Липецка в больницах ГУЗ «Липецкая городская больница скорой медицинской помощи № 1» (ул. Космонавтов, д. 39), ГУЗ «Липецкая городская больница №3 «Свободный сокол» (ул. Ушинского, д.10), ГУЗ «Липецкая городская больница № 4 «Липецк-Мед», (ул. Коммунистическая, д.24), работают в круглосуточном режиме. Детское население города Липецка обслуживается в травмпункте ГУЗ «Областная детская больница» (ул. Московская,6а). Подростки от 15 до 17 лет включительно, проживающие на территории Липецка, могут обращаться и в травмпункты ГУЗ «Липецкая городская больница № 3 «Свободный сокол», ГУЗ «Липецкая городская больница № 4 «Липецк-Мед».    Экстренная госпитализация нуждающихся осуществляется в соответствии с графиком дежурств стационаров.    Пациенты (взрослые и дети), нуждающиеся в экстренной офтальмологической помощи, могут обращаться в офтальмологическое отделение ГУЗ «Областная больница № 2» (ул. Ленина, д.35).     1,3,5,7 января 2019 года, а также в нерабочее время стоматологических поликлиник пациенты (взрослые и дети), нуждающиеся в экстренной стоматологической помощи, могут обращаться в кабинет хирургической стоматологии ГУЗ «Областная стоматологическая поликлиника – стоматологический центр» (ул. Циолковского, д.22).№%:№%:2018-12-26 10:30:13№%:№%:60460495
Движение по главной переправе Липецка - Петровскому мосту - восстановлено http://lipetskcity.ru/iblock/news/e/dvizhenie_po_glavnoj_pereprave_lipecka__petrovskomu_mostu__vosstanovleno26-12-2018/№%:№%:2018-12-26 09:51:29№%:№%:60460495
После открытия Петровского моста работа общественного транспорта возобновляется в прежнем режиме http://lipetskcity.ru/iblock/news/e/posle_otkritija_petrovskogo_mosta_rabota_obshhestvennogo_transporta_vozobnovljaetsja_v_prezhnem_rezhime25-12-2018/№%:№%:2018-12-25 17:14:22№%:№%:60460495
Движение по Петровскому мосту откроют в ночь с 25 на 26 декабря http://lipetskcity.ru/iblock/news/e/dvizhenie_po_petrovskomu_mostu_otkrojut_v_noch_s_25_na_26_dekabrja25-12-2018/№%:№%:2018-12-25 16:16:25№%:№%:60460495
#здоровыйрегион #липецкаяобласть #ЗдоровыйрегионгородЛипецк#ЭтоНужноЗнатьКаждому Юные спортсмены Липецка получили гранты от НЛМК http://lipetskcity.ru/iblock/news/e/junie_sportsmeni_lipecka_poluchili_granti_ot_nlmk25-12-2018/№%:№%:2018-12-25 15:48:20№%:№%:60460495
Спасатели предупреждают липчан о непогоде http://lipetskcity.ru/iblock/news/e/spasateli_preduprezhdajut_lipchan_o_nepogode25-12-2018/№%:№%:2018-12-25 14:38:07№%:№%:60460495
#здоровыйрегион #липецкаяобласть #ЗдоровыйрегионгородЛипецк#ЭтоНужноЗнатьКаждому Меры поддержки семей с детьми вырастут в Новом году http://lipetskcity.ru/iblock/news/e/meri_podderzhki_semej_s_detmi_virastut_v_novom_godu_25-12-2018/№%:№%:2018-12-25 11:25:20№%:№%:60460495
#здоровыйрегион #липецкаяобласть #ЗдоровыйрегионгородЛипецк#ЭтоНужноЗнатьКаждому Встретить Новый Год приглашает «Школа мастеров» http://lipetskcity.ru/iblock/news/zdorovij_region/e/vstretit_novij_god_priglashaet_shkola_masterov__25-12-2018/№%:№%:2018-12-25 11:21:48№%:№%:60460495
Сергей Иванов: В новогодние праздники нужно обеспечить максимально комфортные условия для липчан http://lipetskcity.ru/iblock/news/e/sergej_ivanov_v_novogodnie_prazdniki_nuzhno_obespechit__maksimalno_komfortnie_uslovija_dlja_lipchan__24-12-2018/№%:№%:2018-12-25 08:53:49№%:№%:60460495
Руководители Липецка подвели итоги года и поделились планами на будущее http://lipetskcity.ru/iblock/news/e/rukovoditeli_lipecka_podveli_itogi_goda_i_podelilis_planami_na_budushhee_24-12-2018/№%:№%:2018-12-25 08:53:03№%:№%:60460495
#здоровыйрегион #липецкаяобласть #ЗдоровыйрегионгородЛипецк#ЭтоНужноЗнатьКаждому  Единый день плавания объединил свыше трех тысяч липчан  http://lipetskcity.ru/iblock/news/e/edinij_den_plavanija_obedinil_svishe_treh_tisjach_lipchan_24-12-2018/№%:№%:2018-12-24 17:17:27№%:№%:60460495
Липчан приглашают станцевать под джаз в Доме музыки  http://lipetskcity.ru/iblock/news/e/lipchan_priglashajut_stancevat_pod_dzhaz_v_dome_muziki__24-12-2018/№%:№%:2018-12-24 16:40:45№%:№%:60460495
#здоровыйрегион #липецкаяобласть #ЗдоровыйрегионгородЛипецк#ЭтоНужноЗнатьКаждому Вторая встреча волейбольных клубов «Липецк» и «Динамо-Казань-УОР» подтвердила преимущество липчанок http://lipetskcity.ru/iblock/news/zdorovij_region/e/vtoraja_vstrecha_volejbolnih_klubov_lipeck_i_dinamokazanuor_podtverdila_preimushhestvo_lipchanok_24-12-2018/№%:№%:2018-12-24 14:29:16№%:№%:60460495
#здоровыйрегион #липецкаяобласть #ЗдоровыйрегионгородЛипецк#ЭтоНужноЗнатьКаждому Липецкие волейболистки оказались сильнее казанских http://lipetskcity.ru/iblock/news/zdorovij_region/e/lipeckie_volejbolistki_okazalis_silnee_kazanskih_24-12-2018/№%:№%:2018-12-24 14:26:30№%:№%:60460495
#здоровыйрегион #липецкаяобласть #ЗдоровыйрегионгородЛипецк#ЭтоНужноЗнатьКаждому Городские дома культуры приглашают липчан за здоровьем http://lipetskcity.ru/iblock/news/zdorovij_region/e/gorodskie_doma_kulturi_priglashajut_lipchan_za_zdorovem_24-12-2018/№%:№%:2018-12-24 14:21:38№%:№%:60460495
#здоровыйрегион #липецкаяобласть #ЗдоровыйрегионгородЛипецк#ЭтоНужноЗнатьКаждому Юные жители района «Силикатный» отправятся в «Новогоднее путешествие» http://lipetskcity.ru/iblock/news/zdorovij_region/e/junie_zhiteli_rajona_silikatnij_otpravjatsja_v_novogodnee_puteshestvie_24-12-2018/№%:№%:2018-12-24 14:13:33№%:№%:60460495
Липчан приглашают на спортивно-развлекательный праздник «Новый год шагает по планете» http://lipetskcity.ru/iblock/news/zdorovij_region/e/lipchan_priglashajut_na_sportivnorazvlekatelnij_prazdnik_novij_god_shagaet_po_planete_24-12-2018/ #здоровыйрегион #липецкаяобласть #ЗдоровыйрегионгородЛипецк#ЭтоНужноЗнатьКаждому№%:№%:2018-12-24 14:11:24№%:№%:60460495
#здоровыйрегион #липецкаяобласть #ЗдоровыйрегионгородЛипецк#ЭтоНужноЗнатьКаждому Липецк подводит итоги спортивного года http://lipetskcity.ru/iblock/news/zdorovij_region/e/lipeck_podvodit_itogi_sportivnogo_goda24-12-2018/№%:№%:2018-12-24 14:05:09№%:№%:60460495
Схему движения автобуса №19 изменят ремонтные работы  http://lipetskcity.ru/iblock/news/e/shemu_dvizhenija_avtobusa_19_izmenjat_remontnie_raboti_24-12-2018/№%:№%:2018-12-24 13:40:40№%:№%:60460495
В Липецке демонтируют порядка 50 старых афишных тумб  http://lipetskcity.ru/iblock/news/e/v_lipecke_demontirujut_porjadka_50_starih_afishnih_tumb_24-12-2018/№%:№%:2018-12-24 11:10:03№%:№%:60460495
Генеральная репетиция Нового года в Липецке завершилась ярким 14-минутным фейерверком http://lipetskcity.ru/iblock/news/e/generalnaja_repeticija_novogo_goda_v_lipecke_zavershilas_jarkim_14minutnim_fejerverkom22-12-2018/№%:№%:2018-12-24 09:10:42№%:№%:60460495
#здоровыйрегион #липецкаяобласть #ЗдоровыйрегионгородЛипецк#ЭтоНужноЗнатьКаждому «Мы верим твердо в победу спорта» - в Липецке стартовал Единый день плавания «За здоровое будущее!»  http://lipetskcity.ru/iblock/news/e/mi_verim_tverdo_v_pobedu_sporta__v_lipecke_startoval_edinij_den_plavanija_za_zdorovoe_budushhee_22-12-2018/№%:№%:2018-12-22 13:28:32№%:№%:60460495
С городских магистралей с начала декабря вывезено 37 тысяч кубометров снега http://lipetskcity.ru/iblock/news/e/s_gorodskih_magistralej_s_nachala_dekabrja_vivezeno_37_tisjach_kubometrov_snega22-12-2018/№%:№%:2018-12-22 12:36:53№%:№%:60460495
Четыре грузовика общим весом около ста тонн – Петровский мост испытывают на прочность http://lipetskcity.ru/iblock/news/e/chetire_kamaza_obshhim_vesom_okolo_sta_tonn__petrovskij_most_ispitivajut_na_prochnost22-12-2018/№%:№%:2018-12-22 12:18:50№%:№%:60460495
Уборку липецких дворов от снега и льда в департаменте ЖКХ мониторят в режиме онлайн http://lipetskcity.ru/iblock/news/e/_uborku_lipeckih_dvorov_ot_snega_i_lda_v_departamente_zhkh_monitorjat_v_rezhime_onlajn_21-12-2018/№%:№%:2018-12-22 11:52:26№%:№%:60460495
Более ста конфискованных елей – в Липецке начали борьбу с несанкционированной предновогодней торговлей http://lipetskcity.ru/iblock/news/e/bolee_sta_konfiskovannih_elej__v_lipecke_nachali_borbu_s_nesankcionirovannoj_prednovogodnej_torgovlej21-12-2018/№%:№%:2018-12-21 16:09:48№%:№%:60460495
В мэрии добились повышения заработка сотрудникам более 300 организаций города http://lipetskcity.ru/iblock/news/e/v_mjerii_dobilis_povishenija_zarabotka_sotrudnikam__bolee_300_organizacij_goroda_21-12-2018/№%:№%:2018-12-21 15:59:33№%:№%:60460495
#здоровыйрегион #липецкаяобласть #ЗдоровыйрегионгородЛипецк#ЭтоНужноЗнатьКаждому  Липчане голосуют за Единый день плавания http://lipetskcity.ru/iblock/news/e/lipchane_golosujut_za_edinij_den_plavanija_21-12-2018/№%:№%:2018-12-21 15:58:15№%:№%:60460495
Комиссия по снижению недоимки вернула в бюджет города более 56 миллионов http://lipetskcity.ru/iblock/news/e/komissija_po_snizheniju_nedoimki_vernula_v_bjudzhet_goroda__bolee_56_millionov_21-12-2018/№%:№%:2018-12-21 15:52:13№%:№%:60460495
№%:№%:2018-12-21 15:48:31№%:№%:60460495
В Липецк прибыл первый из 5 электробусов  VOLGABUS 5270E  http://lipetskcity.ru/iblock/news/e/_v_lipeck_pribil_pervij_iz_5_jelektrobusov__volgabus_5270e_21-12-2018/№%:№%:2018-12-21 15:13:51№%:№%:60460495
Победителей муниципального этапа всероссийской олимпиады школьников чествовали в администрации Липецкаhttp://lipetskcity.ru/iblock/news/e/pobeditelej_municipalnogo_jetapa_vserossijskoj_olimpiadi_shkolnikov_chestvovali_v_administracii_lipecka_21-12-2018/№%:№%:2018-12-21 11:59:43№%:№%:60460495
#здоровыйрегион #липецкаяобласть #ЗдоровыйрегионгородЛипецк#ЭтоНужноЗнатьКаждому На хоккейных коробках областного центра проходят зимние спортивные мероприятия http://lipetskcity.ru/iblock/news/e/na_hokkejnih_korobkah_oblastnogo_centra_prohodjat_zimnie_sportivnie_meroprijatija20-12-2018/№%:№%:2018-12-20 18:18:21№%:№%:60460495
#здоровыйрегион #липецкаяобласть #ЗдоровыйрегионгородЛипецк#ЭтоНужноЗнатьКаждому О счастье современной женщины говорили на заседании мобильного клуба молодых семей http://lipetskcity.ru/iblock/news/e/o_schaste_sovremennoj_zhenshhini_govorili_na_zasedanii_mobilnogo_kluba_molodih_semej20-12-2018/№%:№%:2018-12-20 18:01:16№%:№%:60460495
№%:№%:2018-12-20 15:09:01№%:№%:60460495
Несколько улиц района Казинка останутся без электричества http://lipetskcity.ru/iblock/news/e/neskolko_ulic_rajona_kazinka_ostanutsja_bez_jelektrichestva20-12-2018/№%:№%:2018-12-20 14:33:23№%:№%:60460495
Городские экологи подвели итоги благотворительной акции «Новогоднее чудо» http://lipetskcity.ru/iblock/news/e/gorodskie_jekologi_podveli_itogi_blagotvoritelnoj_akcii_novogodnee_chudo20-12-2018/№%:№%:2018-12-20 13:40:49№%:№%:60460495
#здоровыйрегион #липецкаяобласть #ЗдоровыйрегионгородЛипецк#ЭтоНужноЗнатьКаждому В Липецк приедут волейболистки из Казани http://lipetskcity.ru/iblock/news/zdorovij_region/e/v_lipeck_priedut_volejbolistki_iz_kazani20-12-2018/№%:№%:2018-12-20 10:43:54№%:№%:60460495
Разноцветный дождь гирлянд и волшебные деревья – сотрудники управления Советским округом оценили новогоднее убранство улицы Советская  http://lipetskcity.ru/iblock/news/e/raznocvetnij_dozhd_girljand_i_volshebnie_derevja__sotrudniki_upravlenija_sovetskim_okrugom_ocenili_novogodnee_ubranstvo_ulici_sovetskaja_20-12-2018/№%:№%:2018-12-20 10:23:35№%:№%:60460495
Администрация Липецка и Фонд «Сколково» заключили соглашение о партнерстве в инновационной сфере http://lipetskcity.ru/iblock/news/e/administracija_lipecka_i_fond_skolkovo_zakljuchili_soglashenie_o_partnerstve__v_innovacionnoj_sfere19-12-2018/№%:№%:2018-12-20 09:00:51№%:№%:60460495
#здоровыйрегион #липецкаяобласть #ЗдоровыйрегионгородЛипецк#ЭтоНужноЗнатьКаждому Липчан приглашают на Единый день плавания http://lipetskcity.ru/iblock/news/e/lipchan_priglashajut_na_edinij_den_plavanija19-12-2018/№%:№%:2018-12-19 17:46:15№%:№%:60460495
Каменные пуфики, лавочки и урны – на Петровском спуске обновляют малые архитектурные формы http://lipetskcity.ru/iblock/news/e/kamennie_pufiki_lavochki_i_urni__na_petrovskom_spuske_obnovljajut_malie_arhitekturnie_formi19-12-2018/№%:№%:2018-12-19 16:59:10№%:№%:60460495
Книги по саморазвитию пополнят фонды липецких библиотек http://lipetskcity.ru/iblock/news/e/knigi_po_samorazvitiju_popolnjat_fondi_lipeckih_bibliotek19-12-2018/№%:№%:2018-12-19 16:50:46№%:№%:60460495
№%:№%:2018-12-19 16:19:43№%:№%:60460495
Несколько районов Липецка в четверг останутся без воды и света http://lipetskcity.ru/iblock/news/e/neskolko_rajonov_lipecka_v_chetverg_ostanutsja_bez_vodi_i_sveta_19-12-2018/№%:№%:2018-12-19 16:18:32№%:№%:60460495
В Новый год – без долгов и убытков http://lipetskcity.ru/iblock/news/e/v_novij_god__bez_dolgov_i_ubitkov19-12-2018/№%:№%:2018-12-19 16:13:33№%:№%:60460495
Липчане могут подарить детям-сиротам «Новый год в кругу семьи» http://lipetskcity.ru/iblock/news/e/lipchane_mogut_podarit_detjamsirotam_novij_god_v_krugu_semi19-12-2018/№%:№%:2018-12-19 16:03:42№%:№%:60460495
«Crazy ёлки» и «Ёлки-великаны» украсят площадь возле СК Звездный в Липецке  http://lipetskcity.ru/iblock/news/e/crazy_jolki_i_jolkivelikani_ukrasjat_ploshhad_vozle_sk_zvezdnij_v_lipecke_19-12-2018/№%:№%:2018-12-19 16:01:13№%:№%:60460495
В областном центре начинается продажа новогодних деревьев  http://lipetskcity.ru/iblock/news/e/v_oblastnom_centre_nachinaetsja_prodazha_novogodnih_derevev_19-12-2018/№%:№%:2018-12-19 14:50:30№%:№%:60460495
№%:№%:2018-12-19 13:14:25№%:№%:60460495
«Их учили быть птицами» - стали известны имена победителей и призеров конкурса «Молодой лидер города Липецка»  http://lipetskcity.ru/iblock/news/e/ih_uchili_bit_pticami__stali_izvestni_imena_pobeditelej_i_prizerov_konkursa_molodoj_lider_goroda_lipecka_19-12-2018/№%:№%:2018-12-19 12:18:15№%:№%:60460495
Предновогодняя ярмарка пройдёт в Липецке 22 декабря http://lipetskcity.ru/iblock/news/e/prednovogodnjaja_jarmarka_projdjot_v_lipecke_22_dekabrja19-12-2018/№%:№%:2018-12-19 10:04:58№%:№%:60460495
№%:№%:2018-12-19 09:15:34№%:№%:60460495
№%:№%:2018-12-19 09:13:52№%:№%:60460495
№%:№%:2018-12-19 09:13:23№%:№%:60460495
№%:№%:2018-12-19 09:11:57№%:№%:60460495
№%:№%:2018-12-19 09:10:15№%:№%:60460495
№%:№%:2018-12-19 09:08:33№%:№%:60460495
№%:№%:2018-12-19 09:07:54№%:№%:60460495
№%:№%:2018-12-19 09:07:35№%:№%:60460495
№%:№%:2018-12-19 09:07:07№%:№%:60460495
№%:№%:2018-12-19 09:06:51№%:№%:60460495
№%:№%:2018-12-19 09:06:15№%:№%:60460495
№%:№%:2018-12-19 09:04:36№%:№%:60460495
№%:№%:2018-12-19 09:01:17№%:№%:60460495
№%:№%:2018-12-19 09:00:42№%:№%:60460495
№%:№%:2018-12-19 09:00:29№%:№%:60460495
№%:№%:2018-12-19 09:00:09№%:№%:60460495
№%:№%:2018-12-19 08:59:41№%:№%:60460495
№%:№%:2018-12-19 08:59:17№%:№%:60460495
№%:№%:2018-12-19 08:58:56№%:№%:60460495
№%:№%:2018-12-19 08:58:37№%:№%:60460495
№%:№%:2018-12-19 08:58:20№%:№%:60460495
№%:№%:2018-12-19 08:58:04№%:№%:60460495
№%:№%:2018-12-19 08:57:39№%:№%:60460495
Как сделать переход на цифровое телевещание для липчан комфортным и безболезненным, обсуждали в мэрии http://lipetskcity.ru/iblock/news/e/kak_sdelat_perehod_na_cifrovoe_televeshhanie_dlja_lipchan_komfortnim_i_bezboleznennim_obsuzhdali_v_mjerii__18-12-2018/№%:№%:2018-12-19 08:49:21№%:№%:60460495
Праздничное настроение создаём вместе – Липецк продолжает готовиться к Новому году http://lipetskcity.ru/iblock/news/e/prazdnichnoe_nastroenie_sozdajom_vmeste__lipeck_prodolzhaet_gotovitsja_k_novomu_godu18-12-2018/№%:№%:2018-12-18 17:59:18№%:№%:60460495
В Липецке продолжается монтаж уникального катка  http://lipetskcity.ru/iblock/news/e/v_lipecke_prodolzhaetsja_montazh_unikalnogo_katka_18-12-2018/№%:№%:2018-12-18 15:59:14№%:№%:60460495
В Липецке повышение мутности воды http://lipetskcity.ru/iblock/news/e/v_lipecke_povishenie_mutnosti_vodi18-12-2018/№%:№%:2018-12-18 15:09:33№%:№%:60460495
Традиционную новогоднюю посылку отправили экипажу субмарины «Липецк» http://lipetskcity.ru/iblock/news/e/tradicionnuju_novogodnjuju_posilku_otpravili_jekipazhu_submarini_lipeck18-12-2018/№%:№%:2018-12-18 13:44:22№%:№%:60460495
Кольцо на пересечении улиц Катукова и Стаханова станет главной дорогой http://lipetskcity.ru/iblock/news/e/kolco_na_peresechenii_ulic_katukova_i_stahanova_stanet_glavnoj_dorogoj_18-12-2018/№%:№%:2018-12-18 10:28:48№%:№%:60460495
Сергей Иванов: «Мэр ответственен за все, что происходит в городе»№%:№%:2018-12-18 09:15:34№%:№%:60460495
#здоровыйрегион #липецкаяобласть #ЗдоровыйрегионгородЛипецк#ЭтоНужноЗнатьКаждому Новые открытия фестиваля «Звёздочки ГТО» http://lipetskcity.ru/iblock/news/e/novie_otkritija_festivalja_zvjozdochki_gto17-12-2018/№%:№%:2018-12-17 18:54:50№%:№%:60460495
Ремонтные работы станут причиной масштабного отключения водоснабжения http://lipetskcity.ru/iblock/news/e/remontnie_raboti_stanut_prichinoj_masshtabnogo_otkljuchenija_vodosnabzhenija17-12-2018/№%:№%:2018-12-17 16:05:55№%:№%:60460495
#здоровыйрегион #липецкаяобласть #ЗдоровыйрегионгородЛипецк#ЭтоНужноЗнатьКаждому Забота о здоровье – круглый год В предпоследнюю неделю декабря в липецких учреждениях культуры проводятся традиционные мероприятия, направленные на оздоровление горожан и формирования здорового образа жизни. В Липецком Доме музыке любительское объединение «Сталкер» каждую пятницу, в 16.00 проводит оздоровительную гимнастику, курсы по массажу, лекции по здоровому питанию. В филиале Липецкого Дома музыки «Студеновский» любительское объединение «Турнир» организует для всех желающих занятия по настольному теннисом и игре в дартс. По воскресеньям с 15.00 в городском Дворце культуры открыт клуб «Родник», объединяющий людей, ведущих антиалкогольную работу. В ДК «Луч» с понедельника по субботу в 13.00 проходят занятия любительского объединения «На зарядку становись».№%:№%:2018-12-17 15:54:42№%:№%:60460495
#здоровыйрегион #липецкаяобласть #ЗдоровыйрегионгородЛипецк Спортивно-туристский праздник «Здоровым быть здорово!»   http://lipetskcity.ru/iblock/news/zdorovij_region/e/sportivnoturistskij_prazdnik_zdorovim_bit_zdorovo_17-12-2018/№%:№%:2018-12-17 15:45:03№%:№%:60460495
#здоровыйрегион #липецкаяобласть #ЗдоровыйрегионгородЛипецк Фестиваль «Петровские забавы, или Новогодний фейерверк по-Липецки» приглашает http://lipetskcity.ru/iblock/news/zdorovij_region/e/festival_petrovskie_zabavi_ili_novogodnij_fejerverk_polipecki_priglashaet17-12-2018/№%:№%:2018-12-17 15:38:28№%:№%:60460495
#здоровыйрегион #липецкаяобласть #ЗдоровыйрегионгородЛипецк№%:№%:2018-12-17 15:31:25№%:№%:60460495
#здоровыйрегион #липецкаяобласть #ЗдоровыйрегионгородЛипецк№%:№%:2018-12-17 15:26:36№%:№%:60460495
#здоровыйрегион #липецкаяобласть #ЗдоровыйрегионгородЛипецк#ЭтоНужноЗнатьКаждому Более 80 юных спортсменов выполнили нормативы комплекса ГТО http://lipetskcity.ru/iblock/news/zdorovij_region/e/bolee_80_junih_sportsmenov_vipolnili_normativi_kompleksa_gto17-12-2018/№%:№%:2018-12-17 11:50:37№%:№%:60460495
С городских улиц вывезли порядка 7 тысяч кубометров снега  http://lipetskcity.ru/iblock/news/e/s_gorodskih_ulic_vivezli_porjadka_7_tisjach_kubometrov_snega__17-12-2018/№%:№%:2018-12-17 10:39:09№%:№%:60460495
«Основной государственный экзамен: Знаю! Умею! Действую!» - в школах города прошёл единый информационный день http://lipetskcity.ru/iblock/news/e/_osnovnoj_gosudarstvennij_jekzamen_znaju_umeju_dejstvuju__v_shkolah_goroda_proshjol_edinij_informacionnij_den17-12-2018/№%:№%:2018-12-17 10:18:26№%:№%:60460495
Камин с уютным креслом появился на площади Петра Великого lipetskcity.ru/iblock/news/e/kamin_s_ujutnim_kreslom_pojavilsja_na_ploshhadi_petra_velikogo16-12-2018/№%:№%:2018-12-16 12:06:59№%:№%:60460495
Новогодние ёлки и иллюминацию в городе начали включать уже в первой декаде декабря http://lipetskcity.ru/iblock/news/e/v_gorode_zagorajutsja_novogodnie_jolki_i_prazdnichnaja_illjuminacija14-12-2018/№%:№%:2018-12-14 20:19:21№%:№%:60460495
Объединить усилия на благо города и его жителей – в Липецке состоялась конференция общественности http://lipetskcity.ru/iblock/news/e/obedinit_usilija_na_blago_goroda_i_ego_zhitelej__v_lipecke_sostojalas_konferencija_obshhestvennosti14-12-2018/№%:№%:2018-12-14 20:18:17№%:№%:60460495
Липчан приглашают принять участие в благотворительной акции «Подари новогоднее настроение» http://lipetskcity.ru/iblock/news/e/lipchan_priglashajut_prinjat_uchastie_v_blagotvoritelnoj_akcii_podari_novogodnee_nastroenie14-12-2018/№%:№%:2018-12-14 20:17:38№%:№%:60460495
У Комсомольского пруда устанавливают ажурные арки, белоснежные скамейки и сказочные фонари http://lipetskcity.ru/iblock/news/e/u_komsomolskogo_pruda_ustanavlivajut_azhurnie_arki_belosnezhnie_skamejki_i_skazochnie_fonari14-12-2018/№%:№%:2018-12-14 20:17:00№%:№%:60460495
Итоги летней оздоровительной кампании, вакцинации и социального партнерства в 2018 году обсудили на городской трехсторонней комиссии  http://lipetskcity.ru/iblock/news/e/itogi_letnej_ozdorovitelnoj_kampanii_vakcinacii_i_socialnogo_partnerstva_v_2018_godu_obsudili_na_gorodskoj_trehstoronnej_komissii_14-12-2018/№%:№%:2018-12-14 16:48:45№%:№%:60460495
В частном секторе Липецка в понедельник не будет воды http://lipetskcity.ru/iblock/news/e/v_chastnom_sektore_lipecka_v_ponedelnik_ne_budet_vodi14-12-2018/№%:№%:2018-12-14 16:37:16№%:№%:60460495
Приводить в порядок участок Лебедянского выезда подрядчик будет за свой счет http://lipetskcity.ru/iblock/news/e/privodit_v_porjadok_uchastok_lebedjanskogo_viezda_podrjadchik_budet_za_svoj_schet_14-12-2018/№%:№%:2018-12-14 16:36:25№%:№%:60460495
Обеспечение безопасности новогодних мероприятий на контроле мэрии  http://lipetskcity.ru/iblock/news/e/obespechenie_bezopasnosti_novogodnih_meroprijatij_na_kontrole_mjerii_14-12-2018/№%:№%:2018-12-14 14:02:07№%:№%:60460495
Липецке определили победителей Фестиваля родительских инициатив http://lipetskcity.ru/iblock/news/e/v_lipecke_opredelili_pobeditelej_festivalja_roditelskih_iniciativ14-12-2018/№%:№%:2018-12-14 13:51:09№%:№%:60460495
Стали известны имена самых юных липецких умников и умниц http://lipetskcity.ru/iblock/news/e/stali_izvestni_imena_samih_junih_lipeckih_umnikov_i_umnic14-12-2018/№%:№%:2018-12-14 11:52:00№%:№%:60460495
В липецкой библиотеке презентовали книгу сказок народов, проживающих в регионе http://lipetskcity.ru/iblock/news/e/v_lipeckoj_biblioteke__prezentovali_knigu_skazok_narodov__prozhivajushhih_v_regione14-12-2018/№%:№%:2018-12-14 11:37:41№%:№%:60460495
В администрации города обсудили генеральную репетицию Нового года http://lipetskcity.ru/iblock/news/e/v_administracii_goroda_obsudili_generalnuju_repeticiju_novogo_goda13-12-2018/№%:№%:2018-12-13 17:09:31№%:№%:60460495
Насладиться органной музыкой липчан приглашают «Под небом Парижа»  http://lipetskcity.ru/iblock/news/e/nasladitsja_organnoj_muzikoj_lipchan_priglashajut_pod_nebom_parizha__13-12-2018/№%:№%:2018-12-13 17:08:45№%:№%:60460495
Глава Липецка Сергей Иванов провёл очередное заседание антикоррупционной комиссии http://lipetskcity.ru/iblock/news/e/glava_lipecka_sergej_ivanov_provjol_ocherednoe_zasedanie_antikorrupcionnoj_komissii13-12-2018/№%:№%:2018-12-13 16:56:08№%:№%:60460495
В расписание муниципальных маршрутов №№ 9 и 26 внесены изменения http://lipetskcity.ru/iblock/news/e/v_raspisanie_municipalnih_marshrutov__9_i_26_vneseni_izmenenija_13-12-2018/№%:№%:2018-12-13 16:28:52№%:№%:60460495
Жителей и гостей Липецка приглашают на праздничные ярмарки http://lipetskcity.ru/iblock/news/e/zhitelej_i_gostej_lipecka_priglashajut_na_prazdnichnie_jarmarki13-12-2018/№%:№%:2018-12-13 16:12:18№%:№%:60460495
#здоровыйрегион #липецкаяобласть #ЗдоровыйрегионгородЛипецк#ЭтоНужноЗнатьКаждому Единый день плавания состоится в Липецке 22 декабря  http://lipetskcity.ru/iblock/news/e/edinij_den_plavanija_sostoitsja_v_lipecke_22_dekabrja_13-12-2018/№%:№%:2018-12-13 15:32:59№%:№%:60460495
#здоровыйрегион #липецкаяобласть #ЗдоровыйрегионгородЛипецк#ЭтоНужноЗнатьКаждому Тестирование студентов ВУЗов стало основной темой городской антинаркотической комиссии  http://lipetskcity.ru/iblock/news/e/testirovanie_studentov_vuzov_stalo_osnovnoj_temoj_gorodskoj_antinarkoticheskoj_komissii_13-12-2018/№%:№%:2018-12-13 15:04:20№%:№%:60460495
В День Конституции глава Липецка Сергей Иванов провёл приём граждан http://lipetskcity.ru/iblock/news/e/v_den_konstitucii_glava_lipecka_sergej_ivanov_provjol_prijom_grazhdan12-12-2018/№%:№%:2018-12-12 18:26:36№%:№%:60460495
Выпускники городских школ борются за право стать ведущими праздника «Липецкие зори» http://lipetskcity.ru/iblock/news/e/vipuskniki_gorodskih_shkol_borjutsja_za_pravo_stat_vedushhimi_prazdnika_lipeckie_zori12-12-2018/№%:№%:2018-12-12 18:04:45№%:№%:60460495
Ремонт светофора на Лебедянском шоссе продлен на два дня  http://lipetskcity.ru/iblock/news/e/remont_svetofora_na_lebedjanskom_shosse_prodlen_na_dva_dnja_12-12-2018/№%:№%:2018-12-12 17:28:30№%:№%:60460495
В Липецке продолжается обследование участков, которые могут усложнить пропуск паводковых вод  http://lipetskcity.ru/iblock/news/e/v_lipecke_prodolzhaetsja_obsledovanie_uchastkov_kotorie_mogut_uslozhnit_propusk_pavodkovih_vod_12-12-2018/№%:№%:2018-12-12 15:22:07№%:№%:60460495
Урок, посвященный 25-летию Конституции РФ, провел для девятиклассников депутат горсовета http://lipetskcity.ru/iblock/news/e/urok_posvjashhennij_25letiju_konstitucii_rf_provel_dlja_devjatiklassnikov_deputat_gorsoveta12-12-2018/№%:№%:2018-12-12 15:21:33№%:№%:60460495
В Минстрое подготовили методику определения индекса качества городской среды http://lipetskcity.ru/iblock/news/e/v_minstroe_podgotovili_metodiku_opredelenija_indeksa_kachestva_gorodskoj_sredi__12-12-2018/№%:№%:2018-12-12 15:20:21№%:№%:60460495
Липчан приглашают присоединиться к проекту «Россия без шинных свалок» http://lipetskcity.ru/iblock/news/e/lipchan_priglashajut_prisoedinitsja_k_proektu_rossija_bez_shinnih_svalok12-12-2018/№%:№%:2018-12-12 14:51:17№%:№%:60460495
Пожарная безопасность учреждений соцкультбыта стала центральной темой заседания профильной комиссии  http://lipetskcity.ru/iblock/news/e/pozharnaja_bezopasnost_uchrezhdenij_sockultbita_stala_centralnoj_temoj_zasedanija_profilnoj_komissii_12-12-2018/№%:№%:2018-12-12 12:13:21№%:№%:60460495
Украсить город и подарить праздничное настроение его жителям – стать участником конкурса на лучшее новогоднее оформление может каждый http://lipetskcity.ru/iblock/news/e/ukrasit_gorod_i_podarit_prazdnichnoe_nastroenie_ego_zhiteljam__stat_uchastnikom_konkursa_na_luchshee_novogodnee_oformlenie_mozhet_kazhdij11-12-2018/№%:№%:2018-12-11 18:33:00№%:№%:60460495
Липчане почтили память погибших на Северном Кавказе http://lipetskcity.ru/iblock/news/e/lipchane_pochtili_pamjat_pogibshih_na_severnom_kavkaze11-12-2018/№%:№%:2018-12-11 18:32:04№%:№%:60460495
Участок улицы Гагарина частично перекроют из-за ремонтных работ  http://lipetskcity.ru/iblock/news/e/uchastok_ulici_gagarina_chastichno_perekrojut_izza_remontnih_rabot_10-12-2018/№%:№%:2018-12-10 20:35:13№%:№%:60460495
Стала известна дата проведения городского праздника выпускников «Липецкие зори» http://lipetskcity.ru/iblock/news/e/stala_izvestna_data_provedenija_gorodskogo_prazdnika_vipusknikov_lipeckie_zori10-12-2018/№%:№%:2018-12-10 18:20:31№%:№%:60460495
Отключения света и холодной воды: адреса на вторник и среду http://lipetskcity.ru/iblock/news/e/otkljuchenija_sveta_i_holodnoj_vodi_adresa_na_vtornik_i_sredu10-12-2018/№%:№%:2018-12-10 17:16:43№%:№%:60460495
#здоровыйрегион #липецкаяобласть #ЗдоровыйрегионгородЛипецк#ЭтоНужноЗнатьКаждому В Липецке состоялся фестиваль воркаута  http://lipetskcity.ru/iblock/news/e/v_lipecke_sostojalsja_festival_vorkauta_10-12-2018/№%:№%:2018-12-10 17:15:26№%:№%:60460495
Каждый десятый вызов на номер «112» – ложный http://lipetskcity.ru/iblock/news/e/kazhdij_desjatij_vizov_na_nomer_112__lozhnij10-12-2018/№%:№%:2018-12-10 16:17:41№%:№%:60460495
Порядка 4 тысяч кубометров снега вывезли с улиц Липецка в минувшие выходные  http://lipetskcity.ru/iblock/news/e/porjadka_4_tisjach_kubometrov_snega_vivezli_s_ulic_lipecka_v_minuvshie_vihodnie__10-12-2018/№%:№%:2018-12-10 16:04:25№%:№%:60460495
Ясельные корпуса для семи липецких детских садов возведут к новому учебному году  http://lipetskcity.ru/iblock/news/e/__jaselnie_korpusa_dlja_semi_lipeckih_detskih_sadov_vozvedut_k_novomu_uchebnomu_godu__10-12-2018/№%:№%:2018-12-10 15:00:49№%:№%:60460495
В расписания трамвайных маршрутов № 1 и № 5 будут внесены изменения  http://lipetskcity.ru/iblock/news/e/v_raspisanija_tramvajnih_marshrutov__1_i__5_budut_vneseni_izmenenija_10-12-2018/№%:№%:2018-12-10 13:53:46№%:№%:60460495
Хор Дедов Морозов прозвучит на фестивале «Петровские забавы» в Липецке http://lipetskcity.ru/iblock/news/e/__hor_dedov_morozov_prozvuchit_na_festivale_petrovskie_zabavi_v_lipecke__10-12-2018/№%:№%:2018-12-10 12:44:52№%:№%:60460495
Олимпийский чемпион дал старт липецкому спортивно-просветительскому проекту http://lipetskcity.ru/iblock/news/e/olimpijskij_chempion_dal_start_lipeckomu_sportivnoprosvetitelskomu_proektu10-12-2018/№%:№%:2018-12-10 12:44:23№%:№%:60460495
Ушел из жизни народный художник Юрий Гришко  http://lipetskcity.ru/iblock/news/e/ushel_iz_zhizni_narodnij_hudozhnik_jurij_grishko_10-12-2018/№%:№%:2018-12-10 11:32:04№%:№%:60460495
В Доме музыки подвели итоги годовой работы главных помощников муниципальной власти  http://lipetskcity.ru/iblock/news/e/v_dome_muziki_podveli_itogi_godovoj_raboti_glavnih_pomoshhnikov_municipalnoj_vlasti_07-12-2018/№%:№%:2018-12-07 22:44:55№%:№%:60460495
#здоровыйрегион #липецкаяобласть #ЗдоровыйрегионгородЛипецк Праздник для детей с ограниченными возможностями здоровья пройдёт в Липецке http://lipetskcity.ru/iblock/news/e/prazdnik_dlja_detej_s_ogranichennimi_vozmozhnostjami_zdorovja_projdjot_v_lipecke_07-12-2018/№%:№%:2018-12-07 16:36:49№%:№%:60460495
#здоровыйрегион #липецкаяобласть #ЗдоровыйрегионгородЛипецк Липецк примет волейболисток из Владивостока http://lipetskcity.ru/iblock/news/zdorovij_region/e/lipeck_primet_volejbolistok_iz_vladivostoka07-12-2018/№%:№%:2018-12-07 16:32:22№%:№%:60460495
#здоровыйрегион #липецкаяобласть #ЗдоровыйрегионгородЛипецк В бассейне «Лидер» соревноваться в плавании будут особенные спортсмены http://lipetskcity.ru/iblock/news/e/v_bassejne_lider_sorevnovatsja_v_plavanii_budut_osobennie_sportsmeni07-12-2018/№%:№%:2018-12-07 16:18:51№%:№%:60460495
Движение транспорта вдоль набережной будет ограничено 8 декабря http://lipetskcity.ru/iblock/news/e/dvizhenie_transporta_vdol_naberezhnoj_budet_ogranicheno_8_dekabrja07-12-2018/№%:№%:2018-12-07 15:21:07№%:№%:60460495
Липчан предупреждают о сильном снеге и ухудшении видимости http://lipetskcity.ru/iblock/news/e/lipchan_preduprezhdajut_o_silnom_snege_i_uhudshenii_vidimosti07-12-2018/№%:№%:2018-12-07 14:29:07№%:№%:60460495
Сергей Иванов: В Стратегии пространственного развития Российской Федерации важно учесть потребности областных центров http://lipetskcity.ru/iblock/news/e/sergej_ivanov_v_strategii_prostranstvennogo_razvitija_rossijskoj_federacii__vazhno_uchest_potrebnosti_oblastnih_centrov___06-12-2018/№%:№%:2018-12-07 14:24:45№%:№%:60460495
Общероссийский день приема граждан в Липецке проведут по трём адресам http://lipetskcity.ru/iblock/news/e/obshherossijskij_den_priema_grazhdan_v_lipecke_provedut_po_trjom_adresam07-12-2018/№%:№%:2018-12-07 13:34:06№%:№%:60460495
С 12 декабря первый рейс 27 автобуса будет отправляться от остановки «НЛМК» в 5:20 http://lipetskcity.ru/iblock/news/e/s_12_dekabrja_pervij_rejs_27_avtobusa_budet_otpravljatsja_s_ostanovki_nlmk_v_52007-12-2018/№%:№%:2018-12-07 11:45:54№%:№%:60460495
В областном центре ищут «Липчанку года»  http://lipetskcity.ru/iblock/news/e/v_oblastnom_centre__ishhut_lipchanku_goda_07-12-2018/№%:№%:2018-12-07 10:13:43№%:№%:60460495
Органы ТОС принимают участие во всех значимых для города проектах http://lipetskcity.ru/iblock/news/e/organi_tos_prinimajut_uchastie_vo_vseh_znachimih_dlja_goroda_proektah06-12-2018/№%:№%:2018-12-07 09:25:13№%:№%:60460495
Липецкие школьники станут участниками проектов по формированию культуры безопасности http://lipetskcity.ru/iblock/news/e/lipeckie_shkolniki_stanut_uchastnikami_proektov_po_formirovaniju_kulturi_bezopasnosti06-12-2018/№%:№%:2018-12-06 17:44:25№%:№%:60460495
На борьбу с последствиями снегопада вышло 88 единиц спецтехники  http://lipetskcity.ru/iblock/news/e/na_borbu_s_posledstvijami_snegopada_vishlo_88_edinic_spectehniki_06-12-2018/№%:№%:2018-12-06 11:12:12№%:№%:60460495
Схема движения автобуса № 7 «О» изменится с сегодняшнего дня http://lipetskcity.ru/iblock/news/e/shema_dvizhenija_avtobusa__7_o_izmenitsja_s_segodnjashnego_dnja06-12-2018/№%:№%:2018-12-06 09:18:21№%:№%:60460495
#здоровыйрегион #липецкаяобласть #ЗдоровыйрегионгородЛипецк Принять участие в благотворительной акции «Новогоднее чудо» можно до 15 декабря http://lipetskcity.ru/iblock/news/e/prinjat_uchastie_v_blagotvoritelnoj_akcii_novogodnee_chudo_mozhno_do_15_dekabrja05-12-2018/№%:№%:2018-12-05 16:59:04№%:№%:60460495
Ремонтные работы оставят ряд улиц Липецка без воды и элетроэнергии http://lipetskcity.ru/iblock/news/e/remontnie_raboti_ostavjat_rjad_ulic_lipecka_bez_vodi_i_jeletrojenergii05-12-2018/№%:№%:2018-12-05 16:53:21№%:№%:60460495
#здоровыйрегион #липецкаяобласть #ЗдоровыйрегионгородЛипецк#ЭтоНужноЗнатьКаждому Спортивное начало зимы детям и подросткам дарит ГДЮЦ «Спортивный»  http://lipetskcity.ru/iblock/news/e/sportivnoe_nachalo_zimi_detjam_i_podrostkam_darit_gdjuc_sportivnij_05-12-2018/№%:№%:2018-12-05 16:38:10№%:№%:60460495
Юных представителей творческих и рабочих профессий объединит Форум молодежи Липецкой области  http://lipetskcity.ru/iblock/news/e/junih_predstavitelej_tvorcheskih_i_rabochih_professij_obedinit_forum_molodezhi_lipeckoj_oblasti_05-12-2018/№%:№%:2018-12-05 15:13:48№%:№%:60460495
ЦБС Липецка стала лауреатом Всероссийского конкурса по правовому просвещению http://lipetskcity.ru/iblock/news/e/cbs_lipecka_stala_laureatom_vserossijskogo_konkursa_po_pravovomu_prosveshheniju05-12-2018/№%:№%:2018-12-05 15:05:54№%:№%:60460495
«Горячая линия» по вопросам качества детских товаров и новогодних подарков начнет работать 10 декабря http://lipetskcity.ru/iblock/news/e/gorjachaja_linija_po_voprosam_kachestva_detskih_tovarov_i_novogodnih_podarkov_nachnet_rabotat_10_dekabrja05-12-2018/№%:№%:2018-12-05 14:35:02№%:№%:60460495
В рамках аварийного ремонта привели в порядок около 900 м2 липецких дорог  http://lipetskcity.ru/iblock/news/e/v_ramkah_avarijnogo_remonta_priveli_v_porjadok_okolo_900_m2_lipeckih_dorog__05-12-2018/№%:№%:2018-12-05 11:39:48№%:№%:60460495
В регионе заработал информационный ресурс в сфере защиты прав потребителей http://lipetskcity.ru/iblock/news/e/v_regione_zarabotal_informacionnij_resurs_v_sfere_zashhiti_prav_potrebitelej05-12-2018/№%:№%:2018-12-05 11:39:00№%:№%:60460495
С городских улиц за сутки вывезено порядка 900 кубометров снега  http://lipetskcity.ru/iblock/news/e/s_gorodskih_ulic_za_sutki_vivezeno_porjadka_900__kubometrov_snega_05-12-2018/№%:№%:2018-12-05 10:58:16№%:№%:60460495
Несколько улиц жилого района Дачный останутся без электричества http://lipetskcity.ru/iblock/news/e/neskolko_ulic_zhilogo_rajona_dachnij_ostanutsja_bez_jelektrichestva04-12-2018/№%:№%:2018-12-04 16:12:17№%:№%:60460495
#здоровыйрегион #липецкаяобласть #ЗдоровыйрегионгородЛипецк#ЭтоНужноЗнатьКаждому В Есенинке стартует спортивно-просветительский проект «Волейбол: Читай и играй!» http://lipetskcity.ru/iblock/news/e/v_eseninke_startuet_sportivnoprosvetitelskij_proekt_volejbol_chitaj_i_igraj04-12-2018/№%:№%:2018-12-04 16:10:24№%:№%:60460495
#здоровыйрегион #липецкаяобласть #ЗдоровыйрегионгородЛипецк#ЭтоНужноЗнатьКаждому Липчан приглашают на фестиваль по воркауту http://lipetskcity.ru/iblock/news/e/lipchan_priglashajut_na_festival_po_vorkautu04-12-2018/№%:№%:2018-12-04 16:09:12№%:№%:60460495
Липчанам предлагают выбрать гимн города  http://lipetskcity.ru/iblock/news/e/lipchanam_predlagajut_vibrat_gimn_goroda_04-12-2018/№%:№%:2018-12-04 13:49:42№%:№%:60460495
Липецк приобретает спецтехнику для уборки города общей стоимостью около 20 млн. рублей   http://lipetskcity.ru/iblock/news/e/lipeck_priobretaet_spectehniku_dlja_uborki_goroda_obshhej_stoimostju_okolo_20_mln_rublej_04-12-2018/№%:№%:2018-12-04 12:04:20№%:№%:60460495
#здоровыйрегион #липецкаяобласть #ЗдоровыйрегионгородЛипецк Ледовые катки в липецких дворах приняли первых посетителей http://lipetskcity.ru/iblock/news/e/ledovie_katki_v_lipeckih_dvorah_prinjali_pervih_posetitelej_04-12-2018/№%:№%:2018-12-04 11:53:52№%:№%:60460495
#здоровыйрегион #липецкаяобласть #ЗдоровыйрегионгородЛипецк Полумарафон в 21 километр предложат преодолеть липчанам и гостям города в мае следующего года http://lipetskcity.ru/iblock/news/e/polumarafon_v_21_kilometr_predlozhat_preodolet_lipchanam_i_gostjam_goroda_v_mae_sledujushhego_goda03-12-2018/№%:№%:2018-12-03 17:49:16№%:№%:60460495
Любителей киновидеотворчества приглашают на фестиваль «30 кадров» http://lipetskcity.ru/iblock/news/e/ljubitelej_kinovideotvorchestva_priglashajut_na_festival_30_kadrov03-12-2018/№%:№%:2018-12-03 17:47:41№%:№%:60460495
Липецкие библиотекари посетили Москву с профессиональным визитом http://lipetskcity.ru/iblock/news/e/lipeckie_bibliotekari_posetili_moskvu_s_professionalnim_vizitom03-12-2018/№%:№%:2018-12-03 17:31:05№%:№%:60460495
Липецкие школьники примут участие во всероссийской акции «Урок цифры» http://lipetskcity.ru/iblock/news/e/lipeckie_shkolniki_primut_uchastie_vo_vserossijskoj_akcii_urok_cifri03-12-2018/№%:№%:2018-12-03 17:00:01№%:№%:60460495
Отключения воды и света в Липецке 4 декабря http://lipetskcity.ru/iblock/news/e/otkljuchenija_vodi_i_sveta_v_lipecke_4_dekabrja_03-12-2018/№%:№%:2018-12-03 16:43:00№%:№%:60460495
В Липецке появилась еще одна современная спортплощадка  http://lipetskcity.ru/iblock/news/e/v_lipecke_pojavilas_eshhe_odna_sovremennaja_sportploshhadka_03-12-2018/№%:№%:2018-12-03 14:50:49№%:№%:60460495
#здоровыйрегион #липецкаяобласть #ЗдоровыйрегионгородЛипецк#Заздоровуюсредуобитания Проект липецких экологов получил диплом Международной экологической Премии «EcoWorld» http://lipetskcity.ru/iblock/news/e/lipeck_poluchil_diplom_mezhdunarodnoj_jekologicheskoj_premii_ecoworld03-12-2018/№%:№%:2018-12-03 14:39:24№%:№%:60460495
Дискотеки на снегу, спектакли и представления – в городе готовятся к яркой встрече 2019-го годаhttp://lipetskcity.ru/iblock/news/e/diskoteki_na_snegu_spektakli_i_predstavlenija__v_gorode_gotovjatsja_k_jarkoj_vstreche_2019go_goda03-12-2018/№%:№%:2018-12-03 13:33:44№%:№%:60460495
Площадь у СК «Звездный», где обустроят новый каток, станет главным местом проведения новогодних праздников в Липецке http://lipetskcity.ru/iblock/news/e/ploshhad_u_sk_zvezdnij_gde_obustrojat_novij_katok_stanet_glavnim_mestom_provedenija_novogodnih_prazdnikov_v_lipecke03-12-2018/№%:№%:2018-12-03 13:31:52№%:№%:60460495
Председателем департамента экономического развития администрации Липецка назначена Ольга Герасименко http://lipetskcity.ru/iblock/news/e/predsedatelem_departamenta_jekonomicheskogo_razvitija_administracii_lipecka_naznachena_olga_gerasimenko03-12-2018/№%:№%:2018-12-03 10:41:21№%:№%:60460495
С городских улиц вывезено порядка 210 м3 снега  http://lipetskcity.ru/iblock/news/e/s_gorodskih_ulic_vivezeno_porjadka_210_m3_snega__03-12-2018/№%:№%:2018-12-03 10:39:42№%:№%:60460495
Победителем конкурса «Дебют» стала музыкальный руководитель детского сада № 25 Ирина Щербатых http://lipetskcity.ru/iblock/news/e/pobeditelem_konkursa_debjut_stala_muzikalnij_rukovoditel_detskogo_sada__25_irina_shherbatih03-12-2018/№%:№%:2018-12-03 10:26:31№%:№%:60460495
№%:№%:2018-12-03 08:32:41№%:№%:60460495
#здоровыйрегион #липецкаяобласть #ЗдоровыйрегионгородЛипецк Стали известны победители Спартакиады среди детей и подростков по месту жительства http://lipetskcity.ru/iblock/news/zdorovij_region/e/stali_izvestni_pobediteli_spartakiadi_sredi_detej_i_podrostkov_po_mestu_zhitelstva30-11-2018/№%:№%:2018-11-30 16:54:12№%:№%:60460495
Липецких предпринимателей приглашают принять участие в конкурсе на лучшее новогоднее оформление http://lipetskcity.ru/iblock/news/e/lipeckih_predprinimatelej_priglashajut_prinjat_uchastie_v_konkurse_na_luchshee_novogodnee_oformlenie30-11-2018/№%:№%:2018-11-30 16:53:06№%:№%:60460495
В школе №29 чествовали победителей и призеров фестиваля «Крепка семья – крепка держава!»!  http://lipetskcity.ru/iblock/news/e/v_shkole_29_chestvovali_pobeditelej_i_prizerov_festivalja_krepka_semja__krepka_derzhava_30-11-2018/№%:№%:2018-11-30 16:51:36№%:№%:60460495
#здоровыйрегион #липецкаяобласть #ЗдоровыйрегионгородЛипецк В Липецке открывается сезон массовых катаний на коньках http://lipetskcity.ru/iblock/news/e/v_lipecke_otkrivaetsja_sezon_massovih_katanij_na_konkah30-11-2018/№%:№%:2018-11-30 16:17:02№%:№%:60460495
В Липецке начал работать мобильный пост весового контроля  http://lipetskcity.ru/iblock/news/e/v_lipecke_nachal_rabotat_mobilnij_post_vesovogo_kontrolja_30-11-2018/№%:№%:2018-11-30 15:47:00№%:№%:60460495
«Петровские забавы» соберут гостей на площади у Спортивного комплекса «Звездный» http://lipetskcity.ru/iblock/news/e/petrovskie_zabavi_soberut_gostej_na_ploshhadi_u_sportivnogo_kompleksa_zvezdnij30-11-2018/№%:№%:2018-11-30 15:28:22№%:№%:60460495
Об организации детского досуга и предупреждении наркомании говорили в администрации города http://lipetskcity.ru/iblock/news/e/ob_organizacii_detskogo_dosuga_i_preduprezhdenii_narkomanii_govorili_v_administracii_goroda30-11-2018/№%:№%:2018-11-30 11:17:10№%:№%:60460495
#здоровыйрегион #липецкаяобласть #ЗдоровыйрегионгородЛипецк Липчан приглашают присоединиться к воркаут-движению http://lipetskcity.ru/iblock/news/e/lipchan_priglashajut_prisoedinitsja_k_vorkautdvizheniju29-11-2018/№%:№%:2018-11-29 17:25:25№%:№%:60460495
Ремонтные работы станут причиной отключения воды и электроснабжения  http://lipetskcity.ru/iblock/news/e/remontnie_raboti_stanut_prichinoj_otkljuchenija_vodi_i_jelektrosnabzhenija29-11-2018/№%:№%:2018-11-29 16:56:09№%:№%:60460495
Яркая палитра традиций и культур народов мира - в Липецке прошел фестиваль «Встреча друзей»  http://lipetskcity.ru/iblock/news/e/jarkaja_palitra_tradicij_i_kultur_narodov_mira__v_lipecke_proshel_festival_vstrecha_druzej_29-11-2018/№%:№%:2018-11-29 14:59:51№%:№%:60460495
В работу муниципального маршрута № 6К вносятся изменения  http://lipetskcity.ru/iblock/news/e/v_rabotu_municipalnogo_marshruta__6k_vnosjatsja_izmenenija_29-11-2018/№%:№%:2018-11-29 14:28:43№%:№%:60460495
Фестиваль «День добрых сердец» пройдёт в Липецке http://lipetskcity.ru/iblock/news/e/festival_den_dobrih_serdec_projdjot_v_lipecke_29-11-2018/№%:№%:2018-11-29 10:21:09№%:№%:60460495
Дом музыки приготовил для липчан цикл новогодних концертов http://lipetskcity.ru/iblock/news/e/dom_muziki_prigotovil_dlja_lipchan_cikl_novogodnih_koncertov29-11-2018/№%:№%:2018-11-29 09:28:19№%:№%:60460495
В администрации обсудили Концепцию создания «Умного города»  http://lipetskcity.ru/iblock/news/e/v_administracii_obsudili_koncepciju_sozdanija_umnogo_goroda_29-11-2018/№%:№%:2018-11-29 09:12:54№%:№%:60460495
В городе снова будет ограничена розничная продажа алкоголя  http://lipetskcity.ru/iblock/news/e/v_gorode_snova_budet_ogranichena_roznichnaja_prodazha_alkogolja_29-11-2018/№%:№%:2018-11-29 09:00:35№%:№%:60460495
Победители конкурса «Созвездие» станут участниками городского праздника выпускников «Липецкие зори» http://lipetskcity.ru/iblock/news/e/pobediteli_konkursa_sozvezdie_stanut_uchastnikami_gorodskogo_prazdnika_vipusknikov_lipeckie_zori28-11-2018/№%:№%:2018-11-28 18:01:22№%:№%:60460495
День открытых дверей состоится в Центрах помощи детям 1 декабря http://lipetskcity.ru/iblock/news/e/den_otkritih_dverej_sostoitsja_v_centrah_pomoshhi_detjam_1_dekabrja28-11-2018/№%:№%:2018-11-28 17:32:53№%:№%:60460495
Липецкая гимназия стала абсолютным победителем Всероссийского конкурса http://lipetskcity.ru/iblock/news/e/lipeckaja_gimnazija_stala_absoljutnim_pobeditelem_vserossijskogo_konkursa28-11-2018/№%:№%:2018-11-28 16:47:45№%:№%:60460495
#48мол #молодойлидер #знайнаших #липецк #лучшиеизлучших Названы имена финалистов конкурса «Молодой лидер Липецк 2018» http://lipetskcity.ru/iblock/news/e/nazvani_imena_finalistov_konkursa_molodoj_lider_lipeck_201828-11-2018/№%:№%:2018-11-28 16:39:26№%:№%:60460495
В Липецке наградили самые патриотичные библиотеки http://lipetskcity.ru/iblock/news/e/v_lipecke_nagradili_samie_patriotichnie_biblioteki28-11-2018/№%:№%:2018-11-28 16:24:24№%:№%:60460495
В Липецке сформирован «Молодежный совет Октябрьского округа» http://lipetskcity.ru/iblock/news/e/v_lipecke_sformirovan_molodezhnij_sovet_oktjabrskogo_okruga28-11-2018/№%:№%:2018-11-28 14:58:15№%:№%:60460495
Липчан приглашают отправиться в путешествие по славным страницам истории Руси http://lipetskcity.ru/iblock/news/e/lipchan_priglashajut_otpravitsja_v_puteshestvie_po_slavnim_stranicam_istorii_rusi28-11-2018/№%:№%:2018-11-28 11:56:25№%:№%:60460495
Сергей Иванов укрепил позиции в первой группе «Национального рейтинга» мэров российских городов http://lipetskcity.ru/iblock/news/e/sergej_ivanov_ukrepil_pozicii_v_pervoj_gruppe_nacionalnogo_rejtinga_mjerov_rossijskih_gorodov28-11-2018/№%:№%:2018-11-28 11:43:05№%:№%:60460495
#здоровыйрегион #липецкаяобласть #ЗдоровыйрегионгородЛипецк Итоги спартакиады по месту жительства подведут 29 ноября http://lipetskcity.ru/iblock/news/e/itogi_spartakiadi_po_mestu_zhitelstva_podvedut_v_lipecke28-11-2018/№%:№%:2018-11-28 11:27:39№%:№%:60460495
Расписание автобусов № 34, 17, 300, 317 изменится в ближайшее время http://lipetskcity.ru/iblock/news/e/raspisanie_avtobusov__34_17_300_317_izmenitsja_v_blizhajshee_vremja28-11-2018/№%:№%:2018-11-28 10:43:26№%:№%:60460495
Глава Липецка получил приглашение посетить с ответным визитом Котбус http://lipetskcity.ru/iblock/news/e/glava_lipecka_poluchil_priglashenie_posetit_s_otvetnim_vizitom_kotbus28-11-2018/№%:№%:2018-11-28 09:18:32№%:№%:60460495
Сергей Иванов сверил со строителями сроки сдачи после реконструкции знаковых городских объектов http://lipetskcity.ru/iblock/news/e/sergej_ivanov_sveril_so_stroiteljami_sroki_sdachi_znakovih_gorodskih_obektov_posle_rekonstrukcii_27-11-2018/№%:№%:2018-11-27 19:54:31№%:№%:60460495
Возможность использовать Комсомольский пруд как каток рассматривают в мэрии http://lipetskcity.ru/iblock/news/e/vozmozhnost_ispolzovat_komsomolskij_prud_kak_katok_rassmatrivajut_v_mjerii27-11-2018/№%:№%:2018-11-27 19:53:28№%:№%:60460495
Педагог гимназии № 12 стала победителем профессионального конкурса «Дебют» http://lipetskcity.ru/iblock/news/e/pedagog_gimnazii__12_stala_pobeditelem_professionalnogo_konkursa_debjut_27-11-2018/№%:№%:2018-11-27 17:15:00№%:№%:60460495
Липецкие волонтеры примут участие в Международном форуме добровольцев  http://lipetskcity.ru/iblock/news/e/lipeckie_volonteri_primut_uchastie_v_mezhdunarodnom_forume_dobrovolcev_27-11-2018/№%:№%:2018-11-27 14:52:22№%:№%:60460495
В ближайшее время липчане смогут прогуляться по «Бунинским аллеям» http://lipetskcity.ru/iblock/news/e/v_blizhajshee_vremja_lipchane_smogut_proguljatsja_po_buninskim_allejam27-11-2018/№%:№%:2018-11-27 14:18:13№%:№%:60460495
На 9 улицах Липецка завтра не будет холодной воды http://lipetskcity.ru/iblock/news/e/na_9_ulicah_lipecka_zavtra_ne_budet_holodnoj_vodi27-11-2018/№%:№%:2018-11-27 13:30:57№%:№%:60460495
#здоровыйрегион #липецкаяобласть #ЗдоровыйрегионгородЛипецк На вопросы липчан о профилактике ВИЧ-инфекции ответят специалисты Роспотребнадзора http://lipetskcity.ru/iblock/news/e/na_voprosi_lipchan_o_profilaktike_vichinfekcii_otvetjat_specialisti_rospotrebnadzora27-11-2018/№%:№%:2018-11-27 09:48:11№%:№%:60460495
«Диалог цивилизаций» объединил школьников из 50 образовательных учреждений Липецка, Великого Новгорода и Кисловодска http://lipetskcity.ru/iblock/news/e/_dialog_civilizacij_obedinil_shkolnikov_iz_50_obrazovatelnih_uchrezhdenij_lipecka_velikogo_novgoroda_i_kislovodska26-11-2018/№%:№%:2018-11-26 17:23:33№%:№%:60460495
#здоровыйрегион #липецкаяобласть #ЗдоровыйрегионгородЛипецк Спортсменов, интеллектуалов и экстремалов приглашают к участию в приключенческой квест-игре http://lipetskcity.ru/iblock/news/e/sportsmenov_intellektualov_i_jekstremalov_priglashajut_k_uchastiju_v_prikljuchencheskoj_kvestigre_26-11-2018/№%:№%:2018-11-26 17:20:41№%:№%:60460495
Первый снегопад не открыл счет «дням жестянщика» в Липецке  http://lipetskcity.ru/iblock/news/e/pervij_snegopad_ne_otkril_schet_dnjam__zhestjanshhika_v_lipecke_26-11-2018/№%:№%:2018-11-26 16:24:18№%:№%:60460495
#здоровыйрегион #липецкаяобласть #ЗдоровыйрегионгородЛипецк Памяти Михаила Баландина посвятили первенство по хоккею http://lipetskcity.ru/iblock/news/zdorovij_region/e/pamjati_mihaila_balandina_posvjatili_pervenstvo_po_hokkeju26-11-2018/№%:№%:2018-11-26 16:08:42№%:№%:60460495
#здоровыйрегион #липецкаяобласть #ЗдоровыйрегионгородЛипецк В Липецке прошел семейный праздник «Наши мамы лучше всех» http://lipetskcity.ru/iblock/news/zdorovij_region/e/v_lipecke_proshel_semejnij_prazdnik_nashi_mami_luchshe_vseh26-11-2018/№%:№%:2018-11-26 15:37:24№%:№%:60460495
#здоровыйрегион #липецкаяобласть #ЗдоровыйрегионгородЛипецк Более 30 ледовых площадок будут работать в Липецке зимой  http://lipetskcity.ru/iblock/news/e/bolee_30_ledovih_ploshhadok_budut_rabotat_v_lipecke_zimoj_26-11-2018/№%:№%:2018-11-26 15:35:46№%:№%:60460495
В Липецке состоялся традиционный праздник «День матери» http://lipetskcity.ru/iblock/news/e/v_lipecke_sostojalsja_tradicionnij_prazdnik_den_materi26-11-2018/№%:№%:2018-11-26 15:27:24№%:№%:60460495
Дворы Липецка освобождают от металлических гаражей  http://lipetskcity.ru/iblock/news/e/dvori_lipecka_osvobozhdajut_ot_metallicheskih_garazhej_26-11-2018/№%:№%:2018-11-26 13:29:56№%:№%:60460495
На устранение последствий первого снегопада выведена 101 единица спецтехники  http://lipetskcity.ru/iblock/news/e/na_ustranenie_posledstvij_pervogo_snegopada_vivedena_101_edinica_spectehniki_26-11-2018/№%:№%:2018-11-26 10:08:38№%:№%:60460495
Большой дорожный ремонт и украшение Липецка к Новому обсуждали на заседании общественного совета при главе города http://lipetskcity.ru/iblock/news/e/bolshoj_dorozhnij_remont_i_ukrashenie_lipecka_k_novomu_obsuzhdali_na_zasedanii_obshhestvennogo_soveta_pri_glave_goroda23-11-2018/№%:№%:2018-11-23 17:52:06№%:№%:60460495
Дополнительный остановочный пункт и изменения в расписании – два автобусных маршрута будут работать по-новому http://lipetskcity.ru/iblock/news/e/dopolnitelnij_ostanovochnij_punkt_i_izmenenija_v_raspisanii__dva_avtobusnih_marshruta_budut_rabotat_ponovomu23-11-2018/№%:№%:2018-11-23 16:43:14№%:№%:60460495
Глава Липецка Сергей Иванов призвал коллег работать на перспективу  http://lipetskcity.ru/iblock/news/e/glava_lipecka_sergej_ivanov_prizval_kolleg_rabotat_na_perspektivu_23-11-2018/№%:№%:2018-11-23 16:15:50№%:№%:60460495
Молодежное правительство Липецка покорило «Проектный Олимп»  http://lipetskcity.ru/iblock/news/e/molodezhnoe_pravitelstvo_lipecka_pokorilo_proektnij_olimp_23-11-2018/№%:№%:2018-11-23 16:03:06№%:№%:60460495
Продажа новогодних деревьев в Липецке начнется 20 декабря http://lipetskcity.ru/iblock/news/e/prodazha_novogodnih_derevev_v_lipecke_nachnetsja_20_dekabrja23-11-2018/№%:№%:2018-11-23 13:37:34№%:№%:60460495
