2868,томск год крупнейшей в его истории политической лихорадки главный герой книги надежды дмитриенко и эдуарда черняка в томске в году выпущенной издательским домом томского госуниверситета книга это своеобразный экскурсионный маршрут по улицам города связанным с революционными событиями,2017-09-26 05:21:44,29606802,[]
2869,полиция задержала подозреваемого в избиении водителя маршрутки злоумышленник хотел ограбить шофера,2017-09-25 17:30:21,29606802,[]
2870,во вторник более улиц томска останутся без света какие именно читайте по ссылке,2017-09-25 13:00:28,29606802,[]
2871,фестиваль науки пройдет в тпу с по октября вы увидите робота растение узнаете из какого полимера можно сделать паутину человека паука научитесь определять ботов среди своих друзей в вконтакте а также приготовите слоеный пирог из конфет полная программа в прикрепленном файле вход на мероприятие свободный,2017-09-25 09:46:03,29606802,[]
2872,большой концерт и презентация его нового альбома царь горы пройдет в томске октября не пропустите ну а если вы хотите выиграть пригласительный делайте репост этой записи до октября мы отберем победителя рандомно всем удачи,2017-09-25 08:32:58,29606802,[]
2873,на концерт бах кофе бразилия идет александра альшанникова поздравляем мы свяжемся с вами и расскажем как забрать билет,2017-09-25 07:19:23,29606802,[]
2874,соревнования по ездовым видам спорта с участием собак прошли сегодня на лыжной базе янтарь больше фото по ссылке,2017-09-24 14:42:49,29606802,[]
2875,разыгрываем пригласительный на братьев сафроновых артисты привозят в томск шоу молния делитесь этим постом с друзьями до октября с помощью приложения рандом мы определим одного человека который получит билет на двоих дерзайте,2017-09-24 09:48:00,29606802,[]
2876,мы побывали на концерте музыки из японских аниме в цк тгу и послушали произведения из фильмов знаменитого японского режиссера хаяо миядзаки смотрите наше видео,2017-09-24 07:52:30,29606802,[]
2877,а вот и томск дождался снега вы рады,2017-09-24 06:56:11,29606802,[]
2878,а в каргаске дети уже лепят снеговиков,2017-09-23 11:15:59,29606802,[]
2879,лучшие песни ретро эстрады октября в бкз легендарные хиты муслима магомаева анны герман фрэнк синатра и других прославленных советских и зарубежных композиторов в исполнении финалиста первого сезона телепроекта большая опера на телеканале культура сергея плюснина победителя телепроекта живой звук на телеканале россия сергея дудинского и лауреата международных конкурсов станислава серебрянникова,2017-09-23 09:14:00,29606802,[]
2880,для сырных гурманов камамбер буратта томини качотта страккино теперь томского производства сентября новый производитель откроет фирменную лавку в торгово развлекательном центре изумрудный город,2017-09-22 13:46:52,29606802,[]
2881,томские ученые разработали уникальный препарат диагностики рака молочной железы он уже прошел доклинические испытания его применение позволит существенно уменьшить объем хирургического вмешательства у женщин такой препарат не производится нигде в мире это томская разработка,2017-09-22 13:03:53,29606802,[]
2882,на трассе томск колпашево произошло дтп с участием медведя который выбежал на дорогу зверь попал под колеса двух автомобилей после чего погиб,2017-09-22 11:34:36,29606802,[]
2883,руян город закрывается в томской области его автор компания экспедиция перевозит проект в подмосковье,2017-09-22 11:02:26,29606802,[]
2884,персонаж посередине на фото никто иной как новый талисман фк томь пока он будет принимать участие в домашних матчах клуба общаться обниматься и фотографироваться с болельщиками однако у ростовой куклы коня все еще нет имени,2017-09-22 09:10:05,29606802,[]
2885,сегодня ночью сах выйдет на дежурство и в случае гололеда будет посыпать дороги песком напомним в третьей декаде сентября синоптики прогнозировали прохладную погоду с дождем и снегом а в стрежевом сегодня утром уже выпал первый снег,2017-09-22 08:20:03,29606802,[]
2886,октября в томск с прощальным туром приезжает группа кукрыниксы не пропустите это событие ну а если вы хотите заполучить бесплатный пригласительный делайте репост этой записи до сентября приложение рандом отберет одного счастливчика который получит билет на двоих удачи,2017-09-22 06:43:18,29606802,[]
2887,в стрежевом выпал первый снег завтра ждем в томске,2017-09-22 06:19:49,29606802,[]
2888,астрономическая осень вступает в права в томске она наступит в ночь на сентября,2017-09-21 15:19:00,29606802,[]
2889,группа презентует свой новый альбом выходи за меня в нк театро октября мы отдадим пригласительный на двоих бесплатно одному счастливчику принявшему участие в розыгрыше с помощью приложения рандома делайте репост этой записи до сентября всем везения,2017-09-21 09:19:00,29606802,[]
2890,вот что осталось от вековых столбов в губернаторском квартале власти занялись их реконструкцией общая стоимость работ более миллионов рублей,2017-09-21 08:18:19,29606802,[]
2891,осень это интересно согревайтесь самыми яркими мероприятиями этой культурной недели выставками концертами а также теплым общением с братьями нашими меньшими,2017-09-21 08:18:00,29606802,[]
2892,а вы ждали его синоптики рассказали о первом снеге в томске,2017-09-21 07:35:58,29606802,[]
2893,инна рожкова тимина получает билет на детское шоу ростовых кукол герои в масках и щенячий патруль спасают город наши поздравления,2017-09-21 07:16:07,29606802,[]
2894,образовательное и развлекательное шоу для детей и взрослых мультикосмос пройдет в бкз октября зрители узнают много нового о мире космоса выполнят непростое задание на самой жаркой планете солнечной системы смогут передать сообщение на землю через спутник юпитера и прокатятся по кольцам сатурна,2017-09-21 06:16:38,29606802,[]
2895,газпром станет стратегическим партнером детского технопарка холдинг выделит миллионов рублей на закупку оборудования,2017-09-21 06:08:40,29606802,[]
2896,тысяч евро получит томский разработчик игр от компании к слову это крупнейшая гейм инвестиция знаменитой корпорации,2017-09-20 13:24:08,29606802,[]
2897,на концерт группы валентин стрыкало пойдет валерия хойкова поздравляем,2017-09-20 12:28:44,29606802,[]
2898,сентября в тгу пройдет импровизационное юмористическое шоу так себе театр приглашенный гость вечера звезда международного союза квн и ведущий шоу студия союз на канале тнт артем муратов,2017-09-20 08:56:18,29606802,[]
2899,мужчина который сбывал гашиш у школ и вузов томска приговорен к годам тюрьмы,2017-09-20 08:39:12,29606802,[]
2900,итальянский саксофонист росарио джулиани выступит на сцене бкз октября вместе с асхатом сайфуллиным александром титовым и евгением суворовым этот квартет исполнит свои лучшие произведения,2017-09-20 06:50:54,29606802,[]
2901,девочка сбитая машиной росгвардии в северске находится в реанимации в тяжелом состоянии,2017-09-20 05:38:56,29606802,[]
2902,участники фестиваля стенограффия преобразили три здания в томске вы можете сами увидеть и оценить результаты до и после фото здесь,2017-09-19 13:57:00,29606802,[]
2903,шесть лет назад у леши кабайлова обнаружили рак сейчас ему лет но мальчик и его родители до сих пор борются с болезнью ребенку необходимо лечение стоимостью тысяч рублей родные мальчика и благотворительный фонд имени алены петровой просят томичей помочь в сборе средств для реабилитации леши,2017-09-19 13:49:48,29606802,[]
2904,девочку в северске сбил автомобиль росгвардии,2017-09-19 13:11:41,29606802,[]
2905,томичи жалуются на предпринимателей которые разместились в сквере возле томских товаров они считают что зона отдыха не используется по назначению и переполнена людьми по этой причине депутаты гордумы хотят запретить всю предпринимательскую деятельность на этой территории точки питания аттракционы прокат лошадей велосипедов скутеров,2017-09-19 12:38:02,29606802,[]
2906,волонтеры и полиция разыскивают летнего студента тусура григория мазницына последний раз парень выходил на связь сентября наш журналист связался с отцом григория который рассказал о том что сын ранее уже пропадал на две недели из за долгов перед студентами помимо этого парню грозит отчисление из университета,2017-09-19 11:54:23,29606802,[]
2907,пригласительный на персоны на концерт дениса мацуева получает алтынгул кошатова поздравляем,2017-09-19 11:26:12,29606802,[]
2908,полина цубрович получит пригласительный на концерт музыки из фильмов знаменитого японского режиссера хаяо миядзаки всем спасибо за участие,2017-09-19 07:15:24,29606802,[]
2909,кто сохранит свои должности после выборов и какие изменения ждут структуру образования рассказываем,2017-09-19 07:09:40,29606802,[]
2910,горячая новость отопительный сезон начался мэр томска подписал постановление которое обязывает все ресурсоснабжающие и жилищные организации подать тепло в дома томичей с сентября,2017-09-19 06:13:54,29606802,[]
2911,о том как будем отдыхать в году расскажет наша инфографика,2017-09-18 14:16:29,29606802,[]
2912,сильный дождь и порывы ветра до метров в секунду придут на смену солнцу и теплу завтра,2017-09-18 14:02:30,29606802,[]
2913,евгений малков отправляется на концерт орган валторна поздравляем,2017-09-18 11:27:35,29606802,[]
2914,оказывается томск комфортнее новосибирска и красноярска об этом гласит исследование конструкторского бюро стрелка какие показатели отметили специалисты читайте в материале,2017-09-18 08:46:22,29606802,[]
2915,покинули тгу теперь музыканты отправляются в выставочное турне,2017-09-18 07:48:03,29606802,[]
2916,музыка для кофеманов от настоящего кофемана иоганна себастьяна баха кофейная кантата и другие произведения можно будет услышать в органном зале томской филармонии октября кстати гостей концерта обещают угощать кофе,2017-09-18 07:26:57,29606802,[]
2917,мукомольный завод,2017-09-16 11:52:00,29606802,[]
2918,герои в масках и щенячий патруль спасают город это новый московский спектакль ростовых кукол его привозят в цк тгу октября хотите получить пригласительный на двоих делайте репост этой записи до сентября а мы выберем одного победителя рандомно всем удачи,2017-09-16 09:52:00,29606802,[]
2919,солнечного томска вам в ленту,2017-09-15 14:57:00,29606802,[]
2920,от до градусов тепла ожидается на выходных всем гулять,2017-09-15 12:11:00,29606802,[]
2921,пригласительный на персоны на спектакль любовь по понедельникам получает алиса карташева цехановская поздравляем,2017-09-15 11:47:00,29606802,[]
2922,томич выращивал коноплю при помощи своего же изобретения запатентованного фитосветильника для улучшенного роста растений талантливый изобретать получил года условно,2017-09-15 11:30:02,29606802,[]
2923,дворик в университетской роще тгу,2017-09-15 09:50:25,29606802,[]
2924,томич поймал в оби на удочку щуку весом в кг и длиной сантиметров,2017-09-15 07:40:08,29606802,[]
2925,и все таки они существуют роспотребнадзор обнаружил в рисовой крупе томского кадетского корпуса три вида насекомых,2017-09-14 12:48:15,29606802,[]
2926,на томск надвигаются сильные ветра до метров в секунду мчс призывает томичей быть осторожными,2017-09-14 12:08:31,29606802,[]
2927,для самых замерзших у нас вышел материал в котором мы объясняем как добиться досрочного включения отопления в вашем доме,2017-09-14 12:00:55,29606802,[]
2928,целый триллер разыгрался в томском лесу трое жителей села отправились охотиться на лося а подстрелили медведя после чего еще и принялись его преследовать разъяренное животное настигло одного из мужчин от гибели его спасла доля секунды другой охотник успел добить медведя у мужчины изуродовано лицо и вырваны мышцы икры,2017-09-14 08:16:26,29606802,[]
2929,в этом гиде можно встретить очень много собак новых спектаклей и парочку по настоящему русских праздников добро пожаловать,2017-09-14 07:30:00,29606802,[]
2930,четверг начался с эвакуации сотрудников тусур эвакуировали из корпуса на этот раз причина не ложное минирование а замыкание электрощита по крайней мере так официально прокомментировало мчс,2017-09-14 06:10:56,29606802,[]
2931,участник стенограффии данила шмелев прорубил окно в лето на одном из зданий по улице дальне ключевская а смотрите фотографии до и после,2017-09-13 14:37:00,29606802,[]
2932,осеннее коларово,2017-09-13 12:32:00,29606802,[]
2933,анастасия иванкович пойдет на концерт наши поздравления,2017-09-13 11:28:17,29606802,[]
2934,оснований для паники нет ситуация находится под полным контролем параллельно устанавливаются организаторы провокаций областная администрация прокомментировала волну минирований,2017-09-13 10:43:16,29606802,[]
2935,и мэрию тоже,2017-09-13 09:25:47,29606802,[]
2936,почти томские инновационщики приступили к разработке умных часов которые помогут специалистам занятым на промышленных объектах и военных полигонах гаджет будет контролировать местонахождение сотрудников а также их психоэмоциональное и физическое состояние,2017-09-13 08:37:00,29606802,[]
2937,спрашивали отвечаем мэрия озвучила график светомузыкального шоу фонтана на новособорной,2017-09-13 08:14:17,29606802,[]
2938,у вас есть еще один шанс музыка из фильмов знаменитого японского режиссера хаяо миядзаки сентября в центре культуры тгу дирижер котаро кимура оркестр и солистка сатоко ота представят музыку из рисованных шедевров унесенные призраками мой сосед тоторо летающий замок лапута и ведьмина служба доставки,2017-09-13 07:58:18,29606802,[]
2939,томский депутат госдумы рф ирина евтушенко умерла на м году жизни причиной смерти стало онкологическое заболевание томичам она больше известна как врач акушер гинеколог и как руководитель томского перинатального центра который ирина дмитриевна возглавляла в году,2017-09-13 06:51:25,29606802,[]
2940,томская романтика,2017-09-12 16:39:00,29606802,[]
2941,томский политех впервые вошел в мировой рейтинг по трудоустройству выпускников это единственный томский вуз в авторитетном рейтинге,2017-09-12 15:25:00,29606802,[]
2942,первая секция по футболу для девочек открылась в томске она будет работать на базе муниципальной детско юношеской спортивной школы в секцию уже записалось девочек,2017-09-12 14:45:00,29606802,[]
2943,следственный комитет возбудил уголовное дело спустя недели после чп в маршрутке по версии следствия мужчину вытолкнули из маршрутки из за того что он приставал к женщине молодой человек ударился головой об асфальт и позже скончался в больнице санкция статьи предусматривает лишение свободы на срок до лет,2017-09-12 13:41:57,29606802,[]
2944,браво томским спасателям и волонтерам они смогли спасти двоих томичек более часов блуждавших по лесу женщины отправились за грибами в лес расположенный между дорогой тимирязево й квартал и рекой жуковкой,2017-09-12 12:07:26,29606802,[]
2945,орган валторна или властелин колец на сцене органного зала томской филармонии сентября делитесь этим постом с друзьями до сентября и может быть именно вы получите пригласительный на двоих мы отберем победителя случайным образом,2017-09-12 11:04:21,29606802,[]
2946,посмотрите как после реконструкции выглядит новособорная видео с квадрокоптера поможет разглядеть весь масштаб и красоту,2017-09-12 08:11:50,29606802,[]
2947,город теперь совсем осенний если вы все еще этого не прочувствовали смотрите нашу фотоленту из снимков,2017-09-12 07:16:28,29606802,[]
