2580,академия игровых видов спорта перми приглашает на дополнительный отбор в отделение футбола,2018-09-25 18:53:00,3551694,[]
2581,вот такая дорога в осень из листьев появилась в саду соловьев у реки уинки,2018-09-25 18:17:00,3551694,[]
2582,планировать короткие путешествия по прикамью станет удобнее с новым мобильным приложением,2018-09-25 17:52:00,3551694,[]
2583,вознаграждение тыс руб вчера было тыс талица,2018-09-25 17:17:00,3551694,[]
2584,история перми,2018-09-25 16:37:00,3551694,[]
2585,в октябре театральный фонтан закрывается на зиму,2018-09-25 15:52:00,3551694,[]
2586,арт объект спутник в перми,2018-09-25 15:06:00,3551694,[]
2587,абсолютно бесплатный месяц занятий,2018-09-25 14:05:00,3551694,[]
2588,гайвинского маньяка душителя выпустили под подписку о невыезде,2018-09-25 13:33:00,3551694,[]
2589,сдай использованную батарейку спаси ежика,2018-09-25 12:37:00,3551694,[]
2590,две жительницы перми в один день зарезали своих мужей,2018-09-25 11:52:00,3551694,[]
2591,впечатляющее настроение в парке горького,2018-09-25 11:06:00,3551694,[]
2592,,2018-09-25 10:05:00,3551694,
2593,осужденный за выросший мак пенсионер пытался прикрыть своего сына,2018-09-25 09:37:00,3551694,[]
2594,пермь спортивная утренняя гимнастика,2018-09-25 08:36:00,3551694,[]
2595,сентября в перми пройдет международный фестиваль медведей тедди,2018-09-25 07:37:00,3551694,[]
2596,рассвет на угорах у деревни медвежье пермский край,2018-09-25 06:37:00,3551694,[]
2597,коллекции восстановлены на ботанический сад пгниу об итогах осенней аварии,2018-09-25 05:17:00,3551694,[]
2598,гайвы вам в ленту,2018-09-24 21:21:00,3551694,[]
2599,любуются архитектурой замечено в этнографическом парке истории реки чусовой,2018-09-24 20:52:00,3551694,[]
2600,в перми за долги арестовали пассажирский теплоход урал,2018-09-24 20:17:00,3551694,[]
2601,пермское утреннее золото,2018-09-24 19:52:00,3551694,[]
2602,в перми сотрудники гибдд приехали в роддом на выписку новорожденной девочки,2018-09-24 19:17:00,3551694,[]
2603,сказочная осень в каменном городе,2018-09-24 18:52:00,3551694,[]
2604,в прикамье произошла стрельба в продуктовом магазине видео,2018-09-24 18:16:00,3551694,[]
2605,надоел наркопритон в подъезде,2018-09-24 17:22:30,3551694,[]
2606,год дворянский клуб угол луначарского и сибирской,2018-09-24 16:36:00,3551694,[]
2607,на участке от соборной площади до границ земельного порт пермь появится детская площадка зона отдыха зона для занятий спортом и культурно массовых мероприятий а также прогулочная зона,2018-09-24 15:37:00,3551694,[]
2608,пермь осенняя,2018-09-24 14:52:00,3551694,[]
2609,засыпала и просыпалась под гул мигов екатеринбургский журналист о жизни в перми,2018-09-24 14:27:00,3551694,[]
2610,сентября в городе екатеринбург состоялся всероссийский турнир по каратэ малахитовый пояс который собрал более семисот спортсменов из регионов россии,2018-09-24 13:52:00,3551694,[]
2611,пермский аэропорт отменил закрытие на шесть дней,2018-09-24 13:07:00,3551694,[]
2612,,2018-09-24 12:05:01,3551694,
2613,жители микрорайона заозерье вышли на пикет против закрытия пляжа,2018-09-24 11:42:00,3551694,[]
2614,футбольные трюки от пермяков некоторые прям вау,2018-09-24 10:41:00,3551694,[]
2615,горит дом на монастырской дорога перекрыта на самой улице и на матросова,2018-09-24 10:20:08,3551694,[]
2616,в перми вынесли приговор главному фигуранту по делу банды псевдогазовиков,2018-09-24 09:36:00,3551694,[]
2617,старина роскошь пермская набережная,2018-09-24 08:37:00,3551694,[]
2618,депутат госдумы призвал пересмотреть дело о маке в огороде пенсионера,2018-09-24 07:37:00,3551694,[]
2619,,2018-09-24 06:36:00,3551694,[]
2620,осень на тихом компросе фото андрей минин,2018-09-24 05:16:00,3551694,[]
2621,сказка на набережной,2018-09-24 04:16:00,3551694,[]
2622,ночной туман сентября в перми,2018-09-23 20:16:00,3551694,[]
2623,самолет в парке горького,2018-09-23 19:21:00,3551694,[]
2624,пьяный мужик разбил стекло в двери автобуса гознак,2018-09-23 18:31:41,3551694,[]
2625,осеннее утро на горе колпаки пермский край,2018-09-23 18:21:00,3551694,[]
2626,дтп на бульваре гагарина,2018-09-23 18:16:16,3551694,[]
2627,рубрика вопросы ответы,2018-09-23 18:01:00,3551694,[]
2628,,2018-09-23 17:05:01,3551694,
2629,граффити в перми на стене дома по ул тимирязева,2018-09-23 16:31:00,3551694,[]
2630,в перми снимают новые серии ревизорро,2018-09-23 15:31:00,3551694,[]
2631,по дороге на ильинский,2018-09-23 14:46:00,3551694,[]
2632,на улицах перми станцевали линди хоп бальбоа чарльстон блюз шэг,2018-09-23 13:46:00,3551694,[]
2633,в пермь пришло бабье лето,2018-09-23 12:46:00,3551694,[]
2634,есть чему порадоваться каменщикам,2018-09-23 12:01:00,3551694,[]
2635,больше рейсов задержано в аэропорту перми густой туман,2018-09-23 11:01:00,3551694,[]
2636,лихач около тц гудвин что с водителем инспектор гаи отказался отвечать,2018-09-23 10:16:00,3551694,[]
2637,утренний туман,2018-09-23 09:39:17,3551694,[]
2638,пишите в комментарии ваши предложения,2018-09-23 09:01:00,3551694,[]
2639,от подписчика,2018-09-23 08:01:00,3551694,[]
2640,вчера рыбаки и экоактивисты провели сразу два субботника в перми один на берегу камы в районе язовой другой у красавинского моста несмотря на не комфортную погоду и выходной на субботник пришло довольно много людей для сравнения летом на субботнике в районе года было всего человек все рыбаки и не одного гражданского,2018-09-23 07:01:00,3551694,[]
2641,такой крутой туман сейчас фото настя,2018-09-23 01:41:19,3551694,[]
2642,опрос,2018-09-22 20:31:00,3551694,[]
2643,музейный сквер около музея современного искусства,2018-09-22 19:31:00,3551694,[]
2644,в перми прошло закрытие мотосезона,2018-09-22 18:31:00,3551694,[]
2645,в перми открыли бюст выдающегося хирурга евгения вагнера,2018-09-22 17:41:00,3551694,[]
2646,художница за работой,2018-09-22 16:41:00,3551694,[]
2647,в перми закрыли манеж спартак,2018-09-22 15:52:20,3551694,[]
2648,в августе этого года пермяки в очередной раз подняли флаг перми на вершине эльбруса следующая цель флаг родного города на вершине эвереста,2018-09-22 14:41:00,3551694,[]
2649,пьяный пермяк перекрыл собой дорогу трамваю,2018-09-22 13:46:00,3551694,[]
2650,рисунок в честь павла александровича соловьева советского и российского конструктора авиационных двигателей основоположника газотурбинного двигателестроения в ссср,2018-09-22 13:01:00,3551694,[]
2651,барабанная студия уроки приглашает всех желающих незабываемо провести время абсолютно бесплатно,2018-09-22 12:05:00,3551694,[]
2652,урал бунташный,2018-09-22 11:51:00,3551694,[]
2653,новое граффити в перми,2018-09-22 11:41:00,3551694,[]
2654,самая милая рубрика вновь готова радовать вас,2018-09-22 11:01:00,3551694,[]
2655,ледовый драматический спектакль ильи авербуха ромео и джульетта впервые в перми,2018-09-22 10:05:00,3551694,[]
2656,пожалуй лучшие модели в деревне,2018-09-22 09:42:00,3551694,[]
2657,жителю кунгура предстоит выплатить авиакомпании тысячи рублей,2018-09-22 08:37:00,3551694,[]
2658,затерявшийся в лесах поселок чикали пермский край,2018-09-22 07:46:00,3551694,[]
2659,пермякам ответили на главных вопросов о тепле,2018-09-22 07:02:01,3551694,[]
2660,,2018-09-22 06:05:00,3551694,
2661,вишера романиха,2018-09-22 05:41:00,3551694,[]
2662,в выходные дни и в начале следующей недели ожидается значительное потепление,2018-09-21 20:37:00,3551694,[]
2663,будний осенний вечер в перми,2018-09-21 19:32:00,3551694,[]
2664,в перми появилась доставка веганской еды,2018-09-21 18:37:00,3551694,[]
2665,красавец владимир маяковский возвращается с рейса,2018-09-21 17:37:00,3551694,[]
2666,в перми открывается первый англоязычный детсад,2018-09-21 16:41:00,3551694,[]
2667,куда сходить в выходные афиша на и сентября,2018-09-21 15:42:00,3551694,[]
2668,за год до открытия набережной мая года дебаркадеров тогда было много а слева в тумане грузовой порт он был прямо в городе,2018-09-21 14:52:00,3551694,[]
2669,депутаты разрешили проводить дорожные работы в перми ночью,2018-09-21 14:06:00,3551694,[]
2670,,2018-09-21 13:05:01,3551694,
2671,полюдов камень красновишерский район,2018-09-21 12:41:00,3551694,[]
2672,скоро на центральных улицах города не останется ни липы ни тополя ни клена,2018-09-21 11:37:00,3551694,[]
2673,кто еще любит конные походы слобода село сергино нытвенского района,2018-09-21 10:41:00,3551694,[]
2674,в новой пермской поликлинике медпомощь смогут получать тысяч детей,2018-09-21 09:36:00,3551694,[]
2675,г усолье церковь николая чудотворца,2018-09-21 08:33:00,3551694,[]
2676,в мотовилихе виновники дтп угнали машину потерпевшего,2018-09-21 07:41:00,3551694,[]
2677,осень вступила в свои права,2018-09-21 06:37:00,3551694,[]
2678,в перми налетчики напали на бизнесмена и похитили у него тысяч рублей,2018-09-21 05:26:00,3551694,[]
2679,о пермском чистомэне и его критиках,2018-09-20 20:17:00,3551694,[]
2680,в школе выдали такие акты должны ли мы их заполнять по моему школы занимаются не теми делами как считаете,2018-09-20 19:42:00,3551694,[]
2681,пермяк отсудил двойную стоимость некачественной иномарки,2018-09-20 19:17:00,3551694,[]
2682,всю информацию о кружках и секциях для детей теперь можно получить на едином портале навигаторе дополнительного образования,2018-09-20 18:17:00,3551694,[]
2683,в магазинах все больше модного молока овсяного пшеничного рисового что это вообще такое,2018-09-20 17:52:00,3551694,[]
2684,туманное утро в горнозаводске,2018-09-20 17:17:00,3551694,[]
2685,женщина из прикамья отсудила тыс руб за ампутированную лапу своего кота,2018-09-20 16:52:00,3551694,[]
2686,сотрудники дпс из перми помогли доехать мужу и его беременной жене до роддома,2018-09-20 16:17:00,3551694,[]
2687,открыто регулярное авиасообщение пермь минеральные воды,2018-09-20 15:52:00,3551694,[]
2688,река чусовая вошла в десятку самых красивых мест россии,2018-09-20 15:17:00,3551694,[]
2689,в перми осудили дедушку у которого на участке рос мак,2018-09-20 14:52:00,3551694,[]
2690,в перми задержали организаторов запрещенной секты свидетели иеговы,2018-09-20 14:17:00,3551694,[]
2691,пермский музей современного искусства устанавливает арт объекты,2018-09-20 13:37:00,3551694,[]
2692,власти перми планируют увеличить штраф за безбилетный проезд,2018-09-20 12:33:00,3551694,[]
2693,прекрасное рядом,2018-09-20 11:36:00,3551694,[]
2694,в перми выступит популярная группа,2018-09-20 10:37:00,3551694,[]
2695,п усьва,2018-09-20 09:42:00,3551694,[]
2696,в перми школьница через прокуратуру добилась зачисления в й класс,2018-09-20 08:53:49,3551694,[]
2697,пермский промобот уже проник в здание правительства чили,2018-09-20 08:01:00,3551694,[]
2698,водитель из пермского края объездил пол россии в компании кота,2018-09-20 07:01:00,3551694,[]
2699,друзья и снова сентябрь и снова день рождения домадом на соликамской,2018-09-20 06:05:00,3551694,[]
2700,вот так разукрасили сами жители остановку в своем микрорайоне новобродовский,2018-09-20 06:01:00,3551694,[]
2701,золотая осень фото александр жилко,2018-09-20 05:16:00,3551694,[]
2702,за окном мгла,2018-09-19 22:15:46,3551694,[]
2703,осенние пермские отражения фото евгений зубов,2018-09-19 20:42:14,3551694,[]
2704,скоростной поезд ласточка совершил первую поездку по прикамью,2018-09-19 19:21:00,3551694,[]
2705,гербарий,2018-09-19 18:50:33,3551694,[]
2706,осенние краски природы пермского края на фотографиях самое известное скалистое обнажение на реке усьве камень столбы в разное время года фото александр паньков,2018-09-19 17:46:00,3551694,[]
2707,а обещали включить отопление ого запуск отопления в объекты соцсферы перми начнется с сентября,2018-09-19 16:46:00,3551694,[]
2708,хорошей осени пермяки ведь счастье не за горами,2018-09-19 16:01:00,3551694,[]
2709,хор млада даст концерт в музее ретро гараж,2018-09-19 15:22:00,3551694,[]
2710,выиграй билеты в кино на фильм,2018-09-19 14:11:00,3551694,[]
2711,пермскую школьницу которая сломала ногу отчитали за непосещение школы,2018-09-19 13:31:00,3551694,[]
2712,от подписчика,2018-09-19 12:31:00,3551694,[]
2713,пермский промобот стал соведущим в сша на телеканале,2018-09-19 11:41:00,3551694,[]
2714,в перми обустроена гайвинская экологическая тропа,2018-09-19 10:46:00,3551694,[]
2715,дтп лянгасова боковая по версии очевидцев водитель был пьян,2018-09-19 10:01:00,3551694,[]
2716,,2018-09-19 09:05:00,3551694,
2717,сегодня вход в музеи перми бесплатный,2018-09-19 08:16:00,3551694,[]
2718,в перми активисты расчистили долину вокруг речки егошихи сделали площадку и построили ульи по словам ученых здесь живут видов пчел,2018-09-19 07:16:00,3551694,[]
2719,красота на парковом подлесная фото елена попова,2018-09-19 06:16:00,3551694,[]
2720,звездное небо в окрестностях поселка юг,2018-09-19 05:16:00,3551694,[]
2721,новое здание лукойла заметно сверху теперь всегда пермская а фото виталий юрьев,2018-09-18 21:33:17,3551694,[]
2722,осень в пермском крае,2018-09-18 20:31:00,3551694,[]
2723,приключения дэдпула в перми продолжаются,2018-09-18 19:40:00,3551694,[]
2724,в перми пройдет забег по лесенкам на й этаж,2018-09-18 19:01:00,3551694,[]
2725,в перми выбирают цвет новых пассажирских автобусов,2018-09-18 18:17:00,3551694,[]
2726,пермский арт объект дом ста птиц фото виктор михалев,2018-09-18 17:46:00,3551694,[]
2727,,2018-09-18 17:05:00,3551694,
2728,кондуктор пермского автобуса украла телефон у пассажира,2018-09-18 16:46:00,3551694,[]
2729,история перми,2018-09-18 15:46:00,3551694,[]
2730,бывший трамвайный мост на разгуляе,2018-09-18 15:21:58,3551694,[]
2731,сентября года введена в строй камская гэс,2018-09-18 14:46:00,3551694,[]
2732,бассейн в закамске в конце октября в перми откроют новый бассейн,2018-09-18 13:46:00,3551694,[]
2733,,2018-09-18 13:05:01,3551694,
2734,сентября вход в музеи перми бесплатный,2018-09-18 12:46:00,3551694,[]
2735,как отдыхаем в году календарь выходных и праздников,2018-09-18 12:01:00,3551694,[]
2736,возле пермского оперного театра высадили около деревьев,2018-09-18 11:21:00,3551694,[]
2737,как часто сказка у нас перед глазами а мы ее не замечаем,2018-09-18 10:36:00,3551694,[]
2738,театр у моста покажет пьесу островского невольницы,2018-09-18 09:41:00,3551694,[]
2739,вот так идет благоустройство сквера напротив парка горького половину деревьев вырубили,2018-09-18 08:37:00,3551694,[]
2740,в прикамье количество выданных кредитных карт за год выросло на,2018-09-18 07:33:00,3551694,[]
2741,постапокалипсис мотовилихи мимо которого проходят постоянно,2018-09-18 06:46:00,3551694,[]
2742,краски заката на ж д вокзале пермь,2018-09-17 21:33:00,3551694,[]
2743,в перми подростка убило обломком каменной колонны,2018-09-17 20:37:00,3551694,[]
2744,камень ермак на реке сылва,2018-09-17 19:42:00,3551694,[]
2745,осенний вечер в парке камней,2018-09-17 19:11:11,3551694,[]
2746,главреда интернет портала владислава аскариди признали виновным в неповиновении полиции,2018-09-17 18:38:35,3551694,[]
2747,пермяк выиграл в лотерею семь миллионов рублей,2018-09-17 17:46:00,3551694,[]
2748,пермяки а вы помните что в году на набережной проходили съемки в поддержку нового сезона сериала молодежка смотрите видео,2018-09-17 17:05:00,3551694,[]
2749,река акчим поселок мутиха красновишерский район,2018-09-17 16:51:00,3551694,[]
2750,в перми досрочно завершился ремонт чусовского моста,2018-09-17 16:07:01,3551694,[]
2751,абсолютно бесплатный месяц занятий,2018-09-17 15:05:00,3551694,[]
2752,пермяки взяли серебро на мировом гран при по фигурному катанию на коньках,2018-09-17 14:53:00,3551694,[]
2753,с каждым днем будет холоднее прогноз погоды в прикамье на неделю,2018-09-17 14:17:00,3551694,[]
2754,горит садовый домик на камгэсе,2018-09-17 14:10:24,3551694,[]
2755,фотофакт спустили мотовилихинский пруд для запланированной очистки,2018-09-17 13:37:00,3551694,[]
2756,пермь встретит сильнейших представителей киокусинкай каратэ со всей россии афиша,2018-09-17 12:42:00,3551694,['афиша']
2757,прекрасное здание фсб россии по пермскому краю,2018-09-17 11:52:00,3551694,[]
2758,ученые против мифов спасет ли мед от простуды и можно ли есть его засахаренным,2018-09-17 11:06:00,3551694,[]
2759,если вас всегда интересовало почему в перми нет небоскребов и может ли лифт упасть как в том голливудском боевике прочтите материал полезного п журнала,2018-09-17 10:05:00,3551694,[]
2760,дня в больнице в перми девочке с тяжелой пневмонией провели уникальную операцию кислородонасыщения крови,2018-09-17 09:33:00,3551694,[]
2761,аллея страха в парке горького,2018-09-17 08:36:00,3551694,[]
2762,в прикамье жители глубинки боятся что могут остаться без школы и почты,2018-09-17 07:37:00,3551694,[]
2763,закамской красоты вам в ленту,2018-09-17 06:36:00,3551694,[]
2764,готово первое юридическое обоснование незаконности проверки холодильников в домах пермских школьников,2018-09-17 05:33:00,3551694,[]
2765,несколько кадров с фестиваля эпоха в парке горького,2018-09-16 20:32:00,3551694,[]
2766,три года колонии пермяк устроивший смертельное дтп со скорой не смог обжаловать приговор,2018-09-16 19:37:00,3551694,[]
2767,починить и приодеть пермский врач коллекционирует и реставрирует кукол,2018-09-16 18:33:00,3551694,[]
2768,нужно ли вакцинироваться от гриппа топ важных вопроса про прививки,2018-09-16 17:37:00,3551694,[]
2769,созрели на карпинского,2018-09-16 16:33:00,3551694,[]
