3913,тгу запустил видеопроект детектор мифов в рамках него ученые вуза разберут популярные фильмы и книги и объяснят позволят ли законы природы сделать то что придумали фантасты в первом выпуске физики объяснили почему звезда смерти должна была взорваться бесшумно и можно ли летать в космосе на огнетушителе как баллок в фильме гравитация подробнее,2017-03-10 10:34:17,29606802,[]
3914,житель кожевникова несколько месяцев крутил роман с замужней дамой после разрыва отношений он отправил по видео их любовных утех мужу своей бывшей любовницы за это хоум видео мужчина предстал перед судом,2017-03-09 13:08:38,29606802,[]
3915,на концерт глеба самойлова и группы пойдет надежда быстрова наши поздравления,2017-03-09 12:48:26,29606802,[]
3916,мама я в беде скинь рублей на этот номер подобные мошеннические стали уже классикой сколько томичей ведутся на подобное а также как вывести на чистую воду злоумышленников читайте в нашем материале,2017-03-09 11:39:06,29606802,[]
3917,в какие народные приметы о погоде можно верить об этом рассказала начальник отдела метеорологии томского гидрометцентра светлана рюхтина пройдите тест риа томск и узнайте какие приметы имеют под собой научное обоснование,2017-03-09 08:16:06,29606802,[]
3918,на этой неделе вас ждут любовная комедия с ургантом юбилей пилота звезды восточного танца крутые рок оперы и абсолютно волшебная выставка выбирайте мероприятие для себя,2017-03-09 07:24:34,29606802,[]
3919,сегодня на улицах томска ооочень много мужчин с цветами праздничное настроение в фотографиях риа томск,2017-03-08 12:42:54,29606802,[]
3920,наглядно о том как изменилось здание и территория томского аэропорта,2017-03-08 09:12:05,29606802,[]
3921,обаятельные нежные и неповторимые с марта,2017-03-08 07:09:00,29606802,[]
3922,томские хакеры лучшие хакеры команда тгу вошла в десятку лучших команд на международных хакерских соревнованиях,2017-03-07 13:27:21,29606802,[]
3923,коротко о предпраздничном дне,2017-03-07 12:55:50,29606802,[]
3924,завтра в томске много интересных событий от поэтического концерта до репетиции свадьбы,2017-03-07 11:12:12,29606802,[]
3925,девушки это инфографика дня пусть цветы подаренные вам сегодня или завтра простоят немного дольше с помощью советов и рецептов спасительных растворов полноразмерная картинка тут,2017-03-07 10:48:28,29606802,[]
3926,томички скромнее мужчин в зарплатных ожиданиях обычно они указывают в своих резюме желаемую зарплату в тысячи рублей тогда как томичи в среднем,2017-03-07 07:19:45,29606802,[]
3927,пледы из шерсти мериноса фрубукеты чехлы аккумуляторы и клатчи в виде книг мы собрали оригинальные идеи подарков на марта читайте и черпайте информацию,2017-03-06 12:41:26,29606802,[]
3928,а на концерт азбука симфонического оркестра с артемом варгафтиком идет наталья цедрик всем спасибо за участие,2017-03-06 11:55:17,29606802,[]
3929,на средневековое шоу от рок группы пойдет наталья михалева наши поздравления,2017-03-06 11:36:56,29606802,[]
3930,и если весной вместе со снегом с дорог сойдет и асфальт то потраченные на эти участки средства муниципалитеты вернут в областной бюджет а подрядчики окажутся в списке недобросовестных поставщиков сказал жвачкин,2017-03-06 08:51:46,29606802,[]
3931,теперь в и даже в на троллейбусах и можно уехать домой это стало возможным после введения на них двухсменного графика работы для водителей,2017-03-06 07:50:24,29606802,[]
3932,лидер известной в х группы джон макинери попал в аварию по дороге из новосибирска в томск ему была сделана срочная операция в томской больнице,2017-03-05 10:28:05,29606802,[]
3933,автобусы маршрута начали работать по новой компромиссной схеме теперь маршрутки не ездят по крылова и большой подгорной но заезжают на московский тракт,2017-03-04 09:10:46,29606802,[]
3934,домик розовый зефир,2017-03-04 07:02:15,29606802,[]
3935,ценители классического балета этот конкурс для вас мы разыгрываем пригласительный на лебединое озеро марта в мы рандомно выберем победителя среди тех кто поделился этим постом,2017-03-03 10:59:13,29606802,[]
3936,это гифка антристресс в тгу выяснили что кошки обладают максимальной мимишностью среди других детенышей животных на основании этого магистрантка вуза начала разрабатывать мобильное приложении снимающее эмоциональное напряжение,2017-03-03 10:07:08,29606802,[]
3937,талантливейший николай носков приезжает в томск марта в рамках своего юбилейного тура вместе с исполнителем на сцене выступит струнный квартет делайте репост этой записи и станете участников розыгрыша пригласительного на двоих,2017-03-03 09:14:01,29606802,[]
3938,будущее близко футурологи считают что к году роботы полностью заменят человека в добывающей промышленности а еще второе дыхание получат дирижабли,2017-03-03 08:39:22,29606802,[]
3939,ежи мигранты начали переселяться из более южных регионов в томскую область,2017-03-03 06:57:31,29606802,[]
3940,рано радовались похолодание до минус градусов ожидается в томской области во второй декаде марта правда по ночам,2017-03-02 12:20:16,29606802,[]
3941,глеб самойлов и группа выступят в томске с эксклюзивной программой помимо хитов группы публика услышит лучшие треки легендарной агаты кристи сделайте репост и может быть повезет именно вам мы выберем счастливчика случайным образом марта в удачи,2017-03-02 12:17:25,29606802,[]
3942,счастливый день для владимира жукова именно он услышит треки из знаменитых фильмов в исполнении симфонического оркестра на концерте кино с запада наши поздравления,2017-03-02 11:52:21,29606802,[]
3943,ильича тоже завалило снегом,2017-03-02 10:06:28,29606802,[]
3944,весна пора крутых событий на этой культурной неделе можно будет посмотреть премьеру в драмтеатре про американскую мечту послушать саксофон который звучал в известнейших кинокартинах и поплясать на дискотеке вместе с ладой дэнс и группой,2017-03-02 09:20:29,29606802,[]
3945,,2017-03-02 08:03:28,29606802,[]
3946,кедровые бюсты томского скульптора леонтия усова добрались до ливерпуля легендарный музей с радостью принял этот подарок,2017-03-02 06:56:19,29606802,[]
3947,на открытках молодой томской художницы анастасии еременко коты живую человеческой жизнью собирают цветы едят варенье занимаются йогой и даже принимают ванну в разное время иллюстрации выпускницы тгу публиковались в яндексе журналах и лиза в день кошек предлагаем вам оценить эти милые картинки,2017-03-01 16:11:10,29606802,[]
3948,первый день весны в томске,2017-03-01 15:11:13,29606802,[]
3949,коты томас кутузов и еще один рыжий хвостатый снова могут ходить благодаря имплантатам тпу титановые лапы были установлены котикам в новосибирской ветклинике операция томасу стала уникальной первой в россии и второй в мире,2017-03-01 13:17:10,29606802,[]
3950,совсем скоро можно будет отправиться в путешествие по золотому кольцу томской области это рабочее название маршрута стоимость тура на три дня и две ночи в формате все включено обойдется в тысяч рублей а пока организаторы объявили конкурс на лучшее название маршрута,2017-03-01 12:41:31,29606802,[]
3951,нас ждет теплое начало марта дневная температура первой декады месяца по прогнозам синоптиков будет достигать градусов,2017-03-01 11:58:14,29606802,[]
3952,на концерт чайф идет мария казазаева у которой сегодня день рождения вот такое приятное совпадение мария примите наши поздравления,2017-03-01 11:48:36,29606802,[]
3953,продолжаем разглядывать как изменился наш город на фото переулок кооперативный и цум,2017-03-01 09:12:02,29606802,[]
3954,у вас есть уникальная возможность посмотреть разнотематических фильмов созданных кинематографами со всего света а также обсудить эти картины с российскими учеными а еще можно будет побывать на захватывающих лекциях все это фестиваль актуального научного кино кстати вход на все мероприятия свободный,2017-03-01 08:14:08,29606802,[]
3955,вчера с жилого дома на смирнова на школьницу рухнула глыба снега пострадавшая была госпитализирована,2017-03-01 07:02:29,29606802,[]
3956,ну наконец эта долгая холодная и снежная зима официально сложила свои полномочия с первым днем весны вас томичи,2017-03-01 06:10:02,29606802,[]
3957,ксения колесникова желания исполняются вы победили в нашем конкурсе и идете на концерт орган,2017-02-28 13:21:38,29606802,[]
3958,в томских вузах появятся инновационные центры в рамках проекта минобрнауки тгу и тпу уже в этом году откроют такие центры,2017-02-28 11:10:07,29606802,[]
3959,теперь и школа,2017-02-28 10:46:33,29606802,[]
3960,фестиваль уличного искусства стенограффия впервые пройдет в томске томские художники смогут представить свои эскизы а лучшие работы украсят городские здания и стены,2017-02-28 10:33:22,29606802,[]
3961,на рок оперу иисус христос суперзвезда идет евгения пушкарева наши поздравления,2017-02-27 12:36:17,29606802,[]
3962,у нас на началась трансляция пресс концеренции аниты цой сегодня вечером в бкз она представит томичам свое новое шоу под названием шоу мечты,2017-02-27 12:12:11,29606802,[]
3963,вы не поверите в оцифрованных дореволюционных списках студентов тпу нашлись предки многих знаменитостей среди них родственники оскароносного режиссера майка николса,2017-02-27 12:00:35,29606802,[]
3964,мы готовы объявить победителей розыгрыша на концерт аниты цой счастливыми обладателями пригласительных становятся наталья федотова и дарья шевцова наши поздравления мы свяжемся с вами и расскажем как заполучить билет,2017-02-27 08:17:52,29606802,[]
3965,развязка на пересечении кузовлевского и чекистского трактов в простонародье известная как северская с высоты почти метров,2017-02-27 05:40:08,29606802,[]
3966,зима уходи томичи сожгли чучело и встретили весну у нас много фотографий фотолента пополняется,2017-02-26 13:24:08,29606802,[]
3967,томичи пробудились смотрите как местные моржи вылили на себя ведер воды на стадионе тгу,2017-02-26 12:08:32,29606802,[]
3968,средневековое шоу от рок группы марта в томской филармонии волынка флейта рог буйвола фанфара и другие невиданные музыкальные орудия в стиле босха готовы удивить вас марта мы отдадим пригласительный на этот концерт тому кого выберет приложение рандом стоп марта в,2017-02-26 10:10:10,29606802,[]
3969,яркий томск,2017-02-25 15:45:14,29606802,[]
3970,звездный парус,2017-02-24 15:30:54,29606802,[]
3971,еще одно смертельное чп с обрушением снега в этот раз погиб сторож,2017-02-24 15:06:43,29606802,[]
3972,французские студенты ромен вессье и нельсон батиста приехали в томск по программе обмена перед молодыми людьми стоял выбор стажироваться в россии или в одной из европейских стран студенты рассказали риа томск почему не жалеют о том что выбрали сибирь,2017-02-24 10:50:16,29606802,[]
3973,власти томска нашли собственников гаражей с крыш которых на троих детей обвалился снег в результате чего один ребенок погиб собственником ячейки откуда дети пробрались в опасную зону оказался рабочий которого накануне придавило плитой,2017-02-24 09:33:16,29606802,[]
3974,блестящий популяризатор музыки артем варгафтик марта познакомит томичей с музыкой на букву б а в исполнении томского симфонического оркестра прозвучит музыка баха брамса бетховена марта мы случайным образом определим победителя который получит пригласительный на этот концерт стоп марта в,2017-02-24 09:10:12,29606802,[]
3975,с по февраля в томске можно будет посетить народные ярмарки принять участие в кулачных боях и увидеть сожжение шестиметрового чучела все это широкая томская масленица сохраните эту программу себе пригодится,2017-02-24 07:58:40,29606802,[]
3976,марта на сцене бкз томский симфонический оркестр представит целую антологию самых культовых кинолент крестный отец звездные войны миссия мужчина и женщина и других особую атмосферу запада столетия создадут участники томской студии аниме и косплея в образе чарли чаплина и других звезд у нас есть пригласительный на персоны делайте репост а марта мы рандомно выберем победителя стоп в,2017-02-23 15:59:00,29606802,[]
3977,один из детей на которых упал снег с гаража в томске скончался,2017-02-23 14:14:41,29606802,[]
3978,про таких как они снимают сериалы и фильмы а также пишут книги мы пообщались с томскими криминалистами которые раскрыли нам детали раскрытия пожалуй самых громких преступлений за последнее время это правда интересно,2017-02-23 11:18:09,29606802,[]
3979,в ботаническом саду тгу зацвело видов азалий сотрудники ботсада говорят что это также красиво как цветение сакуры в японии на экскурсию можно попасть и в праздничные дни подробнее,2017-02-23 10:56:54,29606802,[]
3980,не знаете куда сходить на этих длинных выходных вот вам наш традиционный ответ гид по мероприятиям томска,2017-02-23 10:20:46,29606802,[]
3981,блистательная анита цой привозит в томск свое новое шоу фантастические спецэффекты яркие костюмы и отменная постановка все это ожидает вас февраля в бкз мы разыгрываем билета на персоны каждый итоги подведем в понедельник февраля в всем удачи,2017-02-23 09:10:22,29606802,[]
3982,собака томского центра кинологической службы мвд выполняет команду зайка,2017-02-23 08:31:07,29606802,[]
3983,всех причастных к этому дню риа томск от всей души поздравляет с праздником,2017-02-23 07:17:52,29606802,[]
3984,зоозащитники распространяют в соцсетях информацию о жестоком убийстве собаки мужчина пытался отдать свою собаку в пункт передержки верный друг в поросино получив отказ он забил животное насмерть полиция проводит проверку,2017-02-22 13:50:02,29606802,[]
3985,на концерт квартета при участии идет наталья мишанкина поздравляем,2017-02-22 11:24:53,29606802,[]
3986,годы идут а сбербанк на том же месте в е годы в здании на площади ленина располагалась сберкасса,2017-02-22 08:09:06,29606802,[]
3987,жвачкин пожаловался президенту на шелкопряда,2017-02-22 07:10:19,29606802,[]
3988,сергей жвачкин теперь не губернатор а врио главы региона таким его вчера назначил владимир путин после того как жвачкин досрочно сложил полномочия,2017-02-22 06:51:56,29606802,[]
3989,атмосферные коридоры тгу,2017-02-21 17:09:09,29606802,[]
3990,у нас на сайте вышла традиционная блинная инфографика теперь вы знаете куда сходить на масленицу,2017-02-21 13:01:41,29606802,[]
3991,билет на концерт группы пилот выиграла анастасия савченко поздравляем анастасия откройте профиль чтобы с вами можно было связаться и рассказать как забрать пригласительный,2017-02-21 11:42:18,29606802,[]
3992,томичка решила воспользоваться возможностью и подала документы на получение дальневосточного гектара напомним соответствующая госпрограмма действует вот уже полгода женщина хочет развивать там туристический бизнес,2017-02-21 10:20:39,29606802,[]
3993,ведущие томские университеты тгу и тпу вновь получат солидные средства от государства это миллиона рублей по программе повышения мировой конкурентоспособности,2017-02-21 09:24:23,29606802,[]
3994,власти хотят снизить норматив на парковочные места для части новостроек вместо системы квартира машиноместо хотят вести квартира машиноместа,2017-02-21 09:09:24,29606802,[]
3995,мчс предупреждает завтра в томске ожидаются снег и ветер до м с,2017-02-20 13:10:38,29606802,[]
3996,на музыкальный вечер три карты идет мария кривошапова наши поздравления,2017-02-20 12:39:17,29606802,[]
3997,легендарная рок опера иисус христос суперзвезда марта вновь на сцене томского бкз сделайте репост этой записи и получите шанс попасть на мюзикл февраля мы рандомно определим победителя который получит пригласительный на персоны видеоитоги опубликуем в нашем сообществе,2017-02-20 12:09:07,29606802,[]
