0,тело человека было обнаружено при тушении пожара неподалеку от театра ку,2019-02-01 16:23:43,29606802,[]
1,друзья поздравьте нас,2019-02-01 16:08:27,29606802,[]
2,мы узнали когда наконец то потеплеет,2019-02-01 13:32:56,29606802,[]
3,томичи смогут принять участие в голосовании за благоустройство общественных пространств в м году,2019-02-01 12:55:01,29606802,[]
4,волонтеры обратились в полицию чтобы выяснить как шарпей гера выпала с го этажа,2019-02-01 11:20:24,29606802,[]
5,этот товарищ тычет в вас пальцем не просто так,2019-02-01 09:45:48,29606802,[]
6,автовокзал отменяет рейсы из за морозов сегодня завтра еще несколько,2019-02-01 08:51:47,29606802,[]
7,такие терминалы безналичной оплаты появились в некоторых трамваях пока в тестовом режиме,2019-02-01 05:44:48,29606802,[]
8,в маршрутке скоро можно будет не только скроллить ленту вк но и читать книги из научки тгу,2019-01-31 13:31:00,29606802,[]
9,завтра начинает работу единая круглосуточная горячая линия по уборке снега,2019-01-31 12:31:00,29606802,[]
10,начало февраля не порадует теплом жителей томской области,2019-01-31 11:51:02,29606802,[]
11,женщина у которой врачи диагностировали перелом позвоночника вернулась домой после лечения в стационаре,2019-01-31 10:22:03,29606802,[]
12,в тгу провели любопытный эксперимент,2019-01-31 09:10:00,29606802,[]
13,кто такие и хубатка пора знакомиться,2019-01-31 08:12:04,29606802,[]
14,томичи собирают деньги на лечение шарпея геры собака упала с го этажа и сломала позвоночник нужно тысяч рублей более тысяч уже собрано,2019-01-31 05:35:27,29606802,[]
15,на улицах с максимальной концентрации дтп появятся пластиковая разметка и новые дорожные знаки а скорость будет ограничена до километров в час,2019-01-31 04:55:21,29606802,[]
16,вот переболеем и с головой в науку,2019-01-30 11:25:13,29606802,[]
17,парапланеристы больше не смогут соревноваться в лагерном саду,2019-01-30 07:41:30,29606802,[]
18,бревна на обочинах дорог теперь будут расти и на яковлева,2019-01-30 06:42:12,29606802,[]
19,в томске живет человек который умеет превращать заколки для волос гвозди и запчасти от холодильников в гитары,2019-01-29 13:29:33,29606802,[]
20,сейчас на карантин закрыты классов в школах и групп в детсадах,2019-01-29 12:24:36,29606802,[]
21,ложные сообщения о минировании продолжают поступать в организации томской области,2019-01-29 10:29:04,29606802,[]
22,грипп усиливает позиции в томской области,2019-01-29 09:40:00,29606802,[]
23,средняя зарплата жителя томской области в году тысяча рублей,2019-01-29 08:54:55,29606802,[]
24,за последние дни несколько десятков ложных сообщений о минировании поступило в адрес томских организаций,2019-01-28 13:01:34,29606802,[]
25,ремонт дорог в томске в м году должен завершиться не позднее августа как думаете получится,2019-01-28 10:42:50,29606802,[]
26,разрушители легенд атакуют научные мифы в нии психического здоровья день открытых дверей в городских кофейнях проходят антилекции под кофе и чаек,2019-01-28 09:47:00,29606802,[]
27,крещенские морозы чуть припоздали,2019-01-28 07:58:37,29606802,[]
28,ддт привезет в томск программу история звука представив своим поклонникам все свои нетленки в один вечер,2019-01-28 05:42:24,29606802,[]
29,нашли все самые сочные предложения киберпонедельника,2019-01-27 07:24:13,29606802,[]
30,хорошая новость земля не столкнется с гигантским астероидом,2019-01-27 06:13:50,29606802,[]
31,бум кофе с собой в томске практически закончился зато появляются кофейни которые предлагают альтернативные способы заваривания кемекс пуровер аэропресс рынок пытается предложить потребителю новые места с такой концепцией приятные сидебельные модные,2019-01-26 09:16:45,29606802,[]
32,день студенчества в томске отметили акцией,2019-01-25 14:05:47,29606802,[]
33,в выходные в томске основательно похолодает,2019-01-25 12:31:34,29606802,[]
34,дело летней сожительницы альтапова отправилось в суд томичка обвиняется в укрывательстве преступления,2019-01-25 11:37:33,29606802,[]
35,новый завод по переработке рапса сегодня открылся в светлом,2019-01-25 09:06:06,29606802,[]
36,сегодня прошло первое судебное заседание по делу михаила бегуна,2019-01-25 07:36:01,29606802,[]
37,томск студенческий с праздником утепляем татьяну покровительницу и веселимся,2019-01-25 04:57:49,29606802,[]
38,несчастный случай произошел когда лесничие и сотрудники полиции попытались задержать группу черных лесорубов,2019-01-24 13:54:24,29606802,[]
39,хоккей в валенках и керлинг с надувными санками бесплатные киносеансы капсула времени и деликатесы полевой кухни,2019-01-24 12:32:01,29606802,[]
40,беспошлинный лимит на посылки из за рубежа сократился,2019-01-24 11:46:56,29606802,[]
41,томичка шла по алтайской и в этот момент ей на спину свалилась снежная глыба,2019-01-24 11:01:06,29606802,[]
42,в томске разгулялся грипп,2019-01-24 10:27:57,29606802,[]
43,в поликлинике появились информаты с помощью них пациенты смогут пройти медицинское анкетирование перед консультацией это для того чтобы сэкономить время на приеме у врача,2019-01-24 08:10:03,29606802,[]
44,журналист и писатель виктор лойша скончался в среду на м году жизни,2019-01-24 04:50:08,29606802,[]
45,к году власти ожидают что кружки и секции будут посещать до томских детей,2019-01-23 16:10:13,29606802,[]
46,все дипломом об образовании можно подпереть шатающийся шкаф,2019-01-23 15:21:00,29606802,[]
47,третий год подряд томичи все меньше и меньше денег тратят на кафе и рестораны и это даже без учета инфляции,2019-01-23 13:49:51,29606802,[]
48,томичи могут проголосовать место для парка аттракционов не состоявшегося на территории михайловской рощи,2019-01-23 12:40:59,29606802,[]
49,чтобы развиваться томи нужен еще один спонсор переговоры с возможными партнерами уже идут,2019-01-23 11:33:48,29606802,[]
50,мы уже рассказывали что за отопление в январе томичи заплатят больше чем рассчитывали разница между ожиданием и реальностью от до рублей,2019-01-23 10:32:15,29606802,[]
51,дмитрий певцов и никита высоцкий февраля в цк тгу представят музыкально литературный спектакль баллада о высоцком,2019-01-23 06:28:26,29606802,[]
52,мэрия хочет взыкать миллионов с перевозчика работающего на м маршруте,2019-01-22 14:11:13,29606802,[]
53,по томской области гуляет грипп кое где даже зафиксировали свиной,2019-01-22 13:30:03,29606802,[]
54,в томской области снова появится госпожнадзор,2019-01-22 12:49:38,29606802,[]
55,рубрика удивительно но факт,2019-01-22 11:46:00,29606802,[]
56,более учеников молчановской школы отправились домой вместо того чтобы сидеть на уроках,2019-01-22 10:59:57,29606802,[]
57,на всех томских магазинах абрикос в ближайшие полгода изменится вывеска с названием,2019-01-22 09:48:30,29606802,[]
58,сергей жвачкин призвал томских айтишников подключиться к модернизации городского транспорта,2019-01-22 08:35:23,29606802,[]
59,и биться сердце стало чаще,2019-01-22 06:30:00,29606802,[]
60,косметика с ксеноном от ученых томского госуниверситета может появиться в федеральных сетях азиатские рынки она уже завоевала отбеливающие средства под брендом подснежник продаются в индонезии малайзии вьетнаме,2019-01-22 05:38:35,29606802,[]
61,волонтеры организации стиль жизни томского политеха запустили акцию по сбору макулатуры все вырученные средства пойдут на помощь бездомным животным,2019-01-21 17:11:47,29606802,[]
62,интересно сколько времени займет внедрение кондукторов,2019-01-21 13:36:08,29606802,[]
63,все течет все меняется вот и китай больше не лидер по экспорту древесины из томской области,2019-01-21 12:51:37,29606802,[]
64,хочу помочь пацанам сказал томич егор позвонив в фонд имени алены петровой,2019-01-21 10:30:04,29606802,[]
65,нет тебя прекрасней синий иней люди встречаются и многие другие добрые песни прозвучат в бкз февраля на концерте виа поющие гитары,2019-01-21 09:57:49,29606802,[]
66,это аномалия такой жары в январе не было в томске лет,2019-01-21 09:07:01,29606802,[]
67,гостиниц в томске становится меньше однако это вовсе не означает что в наш город не заглядывают гости,2019-01-21 08:23:00,29606802,[]
68,почему вузы так бьются за иностранных студентов,2019-01-21 06:20:08,29606802,[]
69,пять тысяч томичей не побоялись окунуться в воду белого озера в крещение и еще столько же стали зрителями,2019-01-20 06:30:01,29606802,[]
70,крещенские купания как томск смывает грехи и закаливает тело и дух,2019-01-19 14:21:23,29606802,[]
71,ну что теплые выходные отличный повод для прогулки,2019-01-19 09:56:44,29606802,[]
72,томский врач анестезиолог владимир корнилов занимается самой сложной категорией пациентов онкобольными детьми и пациентами с инсультами,2019-01-19 06:34:42,29606802,[]
73,татнефть томская азс незаконно использует товарный знак компании фейковая заправка,2019-01-18 14:36:58,29606802,[]
74,выдыхаем в михайловской роще парка аттракционов не будет,2019-01-18 13:18:03,29606802,[]
75,еще больше месяца томичей будет радовать главная городская горка,2019-01-18 12:20:36,29606802,[]
76,мужчина убил котенка желая отомстить сожительнице которая объявила о расставании,2019-01-18 10:16:45,29606802,[]
77,говорят только на белом озере в этом году крещение будут праздновать более тысяч человек,2019-01-18 07:43:03,29606802,[]
78,осужденные томской исправительной колонии освоили технологию изготовления колбасы и сервелата без гмо и сои,2019-01-17 16:34:24,29606802,[]
79,летний марк пережил серьезную травму после чего видел только одним глазом,2019-01-17 10:23:09,29606802,[]
80,томичи могут окунуться в прорубь на семи реках и озерах а всего в томской области таких объектов будет почти,2019-01-17 09:11:24,29606802,[]
81,четверг самый культурный день недели,2019-01-17 08:13:51,29606802,[]
82,томский мальчик информация о пропаже которого размещена в социальных сетях и в мессенджерах нашелся еще вчера,2019-01-17 07:05:39,29606802,[]
83,в этом году мы похоже остались без крещенских морозов,2019-01-17 06:14:22,29606802,[]
84,томский аэропорт после реконструкции сможет предложить пассажирам телескопических трапа,2019-01-16 14:24:04,29606802,[]
85,бензин на томских заправках снова подорожал,2019-01-16 13:16:10,29606802,[]
86,иллюминация будет работать в томске еще неделю,2019-01-16 11:55:33,29606802,[]
87,в бкз проблема с акустикой,2019-01-16 10:44:14,29606802,[]
88,неработающим пенсионерам страховую пенсию в этом году повысят на,2019-01-16 09:08:48,29606802,[]
89,врачи объясняют почему детям нельзя нырять в прорубь на крещение,2019-01-16 07:23:00,29606802,[]
90,следователи рассказали про резонансное дело убийство девочки в нарге сейчас подозреваемый мужчина проходит психиатрическую экспертизу от этого зависит какое наказание он понесет принудительное лечение или лет лишение свободы подробности в материале риа томск,2019-01-16 06:24:00,29606802,[]
91,частные юристы и специалисты роспотребнадзора помогают томским туристам которые не смогли улететь на отдых в китай составлять иски на получение компенсаций от туроператора жемчужная река,2019-01-16 05:19:00,29606802,[]
92,все бумаги подписаны газпром сейчас рассчитывается и мы получим около миллионов рублей и рассчитаемся со всеми долгами и со следующего года у нас проблем не будет если не захотим в премьер лигу сказал жвачкин,2019-01-15 17:38:38,29606802,[]
93,талисманом чемпионата россии по плаванию в ластах стал детеныш нерпы белек,2019-01-15 13:25:27,29606802,[]
94,очень мягкая новость,2019-01-15 09:51:45,29606802,[]
95,в ближайшее время томские диабетики смогут получать расходники для введения инсулина бесплатно,2019-01-15 09:06:00,29606802,[]
96,двое томичей получили условные сроки за создание подпольной лаборатории по изготовлению оружия,2019-01-15 08:31:37,29606802,[]
97,с января года штрафы за нарушение правил безопасности дорожного движения поступают в региональные дорожные фонды то есть тратить их можно будет только на содержание ремонт и строительство дорог,2019-01-15 06:12:33,29606802,[]
98,неизвестные переименовали несколько томских школ назвав их в честь бразильского стриптизера рикардо милоса в картах,2019-01-14 16:15:00,29606802,[]
99,чиновники предоставили многодетным семьям и семьям с детьми инвалидами земельные участки расположенные в границах санитарно защитной зоны оптоволоконной сети,2019-01-14 14:21:23,29606802,[]
100,ск возбудил уголовное дело по факту смерти томички после операции в частной клинике,2019-01-14 13:37:06,29606802,[]
101,не знаем как вы а наша дорогая редакция сильно удивилась получив квитанции за тепло,2019-01-14 12:50:34,29606802,[]
102,ученые из сша будут реконструировать лесные пожары в пойме оби,2019-01-14 11:05:45,29606802,[]
103,понедельничная сова,2019-01-14 07:09:45,29606802,[]
104,размер пособия по безработице не менялся уже лет,2019-01-13 12:47:58,29606802,[]
105,лечебное биомороженое средство от ржавчины косметика и даже антимикробный крем с серебром все эти и многие другие товары с прилавков магазинов разработки томских ученых,2019-01-13 10:21:51,29606802,[]
106,со старым новым годом томичи,2019-01-13 07:11:35,29606802,[]
107,ночь перед старым новым годом традиционное время для ворожбы,2019-01-12 12:44:23,29606802,[]
108,всероссийская выставка лучших молодых фотографов стартует в томске января,2019-01-12 10:15:28,29606802,[]
109,жители тегульдетского района очень активны люди которые живут заготовкой дикоросов опасаются что такая возможность у них может исчезнуть из за масштабных вырубок,2019-01-12 07:27:57,29606802,[]
110,января в томске пройдут традиционные крещенские купания,2019-01-12 06:30:00,29606802,[]
111,в томске собирают автомобиль способный ездить по заснеженным и обледенелым дорогам без водителя,2019-01-11 12:54:45,29606802,[]
112,почему то решили не ехать на каннский кинофестиваль тогда он сам приедет к вам,2019-01-11 11:23:01,29606802,[]
113,утро выдалось холодным но жители академгородка не растерялись и синхронно затопили печи,2019-01-11 09:07:39,29606802,[]
114,это не розыгрыш,2019-01-10 15:43:00,29606802,[]
115,ранее в нескольких томских сми и социальных сетях появились сообщения о том что в одной из клиник томска после проведения операции скончалась пациентка,2019-01-10 14:46:22,29606802,[]
116,будет снег мнооого снега,2019-01-10 13:29:13,29606802,[]
117,поводом для вызова был мужчина который находился без сознания во время осмотра пациент внезапно подскочил и ударил фельдшера кулаком в живот,2019-01-10 12:45:04,29606802,[]
118,таинственные мы бы даже сказали мистические виды досуга предлагают томские музеи на святки,2019-01-10 11:40:40,29606802,[]
119,курсы иностранного языка скандинавская ходьба и плавание пользуются особой популярностью у томских пенсионеров,2019-01-10 10:01:19,29606802,[]
120,в съемной квартире северчанина сотрудники полиции нашли килограмма наркотиков,2019-01-09 13:14:55,29606802,[]
121,вот тебе венеция приговаривают томичи перепрыгивая через лужи в центре томска,2019-01-09 12:36:35,29606802,[]
122,на полисы осаго действуют новые тарифы,2019-01-09 11:03:03,29606802,[]
123,пригласительный на постановку мастер и маргарита получает аля искоркина,2019-01-09 10:03:02,29606802,[]
124,томские ученые готовят интерактивную модель обучения математике аналогов которой в мире не существует,2019-01-09 09:04:00,29606802,[]
125,погодка сегодня отпад,2019-01-09 07:59:31,29606802,[]
126,перед зданием центра временного содержания иностранных граждан на иркутском собралась очередь из нескольких сотен людей,2019-01-09 06:04:42,29606802,[]
127,долг тту томска по кредитам сократился почти в раз за пять лет,2019-01-08 10:38:49,29606802,[]
128,эксперты томской торгово промышленной палаты оценили экономику региона,2019-01-08 06:41:33,29606802,[]
129,томичи и творческий коллектив жаворонки устроили настоящий праздник на улицах города,2019-01-07 09:22:28,29606802,[]
130,накануне нового года в итатке сгорел дом в котором жила семья из пятерых человек трое из которых дети,2019-01-07 07:33:39,29606802,[]
131,сегодня один из главных христианских праздников рождество христово,2019-01-07 06:20:51,29606802,[]
132,православные в ночь на января будут отмечать рождественский сочельник,2019-01-06 12:47:42,29606802,[]
133,специальный чип в который интегрированы функции пропуска в тгу банковской карты и даже билета на метро в москве будет вживлен подопытному добровольцу,2019-01-06 10:25:28,29606802,[]
