2311,крымский военно исторический фестиваль пройдет в севастополе в пятый раз с по сентября,2018-08-21 14:09:00,55342106,[]
2312,августа день в истории знаковые события и даты севастополя россии и мира,2018-08-21 13:30:03,55342106,[]
2313,севастополь район летчики дожимают рынок тв наехало снимают,2018-08-21 13:10:47,55342106,[]
2314,августа на мысе фиолент яхта ушла на дно,2018-08-21 11:21:00,55342106,[]
2315,местный респект,2018-08-21 10:07:00,55342106,[]
2316,мкр слышны выстрелы со стороны парка победы кто знает что случилось,2018-08-21 08:58:52,55342106,[]
2317,лайфхак как заработать в севастополе,2018-08-20 22:27:00,55342106,[]
2318,череда возгораний в центре севастополя продолжилась на этот раз обширно горело рядом с баркасом общая площадь выгоревшего участка квадратных метров,2018-08-20 21:23:00,55342106,[]
2319,наш город меняется и сейчас группа энтузиастов и активисты велопобеды работают над новой перспективной схемой велодорожек севастополя а не зря ли они это все делают,2018-08-20 20:07:41,55342106,[]
2320,вот такой челлендж мне нравится,2018-08-20 18:17:00,55342106,[]
2321,смерч в севастополе,2018-08-20 16:17:00,55342106,[]
2322,праздник дрифта в крыму состоялся этап,2018-08-20 15:30:03,55342106,[]
2323,фк севастополь одержал безоговорочную победу в первом матче чемпионата премьер лиги крымского футбольного союза,2018-08-20 14:50:00,55342106,[]
2324,у берегов севастополя на мель села яхта,2018-08-20 13:08:00,55342106,[]
2325,скала дива прыжок с высоты метров,2018-08-20 12:28:00,55342106,[]
2326,в севастополе снимают документальный фильм о подводном историческом наследии причем впервые в сверхвысоком разрешении к энтузиасты фридайвинга из ассоциации подводной деятельности крыма и севастополя таким образом пропагандируют этот вид спорта и изучение истории своей родины ныряльщики говорят в водах черного моря масса интересных затонувших объектов разных эпох и доступны они даже людям с минимальной подготовкой и финансовыми возможностями,2018-08-20 11:09:00,55342106,[]
2327,генеральские пляжи тихая бухта судакская крепость ласточкино гнездо и другие красивые места крыма,2018-08-20 10:26:00,55342106,[]
2328,августа приглашает вас на шоу в честь поездки на конкурс новая звезда приходи и поддержи,2018-08-20 10:01:55,55342106,[]
2329,тем временем в индии,2018-08-20 09:22:47,55342106,[]
2330,добрый вечер всех с крещением руси а вот и фильм к вечернему просмотру публикуем фильм херсонес великий,2018-08-20 01:11:00,55342106,[]
2331,,2018-08-19 22:21:00,55342106,
2332,новый арт объект,2018-08-19 19:07:00,55342106,[]
2333,пусть весь город знает это чудовище ходила на днях по московскому с ребенком запудрила мозги с купюрой в этот же день провернула данную аферу около цума и в тц апельсин,2018-08-19 18:43:18,55342106,[]
2334,байк шоу в севастополе посетили около тысяч человек,2018-08-19 16:31:00,55342106,[]
2335,балаклава,2018-08-19 15:16:00,55342106,[]
2336,больше камер больше штрафов,2018-08-19 14:00:03,55342106,[]
2337,,2018-08-19 13:07:00,55342106,
2338,ретро клумба в севастополе,2018-08-19 11:17:00,55342106,[]
2339,новый вид экскурсии на слоне по центру севастополя,2018-08-19 10:21:00,55342106,[]
2340,унфс напоминает предпринимателям сроки перехода на применение онлайн касс и размерах штрафов за уклонение,2018-08-19 09:19:15,55342106,[]
2341,в крыму предложили запустить поезд дружбы берлин москва симферополь,2018-08-19 09:00:03,55342106,[]
2342,фестиваль воздушных шаров в крыму,2018-08-18 23:04:00,55342106,[]
2343,,2018-08-18 22:00:00,55342106,
2344,прекрасные фотографии севастопольского фотографа наталья музычук,2018-08-18 21:14:00,55342106,[]
2345,пробку возле места проведения байк шоу в севастополе запечатлели на видео,2018-08-18 20:14:00,55342106,[]
2346,суд присяжных в севастопольском горсуде появился с января этого года,2018-08-18 19:21:00,55342106,[]
2347,салют байк шоу,2018-08-18 18:11:00,55342106,[]
2348,байк шоу русская мечта кульминация,2018-08-18 17:07:00,55342106,[]
2349,местный респект,2018-08-18 16:09:00,55342106,[]
2350,пожар в центре севастополя,2018-08-18 15:13:46,55342106,[]
2351,севастопольские ученые разработали экологически безопасную технологию утилизации,2018-08-18 15:00:08,55342106,[]
2352,,2018-08-18 14:07:00,55342106,
2353,севастополь сейчас,2018-08-18 14:05:22,55342106,[]
2354,байк шоу ночные волки,2018-08-18 12:19:33,55342106,[]
2355,узнаете местечко каждое утро эта кошечка на своем посту,2018-08-18 11:06:00,55342106,[]
2356,августа в феодосии пройдет фестиваль искусств посвященный дню рождения александра грина,2018-08-18 09:00:03,55342106,[]
2357,не пропусти торжественное открытие чемпионата премьер лиги крымского футбольного союза,2018-08-18 08:00:05,55342106,[]
2358,,2018-08-17 23:03:00,55342106,
2359,в херсонесе таврическом в субботу августа в четь дня археолога впервые за более чем лет зазвучит один из главных символов музея заповедника туманный колокол,2018-08-17 22:08:00,55342106,[]
2360,едете на байк шоу,2018-08-17 21:09:00,55342106,[]
2361,то что необходимо мне в конце рабочей недели,2018-08-17 20:03:00,55342106,[]
2362,,2018-08-17 19:00:03,55342106,
2363,официальный комментарий фнс о транспортном налоге рано радовались,2018-08-17 18:30:02,55342106,[]
2364,высокоточный комплекс калибр поразил цель,2018-08-17 18:09:00,55342106,[]
2365,хочешь быть в курсе всех молодежных событий,2018-08-17 17:00:01,55342106,[]
2366,,2018-08-17 16:12:00,55342106,
2367,это те кто ждет вас под водой,2018-08-17 14:03:01,55342106,[]
2368,живуфутболомсевастополь начало футбольной эры в городе герое,2018-08-17 13:00:09,55342106,['живуфутболомсевастополь']
2369,путин подписал закон о праздновании апреля дня принятия крыма в состав российской империи,2018-08-17 11:41:38,55342106,[]
2370,в севастополе две улицы отремонтируют за млн рублей,2018-08-17 11:12:00,55342106,[]
2371,тц готовится к открытию,2018-08-17 10:37:51,55342106,[]
2372,купил гироскутер не забудь зарегистрироваться в гибдд и получить водительское удостоверение,2018-08-17 10:00:10,55342106,[]
2373,в севастополе снесут недостроенный каток на пожарова,2018-08-17 09:32:05,55342106,[]
2374,найден пес в районе студ городка,2018-08-16 21:14:00,55342106,[]
2375,,2018-08-16 20:12:00,55342106,
2376,малообеспеченным и многодетным семьям севастополя компенсируют покупку школьной формы,2018-08-16 19:00:05,55342106,[]
2377,возможно ли благоустроить фиолент сохранив красоту обезопасить туристов и не разбудить оползни ищем ответ в открытом вопросе,2018-08-16 18:13:00,55342106,[]
2378,,2018-08-16 17:00:03,55342106,
2379,водителей пугают штрафными утками,2018-08-16 16:30:03,55342106,[]
2380,в севастополе в центре внимания юмашевский рынок причиной стала появление остановки на остановке,2018-08-16 16:07:00,55342106,[]
2381,августа день в истории знаковые события и даты севастополя россии и мира,2018-08-16 15:13:13,55342106,[]
2382,по итогам первых дней комета курсирующая на маршруте севастополь ялта севастополь перевезла более пассажиров,2018-08-16 15:11:00,55342106,[]
2383,севастополь фиолент пляж баунти,2018-08-16 14:07:00,55342106,[]
2384,житель севастополя виктор кравец сделал из обычной копейки кабриолет,2018-08-16 13:34:00,55342106,[]
2385,сегодня в на м киллометре товарищь водитель автобуса маршрута татарской внешности предрассудков никаких нет в наглой форме отобрал деньги в размере рублей у ребенка лет когда та попыталась оплатить за проезд причем он сказал иди н хрен малолетка сотрудник был уволен спустя мин после кражи спасибо за своевременную реакцию компании этого маршрута надеюсь этот гражданин вернет деньги просто не хочется чтобы это повторялось в таких случаях звоните не в полицию а в компанию маршрута там разберутся молнееностно,2018-08-16 12:27:22,55342106,[]
2386,,2018-08-16 11:18:00,55342106,
2387,как выглядят люди в интернете в реальной жизни,2018-08-16 10:18:00,55342106,[]
2388,вы такси в балаклаву заказывали,2018-08-16 09:09:00,55342106,[]
2389,,2018-08-16 08:30:00,55342106,
2390,севастополь,2018-08-15 23:02:00,55342106,[]
2391,августа впервые за много лет зазвучит туманный колокол херсонеса таврического,2018-08-15 22:08:00,55342106,[]
2392,пляж каравелла на мысе фиолент,2018-08-15 21:12:00,55342106,[]
2393,под симферополем археологи нашли уникальные погребения,2018-08-15 20:00:08,55342106,[]
2394,существует поверье если вы были в крыму,2018-08-15 19:09:00,55342106,[]
2395,,2018-08-15 18:32:00,55342106,
2396,,2018-08-15 17:29:00,55342106,
2397,,2018-08-15 17:00:02,55342106,
2398,севастополь это не еще один город на карте мира а то место в котором хоть раз должен побывать каждый,2018-08-15 16:17:00,55342106,[]
2399,бесплатная юридическая помощь в севастополе итоги проекта мы защищаем права севастопольцев,2018-08-15 15:00:12,55342106,[]
2400,предметы найденные в ходе раскопок при строительстве федеральной трассы таврида перейдут в фонды музея херсонес таврический в севастополе,2018-08-15 13:11:26,55342106,[]
2401,фото красот балаклавы,2018-08-15 11:23:00,55342106,[]
2402,началась эвакуации жителей перед подрывом немецкой авиабомбы времен вов севастополь ул мельника,2018-08-15 11:13:08,55342106,[]
2403,имущественный налог для жителей севастополя как где и сколько необходимо оплатить,2018-08-15 10:25:23,55342106,[]
2404,тц муссон откроют не раньше нового года,2018-08-15 10:17:00,55342106,[]
2405,севастопольцев эвакуируют из района где уничтожат авиабомбу,2018-08-15 09:29:56,55342106,[]
2406,вандалы даже слона испортили,2018-08-15 08:21:12,55342106,[]
2407,севастополь августа станет одним из городов россии где состоится акция хоровод мира,2018-08-14 22:19:00,55342106,[]
2408,,2018-08-14 21:30:00,55342106,
2409,охраняемые автостоянки и вся информация о платных и бесплатных парковках в севастополе,2018-08-14 20:37:00,55342106,[]
2410,в севастополе на фиоленте турист прыгнул со скалы и переломал ноги,2018-08-14 20:03:01,55342106,[]
2411,шикарное небо,2018-08-14 19:17:00,55342106,[]
2412,августа день в истории знаковые события и даты севастополя россии и мира,2018-08-14 18:37:00,55342106,[]
2413,,2018-08-14 18:09:00,55342106,[]
2414,севастополь влюбляет в себя сразу влюбляет своей гордой суровой красотой и любит глубоко искренне,2018-08-14 17:23:00,55342106,[]
2415,в севастополе раздают землю дачи януковича,2018-08-14 16:21:00,55342106,[]
2416,судьба муссона стала еще туманнее,2018-08-14 15:20:00,55342106,[]
2417,в суде выяснилось что проект парка ахматовой и пляжа солнечный так и остался на бумаге а что же тогда приняло правительство севастополь,2018-08-14 14:50:00,55342106,[]
2418,спасибо вам фиолентовские эльфы,2018-08-14 14:12:00,55342106,[]
2419,виртуальная стена светофоры будущего,2018-08-14 13:11:00,55342106,[]
2420,августа скорбная дата в истории медицины севастополя,2018-08-14 11:09:58,55342106,[]
2421,в крыму пройдут соревнования по прыжкам в воду с метровой высоты,2018-08-14 11:09:00,55342106,[]
2422,материнский инстинкт,2018-08-14 09:09:00,55342106,[]
2423,музей подводных лодок в балаклаве,2018-08-14 08:12:00,55342106,[]
2424,на детской площадке по адресу пор в найден кулон обращаться в личные сообщения,2018-08-13 23:03:00,55342106,[]
2425,привет на улице живет такой пародистый красавчик мальчик ему почти года хозяева переехали и оставили его теперь он живет на улице может кто то хочет себе такую собаку,2018-08-13 22:09:00,55342106,[]
2426,топ самых фантастических озер крыма,2018-08-13 21:21:00,55342106,[]
2427,,2018-08-13 20:09:00,55342106,
2428,уважаемые жители и гости севастополя и крыма если вы увидели живого дельфина на мелководье или на берегу пожалуйста никогда не выталкивайте его в море,2018-08-13 19:19:00,55342106,[]
2429,информируем,2018-08-13 18:44:00,55342106,[]
2430,на что похоже,2018-08-13 18:08:20,55342106,[]
2431,крымские мальдивы,2018-08-13 17:15:01,55342106,[]
2432,производство инкерманского завода марочных вин от виноградной лозы до готовой продукции,2018-08-13 16:00:10,55342106,[]
2433,россия,2018-08-13 15:09:00,55342106,[]
2434,погиб подросток на набережной в ялте,2018-08-13 14:04:00,55342106,[]
2435,августа день в истории знаковые события и даты севастополя россии и мира,2018-08-13 13:30:02,55342106,[]
2436,зарубежные и российские исполнители встретились на фестивале опера в херсонесе,2018-08-13 13:07:00,55342106,[]
2437,севастопольский цирк на пожарова,2018-08-13 12:13:00,55342106,[]
2438,кто смотрел сегодня ночью самый яркий звездопад года,2018-08-13 11:11:00,55342106,[]
2439,как собрать ребенка в школу и не разориться цены на школьные товары в севастополе,2018-08-13 10:00:07,55342106,[]
2440,когда играет твой любимый трек в любом возрасте,2018-08-13 09:17:00,55342106,[]
2441,,2018-08-13 08:17:00,55342106,
2442,в севастополе вспоминают погибших на подлодке курск,2018-08-12 23:03:00,55342106,[]
2443,севастопольцы в ночном небе увидят самый яркий звездопад года,2018-08-12 22:07:00,55342106,[]
2444,присылайте фото своих домашних любимцев в комменты,2018-08-12 21:12:00,55342106,[]
2445,,2018-08-12 20:09:00,55342106,
2446,реклама,2018-08-12 19:00:07,55342106,['реклама']
2447,историк из сибири побывал в севастополе на новый год и сказал что севастополь единственное место где сохранилась настоящая россия,2018-08-12 18:09:00,55342106,[]
2448,такой разный севастополь,2018-08-12 17:17:00,55342106,[]
2449,в р не юмашева был утерен коричневый кошелек в нем был й айфон золотой умоляю верните тел в нем очень важная информация а так же фото тех кого уже нет и востановить нет возможности вы не сможите им воспользоватся я же за него заплачу много больше чем если его продавать на запчасти т,2018-08-12 16:04:00,55342106,[]
2450,какой пляж посещаете чаще всего в севастополе,2018-08-12 14:15:01,55342106,[]
2451,сейчас севастополь,2018-08-12 12:40:11,55342106,[]
2452,в судьбе миллиардного проекта по реконструкции парка победы в севастополе новый поворот,2018-08-12 11:19:00,55342106,[]
2453,севастополь влюбляет в себя с самого детства,2018-08-12 10:14:00,55342106,[]
2454,,2018-08-12 09:00:11,55342106,
2455,безумно красивое место,2018-08-12 08:11:10,55342106,[]
2456,парусную неделю в севастополе украсят гонки аквабайкеров,2018-08-11 22:18:00,55342106,[]
2457,севастополь,2018-08-11 21:21:00,55342106,[]
2458,в севастопольском парке победы может снова поменяться подрядчик,2018-08-11 20:09:00,55342106,[]
2459,,2018-08-11 19:21:00,55342106,
2460,,2018-08-11 18:24:00,55342106,
2461,в турции задержан плывший на плоту из севастополя путешественник,2018-08-11 17:19:00,55342106,[]
2462,в севастополе хотят построить фабрику мороженого и светодиодный завод,2018-08-11 16:02:01,55342106,[]
2463,,2018-08-11 13:41:00,55342106,
2464,парк победы в севастополе продолжат застраивать апартаментами,2018-08-11 12:33:00,55342106,[]
2465,херсонес уже давно нуждался в глобальной реконструкции с большими вложениями и вот дождался,2018-08-11 11:29:00,55342106,[]
2466,черное море может превратиться в болото,2018-08-11 10:14:00,55342106,[]
2467,заходящие в севастопольскую бухту корабли будет встречать метровый николай чудотворец,2018-08-11 08:24:41,55342106,[]
2468,в севастопольском троллейбусе искали мину,2018-08-10 23:09:00,55342106,[]
2469,сегодня водитель маршрута на весь салон выяснял отношения по телефону со своим коллегой который его обогнал на маршруте и не дал ему заработать не очень интересная тема для пассажиров и неудобное ожидание пока мы поедем дальше на видео концовка разговора а началось все с фразы петрович ты что закуситься хочешь а затем уже последовало минутное объяснение петровичу за что закус ну и конечно же петрович не из робкого десятка сразу не воспринял наезд коллеги анонимно пожалуйста,2018-08-10 22:17:00,55342106,[]
2470,,2018-08-10 21:00:07,55342106,
2471,,2018-08-10 20:09:00,55342106,
2472,,2018-08-10 19:00:03,55342106,
2473,жителям полуострова впервые придется заплатить налог на землю по российским законам,2018-08-10 18:07:00,55342106,[]
2474,,2018-08-10 17:34:00,55342106,
2475,херсонес таврический в севастополе стал интерактивным,2018-08-10 16:09:00,55342106,[]
2476,августа день в истории знаковые события и даты севастополя россии и мира,2018-08-10 15:09:00,55342106,[]
2477,пассажиры скоростной кометы сняли на видео поездку из ялты в севастополь,2018-08-10 14:19:00,55342106,[]
2478,новый археологический проект в крыму,2018-08-10 13:48:52,55342106,[]
2479,в черноречье под севастополем появится элитный коттеджный поселок,2018-08-10 13:16:00,55342106,[]
2480,в балаклаве создадут подводный музей,2018-08-10 12:17:00,55342106,[]
2481,,2018-08-10 11:07:00,55342106,
2482,на развитие детских поликлиник севастополя направят млн,2018-08-10 10:09:00,55342106,[]
2483,пробки не для всех ост хрюкина,2018-08-10 09:18:00,55342106,[]
2484,ретро севастополь площадь ушакова,2018-08-10 08:16:00,55342106,[]
2485,,2018-08-09 22:11:00,55342106,
2486,летие послевоенного восстановления города севастополя,2018-08-09 21:30:02,55342106,[]
2487,,2018-08-09 21:07:00,55342106,
2488,сколько будет стоить парковка минтранс подготовил рекомендации по стоимости платной парковки,2018-08-09 20:30:03,55342106,[]
2489,августа день в истории знаковые события и даты севастополя россии и мира,2018-08-09 19:50:00,55342106,[]
