2574,перуанцы признаны самыми активными и преданными болельщиками по итогам чм помните эта многотысячная красно белая армия приезжала в екатеринбург,2018-09-25 09:55:00,32182751,[]
2575,депутаты выбрали нового мэра екатеринбурга александр высокинский будет возглавлять город четыре года,2018-09-25 08:51:27,32182751,[]
2576,интересные детали можно усмотреть на старых снимках,2018-09-25 08:34:38,32182751,[]
2577,бюстгальтер и авоську потеряли болельщики матча урал ростов на екатеринбург арене после игры сотрудники стадиона обнаружили множество интересных вещей помимо уже указанных на трибунах оставили пледы дезодоранты контейнер для еды кто то взял с собой покушать несколько комплектов ключей как же люди домой потом попали штопор все понятно гаечный ключ ключ от автомобиля пинцеты,2018-09-25 08:01:00,32182751,[]
2578,золотая осень в верх исетском районе,2018-09-25 07:31:00,32182751,[]
2579,доброе утро,2018-09-25 06:31:00,32182751,[]
2580,динамичное любительское видео ночного екатеринбурга от подписчика как вам,2018-09-24 21:02:01,32182751,[]
2581,ночной чат,2018-09-24 20:02:01,32182751,[]
2582,тем временем школьники нижнего тагила и нижней туры дерутся город на город предположительно в результате конфликта мальчику сломали позвоночник,2018-09-24 19:32:00,32182751,[]
2583,екатеринбург пожалуй самый музыкальный город журнал афиша даже когда то написал о нас так кажется в этом городе у каждой семьи есть повинность родить хотя бы одного музыканта,2018-09-24 18:34:00,32182751,[]
2584,полиция ищет пострадавших от банды грабителей мужчины действовали по отлаженной схеме грабя водителей сейчас они задержаны,2018-09-24 18:05:01,32182751,[]
2585,,2018-09-24 17:05:00,32182751,
2586,вице мисс екатеринбурга ирина воржева вошла в топ конкурса красоток журнала,2018-09-24 16:33:00,32182751,[]
2587,охранники трц гринвич силой утащили в подсобное помещение летнего школьника и провели воспитательную беседу с угрозами видео прислал очевидец событий подписчик типичного екатеринбурга,2018-09-24 15:31:00,32182751,[]
2588,подписчик прислал нам фотографию скамеек в парке чкалова горожане удивляются и возмущаются столь удобным местам для отдыха,2018-09-24 15:05:01,32182751,[]
2589,лекция о буддийской тантре пройдет сентября в в музее об этом в рамках цикла встреч сексуальные культуры народов мира проведет ее евгений ильич рабинович культуролог кандидат наук исследователь восточных культур преподаватель урфу,2018-09-24 14:05:00,32182751,[]
2590,как с открытки город невьянск,2018-09-24 13:31:00,32182751,[]
2591,ограбление века произошло в магазине ломбарде золотой на ул вайнера преступники похитили ювелирных изделий примерно на миллионов рублей передают сми,2018-09-24 12:34:00,32182751,[]
2592,любит памятник кирову гулять по району,2018-09-24 11:35:00,32182751,[]
2593,в центре екатеринбурга судебные приставы и полицейские устроили облаву на должников камеры сканируют номера автомобилей передают данные гаишникам те останавливают транспорт должников оказалось так много что образовалась пробка передает,2018-09-24 11:02:03,32182751,[]
2594,зима уже слишком близко,2018-09-24 10:08:00,32182751,[]
2595,издали первую книгу которую написал екатеринбуржец рукописи аникита ярцова ждали своего часа лет в работе он описал горное дело здесь и исторический труд и мемуары и исследование говорят что чтение очень увлекательно,2018-09-24 09:31:00,32182751,[]
2596,в екатеринбурге открылась посмертная выставка виталия воловича художник с мировым именем из екатеринбурга напомним покинул нас августа экспозиция готовилась изначально в честь его юбилея но теперь это выставка памяти,2018-09-24 08:31:00,32182751,[]
2597,солнечные осенние деньки так и манит погода гулять,2018-09-24 07:31:00,32182751,[]
2598,понаехали тут жители столицы чаще всего кричат екатеринбуржцам столица урала лидирует по количеству граждан перебравшихся в москву нас обогнал только санкт петербург,2018-09-24 07:02:06,32182751,[]
2599,доброе утро,2018-09-24 06:29:00,32182751,[]
2600,городской центр медицинской профилактики екатеринбурга режиссер анна веселова и кот савелий сняли безумную социальную рекламу ролик быстро набирает популярность,2018-09-23 21:01:00,32182751,[]
2601,ночной чат,2018-09-23 20:03:03,32182751,[]
2602,кошка зухра путешествует с ребятами из екатеринбурга автостопом по россии года назад катя с другом нашли котенка в пакете в канаве у трассы пишет кп и взяли зверя с собой зухра скоро увидит крым а потом байкал,2018-09-23 19:31:00,32182751,[]
2603,свердловчанин подделал диплом о высшем медицинском образовании и стал главным врачом больницы в курганской области сначала фельдшер работал в серовском районе деревенские жители даже хвалили владислава федина и внимательный и заботливый но тут медик стал занимать деньги у пенсионерок взял как минимум рублей и исчез,2018-09-23 19:02:01,32182751,[]
2604,красоты южного урала шихан юрактау капова пещера и водопад атыш,2018-09-23 18:03:01,32182751,[]
2605,до октября в екатеринбурге восстановят тротуары и разбитые дороги на шести улицах также подрядчик переложит газон и выкорчует пни на эти цели выделили более миллиона рублей,2018-09-23 17:31:00,32182751,[]
2606,а вы встречали в центре екатеринбурга игоря зимина это художник который рисует в стиле спрей арт его уличная работа всегда собирает вокруг себя толпы зрителей,2018-09-23 17:03:02,32182751,[]
2607,под екатеринбургом школьников в роли заложников учили патриотизму казаки общество инвалидов юнармия посвятили мероприятие куликовской битве переходу войск с суворовым через альпы летию героя россии анатолия романова а также памяти жертв теракта в беслане передает,2018-09-23 16:32:00,32182751,[]
2608,екатеринбург глазами гостя из тобольска,2018-09-23 15:32:00,32182751,[]
2609,а пока наш цирк на глобальной реконструкции давайте вспомним его историю,2018-09-23 15:02:02,32182751,[]
2610,представители екатеринбурга штурмуют шоу танцы в проект за последние две недели попали четверо ребят,2018-09-23 14:02:01,32182751,[]
2611,наш подписчик сфоткал свадебный банкет в трц радуга парк,2018-09-23 13:33:00,32182751,[]
2612,в поселке сосьва обнаружено обгоревшее тело летней девушки по информации паблика плохие новости полину н изнасиловал а затем убил ее знакомый,2018-09-23 12:31:00,32182751,[]
2613,скульптуры екатеринбурга музыкантам горожанам героям книг и даже сериалов на любой вкус,2018-09-23 12:02:02,32182751,[]
2614,фестиваль царский мостъ стартовал в районе улиц декабристов чапаева степана разина он посвящен историческому месту екатеринбурга сердцу города,2018-09-23 11:00:10,32182751,[]
2615,академический в сказочном тумане,2018-09-23 10:02:01,32182751,[]
2616,масштабную акцию провели фанаты спартака в городах появились надписи в рамках флешмоба вся россия вся москва ненавидит цска оставили рисунок ненависти и болельщики из екатеринбурга акт массового вандализма устроен накануне игр самых популярных московских команд,2018-09-23 09:33:00,32182751,[]
2617,утром екатеринбург погрузился в плотный туман ветер при этом есть предупреждения от метеорологов о плохом рассеивании вредных примесей не было так что скорее всего это и правда безобидный осенний туман а не опасный смог,2018-09-23 08:32:02,32182751,[]
2618,возле трц карнавал накануне днем под трамвай попал летний мальчик он остался жив но достать его из под транспорта удалось не сразу в больницу ребенок увезен с черепно мозговой травмой рваной раной лица и переломом лобной кости,2018-09-23 07:31:00,32182751,[]
2619,доброе утро екатеринбург,2018-09-23 06:31:00,32182751,[]
2620,ночной чат,2018-09-22 20:34:00,32182751,[]
2621,екатеринбургский зоопарк отметил летие зверей угостили праздничными блюдами и подарили игрушки,2018-09-22 19:32:00,32182751,[]
2622,невероятные пейзажи вблизи карабаша но к сожалению эта красота ужасна и неслучайна местность терпит экологическую катастрофу после деятельности предприятий,2018-09-22 19:02:01,32182751,[]
2623,бас гитарист стефан олсдал прокомментировал клипы уральских музыкантов он посмотрел их по просьбе легендарный рокер в целом позитивно воспринял творчество екатеринбуржцев,2018-09-22 18:32:00,32182751,[]
2624,прогуляемся по проспекту ленина х,2018-09-22 18:01:00,32182751,[]
2625,вчера вечером пьяный отец заперся с ребенком в квартире и не пускал мать в дом на ул вильгельма де геннина на место выехала полиция мужчина угрожал облить их кипятком если они попытаются войти передает служба сова,2018-09-22 17:03:02,32182751,[]
2626,екатеринбургские спортсмены продолжают радовать хк автомобилист выиграл йокерит а фк урал победил енисей причем для хоккеистов эта уже девятая победа подряд,2018-09-22 16:32:00,32182751,[]
2627,чтобы расширить ул татищева в екатеринбурге снесут жилые дома частный сектор и пятиэтажку передает по плану улица должна стать магистралью связывающую виз и центр города но пока поток автомобилей упирается в узкую дорогу в районе ул красноуральской,2018-09-22 15:31:00,32182751,[]
2628,в екатеринбурге тихо мирно прошли сразу два митинга против пенсионной реформы напомним в одно время но в разных местах людей собирали партия кпрф и федерация профсоюзов,2018-09-22 15:02:02,32182751,[]
2629,в уральской колонии остановили деятельность молочного завода который прославился тем что в его продукции грели руки заключенные передает молоко отправляли на переработку в ирбит сейчас осужденные не понимают почему их лишили работы при этом правозащитники утверждают что у заключенных ужасные условия труда руки гниют от переработок и отсутствия медпомощи все это они якобы наблюдали лично во время инспекции,2018-09-22 14:02:02,32182751,[]
2630,солист свердловской музкомедии александр уманчук обвиняет филиппа киркорова в нелепом следовании трендам молодежи,2018-09-22 13:01:00,32182751,[]
2631,два гимназиста попали с отравлением в больницу а еще несколько в полицию так обернулась для учащихся гимназии считающейся элитной проба некой курительной смеси передает со ссылкой на родителей школьников,2018-09-22 12:04:00,32182751,[]
2632,отличный монтаж двери в алапаевске,2018-09-22 11:02:02,32182751,[]
2633,житель екатеринбурга взыскал с властей рублей за разбитый автомобилист попал в люк еще в прошлом году на объездной дороге в чкаловском транспорт серьезно пострадал,2018-09-22 10:05:01,32182751,[]
2634,мир без границ,2018-09-22 09:05:00,32182751,[]
2635,в сентябре стартовал театральный сезон мы решили проверить готовы ли вы лицезреть местные постановки предлагаем игру на этих пяти снимках оперный театр театр юного зрителя коляда театр театр музкомедии и театр драмы,2018-09-22 08:31:00,32182751,[]
2636,сегодня в екатеринбурге состоятся сразу два митинга против пенсионной реформы старт обоих мероприятий в,2018-09-22 08:01:00,32182751,[]
2637,бывший летний полицейский николай расстрелял жену тещу и убил себя в пригороде асбеста что послужило причиной такой трагедии неизвестно,2018-09-22 07:32:00,32182751,[]
2638,доброе утро,2018-09-22 06:31:00,32182751,[]
2639,на этой любительской съемке года свердловские студенты как они веселы легки и забавны и будто совсем не отличаются от нынешней молодежи,2018-09-21 21:01:00,32182751,[]
2640,ночной чат,2018-09-21 20:02:01,32182751,[]
2641,сегодня суд отказался помещать летнюю девочку участвовавшую в расправе над парнем в березовском в центр временной изоляции школьница проходит свидетелем по делу именно она снимала на видео расправу над дмитрием рудаковым,2018-09-21 19:32:00,32182751,[]
2642,тимофей радя из екатеринбурга установил новую сильную надпись в лесах нижегородской области,2018-09-21 19:05:01,32182751,[]
2643,у вас проблемная кожа надоели черные точки тогда бегом ко мне я косметолог с медицинским образованием буду рада вам помочь,2018-09-21 18:05:01,32182751,[]
2644,наши подписчики ловят мгновения осени в объективы фотоаппаратов волшебные аллеи и парки пугающие голые деревья прекрасно красная рябина а в дендропарке пробились будто подснежники осенние крокусы,2018-09-21 17:32:00,32182751,[]
2645,сегодня продлен карантин из за менингита в гимназии ученики старшей школы вернутся за парты только октября напомним всех детей отправили на дистанционное обучение сентября в других школах тоже обнаружились заболевшие ученики родители пребывали в панике но горздрав заверил эпидемии нет все под контролем,2018-09-21 17:02:02,32182751,[]
2646,кто вызвал команду скуби ду в городе монстры,2018-09-21 16:04:34,32182751,[]
2647,легендарный гроссмейстер анатолий карпов возглавит кафедру шахматного искусства в ургэу структура появится в вузе по инициативе самого карпова для новой кафедры наберут преподавателей и разработают образовательные программы шахматное искусство необходимо будущим экономистам чтобы уметь прогнозировать процессы,2018-09-21 15:32:00,32182751,[]
2648,красная матрешка в шарфе станет послом екатеринбурга фигурка поедет в дубай а затем в париж чтобы продвигать заявку города на право принять экспо,2018-09-21 15:05:01,32182751,[]
2649,мы знаем ваши планы на выходные,2018-09-21 14:05:00,32182751,[]
2650,летний мальчик разбился делая селфи пишет вечерний екатеринбург со ссылкой на очевидцев школьник выпал с общего балкона дома на ул рассветной вчера как рассказали журналистам соседи он пришел в этот дом в гости к приятелю,2018-09-21 13:04:00,32182751,[]
2651,свердловск в х годах,2018-09-21 12:31:00,32182751,[]
2652,яндекс презентовал жителям екатеринбурга два новых сервиса первый похож на социальную сеть для соседей яндекс район предназначен для обсуждения новостей своего округа новых магазинов мусора на улицах мероприятиях посмотреть на сервис можно тут,2018-09-21 11:31:00,32182751,[]
2653,зеркало реки чусовой,2018-09-21 10:31:00,32182751,[]
2654,в эту субботу сентября вновь состоится субботник против рака акция которая помогает вовремя выявить онкологические заболевания в августе рак нашли у участников осмотра,2018-09-21 10:05:01,32182751,[]
2655,моноресторан креветки и бургеры открылся в начале года и успел покорить сердца многих жителей нашего города меню ресторана построено вокруг двух продуктов креветок и бургеров потому что шеф считает что ровно столько нужно для счастья каждому с полудня до полуночи креветки для тех кто думает о фигуре и бургеры для тех кто думает о фигуре но бургеры любит сильнее,2018-09-21 09:05:00,32182751,[]
2656,паук уже не тот,2018-09-21 08:28:00,32182751,[]
2657,родителям екатеринбургских школьников напомнили о комендантском часе и запрете участия подростков в экстремистских митингах и флешмобах памятки раздали в учебных заведениях,2018-09-21 07:31:00,32182751,[]
2658,доброе утро екатеринбург,2018-09-21 06:31:00,32182751,[]
2659,свердловские школьники сняли огненно танцевальную постановку как вам,2018-09-20 21:01:00,32182751,[]
2660,ночной чат,2018-09-20 20:01:00,32182751,[]
2661,дом обороны вначале здесь стоял биплан затем установили як,2018-09-20 19:22:00,32182751,[]
2662,екатеринбуржец прописал в своей квартире девять тысяч хороших друзей иностранцев за это суд оштрафовал мужчину на рублей,2018-09-20 19:02:00,32182751,[]
2663,в екатеринбурге наступила яркая осень деревья готовы к фотосессиям листья разлетаются на школьные гербарии и как говорится горят костры рябин,2018-09-20 18:30:03,32182751,[]
2664,дозвониться до полиции в эту субботу будет очень непросто сообщили в умвд сентября планируются технические работы на станции поэтому номер в екатеринбурге будет работать с перебоями,2018-09-20 17:32:03,32182751,[]
2665,сентября года произошла трагедия в кармадонском ущелье погибло более человек,2018-09-20 17:05:00,32182751,[]
2666,кто хочет получить к в свой день рождения не пропустите конкурс от убрир,2018-09-20 16:05:00,32182751,[]
