3827,архимандрита тихона проводили в последний путь,2018-09-14 12:46:17,1205247,[]
3828,на площади победы в пскове сегодня вечером будет перекрыто движение транспорта,2018-09-14 12:40:02,1205247,[]
3829,объявлен победитель конкурса мой выбор на плн,2018-09-14 12:26:36,1205247,[]
3830,на выходных в акваполисе будут записывать псковский бит,2018-09-14 12:09:26,1205247,[]
3831,до сентября можно приобрести билеты на спектакли псковского драмтеатра с процентной скидкой,2018-09-14 12:01:27,1205247,[]
3832,завтра стартует чемпионат псковской области по хоккею,2018-09-14 11:59:23,1205247,[]
3833,в продажу поступили дополнительные билеты на заключительный концерт фестиваля воздух джаз в пскове,2018-09-14 11:25:37,1205247,[]
3834,красивый дом и сад скидки сентября от стройбазы на алмазной,2018-09-14 11:10:00,1205247,[]
3835,человек приняли участие в митинге против пенсионной реформы в великих луках,2018-09-14 11:04:42,1205247,[]
3836,мечтаете о своей квартире но не готовы переплачивать банку вам сюда,2018-09-14 10:59:44,1205247,[]
3837,интерактив что происходит с маршрутом автобусов,2018-09-14 10:47:26,1205247,[]
3838,ежедневные рейсы псков москва азимут планирует запустить с марта,2018-09-14 10:27:41,1205247,[]
3839,тарифная политика азимута позволит купить билет на самолет псков москва каждому жителю области,2018-09-14 10:13:07,1205247,[]
3840,наше радио псков разыгрывает билеты на предпоказ фильма игрушки для взрослых,2018-09-14 10:10:00,1205247,[]
3841,девушка за рулем бмв сбила мотоциклиста в великих луках,2018-09-14 09:53:24,1205247,[]
3842,псковские зоозащитники собирают деньги на операцию рыжему коту попавшему в дтп,2018-09-14 09:18:59,1205247,[]
3843,в великолукской крепости пройдет первый чемпионат псковской области по рубке шашкой,2018-09-14 08:45:02,1205247,[]
3844,,2018-09-14 08:16:49,1205247,
3845,интерактив кого вы пытаетесь обмануть,2018-09-13 21:11:32,1205247,[]
3846,,2018-09-13 20:20:00,1205247,
3847,фестиваль воздух джаз открылся в пскове видео,2018-09-13 19:33:09,1205247,[]
3848,свояквартира безбанка безволокит,2018-09-13 19:10:00,1205247,"['свояквартира', 'безбанка', 'безволокит']"
3849,,2018-09-13 18:27:12,1205247,
3850,весь сентябрь только в официальной точке продаж центр при покупке х литровой канистры вы получаете литр идентичного масла в подарок,2018-09-13 18:00:00,1205247,[]
3851,в пскове сентября проходит профсоюзный митинг против повышения пенсионного возраста,2018-09-13 17:57:00,1205247,[]
3852,водитель ваза наехал на мальчика на улице труда в пскове,2018-09-13 16:59:49,1205247,[]
3853,псковичей просят помочь в поиске двух женщин обокравших пенсионерку видео,2018-09-13 16:57:05,1205247,[]
3854,стало известно когда в пскове откроется вторая лента,2018-09-13 16:41:08,1205247,[]
3855,,2018-09-13 16:10:37,1205247,
3856,открылась новая фирма по прокату автомобилей без водителя прокат псков,2018-09-13 15:26:21,1205247,[]
3857,михаилу ведерникову представили нового управляющего почты россии по псковской области,2018-09-13 15:07:15,1205247,[]
3858,наше радио псков разыгрывает билеты на предпоказ фильма игрушки для взрослых,2018-09-13 14:35:28,1205247,[]
3859,юлия белобородова покинула пост первого заместителя председателя комитета по культуре,2018-09-13 14:09:14,1205247,[]
3860,скидки на молоко прасковья молочкова в бутылках стартовали в магнитах пскова и великих лук,2018-09-13 14:05:00,1205247,[]
3861,михаил ведерников подписал распоряжение о приватизации псковавиа,2018-09-13 13:52:24,1205247,[]
3862,красный крест приглашает псковичей к участию в осенней неделе добра,2018-09-13 13:49:16,1205247,[]
3863,я симфония моцарта прозвучит сегодня на фестивале воздух джаз в исполнении музыкантов нового оркестра псковской филармонии,2018-09-13 13:38:21,1205247,[]
3864,михаил ведерников встретился с будущим депутатом областного собрания ириной толмачевой,2018-09-13 12:55:00,1205247,[]
3865,михаил ведерников предложил предоставлять врачам работающим на селе квартиры в пскове,2018-09-13 11:56:43,1205247,[]
3866,псковским музейщикам показали деревянную стену века обнаруженную в ходе раскопок у границ окольного города,2018-09-13 11:56:38,1205247,[]
3867,чеснок и баня от гриппа не помогут александр нестерук,2018-09-13 11:29:19,1205247,[]
3868,времени на раскачку нет михаил ведерников напутствовал избранных глав районов,2018-09-13 11:27:56,1205247,[]
3869,фестиваль воздух джаз стартует сегодня в пскове,2018-09-13 10:25:05,1205247,[]
3870,водитель мазды снес ограждение на ул юбилейной при перестроении,2018-09-13 10:11:06,1205247,[]
3871,видеоинтерактив ехал на работу никого не трогал,2018-09-13 10:07:49,1205247,[]
3872,глубокие тексты осмысленные аранжировки и известные музыканты представляем хедлайнеров первого концерта фестиваля добрый рок,2018-09-13 10:04:50,1205247,[]
3873,великолукский студент завоевал золото в чемпионате мира по вольной борьбе в бразилии,2018-09-13 09:32:39,1205247,[]
3874,,2018-09-13 09:12:22,1205247,
3875,водитель иномарки врезался в ограждение на улице юбилейной в пскове,2018-09-13 09:03:14,1205247,[]
3876,водитель бмв при выезде с парковки в великих луках сбил пенсионерку,2018-09-13 08:34:56,1205247,[]
3877,,2018-09-12 23:04:57,1205247,
3878,компания представила новый,2018-09-12 22:42:28,1205247,[]
3879,реплика донецкого бесполезные слушания,2018-09-12 22:31:34,1205247,[]
3880,александр питиримов покинул пост руководителя гппо псковпассажиравтотранс,2018-09-12 21:54:42,1205247,[]
3881,устав пскова планируют изменить,2018-09-12 20:46:39,1205247,[]
3882,псковичка рассказала о квесте по медучреждениям пскова с травмированным ребенком,2018-09-12 18:29:57,1205247,[]
3883,группа гастролеров из западной африки задержана в печорском районе при попытке незаконного пересечения границы,2018-09-12 17:51:09,1205247,[]
3884,,2018-09-12 17:09:15,1205247,
3885,сергей ащеулов назначен на должность начальника омвд россии по порховскому району,2018-09-12 16:44:18,1205247,[]
3886,в россии предлагается узаконить дуэли,2018-09-12 15:57:20,1205247,[]
3887,мечтаете о своей квартире но не готовы переплачивать банку вам сюда,2018-09-12 15:42:27,1205247,[]
3888,отпевание архимандрита тихона пройдет сентября,2018-09-12 15:12:02,1205247,[]
3889,маршрут ласточки просят продлить до острова и пыталово,2018-09-12 15:08:49,1205247,[]
3890,александр братчиков против жилой застройки на участке рядом с ддт пскова,2018-09-12 14:48:10,1205247,[]
3891,лето позади скоро и бархатный сезон закончится а многие так и не успели отправиться в отпуск впрочем и на межсезонье можно найти отдых на любой вкус чтобы облегчить псковичам выбор туристической путевки цди представляет обзор лучших предложений от псковских турфирм,2018-09-12 14:25:27,1205247,[]
3892,рецепт успеха почему в магазин псковагроинвеста в соловьях ездят даже из петербурга,2018-09-12 14:10:00,1205247,[]
3893,схема движения общественного транспорта изменится в пскове сентября,2018-09-12 13:51:18,1205247,[]
3894,с сентября будет закрыто движение транспорта на участке улицы конной в пскове,2018-09-12 13:50:43,1205247,[]
3895,заместитель начальника угх пскова дмитрий таратынов покинул свой пост,2018-09-12 13:49:26,1205247,[]
3896,в доме офицеров прошли публичные слушания по строительству новой школы в пскове,2018-09-12 12:36:17,1205247,[]
3897,открыт набор в студию гвозди на год,2018-09-12 12:19:18,1205247,[]
3898,котельных в псковской области остаются без электричества за накопленные долги,2018-09-12 12:15:00,1205247,[]
3899,сначала музыка,2018-09-12 11:55:50,1205247,[]
3900,родственники пропавшей в псковском районе женщины просят помощи у военных,2018-09-12 11:18:41,1205247,[]
3901,убитые дороги попросили у администрации пскова принять меры по ликвидации застоя воды у кромки асфальта на рижском проспекте,2018-09-12 10:31:38,1205247,[]
3902,ушел из жизни бывший наместник псково печерского монастыря архимандрит тихон секретарев,2018-09-12 09:58:20,1205247,[]
3903,финал конкурса мой выбор голосование будет закрыто сентября в победитель получит планшет,2018-09-12 09:23:53,1205247,[]
3904,,2018-09-12 09:00:03,1205247,
3905,мотоциклист погиб в дтп в островском селе воронцово,2018-09-12 08:47:46,1205247,[]
3906,задачник для губернатора,2018-09-12 07:57:22,1205247,[]
3907,возле дома детского творчества в пскове появятся новые жилые дома,2018-09-11 20:34:26,1205247,[]
3908,как купить квартиру не имея миллиона и не обращаясь в банк ответ здесь,2018-09-11 20:00:08,1205247,[]
3909,в псковской областной филармонии открылся й филармонический сезон,2018-09-11 19:38:07,1205247,[]
3910,в псковской филармонии перед открытием сезона заработал буфет,2018-09-11 18:58:24,1205247,[]
3911,храм богоявления с запсковья отметил престольный праздник,2018-09-11 18:30:59,1205247,[]
3912,певица слава выступит в псковской филармонии сентября,2018-09-11 18:08:43,1205247,[]
3913,военным запретят размещать информацию о себе и сослуживцах в соцсетях и сми,2018-09-11 18:08:16,1205247,[]
3914,для коммерческого транспорта по выгодной цене в центре,2018-09-11 18:00:00,1205247,[]
3915,почти к годам лишения свободы приговорили осужденного в середке который пытался заказать у сотрудника колонии героин,2018-09-11 16:52:48,1205247,[]
3916,детский клуб играй и развивайся,2018-09-11 16:46:22,1205247,[]
3917,ливни и грозы прогнозируют вечером в псковской области,2018-09-11 16:26:22,1205247,[]
3918,псков должен быть подготовлен к пуску тепла к октября,2018-09-11 15:35:39,1205247,[]
3919,красавицы и чудовища,2018-09-11 15:35:15,1205247,[]
3920,приобрести билеты на три спектакля с процентной скидкой предлагает псковский драмтеатр в честь открытия сезона,2018-09-11 14:32:06,1205247,[]
3921,первый псковский в прямом эфире покажет матч луки энергия енисей,2018-09-11 14:21:55,1205247,[]
3922,градостроительный ребус,2018-09-11 13:58:10,1205247,[]
3923,наталья горбачева на сегодня учителя так ничего и не услышали о сохранении права выхода на досрочную пенсию,2018-09-11 13:05:47,1205247,[]
3924,пскович пытался вывезти за границу свыше пачек сигарет,2018-09-11 12:58:32,1205247,[]
3925,для концерта открытия в псковской филармонии организовали оркестровую яму,2018-09-11 12:35:39,1205247,[]
3926,балерина не должна быть дурой в короткой юбке гедиминас таранда,2018-09-11 12:28:34,1205247,[]
3927,власти псковской области подготовили план мероприятий по сохранению и возрождению усадьбы в волышово,2018-09-11 12:23:39,1205247,[]
3928,псковичей приглашают на концерт памяти экс директора колледжа искусств егора студинова,2018-09-11 12:16:28,1205247,[]
3929,еще один дом в жк европа сдан раньше срока,2018-09-11 12:13:19,1205247,[]
3930,псковские педагоги могут стать участниками областных соревнований по туризму на озере велье,2018-09-11 12:12:44,1205247,[]
3931,сидишь без работы она у нас есть,2018-09-11 12:05:04,1205247,[]
3932,пользователи почтового сервиса яндекса столкнулись с проблемами,2018-09-11 11:46:29,1205247,[]
3933,лучшие члены команды займут места в руководстве псковского региона уверен депутат госдумы александр васильев,2018-09-11 11:40:46,1205247,[]
3934,в псковской области пока не зафиксировано случаев мисселинга,2018-09-11 11:35:14,1205247,[]
3935,в гибдд пскова отреагировали на фотофакт опубликованный на плн,2018-09-11 11:35:10,1205247,[]
3936,,2018-09-11 11:00:19,1205247,
3937,ипотека цифры и тренды лонгрид,2018-09-11 10:56:13,1205247,[]
3938,для самых экономных и хозяйственных выбери свою скидку от стройбазы на алмазной,2018-09-11 10:35:00,1205247,[]
3939,для самых экономных и хозяйственных выбери свою скидку от стройбазы на алмазной,2018-09-11 10:35:00,1205247,[]
3940,,2018-09-11 09:49:11,1205247,
3941,генерального директора крупного псковского предприятия обвиняют в сокрытии денег от налоговой,2018-09-11 09:25:22,1205247,[]
3942,два человека пострадали в столкновении двух автомашин и автобуса в пскове,2018-09-11 09:16:25,1205247,[]
3943,,2018-09-11 08:50:21,1205247,
3944,после нового закона псковская область недосчитается денег от многих евротуристов мнение латвийского бизнесмена,2018-09-10 22:24:18,1205247,[]
3945,россия выдвинула на оскар фильм константина хабенского собибор,2018-09-10 21:27:04,1205247,[]
3946,заслуженный тренер россии не может вылезти из долгов в псковской области,2018-09-10 20:40:46,1205247,[]
3947,первенство мро северо запад стартовало в пскове,2018-09-10 19:43:03,1205247,[]
3948,мечтаете о своей квартире но не готовы переплачивать вам сюда,2018-09-10 19:35:00,1205247,[]
3949,фотофакт машиностроитель остался без трибун,2018-09-10 19:07:03,1205247,[]
3950,группа азиатов задержана в пыталовском районе при попытке незаконного пересечения границы,2018-09-10 17:48:14,1205247,[]
3951,нетрезвый пассажир угнал машину у женщины таксиста в острове,2018-09-10 17:25:17,1205247,[]
3952,псковские реконструкторы снова едут на фестиваль поле куликово,2018-09-10 16:56:46,1205247,[]
3953,,2018-09-10 16:55:27,1205247,
3954,михаил ведерников поблагодарил жителей псковской области за доверие и поддержку,2018-09-10 16:19:44,1205247,[]
3955,концерт третьего дня фестиваля воздух джаз сентября отменяется,2018-09-10 16:07:57,1205247,[]
3956,выбираем жемчужину псковской области плн объявляет новый фотоконкурс,2018-09-10 16:02:00,1205247,[]
3957,ночь выборов битва где нет проигравших,2018-09-10 15:49:07,1205247,[]
3958,ольгинская гимназия дополнительное образование детям,2018-09-10 15:22:10,1205247,[]
3959,псковичи познакомились с новой,2018-09-10 15:03:07,1205247,[]
3960,слушания по вопросу перезонирования территории под строительство новой школы на ул юбилейной пройдут сентября,2018-09-10 14:55:48,1205247,[]
3961,,2018-09-10 14:54:30,1205247,
3962,объявляется набор детей с лет в группы спортивного каратэ,2018-09-10 13:45:00,1205247,[]
3963,губернатор главные итоги,2018-09-10 12:48:45,1205247,[]
3964,желающих пройти обучение по программе специалист по физической культуре и спорту тренер преподаватель ждут в псковгу,2018-09-10 12:44:41,1205247,[]
3965,псков и великие луки показали самую низкую явку на губернаторских выборах,2018-09-10 12:44:24,1205247,[]
3966,на трассе соревнований в кудяево перевернулся квадроцикл,2018-09-10 11:27:41,1205247,[]
3967,благоустройство и ремонт дорог в пскове инфографика,2018-09-10 11:17:50,1205247,[]
3968,,2018-09-10 10:57:57,1205247,
3969,в псковгу пройдет международной конференции современные проблемы обучения математике в школе и вузе,2018-09-10 10:26:59,1205247,[]
3970,в пскове неизвестный наехал на женщину и скрылся,2018-09-10 09:18:56,1205247,[]
3971,в псковском районе летняя женщина ушла в лес и не вернулась,2018-09-10 09:13:04,1205247,[]
3972,пассажир иномарки скончался в больнице после дтп в стругокрасненском районе,2018-09-10 09:08:46,1205247,[]
3973,труп мужчины обнаружен на пожаре в печорах,2018-09-10 09:04:18,1205247,[]
3974,перед судом предстанут трое псковичей за организацию занятия проституцией и содержание притонов,2018-09-10 09:03:31,1205247,[]
3975,,2018-09-10 08:52:44,1205247,
3976,дтп на перекрестке алтаева инженерная затрудняет движение,2018-09-10 08:32:24,1205247,[]
3977,по результатам обработки бюллетеней михаил ведерников победил на выборах губернатора псковской области,2018-09-10 07:37:36,1205247,[]
3978,ирина толмачева станет депутатом псковского областного собрания,2018-09-10 07:36:22,1205247,[]
3979,кандидаты единороссы победили на выборах глав муниципалитетов в восьми районах псковской области,2018-09-10 07:35:50,1205247,[]
3980,михаил ведерников побеждает на выборах губернатора псковской области с данные протоколов избиркомов,2018-09-10 01:50:59,1205247,[]
3981,у псковичей сделавших фото на избирательных участках еще есть возможность выиграть модный гаджет,2018-09-10 00:10:32,1205247,[]
3982,жителей великолукского района проголосовали за переизбрание сергея петрова на пост главы,2018-09-10 00:09:22,1205247,[]
3983,нина степанова лидирует на выборах главы локнянского района,2018-09-10 00:02:04,1205247,[]
3984,по итогам обработки протоколов с уик михаил ведерников набирает голосов,2018-09-10 00:01:49,1205247,[]
3985,более опочан проголосовали за переизбрание юрия ильина главой опочецкого района,2018-09-09 22:53:04,1205247,[]
3986,вера кондратьева лидирует на выборах главы пыталовского района с голосов,2018-09-09 22:53:00,1205247,[]
3987,на выборах главы стругокрасненского района побеждает единоросс александр волков,2018-09-09 22:45:41,1205247,[]
3988,михаил ведерников выборы прошли честно открыто и легитимно,2018-09-09 22:17:07,1205247,[]
3989,михаил ведерников лидирует на выборах губернатора псковской области,2018-09-09 21:12:02,1205247,[]
3990,виноваты грибы александр машкарин о явке на выборах,2018-09-09 20:59:42,1205247,[]
3991,молодые общественные независимые наблюдатели теперь знают как дашка увела егорку,2018-09-09 20:45:27,1205247,[]
3992,избирательные участки закрылись в псковской области,2018-09-09 20:06:45,1205247,[]
