2541,против главы минздрава камчатки татьяны лемешко могут возбудить второе уголовное дело,2018-10-04 05:25:12,49796420,[]
2542,в петропавловске оштрафовали водителя который мыл машину во дворе дома,2018-10-04 05:00:56,49796420,[]
2543,фото,2018-10-04 04:30:17,49796420,['фото']
2544,молодая женщина на тойоте не вписалась в поворот и попала в реанимацию обзор дтп,2018-10-04 03:45:21,49796420,[]
2545,жителя камчатки будут судить за создание порнографической группы в,2018-10-04 03:20:23,49796420,[]
2546,на ярмарке вакансий в петропавловске пенсионерам предложат более рабочих мест,2018-10-04 02:55:15,49796420,[]
2547,прокуратура петропавловска помогла горожанке получить зарплату умершего отца,2018-10-04 02:05:08,49796420,[]
2548,в петропавловске спасатели деблокировали из тойоты попавшую в дтп женщину водителя,2018-10-04 01:40:21,49796420,[]
2549,в петропавловске продавец икры выиграла суд у роспотребнадзора,2018-10-04 01:15:22,49796420,[]
2550,на камчатке спасатели на учениях ликвидировали утечку аммиака фото,2018-10-04 00:50:07,49796420,[]
2551,от подписчика,2018-10-03 23:58:14,49796420,['от']
2552,педагог камчатского колледжа искусств стала призером всероссийского конкурса,2018-10-03 12:55:10,49796420,[]
2553,на камчатке тонны красной икры выбросили на помойку фото,2018-10-03 12:31:16,49796420,[]
2554,мошенник из петропавловска обманул жительницу сургута на тысячи рублей,2018-10-03 12:05:13,49796420,[]
2555,на камчатке снизилась смертность от туберкулеза,2018-10-03 10:15:49,49796420,[]
2556,ученые из новосибирска проверят как на камчатке лечат туберкулез,2018-10-03 10:02:26,49796420,[]
2557,в петропавловске снесли незаконно построенный ларек овощи фрукты,2018-10-03 10:01:56,49796420,[]
2558,петропавловск украсили восемь новых граффити,2018-10-03 09:46:13,49796420,[]
2559,остров надежды камчатские школьники помогли приюту для собак,2018-10-03 09:30:55,49796420,[]
2560,в петропавловске эксгибиционист поджидал девочек в роще возле школы,2018-10-03 09:15:47,49796420,[]
2561,министру здравоохранения камчатки предъявлено обвинение в растрате,2018-10-03 09:02:09,49796420,[]
2562,за неделю камчатцы перечислили мошенникам почти полмиллиона рублей,2018-10-03 08:45:39,49796420,[]
2563,на камчатке посадили любителя пьяной езды который сделал инвалидом летнюю девушку,2018-10-03 08:20:36,49796420,[]
2564,женщина лет жила с салфеткой в теле которую медики забыли при операции,2018-10-03 07:55:14,49796420,[]
2565,готова создать на камчатке уникальные транспортные системы,2018-10-03 05:50:17,49796420,[]
2566,лучшего уличного художника петропавловска поощрят премией фото,2018-10-03 05:25:08,49796420,[]
2567,мэрия в петропавловске неизвестные превращают в опасные ловушки уличные колодцы фото,2018-10-03 05:01:14,49796420,[]
2568,фото,2018-10-03 04:30:09,49796420,['фото']
2569,на камчатке будут судить сотрудницу банка которая украла у клиентов миллиона рублей,2018-10-03 04:10:07,49796420,[]
2570,на камчатке гражданин украины демонстрировал свои половые органы школьницам,2018-10-03 03:45:35,49796420,[]
2571,рано утром в аварии на камчатке не справившись с управлением субару погиб мужчина,2018-10-03 03:20:13,49796420,[]
2572,от подписчика,2018-10-03 03:04:00,49796420,['от']
2573,на камчатке министру здравоохранения предъявили обвинение в растрате,2018-10-03 02:55:07,49796420,[]
2574,директор аптеки на камчатке попала под статью за попытку сэкономить тысяч рублей,2018-10-03 02:30:31,49796420,[]
2575,троих жителей камчатки будут судить за продажу опасного алкоголя,2018-10-03 02:05:08,49796420,[]
2576,камчатским семьям напомнили о праве на пособие за рождение первенца,2018-10-03 01:40:12,49796420,[]
2577,на совещании в грозном виталий иваненко поделится опытом и знаниями,2018-10-03 01:15:23,49796420,[]
2578,камчатский алкоголик пообещал убить приговорившего его судью,2018-10-03 00:50:16,49796420,[]
2579,жительнице камчатки убившей мужа из ревности не удалось смягчить приговор,2018-10-02 13:20:40,49796420,[]
2580,в петропавловске суд признал что популярные павильоны в центре стоят незаконно,2018-10-02 12:55:18,49796420,[]
2581,ремонт дорог в петропавловске продлится до середины ноября,2018-10-02 12:31:22,49796420,[]
2582,на камчатке работников ркз указом президента россии представили к наградам,2018-10-02 12:05:11,49796420,[]
2583,жители камчатки стали чаще жаловаться на работу коллекторов и кредиторов,2018-10-02 10:25:10,49796420,[]
2584,камчатцы не смогли вылететь из москвы из за пожара в аэропорту шереметьево,2018-10-02 10:16:05,49796420,[]
2585,суд обязал снести кафе бриз в центре петропавловска,2018-10-02 10:02:18,49796420,[]
2586,в центре петропавловска полицейские помогли утиной семье,2018-10-02 10:00:14,49796420,[]
2587,трое жителей камчатки пойдут под суд за торговлю ядовитым алкоголем,2018-10-02 09:46:17,49796420,[]
2588,в петропавловске жилых домов не могут подключить к системе отопления из за аварий,2018-10-02 09:35:12,49796420,[]
2589,отопительный сезон начался во всех районах камчатки,2018-10-02 09:30:23,49796420,[]
2590,на камчатке летняя девочка повредила позвоночник в спортшколе эдельвейс,2018-10-02 09:15:59,49796420,[]
2591,на камчатке госпитализировали в реанимацию пожилую туристку из сша,2018-10-02 09:10:08,49796420,[]
2592,камчатский сельчанин изнасиловал бывшую возлюбленную в автомобиле,2018-10-02 09:00:12,49796420,[]
2593,из за пожара в аэропорту шереметьево камчатские пассажиры не смогли вылететь из москвы,2018-10-02 08:45:19,49796420,[]
2594,камчатские депутаты включились в борьбу с авиадебоширами,2018-10-02 08:20:41,49796420,[]
2595,фас вынесла предупреждение главному на камчатке продавцу топлива,2018-10-02 05:25:16,49796420,[]
2596,в петропавловске заасфальтировали проезд к новому детсаду на северо востоке,2018-10-02 05:00:31,49796420,[]
2597,фото,2018-10-02 04:30:57,49796420,['фото']
2598,эксперты признали камчатку одним из самых нездоровых регионов россии,2018-10-02 03:45:34,49796420,[]
2599,на канатной дороге в спортшколе эдельвейс получила травму летняя горнолыжница,2018-10-02 03:20:14,49796420,[]
2600,житель камчатки избил и изнасиловал бывшую любовницу в салоне внедорожника,2018-10-02 02:55:12,49796420,[]
2601,ранним утром в елизове огонь объял субару форестер,2018-10-02 02:30:26,49796420,[]
2602,нерадивого отца из петропавловска не пустили за границу и отправили поработать,2018-10-02 02:05:06,49796420,[]
2603,моряки спрятали в схронах на борту судна тонны нелегальной икры,2018-10-02 01:40:10,49796420,[]
2604,в петропавловске автоинспекторы проверили техническое состояние пассажирских автобусов,2018-10-02 01:15:20,49796420,[]
2605,около камчатцев приняли участие во всероссийском дне ходьбы фото,2018-10-02 00:50:13,49796420,[]
2606,краевые власти начало отопительного сезона на камчатке проходит без серьезных сбоев,2018-10-01 16:16:31,49796420,[]
2607,на мишенной сопке сделали обзорную площадку в виде короны фото,2018-10-01 15:50:52,49796420,[]
2608,на камчатке военный спас ребенка провалившегося в колодец с водой,2018-10-01 15:25:07,49796420,[]
2609,на камчатке чиновнику единороссу грозит уголовное дело за подстрекательство,2018-10-01 15:01:44,49796420,[]
2610,к берегам камчатки приближается тайфун трами,2018-10-01 14:35:29,49796420,[]
2611,в петропавловске мотоциклист на огромной скорости врезался в тойоту,2018-10-01 14:10:37,49796420,[]
2612,жительница елизова обокрала приезжего с алтая пока он покупал ей шоколадку,2018-10-01 13:45:45,49796420,[]
2613,на камчатке определили лучших кондитеров,2018-10-01 13:20:35,49796420,[]
2614,статистики жители камчатки в последние годы стали меньше есть,2018-10-01 12:55:06,49796420,[]
2615,власти камчатки готовятся к зимней эпидемии гриппа,2018-10-01 12:30:15,49796420,[]
2616,на камчатке человек получают образование в исправительных колониях,2018-10-01 12:05:08,49796420,[]
2617,на камчатке инспекторы спасли обворованного и замерзающего рыбака,2018-10-01 11:40:23,49796420,[]
2618,на камчатке летний водитель карины врезался в грузовик внедорожник и пешехода,2018-10-01 11:15:24,49796420,[]
2619,в петропавловске неизвестный водитель сбил пенсионера и скрылся обзор дтп,2018-10-01 10:50:28,49796420,[]
2620,камчатский кондитер будет бороться за победу на всероссийском конкурсе,2018-10-01 10:45:10,49796420,[]
2621,камчатские самбисты будут бороться за призы восьмикратной чемпионки мира,2018-10-01 10:30:17,49796420,[]
2622,капитана судна за браконьерство оштрафовали на тысяч рублей,2018-10-01 10:25:12,49796420,[]
2623,жителю камчатки назначили часов работ за долг по алиментам в тысяч,2018-10-01 10:15:06,49796420,[]
2624,учения по гражданской обороне будут идти на камчатке дня,2018-10-01 10:00:48,49796420,[]
2625,капитан сахалинского судна заплатит тысяч за браконьерство на камчатке,2018-10-01 10:00:33,49796420,[]
2626,окончание путины на камчатке не останавливает браконьеров от промысла,2018-10-01 09:46:19,49796420,[]
2627,на камчатке экс начальницу отделения почтовой связи заподозрили в растрате,2018-10-01 09:44:29,49796420,[]
2628,на камчатке пройдут чемпионат и первенство россии по горнолыжному спорту,2018-10-01 09:30:17,49796420,[]
2629,в елизове рано утром сгорел,2018-10-01 09:15:22,49796420,[]
2630,летний елизовчанин угнал лошадь стоимостью тысяч рублей,2018-10-01 09:10:10,49796420,[]
2631,карымский вулкан на камчатке выбросил пепел на высоту метров,2018-10-01 09:02:00,49796420,[]
2632,на камчатской трассе по неизвестным причинам загорелся грузовик,2018-10-01 08:46:04,49796420,[]
2633,на камчатке по сценарию эвакуировали туристов с авачинского вулкана,2018-10-01 08:20:31,49796420,[]
2634,карымский вулкан на камчатке выбросил пепел на три тысячи метров,2018-10-01 07:55:06,49796420,[]
2635,фото,2018-10-01 04:30:10,49796420,['фото']
2636,в петропавловске нашли мужчину в бессознательном состоянии,2018-10-01 02:30:33,49796420,[]
2637,в октябре состоится премьера фильма валдиса пельша о камчатке,2018-10-01 02:05:14,49796420,[]
2638,камчатские военные маневрируют на полигоне радыгино,2018-10-01 01:40:08,49796420,[]
2639,на камчатке завершился первый этап конкурса народный участковый,2018-10-01 01:15:20,49796420,[]
2640,огнеборцы пасли имущество на миллион рублей из горящего здания,2018-10-01 00:50:13,49796420,[]
2641,фото,2018-09-30 09:00:56,49796420,['фото']
2642,фото,2018-09-30 04:31:31,49796420,['фото']
2643,фото,2018-09-29 09:01:34,49796420,['фото']
2644,фото,2018-09-29 04:30:12,49796420,['фото']
2645,на камчатке начали готовиться к проведению чемпионата россии по горнолыжному спорту,2018-09-28 13:20:09,49796420,[]
2646,губернатор илюхин рассказал чем камчатке аукнется снижение транспортного налога,2018-09-28 12:55:12,49796420,[]
2647,в жилых домах петропавловска возникли проблемы с теплоснабжением,2018-09-28 12:31:42,49796420,[]
2648,реконструкцию центра петропавловска власти намерены завершить к июлю года,2018-09-28 12:05:19,49796420,[]
2649,в россии вводят новые правила регистрации автомобилей и выдачи номеров,2018-09-28 11:15:10,49796420,[]
2650,у властей камчатки появился план борьбы с коррупцией,2018-09-28 10:50:15,49796420,[]
2651,на камчатке суд обезглавил паратунское поселение,2018-09-28 10:45:37,49796420,[]
2652,камчатские сыщики поймали конокрада и вернули лошадь хозяину,2018-09-28 10:31:15,49796420,[]
2653,смена нпф как не потерять дивиденды начисленные на накопительную часть пенсии,2018-09-28 10:25:13,49796420,[]
2654,ростелеком охватывает видеонаблюдением многоквартирные дома на камчатке,2018-09-28 10:16:04,49796420,[]
2655,в петропавловске разбойник ударил камнем продавца и сбежал с кассой,2018-09-28 10:02:11,49796420,[]
2656,на камчатке суд отстранил от должности главу села паратунка александра бабака,2018-09-28 10:01:15,49796420,[]
2657,за два дня жители камчатки собрали для семьи перегинец почти тысяч,2018-09-28 09:45:36,49796420,[]
2658,бастует ли почта россии жители камчатки не могут дождаться своих посылок,2018-09-28 09:35:07,49796420,[]
2659,в петропавловске работает горячая линия по нарушениям в работе автобусов,2018-09-28 09:30:13,49796420,[]
2660,камчатский наркоторговец не оправдал доверие суда,2018-09-28 09:15:53,49796420,[]
2661,уволенный главбух сельской администрации получит компенсацию за моральный вред,2018-09-28 09:10:16,49796420,[]
2662,более тысяч тонн лососей добыли рыбаки в рекордную путину на камчатке,2018-09-28 09:02:39,49796420,[]
2663,житель петропавловска ограбил магазин ударив продавца камнем по голове,2018-09-28 08:45:23,49796420,[]
2664,на северо востоке благоустроили самую большую в городе детскую площадку,2018-09-28 08:20:14,49796420,[]
2665,власти камчатки определили сроки закрытия навигации маломерных судов,2018-09-28 07:55:14,49796420,[]
2666,на камчатке посадили мужчину который не оправдал оказанное судом доверие,2018-09-28 05:00:19,49796420,[]
2667,пассажирам автобусов предлагают сообщать о нарушении своих прав на горячую линию,2018-09-28 04:35:19,49796420,[]
2668,фото,2018-09-28 04:30:24,49796420,['фото']
2669,в петропавловске водитель тойоты отправил в больницу летнего мотоциклиста обзор дтп,2018-09-28 04:10:18,49796420,[]
2670,синоптики прогнозируют хорошую погоду в петропавловске на выходные,2018-09-28 03:45:08,49796420,[]
2671,жителей камчатки в этом году пострадали от укусов животных,2018-09-28 03:20:09,49796420,[]
2672,онф в усть камчатске на разбитый асфальт наносили дорожную разметку,2018-09-28 02:55:08,49796420,[]
2673,московские эксперты выберут лучших рестораторов петропавловска,2018-09-27 13:51:00,49796420,[]
2674,часть рекордных уловов лососей с камчатки увезли на хранение в китай,2018-09-27 12:31:41,49796420,[]
2675,от подписчика,2018-09-27 12:07:27,49796420,['от']
2676,фас нашла нарушения в работе главы камчатского минздрава,2018-09-27 12:05:35,49796420,[]
2677,суд принял решение снести шашлычную бриз в центре петропавловска,2018-09-27 10:50:32,49796420,[]
2678,в администрации петропавловска обсудили национальный вопрос,2018-09-27 10:36:29,49796420,[]
2679,в кроноцком заповеднике посчитали туристов и подвели итоги сезона фото,2018-09-27 10:01:40,49796420,[]
2680,жительница камчатки сдавшая два охотничьих ружья получит тысяч,2018-09-27 10:00:49,49796420,[]
2681,заповедные территории камчатки в этом году посетили более тысяч туристов,2018-09-27 09:49:49,49796420,[]
2682,на камчатке полицейские изъяли у браконьеров тонн красной икры видео,2018-09-27 09:30:26,49796420,[]
2683,в петропавловске благоустраивают площадку для выгула собак,2018-09-27 09:16:00,49796420,[]
2684,стали известны подробности гибели пассажира в камчатском аэропорту,2018-09-27 09:10:09,49796420,[]
2685,с камчатки в таиланд с октября полетят чартеры,2018-09-27 09:00:29,49796420,[]
2686,власти петропавловска обещают заняться аллеей флота,2018-09-27 08:45:35,49796420,[]
2687,в помещениях автобазы аппарата губернатора камчатки нашли нелегальную икру,2018-09-27 08:20:04,49796420,[]
2688,стали известны причины крушения вертолета при котором погибли два бизнесмена и пилот фсб,2018-09-27 07:55:10,49796420,[]
2689,на камчатке женщина отнесла в полицию оружие которая нашла в шкафу умершего сожителя,2018-09-27 05:25:11,49796420,[]
2690,на камчатке в ходе полицейской операции у браконьеров изъяли тонн икры видео,2018-09-27 05:00:21,49796420,[]
2691,фото,2018-09-27 04:30:38,49796420,['фото']
2692,если партия доверит депутат калашников заявил о своих губернаторских амбициях,2018-09-27 03:20:15,49796420,[]
2693,водитель на ленд крузере травмировал трех женщин и скрылся с места аварии,2018-09-27 02:55:12,49796420,[]
2694,чиновники решили поощрять жителей камчатки за гражданскую позицию и большое сердце,2018-09-27 01:15:23,49796420,[]
2695,бывший губернатор корякии олег кожемяко возглавит приморский край,2018-09-27 00:50:09,49796420,[]
2696,всероссийский день ходьбы на камчатке отметят празднично,2018-09-26 12:31:55,49796420,[]
2697,держите меня в краевой больнице не нашлось каталки для тяжелого пациента,2018-09-26 12:05:08,49796420,[]
2698,на северо востоке делают первую в городе спецплощадку для выгула собак фото,2018-09-26 10:25:30,49796420,[]
2699,жителей камчатки приглашают на концерт в поддержку семьи перегинец,2018-09-26 10:15:28,49796420,[]
2700,в елизове пожарных не смогли отстоять от огня двухэтажный дом,2018-09-26 10:00:27,49796420,[]
2701,министерство обороны пыталось отсудить у камчатскэнерго миллиона за рубку леса,2018-09-26 10:00:26,49796420,[]
2702,новый дом в камчатском поселке оссора построили за месяца,2018-09-26 09:45:33,49796420,[]
2703,на камчатке браконьеры избили инспектора в отделе росрыболовства,2018-09-26 09:35:05,49796420,[]
2704,петропавловск остается без тепла из за неготовности управляющих компаний,2018-09-26 09:32:47,49796420,[]
2705,камчатка даст старт всероссийскому дню ходьбы,2018-09-26 09:16:06,49796420,[]
2706,после поражения единой россии в вывенке губернатор пообещал сельчанам водопровод,2018-09-26 09:10:31,49796420,[]
