3708,прелесть майских дождей город утопает в сочной зелени,2018-05-12 13:19:00,55342106,[]
3709,в ночь с го на мая ночной ливень разрушил дорогу на улице котовского разбита плитка на проезжей части и повреждены бордюры в последствии стихии также затоплены частные дома повреждены пол мебель личные вещи техника и многое другое на сегодняшний день проезжая часть перекрыта а помощь пострадавшим севастопольцам не оказывается подробнее в репортаже,2018-05-12 12:08:00,55342106,[]
3710,вода на мысе фиолент,2018-05-12 11:30:35,55342106,[]
3711,помогите найти,2018-05-12 09:42:10,55342106,[]
3712,хоп хей лала лей интересно а топик сколько станет,2018-05-11 22:14:00,55342106,[]
3713,у всех есть такой друг,2018-05-11 21:23:00,55342106,[]
3714,,2018-05-11 19:00:01,55342106,
3715,,2018-05-11 17:11:00,55342106,
3716,у кого уже есть фото с инсталляцией,2018-05-11 16:04:00,55342106,[]
3717,крымские дружелюбные дельфины,2018-05-11 15:19:00,55342106,[]
3718,севастопольские дороги и ливневки не справились со стихией в городе подтопления и срочный ремонт,2018-05-11 14:00:10,55342106,[]
3719,славные обитатели севастополя,2018-05-11 13:23:00,55342106,[]
3720,обновленная торопова дача во что превратились милые сердцу места после проведенного ремонта,2018-05-11 12:00:12,55342106,[]
3721,море забирает что то важное но уже ненужное и что то большое новое оставляет внутри,2018-05-11 11:31:00,55342106,[]
3722,привет севастополю из ставрополя,2018-05-11 10:46:23,55342106,[]
3723,почему мы должны взять на работу именно в с,2018-05-11 09:19:00,55342106,[]
3724,аттракционы на историческом бульваре севастополь год,2018-05-11 08:11:00,55342106,[]
3725,в ночь с мая на на кожанова машин пострадало от дождя уровень воды был такой что в некоторых машин вода достигала до водительского кресла а проблема всего этого что коммунальщики закрыли ливневой сток бетонной плитой а под слив оставили очень незначительное расстояние на фундаменте дома остался уровень воды,2018-05-10 23:17:39,55342106,[]
3726,в севастополе ожидается увеличение стоимости проезда,2018-05-10 22:14:00,55342106,[]
3727,припарковался на месте для инвалидов,2018-05-10 21:09:00,55342106,[]
3728,,2018-05-10 20:00:11,55342106,
3729,севастополь салют в честь дня победы,2018-05-10 19:10:00,55342106,[]
3730,крым это не только богатая историческими событиями точка на карте это еще и красивейшая разнообразная природа делающая полуостров лучшим местом отдыха и туризма в ссср при котором крым по праву называли всесоюзной здравницей,2018-05-10 18:16:00,55342106,[]
3731,севастополь в честь дня победы над константиновской батареей был поднят аэростат россия,2018-05-10 17:11:00,55342106,[]
3732,ребят нужна помощь есть девчонка не я которая постеснялась познакомиться с этим парнем который стоял в оцеплении на параде сегодня мая кто что знает напишите мне лично очень хочу их познакомить если парень не занят конечно если правильно рассмотрели фамилию то он голумбивский д с если допустили ошибку извиняюсь,2018-05-10 16:47:00,55342106,[]
3733,строительство автомобильно крымского моста завершено заказчик подписал акт приемки,2018-05-10 16:03:01,55342106,[]
3734,,2018-05-10 15:21:00,55342106,
3735,парад войск на мая вид сверху,2018-05-10 14:09:00,55342106,[]
3736,помогите найти,2018-05-10 13:14:00,55342106,[]
3737,в севастополе в бессмертном полку прошло около тысяч человек,2018-05-10 12:00:10,55342106,[]
3738,ребята ну диву даешься тупости наших людей говорят власти города плохие вчера везде объявили что спуск котовского закрыт закрыт ну мне же важнее я подвину заграждение и проеду можно прям перепись людей делать тут и на бывшем пешеходе пл восставших,2018-05-10 11:13:00,55342106,[]
3739,найден мопс мальчик в районе жидилова с ошейником имеется татуировка на животе,2018-05-10 10:14:00,55342106,[]
3740,,2018-05-10 09:08:00,55342106,
3741,парад мая в севастополе,2018-05-10 08:21:00,55342106,[]
3742,срочно,2018-05-09 23:31:00,55342106,[]
3743,хороший пост дважды заблокировал аккаунт журналиста вгтрк андрея медведева за его пост о выступлении в бундестаге текст отличный и по хорошему очень русский поэтому заслуживает чтобы его прочли,2018-05-09 22:47:00,55342106,[]
3744,проход военной техники черноморского флота на параде мая в севастополе,2018-05-09 22:07:00,55342106,[]
3745,севастопольцы готовы,2018-05-09 21:14:00,55342106,[]
3746,знакомство с севастополем сквозь кадры киноленты,2018-05-09 18:11:00,55342106,[]
3747,севастополь спуск котовского после дождя,2018-05-09 17:14:00,55342106,[]
3748,пока жива память о героях великой отечественной войны они рядом с нами мы обязаны им миром на нашей земле и будем помнить об этом всегда с днем победы,2018-05-09 16:27:00,55342106,[]
3749,удар кинжалом в параде победы в москве будет продемонстрирован гиперзвуковой ракетный комплекс,2018-05-09 15:19:00,55342106,[]
3750,севастополь,2018-05-09 14:11:00,55342106,[]
3751,в преддверии дня победы блокпост севастополь почтил память павших воинов,2018-05-09 13:19:00,55342106,[]
3752,севпарки сделали шикарный подарок городу герою,2018-05-09 12:18:00,55342106,[]
3753,в севастополе даже котики чтут великий день победы,2018-05-09 11:13:00,55342106,[]
3754,в севастополе сегодня временно перекрыли для транспорта спуск котовского,2018-05-09 10:03:00,55342106,[]
3755,мая года исполняется годовщина со дня великой победы,2018-05-09 09:11:00,55342106,[]
3756,программа празднования дня победы в севастополе,2018-05-09 08:09:00,55342106,[]
3757,мая севастополь в,2018-05-09 07:51:30,55342106,[]
3758,подготовка к мая в севастополе,2018-05-08 23:03:00,55342106,[]
3759,коротко о погоде в севастополе,2018-05-08 22:19:00,55342106,[]
3760,лучший город на земле или в трепетном ожидании лета,2018-05-08 21:08:00,55342106,[]
3761,вы этого ждали,2018-05-08 20:05:26,55342106,[]
3762,с года в отелях крыма должна была появиться система все включено,2018-05-08 19:13:00,55342106,[]
3763,севастопольский дзюдоист стал лучшим на турнире в сараево,2018-05-08 18:07:00,55342106,[]
3764,репетиция парада победы в севастополе,2018-05-08 17:16:00,55342106,[]
3765,четвертая инаугурация президента владимира владимировича путина,2018-05-08 16:11:00,55342106,[]
3766,п принцип,2018-05-08 15:21:00,55342106,[]
3767,в севастополе подготовка города к празднованию дня победы превратилась в гнусную показуху подмазали и готово,2018-05-08 14:13:00,55342106,[]
3768,севастополь в тумане,2018-05-08 13:15:00,55342106,[]
3769,великая отечественная война это тяжелое бремя которое смертельным ураганом из пуль и снарядов обрушилось на судьбы советского народа трудно себе представить что чувствовали солдаты покидая свои дома смотря в глаза своим родным и близким возможно в последний раз,2018-05-08 12:18:00,55342106,[]
3770,в центре фильм снимают или подготовка к мая,2018-05-08 11:31:00,55342106,[]
3771,разбирают мост на камышовой объездной,2018-05-08 10:47:00,55342106,[]
3772,прошла реконструкция штурма сапун горы,2018-05-08 09:49:00,55342106,[]
3773,афиша,2018-05-08 09:14:00,55342106,[]
3774,день вмф ссср в севастополе год,2018-05-08 08:12:00,55342106,[]
3775,мая при массированной поддержке всей авиации фронта советские войска начали генеральный штурм севастопольского укрепленного района,2018-05-07 21:19:00,55342106,[]
3776,вечерняя балаклава,2018-05-07 20:15:00,55342106,[]
3777,история создания памятника затопленным кораблям,2018-05-07 19:08:00,55342106,[]
3778,крым ласпи гора деликли бурун,2018-05-07 18:11:00,55342106,[]
3779,реклама,2018-05-07 17:00:01,55342106,['реклама']
3780,то что делает нас людьми это доброта,2018-05-07 16:08:00,55342106,[]
3781,чтобы не вводить ни кого в заблуждение в утра была фото сделана что собака находится на ушакова возле гостиницы украина но там ее не было видимо все уже запутались,2018-05-07 15:06:00,55342106,[]
3782,спасите наш фиолент,2018-05-07 14:31:00,55342106,[]
3783,цвет настроения церцис,2018-05-07 13:13:00,55342106,[]
3784,отличный кадр,2018-05-07 12:23:00,55342106,[]
3785,о фестивале о да еда,2018-05-07 11:12:00,55342106,[]
3786,севастополь северная сторона мая памятное шествие бессмертного полка,2018-05-07 10:17:00,55342106,[]
3787,дорога севастополь ялта,2018-05-07 09:06:00,55342106,[]
3788,фиолент яшмовый пляж,2018-05-07 08:24:28,55342106,[]
3789,выходные вы куда,2018-05-06 23:07:00,55342106,[]
3790,на камышовом шоссе начали демонтировать мост,2018-05-06 22:20:00,55342106,[]
3791,сапун гора сегодня,2018-05-06 21:18:00,55342106,[]
3792,фиолент ночь на яшмовом пляже,2018-05-06 20:03:00,55342106,[]
3793,каштановый севастополь,2018-05-06 19:22:00,55342106,[]
3794,как в севастополе отметят день победы,2018-05-06 18:24:00,55342106,[]
3795,юбк,2018-05-06 17:31:00,55342106,[]
3796,севастопольцев мая приглашают на открытие поющих фонтанов,2018-05-06 16:07:00,55342106,[]
3797,,2018-05-06 15:00:02,55342106,
3798,севастополь,2018-05-06 13:27:00,55342106,[]
3799,в севастополе уже появились огромные пробки а после открытия крымского моста город совсем встанет,2018-05-06 12:07:00,55342106,[]
3800,в севастополе украинский активист получил два года колонии,2018-05-06 11:03:00,55342106,[]
3801,парад мая в севастополе это незабываемо,2018-05-06 10:03:00,55342106,[]
3802,в россии со следующего года намерены ввести новый налог,2018-05-06 09:08:00,55342106,[]
3803,фиолент скала святого явления,2018-05-06 08:12:00,55342106,[]
3804,балаклава,2018-05-05 23:18:00,55342106,[]
3805,севастопольцев мая приглашают на открытие поющих фонтанов,2018-05-05 22:12:00,55342106,[]
3806,я и субботние мысли лезущие в голову,2018-05-05 21:08:00,55342106,[]
3807,пл восставших для особо настойчивых повесили знак,2018-05-05 20:07:31,55342106,[]
3808,для всех творческих жителей нашего прекрасного города героя севастополя,2018-05-05 19:00:07,55342106,[]
3809,ребят найдена собака лежит уже ий день на остановке ая батарея ни ест ни пьет близко к себе не подпускает рычит средних размеров черная с коричнево белыми участками не породистая с ошейником серо бежевого цвета непонятный цвет,2018-05-05 17:15:00,55342106,[]
3810,,2018-05-05 16:17:00,55342106,
3811,на камышовой объездной ремонт дороги продвинулся за мост,2018-05-05 15:05:00,55342106,[]
3812,принимают душ,2018-05-05 12:29:00,55342106,[]
3813,информируем,2018-05-05 11:23:00,55342106,[]
3814,балаклава,2018-05-05 10:17:00,55342106,[]
3815,репетиции парада победы в севастополе пройдут и мая,2018-05-05 09:19:00,55342106,[]
3816,,2018-05-05 08:01:28,55342106,
3817,вид на ночной севастополь с корабельной стороны,2018-05-04 22:07:00,55342106,[]
3818,,2018-05-04 20:03:00,55342106,
3819,как же нам с вами крымские ребята повезло,2018-05-04 19:04:10,55342106,[]
3820,фиолентовское шоссе,2018-05-04 15:15:01,55342106,[]
3821,пдд для смертных перекресток шабалина и токарева,2018-05-04 14:27:00,55342106,[]
3822,,2018-05-04 13:29:00,55342106,
3823,в гагаринском районе начались работы по строительству нового детского сада по улице тараса шевченко напртив тц через дорогу,2018-05-04 12:19:00,55342106,[]
3824,семья романовых на графская пристани в севастополе год,2018-05-04 10:12:00,55342106,[]
3825,когда надоела чья то кислая мина,2018-05-04 09:19:00,55342106,[]
3826,ретро севастополь года,2018-05-04 08:17:00,55342106,[]
3827,херсонеский маяк,2018-05-03 22:58:07,55342106,[]
3828,севастополь,2018-05-03 21:21:00,55342106,[]
3829,,2018-05-03 20:00:02,55342106,
3830,цветочное безумие в разгаре,2018-05-03 19:12:00,55342106,[]
3831,двенадцать национально культурных обществ города и полуострова накормили севастопольцев блюдами национальных кухонь мая в эко парке лукоморье состоялся й фестиваль национальной кухни народов крыма и севастополя на мероприятии были представлены армянские греческие мордовские чувашские болгарские белорусские украинские и др блюда очень быстро разобрали греческие спанакопиту тиропиту и мусаку,2018-05-03 18:16:00,55342106,[]
3832,херсонесский маяк,2018-05-03 17:17:00,55342106,[]
3833,как в севастополе отпразднуют день победы,2018-05-03 15:03:00,55342106,[]
3834,можно ехать завершена укладка асфальта на к ымском мосту,2018-05-03 14:18:00,55342106,[]
3835,в севастополе к концу года появится новый парк,2018-05-03 13:19:00,55342106,[]
3836,в центре севастополя прошла выставка ретро автомобилей,2018-05-03 12:21:00,55342106,[]
3837,севастополь,2018-05-03 11:18:00,55342106,[]
3838,мыс хрустальный,2018-05-03 10:14:00,55342106,[]
3839,я т к понял по хорошему ты не хочешь,2018-05-03 09:15:00,55342106,[]
3840,балаклава моего детства,2018-05-03 08:14:00,55342106,[]
3841,ретро севастополь мыс хрустальный лето г,2018-05-02 23:03:00,55342106,[]
3842,процесс выгрузки сейфа из здания крымского коммерческого церковного банка на ул ленина нынешний сцкии банк который принадлежал известному депутату кондратевскому разорился и оставил много недовольных вкладчиков лихие е по севастопольски,2018-05-02 22:14:00,55342106,[]
3843,прогуливались сегодня по херсонесу и решили вдоль моря пройтись к солнечному пляжу и вот что увидели вроде весь парк и улица надежды островской чистые как так,2018-05-02 21:22:20,55342106,[]
3844,,2018-05-02 19:00:20,55342106,
3845,первомайские портреты,2018-05-02 18:05:00,55342106,[]
3846,в севастополе рассказали какие улицы капитально отремонтируют,2018-05-02 16:08:00,55342106,[]
3847,добрый день возможно в вашей группе уже публиковали подобную информацию но я все же решила написать,2018-05-02 14:37:00,55342106,[]
3848,опрос,2018-05-02 13:27:00,55342106,[]
3849,куда не кинешь взор везде цветет церцис,2018-05-02 12:21:00,55342106,[]
3850,сегодня мне посчастливилось стать участником автопробега авторалли нахимов на участке севастополь евпатория на ретро автомобилях я открыл подробно для себя множество легенд советского автопрома на которые в общем то не сильно раньше обращал внимание газ газ газ чайка газ чайка газ сайбер просто дух захватывает когда ты едешь на автомобиле года выпуска умели же раньше же делать машины я обязательно когда нибудь приобрету себе такую же,2018-05-02 11:12:00,55342106,[]
3851,первомай в севастополе прошел в лучших советских традициях но без скандала не обошлось,2018-05-02 10:12:00,55342106,[]
3852,обычный дом в севастополе,2018-05-02 09:19:00,55342106,[]
3853,когда видишь свободное место в автобусе,2018-05-02 08:16:00,55342106,[]
3854,интересно почему власти так рьяно борятся с нто а церквям раздают земли или те по своему усмотрению ставят ларьки по беспредела или закон для них не писан,2018-05-01 22:17:00,55342106,[]
3855,видели как я ночью светился это тестировали освещение моей арки когда весь достроюсь ночью арки будут в триколоре,2018-05-01 21:17:00,55342106,[]
3856,вот вам и мая,2018-05-01 20:11:00,55342106,[]
3857,,2018-05-01 19:13:00,55342106,
3858,севастополь мая в районе исторического бульвара найдены ключи от автомобиля рено,2018-05-01 18:09:00,55342106,[]
3859,мая каждого года на сапун горе в г севастополе проводился традиционный мотокросс чья история отсчитывается с года в этом году его не будет,2018-05-01 17:12:00,55342106,[]
3860,придумайте название к этому фото,2018-05-01 14:47:00,55342106,[]
3861,что там с фонтаном на нахимова,2018-05-01 14:01:00,55342106,[]
3862,в севастополе после реставрации открыли оборонительную башню на малаховом кургане,2018-05-01 13:11:00,55342106,[]
3863,,2018-05-01 12:21:00,55342106,
3864,в севастополе сотни горожан отметили международный день танца исполнив московскую кадриль,2018-05-01 11:19:00,55342106,[]
3865,остановка в севастополе заросла сорняками до колен,2018-05-01 10:17:00,55342106,[]
3866,стало известно кто первым проедет по крымскому мосту,2018-05-01 09:19:00,55342106,[]
3867,всех с праздником,2018-05-01 08:17:00,55342106,[]
3868,ночная подсветка крымского моста,2018-04-30 22:27:00,55342106,[]
3869,в севастополе остановку проспект октябрьской революции перенесли на метров назад,2018-04-30 21:19:00,55342106,[]
3870,севастополь на закате,2018-04-30 20:17:00,55342106,[]
3871,разминка перед сезоном гонок в севастополе,2018-04-30 19:04:00,55342106,[]
3872,в севастополе развернули метровый российский флаг,2018-04-30 18:26:00,55342106,[]
3873,на крымской трассе сгорел двухэтажный автобус,2018-04-30 17:41:00,55342106,[]
3874,ретро севастополь,2018-04-30 16:23:00,55342106,[]
3875,севастополь город мечты,2018-04-30 15:09:00,55342106,[]
3876,фас завела дело о завышении топливных цен на крымских заправках,2018-04-30 13:29:00,55342106,[]
3877,вчера площадь нахимова собрала тысячи людей которые пришли потанцевать в рамках международного дня танца,2018-04-30 12:13:00,55342106,[]
3878,все левых поворотов отныне в севастополе почти нет от сталинграда и по всему проспекту окт революции на каждом повороте стоят знаки только направо и на ост парк победы и у ост пор и у комплекса тут же теперь разворачивайтесь только на кольце меньшикова или на кольце свято никольского храма иначе в парк в омегу на античный не доехать дворами и кольцами маразм когда будут думать о людях,2018-04-30 11:07:00,55342106,[]
3879,опрос,2018-04-30 10:12:00,55342106,[]
3880,севастополь парк имени ахматовой русской поэтессы,2018-04-30 09:21:00,55342106,[]
