3891,в чебоксарах пройдут фестиваль матерей и детей выставка цветов и велогонки афиша,2018-09-24 15:10:01,23951627,['афиша']
3892,в селе абашево колхоз сливает навозную жижу прямо на дорогу новости,2018-09-24 14:50:00,23951627,['новости']
3893,в минувшие выходные прошла фотовыставка новочебоксарск город красивых людей видео,2018-09-24 14:30:03,23951627,['видео']
3894,глава чувашии создал новый отдел в своей администрации новости,2018-09-24 14:15:01,23951627,['новости']
3895,в чувашии задавили женщину которая шла ночью по краю дороги дтп,2018-09-24 14:00:13,23951627,['дтп']
3896,в чувашии на лет осудили мужчину который подсел в парке к ребенку новости,2018-09-24 13:50:00,23951627,['новости']
3897,синоптики рассказали вернется ли в чувашию теплая погода новости,2018-09-24 13:30:03,23951627,['новости']
3898,в чувашии место собираются сделать памятником истории россии новости,2018-09-24 13:03:01,23951627,['новости']
3899,каждый раз начинаете ремонт с понедельника,2018-09-24 12:00:13,23951627,[]
3900,что ждет чебоксары в новом театральном сезоне афиша,2018-09-24 11:20:00,23951627,['афиша']
3901,в чувашии в воскресенье произошло несколько крупных пожаров новости,2018-09-24 10:55:00,23951627,['новости']
3902,в цивильске фура насмерть сбила велосипедиста дтп,2018-09-24 10:53:03,23951627,['дтп']
3903,михаил игнатьев наша главная задача продлить ваше долголетие новости,2018-09-24 10:32:00,23951627,['новости']
3904,можно ли заправить свой автомобиль бесплатно автосервис с отвечает да участвуйте в розыгрыше который проводят специально для вас автосервис с разыгрывает литров го бензина прямо сейчас рассказываем на сколько смогут заправиться счастливчики победители,2018-09-24 09:30:03,23951627,[]
3905,в чувашии летний мужчина из чебоксар ушел из дома и пропал новости,2018-09-24 09:02:42,23951627,['новости']
3906,напоминаем что каждый житель чувашии может стать народным корреспондентом и даже подзаработать,2018-09-24 08:44:07,23951627,[]
3907,в чебоксарах замечен белый воробей что с ним не так и не опасно ли это народныйконтроль,2018-09-24 07:15:00,23951627,['народныйконтроль']
3908,министр проверил ремонт больниц канаша и сделал замечания новости,2018-09-24 06:45:00,23951627,['новости']
3909,рынок шупашкар ночью оцепили кинологи и саперы,2018-09-24 06:20:00,23951627,[]
3910,доброе утро желаем отличного настроения в этот понедельник,2018-09-24 06:03:00,23951627,[]
3911,ночной чат,2018-09-23 23:45:00,23951627,[]
3912,следователи дополнительно проверят сенатора чувашии после банкротства чувашского бройлера,2018-09-23 22:30:01,23951627,[]
3913,фотография от подписчика чебоксары,2018-09-23 21:45:00,23951627,['чебоксары']
3914,серьезное столкновение двух автомобилей на марпосадском шоссе дтп,2018-09-23 21:30:02,23951627,['дтп']
3915,октября в дк химик симфонический оркестр впервые представит обширную концертную программу всем любителям рок музыки музыканты приезжают в новочебоксарск чтобы наполнить зал драйвом и энергией рока сочетающимися с торжественностью и возвышенностью симфонической музыки в программе вас ожидают взрывные и легендарные и мелодичные и многие другие,2018-09-23 20:30:01,23951627,[]
3916,в понедельник в чувашии похолодает и начнется пора небольших дождей,2018-09-23 20:15:00,23951627,[]
3917,вечерний чат,2018-09-23 20:00:10,23951627,[]
3918,в группе доставка из икеа стартовал новый конкурс,2018-09-23 19:00:05,23951627,[]
3919,строители засоряют волгу пенопластом а в водоеме плавают утки с лебедями народынйконтроль,2018-09-23 18:10:32,23951627,['народынйконтроль']
3920,троллейбус в новый город власти обещают отправить без опозданий,2018-09-23 17:15:01,23951627,[]
3921,,2018-09-23 16:40:00,23951627,
3922,в чебоксарах гибдд начала охоту на таксистов яндекс новости,2018-09-23 16:20:00,23951627,['новости']
3923,видео,2018-09-23 16:01:08,23951627,['видео']
3924,национальный банк по чувашии пригласил горожан на день открытых дверей новости,2018-09-23 15:14:29,23951627,['новости']
3925,чебоксарец наказал коллекторов на тысяч рублей новости,2018-09-23 14:45:00,23951627,['новости']
3926,у чебоксарца телефон заразился опасным вирусом после скачивания приложения новости,2018-09-23 14:20:00,23951627,['новости']
3927,видео от гибдд видео,2018-09-23 14:00:11,23951627,['видео']
3928,глава чувашии подписал несколько законов о налогах и строительстве политика,2018-09-23 13:40:00,23951627,['политика']
3929,сергей жуков собрал аншлаг в ледовом дворце чебоксар афиша,2018-09-23 13:00:10,23951627,['афиша']
3930,любите кофе пончики и рисовать тогда этот конкурс для вас запускает конкурс детских рисунков в котором стоит поучаствовать потому что все призеры которых будет получат вкусные и сладкие подарки,2018-09-23 12:00:10,23951627,[]
3931,рынок шупашкар ночью оцепили кинологи и саперы происшествия,2018-09-23 11:15:00,23951627,['происшествия']
3932,в чебоксарах запертый в квартире мужчина выпрыгнул в окно происшествия,2018-09-23 10:30:03,23951627,['происшествия']
3933,знаете ли вы о том что имеете право на вычеты по ндфл,2018-09-23 09:30:00,23951627,[]
3934,для обманутых дольщиков в чувашии работает горячая линия,2018-09-23 08:04:00,23951627,[]
3935,чебоксарка рассказала на поле чудес зачем в жкх красивые девушки,2018-09-23 07:09:00,23951627,[]
3936,доброе утро сегодня ожидается жаркое воскресенье,2018-09-23 06:04:00,23951627,[]
3937,ночной чат,2018-09-22 23:07:45,23951627,[]
3938,специалисты уточнили судьбу етк в чебоксарах,2018-09-22 22:30:01,23951627,[]
3939,новочебоксарск рядом с магазином нарспи идет стройка ограждение убрали теперь там бегают дети народныйконтроль,2018-09-22 22:00:06,23951627,['народныйконтроль']
3940,в чувашии потеплеет до градусов,2018-09-22 21:30:01,23951627,[]
3941,подписывайтесь на наш канал,2018-09-22 20:30:02,23951627,[]
3942,вечерний чат народныйконтроль,2018-09-22 20:00:08,23951627,['народныйконтроль']
3943,хочешь расслабиться на этой осенью тогда конкурс который проводит комплекс аква лайф с сентября по сентября для тебя,2018-09-22 18:00:04,23951627,[]
3944,следователи дополнительно проверят сенатора чувашии после банкротства чувашского бройлера новости,2018-09-22 17:30:03,23951627,['новости']
3945,чиновники поехали в марий эл брать пример по общественному транспорту новости,2018-09-22 17:02:02,23951627,['новости']
3946,в конкурсе сестры появились новые девушки конкурс,2018-09-22 16:50:00,23951627,['конкурс']
3947,новость от подписчика дтп,2018-09-22 16:36:34,23951627,['дтп']
3948,наш праздник подошел к концу победители награждены гости сыты дети счастливы,2018-09-22 16:20:19,23951627,[]
3949,в новочебоксарске ремонтируют мост движение реверсивное новости,2018-09-22 15:50:00,23951627,['новости']
3950,фоторепортаж афиша,2018-09-22 15:30:02,23951627,['афиша']
3951,участвуйте в розыгрыше универсальных подарков которые поднимут настроение любому другу коллеге или имениннику,2018-09-22 15:20:00,23951627,[]
3952,в алатыре планируют построить комплекс предприятий новости,2018-09-22 15:01:00,23951627,['новости']
3953,в чебоксарах возобновил работу взрослый зал скалодрома кошка,2018-09-22 14:00:04,23951627,[]
3954,анонс выпуска самых читаемых новостей за прошедшую неделю видео,2018-09-22 13:50:00,23951627,['видео']
3955,педофил попытался выйти на свободу через верховный суд чувашии криминал,2018-09-22 13:20:00,23951627,['криминал']
3956,уже сегодня состоится открытие фотовыставки новочебоксарск город красивых людей мы ждем вас по адресу ул винокурова кафе плюшкин начало в вас ждут красивые фотографии куча призов фуршет розыгрыш тортов и многое другое,2018-09-22 13:00:10,23951627,[]
3957,для вас есть хорошая новость в тц крона парк пр максима горького д открылся новый магазин,2018-09-22 12:00:05,23951627,[]
3958,разметку на дорогах чувашии обещают сделать до выпадения снега новости,2018-09-22 11:45:00,23951627,['новости']
3959,чебоксарка рассказала на поле чудес зачем в жкх красивые девушки новости,2018-09-22 11:01:15,23951627,['новости']
3960,в конкурсе а ты знаешь свой город появился победитель конкурс,2018-09-22 10:22:39,23951627,['конкурс']
3961,власти чебоксар обещают начать отопительный сезон без эксцессов новости,2018-09-22 09:53:43,23951627,['новости']
3962,в чувашии испытали первый российский хмелеуборочный комбайн новости,2018-09-22 08:03:00,23951627,['новости']
3963,чем заняться чудесным субботним днем всех участников и неравнодушных горожан приглашаем на фотовыставку новочебоксарск город красивых людей сентября в в кафе плюшкин по адресу ул винокурова,2018-09-22 07:00:02,23951627,[]
3964,в новочебоксарске лежачие полицейские оказались неправильными новости,2018-09-22 06:35:00,23951627,['новости']
3965,в россии в году появятся новые автомобильные номера,2018-09-22 06:20:00,23951627,[]
3966,доброе утро желаем прогулки на природе ведь все еще так тепло чувашия,2018-09-22 06:00:03,23951627,['чувашия']
3967,ночной чат народныйконтроль,2018-09-21 23:35:00,23951627,['народныйконтроль']
3968,свора собак в новочебоксарске у нижнего кольца голов,2018-09-21 23:11:04,23951627,[]
3969,личная история в новочебоксарске соседка отказалась пускать девочку в подъезд,2018-09-21 22:35:00,23951627,[]
3970,вы фотограф художник пишите памфлеты или просто любите вкусно поесть и не против прикоснуться к искусству в эти выходные приходите на выставку новочебоксарск город красивых людей сентября в в кафе плюшкин сделайте репост чтобы не забыть адрес ул винокурова,2018-09-21 20:15:00,23951627,[]
3971,на красной площади придумали поставить новый фонтан новости,2018-09-21 19:45:00,23951627,['новости']
3972,в чувашии выходные готовят сюрприз для жителей республики погода,2018-09-21 19:30:03,23951627,['погода']
3973,в чебоксарах мужчина избивал пожилую мать последний случай стал смертельным криминал,2018-09-21 19:03:00,23951627,['криминал']
3974,,2018-09-21 18:00:09,23951627,
3975,афиша выходного дня фестиваль ретроавтомобилей день здоровья и спорта квест игра для детей афиша,2018-09-21 17:40:01,23951627,['афиша']
3976,в чебоксарах женщине пришел штраф ни за что новости,2018-09-21 17:21:00,23951627,['новости']
3977,новость от подписчика,2018-09-21 17:18:35,23951627,[]
3978,специалисты уточнили судьбу етк в чебоксарах новости,2018-09-21 17:00:09,23951627,['новости']
3979,в чебоксарах электрики нашли в подвале труп новости,2018-09-21 16:37:00,23951627,['новости']
3980,в чебоксарах в центре города оцепили здание сбербанка происшествия,2018-09-21 16:16:04,23951627,['происшествия']
3981,стаи бродячих собак держат жителей новочебоксарска в страхе новости,2018-09-21 16:05:01,23951627,['новости']
3982,волга ломбард продолжает радовать своих клиентов новыми розыгрышами на этот раз ювелирная компания разыгрывает золотых изделий среди своих клиентов,2018-09-21 15:05:01,23951627,[]
3983,в чувашии чиновники поддержали предложение путина по льготам пенсионерам новости,2018-09-21 14:30:03,23951627,['новости']
3984,сообщение от подписчика,2018-09-21 14:10:00,23951627,[]
3985,новым советником игнатьева стал георгий какабадзе новости,2018-09-21 13:50:00,23951627,['новости']
3986,из чувашской колонии досрочно вышла осужденная по делу о крушении булгарии новости,2018-09-21 13:25:00,23951627,['новости']
3987,сергей жуков вернулся на сцену после болезни и теперь едет в чебоксары афиша,2018-09-21 13:01:00,23951627,['афиша']
3988,бесплатный дизайн квартиры от инком,2018-09-21 12:01:16,23951627,[]
3989,на юрму завели новое уголовное дело новости,2018-09-21 11:45:00,23951627,['новости']
3990,в чувашии из за ошибки врача убийца вырвался на свободу новости,2018-09-21 11:20:01,23951627,['новости']
3991,игнатьев за золотую медаль подарил спортсменке из чебоксар часы новости,2018-09-21 10:52:00,23951627,['новости']
3992,прими участие в квесте а ты знаешь свой город конкурс,2018-09-21 10:32:00,23951627,['конкурс']
3993,задумали обновить гардероб или аксессуары к осени это отличное время для того чтобы приобретать красивые товары по скидкам хотите получить скидку на сумку,2018-09-21 09:30:02,23951627,[]
3994,в канаше во время пожара в квартире погиб мужчина происшествия,2018-09-21 08:50:07,23951627,['происшествия']
3995,в россии в году появятся новые автомобильные номера новости,2018-09-21 07:35:00,23951627,['новости']
3996,в чувашии чулочно трикотажную фабрику признали банкротом новости,2018-09-21 06:35:00,23951627,['новости']
3997,игнатьев сказал почему не сожалеет что кто то уезжает из чувашии,2018-09-21 06:20:00,23951627,[]
3998,доброе утро желаем золотистого настроения автор фото виктор чугаров чебоксары,2018-09-21 06:03:00,23951627,['чебоксары']
3999,ночной чат народныйконтроль,2018-09-20 23:30:01,23951627,['народныйконтроль']
4000,чебоксарец выходя из дома мои дети будут видеть кресты и могилы,2018-09-20 22:30:02,23951627,[]
4001,на хузангая в подъезде в лифте не очень приятный сюрприз народныйконтроль,2018-09-20 21:50:17,23951627,['народныйконтроль']
4002,в новом городе определили стоимость и время строительства школы новости,2018-09-20 21:30:01,23951627,['новости']
4003,хотите недорого одеться в классные осенние вещи тогда вступайте в группу,2018-09-20 20:30:02,23951627,[]
4004,вечерний чат от подписчицы народныйконтроль,2018-09-20 20:00:11,23951627,['народныйконтроль']
4005,в пятницу в чувашии синоптики обещают потепление погода,2018-09-20 19:45:00,23951627,['погода']
4006,,2018-09-20 19:40:00,23951627,
4007,в фотоконкурсе появились еще новых сестер конкурс,2018-09-20 19:30:02,23951627,['конкурс']
4008,,2018-09-20 18:30:01,23951627,
4009,в сирии сбили самолет с военным из чувашии новости,2018-09-20 18:20:00,23951627,['новости']
4010,чебоксарка заказала шпица с доставкой на самолете но получилось как обычно новости,2018-09-20 18:05:01,23951627,['новости']
4011,в новочебоксарске нашли пьющих трактористов новости,2018-09-20 17:45:00,23951627,['новости']
4012,в августе отремонтировали дорогу по улице афанасьева обещали отремонтировать и тротуар на сегодняшний день он разбит в городской администрации сказали тротуар около пешеходного перехода в районе чувашпотребсоюза отремонтируют тротуар от остановки общественного транспорта улица афанасьева вдоль ремонтируемой дороги чинить не будут по факту участок в районе чувашпотребсоюза засыпали асфальтной крошкой которая проваливается при ходьбе дыры закидали теми же кусками асфальта которыми и дробили этот тротуар как людям по нему ходить народныйконтроль,2018-09-20 17:25:00,23951627,['народныйконтроль']
4013,с рейса чебоксары сочи сняли буйного пассажира происшествия,2018-09-20 17:00:11,23951627,['происшествия']
4014,в чувашии геронтофил вышел из тюрьмы и снова напал на пенсионерку криминал,2018-09-20 16:40:00,23951627,['криминал']
4015,в шумерлинском районе пешеход погиб под колесами автомобиля дтп,2018-09-20 16:20:00,23951627,['дтп']
4016,за один день в чувашии сбили кабана и лося новости,2018-09-20 16:00:10,23951627,['новости']
4017,неизвестные сломали молодые деревья во дворе дома в чебоксарах новости,2018-09-20 15:41:00,23951627,['новости']
4018,кинопремьеры недели в чебоксарах пародийный суперагент монахиня из ада мамаша видеоблогер афиша,2018-09-20 15:21:00,23951627,['афиша']
4019,личная история в новочебоксарске соседка отказалась пускать девочку в подъезд новости,2018-09-20 15:01:00,23951627,['новости']
4020,партнерскийматериал,2018-09-20 14:00:12,23951627,['партнерскийматериал']
4021,в новочебоксарске двое молодых парней до смерти избили летнего мужчину криминал,2018-09-20 13:47:00,23951627,['криминал']
4022,в чувашии на день здоровья и спорта теперь можно записаться онлайн афиша,2018-09-20 13:35:53,23951627,['афиша']
4023,двое жителей новочебоксарска тайно перевозили людей через волгу новости,2018-09-20 13:20:00,23951627,['новости']
4024,в году россияне получат второй отпуск новости,2018-09-20 13:03:01,23951627,['новости']
4025,в какую стоимость обошлись окна в дом для телеведущей давай поженимся,2018-09-20 12:00:05,23951627,[]
4026,чебоксарец поссорился со своей сожительницей и убил ее криминал,2018-09-20 11:40:00,23951627,['криминал']
4027,в шумерлинском районе более двух недель назад пропал мужчина новости,2018-09-20 11:15:01,23951627,['новости']
4028,в чебоксарах ищут мужчину который похитил несколько бутылок алкоголя и колбасу новости,2018-09-20 10:50:00,23951627,['новости']
4029,игнатьев сказал почему не сожалеет что кто то уезжает из чувашии новости,2018-09-20 10:30:03,23951627,['новости']
4030,участвуйте в розыгрыше универсальных подарков которые поднимут настроение любому другу коллеге или имениннику,2018-09-20 10:20:00,23951627,[]
