2524,в чебоксарах пройдет кастинг на конкурс топ модель чувашии афиша,2018-11-08 13:07:46,23951627,['афиша']
2525,в семейном бюджете расходы на машину играют такую же роль как расходы на нужды еще одного члена семьи вы предпочитаете быть экономным в финансовых тратах,2018-11-08 12:00:18,23951627,[]
2526,чебоксары обогнали казань в рейтинге городов где хорошо жить с детьми новости,2018-11-08 11:55:17,23951627,['новости']
2527,нарушений в действиях полицейских при оформлении дтп где задавили девочку не нашли новости,2018-11-08 11:32:00,23951627,['новости']
2528,в чувашии турецкая компания намерена построить большой склад новости,2018-11-08 11:12:00,23951627,['новости']
2529,на трассе в чувашии погибли водитель и пассажир мазды дтп,2018-11-08 10:52:00,23951627,['дтп']
2530,роспотребнадзор рассказал как не стать жертвой новогодних распродаж новости,2018-11-08 10:32:00,23951627,['новости']
2531,хочешь попасть в цирк бесплатно цирк шапито альянс сейчас проводит розыгрыш билетов на представление за репост специально для тебя в чебоксары приехал большой российский цирк шапито альянс с программой империя зрелищ не пропусти самое яркое шоу для всей семьи которое пройдет с ноября по декабря года,2018-11-08 09:35:00,23951627,[]
2532,в чебоксарах после жалоб прикрыли кафе в мтв центре новости,2018-11-08 07:40:00,23951627,['новости']
2533,замруководитель администрации главы чувашии отделался штрафом новости,2018-11-08 06:50:00,23951627,['новости']
2534,в чувашии появился новый храм в честь архангела михаила,2018-11-08 06:20:00,23951627,[]
2535,доброе утро и отличного настроения чувашия,2018-11-08 06:05:00,23951627,['чувашия']
2536,в чувашии женщина выпала из движущегося поезда и погибла,2018-11-07 22:35:00,23951627,[]
2537,в порецком районе на складе сгорели тонн зерна и техника новости,2018-11-07 22:00:09,23951627,['новости']
2538,после автокатастрофы под чебоксарами стройфирму оштрафовали на миллиона рублей новости,2018-11-07 21:30:02,23951627,['новости']
2539,,2018-11-07 20:30:04,23951627,
2540,два водителя погибли в лобовом столкновении в чувашии дтп,2018-11-07 20:13:55,23951627,['дтп']
2541,вечерний чат,2018-11-07 20:00:13,23951627,[]
2542,чувашию в четверг окутает туманная дымка погода,2018-11-07 19:40:00,23951627,['погода']
2543,в чебоксарах вне зебры сбили двух женщин дтп,2018-11-07 19:33:17,23951627,['дтп']
2544,в чувашии выпавшую из поезда женщину обнаружил машинист другого состава новости,2018-11-07 19:20:00,23951627,['новости']
2545,пара из чебоксар сыграла свадьбу на тысяч рублей в реалити шоу новости,2018-11-07 19:00:14,23951627,['новости']
2546,как вы отмечаете детские праздники вспомните много ли потом остается счастливых фотографий ребенка и его маленьких гостей,2018-11-07 18:00:04,23951627,[]
2547,кинопремьеры недели в чебоксарах зомби нацисты и русские на марсе афиша,2018-11-07 17:20:01,23951627,['афиша']
2548,галстук это нечто большее чем завершающий штрих к костюму это его неотъемлемая часть никогда не следует выбирать ткань для костюма не придумав с каким галстуком вы его будете носить,2018-11-07 17:00:03,23951627,[]
2549,игнатьев назначил нового министра образования чувашии новости,2018-11-07 16:41:00,23951627,['новости']
2550,интервью с участником русский ниндзя чувствовал себя как в игре марио новости,2018-11-07 16:21:00,23951627,['новости']
2551,в чебоксарах незаконная сауна спортклуба работала в жилом доме новости,2018-11-07 16:01:00,23951627,['новости']
2552,единственная настоящая любовь в мире это любовь к еде а главное в нашей жизни это быть с любимыми желаешь вкусно пообедать совершенно бесплатно участвуй в розыгрыше от т ван шаурма и выиграй сертификат с суммой рублей на посещение кафе переходи по ссылке и узнавай условия участия а также помни что такие розыгрыши т ван шаурма устраивает каждый день,2018-11-07 15:00:13,23951627,[]
2553,в чебоксарах осудили мужчину который изнасиловал и пленил женщину новости,2018-11-07 14:50:00,23951627,['новости']
2554,в чебоксарах на видео попало задержание водителя который устроил погоню новости,2018-11-07 14:20:01,23951627,['новости']
2555,,2018-11-07 14:00:14,23951627,
2556,в чувашии мужчина убил брата и закопал его тело во дворе криминал,2018-11-07 13:47:00,23951627,['криминал']
2557,в чувашии появился новый храм в честь архангела михаила новости,2018-11-07 13:35:00,23951627,['новости']
2558,в новочебоксарске стая собак бросается на автомобили новости,2018-11-07 13:23:00,23951627,['новости']
2559,видео от подписчика,2018-11-07 13:03:00,23951627,[]
2560,большое обновление напольных покрытий в стройцентре инком новинка немецкий ламинат сантиметров,2018-11-07 12:00:15,23951627,[]
2561,в новочебоксарске женщина отметила день рождения новости,2018-11-07 11:40:00,23951627,['новости']
2562,жители чебоксар выберут фигуру поросенка которого установят в городе новости,2018-11-07 11:20:00,23951627,['новости']
2563,в чувашии женщина выпала из движущегося поезда и погибла происшествия,2018-11-07 11:00:11,23951627,['происшествия']
2564,пропавшая летняя женщина найдена живой новости,2018-11-07 10:40:00,23951627,['новости']
2565,картину летней чебоксарки выставили в третьяковской галерее афиша,2018-11-07 10:18:00,23951627,['афиша']
2566,в чувашии в ноябре откроется охота на лося новости,2018-11-07 09:54:37,23951627,['новости']
2567,сегодня последний шанс выиграть приятные призы себе и своим близким скорее участвуй в розыгрыше,2018-11-07 09:00:02,23951627,[]
2568,в чебоксарах продолжают ходить и искать неоформленных работников в магазинах новости,2018-11-07 08:01:00,23951627,['новости']
2569,хотите одеться в теплые уютные вещи за полцены вступайте в группу,2018-11-07 07:00:03,23951627,[]
2570,в парке новочебоксарска поселятся трое из простоквашино винни и пятачок новости,2018-11-07 06:50:00,23951627,['новости']
2571,мать четырех детей поймали на камчатке чтобы заставить платить алименты,2018-11-07 06:20:00,23951627,[]
2572,доброго утро ноября жители чувашии,2018-11-07 06:05:00,23951627,[]
2573,ночной чат,2018-11-06 23:55:00,23951627,[]
2574,глава чувашии передал бразды правления другому и ушел в отпуск,2018-11-06 23:35:00,23951627,[]
2575,собираешься на праздник прихвати с собой хороший подарок выигрывай классные подарки в розыгрыше,2018-11-06 23:15:00,23951627,[]
2576,хотите чтобы день рождения запомнился надолго и при этом прошел бесплатно,2018-11-06 22:15:00,23951627,[]
2577,пять бесплатных мероприятий на этой неделе в чебоксарах афиша,2018-11-06 21:36:00,23951627,['афиша']
2578,в мариинско посадском районе почтили память жертв погибших в огне местной школы новости,2018-11-06 21:16:00,23951627,['новости']
2579,что скрывает производство натяжных потолков,2018-11-06 20:15:00,23951627,[]
2580,вечерний чат чувашия,2018-11-06 20:00:12,23951627,['чувашия']
2581,жена втайне спрятала автомобиль мужа тот заявил об угоне новости,2018-11-06 19:40:00,23951627,['новости']
2582,часто работодателю приходят штрафы наложенные органами гибдд за нарушение водителями работниками организации пдд рф при управлении автомобилями принадлежащими организации вправе ли работодатель удерживать суммы штрафов из зарплаты водителей,2018-11-06 19:20:00,23951627,[]
2583,в чебоксарах летний сын сенатора оказался обвиняемым по уголовному делу новости,2018-11-06 19:00:15,23951627,['новости']
2584,зимой на всех мостах чебоксар уменьшат максимальную скорость движения новости,2018-11-06 18:40:00,23951627,['новости']
2585,видео от подписчика,2018-11-06 18:28:56,23951627,[]
2586,везучие живут с деньгами невезучие без а негодяи для не упусти свой шанс не быть негодяем и стать везунчиком у нас проходит розыгрыш денежных призов читай условия участия в конкурсе по ссылке,2018-11-06 18:00:12,23951627,[]
2587,я никому ничего не должен и другие причины уклонения от службы в армии новости,2018-11-06 17:45:00,23951627,['новости']
2588,в чебоксарах более дней ищут пропавшую женщину новости,2018-11-06 17:23:00,23951627,['новости']
2589,игнатьев перед отпуском вызвал на лед чиновников новости,2018-11-06 17:01:00,23951627,['новости']
2590,не знаете с чего начать ремонт начали наводить красоту в квартире а дети почему то спрашивают папа а когда закончится ремонт мне сколько лет будет самостоятельная сборка мебели поклейка обоев или ремонт потолка это процесс когда вы узнаете что никакой вы не любимый дорогой и зая а безрукий муж,2018-11-06 16:00:10,23951627,[]
2591,госдума упростила получение льгот на услуги жкх новости,2018-11-06 15:47:00,23951627,['новости']
2592,на чувашию надвигается похолодание погода,2018-11-06 15:26:23,23951627,['погода']
2593,чебоксарские молодожены сразились в свадебной битве на реалити шоу афиша,2018-11-06 15:00:13,23951627,['афиша']
2594,ремонт вторичного жилья история одной квартиры,2018-11-06 14:00:11,23951627,[]
2595,жительница чувашии отправилась на камчатку лишь бы не содержать своих детей новости,2018-11-06 13:34:50,23951627,['новости']
2596,в чебоксарах мужчину осудят за истязания и изнасилования женщины новости,2018-11-06 13:00:15,23951627,['новости']
2597,в новочебоксарске один из дворов отремонтировали лишь на бумаге новости,2018-11-06 12:41:00,23951627,['новости']
2598,чебоксарец упал в воду в шаге до полуфинала в шоу русский ниндзя новости,2018-11-06 12:21:00,23951627,['новости']
2599,горожанам долгие выходные испортили курящие подростки и еда из будущего новости,2018-11-06 12:01:00,23951627,['новости']
2600,выгодные акции в стоматологии на ярмарочной вас ждут большие скидки до,2018-11-06 11:00:11,23951627,[]
2601,в чувашии продолжает наблюдаться миграционная убыль населения новости,2018-11-06 10:08:22,23951627,['новости']
2602,глава чувашии передал бразды правления другому и ушел в отпуск новости,2018-11-06 09:09:48,23951627,['новости']
2603,в чувашии создадут особо охраняемую территорию для выхухоли новости,2018-11-06 08:00:04,23951627,['новости']
2604,внес чувашию в список регионов с высоким потенциалом новости,2018-11-06 07:00:02,23951627,['новости']
2605,в чебоксарах родилась двойня с княжескими именами,2018-11-06 06:20:00,23951627,[]
2606,доброе утро пусть у вас все будет хорошо чувашия,2018-11-06 06:00:01,23951627,['чувашия']
2607,ночной чат,2018-11-05 23:55:00,23951627,[]
2608,удиви неожиданными подарками себя и своих близких участвуй в розыгрыше ценных призов,2018-11-05 22:30:01,23951627,[]
2609,в чувашии подростки показали полицейским тайник где спрятали украденное,2018-11-05 22:15:01,23951627,[]
2610,в новом городе маршрутка сбила двоих пешеходов дтп,2018-11-05 22:04:13,23951627,['дтп']
2611,участвуй в конкурсе и выигрывай приятные денежные призы подробности участия читай по ссылке,2018-11-05 21:00:07,23951627,[]
2612,вечерний чат,2018-11-05 20:00:11,23951627,[]
2613,во вторник в чувашии ожидаются дождь и туман погода,2018-11-05 19:00:14,23951627,['погода']
2614,хочешь чувствовать себя уверенно на любом празднике официальном мероприятии или в повседневной жизни одевайся стильно и красиво в магазине мужских костюмов,2018-11-05 18:00:13,23951627,[]
2615,игнатьев назначил нового руководителя минспорта чувашии новости,2018-11-05 17:00:10,23951627,['новости']
2616,в чувашском селе трое мужчин украли восемь женских курток происшествия,2018-11-05 16:00:15,23951627,['происшествия']
2617,в чувашии мамы могут получить сто тысяч рублей на открытие бизнеса новости,2018-11-05 15:00:11,23951627,['новости']
2618,в мурманске семья уверяет что их кот понимает чувашский язык новости,2018-11-05 14:00:13,23951627,['новости']
2619,алсу исполнила мечту девочки из чебоксар страдающей сложным заболеванием фото новости,2018-11-05 12:29:27,23951627,['новости']
2620,в чебоксарах задержали водителя гранты который сбил женщину и скрылся дтп,2018-11-05 11:03:25,23951627,['дтп']
2621,в чувашии подростки показали полицейским тайник где спрятали украденное происшествия,2018-11-05 10:31:31,23951627,['происшествия']
2622,в чебоксарах бизнесмен избил женщину охранника за замечание происшествия,2018-11-05 09:52:02,23951627,['происшествия']
2623,в латвии в журнале напечатали проект аэропорта чебоксар фото новости,2018-11-05 09:22:19,23951627,['новости']
2624,в чувашии появился памятник посвященный акрамовскому восстанию крестьян новости,2018-11-05 07:40:00,23951627,['новости']
2625,в чебоксарах игнатьев вспомнил историю дня народного единства новости,2018-11-05 06:40:00,23951627,['новости']
2626,в чебоксарах дворы очищают от незаконных гаражей,2018-11-05 06:25:00,23951627,[]
2627,с добрым утром понедельника если день выходной то хорошее настроение уже обеспечено,2018-11-05 06:00:02,23951627,[]
2628,ночной чат,2018-11-04 23:50:00,23951627,[]
2629,в чебоксарах летней девушке предложили работу в интернете но обогатиться ей так и не удалось,2018-11-04 22:30:01,23951627,[]
2630,чебоксарцы после установки пластиковых окон в своих домах сталкиваются с возникновения плесени на подоконниках шторах или потолках отсутствие постоянного естественного притока воздуха приводит к остановке работы всей системы вентиляции и впоследствии к возникновению некоторых проблем,2018-11-04 20:15:00,23951627,[]
2631,подписывайтесь на наш канал,2018-11-04 20:00:08,23951627,[]
2632,вечерний чат,2018-11-04 19:30:02,23951627,[]
2633,в понедельник в чувашии синоптики обещают местами туман погода,2018-11-04 19:01:00,23951627,['погода']
2634,кухня в любом доме представляет собой наиболее функциональное помещение поэтому гарнитур для нее необходимо выбирать тщательно,2018-11-04 18:00:03,23951627,[]
2635,жители чувашии считают что культура вождения в чебоксарах под угрозой деградации новости,2018-11-04 17:31:00,23951627,['новости']
2636,в чувашии доходы бюджета увеличились на новости,2018-11-04 17:01:00,23951627,['новости']
2637,мечтаете навсегда избавиться от очков и линз но все еще откладываете операцию у вас есть уникальная возможность воплотить свою мечту в реальность,2018-11-04 16:00:11,23951627,[]
2638,в чувашии полицейские накрыли автобус с нелегальными иностранцами новости,2018-11-04 15:45:00,23951627,['новости']
2639,фото с хлебом из будущего от подписчика,2018-11-04 15:30:03,23951627,[]
2640,анонс читаемых новостей за прошлую неделю в одной сборке видео,2018-11-04 15:00:10,23951627,['видео']
2641,хочется чтобы праздник ребенка прошел на высоком уровне и запомнился всем гостям и главному имениннику надолго,2018-11-04 14:00:01,23951627,[]
2642,в чебоксарах дворы очищают от незаконных гаражей новости,2018-11-04 13:58:00,23951627,['новости']
2643,в чебоксарах летней девушке предложили работу в интернете но обогатиться ей так и не удалось новости,2018-11-04 13:00:11,23951627,['новости']
2644,в чебоксарах приставы заехали в магазин и арестовали кошачий корм новости,2018-11-04 11:55:00,23951627,['новости']
2645,в чебоксарах родилась двойня с княжескими именами новости,2018-11-04 11:05:00,23951627,['новости']
2646,время утепляться ищете недорогую и качественную детскую обувь теплый пуховик,2018-11-04 10:00:04,23951627,[]
2647,большинство жителей чувашии поддерживают ужесточение закона о тишине новости,2018-11-04 09:50:00,23951627,['новости']
2648,что ждет чебоксарцев в день народного единства афиша,2018-11-04 09:00:06,23951627,['афиша']
2649,замену медицинских полисов на новые продолжат делать в следующем году новости,2018-11-04 08:05:00,23951627,['новости']
2650,возле шупашкара поставят музыкальные фонтаны,2018-11-04 07:10:00,23951627,[]
2651,в ядринском районе игнатьев посмотрел на ремонт больницы и заглянул в один из дворов,2018-11-04 06:25:00,23951627,[]
2652,доброе утро всем удачной дороги и отличного отдыха чувашия,2018-11-04 06:05:00,23951627,['чувашия']
2653,ночной чат по сообщению подписчиков,2018-11-03 23:50:00,23951627,[]
2654,в чувашии в лобовом столкновении нивы и четырнадцатой погиб человек,2018-11-03 22:30:02,23951627,[]
2655,новость от подписчицы дтп,2018-11-03 21:15:01,23951627,['дтп']
2656,у ребенка скоро день рождения поучаствуй в розыгрыше и выиграй праздник от детского развлекательного центра фунтик бесплатно,2018-11-03 20:15:00,23951627,[]
2657,вечерний чат,2018-11-03 20:00:12,23951627,[]
2658,новость от подписчика дтп,2018-11-03 19:37:37,23951627,['дтп']
2659,на чувашию надвигается порывистый ветер но станет теплее,2018-11-03 19:10:00,23951627,[]
2660,специалисты из казани из приволжского центра томотерапии сакнур приезжают в чебоксары в этом медицинском центре лучевой терапии установлен инновационный аппарат томотерапии а услуги оказываются по назначению врача онколога радиотерапевта как платно так и бесплатно,2018-11-03 18:00:04,23951627,[]
