2553,заиграево под угрозой замерзания,2018-11-22 04:02:01,107493817,[]
2554,в бурятии открытая перед выборами больница до сих пор не работает,2018-11-22 03:46:00,107493817,[]
2555,сегодня же четверг,2018-11-22 03:33:24,107493817,[]
2556,с добрым утром друзья,2018-11-22 03:10:00,107493817,[]
2557,зурхай на ноября й лунный день,2018-11-22 02:45:00,107493817,[]
2558,спокойной ночи друзья,2018-11-21 17:00:11,107493817,[]
2559,что не так в работе трудинспекции бурятии,2018-11-21 16:46:00,107493817,[]
2560,ни в чем не отказывай,2018-11-21 16:35:02,107493817,[]
2561,в бурятии нашли мумифицированное тело человека,2018-11-21 16:29:00,107493817,[]
2562,в бурятии фальсификатора выборов обязали извиниться перед избирателями,2018-11-21 16:12:01,107493817,[]
2563,мост с лифтами для маломобильных граждан будет построен в онохое,2018-11-21 15:55:00,107493817,[]
2564,преподаватель обж из бурятии стал чемпионом мира по универсальному бою,2018-11-21 15:39:00,107493817,[]
2565,народным депутатам хурала бурятии отказали в кабинете,2018-11-21 15:22:01,107493817,[]
2566,тимур цыбиков нашел себе работу в москве,2018-11-21 15:06:03,107493817,[]
2567,николай будуев атаковал минстрой бурятии,2018-11-21 14:51:00,107493817,[]
2568,спортсмен из бурятии стал бронзовым призером чемпионата россии по тхэквондо,2018-11-21 14:35:00,107493817,[]
2569,пропала беременная улан удэнка мать троих детей,2018-11-21 14:22:00,107493817,[]
2570,,2018-11-21 13:00:04,107493817,
2571,бурятию захлестнула подростковая преступность,2018-11-21 12:51:00,107493817,[]
2572,выбраковка бурятские сосиски лучшие в стране,2018-11-21 12:34:00,107493817,[]
2573,защитили от наводнения в улан удэ расчистили часть русла уды,2018-11-21 12:33:18,107493817,[]
2574,правительство бурятии утвердило новый прожиточный минимум,2018-11-21 12:16:00,107493817,[]
2575,в сети появилось видео смерча на байкале,2018-11-21 11:59:00,107493817,[]
2576,в правительстве бурятии пообещали не уничтожать лес на верхней березовке,2018-11-21 11:42:00,107493817,[]
2577,власти улан удэ отменили решение о строительстве филиала мфц в городском дворе,2018-11-21 11:25:23,107493817,[]
2578,родственники намжила нимбуева плакали на открытии бюста в болгарии,2018-11-21 10:57:26,107493817,[]
2579,за кресло главы района в бурятии поборется житель краснодарского края,2018-11-21 10:40:00,107493817,[]
2580,победа пригрозила установить габариты ручной клади х х сантиметров,2018-11-21 10:25:00,107493817,[]
2581,в улан удэ началась подготовка к строительству третьего моста через реку уда,2018-11-21 10:10:06,107493817,[]
2582,как работаем и отдыхаем в году календарь,2018-11-21 09:43:00,107493817,[]
2583,спортсменка из бурятии гарантировала медаль чемпионата мира по боксу,2018-11-21 09:26:00,107493817,[]
2584,власти бурятии продают еще два автомобиля,2018-11-21 09:08:02,107493817,[]
2585,в бурятии создан первый кооператив по лекарственному растениеводству,2018-11-21 08:51:00,107493817,[]
2586,нуждающимся семьям в бурятии дают деньги на замену проводки,2018-11-21 08:34:00,107493817,[]
2587,улан удэнцев приглашают на мясные ярмарки,2018-11-21 08:17:00,107493817,[]
2588,руководитель администрации улан удэ получил представление прокуратуры,2018-11-21 08:00:10,107493817,[]
2589,бурятии одобрили субсидированные рейсы в москву новосибирск и еще города,2018-11-21 07:44:00,107493817,[]
2590,алексея цыденова просят спасти лес на верхней березовке от китайцев,2018-11-21 07:27:00,107493817,[]
2591,в бурятии сестра взяла под опеку брата подростка,2018-11-21 07:10:00,107493817,[]
2592,в бурятии отметили всемирный день борьбы с диабетом,2018-11-21 06:52:00,107493817,[]
2593,уроженка бурятии объехала земной шар почти без денег в кармане,2018-11-21 06:35:00,107493817,[]
2594,рэпер из улан удэ хаски отыграл концерт без света и звука из за визита силовиков,2018-11-21 06:17:00,107493817,[]
2595,подходит ли боргойская баранина кремлевскому столу,2018-11-21 06:00:05,107493817,[]
2596,жители бурятии помогли родным найти дедушку спустя лет,2018-11-21 05:42:00,107493817,[]
2597,паломники со всего мира едут на прием к целителям бурятии,2018-11-21 05:25:35,107493817,[]
2598,,2018-11-21 05:23:25,107493817,
2599,не комфорт но выживание,2018-11-21 05:09:24,107493817,[]
2600,в улан удэ растет спрос на бухгалтеров,2018-11-21 04:46:21,107493817,[]
2601,в бурятии бизнесмены получали субсидии из бюджета за откат в,2018-11-21 04:25:00,107493817,[]
2602,баясхалан базаров я просто сын степей,2018-11-21 04:06:29,107493817,[]
2603,когда кто то бодрый с самого утра а тебе бы еще поспать,2018-11-21 03:35:00,107493817,[]
2604,с добрым утром прекрасного настроения на весь день,2018-11-21 03:10:00,107493817,[]
2605,зурхай на ноября й лунный день,2018-11-21 02:45:00,107493817,[]
2606,спокойной ночи приятных снов,2018-11-20 17:00:10,107493817,[]
2607,погода на завтра,2018-11-20 16:45:01,107493817,[]
2608,пожалуйста опубликуйте,2018-11-20 16:29:34,107493817,[]
2609,в бурятии дороги в школу остаются опасными для детей,2018-11-20 16:12:02,107493817,[]
2610,многодетные матери бурятии могут получить льготы,2018-11-20 15:55:00,107493817,[]
2611,в дацанах бурятии пройдет праздник тысячи лампад,2018-11-20 15:38:00,107493817,[]
2612,андрей самаринов может лишиться всех своих активов,2018-11-20 15:22:04,107493817,[]
2613,в улан удэ решили построить еще один новогодний городок,2018-11-20 15:06:08,107493817,[]
2614,идите в другое место в нашем городе игровых автоматов полно,2018-11-20 14:50:00,107493817,[]
2615,мэрия якутска продает джипы чиновников ради запуска социального такси,2018-11-20 14:35:00,107493817,[]
2616,,2018-11-20 13:00:04,107493817,
2617,гимнастки из агинского стали призерами турнира в бердске,2018-11-20 12:58:00,107493817,[]
2618,улан удэнские водители празднуют день жестянщика,2018-11-20 12:44:00,107493817,[]
2619,жителей бурятии не достигших года хотят оставить без алкоголя,2018-11-20 12:35:00,107493817,[]
2620,мвд бурятии ищет новые штрафстоянки в улан удэ,2018-11-20 12:17:01,107493817,[]
2621,тренер по брейк дансу возрождает хип хоп культуру в бурятии,2018-11-20 12:13:51,107493817,[]
2622,электронная очередь в детские сады улан удэ опять дала сбой,2018-11-20 12:00:17,107493817,[]
2623,в болгарии открыли бюст бурятского поэта намжила нимбуева,2018-11-20 11:42:00,107493817,[]
2624,николай васюткин основная борьба будет не столько за мэра улан удэ сколько за горсовет,2018-11-20 11:25:00,107493817,[]
2625,александр богомоев получил звание почетного гражданина,2018-11-20 11:08:06,107493817,[]
2626,после нового года в бурятии подорожает капремонт,2018-11-20 10:51:00,107493817,[]
2627,в железнодорожном районе улан удэ убирают металлические гаражи,2018-11-20 10:34:00,107493817,[]
2628,спортсменка из бурятии покинула чемпионат мира по боксу из за рассечения,2018-11-20 10:17:03,107493817,[]
2629,в улан удэ группа молодежи избила и ограбила прохожего,2018-11-20 09:43:00,107493817,[]
2630,минприроды рф обещает плавный старт мусорной реформы,2018-11-20 09:26:00,107493817,[]
2631,жителей улан удэ продолжают обманывать в соцсетях,2018-11-20 09:09:01,107493817,[]
2632,в х дтп в бурятии пострадали человек,2018-11-20 08:52:00,107493817,[]
2633,северный край на поющей волне,2018-11-20 08:35:00,107493817,[]
2634,бурятские борцы снялись в клипе об обязанностях мужчины,2018-11-20 08:27:34,107493817,[]
2635,личное пространство и повышенный комфорт,2018-11-20 08:03:44,107493817,[]
2636,глава в россии стал меценатом года за помощь бурятскому театру,2018-11-20 07:47:00,107493817,[]
2637,власти бурятии пообещали покончить с третьей сменой в школах через два года,2018-11-20 07:30:01,107493817,[]
2638,учитель химии из бурятии вышла в финал всероссийского конкурса,2018-11-20 07:13:52,107493817,[]
2639,повсеместно под корень улан удэнцы жалуются на вырубку деревьев,2018-11-20 07:12:49,107493817,[]
2640,фермер создал бренд молоко еравны,2018-11-20 06:41:00,107493817,[]
2641,праздник к нам приходит по улицам бурятской столицы разгуливал дед мороз,2018-11-20 06:23:04,107493817,[]
2642,огнеборцы спасли ночью человек на пожаре в улан удэ из них детей,2018-11-20 06:09:00,107493817,[]
2643,бурятии выделят почти миллиарда на строительство девяти школ,2018-11-20 05:52:00,107493817,[]
2644,в бурятии на трассе байкал в поселке сотниково ограничат движение,2018-11-20 05:35:00,107493817,[]
2645,интерактивный парк дикой природы открылся в бурятии,2018-11-20 05:18:00,107493817,[]
2646,пособие по безработице в бурятии вырастет больше чем на тысяч,2018-11-20 05:01:10,107493817,[]
2647,еще сирот в бурятии получили ключи от квартир,2018-11-20 04:35:31,107493817,[]
2648,бурятия заняла второе место в рейтинге всероссийской туристской премии маршрут года,2018-11-20 04:00:00,107493817,[]
2649,потягушки и на работу встаем,2018-11-20 03:35:00,107493817,[]
2650,с добрым утром друзья,2018-11-20 03:10:00,107493817,[]
2651,зурхай на ноября й лунный день,2018-11-20 02:45:00,107493817,[]
2652,спокойной ночи друзья,2018-11-19 17:00:16,107493817,[]
2653,в сети появилось видео прохождения ольхон трейла,2018-11-19 16:45:00,107493817,[]
2654,ноября по бурятии местами небольшой снег,2018-11-19 16:33:01,107493817,[]
2655,власти бурятии официально объявили о возврате к айдаевским временам,2018-11-19 16:18:02,107493817,[]
2656,главе бурятии подарили танку будды медицины,2018-11-19 16:02:01,107493817,[]
2657,дети из бурятии и китая исполнили песню о дружбе,2018-11-19 16:00:14,107493817,[]
2658,размер ежемесячного пособия по уходу за ребенком вырастет до тысяч,2018-11-19 15:46:00,107493817,[]
2659,в улан удэ пройдет всероссийский турнир по гиревому спорту,2018-11-19 15:45:00,107493817,[]
2660,в загорске и восточном в улан удэ отключат холодную воду,2018-11-19 15:30:03,107493817,[]
2661,в центре улан удэ в коллекторе нашли труп,2018-11-19 15:15:09,107493817,[]
2662,в бурятии выпустили клип кижинга на стихи ильи резника,2018-11-19 15:00:18,107493817,[]
2663,,2018-11-19 13:30:05,107493817,
2664,квнщики бурятии попросят дальневосточный гектар для дворца молодежи,2018-11-19 13:28:00,107493817,[]
2665,улан удэнец отсудил у сто тысяч,2018-11-19 13:15:47,107493817,[]
2666,известный таролог о бурятии вы застряли и ходите по кругу,2018-11-19 13:11:07,107493817,[]
2667,бурятский артист стал призером международного конкурса,2018-11-19 12:50:01,107493817,[]
2668,шибко мне было обидно что так начхательски отнеслись ко мне,2018-11-19 12:30:04,107493817,[]
2669,михаил яцевич записал сольный альбом улан удэ,2018-11-19 12:12:07,107493817,[]
2670,с песнями и плясками в улан удэ на месте гибели молодого человека устроили праздничное открытие нового магазина,2018-11-19 11:55:00,107493817,[]
2671,слов аж не хватало на видео видно,2018-11-19 11:43:12,107493817,[]
2672,собственник не агентство,2018-11-19 11:15:01,107493817,[]
2673,дари саханова поедет в теннисную академию в сша,2018-11-19 10:57:00,107493817,[]
2674,жительнице улан удэ заморозили все счета из за долга за водоснабжение в тысячи,2018-11-19 10:40:00,107493817,[]
2675,в улан удэ пассажир маршрутки сломал ногу в дтп,2018-11-19 10:22:00,107493817,[]
2676,мы не можем изменить все сразу юрий трутнев собирается приехать в бурятию,2018-11-19 10:05:10,107493817,[]
2677,солбон лыгденов показал эскизы боевых сцен ой сибирской,2018-11-19 09:48:00,107493817,[]
2678,названа дата празднования сагаалгана,2018-11-19 09:31:00,107493817,[]
2679,в бурятии откроется центр поддержки предпринимательства,2018-11-19 09:14:00,107493817,[]
2680,в улан удэ попрошайки осваивают безналичный прием милостыни,2018-11-19 08:57:00,107493817,[]
2681,михаил пирогов стал лауреатом престижной премии в номинации мастер сцены,2018-11-19 08:40:00,107493817,[]
2682,в улан удэ приедут иллюзионисты братья сафроновы,2018-11-19 08:23:00,107493817,[]
2683,федерация самбо бурятии наградила росгвардейцев,2018-11-19 08:06:03,107493817,[]
2684,депутаты народного хурала намерены разобраться с желтым такси,2018-11-19 07:49:00,107493817,[]
2685,жителям бурятии грозит уголовное дело за спасение краснокнижного лебедя,2018-11-19 07:32:01,107493817,[]
2686,улан удэнец убивал женщину пока ее сын был в соседней комнате,2018-11-19 07:15:00,107493817,[]
2687,обладатель балетного оскара выступил в улан удэ фоторепортаж,2018-11-19 06:58:00,107493817,[]
2688,в улан удэ назвали маршрутки с наибольшим числом нарушений,2018-11-19 06:41:00,107493817,[]
2689,глава баргузинского района бурятии спас изюбря из полыньи,2018-11-19 06:24:00,107493817,[]
2690,в улан удэ приехала таролог марианна абравитова,2018-11-19 06:07:00,107493817,[]
2691,домой пришел а там другие люди,2018-11-19 05:48:58,107493817,[]
2692,улан удэнцы старше лет дольше ищут работу,2018-11-19 05:46:45,107493817,[]
2693,киномарафон пройдет в селах бурятии,2018-11-19 05:35:00,107493817,[]
2694,ушуисты боролись за кубок золотого дракона в улан удэ фоторепортаж,2018-11-19 05:15:46,107493817,[]
2695,первый канал рассказал об анатолии михаханове,2018-11-19 04:54:00,107493817,[]
2696,с добрым утром,2018-11-19 03:10:00,107493817,[]
2697,зурхай на ноября й лунный день,2018-11-19 02:45:00,107493817,[]
2698,доброй ночи,2018-11-18 17:00:11,107493817,[]
2699,александр друзь обратился к участницам чемпионата мира по боксу из бурятии,2018-11-18 16:17:01,107493817,[]
2700,власти бурятии продают землю с гаражом за миллионов,2018-11-18 15:42:42,107493817,[]
2701,,2018-11-18 13:17:08,107493817,
2702,как в отдаленном районе бурятии развивают туризм,2018-11-18 12:35:46,107493817,[]
2703,ненасытный пенсионный фонд бурятии,2018-11-18 11:13:02,107493817,[]
2704,беги за тобой пришла мама,2018-11-18 10:55:25,107493817,[]
2705,добрый день уважаемый администратор обращаюсь к вам с огромной просьбой разместить информацию в вашей группе,2018-11-18 10:49:47,107493817,[]
2706,заблокировал клип рэпера из улан удэ хаски,2018-11-18 09:20:50,107493817,[]
2707,в улан удэ произошло дтп с участием маршрутки,2018-11-18 07:25:45,107493817,[]
2708,геннадий айдаев приходится сожалеть о впустую потерянном времени и бездарно профуканных деньгах,2018-11-18 07:23:12,107493817,[]
2709,в улан удэ произошла незаметная приватизация трамваев,2018-11-18 06:32:00,107493817,[]
2710,деньги военных утекают мимо водоканала за границу,2018-11-18 06:14:00,107493817,[]
2711,баярма и алан пэрри вся наша жизнь цирк,2018-11-18 05:55:00,107493817,[]
2712,в память о чемпионе последняя схватка юрия власко,2018-11-18 05:37:00,107493817,[]
2713,десять молодых борцов из бурятии взяли призовые места на турнире памяти юрия власко,2018-11-18 05:18:00,107493817,[]
2714,в бурятии рост тарифа на электроэнергию для бизнеса приведет к повышению цен на товары,2018-11-18 05:00:02,107493817,[]
2715,из за строительства третьего моста в улан удэ изымают земельные участки,2018-11-18 04:42:00,107493817,[]
2716,недетские испытания как живет мальчик потерявший после удара током обе руки,2018-11-18 04:15:49,107493817,[]
2717,алексей цыденов поделился видео выступления линховоин и ариунбаатара в петербурге,2018-11-18 04:00:00,107493817,[]
2718,как разбудить с утра своих питомцев,2018-11-18 03:42:00,107493817,[]
2719,с добрым воскресным утром друзья,2018-11-18 03:10:00,107493817,[]
2720,зурхай на ноября й лунный день,2018-11-18 02:45:00,107493817,[]
2721,спокойной ночи друзья,2018-11-17 17:00:10,107493817,[]
2722,погода на завтра,2018-11-17 16:58:30,107493817,[]
2723,в иркутске волонтеры исполнили мечту летней тяжелобольной женщины,2018-11-17 16:42:00,107493817,[]
2724,твоими устами мама,2018-11-17 16:30:02,107493817,[]
2725,глава бурятии путину сами себе завидуем,2018-11-17 16:02:02,107493817,[]
2726,,2018-11-17 14:00:03,107493817,
2727,родители улан удэнских дошколят недовольны распределением мест в детские сады,2018-11-17 13:17:10,107493817,[]
2728,мэр якутска решила не финансировать показ балета стоимостью миллиона рублей,2018-11-17 12:53:00,107493817,[]
2729,в бурятии из ледяного плена спасли молодого изюбра,2018-11-17 12:38:00,107493817,[]
2730,дольщики зодчего в бурятии получили обещанные квартиры,2018-11-17 12:20:01,107493817,[]
2731,в улан удэ проходит первый турнир памяти юрия власко фоторепортаж,2018-11-17 12:02:30,107493817,[]
2732,голков прокомментировал возвращение прямых выборов мэра улан удэ,2018-11-17 08:45:00,107493817,[]
2733,модно сейчас одеваться намного теплее кутюрье из парижа застрявшим в столице приангарья посвятили песенку,2018-11-17 08:28:00,107493817,[]
2734,куда можно обратиться в случаях хамства в отрасли туризма рассказала министр мария бадмацыренова,2018-11-17 08:09:02,107493817,[]
2735,еще одну больницу в бурятии оштрафовали за тесные палаты,2018-11-17 07:53:00,107493817,[]
2736,майор милиции в отставке из бурятии заявил права на обезьянник,2018-11-17 07:35:00,107493817,[]
2737,через лет скажем извините мы не выполнили,2018-11-17 07:26:00,107493817,[]
2738,в бурятии ждут памятник в честь великих сынов россии,2018-11-17 07:09:00,107493817,[]
2739,в улан удэ завершилось комплектование детских садов,2018-11-17 06:52:00,107493817,[]
2740,бурятским призерам игр дружба не достались пожизненные выплаты,2018-11-17 06:34:00,107493817,[]
2741,железнодорожный дневной экспресс иркутск улан сверхвостребован,2018-11-17 06:17:00,107493817,[]
2742,жители бурятии могут оформить дома до марта года,2018-11-17 06:00:01,107493817,[]
2743,малому и среднему бизнесу бурятии увеличат господдержку,2018-11-17 05:44:00,107493817,[]
2744,жители регионов дальнего востока смогут летать по субсидиям круглый год,2018-11-17 05:26:00,107493817,[]
