0,выходные грядут чем занять себя пермяку,2019-02-01 11:46:00,3551694,[]
1,,2019-02-01 17:05:01,3551694,
2,строительство коммунального моста через каму год,2019-02-01 16:41:00,3551694,[]
3,из перми можно будет улететь до анталии на победе,2019-02-01 16:01:00,3551694,[]
4,в школах г перми с января по февраля объявлен карантин и сейчас каждый родитель задумался чем же занять любимое чадо в этот период так чтобы время прошло не за компьютером или телевизором а с пользой для здоровья,2019-02-01 15:05:03,3551694,[]
5,срочная новость,2019-02-01 14:51:00,3551694,[]
6,в перми пройдет турнир среди любителей хоккея,2019-02-01 14:16:00,3551694,[]
7,житель прикамья обнаружил в городском парке голову человека,2019-02-01 13:31:00,3551694,[]
8,как пермь борется со снегопадом,2019-02-01 12:41:00,3551694,[]
9,коротко о погоде на горького застрял снегоуборочный камаз,2019-02-01 11:11:00,3551694,[]
10,старинные письма француженки о перми,2019-02-01 11:01:00,3551694,[]
11,,2019-02-01 10:05:05,3551694,
12,сугробы в перми не только на дорогах,2019-02-01 10:03:58,3551694,[]
13,коллапс на героев хасана,2019-02-01 09:43:27,3551694,[]
14,солнечное утро на горе колпаки,2019-02-01 09:31:00,3551694,[]
15,сегодня ночью в перми был сильный снегопад все дороги замело,2019-02-01 08:46:00,3551694,[]
16,афиша пермских театров на февраль,2019-02-01 07:42:00,3551694,[]
17,в перми объявили день бесплатной парковки из за сильных снегопадов,2019-02-01 06:42:00,3551694,[]
18,домики в поселке усьва,2019-02-01 05:16:00,3551694,[]
19,пермь вечерняя,2019-01-31 20:32:03,3551694,[]
20,пермячка намерена отсудить у перекрестка тысяч рублей из за шоколадки,2019-01-31 19:52:00,3551694,[]
21,знаменитый хоккеист владислав третьяк приглашает пермяков с по марта ледовых арены перми и краснокамска откроют двери для хоккейного турнира,2019-01-31 19:16:00,3551694,[]
22,звездное небо над лысьвой,2019-01-31 18:46:00,3551694,[]
23,автомобилистам перми рекомендуется временно пересесть на общественный транспорт,2019-01-31 17:52:00,3551694,[]
24,февраля,2019-01-31 17:12:00,3551694,[]
25,вы спросите что они делают отвечаю они напилили куски льда сделав прорубь и теперь баграми достают лед из проруби а теперь самое интересное через сек после этого кадра мужик который слева свалился в прорубь просто потерял равновесие мы бросились его вытаскивать причем я забыл про фотоаппарат схватил лопату чтобы протянуть ему но он выпрыгнул сам и при этом орал еще не надо помогать не надо наверное был в шоке его напарник предложил ему пойти переодеться но тот отказался и продолжил работать дальше его коллега как ни в чем не бывало тоже вы скажете странная история и я с вами согласен затем я ушел,2019-01-31 16:56:00,3551694,[]
26,в перми пройдут съемки передачи просто кухня,2019-01-31 16:16:00,3551694,[]
27,родителям перми рекомендуют не дарить детям подарки на выпускной в детском саду,2019-01-31 15:41:00,3551694,[]
28,в перми открылся федеральный автосервис,2019-01-31 15:05:01,3551694,[]
29,сегодня ночью на чусовском мосту перми на два года введут ограничения на движение транспорта,2019-01-31 14:46:00,3551694,[]
30,сегодня по перми прошла вторая волна эвакуаций больниц школ торговых центров из за анонимных сообщений о террористической угрозе,2019-01-31 13:52:00,3551694,[]
31,более собак редкие породы соревнования судьи из стран костюмированные ринги аджилити и море веселья все это о международной выставке собак,2019-01-31 13:05:06,3551694,[]
32,за несогласованный полет дрона над эспланадой пермяк заплатит штраф,2019-01-31 12:46:00,3551694,[]
33,малиновый закат на крестовой горе пермский край,2019-01-31 11:37:00,3551694,[]
34,знаменитый оркестр из перми стал номинантом на премию,2019-01-31 10:47:00,3551694,[]
35,сегодня танцы у ребят пермские свиристели,2019-01-31 09:42:00,3551694,[]
36,на комсомольском проспекте перми прекратят движение троллейбусы,2019-01-31 08:46:00,3551694,[]
37,января г на улицах перми было введено электрическое освещение зажглись первые фонари по ул сибирской,2019-01-31 07:37:00,3551694,[]
38,в перми пройдет первый городской обмен одеждой,2019-01-31 06:41:00,3551694,[]
39,геометрия каменных джунглей,2019-01-31 05:36:00,3551694,[]
40,в перми построят бассейн в микрорайоне вышка,2019-01-30 20:46:00,3551694,[]
41,января в перми стартуют бесплатные курсы по подготовке к тотальному диктанту,2019-01-30 18:46:00,3551694,[]
42,работы участников кубка россии по снежной и ледовой скульптуре зимний вернисаж,2019-01-30 17:42:00,3551694,[]
43,февраля в перми пройдет лыжня россии афиша,2019-01-30 16:51:00,3551694,['афиша']
44,зимний путь на гору полюд красновишерский район,2019-01-30 15:46:00,3551694,[]
45,в пермь придут сильные снегопады с последующим резким похолоданием,2019-01-30 14:51:00,3551694,[]
46,старинные фотографии представителей народов населявших пермскую губернию,2019-01-30 13:41:00,3551694,[]
47,пермячка намерена отсудить у аэропорта большое савино тыс рублей за сломанную руку,2019-01-30 12:42:00,3551694,[]
48,великорусские сказки пермской губернии,2019-01-30 11:46:00,3551694,[]
49,больше никаких пончиков в перми убрали легендарный киоск у бывшего детского мира,2019-01-30 10:52:00,3551694,[]
50,,2019-01-30 10:05:07,3551694,
51,деревенские зарисовки стандартный транспорт в селе кын завод,2019-01-30 09:42:00,3551694,[]
52,в образовательных учреждениях перми из за гриппа и орви объявлен карантин,2019-01-30 08:52:00,3551694,[]
53,как необычно поздравить детей с праздниками февраля и марта,2019-01-30 08:05:03,3551694,[]
54,знаете ли вы что в перми есть музыкальная школа для взрослых,2019-01-30 07:16:00,3551694,[]
55,,2019-01-30 06:16:00,3551694,
56,церковь покрова пресвятой богородицы в васькино пермский край фото елена соколова,2019-01-29 20:11:00,3551694,[]
57,морозный вечер в каменном городе вдалеке небо подсвечено огнями завода пао метафракс,2019-01-29 19:16:00,3551694,[]
58,в перми разрешили закрывать классы и группы в детсадах если заболели более детей,2019-01-29 18:16:00,3551694,[]
59,история перми,2019-01-29 17:31:00,3551694,[]
60,среднемесячная реальная заработная плата в прикамье выросла на,2019-01-29 16:46:00,3551694,[]
61,час пик на ленина куйбышева,2019-01-29 15:41:00,3551694,[]
62,по сообщениям очевидцев в районе столовой пятого корпуса загорелись провода пожар оперативно предотвратили пары продолжаются,2019-01-29 15:10:10,3551694,[]
63,полностью завершены подготовительные работы к строительству моста через чусовую,2019-01-29 14:46:00,3551694,[]
64,все подробности об эвакуации в перми января,2019-01-29 13:41:00,3551694,[]
65,от читателя,2019-01-29 13:01:00,3551694,[]
66,эвакуации проходят не только у нас но и например в томске там неизвестные тоже сделали массовую рассылку электронных писем специалисты подразделений фсб и мвд проверив каждый объект опровергли эти сообщения,2019-01-29 12:27:18,3551694,[]
67,как сообщили в департаменте образования города перми сегодня занятия во вторую смену во всех школах перми будут отменены в связи с анонимными сообщениями на электронную почту,2019-01-29 11:36:00,3551694,[]
68,официально,2019-01-29 11:31:00,3551694,[]
69,эвакуация в школе,2019-01-29 11:19:19,3551694,[]
70,эвакуация в тц алмаз,2019-01-29 10:58:53,3551694,[]
71,очевидцы сообщают что эвакуировали цум,2019-01-29 10:55:11,3551694,[]
72,эвакуация в ленте на героев хасана,2019-01-29 10:52:47,3551694,[]
73,от читательницы,2019-01-29 10:31:43,3551694,[]
74,пост постоянно обновляется,2019-01-29 10:17:09,3551694,[]
75,в перми и пермском крае начались массовые эвакуации из за сообщений о минировании,2019-01-29 09:56:24,3551694,[]
76,воспоминания подписчика,2019-01-29 09:16:00,3551694,[]
77,рисуем зимнюю пермь на шелке,2019-01-29 08:16:00,3551694,[]
78,лыжные базы в перми,2019-01-29 07:16:00,3551694,[]
79,величественный каменный останец чертов палец на фоне вечерних огней поселка теплая гора,2019-01-29 05:16:00,3551694,[]
80,рассвет в перми,2019-01-29 04:16:00,3551694,[]
81,пермь будний день,2019-01-28 20:33:05,3551694,[]
82,вечерняя эспланада,2019-01-28 19:31:00,3551694,[]
83,полюдов камень,2019-01-28 18:46:00,3551694,[]
84,в перми в центре города прямо напротив куйбышева человек похожий на чиновника отобрал лопаты у дворников и чистит снег,2019-01-28 18:05:08,3551694,[]
85,старокирпичный переулок хорошая фото зона в любое время года,2019-01-28 17:31:00,3551694,[]
86,от читателя,2019-01-28 16:51:00,3551694,[]
87,на этой неделе в акции день кино участвуют все фильмы кроме спасти ленинград,2019-01-28 16:05:09,3551694,[]
88,счастье не за горами родному городу перми,2019-01-28 15:37:00,3551694,[]
89,в прикамье пройдут финальные турниры крупнейшего юношеского соревнования по хоккею золотая шайба,2019-01-28 15:21:00,3551694,[]
90,пермяков приглашают взять книги из свободной библиотеки возьму почитать,2019-01-28 14:31:00,3551694,[]
91,полностью пустой камский мост спасение дрейфующих кораблей на каме,2019-01-28 13:48:14,3551694,[]
92,,2019-01-28 13:31:13,3551694,
93,в перми построят небольшой спорткомплекс рядом с экстрим парком,2019-01-28 12:46:00,3551694,[]
94,информация чп с домом на революции,2019-01-28 12:01:00,3551694,[]
95,,2019-01-28 11:05:04,3551694,
96,пермская модель наташа поли снялась для обложки журнала,2019-01-28 10:51:00,3551694,[]
97,в перми началась операция по буксировке замерзших во льду дебаркадеров,2019-01-28 10:26:06,3551694,[]
98,российские саночники семен павличенко юрий прохоров а также представители пермского края чусовляне татьяна иванова и владислав южаков победили в эстафете на чемпионате мира,2019-01-28 09:42:00,3551694,[]
99,февраля в перми пройдет выставка арт пермь,2019-01-28 08:46:00,3551694,[]
100,января исплнилось лет старейшему мотоспортсмену прикамья суворову виктору александровичу,2019-01-28 07:41:00,3551694,[]
101,наступившая неделя в перми будет теплой,2019-01-28 06:46:00,3551694,[]
102,страна блокадному ленинграду слово перми,2019-01-28 05:16:00,3551694,[]
103,послезавтра на каме,2019-01-28 04:16:00,3551694,[]
104,пермяков приглашают на международную выставку собак,2019-01-27 20:32:01,3551694,[]
105,пляж советская пермь,2019-01-27 19:41:00,3551694,[]
106,пермяк стащил семь бит спрятав их под одеждой,2019-01-27 18:52:00,3551694,[]
107,соборная площадь вид на комсомольский проспект,2019-01-27 17:42:00,3551694,[]
108,официальная информация об эвакуации дома по адресу улица революции,2019-01-27 16:50:30,3551694,[]
109,сообщение подписчика,2019-01-27 16:34:42,3551694,[]
110,трамвайный мостик в историю,2019-01-27 15:42:00,3551694,[]
111,пермячка задолжала своей дочери более тысяч рублей по алиментам,2019-01-27 14:52:00,3551694,[]
112,эвакуируют дом по адресу ул революции д рухнула плита на этаже этаж технический квартиры не повреждены,2019-01-27 14:06:55,3551694,[]
113,в главном разгрузочном коллекторе перми метров под землей,2019-01-27 13:52:27,3551694,[]
114,пермячка получила кино премию за лучший документальный фильм года,2019-01-27 12:46:00,3551694,[]
115,красавчик на велте,2019-01-27 11:42:00,3551694,[]
116,пермская актриса зоя бербер сыграла в сериале возмездие который покажут на нтв,2019-01-27 10:46:00,3551694,[]
117,всем морозный и солнечный онлайн привет с горы колпаки,2019-01-27 09:41:00,3551694,[]
118,пермякам предлагают подготовиться к тотальному диктанту на бесплатных курсах,2019-01-27 08:46:00,3551694,[]
119,поиск свидетелей врезался в три автомобиля стоявших на парковке и скрылся с места дтп,2019-01-27 07:42:00,3551694,[]
120,,2019-01-27 06:37:00,3551694,
121,зимняя чердынь красота,2019-01-26 20:42:00,3551694,[]
122,за неделю гриппом и орви в прикамье заболели тысяч человек,2019-01-26 19:37:00,3551694,[]
123,снежок под ногами скрипит солнце красиво подсвечивает чистейший искрящийся снег который лежит повсюду на полях на ветках деревьев на деревенских крышах,2019-01-26 18:42:00,3551694,[]
124,пермские чиновники против киосков перед зданиями,2019-01-26 17:41:00,3551694,[]
125,гало над городом,2019-01-26 16:37:00,3551694,[]
126,пермские красавцы,2019-01-26 15:37:00,3551694,[]
127,на чусовском мосту полностью восстановили движение после дтп с фурами,2019-01-26 14:41:00,3551694,[]
128,сказочная фотосессия в закамске,2019-01-26 13:46:00,3551694,[]
129,самая милая рубрика вновь готова радовать вас,2019-01-26 12:42:00,3551694,[]
130,на чусовском мосту опять дтп и опять там же благо без жертв,2019-01-26 11:55:30,3551694,[]
131,показывали поддельные удостоверения и грабили пенсионеров в перми осудили банду лжегазовиков,2019-01-26 11:52:00,3551694,[]
132,неизвестных исторических фактов о перми,2019-01-26 11:01:00,3551694,[]
133,кто то уже заправился реально по рублю скидывают,2019-01-26 10:05:08,3551694,[]
134,в перми собака спасла замерзавшую на улице беременную кошку,2019-01-26 09:41:00,3551694,[]
135,вот такие детские площадки раньше встречались в перми один из дворов по ул мира район ипподрома,2019-01-26 09:16:00,3551694,[]
136,ученые политеха выявят причину неприятного запаха в центре перми,2019-01-26 08:16:00,3551694,[]
137,что делать если в семье кто то гриппует,2019-01-26 07:16:00,3551694,[]
138,гостиница центральная ул сибирская архитектор морогов памятник градостроительства и архитектуры регионального значения,2019-01-26 06:16:00,3551694,[]
139,флаги на крыше здания заксобрания пермского края фото родион балков,2019-01-25 20:31:00,3551694,[]
140,ледовые скульптуры в перми фото алексей гречищев,2019-01-25 19:31:00,3551694,[]
141,почти край света фото григорий скворцов,2019-01-25 18:31:00,3551694,[]
142,в выходные в прикамье температура упадет до,2019-01-25 18:25:00,3551694,[]
143,хочешь работать на радио пройди кастинг,2019-01-25 17:30:04,3551694,[]
144,от читателя,2019-01-25 16:46:00,3551694,[]
145,в перми состоится первенство россии среди юниоров,2019-01-25 16:11:00,3551694,[]
146,место в перми в котором вы точно не были,2019-01-25 15:21:00,3551694,[]
147,пермские власти решили что нужно наказывать шумных соседей,2019-01-25 14:31:00,3551694,[]
148,привет пермь из оаэ абу даби парк феррари,2019-01-25 13:46:00,3551694,[]
149,самое милое видео дня бабушка на качелях,2019-01-25 13:01:00,3551694,[]
150,башня смерти в перми может перейти в краевую собственность мвд съедет,2019-01-25 12:11:00,3551694,[]
151,в перми начали разбирать квартиру заваленную до потолка мусором,2019-01-25 11:16:00,3551694,[]
152,от читателя,2019-01-25 10:32:57,3551694,[]
153,куда сходить в выходные афиша на и января,2019-01-25 10:16:00,3551694,[]
154,в этом году пять мостов прикамья ждет капремонт,2019-01-25 09:16:00,3551694,[]
155,а что вы ждете в перми,2019-01-25 08:16:00,3551694,[]
156,в одном из крупнейших торговых центров перми прошла социальная акция мчс,2019-01-25 07:16:00,3551694,[]
157,парк горького со стороны ул сибирской,2019-01-25 06:16:00,3551694,[]
158,морозное утро в поселке теплая гора пермский край,2019-01-25 05:16:00,3551694,[]
159,зимний вечер в поселке бисер,2019-01-24 22:05:32,3551694,[]
160,шаржи на известных политических деятелей и коммерсантов пермского края,2019-01-24 21:01:00,3551694,[]
161,котята в пермском зоопарке,2019-01-24 20:08:35,3551694,[]
162,сегодня угол ул ленина и борчанинова фото михаил чепкасов,2019-01-24 18:46:30,3551694,[]
163,хоть поверьте друзья хоть проверьте,2019-01-24 18:31:00,3551694,[]
164,так начался мой первый поход было очень холодно в лесу мы жили там дня после этого я еще больше полюбил фотографию и хотел еще больше путешествовать,2019-01-24 17:46:00,3551694,[]
165,в перми проводят историческую экскурсию на ретро поезде пермь левшино,2019-01-24 17:01:00,3551694,[]
166,побег двух дебаркадеров и теплохода на каме фото алексей новиков,2019-01-24 16:11:00,3551694,[]
167,жена пермского депутата предоставляет львенка в аренду для фотосессий,2019-01-24 15:26:00,3551694,[]
168,пермяки реже жителей других городов покупают натуральные шубы заявили эксперты авито,2019-01-24 14:30:04,3551694,[]
169,из за сильных морозов школьники могут пропускать уроки,2019-01-24 13:31:00,3551694,[]
170,над пермью долго кружит самолет что это,2019-01-24 12:46:00,3551694,[]
171,в перми заработает автошкола для людей с ограниченными возможностями здоровья,2019-01-24 12:16:00,3551694,[]
172,,2019-01-24 11:30:02,3551694,
173,в березниках по городу бегают лисы видео,2019-01-24 11:11:00,3551694,[]
174,пермячка выиграла лыжную гонку на км на молодежном чемпионате мира,2019-01-24 10:31:00,3551694,[]
175,успевайте посетить,2019-01-24 09:41:00,3551694,[]
176,в прикамье готовятся к массовому отстрелу волков,2019-01-24 08:42:00,3551694,[]
177,памятка которая поможет оперативно оказать информационную помощь бездомному,2019-01-24 07:46:00,3551694,[]
178,общественники считают что в перми вырубят га леса и построят трк что говорят власти,2019-01-24 06:42:00,3551694,[]
179,композиция штука интересная смотришь на картинку и думаешь одно другому мешает проходит время да нет одно другого притягивает,2019-01-24 05:37:00,3551694,[]
180,в перми построят мостовой переход от вышки до садового,2019-01-23 20:41:00,3551694,[]
