1275,в новочебоксарске незаконно исполнили хиты и афиша,2018-12-19 13:16:00,23951627,['афиша']
1276,на ядринском шоссе при столкновении с калиной погибла женщина дтп,2018-12-19 13:01:00,23951627,['дтп']
1277,суперцена на хит продаж роскошные межкомнатные царговые двери под ключ за рублей в стройцентре инком,2018-12-19 12:00:18,23951627,[]
1278,никита тенче готовит документы для мирового кочевья с семьей новости,2018-12-19 11:55:00,23951627,['новости']
1279,в чувашии поменяли систему и размер тарифа на ж д транспорте новости,2018-12-19 11:41:28,23951627,['новости']
1280,фото от подписчика,2018-12-19 10:50:00,23951627,[]
1281,в чебоксарах девочку нарекли английским именем новости,2018-12-19 10:32:00,23951627,['новости']
1282,новый год замечательный повод подарить близким радость и напомнить им о том как сильно вы их любите для этого не обязательно быть волшебником достаточно заказать подходящие подарочки в лаборатории подарков которые сами по себе настоящее чудо,2018-12-19 09:30:02,23951627,[]
1283,жители северо западного района просят изменить схему движения и маршрутов новости,2018-12-19 09:12:39,23951627,['новости']
1284,действительно важные новости чувашии доступны в подписке на рассылку вам будут приходить сообщения не часто и не без повода подписывайтесь и не пропустите громкие события,2018-12-19 08:54:59,23951627,[]
1285,новогодний мастер класс концерт выставки среда может и должна быть полна ярких эмоций и позитивных впечатлений смотрите краткий обзор событий которые пройдут сегодня в чебоксарах,2018-12-19 08:33:15,23951627,[]
1286,в чебоксарах прикрыли частный детсад из за антисанитарии новости,2018-12-19 07:40:00,23951627,['новости']
1287,в чебоксарах летний мужчина инвестировал в мошенников полмиллиона рублей новости,2018-12-19 06:50:00,23951627,['новости']
1288,глава республики раскритиковал работы регионального оператора по вывозу мусора,2018-12-19 06:25:00,23951627,[]
1289,доброго морозного утра,2018-12-19 06:05:00,23951627,[]
1290,ночной чат,2018-12-18 23:50:00,23951627,[]
1291,большие скидки на одежду для мужчин женщин и детей от до в магазинах улицы лондона,2018-12-18 22:30:01,23951627,[]
1292,игнатьев взял себе молодую помощницу с двумя образованиями,2018-12-18 22:05:00,23951627,[]
1293,смотрите самые актуальные новости за декабря в формате видео видео,2018-12-18 21:15:00,23951627,['видео']
1294,компания репа разыгрывает натяжной потолок стоимостью рублей за репост,2018-12-18 20:15:01,23951627,[]
1295,вечерний чат,2018-12-18 20:00:14,23951627,[]
1296,в чувашии в среду синоптики обещают более крепкий мороз погода,2018-12-18 19:45:00,23951627,['погода']
1297,игнатьев взял на работу еще одну журналистку новости,2018-12-18 19:15:51,23951627,['новости']
1298,,2018-12-18 18:45:00,23951627,
1299,посетила салон красоты и решила осветлить волосы услугой я осталась довольна но осветляющий раствор попал на дорогую блузку испортив ее я обратилась к руководителю с требованием о возмещении стоимости одежды но получила отказ руководитель мотивировал это тем что услуга оказана качественно неужели я не имею права на возмещение стоимости блузки народныйконтроль,2018-12-18 18:25:00,23951627,['народныйконтроль']
1300,фото от подписчика,2018-12-18 17:34:30,23951627,[]
1301,сколько мандаринов можно купить на среднюю зарплату в чувашии новости,2018-12-18 17:15:24,23951627,['новости']
1302,появилось видео момента наезда троллейбуса на женщину дтп,2018-12-18 16:55:00,23951627,['дтп']
1303,чебоксарская певица исполнила новогоднее желание четверых детей новости,2018-12-18 16:31:45,23951627,['новости']
1304,жителей чебоксар призывают запускать фейерверки в строго отведенных местах новости,2018-12-18 15:55:37,23951627,['новости']
1305,проводник поезда ответит за выпадение женщины из вагона новости,2018-12-18 15:40:00,23951627,['новости']
1306,наезд на ребенка в чебоксарах полицейский назвал простым зарабатыванием денег новости,2018-12-18 15:20:01,23951627,['новости']
1307,в чувашии с нового года вырастет сумма платы за вывоз мусора новости,2018-12-18 14:57:00,23951627,['новости']
1308,в чебоксарах рядом с театром оперы и балета появится новая дорога новости,2018-12-18 14:37:23,23951627,['новости']
1309,в чебоксарах женщина вышла на дорогу и погибла под троллейбусом дтп,2018-12-18 14:09:43,23951627,['дтп']
1310,в чувашии работникам не выплатили зарплату на миллионов рублей новости,2018-12-18 13:45:00,23951627,['новости']
1311,в новочебоксарске завели второе уголовное дело по факту смерти утонувшего в бассейне ребенка новости,2018-12-18 13:22:00,23951627,['новости']
1312,начни новой год с новых возможностей прибавь автомобилю мощности от до а на турбированных двигателях до это положительно повлияет на динамику разгона,2018-12-18 12:20:00,23951627,[]
1313,пострадавшая в дтп в шумерлинском районе скончалась в больнице дтп,2018-12-18 12:05:03,23951627,['дтп']
1314,в чувашии чиновник скрыл свои доходы чтобы занять высокую должность новости,2018-12-18 11:55:55,23951627,['новости']
1315,в дтп на проспекте мира пострадали летние парень и девушка дтп,2018-12-18 11:25:12,23951627,['дтп']
1316,власти выставили на торги госпредприятие чувашхлебопродукт новости,2018-12-18 10:33:04,23951627,['новости']
1317,жительнице чебоксар позвонил военный и выманил у нее тысяч рублей новости,2018-12-18 09:49:43,23951627,['новости']
1318,игнатьев взял себе молодую помощницу с двумя образованиями новости,2018-12-18 09:12:43,23951627,['новости']
1319,интервью с победителем в фотоконкурсе братья ваш конкурс сплотил нас еще больше конкурс,2018-12-18 07:40:00,23951627,['конкурс']
1320,глава республики раскритиковал работы регионального оператора по вывозу мусора новости,2018-12-18 06:50:00,23951627,['новости']
1321,в чебоксарах избавляются от брошенных гаражей,2018-12-18 06:25:00,23951627,[]
1322,доброе утро соблюдайте правила безопасности на дороге чтобы утро было точно добрым не торопитесь чтобы везде успеть чувашия,2018-12-18 06:05:00,23951627,['чувашия']
1323,ночной чат,2018-12-17 23:59:39,23951627,[]
1324,девушке из чувашии не удалось завоевать титул мисс вселенная,2018-12-17 23:28:23,23951627,[]
1325,скоро новый год пора задуматься о подарках своим любимым и близким,2018-12-17 22:00:08,23951627,[]
1326,смотрите видеообзор за декабря видео,2018-12-17 20:33:00,23951627,['видео']
1327,вечерний чат,2018-12-17 20:00:17,23951627,[]
1328,утром и ночью в чувашии ожидается туман погода,2018-12-17 19:30:03,23951627,['погода']
1329,в шумерле жители задыхаются от горящей свалки новости,2018-12-17 19:01:00,23951627,['новости']
1330,в чебоксарах автосалон сливает автомобили с сумасшедшей выгодой,2018-12-17 18:00:16,23951627,[]
1331,в аварии в шумерлинском районе столкнулись автомобиля дтп,2018-12-17 16:55:00,23951627,['дтп']
1332,декабря в школе проходила учебная пожарная тревога дети младших классов вышли и стояли на улице без верхней одежды а на дворе зима даже старшеклассники были одеты как так можно народныйконтроль,2018-12-17 16:30:08,23951627,['народныйконтроль']
1333,в детских садах чувашии разрешат выбирать язык образования для детей новости,2018-12-17 15:21:13,23951627,['новости']
1334,изменение маршрутов транспорта в чебоксарах могут выставить на голосование новости,2018-12-17 15:01:00,23951627,['новости']
1335,в преддверии нового года компания натяжных потолков комфорт проводит новый розыгрыш в котором вы можете выиграть бесплатную установку натяжного потолка,2018-12-17 14:00:13,23951627,[]
1336,новость от подписчика,2018-12-17 13:36:31,23951627,[]
1337,игнатьев подписал указ о повышении платы на коммунальные услуги новости,2018-12-17 13:22:00,23951627,['новости']
1338,в чувашии хотят запретить продавать подросткам электронные сигареты новости,2018-12-17 13:01:00,23951627,['новости']
1339,как сделать ремонт и не развестись,2018-12-17 12:00:18,23951627,[]
1340,в чебоксарах избавляются от брошенных гаражей новости,2018-12-17 11:58:30,23951627,['новости']
1341,девушке из чувашии не удалось завоевать титул мисс вселенная новости,2018-12-17 11:20:58,23951627,['новости']
1342,в чебоксарах пьяный полицейский за рулем наехал на летнего мальчика дтп,2018-12-17 11:11:39,23951627,['дтп']
1343,выпускников и классов ожидают новые правила сдачи гиа и егэ новости,2018-12-17 10:48:54,23951627,['новости']
1344,игнатьев на встрече с жителями аликовского района нам важно чтобы в селах и деревнях оставалась молодежь новости,2018-12-17 10:00:19,23951627,['новости']
1345,квартиры в центре чебоксар с дизайнерским ремонтом без первоначального взноса за рублей в месяц,2018-12-17 09:00:03,23951627,[]
1346,новость от подписчика,2018-12-17 08:51:14,23951627,[]
1347,ремонт дороги по лапсарскому проезду оценили в миллиона рублей новости,2018-12-17 07:45:00,23951627,['новости']
1348,три недели не вывозят мусор а реформу приняли поселок вурнары улица иларионова б народныйконтроль,2018-12-17 07:30:01,23951627,['народныйконтроль']
1349,в новочебоксарске полицейские помогли женщине растерянно стоявшей на улице новости,2018-12-17 06:50:00,23951627,['новости']
1350,доброе утро чувашия до нового года ровно две недели всем удачного понедельника,2018-12-17 06:05:00,23951627,['чувашия']
1351,ночной чат,2018-12-16 23:50:00,23951627,[]
1352,в аварии в ибресинском районе пострадало семь человек,2018-12-16 23:31:00,23951627,[]
1353,у жителей чувашии появилась возможность совершать сделки на московской бирже без комиссии с помощью уникальной услуги,2018-12-16 22:30:00,23951627,[]
1354,в конкурсе братья определился победитель конкурс,2018-12-16 21:20:00,23951627,['конкурс']
1355,фото от подписчика,2018-12-16 20:55:00,23951627,[]
1356,фото от подписчика,2018-12-16 20:30:04,23951627,[]
1357,вечерний чат,2018-12-16 20:15:01,23951627,[]
1358,видео от подписчика,2018-12-16 20:00:18,23951627,[]
1359,продолжается регистрация на розыгрыш кнаппера напольное зеркало стоимостью рублей от службы доставки,2018-12-16 19:00:05,23951627,[]
1360,в чувашии в понедельник синоптики почти не обещают снега новости,2018-12-16 18:00:13,23951627,['новости']
1361,девушка из чебоксар готовится к финалу мисс вселенная новости,2018-12-16 17:37:10,23951627,['новости']
1362,фото от подписчика,2018-12-16 17:00:00,23951627,[]
1363,игнатьев поделился планами реконструкции аэропорта чебоксар с замминистром россии по транспорту новости,2018-12-16 16:00:15,23951627,['новости']
1364,фото от подписчика,2018-12-16 15:30:03,23951627,[]
1365,жители северо западного района просят изменить схему движения маршрута новости,2018-12-16 15:03:01,23951627,['новости']
1366,присоединяйтесь к конкурсу репостов и получайте призы от канала,2018-12-16 14:00:04,23951627,[]
1367,количество жителей чувашии сократится к году новости,2018-12-16 13:35:00,23951627,['новости']
1368,в аварии в ибресинском районе пострадало семь человек дтп,2018-12-16 13:02:04,23951627,['дтп']
1369,знакомые на улицах города удивляются почему вы с ними не здороваетесь или смотрите как будто в чем то подозреваете думаете что плохое зрение развивает фантазию лазерная коррекция глаз заставит вас передумать,2018-12-16 12:00:03,23951627,[]
1370,житель канаша ждет суда за убийство работницы железной дороги криминал,2018-12-16 11:35:00,23951627,['криминал']
1371,большинство жителей чувашии поддерживают идею о продаже алкоголя с года новости,2018-12-16 11:03:02,23951627,['новости']
1372,в чебоксарах продавщица вытолкнула мужчину из магазина за попытку сделать фото новости,2018-12-16 10:32:00,23951627,['новости']
1373,говорят под новый год что ни пожелаешь крутой смартфон может достаться тебе абсолютно бесплатно фирменный магазин в чебоксарах щедро наградит одного из своих подписчиков,2018-12-16 09:30:00,23951627,[]
1374,в чувашии большая семья с тремя детьми лишилась дома происшествия,2018-12-16 09:00:05,23951627,['происшествия']
1375,жители юго западного района просят запустить троллейбус,2018-12-16 08:32:00,23951627,[]
1376,чиновники ходят по квартирам с полицейскими в поиске съемного жилья,2018-12-16 07:07:00,23951627,[]
1377,бывшему замминистру образования чувашии вынесли приговор за запрещенную технику на егэ,2018-12-16 06:25:00,23951627,[]
1378,доброго светлого воскресенья жители чувашии,2018-12-16 06:05:00,23951627,[]
1379,ночной чат,2018-12-15 23:50:00,23951627,[]
1380,новость от подписчика дтп,2018-12-15 23:15:00,23951627,['дтп']
1381,чебоксарке пришло письмо о наследстве от богатого покойного родственника,2018-12-15 23:00:04,23951627,[]
1382,выбираем правильные подарки к новому году,2018-12-15 22:00:03,23951627,[]
1383,в чебоксарах в водитель нарушал правила пдд ездил боком возле остановки пригородный вокзал народныйконтроль,2018-12-15 21:34:00,23951627,['народныйконтроль']
1384,вот такая гора мусора накопилась у дома по улице воинов интернационалистов в новочебоксарске платим а мусор не вывозят почему,2018-12-15 21:00:09,23951627,[]
1385,вечерний чат из сообщений,2018-12-15 20:00:16,23951627,[]
1386,будьте осторожны не доверяйте фальшивооконщикам,2018-12-15 19:00:09,23951627,[]
1387,в воскресенье в чувашии станет немного теплее,2018-12-15 18:02:02,23951627,[]
1388,подыщите себе занятие по душе и сделайте так чтобы оно принесло вам доход потому что бизнесмен смесь танцора с калькулятором а совместить приятное с полезным в выходной вам очень просто оцените новое увлекательное интервью с предпринимателем станиславом басниковым из чебоксар на канале,2018-12-15 17:00:08,23951627,[]
1389,в чебоксарах устроят новогодние елки для малоимущих афиша,2018-12-15 16:22:00,23951627,['афиша']
1390,чиновники составили договор с перевозчиком по чебоксарам с ошибками новости,2018-12-15 15:32:36,23951627,['новости']
1391,новость от подписчицы дтп,2018-12-15 15:00:14,23951627,['дтп']
1392,прокуратура указала администрации новочебоксарска на мусор новости,2018-12-15 14:40:36,23951627,['новости']
1393,пожар в чебоксарском районе обернулся гибелью человека происшествия,2018-12-15 14:10:01,23951627,['происшествия']
1394,бывшему замминистру образования чувашии вынесли приговор за запрещенную технику на егэ политика,2018-12-15 13:40:00,23951627,['политика']
1395,продавцы в маленьких магазинах чебоксар подвергаются налоговым проверкам новости,2018-12-15 13:00:14,23951627,['новости']
1396,,2018-12-15 12:00:08,23951627,
1397,в чебоксарах новогодние события начнутся в стиле щелкунчика и холодного сердца афиша,2018-12-15 11:41:50,23951627,['афиша']
1398,в чувашии произошла массовая авария с участием четырех машин дтп,2018-12-15 11:10:17,23951627,['дтп']
1399,сейчас в самом разгаре идет голосование в конкурсе братья конкурс,2018-12-15 10:57:06,23951627,['конкурс']
1400,чебоксарке пришло письмо о наследстве от богатого покойного родственника новости,2018-12-15 10:14:59,23951627,['новости']
1401,обращение к горожанам,2018-12-15 09:48:01,23951627,[]
1402,в новочебоксарске должников лишают горячей воды новости,2018-12-15 07:40:00,23951627,['новости']
1403,настоящие брендовые вещи джинсы и куртки обувь брюки и многое другое можно купить в чебоксарах а конкретно здесь,2018-12-15 07:00:04,23951627,[]
1404,замминистра россии по транспорту похвалил игнатьева за аэропорт новости,2018-12-15 06:50:00,23951627,['новости']
1405,в чебоксарах прикрыли бургерную из за значительных нарушений,2018-12-15 06:20:00,23951627,[]
1406,доброе утро пора вставать на лыжи чувашия,2018-12-15 06:05:00,23951627,['чувашия']
1407,ночной чат,2018-12-14 23:50:00,23951627,[]
1408,чебоксарка на мисс вселенной прошла этап дефиле в купальнике,2018-12-14 22:40:00,23951627,[]
1409,сморите видеообзор новостей за декабря видео,2018-12-14 22:00:12,23951627,['видео']
1410,мировой рекорд попыток сдачи на права принадлежит жительнице южной кореи чха са сунн теорию она смогла сдать только с раза но впереди еще практический экзамен если вы желаете научиться хорошо ездить и с уверенностью сдать экзамены добро пожаловать в автошколу веста,2018-12-14 21:00:06,23951627,[]
1411,чебоксарские мужчины рыбачат на кромке льда прямо у воды новости,2018-12-14 20:30:03,23951627,['новости']
1412,вечерний чат,2018-12-14 20:00:17,23951627,[]
1413,задержанному вице премьеру чувашии избрали меру пресечения политика,2018-12-14 19:51:33,23951627,['политика']
1414,,2018-12-14 18:45:00,23951627,
1415,чебоксарку пригласили на новогодний выпуск давай поженимся новости,2018-12-14 18:13:23,23951627,['новости']
