1276,надымили в перми оштрафовали кальян бар на тыс руб после жалоб жильцов дома,2018-11-29 17:22:02,3551694,[]
1277,в пермском крае человек воспользовались поддержкой властей при переходе на цифровое телевидение,2018-11-29 16:44:23,3551694,[]
1278,новые новогодние инсталляции на улицах перми,2018-11-29 16:17:01,3551694,[]
1279,бдительный житель прикамья сфотографировал незаконный сброс мусора нарушителей оштрафовали на тысяч,2018-11-29 15:52:00,3551694,[]
1280,в перми пройдет краевой семейный форум,2018-11-29 15:11:02,3551694,[]
1281,в центре перми построят поликлинику за млн рублей,2018-11-29 14:56:00,3551694,[]
1282,год назад я приехал в каменный город со своими друзьями полюбоваться видом пощелкать камерой смартфона отдохнуть,2018-11-29 14:31:00,3551694,[]
1283,два мощных метеорных потока и солнцестояние что можно будет увидеть в небе над прикамьем в декабре,2018-11-29 13:56:00,3551694,[]
1284,,2018-11-29 13:17:00,3551694,
1285,салют в честь зажжения главной новогодней елки перми,2018-11-29 12:56:00,3551694,[]
1286,в перми на выходные ограничат движение на коммунальном мосту,2018-11-29 12:31:12,3551694,[]
1287,при въезде на южную дамбу в перми нас встречает плакат оптимистического содержания с жизнерадостным мальчиком,2018-11-29 11:37:00,3551694,[]
1288,жительница перми отдала почку своей сестре,2018-11-29 10:37:00,3551694,[]
1289,история поселка юг,2018-11-29 09:41:00,3551694,[]
1290,на дороги пермского края планируется направить около млрд рублей за три года,2018-11-29 08:33:00,3551694,[]
1291,в пермском крае родители отсудили у детского сада тыс руб за сломанный зуб ребенка,2018-11-29 07:41:00,3551694,[]
1292,пермяки стали чемпионами европы по каратэ до сетокан,2018-11-29 06:36:00,3551694,[]
1293,письмо подписчика,2018-11-29 05:17:00,3551694,[]
1294,зажжение главной новогодней елки в перми и салют,2018-11-29 04:32:00,3551694,[]
1295,красота на соборной площади,2018-11-28 21:37:00,3551694,[]
1296,в перми арестовали вежливого насильника,2018-11-28 20:41:00,3551694,[]
1297,проект о путешествиях по пермскому краю представили на встрече со студентами,2018-11-28 19:37:00,3551694,[]
1298,сегодня на площади у театра театра главный дед мороз страны торжественно зажег главную городскую елку,2018-11-28 18:26:40,3551694,[]
1299,в перми реализуют инициатив горожан на миллионов руб,2018-11-28 17:42:00,3551694,[]
1300,приглашаем на культура декабря с до в центральном выставочном зале комсомольский проспект,2018-11-28 17:05:18,3551694,[]
1301,пермский турист запускает школу выживания для детей,2018-11-28 16:41:00,3551694,[]
1302,суксун,2018-11-28 15:33:01,3551694,[]
1303,неравнодушный пермяк обустраивает лыжную трассу,2018-11-28 14:37:00,3551694,[]
1304,воспоминания подписчика сообщества история перми,2018-11-28 13:41:00,3551694,[]
1305,в пермь приехал главный дед мороз страны и встретился с детьми,2018-11-28 12:51:00,3551694,[]
1306,прямо сейчас пожар индустриальный район частный сектор за столицей,2018-11-28 12:22:00,3551694,[]
1307,пейзаж в лысьвенском районе,2018-11-28 12:06:03,3551694,[]
1308,,2018-11-28 11:05:06,3551694,
1309,они портят облик города пермский общественник раскритиковал новые киоски на компросе,2018-11-28 10:33:01,3551694,[]
1310,новый арт в одном из ночных клубов города,2018-11-28 09:41:00,3551694,[]
1311,к концу недели в прикамье ожидается похолодание ниже градусов,2018-11-28 08:33:00,3551694,[]
1312,вечернее свидание с зоей бербер купили за тысяч рублей,2018-11-28 06:42:00,3551694,[]
1313,холодное утро на каме,2018-11-28 05:17:00,3551694,[]
1314,в перми полиция сорвала концерт группы,2018-11-27 22:22:14,3551694,[]
1315,трасса прямо на эспланаде в центре перми пройдет первый городской лыжный спринт,2018-11-27 20:32:02,3551694,[]
1316,в те далекие безусые года начала ых через станцию пермь проходило два шмоточных фирменных поезда пекин москва и улан батор москва,2018-11-27 19:42:00,3551694,[]
1317,вечерняя прогулка в черняевском лесопарке,2018-11-27 18:47:00,3551694,[]
1318,в перми должникам ставят заглушки на канализацию,2018-11-27 18:17:02,3551694,[]
1319,на соборной площади сегодня,2018-11-27 17:47:00,3551694,[]
1320,применение умных технологий помогло избежать крупных лесных пожаров в прикамье в этом году,2018-11-27 16:36:00,3551694,[]
1321,когда дети уже легли спать в сугроб на них выскочил лось и это их спасло они начали двигаться,2018-11-27 15:57:00,3551694,[]
1322,житель краснокамска купил больничный лист и уехал на две недели в отпуск,2018-11-27 15:17:01,3551694,[]
1323,в рамках проекта не сиди дома пермский край разработаны молодежных маршрутов выходного дня в чусовом,2018-11-27 14:17:03,3551694,[]
1324,учащиеся из перми представили необычные шпаргалки на выставке в екатеринбурге,2018-11-27 13:46:00,3551694,[]
1325,в перми в корпусе пгниу произошел пожар студентов эвакуировали,2018-11-27 13:16:30,3551694,[]
1326,арт объект из влагостойкой фанеры новое счастье не за горами будет антивандальным,2018-11-27 12:41:00,3551694,[]
1327,в пермском крае пройдет предновогодняя акция оливьепочтой для детей,2018-11-27 11:46:00,3551694,[]
1328,главный дед мороз страны зажжет огни на центральной городской елке,2018-11-27 10:51:00,3551694,[]
1329,пролетая над пермью,2018-11-27 10:12:00,3551694,[]
1330,пермь вошла в десятку курящих городов россии правда в нашем городе опросили всего человек,2018-11-27 08:33:00,3551694,[]
1331,пермь украшается к новогодним праздникам светодиодными конструкциями,2018-11-27 07:52:00,3551694,[]
1332,как экономить на кино,2018-11-27 07:03:00,3551694,[]
1333,максимально белый пост из заснеженного пермского края,2018-11-27 06:37:00,3551694,[]
1334,в балатовском парке горки сделали люди уже катаются,2018-11-26 21:36:00,3551694,[]
1335,новая интерактивная панорама города,2018-11-26 20:32:00,3551694,[]
1336,пропавший житель башкирии месяц скитался по перми собирая деньги на билет,2018-11-26 19:37:00,3551694,[]
1337,житель чайковского артем степанов одержал победу в профессиональном турнире мировой серии по кикбоксингу к в китайском городе чженчжоу,2018-11-26 18:47:00,3551694,[]
1338,как можно мыть своего ребенка в такой воде при этом каждый месяц я плачу за горячее и холодное водоснабжение в месяц потом мы удивляемся почему наши детки болеют так часто,2018-11-26 18:16:00,3551694,[]
1339,у нее сотрясение она боится вылезти из под одеяла в прикамье одноклассники избили девочку,2018-11-26 17:33:00,3551694,[]
1340,ноября состоится пермский краевой общественный форум это ежегодная коммуникационная площадка для общения представителей власти бизнеса науки и экспертного сообщества для обмена опытом,2018-11-26 16:30:03,3551694,[]
1341,оленья застава пермский край,2018-11-26 16:12:00,3551694,[]
1342,тысячи в месяц жители перми оценили свое счастье в рублях,2018-11-26 15:37:00,3551694,[]
1343,надоели пьяные дискотеки во дворе по ночам в магазине торгуют алкоголем из под прилавка продают спиртное детям,2018-11-26 14:33:00,3551694,[]
1344,в библиотеке горького хотят взять на работу кота из приюта,2018-11-26 13:37:00,3551694,[]
1345,в пермской галерее открылась выставка об освоении севера,2018-11-26 12:51:00,3551694,[]
1346,чтобы сердце не остановилось пермские ученые создают улучшенные материалы для имплантатов,2018-11-26 11:56:35,3551694,[]
1347,сколько лет нужно копить на квартиру в перми где пермяки чаще всего покупают недвижимость какой район самый популярный для ипотеки,2018-11-26 11:05:03,3551694,[]
1348,зимняя сказка на усьве,2018-11-26 10:52:00,3551694,[]
1349,к середине недели в пермском крае ожидаются двадцатиградусные морозы,2018-11-26 10:02:04,3551694,[]
1350,тысяч пермяков не в состоянии выплатить кредиты а до заемщиков берут новые займы чтобы погасить старые автор п журнала экономист ольга сердюкова дала советы как не оказаться в долговой яме подпишитесь на рассылку чтобы получать больше лайфхаков и полезных историй,2018-11-26 09:05:02,3551694,[]
1351,коллаж с пермскими наличниками,2018-11-26 08:41:00,3551694,[]
1352,почему елку на эспланаде зовут галина леонидовна,2018-11-26 08:16:00,3551694,[]
1353,год угол ленина плеханова да да раньше по ленина ходили трамваи трамвай проедет еще квартал вперед и свернет направо на толмачева,2018-11-26 07:16:00,3551694,[]
1354,сказочная дорога пролетарский м р фото евгений зубов,2018-11-26 05:21:00,3551694,[]
1355,нашлись,2018-11-25 23:38:39,3551694,[]
1356,пермяки уже открыли горнолыжный сезон фото,2018-11-25 20:21:01,3551694,[]
1357,пермяк не смог выиграть шоу на первом канале русский ниндзя но был в финале,2018-11-25 19:22:34,3551694,[]
1358,от подписчика,2018-11-25 18:31:00,3551694,[]
1359,ноября г на пермской ярмарке состоялась международная выставка кошек особой симпатией пользовались бенгалы,2018-11-25 17:41:00,3551694,[]
1360,в губахе разработаны туристические маршруты для молодежи рассчитанные на один два дня,2018-11-25 17:01:00,3551694,[]
1361,в перми из за неочищенных дорог произошло дтп с участием почти десяти машин,2018-11-25 16:31:00,3551694,[]
1362,в этом году ледовый городок в центре перми обойдется в млн рублей,2018-11-25 15:31:00,3551694,[]
1363,в рождество пермский театр театр станет полотном для музыкально светового шоу видеомэппинг,2018-11-25 14:31:00,3551694,[]
1364,приятного дня пермь,2018-11-25 13:31:00,3551694,[]
1365,выбираем лучшее фото перми за август года,2018-11-25 12:31:00,3551694,[]
1366,на подростка из прикамья завели уголовное дело за то что он взял кошелек с лавочки,2018-11-25 11:31:00,3551694,[]
1367,в перми в жилом доме прогремел взрыв эвакуировали человек что известно на данный момент,2018-11-25 10:31:00,3551694,[]
1368,,2018-11-25 09:42:00,3551694,
1369,умрет до конца недели не сегодня так завтра повторяли маме врачи на протяжении года,2018-11-25 09:17:00,3551694,[]
1370,знаменитый певец сергей лазарев обнаружил герб своего рода в пермском музее,2018-11-25 08:41:00,3551694,[]
1371,в перми открылась международная выставка кошек,2018-11-25 07:37:00,3551694,[]
1372,сегодня день матери,2018-11-25 07:21:56,3551694,[]
1373,,2018-11-24 20:37:00,3551694,
1374,пермская зоозащитница галя море чуть не стала жертвой таксиста маньяка,2018-11-24 19:42:00,3551694,[]
1375,кунгур с ледяной горы,2018-11-24 18:37:00,3551694,[]
1376,подросток из перми заработал свой первый миллион к годам,2018-11-24 17:41:00,3551694,[]
1377,пермский зоопарк опубликовал видео с беременной белой медведицей,2018-11-24 16:42:00,3551694,[]
1378,в перми планируют построить небоскреб с бассейном отелем и крытым катком,2018-11-24 15:52:00,3551694,[]
1379,национальная юридическая коллегия поможет вам в решении любых юридических вопросов даже самых сложных,2018-11-24 15:05:03,3551694,[]
1380,на вышке уже год эта техника стоит остановка ивана франко видимо плата за рекламу хитро придумали и платить за рекламо место никому не надо законно ли,2018-11-24 14:33:00,3551694,[]
1381,жительницу чусового осудили за гибель шести человек на пожаре в общежитии,2018-11-24 13:42:00,3551694,[]
1382,и вправду,2018-11-24 12:37:00,3551694,[]
1383,пермскому школьнику выплатили руб компенсации после отравления в школьной столовой,2018-11-24 11:41:00,3551694,[]
1384,самая милая рубрика вновь готова радовать вас,2018-11-24 11:06:03,3551694,[]
1385,черная пятница по всей сети магазинов,2018-11-24 10:05:04,3551694,[]
1386,фестиваль ноября дворец молодежи,2018-11-24 09:37:00,3551694,[]
1387,в перми с помощью соцсетей нашли должника алиментщика,2018-11-24 09:06:01,3551694,[]
1388,и ноября на пермской ярмарке проходит международная выставка кошек,2018-11-24 08:05:05,3551694,[]
1389,в перми разыскивают преступника напавшего на летнего ребенка,2018-11-24 07:41:00,3551694,[]
1390,сегодняшний восход луны над городом,2018-11-23 21:17:09,3551694,[]
1391,открытка из сувенирного набора российской империи года климат вообще холодный,2018-11-23 20:31:00,3551694,[]
1392,актриса из перми зоя бербер станет лотом на благотворительном аукционе,2018-11-23 19:36:00,3551694,[]
1393,от подписчика,2018-11-23 18:37:36,3551694,[]
1394,специалисты заявили о росте численности грызунов в перми,2018-11-23 17:42:00,3551694,[]
1395,возможно в скором времени некоторые из нас смогут заниматься спортом нахаляву,2018-11-23 16:41:00,3551694,[]
1396,уже несколько лет пермская галерея затянута зеленой сеткой почему так долго,2018-11-23 15:52:00,3551694,[]
1397,новогодний поезд,2018-11-23 15:16:05,3551694,[]
1398,в перми прошел межрегиональный экспортный форум,2018-11-23 14:31:00,3551694,[]
1399,в березниках летняя сирота покончила с собой,2018-11-23 13:47:00,3551694,[]
1400,куда сходить в выходные афиша на и ноября,2018-11-23 13:02:03,3551694,[]
1401,в пермском крае запускается туристический проект не сиди дома,2018-11-23 12:06:02,3551694,[]
1402,пермский ждун в индустриальном районе,2018-11-23 11:46:00,3551694,[]
1403,в черную пятницу пермяки смогут приобрести товары со скидкой до,2018-11-23 11:02:03,3551694,[]
1404,,2018-11-23 10:05:02,3551694,
1405,резкое потепление и сильный снегопад погода в прикамье на выходные,2018-11-23 09:46:00,3551694,[]
1406,знаменитый кулинарный магазин белочка который с советских времен находился на комсомольском проспекте само здание построено в году закрылся весной года,2018-11-23 09:01:00,3551694,[]
1407,новогодний форт боярд всем классом,2018-11-23 08:05:02,3551694,[]
1408,зима на носу,2018-11-23 07:46:00,3551694,[]
1409,осколок советской империи в пермском крае,2018-11-23 07:16:00,3551694,[]
1410,а какие фразочки вы знаете пишите в комментариях,2018-11-23 06:16:00,3551694,[]
1411,пермская архитектура фото александр дьяков,2018-11-23 05:16:00,3551694,[]
1412,пермское волшебное автор фото дмитрий фролов,2018-11-22 20:31:04,3551694,[]
1413,мы собрали все что уже известно о праздновании грядущего нового года,2018-11-22 19:31:00,3551694,[]
1414,в перми запустили ласточку до голованово в тестовом режиме,2018-11-22 18:46:00,3551694,[]
1415,в перми на площади у памятника миг на взлете зальют каток,2018-11-22 17:51:00,3551694,[]
1416,,2018-11-22 17:05:04,3551694,
1417,ночь улица фонарь пермь фото евгений зубов,2018-11-22 16:51:00,3551694,[]
1418,спасатели пермской городской службы спасения извлекли из бетонного плена собаку,2018-11-22 16:16:03,3551694,[]
1419,ура счастье восстановили,2018-11-22 15:31:00,3551694,[]
1420,выбираем лучшее фото перми за июль года,2018-11-22 14:41:00,3551694,[]
1421,в перми на территории действующего зоопарка могут появиться парк или сквер,2018-11-22 13:46:00,3551694,[]
1422,культура яркое событие начала декабря для тех кто любит провести время интересно и с пользой,2018-11-22 13:01:00,3551694,[]
1423,пермская спортсменка выиграла кубок по пара армрестлингу,2018-11-22 12:31:00,3551694,[]
1424,пермячка примет участие в конкурсе миссис земной шар,2018-11-22 11:31:00,3551694,[]
1425,,2018-11-22 10:40:00,3551694,
1426,в перми пройдет чемпионат по армрестлингу вход свободный,2018-11-22 10:17:06,3551694,[]
1427,от подписчика,2018-11-22 10:01:00,3551694,[]
1428,сеть гипермаркет которой работает в перми уходит из россии,2018-11-22 09:33:02,3551694,[]
1429,приближается зима уже выпал снег и начались первые морозы для небольшой части жителей нашего города людей у которых нет жилья это самый тяжелый период,2018-11-22 08:36:00,3551694,[]
1430,в пермском крае создается мобильная служба сохранения детей в семьях,2018-11-22 07:41:00,3551694,[]
1431,дорога в зимнюю сказку а если быть точным в каменный город,2018-11-22 06:41:00,3551694,[]
1432,медицинский колледж в перми закрыли на карантин у студента нашли открытую форму туберкулеза,2018-11-22 05:33:00,3551694,[]
1433,пермь вошла в топ в рейтинге любви просмотра телевизора,2018-11-21 20:42:00,3551694,[]
1434,в музее современного искусства,2018-11-21 19:42:00,3551694,[]
1435,главная новогодняя елка перми засияет звездами к ноября,2018-11-21 18:37:02,3551694,[]
1436,вчера вечером максим решетников провел прямой эфир для жителей края в инстаграме,2018-11-21 17:42:00,3551694,[]
1437,в перми на площади у памятника миг на взлете впервые зальют каток,2018-11-21 16:46:00,3551694,[]
1438,от подписчика,2018-11-21 16:16:02,3551694,[]
1439,инвестиции международный рынок региональный экспортный акселератор курс национальной валюты,2018-11-21 15:16:05,3551694,[]
1440,супруги из перми отсудили у приставов компенсацию за испорченный отпуск,2018-11-21 14:46:00,3551694,[]
1441,в одном из домов на ул уральской в подъезде вот такая картина на стене,2018-11-21 13:51:00,3551694,[]
1442,жительницу добрянки приговорили к штрафу за помощь бездомным кошкам,2018-11-21 13:06:04,3551694,[]
1443,,2018-11-21 12:05:02,3551694,
1444,зима в пермском крае,2018-11-21 11:46:00,3551694,[]
1445,дома на компросе отремонтируют и покрасят каждый в свой уникальный цвет,2018-11-21 11:02:03,3551694,[]
1446,,2018-11-21 10:05:02,3551694,
1447,наша праздничная ель,2018-11-21 09:46:00,3551694,[]
1448,авторынок на островского выставили на продажу,2018-11-21 09:06:01,3551694,[]
1449,олимпиада исполняющая желания,2018-11-21 08:05:01,3551694,[]
1450,эпидемия приближается в прикамье выросла заболеваемость орви,2018-11-21 07:37:00,3551694,[]
