3768,сегодня в екатеринбурге стартовал венский фестиваль музыкальных фильмов он пройдет в столице урала с июля по августа,2018-07-26 17:29:00,32182751,[]
3769,шагов к осуществлению мечты полета в космос вместе с космодрайв,2018-07-26 16:29:00,32182751,[]
3770,уральский репер витя ак оценил недавно созданный уличный арт с тремя топорами который появился в екатеринбурге на азина,2018-07-26 16:07:38,32182751,[]
3771,потрясающая природа среднего урала,2018-07-26 15:45:48,32182751,[]
3772,наш читатель сообщает что на улице марта для всех желающих поставили вентиляторы которые обрызгивают водой,2018-07-26 15:06:18,32182751,[]
3773,,2018-07-26 14:05:00,32182751,
3774,девушка из екатеринбурга ксения филиппова попала в тройку самых сексуальных девушек россии,2018-07-26 13:29:04,32182751,[]
3775,актуальный уличный арт на красноармейской,2018-07-26 13:05:01,32182751,[]
3776,в екатеринбурге африканец оказался на улице из за девушки,2018-07-26 12:06:16,32182751,[]
3777,,2018-07-26 11:05:00,32182751,
3778,вчера на плотинке появился красивый и оригинальный уличный арт людям понравилось в общем красота,2018-07-26 10:51:00,32182751,[]
3779,с августа железнодорожный вокзал в екатеринбурге перейдет на местное время,2018-07-26 10:13:05,32182751,[]
3780,редкий снимок вид на торговый центр пассаж с высоты,2018-07-26 09:23:48,32182751,[]
3781,из екатеринбурга в березовский планируют запустить трамвай об этом стало известно после встречи замглавы администрации екатеринбурга андрея корюкова и мэра березовского евгений писцова,2018-07-26 08:20:47,32182751,[]
3782,от читателя,2018-07-26 07:31:00,32182751,[]
3783,в этом году в екатеринбурге появится центр по подготовке юных футболистов его откроют на базе уральской футбольной академии,2018-07-26 07:06:47,32182751,[]
3784,доброе утро екатеринбург,2018-07-26 06:07:00,32182751,[]
3785,ночной интерактив выкладываем в комменты последнее фото на телефоне,2018-07-25 23:34:49,32182751,[]
3786,спокойной ночи екатеринбург,2018-07-25 21:02:00,32182751,[]
3787,вечер в екатеринбурге музыканты играют песню филиппа киркорова цвет настроения синий,2018-07-25 20:39:58,32182751,[]
3788,в екатеринбургской колонии строгого режима ик погиб заключенный мужчина скончался июня признаков насильственной смерти не выявлено,2018-07-25 19:32:00,32182751,[]
3789,в этот день июля года не стало великого советского поэта актера театра и кино барда владимира семеновича высоцкого,2018-07-25 19:05:02,32182751,[]
3790,,2018-07-25 18:05:00,32182751,
3791,пустыня на вайнера в,2018-07-25 17:52:05,32182751,[]
3792,ребята из выпустили документальное музыкальное видео на ска панк версию трека из окна клип был снят во время фестиваля который проходил в екатеринбурге с на июня,2018-07-25 17:15:48,32182751,[]
3793,летний вечер на набережной,2018-07-25 16:43:13,32182751,[]
3794,правительство свердловской области закупят сразу в комплектации люкс такая информация опубликована на сайте госзакупок,2018-07-25 15:33:09,32182751,[]
3795,новый стрит арт на плотинке,2018-07-25 15:05:17,32182751,[]
3796,на прошлой неделе в екатеринбурге завершился фестиваль православной культуры царские дни приуроченный в этом году к летию расстрела семьи николая в рамках мероприятий при участии фонда святой екатерины в мультимедийном парке россия моя история прошел показ фильма елены чавчавадзе революция западня для россии,2018-07-25 14:05:00,32182751,[]
3797,наша читательница возмущена тем что сегодня в вагоне метро никто не уступил место беременной женщине,2018-07-25 13:17:21,32182751,[]
3798,знакомьтесь это владимир бутров и антон жеребятьев это уличные музыканты которых уже знают многие горожане почти каждый вечер они играют на плотинке радуя и удивляя прохожих своей музыкой,2018-07-25 12:33:00,32182751,[]
3799,в екатеринбурге на улице азина появилось граффити с тремя топорами,2018-07-25 12:05:01,32182751,[]
3800,,2018-07-25 11:05:00,32182751,
3801,жители екатеринбурга смогут отправлять посылки почтой россии за секунд сейчас в почтовых отделениях тестируют сервис который позволяет сократить время оформления посылки с минут до секунд,2018-07-25 10:53:17,32182751,[]
3802,стена плача в екатеринбургском зоопарке,2018-07-25 10:14:11,32182751,[]
3803,с сентября во всех школах екатеринбурга будут работать службы примирения с первым учебным днем в школы придут медиаторы специалисты которые будут помогать решать внутренние конфликты,2018-07-25 09:14:23,32182751,[]
3804,этой ночью в центральной городской больнице в роддоме произошел пожар задымление началось в в подвальном помещении,2018-07-25 08:35:54,32182751,[]
3805,депутаты государственной думы приняли в третьем чтении закон о повышении ндс с января года налог повысится с до,2018-07-25 08:05:01,32182751,[]
3806,испытай себя на прочность,2018-07-25 07:05:00,32182751,[]
3807,доброе утро екатеринбург,2018-07-25 06:11:00,32182751,[]
3808,время для вечерних разговоров,2018-07-24 21:13:35,32182751,[]
3809,екатеринбург в черно белых тонах,2018-07-24 20:43:36,32182751,[]
3810,сегодня к российскому этапу ралли шелковый путь присоединился ведущий канала бородатая езда олег максимов блогер поднял стрим с экскурсией по бивуаку в котором располагаются команды и медиаэкипажи,2018-07-24 19:42:29,32182751,[]
3811,в екатеринбурге около двух месяцев назад мужчина выкинул из окна двух котов своей матери к которым она была очень привязана в тот день мужчина был не трезв произошла ссора после которой он решил отомстить маме отыгравшись на ее котах кузе и дине,2018-07-24 18:54:38,32182751,[]
3812,в екатеринбурге сегодня открыли живой памятник высоцкому в виде кино ленты на которой выложены цитаты из песен артиста,2018-07-24 17:56:32,32182751,[]
3813,наша читательница рассказывает что на перекрестке чусовской тракт объездная не работает светофор там сразу нашелся нештатный регулировщик как он думает но он только мешает движению и создает аварийные ситуации,2018-07-24 17:15:33,32182751,[]
3814,на этой неделе в екатеринбурге пройдет сразу два митинга против повышения пенсионного возраста,2018-07-24 16:37:02,32182751,[]
3815,обмелевший берег городского пруда,2018-07-24 15:33:00,32182751,[]
3816,на тюменском тракте семейная пара расстреляла автомобиль из пневматического пистолета,2018-07-24 15:06:19,32182751,[]
3817,гуляя по набережной городского пруда можно встретить много интересных людей,2018-07-24 14:05:03,32182751,[]
3818,специальное предложение от салона красоты новелла,2018-07-24 13:05:01,32182751,[]
3819,в екатеринбурге в отделе полиции умер задержанный мужчина его обнаружили в крови в одной из камер,2018-07-24 12:55:05,32182751,[]
3820,если вам не нравится ваша работа посмотрите как работает эта девушка на вайнера,2018-07-24 11:51:59,32182751,[]
3821,в екатеринбурге появилась скульптурная композиция посвященная песням владимира высоцкого,2018-07-24 11:13:30,32182751,[]
3822,в екатеринбурге судебные приставы арестовали из за долга в тысяч рублей,2018-07-24 10:28:56,32182751,[]
3823,архитектура екатеринбурга,2018-07-24 09:47:06,32182751,[]
3824,в четверг июля в екатеринбурге начнется венский фестиваль музыкальных фильмов он пройдет в столице урала с июля по августа,2018-07-24 08:44:31,32182751,[]
3825,в парке на уралмаше власти давно хотели устранить проблему с неработающим фонтаном недавно они нашли решение,2018-07-24 08:09:25,32182751,[]
3826,динамо глазами фотографа елизаветы хлызовой,2018-07-24 07:26:25,32182751,[]
3827,в самой крупной сети мини кофеен на урале открыта вакансия бариста,2018-07-24 06:15:00,32182751,[]
3828,доброе утро,2018-07-24 05:33:00,32182751,[]
3829,время для вечерних разговоров,2018-07-23 21:00:19,32182751,[]
3830,вчера на километре трассы москва волгоград произошло дтп в котором погибли пять человек трое из которых жили в екатеринбурге в страшной аварии удалось выжить лишь летнему подростку как сообщают местные сми в воскресенье мужчина вместе со своей семьей ехал в волгоград в салоне находились его летняя мать летняя супруга и летний сын все они граждане украины которые уже два года проживали в екатеринбурге,2018-07-23 20:46:12,32182751,[]
3831,наша читательница сообщает что на декабристов образовалась яма в которую уже успели влететь несколько автомобилей,2018-07-23 20:10:01,32182751,[]
3832,еще один новый арт объект в екатеринбурге на этот раз на верх исетском пруду,2018-07-23 19:30:21,32182751,[]
3833,проведи день в космосе,2018-07-23 18:30:01,32182751,[]
3834,привет екатеринбургу из турции как там у вас погода,2018-07-23 18:05:43,32182751,[]
3835,в аэропорту кольцово уже несколько дней живет болельщик из нигерии он случайно купил билеты домой не на июля а на августа,2018-07-23 17:02:36,32182751,[]
3836,черные ножи двинулись на прагу,2018-07-23 16:43:20,32182751,[]
3837,в пионерском районе вместо скульптуры жирафов установили волка из ну погоди,2018-07-23 16:05:46,32182751,[]
3838,задумайся,2018-07-23 15:05:01,32182751,[]
3839,в микрорайоне академический своя атмосфера там воспитатель детского сада водит малышей за веревочку один из местных жителей даже заснял это на видео,2018-07-23 14:34:50,32182751,[]
3840,накануне дня памяти владимира высоцкого завтра в екатеринбурге появится скульптурная композиция посвященная песням барда,2018-07-23 13:51:42,32182751,[]
3841,обитатели парка динозавров в цпкио им маяковского,2018-07-23 13:06:03,32182751,[]
3842,у нас для вас хорошие новости жара в екатеринбурге будет всю неделю как сообщают синоптики как минимум до выходных средняя температура днем составит градусов,2018-07-23 12:23:40,32182751,[]
3843,один день на взлетно посадочной полосе в кольцово,2018-07-23 11:41:00,32182751,[]
3844,от легендарной бани бодрость на куйбышева почти ничего не осталось снос начался еще неделю назад сначала здание разбирали вручную а позже была подключена техника,2018-07-23 11:13:56,32182751,[]
3845,в город ком пруду понизили уровень воды а это значит что самое время устроить фотосессию,2018-07-23 10:28:03,32182751,[]
3846,в прошедшие выходные на озере балтым утонул мужчина как рассказывают очевидцы он упал с гидроцикла и не смог выплыть,2018-07-23 09:59:33,32182751,[]
3847,в городском пруду на один метр снизили уровень воды это нужно для проведения работ по реконструкции макаровского моста,2018-07-23 09:05:09,32182751,[]
3848,а ты думал о том что радио можно не только слышать в автомобиле или на работе но и работать на нем у вас есть такой шанс,2018-07-23 08:05:00,32182751,[]
3849,блогер илья варламов который ранее раскритиковал екатеринбург за подготовку к чм опубликовал на своем канале ролик посвященный газону в уральской столице,2018-07-23 07:42:59,32182751,[]
3850,посмотрите какое небо можно было наблюдать этой ночью в этом году невероятная активность серебристых облаков,2018-07-23 07:06:08,32182751,[]
3851,доброе утро,2018-07-23 06:07:00,32182751,[]
3852,ночной чат,2018-07-22 20:53:09,32182751,[]
3853,наша читательница спрашивает где находится этот рисунок,2018-07-22 20:36:04,32182751,[]
3854,от читателя,2018-07-22 19:37:06,32182751,[]
3855,сегодня в парке маяковского упал один из аттракционов на котором катались дети,2018-07-22 18:28:33,32182751,[]
3856,в екатеринбурге в рамках фестиваля карт бланш появился памятник эгоизму,2018-07-22 17:27:25,32182751,[]
3857,в компрессорном микрорайоне мужчина пришел купить два корнишона но что то пошло не так,2018-07-22 16:23:34,32182751,[]
3858,в екатеринбурге начали появляться объявления о митинге против пенсионной реформы,2018-07-22 15:12:49,32182751,[]
3859,в сети появилось видео ужасной аварии которая произошла вчера вечером на трассе пермь екатеринбург,2018-07-22 14:04:11,32182751,[]
3860,в екатеринбурге казаки начали патрулировать шарташский лесопарк теперь они будут поддерживать общественный порядок в зоне отдыха,2018-07-22 13:00:49,32182751,[]
3861,вид с купола цирка на дендрарий год,2018-07-22 11:57:10,32182751,[]
3862,от читательницы,2018-07-22 10:46:18,32182751,[]
3863,вчера вечером на трассе пермь екатеринбург произошла жуткая авария с пятью погибшими,2018-07-22 09:38:29,32182751,[]
3864,в екатеринбурге появились специальные знаки обозначающие выделенную линию для трамваев теперь за выезд на трамвайные линии нарушителей будут карать как за троллейбусные и автобусные полосы,2018-07-22 08:30:51,32182751,[]
3865,екатеринбург с высоты,2018-07-22 07:20:42,32182751,[]
3866,доброе утро екатеринбург,2018-07-22 06:07:00,32182751,[]
3867,время для вечерних разговоров как выходные проводите,2018-07-21 20:59:09,32182751,[]
3868,кто сказал что екатеринбург грязный и серый город,2018-07-21 19:57:09,32182751,[]
3869,у многих городов россии есть боль улицы уродуются незаконной рекламой которая появляется на стендах по ночам,2018-07-21 18:54:59,32182751,[]
3870,еще один новый стрит арт в екатеринбурге расположен на улице испанских рабочих,2018-07-21 17:52:00,32182751,[]
3871,а вы смотрите телевизор,2018-07-21 16:50:49,32182751,[]
3872,в свердловских колониях решили производить газировку об этом сообщает пресс служба гуфсин россии по свердловской области,2018-07-21 16:04:00,32182751,[]
3873,полицейские екатеринбурга помогли болельщику из нигерии который после чм не смог улететь домой,2018-07-21 15:04:00,32182751,[]
3874,еще один новый стрит арт на улицах екатеринбурга,2018-07-21 14:04:00,32182751,[]
3875,в екатеринбурге водитель яндекс такси сломал руку клиентке за то что она хотела рассчитаться крупной купюрой по данным портала е две девушки и два парня заказали такси от ленина до микрорайона светлый по приезду оказалось что у пассажиров с собой только крупная купюра водитель заявил что у него нет сдачи,2018-07-21 13:16:11,32182751,[]
3876,в кольцово вчера днем и сегодня утром приземлялись истребители бомбардировщики и военный самолет ил рев от двигателей было слышно в разных районах екатеринбурга,2018-07-21 12:13:11,32182751,[]
3877,в екатеринбурге компания три десятки выплатит пенсионерке компенсацию за то что она опоздала на спектакль,2018-07-21 11:08:00,32182751,[]
3878,прожить без воды все лето да запросто жители вторчермета практикуют такое как сообщает наша читательница она как и другие горожане живут без горячей воды уже около дней,2018-07-21 10:04:00,32182751,[]
3879,активистам общественного движения уральский хронотип удалось остановить демонтаж старинной бани бодрость которую начали сносить на днях когда к зданию подъехал экскаватор общественник александр зыков вызвал полицейских которые прибыв на место остановили снос,2018-07-21 09:04:00,32182751,[]
3880,в екатеринбурге следователи закончили расследование уголовного дела против тренера который обвиняется в педофилии как рассказала жена обвиняемого материалы дела заняли страниц,2018-07-21 08:04:00,32182751,[]
3881,как вам сегодня погодка,2018-07-21 07:14:06,32182751,[]
3882,доброе утро екатеринбург,2018-07-21 06:07:00,32182751,[]
3883,сегодня июля на площадке около памятника прошел вечер памяти посвященный солисту рок группы честеру беннингтону в его песнях находят душевный отклик миллионы людей на планете,2018-07-20 21:39:48,32182751,[]
3884,время для вечерних разговоров,2018-07-20 20:39:48,32182751,[]
3885,от читателя,2018-07-20 20:06:31,32182751,[]
3886,еще один стрит арт под названием наблюдение располагается по адресу некрасова,2018-07-20 18:56:04,32182751,[]
3887,в екатеринбурге начался вечер памяти в честь вокалиста честера беннингтона,2018-07-20 17:54:30,32182751,[]
3888,всеми известный куб на вайнера теперь стал намного ярче все благодаря художникам дамиру бозику и никите руфасу которые расписали куб в рамках фестиваля карт бланш,2018-07-20 17:33:00,32182751,[]
3889,сегодня в екатеринбурге состоялось открытие памятника барельефа об истории железных дорог в россии на нем показаны ключевые моменты развития страны и становления железнодорожного транспорта,2018-07-20 17:05:01,32182751,[]
3890,проведи день в космосе,2018-07-20 16:05:00,32182751,[]
3891,в екатеринбурге на две недели отключат эфирные радиостанции и телеканалы об этом сообщили в свердловском филиале российской телевизионной и радиовещательной сети сигнал отключат в связи с тем что на телебашне на улице луначарского будут работать маляры которые покроют ее антикоррозийной краской,2018-07-20 15:41:33,32182751,[]
