3703,в прикамье молодой человек с девушкой спасли тонущего ребенка,2018-08-02 13:31:00,3551694,[]
3704,топ вопросов и ответов об акции цветы жизни,2018-08-02 12:31:00,3551694,[]
3705,в перми преображается сквер авиаторов,2018-08-02 11:41:00,3551694,[]
3706,шествие колонны вдв сегодня в перми видео михаил белобородов,2018-08-02 10:51:00,3551694,[]
3707,есть работа,2018-08-02 10:05:00,3551694,[]
3708,пермские авто красавица,2018-08-02 09:31:00,3551694,[]
3709,пермячка татьяна митюшина снялась в голливудском триллере,2018-08-02 08:31:00,3551694,[]
3710,в пермском детсаду ребенка публично унизили так как родители не сдают деньги на подарки,2018-08-02 07:51:00,3551694,[]
3711,дождались,2018-08-02 07:05:00,3551694,[]
3712,работы художника анатолия вадимовича попова работающего более лет на краснокамском заводе металлических сеток,2018-08-02 06:16:00,3551694,[]
3713,немного свежести жигаланских водопадов вам в ленту,2018-08-02 05:16:00,3551694,[]
3714,вот бы все фасады домов в перми были такие как у этого дома фото виктор михалев,2018-08-01 20:31:00,3551694,[]
3715,недалеко от города есть вот такие красоты жебреи фото дмитрий новиков,2018-08-01 19:41:00,3551694,[]
3716,начало лунного затмения июля над пермью видео артем куликов,2018-08-01 18:51:00,3551694,[]
3717,сейчас за окном,2018-08-01 18:31:00,3551694,[]
3718,,2018-08-01 18:05:00,3551694,
3719,важно с августа на улице уральской будет полностью закрыто движение,2018-08-01 17:31:00,3551694,[]
3720,замечено в донецке,2018-08-01 16:51:00,3551694,[]
3721,уже в восьми банках можно оплатить квитанции крц прикамье без комиссии,2018-08-01 16:21:00,3551694,[]
3722,мыс стрелка залитый солнцем,2018-08-01 15:41:00,3551694,[]
3723,проект по строительству международного студенческого кампуса в перми получил статус приоритетного инвестиционного проекта,2018-08-01 15:01:00,3551694,[]
3724,кто нибудь покажите мировым знаменитостям из перми как правильно выходить из самолета,2018-08-01 14:31:00,3551694,[]
3725,барсят родившихся в мае впервые показали посетителям пермского зоопарка,2018-08-01 13:51:00,3551694,[]
3726,застройщик жк ньютон стал победителем престижной российской премии,2018-08-01 13:05:00,3551694,[]
3727,от подписчика,2018-08-01 12:51:00,3551694,[]
3728,в пермском крае нашли мумифицированное тело ребенка,2018-08-01 12:31:00,3551694,[]
3729,в перми начались работы по установке оборудования в подземном помещении нового фонтана на эспланаде,2018-08-01 12:01:00,3551694,[]
3730,видео дтп на уральской водитель уснул и врезался в машину пожарной охраны,2018-08-01 11:16:00,3551694,[]
3731,скульптура золотого льва в парке горькго,2018-08-01 10:51:00,3551694,[]
3732,проект экодесант стартовал в августе года,2018-08-01 10:05:01,3551694,[]
3733,сегодня с августа в перми расписание поездов и электричек будет указываться по местному времени,2018-08-01 09:42:14,3551694,[]
3734,привет перми с технических озер балхашского горно металлургического комбината казахстан,2018-08-01 08:37:00,3551694,[]
3735,от подписчика пермь в полицейском оцеплении кто знает что случилось,2018-08-01 08:21:11,3551694,[]
3736,в библиотеке им горького проходят бесплатные юридические консультации график на август,2018-08-01 07:42:00,3551694,[]
3737,и есть же такие идиоты а как же люди с коляской вот именно из за таких наш мир не может стать лучше капитанского,2018-08-01 06:37:00,3551694,[]
3738,видеопутешествие на хребет кваркуш,2018-07-31 20:38:00,3551694,[]
3739,замечено на комсомольской площади,2018-07-31 19:51:00,3551694,[]
3740,объект не капитальный разрешения не нужно суд признал строительство фонтана на эспланаде законным,2018-07-31 19:11:00,3551694,[]
3741,ромашки скосили стога увезли,2018-07-31 18:21:00,3551694,[]
3742,с августа на улице уральской будет закрыто движение транспорта,2018-07-31 17:10:58,3551694,[]
3743,пока я карабкалась по останкам благовещенской церкви к храму подошли две женщины и прислонились ладонями к его стенам,2018-07-31 16:07:00,3551694,[]
3744,,2018-07-31 15:05:00,3551694,
3745,пермский край вошел в топ регионов с наибольшим числом предприятий по переработке пластика,2018-07-31 14:27:00,3551694,[]
3746,что это спросила я первый раз увидев эти деревянные то ли домики то ли кораблики,2018-07-31 13:37:00,3551694,[]
3747,павильоны размещались за центральным рынком незаконно в перми сносят блошиный рынок,2018-07-31 12:42:00,3551694,[]
3748,смотришь и понимаешь счастье здесь и сейчас,2018-07-31 12:07:00,3551694,[]
3749,,2018-07-31 11:05:00,3551694,
3750,русское географическое общество и телеканал моя планета объявили конкурс на лучшего экскурсовода россии,2018-07-31 10:42:00,3551694,[]
3751,борщевик захватывает новые территории в пермском крае,2018-07-31 10:07:00,3551694,[]
3752,восход солнца в перми,2018-07-31 09:02:02,3551694,[]
3753,стань крутым специалистом сферы телекоммуникаций,2018-07-31 08:00:00,3551694,[]
3754,не испугалась сыграть жертву пермячка таня митюшина снялась в кровавом триллере,2018-07-31 07:37:00,3551694,[]
3755,северный ветер не лучший спутник на рыбалке но на реку идти нужно в любую погоду я и в ливень ходил и в шквал и в минус один раз слабину дашь и все потом всегда найдешь причину шланговать дома как всегда взял фидер и поехал на красавицу каму в районе мотозавода,2018-07-31 06:37:00,3551694,[]
3756,пермяки путешествуют,2018-07-30 20:46:00,3551694,[]
3757,пермские учителя и родители откажутся от букетов ради детей,2018-07-30 19:41:00,3551694,[]
3758,закат над рекой язьвой на севере пермского края,2018-07-30 18:37:00,3551694,[]
3759,арктическое вторжение к выходным в пермь придет похолодание,2018-07-30 17:52:00,3551694,[]
3760,видео отчет с йоги в парке миндовского,2018-07-30 17:27:00,3551694,[]
3761,умирающий поселок юбилейный гремячинский район,2018-07-30 16:37:00,3551694,[]
3762,и что только не увидишь гуляя по городскому пляжу,2018-07-30 15:52:00,3551694,[]
3763,в выходные на городском пляже пермские рыбаки собирали подписи под открытым письмом максиму решетнкову о запрете свободной продаже рыболовных сетей,2018-07-30 15:26:00,3551694,[]
3764,жители поселения пермского края получат доступ к высокоскоростному интернету до конца года,2018-07-30 14:46:00,3551694,[]
3765,в центре перми под ребенком взорвался гироскутер,2018-07-30 14:06:00,3551694,[]
3766,,2018-07-30 13:05:00,3551694,
3767,для сериала с чулпан хаматовой набирают массовку список ролей,2018-07-30 12:07:00,3551694,[]
3768,октябрьская площадь целью снимка скорей всего была иномарка в те времена чудо заморское,2018-07-30 11:52:00,3551694,[]
3769,,2018-07-30 11:05:00,3551694,
3770,с августа в перми расписание поездов и электричек будет указываться по местному времени,2018-07-30 10:52:00,3551694,[]
3771,река косьва белый камень,2018-07-30 10:07:00,3551694,[]
3772,меховая ярмарка и скидки от кировской меховой фабрики,2018-07-30 09:00:10,3551694,[]
3773,пермский симфонический оркестр поразил лондон,2018-07-30 07:16:00,3551694,[]
3774,барахолка пермского цкр фото года,2018-07-30 06:16:00,3551694,[]
3775,пермь красивая фото павел смирнов,2018-07-30 05:16:00,3551694,[]
3776,пгниу,2018-07-29 20:24:53,3551694,[]
3777,река чусовая,2018-07-29 19:01:00,3551694,[]
3778,красивое место парк в жебреях,2018-07-29 18:01:00,3551694,[]
3779,в августе в перми состоится рок фестиваль,2018-07-29 17:01:00,3551694,[]
3780,августа в пермском крае состоится фестиваль большие маневры на хохловских холмах,2018-07-29 16:01:00,3551694,[]
3781,в перми построен второй экземпляр вертолета орлан,2018-07-29 15:01:00,3551694,[]
3782,летний вечер в хохловке,2018-07-29 14:01:00,3551694,[]
3783,двое мужчин едва не утонули попытавшись переплыть мотовилихинский пруд,2018-07-29 13:01:00,3551694,[]
3784,десятилетний мальчик пропавший в перми найден,2018-07-29 12:01:00,3551694,[]
3785,,2018-07-29 11:16:00,3551694,[]
3786,пермские боги в пермской художественной галерее фото юрий ронжин,2018-07-29 10:16:00,3551694,[]
3787,милая пара была замечена на комсомольском проспекте любовь для всех возрастов,2018-07-29 09:16:00,3551694,[]
3788,мыс стрелка,2018-07-29 08:16:00,3551694,[]
3789,красивая картина,2018-07-29 07:16:00,3551694,[]
3790,приключения пермского чистомена продолжаются,2018-07-29 06:16:00,3551694,[]
3791,вчерашнее затмение луны лишь изредка появлявшейся из за облаков уход в тень затмение и выход из тени,2018-07-29 01:41:16,3551694,[]
3792,горит мотоцикл на ж д переезде на ул соликамская,2018-07-29 00:15:39,3551694,[]
3793,пермь красивая фото павел смирнов,2018-07-28 20:31:00,3551694,[]
3794,замечено сегодня на окулова,2018-07-28 20:08:14,3551694,[]
3795,июля на улице петропавловская на тротуаре после дождя обвалился асфальт,2018-07-28 19:16:00,3551694,[]
3796,пермяки сняли танцевальный клип в саду камней,2018-07-28 18:31:00,3551694,[]
3797,в перми прошел митинг против повышения пенсионного возраста,2018-07-28 17:31:00,3551694,[]
3798,в пермь прошел дождик все по прежнему,2018-07-28 16:47:20,3551694,[]
3799,вид на кын завод в году от яна савицкого и в на снимках прокудина горского,2018-07-28 16:16:00,3551694,[]
3800,видео сильного пожара заводе нефтехимик в закамске июля на место выезжали спасатели медики и полиция,2018-07-28 15:16:00,3551694,[]
3801,пермские спасатели спасли таксу застрявшую в бетонной ловушке,2018-07-28 14:16:00,3551694,[]
3802,во дворе на технической,2018-07-28 13:16:00,3551694,[]
3803,мчс предупредило о сильном ветре грозе и граде в пермском крае,2018-07-28 12:16:00,3551694,[]
3804,самая милая рубрика вновь готова радовать вас,2018-07-28 11:16:00,3551694,[]
3805,пермские авто замечено у театра театра,2018-07-28 10:16:00,3551694,[]
3806,,2018-07-28 09:30:01,3551694,
3807,беседка со статуей хоттея в жебреях пермский район берег р сылва,2018-07-28 09:01:00,3551694,[]
3808,интересных мест пермского края подписчики а в скольких из них вы уже побывали,2018-07-28 08:16:00,3551694,[]
3809,очередь за хлебом в перми это все что нужно знать о х годах,2018-07-28 07:16:00,3551694,[]
3810,прогулка по городу на солнышке,2018-07-28 06:16:00,3551694,[]
3811,игра теней на фоне кровавой луны,2018-07-27 22:41:17,3551694,[]
3812,оранжевая луна,2018-07-27 22:06:06,3551694,[]
3813,уже началось,2018-07-27 21:13:33,3551694,[]
3814,пермяки как проводите вечер пятницы какие планы на выходные,2018-07-27 20:49:05,3551694,[]
3815,магия заката на севере пермского края июль,2018-07-27 19:46:00,3551694,[]
3816,видео два грабителя связали продавщицу салона связи в перми и украли почти телефонов на сумму полмиллиона рублей,2018-07-27 18:46:00,3551694,[]
3817,завтра в перми откроют ый этап велогонки,2018-07-27 18:01:00,3551694,[]
3818,вот такой рисунок красуется в одном из пермских зданий,2018-07-27 17:31:00,3551694,[]
3819,важная информация для посетителей фестиваля камва,2018-07-27 17:01:00,3551694,[]
3820,,2018-07-27 16:05:01,3551694,
3821,встречаются в наших лесах такие,2018-07-27 15:16:00,3551694,[]
3822,выращивает растения в голове и выдувает планеты из мыльных пузырей пермячка создает удивительные фотокартинки,2018-07-27 14:46:00,3551694,[]
3823,фантастические пейзажи колчимского камня,2018-07-27 14:01:00,3551694,[]
3824,куда сходить в выходные афиша на и июля,2018-07-27 13:16:00,3551694,[]
3825,в парке горького появился вот такой большой лев,2018-07-27 12:31:00,3551694,[]
3826,на поезде или автобусе чтоб гарантированно и без проблем добраться до нужной точки вариант отличный но так может каждый а слабо на велосипеде,2018-07-27 11:46:00,3551694,[]
3827,вчера новый пермский футбольный клуб звезда состоящий из одних пермяков одержал первую домашнюю победу в чемпионате пфл,2018-07-27 11:02:01,3551694,[]
3828,похождения пермского чистомена продолжаются,2018-07-27 10:16:00,3551694,[]
3829,фотофакт,2018-07-27 09:37:17,3551694,[]
3830,просил починить а предложили снести как чиновники помогли пермяку с реконструкцией детской площадки,2018-07-27 09:31:00,3551694,[]
3831,июля года й уральский добровольческий танковый корпус получил боевое крещение на орловско курской дуге,2018-07-27 08:37:00,3551694,[]
3832,дтп в рабочем поселке,2018-07-27 08:06:52,3551694,[]
3833,искусственный водопад в кусье алекандровском,2018-07-27 07:37:00,3551694,[]
3834,в эту субботу пермяки увидят красную луну,2018-07-27 06:38:00,3551694,[]
3835,один из главных артефактов вишеры камень писанный двухкилометровая стена писанного взметнула седую парму вверх на метров а на его скалах до сих пор сохранились охристые рисунки времен неолита это и послужило причиной его необычного названия,2018-07-27 05:38:00,3551694,[]
3836,мыс стрелка на закате,2018-07-26 20:53:00,3551694,[]
3837,закат,2018-07-26 20:27:00,3551694,[]
3838,в выходные похолодает а потом опять жара синоптик о том какой будет погода в конце июля,2018-07-26 19:41:00,3551694,[]
3839,дорога к радуге красновишерский район,2018-07-26 18:37:00,3551694,[]
3840,в краснокамске задержана мать погибшей от голода летней девочки,2018-07-26 17:41:00,3551694,[]
3841,храм петра и павла остров таман пермский край,2018-07-26 16:37:00,3551694,[]
3842,в перми с четвертого этажа больницы выпала семилетняя девочка,2018-07-26 15:41:00,3551694,[]
3843,сегодня в часов начал движение на белую гору свято серафимовский крестный ход общий путь паломников составит км,2018-07-26 15:16:12,3551694,[]
3844,крестный ход по героев хасана,2018-07-26 14:41:00,3551694,[]
3845,скоро август а значит наступает арбузная пора а как правильно выбрать арбуз смотрите в нашей инструкции,2018-07-26 13:33:00,3551694,[]
3846,в перми августа будет запрещена продажа алкоголя,2018-07-26 12:41:00,3551694,[]
3847,фк звезда обратился ко всем землякам с просьбой прийти сегодня на стадион и поддержать их в первом домашнем мачте,2018-07-26 11:47:00,3551694,[]
3848,именно этот красавец прибудет в пермь осенью этого года,2018-07-26 11:21:00,3551694,[]
3849,и июля в перми прошел крупный автофестиваль урал,2018-07-26 10:22:37,3551694,[]
3850,на гальперина прямо за пожарной частью что то горит предположительно склад или производство летают бочки,2018-07-26 10:14:48,3551694,[]
3851,бивень найденного в прикамье древнего слона оказался самым крупным в россии,2018-07-26 10:02:01,3551694,[]
3852,в этом году в перми отремонтируют двора,2018-07-26 08:56:00,3551694,[]
3853,стань крутым специалистом сферы телекоммуникаций,2018-07-26 08:00:00,3551694,[]
3854,пермяк возглавил новый спортивный телеканал матч премьер,2018-07-26 07:16:00,3551694,[]
3855,минутка истории,2018-07-26 06:16:00,3551694,[]
3856,туман на рассвете над лесами красновишерского района фото алексей сычев,2018-07-26 05:16:00,3551694,[]
3857,лунная ночь на реке чусовая,2018-07-26 00:11:00,3551694,[]
3858,закат на реке колве пермский край чердынский район,2018-07-25 20:01:00,3551694,[]
3859,на средней дамбе у егошихи расцвели посевные цветники возле домиков для пчел,2018-07-25 19:01:00,3551694,[]
3860,тату студия богатырь знает как выглядит счастье,2018-07-25 18:05:00,3551694,[]
3861,новый пермский футбольный клуб звезда приглашает на свой первый домашний матч,2018-07-25 17:31:00,3551694,[]
3862,у вас был капремонт дома а теперь появились дефекты есть решение,2018-07-25 16:46:00,3551694,[]
3863,забавный пермский отдыхающий,2018-07-25 16:11:00,3551694,[]
3864,летняя прогулка по перми,2018-07-25 15:16:00,3551694,[]
3865,в перми на месяц перекроют дорожный участок на улице крисанова,2018-07-25 14:21:00,3551694,[]
3866,летняя пермячка завоевала серебро на чемпионате мира по плаванию в ластах,2018-07-25 13:31:00,3551694,[]
3867,заключенного ярославской колонии избили сотрудники органов среди которых был выпускник пермского института фсин,2018-07-25 12:46:00,3551694,[]
3868,водитель поливальной машины проезжал мимо и увидел горящий грузовик ему удалось потушить пожар если бы не он кабина маза полностью бы выгорела,2018-07-25 12:01:00,3551694,[]
3869,пермяки собрали деньги во время родов младенца чтобы он успел спасти своего старшего брата,2018-07-25 11:16:00,3551694,[]
3870,новое граффити в перми автор артем,2018-07-25 10:16:00,3551694,[]
3871,каменная гряда камня дыроватый пермский край чердынский район,2018-07-25 09:16:00,3551694,[]
3872,котики играют фото вера кондратьева,2018-07-25 08:16:00,3551694,[]
3873,в эту субботу пермяки увидят красную луну,2018-07-25 07:16:00,3551694,[]
3874,оригинальное оформление одного двора в мотовилихе фото кирилл мушак,2018-07-25 06:16:00,3551694,[]
3875,центр перми с высоты,2018-07-25 05:16:00,3551694,[]
3876,закат на реке чусовая,2018-07-24 21:01:00,3551694,[]
3877,юмор в пермском автобусе,2018-07-24 20:46:00,3551694,[]
3878,ночная панорама перми с правого берега камы фото григорий скворцов,2018-07-24 19:46:00,3551694,[]
3879,ваши объявления не забудьте поставить лайк,2018-07-24 19:16:00,3551694,[]
3880,жители перми теперь могут совершать покупки из напрямую,2018-07-24 18:46:00,3551694,[]
3881,моя родина планета пермь,2018-07-24 18:17:09,3551694,[]
3882,в перми прошел семинар для некоммерческих организаций региона по социальному проектированию и получению президентских грантов,2018-07-24 17:47:00,3551694,[]
3883,карта опасных районов перми,2018-07-24 17:01:00,3551694,[]
3884,,2018-07-24 16:05:00,3551694,
3885,поле в рулонах октябрьский район близ села богородск июль год,2018-07-24 15:46:00,3551694,[]
