0,красивую зимнюю обувь для мужчин женщин и детей можно найти здесь,2019-02-02 10:10:01,23951627,[]
1,чебоксарская ук размещала на квитанциях недопустимую рекламу новости,2019-02-02 09:40:00,23951627,['новости']
2,в чебоксарах в результате аварии пострадали два подростка дтп,2019-02-02 08:40:00,23951627,['дтп']
3,житель чебоксар отправил свои интимные фотографии и попал на крючок новости,2019-02-02 07:40:00,23951627,['новости']
4,в чувашии могут перейти к оплате за фактический сбор мусора новости,2019-02-02 06:50:00,23951627,['новости']
5,в чувашии в багажнике приоры нашли похищенных овец,2019-02-02 06:20:00,23951627,[]
6,пусть суббота принесет вам радостную весть,2019-02-02 06:10:00,23951627,[]
7,ночной чат по сообщению подписчика,2019-02-02 00:26:55,23951627,[]
8,в чебоксарах из мтв центра эвакуировали людей,2019-02-01 22:35:00,23951627,[]
9,актуальные новости в формате видео за февраля видео,2019-02-01 21:43:00,23951627,['видео']
10,чебоксарец снял самое отмороженное видео по мнению певца текилы видео,2019-02-01 21:15:00,23951627,['видео']
11,дети цветы жизни благодаря активной позиции компании иско ч детство юных жителей нового города будет проходить в замечательных детских садах и школе,2019-02-01 20:15:00,23951627,[]
12,вечерний чат,2019-02-01 20:00:09,23951627,[]
13,мусорвозы застревают в чувашских селах в попытках увезти отходы новости,2019-02-01 19:04:52,23951627,['новости']
14,госслужащие выписывали штрафы на друзей и сами же их оплачивали новости,2019-02-01 16:30:04,23951627,['новости']
15,в чебоксарах на двух участках дорог введут одностороннее движение новости,2019-02-01 15:50:00,23951627,['новости']
16,в чебоксарах из мтв центра эвакуировали людей происшествия,2019-02-01 15:33:15,23951627,['происшествия']
17,шумерлинской скорой помощи сделали ремонт и пообещали планшеты новости,2019-02-01 15:02:01,23951627,['новости']
18,крутая люстра и натяжной потолок до квадратных метров бесплатно и такое реально с компанией комфорт,2019-02-01 14:00:09,23951627,[]
19,цены на свинину и хлеб в чувашии назвали самыми низкими по россии новости,2019-02-01 13:58:00,23951627,['новости']
20,мужчину обманули при попытке улететь из чебоксар ради хорошей жизни новости,2019-02-01 13:40:00,23951627,['новости']
21,тракторный завод решает проблему поставки плохих комплектующих новости,2019-02-01 13:22:00,23951627,['новости']
22,новости от подписчиков дтп,2019-02-01 13:20:47,23951627,['дтп']
23,школьники моргаушского района рассказали что учатся в коридоре новости,2019-02-01 13:01:00,23951627,['новости']
24,как правильно выбрать напольное покрытие,2019-02-01 11:55:05,23951627,[]
25,сельхозакадемия получила предупреждение за сосульки новости,2019-02-01 11:36:00,23951627,['новости']
26,в чебоксарах мужчина писал дочери смс с угрозами в адрес ее матери новости,2019-02-01 11:10:00,23951627,['новости']
27,какая погода ждет жителей чувашии в феврале погода,2019-02-01 10:50:00,23951627,['погода']
28,к юбилею чебоксар на набережной предложили установить ладью новости,2019-02-01 10:28:19,23951627,['новости']
29,в чебоксарах определили стоимость погребения одиноких людей новости,2019-02-01 09:40:20,23951627,['новости']
30,в алатыре директору стройфирмы заменят штраф на часов работы новости,2019-02-01 08:49:09,23951627,['новости']
31,читала что малоимущие семьи могут получить субсидии на оплату жку куда в чебоксарах можно обратиться для подачи заявления народныйконтроль,2019-02-01 08:10:00,23951627,['народныйконтроль']
32,чиновники заявили что в селах больше нет нехватки врачей новости,2019-02-01 07:50:00,23951627,['новости']
33,вот так мы с ребенком пролазили утром в детсад в микрорайоне университет в щелку между машиной и дверью ребенок конечно быстро проскользнул мне пришлось постараться как можно быть таким недалеким и не видеть что паркуются в плотную к входным воротам в детский сад крик души,2019-02-01 07:20:00,23951627,[]
34,в чувашии в багажнике приоры нашли похищенных овец новости,2019-02-01 06:50:00,23951627,['новости']
35,что в магазине не имеют права запрещать покупателям шесть незаконных требований,2019-02-01 06:20:00,23951627,[]
36,пятница в чувашии объявляется открытой,2019-02-01 06:05:00,23951627,[]
37,внимание пропал человек кому не сложно сделайте репост пожалуйста,2019-02-01 00:08:39,23951627,[]
38,письмо читательницы,2019-01-31 23:45:35,23951627,[]
39,как получают бесплатное жилье без очереди,2019-01-31 22:30:01,23951627,[]
40,сначала срезали детскую площадку для парковочных мест обещали новые качели за года так ничего и не появилось теперь в наглую по кустарникам въезжают как к себе домой кто нибудь должен следить за этим народныйконтроль,2019-01-31 22:05:02,23951627,['народныйконтроль']
41,к участию в лыжне россии допустят только со справкой водитель троллейбуса не обратил внимание на деда и прищемил дверью и другое,2019-01-31 21:42:17,23951627,[]
42,водитель нового автобуса объехал светофор обогнув островок безопасности видео,2019-01-31 21:40:00,23951627,['видео']
43,затрудняетесь с выбором потолков в спальню компания репа поможет определиться,2019-01-31 20:15:00,23951627,[]
44,вечерний чат по сообщению от читателей чебоксары,2019-01-31 20:00:09,23951627,['чебоксары']
45,туман и мокрый снег ожидается в чувашии в пятничный день погода,2019-01-31 19:30:03,23951627,['погода']
46,что в магазине не имеют права запрещать покупателям,2019-01-31 19:01:00,23951627,[]
47,приобрели участок нужно строиться не хочется отказываться от комфорта пока возводится капитальный дом или дом не построить так как участок маленький а бюджет еще меньше небольшой домик бытовка изготовленный компанией стройкомфорт идеально подойдет для таких случаев в ней можно отдохнуть готовить еду и даже иметь городские удобства,2019-01-31 18:00:05,23951627,[]
48,топ редких и единственных имен в чебоксарах новости,2019-01-31 17:49:04,23951627,['новости']
49,экоцентр незаконно заключил договоры с перевозчиками на вывоз мусора новости,2019-01-31 16:41:00,23951627,['новости']
50,в феврале гибдд чувашии проведет рейда новости,2019-01-31 16:20:00,23951627,['новости']
51,жители чувашии проголосовали в опросе об изменении маршрута новости,2019-01-31 16:00:16,23951627,['новости']
52,знакомьтесь это анастасия,2019-01-31 15:00:10,23951627,[]
53,брошенную в чебоксарском роддоме девочку удочерили в другом городе новости,2019-01-31 14:48:53,23951627,['новости']
54,в чебоксарском детском саду пол хотели заменить за счет родителей новости,2019-01-31 14:26:59,23951627,['новости']
55,обиженный водитель обвинил гибдд в задержании бразильских болельщиков новости,2019-01-31 14:00:12,23951627,['новости']
56,когда выгодно стричься и наводить красоту в первой половине дня или во второй пока ты тратишь огромные суммы на модельные стрижки салон цирюльникъ с февраля предоставляет всем посетителям скидку до на все услуги не упусти свой шанс подстричься по смешным ценам в чебоксарах,2019-01-31 13:00:13,23951627,[]
57,в чувашии замначальника колонии избил заключенного новости,2019-01-31 12:30:04,23951627,['новости']
58,в чувашии более тысяч семей могут получать помощь на оплату коммунальных услуг новости,2019-01-31 12:10:01,23951627,['новости']
59,обеденный тест что ели в советском союзе афиша,2019-01-31 11:45:01,23951627,['афиша']
60,чебоксарка водитель троллейбуса не обратил внимание на деда и прищемил дверью новости,2019-01-31 11:30:03,23951627,['новости']
61,в чебоксарах в прокат вышли сразу киноновинок афиша,2019-01-31 11:10:01,23951627,['афиша']
62,не все жители чебоксар проверяют исправность газового оборудования новости,2019-01-31 10:49:51,23951627,['новости']
63,в чувашии могут вернуть расчет вывоза мусора по квадратным метрам новости,2019-01-31 10:30:04,23951627,['новости']
64,магазин сантехники дамирус радует зимними скидками,2019-01-31 09:30:03,23951627,[]
65,как получают бесплатное жилье без очереди новости,2019-01-31 09:20:16,23951627,['новости']
66,утром с этими ми новыми автобусами доехать не возможно ездят через каждые минут иногда интервал еще больше автобусы переполненные ездят очень тяжело добираться на работу,2019-01-31 08:51:17,23951627,[]
67,четверг это маленькая пятница так почему бы не позволить себе отдохнуть этим вечером и не сходить например в кино или на концерт,2019-01-31 08:30:01,23951627,[]
68,в чувашии большинство считают себя бедными новости,2019-01-31 08:20:00,23951627,['новости']
69,в чебоксарах к участию в лыжне россии допустят только со справкой афиша,2019-01-31 07:50:00,23951627,['афиша']
70,в чебоксарах уличным торговкам выписали штрафов на миллион рублей новости,2019-01-31 06:50:00,23951627,['новости']
71,в россии с этого года изменятся правила продажи молочных продуктов,2019-01-31 06:20:00,23951627,[]
72,доброе утро чувашия,2019-01-31 06:05:00,23951627,[]
73,в чебоксарах поступили массовые сообщения о бомбах в школе,2019-01-30 22:30:01,23951627,[]
74,смотрите самые актуальные новости в формате видео за января,2019-01-30 21:45:00,23951627,[]
75,в шумерле собака перекрывает проход по улице новости,2019-01-30 21:15:00,23951627,['новости']
76,,2019-01-30 20:15:00,23951627,
77,вечерний чат по сообщению от читателей чебоксары,2019-01-30 20:00:12,23951627,['чебоксары']
78,в новочебоксарске требуют признать банкротом гэсстрой новости,2019-01-30 19:50:00,23951627,['новости']
79,в чувашии последний день января порадует потеплением погода,2019-01-30 19:30:03,23951627,['погода']
80,из чебоксарских школ были эвакуированы тысяч учеников новости,2019-01-30 19:00:15,23951627,['новости']
81,квартиры в центре чебоксар с планировками комфорт класса без первоначального взноса за рублей в месяц,2019-01-30 18:00:12,23951627,[]
82,в чувашии отныне можно будет купить недостающий стаж для выхода на пенсию,2019-01-30 17:50:00,23951627,[]
83,в батырево мусоровоз не забрал отходы из за снега новости,2019-01-30 17:30:05,23951627,['новости']
84,омбудсмен по правам ребенка отдавать ребенка сирийскому беженцу нецелесообразно новости,2019-01-30 17:10:01,23951627,['новости']
85,мвд прокомментировало массовые сообщения о бомбах в чувашии происшествия,2019-01-30 17:05:10,23951627,['происшествия']
86,новочебоксарцу вскружили голову доллары до потери собственных рублей новости,2019-01-30 16:47:23,23951627,['новости']
87,прокуратура не нашла павильоны на многих остановках чебоксар новости,2019-01-30 16:15:01,23951627,['новости']
88,в новочебоксарске закрыли больницу и проверили сообщение о бомбе происшествия,2019-01-30 15:56:00,23951627,['происшествия']
89,в чебоксарах захватчиков земли заставят оплатить ее использование новости,2019-01-30 15:36:16,23951627,['новости']
90,сообщения о возможно заложенной бомбе затронули торговые центры чебоксар происшествия,2019-01-30 15:01:00,23951627,['происшествия']
91,новые поступления в волга ломбард,2019-01-30 14:00:07,23951627,[]
92,массовые сообщения о бомбах поступают во многих регионах россии происшествия,2019-01-30 13:50:00,23951627,['происшествия']
93,в вурнарском районе заведующий катка собрал тысяч рублей мимо кассы новости,2019-01-30 13:44:49,23951627,['новости']
94,в чебоксарах вслед за школами эвакуировали бизнес центры происшествия,2019-01-30 13:01:00,23951627,['происшествия']
95,как сделать дизайнерский ремонт и уложиться в бюджет,2019-01-30 12:00:13,23951627,[]
96,в чувашии за прошлый год произошел резкий спад рождаемости новости,2019-01-30 11:15:00,23951627,['новости']
97,в чебоксарах поступили массовые сообщения о бомбах в школе происшествия,2019-01-30 10:50:21,23951627,['происшествия']
98,в россии с этого года изменятся правила продажи молочных продуктов новости,2019-01-30 10:35:00,23951627,['новости']
99,глядеть в потолок можно просто так а можно и с наслаждением тем более если он достанется вам даром компания по установке натяжных потолков разыгрывает полотно и его бесплатную установку в помещении до квадратных метров торопитесь принять участие уже февраля будет назван победитель,2019-01-30 09:30:01,23951627,[]
100,в чувашии на медицину потратят более миллиардов рублей новости,2019-01-30 09:21:54,23951627,['новости']
101,афиша гастролей российских звезд в феврале звери и надежда кадышева афиша,2019-01-30 08:33:00,23951627,['афиша']
102,желание выдать внучек замуж вынудило бабушку обратиться к телеэкстрасенсу новости,2019-01-30 07:40:00,23951627,['новости']
103,владелец самолета и иномарок накопил большой долг по алиментам новости,2019-01-30 06:50:00,23951627,['новости']
104,путешественники на подзарядились на единственной станции в чебоксарах,2019-01-30 06:20:00,23951627,[]
105,доброе утро угадайте название чувашской деревни по фото,2019-01-30 06:05:00,23951627,[]
106,ночной чат,2019-01-29 23:25:00,23951627,[]
107,в чувашии тысячи человек не платят за капремонт,2019-01-29 22:30:01,23951627,[]
108,крик души такая вода течет из крана уже неделю чтобы дождаться горячей воды приходиться сливать потому что льется холодная наблюдаем такую картину что из трубы сыпется шлак компания ооо ук жкх игнорирует обращения,2019-01-29 22:03:47,23951627,[]
109,смотрите самые актуальные новости в формате видео за января видео,2019-01-29 21:30:03,23951627,['видео']
110,полет над восточным поселком фоторепортаж от андрея ускова,2019-01-29 21:04:00,23951627,[]
111,какой минимальный и максимальный размер пособия по безработице в году,2019-01-29 20:25:00,23951627,[]
112,вечерний чат,2019-01-29 20:00:12,23951627,[]
113,января чистили снег и до сих пор не закрыли люк а от него в метрах находится детская площадка садовый район народныйконтроль,2019-01-29 19:07:09,23951627,['народныйконтроль']
114,вопреки стереотипам современные бытовки это не бесформенные конструкции с дверью и окном в зависимости от назначения бытовки с отделкой могут иметь не только электропроводку но и отопление водоснабжение канализацию,2019-01-29 18:00:14,23951627,[]
115,в чебоксарах продолжаются проверки работников в небольших магазинах новости,2019-01-29 17:35:39,23951627,['новости']
116,в чебоксарах по маршруту пустили новые автобусы новости,2019-01-29 17:04:33,23951627,['новости']
117,минобороны выбрало чувашию для строительства патриотического парка новости,2019-01-29 17:00:11,23951627,['новости']
118,вина отчима в изнасиловании девочки в моргаушском районе признана неопровержимой новости,2019-01-29 16:35:00,23951627,['новости']
119,школьники лавируют между дорогими машинами у входа в гимназию новости,2019-01-29 16:14:25,23951627,['новости']
120,в новочебоксарске завершили расследование по делу погибшего в бассейне мальчика новости,2019-01-29 15:40:00,23951627,['новости']
121,в чувашии может пойти ледяной дождь погода,2019-01-29 15:20:01,23951627,['погода']
122,в каких сферах самые большие и маленькие зарплаты новости,2019-01-29 15:00:12,23951627,['новости']
123,идеальный домашний очаг каждый представляет по своему одним родной дом видится просторным и светлым жилищем вторые мечтают об уютном семейном гнездышке третьи стараются претворить в жизнь принцип мой дом моя крепость но для реализации любой идеи требуется приложить немало усилий,2019-01-29 14:00:13,23951627,[]
124,на проспекте мира разливается вода новости,2019-01-29 13:59:59,23951627,['новости']
125,в чувашии более человек скрываются от военкомата новости,2019-01-29 13:21:00,23951627,['новости']
126,в чувашии с февраля увеличат размеры пособий и выплат новости,2019-01-29 13:00:15,23951627,['новости']
127,находитесь в поиске работы для вас есть работа в контактном центре газпромбанка,2019-01-29 12:00:05,23951627,[]
128,путешественники на подзарядились на единственной станции в чебоксарах новости,2019-01-29 11:42:00,23951627,['новости']
129,в чебоксарах учеников на крыльце школы встречает свора собак новости,2019-01-29 11:20:00,23951627,['новости']
130,в чебоксарах разыскивают женщину которая расплатилась в магазине чужой картой новости,2019-01-29 10:59:00,23951627,['новости']
131,игнатьев рассказал о планах оздоровить волгу за миллионов рублей новости,2019-01-29 10:52:25,23951627,['новости']
132,в чувашии тысячи человек не платят за капремонт новости,2019-01-29 10:31:00,23951627,['новости']
133,строительная компания сму вион сдала дом как и обещала сейчас компания заморозила цены а это значит что новое жилье можно будет купить по ценам года,2019-01-29 09:30:00,23951627,[]
134,новость от подписчика,2019-01-29 08:43:38,23951627,[]
