1821,уважаемые любители футбола мы подводим итоги розыгрыша билетов на матч томь сибирь который состоится в эту субботу екатерина соколова павел томский надежда жукова и роман уколов отправляются болеть за наших поздравляем,2018-03-22 07:40:25,29606802,[]
1822,разрушенное здание профилактория тгу наконец то снесут,2018-03-22 06:15:44,29606802,[]
1823,в субботу марта по томскому времени все отключаем свет,2018-03-21 16:02:00,29606802,[]
1824,после дтп рейсового автобуса с камазом госпитализированы детей и трое взрослых,2018-03-21 13:34:01,29606802,[]
1825,по предварительной информации занесло прицеп автобус был полный это значит порядка человек было в салоне автобуса,2018-03-21 13:06:44,29606802,[]
1826,пришло время благодарить врачей акция спасибо доктору стартовала в регионе врачи медсестры и фармацевты ждут ваших приятных слов по интернету и телефонам,2018-03-21 12:02:25,29606802,[]
1827,еще одно доказательство того что под крышами надо ходить очень осторожно снежная глыба обрушившаяся с крыши жилого дома томска едва не убила пенсионерку благо у нее оказалась очень хорошая реакция,2018-03-21 11:40:53,29606802,[]
1828,из томска в астану можно будет улететь с мая,2018-03-21 10:13:44,29606802,[]
1829,больше всего голосов томичи отдали за благоустройство лагерного сада это абсолютный лидер опроса также в топ попали михайловская роща пешеходный бульвар по проспекту кирова и площадь новособорная переулок томский,2018-03-21 08:38:12,29606802,[]
1830,на концерт ирины дубцовой пойдет юлия добрянская мы свяжемся с вами и расскажем как забрать билет,2018-03-21 07:49:55,29606802,[]
1831,томская семья организовала в своем гараже подпольный спиртзавод промышленный спирт мешался с ароматизаторами красителями уксусом и сахаром после чего все это разливалось по бутылкам на готовую продукцию клеились этикетки с надписью портвейн,2018-03-21 07:25:27,29606802,[]
1832,поможет ли витамин с в борьбе с гриппом нужно ли принимать противовирусные при орви какую повышенную температуру сбивать не нужно ответы на эти и многие другие актуальные вопросы в материале риа томск и на специальных карточках сибгму,2018-03-21 06:30:18,29606802,[]
1833,печально весенний томск,2018-03-20 16:22:02,29606802,[]
1834,все те же лица,2018-03-20 14:51:53,29606802,[]
1835,выиграла нина смелкова из вологды победитель был один а я отстала от нее на один балл я не расстроилась почти нисколько нина заслужила она дольше всех нас экскурсоводит,2018-03-20 13:59:57,29606802,[]
1836,готовьте ваши капюшоны порывистый ветер будет в томске почти каждый день вплоть до конца месяца,2018-03-20 12:32:54,29606802,[]
1837,впервые с года число поуехавших из томской области превысило число приехавших томичи уезжают из нашего региона в основном в другие города россии,2018-03-20 11:51:21,29606802,[]
1838,ректор тпу считает что пришло время вузам томска поступиться амбициями и объединиться под единым брендом томский университет,2018-03-20 10:40:00,29606802,[]
1839,известный японский музыкант юсуке кикучи впервые даст сольный концерт в томске апреля,2018-03-20 09:40:00,29606802,[]
1840,с завтрашнего дня томские больницы запретят навещать больных причина в превышении эпидпорога по гриппу и орви болеют в основном взрослые,2018-03-20 08:36:45,29606802,[]
1841,на концерт ай кыс кыргыс отправляются елена вяткина и ольга дитц поздравляем,2018-03-20 07:35:42,29606802,[]
1842,с сегодняшнего дня начинается самая настоящая весна астрономическая сутки делятся на равные части а день равен ночи,2018-03-20 07:33:00,29606802,[]
1843,затопленные весенние тротуары красивая доска почета на проспекте кирова верхний гастроном ниипп на красноармейской и совсем другая новособорная мы собрали еще несколько фото старого томска х годов прошлого века,2018-03-20 06:58:16,29606802,[]
1844,мальчик находится в удовлетворительном состоянии,2018-03-19 18:49:52,29606802,[]
1845,футбольный сезон стартовал и мы как и прежде радостно разыгрываем билеты на местные матчи в этот раз отдадим целых пригласительных на две персоны на дерби томь сибирь которое состоится марта,2018-03-19 16:23:00,29606802,[]
1846,эту ложку медики извлекли из желудка у летней томички,2018-03-19 14:56:02,29606802,[]
1847,паводок в томской области будет спокойным толщина льда на реках также не дает оснований для тревоги утверждают эксперты,2018-03-19 14:20:01,29606802,[]
1848,гипермаркетов лента становится больше новый откроется на цоте вместо холидея и будет работать с до,2018-03-19 12:21:09,29606802,[]
1849,хорошая погода сменится в томске похолоданием и шквалистым ветром со снегом уже завтра в целом же в последнюю декаду марта все будет очень переменчиво,2018-03-19 12:04:50,29606802,[]
1850,не пугайтесь завтра и послезавтра в томске будут взрывать лед на томи пока же специалисты пилят лед и категорически советуют закончить ходить на зимнюю рыбалку,2018-03-19 11:10:46,29606802,[]
1851,звездным гостем очередного шоу томских комиков так себе театр станет участник однажды в россии на тнт а также команды квн триод и диод максим киселев на сцене апреля вас ждет импровизационный спектакль который напишете вы сами,2018-03-19 08:19:15,29606802,[]
1852,самый красивый каток томска закрыт лед и иллюминацию демонтируют,2018-03-19 07:25:45,29606802,[]
1853,томич евгений грязев вместе со своей дочкой есенией примут участие в новом реалити шоу одинокий папа мечтает познакомиться шоу стартует сегодня на телеканале ю,2018-03-19 06:20:00,29606802,[]
1854,вот предварительные итоги выборов президента в томской области явка почти,2018-03-19 04:07:40,29606802,[]
1855,томская область известная своей невысокой избирательной активностью сегодня показала хороший результат считает член общественной палаты рф екатерина курбангалеева,2018-03-18 18:33:19,29606802,[]
1856,томичи сделали свой выбор голосование для жителей томской области завершено выборы прошли без серьезных нарушений,2018-03-18 17:38:38,29606802,[]
1857,завтра в томске ожидается сильный ветер до м с мокрый снег и гололед мчс просит томичей быть осторожными,2018-03-18 16:26:23,29606802,[]
1858,в правилах дорожного движения новые изменения с сегодняшего дня водители обязаны надевать светоотражающие жилеты выходя из машины на загородных трассах в темное время суток,2018-03-18 14:11:54,29606802,[]
1859,сегодня томичи активно делятся фотографиями с выборов президента мы собрали для вас небольшую подборку,2018-03-18 12:30:51,29606802,[]
1860,губернатор и мэр уже проголосовали сергей жвачкин рассказал какие разногласия возникли у него с женой в ходе голосования а иван кляйн решил подкрепиться на избирательном участке,2018-03-18 09:18:22,29606802,[]
1861,сегодня томичи выбирают президента рф и городские пространства которые будут благоустроены в этом году избирательные участки уже открылись и будут работать до,2018-03-18 04:34:23,29606802,[]
1862,тгу самый интернациональный вуз в россии после мгу конечно,2018-03-17 17:54:27,29606802,[]
1863,фестиваль народная рыбалка,2018-03-17 16:04:14,29606802,[]
1864,на крыше изумрудного города обгорела обшивка все посетители эвакуированы пострадавших нет,2018-03-17 14:20:36,29606802,[]
1865,в изумрудном городе пожар скоро расскажем подробности,2018-03-17 13:55:24,29606802,[]
1866,какая температура должна быть в квартире и как долго по закону может отсутствовать вода смотрите в нашей инфографике,2018-03-17 13:10:40,29606802,[]
1867,франция считается одной из самых романтичных стран мира,2018-03-17 11:07:44,29606802,[]
1868,победительницей городского конкурса школьница стала ученица школы татьяна вахрушева поздравляем,2018-03-16 17:57:17,29606802,[]
1869,уже с мая минимальная зарплата составит тысячи рублей вместо тысячи,2018-03-16 13:33:04,29606802,[]
1870,мы просили вас присылать свои дорожные фотоистории с камер видеофиксации и задавать вопросы по спорным ситуациям,2018-03-16 08:23:49,29606802,[]
1871,национальный ирландский праздник день святого патрика отмечается марта правда не только у себя на родине даже в томске в этот день можно будет посмотреть на ирландские танцы отведать ирландских напитков и примерить зеленые шляпы лепреконов что где когда в нашем материале,2018-03-16 07:12:35,29606802,[]
1872,короткометражный фильм наставник о нелегкой судьбе подростка начнут снимать в томске в апреле однако съемочная группа все еще в поисках главного героя если ты парень в возрасте лет тебя ждут на кастинге в это воскресенье,2018-03-15 12:55:33,29606802,[]
1873,федеральная сеть магазинов пятерочка заходит в томск первые три магазина открываются уже в конце марта по этим адресам,2018-03-15 08:36:24,29606802,[]
1874,мы подарим пригласительный на концерт с симфоническим оркестром евгении пушкаревой поздравляем,2018-03-15 07:55:51,29606802,[]
1875,большие концерты тимати и наташи королевой скандальный спектакль романа виктюка голос проекта яркая и насыщенная культурная неделя ожидается все подробности можно узнать здесь,2018-03-15 07:18:47,29606802,[]
1876,года строгача за попытку кражи бутылки пива и вина,2018-03-15 05:39:42,29606802,[]
1877,схк опубликовал видео утреннего инцидента на северском кпп напомним там пьяный водитель грузовика протаранил ограждение,2018-03-14 16:38:16,29606802,[]
1878,почти дождались на этой неделе выходные будут по настоящему весенними ожидаются плюсовые температуры причем теплеть начнет уже с завтрашнего дня,2018-03-14 12:14:33,29606802,[]
1879,юная тувинская вокалистка с необычным именем ай кыс кыргыс даст сольный концерт в цк тгу апреля девочка стала финалисткой конкурса синяя птица на канале россия а также участницей сезона проекта голос дети,2018-03-14 10:53:50,29606802,[]
1880,инспектор дпс денис сурганов возвращался со службы домой как вдруг заметил на улице шатающегося мужчину из руки которого шла кровь,2018-03-14 10:16:22,29606802,[]
1881,инновации просочились даже в томские колонии,2018-03-14 09:09:37,29606802,[]
1882,один пьяный водитель пытался прорваться в закрытый город а стоять в пробках теперь всем,2018-03-14 06:56:15,29606802,[]
1883,пьяный водитель камаза протаранил кпп северска,2018-03-14 06:16:45,29606802,[]
1884,о жизни политеха после реформы,2018-03-14 05:23:08,29606802,[]
1885,апреля на сцене бкз тот самый принц антуана де сент экзюпери в рамках проекта сказки с оркестром попадите в сказочный мир мальчика с золотыми волосами,2018-03-13 10:20:00,29606802,[]
1886,вопрос который мучает многих томичей что там с аркой в горсаду оказалось городские власти не могут найти общий язык с главным инвестором руководством горсада,2018-03-13 09:26:25,29606802,[]
1887,томичей хотят распрощаться с городом в ближайшие два года и переехать на новое постоянное место жительства это цифры из исследования финансового университета при правительстве рф по этому показателю мы вошли в топ по соседству в рейтинге махачкала респондентов тольятти омск и челябинск,2018-03-13 07:14:20,29606802,[]
1888,посмотрите на эту пустынные улицы томска когда то по проезжей части проспекта ленина можно было ходить а трамвайчики с машинами были совсем другими мы публикуем еще несколько фото томска х годов,2018-03-13 06:47:16,29606802,[]
1889,сегодня в томск прилетел министр финансов антон силуанов,2018-03-13 06:11:30,29606802,[]
1890,весна которую мы не ждали морозы до минус градусов ожидаются по ночам в томской области во второй декаде марта,2018-03-12 12:54:29,29606802,[]
1891,житель томской области продал оренбуржцу пакет конфет почти за тысяч рублей,2018-03-12 08:20:03,29606802,[]
1892,мы подводим итоги трех розыгрышей,2018-03-12 07:06:13,29606802,[]
1893,сесть на шпагат в гамаке постоять в планке на батуте обрести идеальную фигуру с помощью петель морского котика самые необычные и модные фитнес направления томска в нашем материале,2018-03-11 14:33:26,29606802,[]
1894,хотите узнать что ждет вас этой весной давайте поиграем,2018-03-11 11:57:20,29606802,[]
1895,то врезалась в остановку на клюева и сбила томича который на ней стоял пострадавший доставлен в больницу водитель отказался от проверки на наличие алкоголя в крови,2018-03-10 16:49:00,29606802,[]
1896,томь одержала победу над питерским динамо в домашнем матче это первый выигрыш футбольной команды в весеннем сезоне так держать,2018-03-10 13:48:35,29606802,[]
1897,сегодня прошли соревнования по снегоходному кроссу участники из разных городов сибири выясняли кто лучше управляет зимним железным конем как это было смотрите в нашем видео,2018-03-10 12:31:21,29606802,[]
1898,томский парапланерист застрял на тополе около лагерного сада спасателям потребовался час чтобы снять его с дерева к счастью спортсмен не пострадал и не замерз,2018-03-10 11:01:46,29606802,[]
1899,этого мужчину отправили выбросить сына но он не смог этого сделать,2018-03-10 09:36:00,29606802,[]
1900,клуб пожилых мужчин открылся в томске в феврале заняться спортом на пенсии захотели более человек однако не все смогли пройти медкомиссию один томич даже подделал справку в фотошопе,2018-03-10 07:43:50,29606802,[]
1901,многодетная мама юлия мустафина стала миссис томск,2018-03-09 18:16:03,29606802,[]
1902,в томске прошел чемпионат россии по кинологическому спорту наш фотокор побывала на одном из состязаний гонке буксировке на лыжах больше фото по ссылке,2018-03-09 13:13:27,29606802,[]
1903,комедийное шоу хбдс это гарик харламов тимур батрутдинов демис карабидис и андрей скороход жгучая смесь не правда ли эти звезды представят свою уникальную программу будут общаться с залом и импровизировать такое точно не повторится,2018-03-09 10:14:00,29606802,[]
1904,марта на канале моя планета стартует видеобитва лучших гидов страны одной из участниц стала томичка ксения васильева которая ранее удостоилась звания лучший гид россии,2018-03-09 07:38:37,29606802,[]
1905,все готовы отжигать апреля легендарные руки вверх снова дадут в томске большой концерт во дворце зрелищ и спорта шоу группы неизменно проходят с аншлагом а от танцев не может устоять абсолютно никто вас ждет новая программа неизменные хиты и специальные звездные гости концерта,2018-03-08 12:49:00,29606802,[]
1906,а вы хорошо понимаете о чем говорят девочки пройдите наш тест и проверьте это,2018-03-08 11:14:00,29606802,[]
1907,история спасения малыши гуляли по льду на реке ушайке один из них провалился это случайно увидели подростки,2018-03-08 09:54:22,29606802,[]
1908,битлз снова в томске,2018-03-08 08:26:00,29606802,[]
1909,балет фестиваль хоров легендарный наутилиус что еще ждет томичей в культурном гиде от риа томск,2018-03-08 07:26:02,29606802,[]
1910,нежные прекрасные незабываемые с вашим днем,2018-03-08 06:36:00,29606802,[]
1911,свиристели прилетели и метели засвистели,2018-03-07 16:39:00,29606802,[]
1912,элегантный и популярный коллектив певцов кватро исполняет итальянскую классику русский романс и всеми любимые мировые хиты эти молодые исполнители выпускники академии хорового искусства имени а в свешникова все они учились вокальному мастерству в италии мы разыгрываем пригласительный на двоих на их концерт в томске,2018-03-07 13:11:00,29606802,[]
1913,летняя томичка была доставлена по скорой в городскую больницу где ей по версии следствия долгое время не оказывалась медицинская помощь вечером того же дня она скончалась ведется проверка,2018-03-07 13:03:36,29606802,[]
1914,полиция не нашла взрывчатку,2018-03-07 11:24:16,29606802,[]
1915,марта во всех офисах страны смотрите в нашей фотоленте чем мужчины удивляли томичек накануне международного женского дня,2018-03-07 11:11:00,29606802,[]
1916,теперь потерявшиеся в томске дети смогут обратиться за помощью в любой из офисов сбербанка,2018-03-07 10:39:57,29606802,[]
1917,юрий гагарин кассанда мадам жан петерс,2018-03-07 09:46:57,29606802,[]
1918,волчица тайна обошла королевскую змею виолетту и стала красой зоопарка северска,2018-03-07 08:36:00,29606802,[]
1919,все,2018-03-07 07:53:20,29606802,[]
