3704,на камчатке премьер медведев сравнил пенсионную реформу с горьким лекарством,2018-08-10 12:05:57,49796420,[]
3705,петропавловск возглавил рейтинг городов россии по темпам перехода на безналичный расчет,2018-08-10 11:16:19,49796420,[]
3706,житель камчатки ждал медведева с плакатом денег нет но вы держитесь фото,2018-08-10 10:50:13,49796420,[]
3707,жители камчатки не могут попасть на дачи из за приезда медведева фото,2018-08-10 10:25:09,49796420,[]
3708,полицейские на камчатке возбудили почти уголовных дел о незаконной добыче рыбы,2018-08-10 10:02:08,49796420,[]
3709,кортеж премьера дмитрия медведева приехал на халактырский пляж фото видео,2018-08-10 09:35:07,49796420,[]
3710,на камчатке часть рекордного улова лососей находят выброшенной в лесу и на дорогах видео,2018-08-10 09:10:08,49796420,[]
3711,синоптики на выходных в столице камчатки ожидается хорошая погода,2018-08-10 08:45:50,49796420,[]
3712,заседание правительственной комиссии на камчатке проведут в палатке фото,2018-08-10 08:20:20,49796420,[]
3713,в исправительной колонии камчатки обвенчали молодую пару,2018-08-10 07:55:15,49796420,[]
3714,халактырский пляж на камчатке оборудовали металлоискателями фото,2018-08-10 05:50:09,49796420,[]
3715,на рынке го километра торговали рыбой с нарушением санитарных правил,2018-08-10 05:25:13,49796420,[]
3716,на камчатке в аварии трех внедорожников пострадали два человека обзор дтп,2018-08-10 05:01:51,49796420,[]
3717,фото,2018-08-10 04:30:27,49796420,['фото']
3718,на камчатке ликвидировали возгорание в нежилом доме,2018-08-10 03:20:25,49796420,[]
3719,дмитрий медведев проведет совещание в кроноцком заповеднике на камчатке,2018-08-10 02:55:13,49796420,[]
3720,в краевой столице одновременно благоустраивают восемь дворов,2018-08-10 02:30:40,49796420,[]
3721,в воскресенье в кафедральном соборе на камчатке будут продавать мед,2018-08-10 02:05:19,49796420,[]
3722,в парке на улице индустриальной оборудуют площадку для детей и спортсменов,2018-08-10 01:40:19,49796420,[]
3723,сегодня городской оркестр представит жителям петропавловска новинки репертуара,2018-08-10 01:15:15,49796420,[]
3724,жительница петропавловска осталась без денег поверив фейковой заводчице шпицев,2018-08-10 00:50:12,49796420,[]
3725,молодая пара попала под арест после разговора с губернатором камчатки,2018-08-09 13:27:02,49796420,[]
3726,житель камчатки ударил соседа ножом а потом случайно спас его,2018-08-09 12:55:08,49796420,[]
3727,польский консул встретился с камчатским министром рыбного хозяйства,2018-08-09 12:32:12,49796420,[]
3728,жителей и гостей камчатки приглашают на фестиваль море жизни,2018-08-09 12:10:22,49796420,[]
3729,лососевую путину на камчатке называют самой удачной за лет,2018-08-09 10:25:10,49796420,[]
3730,в парке на индустриальной в петропавловске устанавливают детские площадки,2018-08-09 10:03:27,49796420,[]
3731,житель камчатки обворовал знакомую оформившую для него банковскую карту,2018-08-09 10:00:14,49796420,[]
3732,в петропавловске из за антисанитарии закрыли столовую педколледжа,2018-08-09 09:46:03,49796420,[]
3733,премьер министра дмитрия медведева можно будет встретить на камчатском пляже,2018-08-09 09:35:13,49796420,[]
3734,жительница петропавловска не дождалась купленного на щенка,2018-08-09 09:31:23,49796420,[]
3735,житель камчатки за домогательства к дочери отправится в колонию на лет,2018-08-09 09:15:51,49796420,[]
3736,эксперты считают цены на бензин доступными для камчатских водителей,2018-08-09 09:10:27,49796420,[]
3737,владелец тц империал в петропавловске скрыл от налогов млн рублей,2018-08-09 09:03:37,49796420,[]
3738,стали известны доходы руководителей отделения пенсионного фонда на камчатке,2018-08-09 08:45:45,49796420,[]
3739,якутский депутат пожаловался на многочасовую задержку авиарейса с камчатки,2018-08-09 08:20:54,49796420,[]
3740,в петропавловске из за антисанитарии прикрыли столовую колледжа,2018-08-09 07:55:08,49796420,[]
3741,жителю камчатки домогавшемуся своей дочери не удалось обжаловать приговор,2018-08-09 05:50:33,49796420,[]
3742,пресс секретарь премьера медведева вступила в переписку с камчатским блогером,2018-08-09 05:25:09,49796420,[]
3743,владельца торгового центра в петропавловске осудили за налоговые преступления,2018-08-09 05:00:37,49796420,[]
3744,фото,2018-08-09 04:31:06,49796420,['фото']
3745,краевой депутат направил один миллион рублей на ремонт двух актовых залов петропавловских школ,2018-08-09 03:20:14,49796420,[]
3746,камчатские рыбоводные заводы планируют заложить миллионов икринок,2018-08-09 02:55:13,49796420,[]
3747,пьяный житель камчатки избил бывшую жену и ударил ножом вступившегося за нее соседа,2018-08-09 02:05:12,49796420,[]
3748,камчатская пенсионерка доверилась мошеннице в одноклассниках,2018-08-09 01:40:31,49796420,[]
3749,арест машины и бытовой техники напомнил жительнице петропавловска про долги,2018-08-09 01:15:34,49796420,[]
3750,в районе улицы абеля в петропавловске обустраивают тротуары,2018-08-09 00:50:21,49796420,[]
3751,на камчатке накануне приезда медведева закатали в новый асфальт дорогу к санаторию,2018-08-08 14:10:11,49796420,[]
3752,подземные родники размывают грунт в районе автостанции на кп,2018-08-08 12:31:12,49796420,[]
3753,камчатское отделение пфр выступило против повышения пенсионного возраста в регионе,2018-08-08 12:06:12,49796420,[]
3754,,2018-08-08 11:00:09,49796420,
3755,в школах и детсадах камчатки выявили нарушений пожарной безопасности,2018-08-08 10:50:51,49796420,[]
3756,власти петропавловска обещают заасфальтировать автостанцию на кп,2018-08-08 10:32:24,49796420,[]
3757,гендиректора авиа бюро на камчатке осудили за мошенничество,2018-08-08 10:25:15,49796420,[]
3758,жительница петропавловска после ареста иномарки вспомнила о крупном долге,2018-08-08 10:15:53,49796420,[]
3759,камчатец избил жену и ударил ножом соседа решившего за нее заступиться,2018-08-08 10:05:03,49796420,[]
3760,авиаперевозчиков освободили от ндс при полетах на дальний восток,2018-08-08 10:02:22,49796420,[]
3761,камчатские пограничники на катере протаранили лодку аборигенов видео,2018-08-08 09:35:24,49796420,[]
3762,на камчатке гендиректор турфирмы обманула клиентов на миллион рублей,2018-08-08 09:32:11,49796420,[]
3763,камчатцев приглашают на премьеру документального фильма бергман,2018-08-08 09:16:06,49796420,[]
3764,на камчатке тойота завалила на бок микроавтобус митсубиси обзор дтп,2018-08-08 09:10:51,49796420,[]
3765,на камчатке обнаружено объеденное медведем тело мужчины,2018-08-08 09:00:09,49796420,[]
3766,крупный медведь подрал восемь коров на камчатском сельхозпредприятии фото,2018-08-08 08:45:48,49796420,[]
3767,статистики признали камчатских учителей одними из самых обеспеченных в россии,2018-08-08 08:20:21,49796420,[]
3768,чиновник правительства камчатки попался на уловку мошенника,2018-08-08 07:55:10,49796420,[]
3769,на обучение камчатцев основам интернета власти потратят миллиона рублей,2018-08-08 05:25:13,49796420,[]
3770,на камчатке подвели итоги чемпионата по серфингу фото,2018-08-08 05:00:39,49796420,[]
3771,в петропавловске предприниматель заплатит за бивший из под земли фонтан,2018-08-08 04:35:10,49796420,[]
3772,фото,2018-08-08 04:30:08,49796420,['фото']
3773,на камчатке оштрафовали предприятие загрязняющее ручей долинный,2018-08-08 04:10:11,49796420,[]
3774,на камчатке осужденные померялись силой и интеллектом,2018-08-08 03:45:45,49796420,[]
3775,на камчатке следователи выясняют причастность медведя к смерти летнего мужчины,2018-08-08 03:20:10,49796420,[]
3776,аэровокзальный комплекс камчатки расширят на тысячи квадратных метров,2018-08-08 02:55:12,49796420,[]
3777,мошенник притворился тещей камчатца и выудил у него деньги,2018-08-08 02:05:13,49796420,[]
3778,жителям петропавловска предлагают установить на зеленой аллее именные лавочки,2018-08-08 01:40:11,49796420,[]
3779,камчатские полицейские будут обмениваться опытом с волонтерами,2018-08-08 01:15:40,49796420,[]
3780,в школах петропавловска готовятся к встрече первоклассников,2018-08-08 00:50:14,49796420,[]
3781,елизовским властям не удалось откреститься от бесхозных дорог,2018-08-07 13:45:21,49796420,[]
3782,на камчатке готовятся к встрече премьер министра дмитрия медведева,2018-08-07 12:55:10,49796420,[]
3783,в петропавловске открыли хост отель с самодельной мебелью и баром подушек,2018-08-07 12:40:01,49796420,[]
3784,икра под колесами усыпанную рыбой дорогу видели на камчатке и сахалине видео,2018-08-07 12:06:12,49796420,[]
3785,на камчатке объемы вылова лососей превзошли прошлогодний показатель,2018-08-07 10:25:33,49796420,[]
3786,на камчатке побит рекорд прошлогодней лососевой путины,2018-08-07 10:16:34,49796420,[]
3787,на камчатке посадили мстителя который сжег машину депутата заксобрания,2018-08-07 10:02:23,49796420,[]
3788,в петропавловске открылся хост отель три лыжи,2018-08-07 10:02:05,49796420,[]
3789,сентября школы петропавловска примут более первоклассников,2018-08-07 09:45:09,49796420,[]
3790,в елизове к жилым домам вышел медведь,2018-08-07 09:31:33,49796420,[]
3791,вулкан карымский на камчатке выбросил столб пепла на высоту км,2018-08-07 09:15:20,49796420,[]
3792,на камчатке бассейн базы голубая лагуна признали опасным для жизни и здоровья людей,2018-08-07 09:10:10,49796420,[]
3793,камчатцев просят помочь в поисках летнего мальчика пропавшего июня,2018-08-07 09:01:43,49796420,[]
3794,в петропавловске дым горящих автопокрышек накрыл северо восток,2018-08-07 08:46:01,49796420,[]
3795,жители и предприятия камчатки задолжали водоканалу более миллиарда рублей,2018-08-07 08:20:06,49796420,[]
3796,на камчатке вулкан карымский выбросил пепел на километра,2018-08-07 07:55:10,49796420,[]
3797,в петропавловске пожарные потушили загоревшийся плавучий док,2018-08-07 05:25:11,49796420,[]
3798,омбудсмен валентина броневич проведала александра бабака в камчатском сизо,2018-08-07 05:01:21,49796420,[]
3799,фото,2018-08-07 04:31:11,49796420,['фото']
3800,камчатцев просят помочь в поисках летнего дениса из карымая,2018-08-07 02:55:09,49796420,[]
3801,камчатский минздрав рассказал кого отправляют в санатории северного кавказа,2018-08-07 01:40:29,49796420,[]
3802,военно исторический фестиваль от руси до россии приглашает новых участников,2018-08-07 01:15:23,49796420,[]
3803,в петропавловске полицейские задержали подростка который ограбил летнего мужчину,2018-08-07 00:50:18,49796420,[]
3804,камчатский коррупционер предпочел заплатить миллиона чтобы не лишаться свободы,2018-08-06 13:45:19,49796420,[]
3805,на фестивале от руси до россии камчатцев ждут состязания рыцарей,2018-08-06 13:16:36,49796420,[]
3806,школьник из петропавловска пытался продать угнанную иномарку,2018-08-06 13:01:15,49796420,[]
3807,опрос повлияют ли акции протеста на решение властей повысить пенсионный возраст,2018-08-06 12:55:22,49796420,[]
3808,в пятницу аборигены поделятся своими секретами с жителями и гостями петропавловска,2018-08-06 12:32:47,49796420,[]
3809,власти обещают построить в петропавловске два фока с бассейнами,2018-08-06 12:05:48,49796420,[]
3810,камчатский школьник пытался продать угнанный автомобиль,2018-08-06 11:16:03,49796420,[]
3811,в бассейне камчатской базы отдыха рассвет утонул молодой мужчина,2018-08-06 10:50:07,49796420,[]
3812,статистики на камчатке смертность превышает рождаемость,2018-08-06 10:25:22,49796420,[]
3813,житель камчатки погиб в бассейне на базе отдыха,2018-08-06 10:15:49,49796420,[]
3814,юным камчатцам расскажут необыкновенные истории обыкновенных вещей,2018-08-06 10:03:10,49796420,[]
3815,камчатские таможенники забрали у моряков виски водку пиво и сигареты,2018-08-06 10:00:16,49796420,[]
3816,камчатская пенсионерка лишилась тысяч рублей продавая дачу на,2018-08-06 09:46:14,49796420,[]
3817,на камчатке бездомный пес подружился с медведем на сельской свалке видео,2018-08-06 09:35:16,49796420,[]
3818,жителей и гостей петропавловска приглашают на день аборигена,2018-08-06 09:32:15,49796420,[]
3819,два новых дома на квартир построили в елизове,2018-08-06 09:16:20,49796420,[]
3820,с сентября в петропавловске подорожают льготные проездные билеты,2018-08-06 09:01:20,49796420,[]
3821,в центре петропавловска обнаружен открытый колодец на горизонте фонтан,2018-08-06 08:46:44,49796420,[]
3822,в аварии на мильковской трассе пострадали два человека,2018-08-06 08:20:10,49796420,[]
3823,мошенница из уфы оставила без денег камчатских продавцов дачи,2018-08-06 07:55:10,49796420,[]
3824,на камчатке у скал три брата нашли труп мужчины в спасательном жилете,2018-08-06 05:50:13,49796420,[]
3825,камчатские морпехи во главе с епископом прошли крестным ходом вокруг собора фото,2018-08-06 05:25:12,49796420,[]
3826,единороссы камчатки объявили об убедительной победе на местных выборах,2018-08-06 05:00:58,49796420,[]
3827,фото,2018-08-06 04:30:43,49796420,['фото']
3828,на камчатке пожарные потушили кабину трактора беларусь,2018-08-06 03:20:18,49796420,[]
3829,в елизове сдадут два новых жилых дома на квартир,2018-08-06 02:55:13,49796420,[]
3830,жители камчатки собрали на капремонт более миллиарда рублей,2018-08-06 01:15:09,49796420,[]
3831,камчатцев приглашают увидеть литературный стендап и спектакль о докторе фаусте,2018-08-06 00:50:34,49796420,[]
3832,от подписчика,2018-08-05 11:31:34,49796420,['от']
3833,фото,2018-08-05 09:01:30,49796420,['фото']
3834,бойцы студенческих отрядов строят дороги в краевой столице,2018-08-05 08:20:16,49796420,[]
3835,житель петропавловска сначала разбил чужую машину а потом остался без собственной,2018-08-05 07:55:23,49796420,[]
3836,фото,2018-08-05 04:30:48,49796420,['фото']
3837,в роспотребнадзоре рассказали камчатцам как следует выбирать арбузы и дыни,2018-08-04 10:25:27,49796420,[]
3838,в приморье достроили первую из двух барж для камчатки,2018-08-04 10:03:46,49796420,[]
3839,фото,2018-08-04 09:01:21,49796420,['фото']
3840,фото,2018-08-04 04:33:41,49796420,['фото']
3841,мэрия петропавловска проверила управляющие компании,2018-08-03 13:45:12,49796420,[]
3842,камчатская полиция провела масштабный рейд по заброшенным зданиям,2018-08-03 13:02:36,49796420,[]
3843,на камчатке ракетчики тоф учились стрелять по кораблям противника,2018-08-03 12:07:28,49796420,[]
3844,от подписчика,2018-08-03 12:04:54,49796420,['от']
3845,камчатская семья стала победителем всероссийского конкурса среди молодых,2018-08-03 10:30:23,49796420,[]
3846,на камчатке пьяный школьник поехал ночью на квадроцикле за хлебом,2018-08-03 10:25:11,49796420,[]
3847,камчатские рыбаки идут на исторический рекорд,2018-08-03 10:15:12,49796420,[]
3848,на камчатке пьяный школьник ночью поехал за хлебом на квадроцикле,2018-08-03 10:01:27,49796420,[]
3849,камчатских осужденных исправляли с помощью святых мощей,2018-08-03 10:00:20,49796420,[]
3850,ушел из жизни известный камчатский тренер николай серебренников,2018-08-03 09:45:43,49796420,[]
3851,камчатская семья победила во всероссийском конкурсе семья года,2018-08-03 09:35:07,49796420,[]
3852,в петропавловске построят комплекс для мотогонок,2018-08-03 09:30:26,49796420,[]
3853,камчатские пожарные отстояли от огня двухэтажный частный дом,2018-08-03 09:15:21,49796420,[]
3854,со следующей недели художники начнут разукрашивать строения петропавловска,2018-08-03 09:10:26,49796420,[]
3855,в гонке героев на камчатке впервые смогут принять участие дети,2018-08-03 09:00:08,49796420,[]
3856,ушел из жизни заслуженный работник физической культуры рф николай серебренников,2018-08-03 08:46:14,49796420,[]
3857,на камчатке супругов подозревают в вербовке в экстремистскую организацию,2018-08-03 08:20:40,49796420,[]
3858,камчатским аборигенам могут отказать в квотах на рыбу из за документов,2018-08-03 07:55:20,49796420,[]
3859,на камчатке объемы вылова лососей увеличили до тысяч тонн,2018-08-03 05:50:37,49796420,[]
3860,камчатцы смогут выиграть лодочный мотор на соревнованиях по спортивной рыбалке,2018-08-03 05:25:10,49796420,[]
3861,в петропавловске планируют построить трассу для гонок на мотоциклах,2018-08-03 05:01:34,49796420,[]
3862,фото,2018-08-03 04:30:41,49796420,['фото']
3863,вилючинец купил у мошенников мотоцикл восход за тысяч рублей,2018-08-03 01:15:13,49796420,[]
3864,к осени в петропавловске планируют отремонтировать четыре спортплощадки,2018-08-03 00:50:17,49796420,[]
3865,в женской колонии на камчатке прошли веселые старты,2018-08-02 13:15:04,49796420,[]
3866,на камчатке пьяный парень неприлично оскорбил полицейского,2018-08-02 13:02:18,49796420,[]
3867,юношу из петропавловска будут судить за нецензурное оскорбление полицейского,2018-08-02 12:55:26,49796420,[]
3868,администрация елизовского района позаботилась о комфорте крокодила,2018-08-02 12:31:41,49796420,[]
3869,участники акции в петропавловске собрали больным детям более тысяч рублей,2018-08-02 12:06:29,49796420,[]
3870,камчатский школьник за надругательство над летней девочкой отсидит лет,2018-08-02 11:00:04,49796420,[]
