1165,севастополь заменит лифта в многоквартирных домах в следующем году,2018-11-01 22:27:00,55342106,[]
1166,росгвардия построит в севастополе воинскую часть за млрд рублей,2018-11-01 21:25:48,55342106,[]
1167,ответ за госдумой кпрф инициировали повышение мрот до тысяч рублей,2018-11-01 20:00:12,55342106,[]
1168,крымский серпантин,2018-11-01 19:14:00,55342106,[]
1169,в севастополе проведены публичные обсуждения результатов правоприменительной практики налоговых органов,2018-11-01 18:12:02,55342106,[]
1170,члены правительства севастополя отправятся в горы,2018-11-01 17:17:00,55342106,[]
1171,самый грандиозный лохотрон года пожалуйста будьте бдительны,2018-11-01 16:30:04,55342106,[]
1172,таланты под грифом секретно в следкоме разгорается скандал из за творческого конкурса фото видео,2018-11-01 15:30:02,55342106,[]
1173,старушка на коленях приползла в правительство севастополя,2018-11-01 14:31:00,55342106,[]
1174,сообщи где торгуют смертью,2018-11-01 13:32:27,55342106,[]
1175,придумайте название к фото,2018-11-01 13:07:00,55342106,[]
1176,горздрав севастополя при планировании закупки вакцин ошибся на млн рублей,2018-11-01 12:09:00,55342106,[]
1177,угадайте где это место,2018-11-01 11:12:00,55342106,[]
1178,остановка на остановке ульянова зачем так делать,2018-11-01 10:27:00,55342106,[]
1179,в крымском санатории на глазах у детей убили кошек,2018-11-01 09:21:00,55342106,[]
1180,севастополь,2018-11-01 08:19:00,55342106,[]
1181,севастополь,2018-10-31 23:19:00,55342106,[]
1182,открытие аллеи солнечный берег в севастополе,2018-10-31 22:49:30,55342106,[]
1183,как разводят людей от профгазбезопасность или мошенники в севастополе работают в хэллоуин,2018-10-31 20:14:00,55342106,[]
1184,добрый вечер нужна ваша помощь у нас пропала собака лабрадор касабланка кася район камышм школа м крылова без ошейника,2018-10-31 19:12:00,55342106,[]
1185,простое сочетание всегда отличное решение создавайте стильные лаконичные образы выбирая удобные модели с актуальными принтами и модные аксессуары в,2018-10-31 18:00:12,55342106,[]
1186,на севастопольское похоронное агентство совершили разбойное нападение,2018-10-31 17:14:00,55342106,[]
1187,появились кадры задержания севастопольских сотрудников гибдд которые обвиняются во взяточничестве,2018-10-31 16:30:03,55342106,[]
1188,горжусь своим крестником,2018-10-31 15:49:00,55342106,[]
1189,овсянников на дне очередной виток закулисной борьбы за власть в севастополе,2018-10-31 14:30:03,55342106,[]
1190,теракт в здании фсб подросток принес бомбу и погиб от взрыва фото подробности версии,2018-10-31 13:31:52,55342106,[]
1191,приглашаем всех на бесплатную экскурсию на античную усадьбу будет интересно горожанам всех возрастов,2018-10-31 13:17:00,55342106,[]
1192,у керченского стрелка появились последователи в новом уренгое,2018-10-31 12:47:58,55342106,[]
1193,местный респект,2018-10-31 12:09:00,55342106,[]
1194,крабы в урне эх не по севастопольски все это,2018-10-31 11:21:00,55342106,[]
1195,что делать с этими работодателями пол города загадили своей писаниной тут уже до вк добрались сломать бы им пару тыколок как думаете,2018-10-31 10:40:05,55342106,[]
1196,угадайте где это странное место,2018-10-31 09:11:00,55342106,[]
1197,севастополь,2018-10-31 08:14:00,55342106,[]
1198,правительство рф выделило млрд рублей на машины скорой помощи и школьные автобусы,2018-10-30 23:11:00,55342106,[]
1199,проект яхтенной марины в балаклаве обойдется в млн рублей,2018-10-30 22:08:00,55342106,[]
1200,сегодня в сцкии состоялось торжественное собрание посвященное й годовщине начала героической обороны севастополя гг,2018-10-30 21:09:00,55342106,[]
1201,следователи устанавливают обстоятельства жестокого убийства семилетнего мальчика,2018-10-30 20:10:00,55342106,[]
1202,,2018-10-30 19:00:04,55342106,
1203,,2018-10-30 17:29:00,55342106,
1204,нет времени объяснять твой город захватили роботы,2018-10-30 16:30:00,55342106,[]
1205,не очень публичные слушания в севастополе пытаются обсудить бюджет на следующие три года,2018-10-30 16:00:13,55342106,[]
1206,в мурманске затонул плавучий док один из самых крупнейших в мире,2018-10-30 15:00:09,55342106,[]
1207,севастопольский участок на трассе таврида почти готов,2018-10-30 14:07:00,55342106,[]
1208,где в севастополе не будет света в ноябре перечень улиц,2018-10-30 12:30:04,55342106,[]
1209,добро пожаловать в суд севастопольский главврач переплатил себе и друзьям зарплату,2018-10-30 11:32:09,55342106,[]
1210,севастополь,2018-10-30 11:29:00,55342106,[]
1211,снижение розничных цен в севастополе станет ощутимым после запуска железнодорожной части крымского моста,2018-10-30 10:31:00,55342106,[]
1212,закрывают рынок на проспекте героев сталинграда проблема дороги дублера на проспекте героев сталинграда была и при украине но власти не решались закрыть рынок приносящий тем более доход в бюджет и дающий работу многим горожанам все было вроде законно оформлены у торгующих ип налоги и прочие сборы регулярно платились в бюджет и законно оприходывались теперь все торговые объекты объявлены незаконными и людей проработавших лет на рынке просто выгоняют никаких альтернатив не предложено людей просто лишили источника их существования помню что при украине на рынке всегда собирали продукты и деньги для митингующих регионалов в киеве и феодосии в крымскую весну собирались продукты и деньги для самообороны и полная была поддержка воссоединения с родиной теперь родина благодарит прошу анонимно,2018-10-30 09:21:00,55342106,[]
1213,на северной стороне севастополя началась реконструкция пассажирского причала,2018-10-30 08:17:00,55342106,[]
1214,севастополец вырастил у себя в шкафу коноплю,2018-10-29 23:11:00,55342106,[]
1215,в севастополе планируют построить копию легендарного брига меркурий который в году одержал победу в неравном бою с двумя турецкими линейными кораблями,2018-10-29 22:09:00,55342106,[]
1216,,2018-10-29 21:24:00,55342106,
1217,итоги конкурса,2018-10-29 20:33:20,55342106,[]
1218,где в севастополе потусить на хэллоуин одному и с детьми афиша,2018-10-29 20:00:10,55342106,[]
1219,человек погибли при крушении боинга в индонезии подробности видео,2018-10-29 19:00:11,55342106,[]
1220,есть в севастополе одна собака,2018-10-29 18:21:00,55342106,[]
1221,открытие новой аллеи тц симолл,2018-10-29 17:09:00,55342106,[]
1222,необычный ракурс,2018-10-29 16:24:00,55342106,[]
1223,севастополь потратит миллионы на переобучение предпенсионеров,2018-10-29 15:16:46,55342106,[]
1224,найдено портмоне,2018-10-29 14:07:00,55342106,[]
1225,хроника дтп в крыму за минувшие выходные фото видео,2018-10-29 13:03:38,55342106,[]
1226,севастополь ищет проектировщика для яхтенной марины в балаклаве,2018-10-29 12:11:00,55342106,[]
1227,человек погибли при крушении боинга в индонезии подробности видео,2018-10-29 11:57:18,55342106,[]
1228,хочу поведать о псевдо сервисном центре оникс сервис оказывают услуги по ремонту бойлеров и стиральных машин вот их группа ссылка удалена админ и есть даже сайт история такова сломался бойлер залезла в интернет нашла их сайт собственно наличие сайта и адреса офиса меня и подкупило все домашние были на работе кроме папы пенсионера пришли двое молодых людей провели диагностику сказали что сгорел тэн стоимость запчасти и работы составит руб тэн и работа как бы уже не мало ошибка папы была в том что он согласился даже никому из домашних не позвонив посоветоваться на этом специалисты решили не останавливаться и после всех манипуляций объявили конечную сумму ремонта руб папа конечно офигел от такой суммы но заплатил к руб добавилась еще за чистку бойлера и рублей за новый анод который как оказалось стоит рублей чеков квитанций естественно никто не дал по итогу бойлер вечером грел но не на полную на следующий день вызвали их еще раз чтобы отрегулировать температуру на этот раз специально отпросилась с работы чтобы увидеть их лично пришли отрегулировали что нужно было на мои вопросы почему такие космические суммы за которые можно практически новый бойлер купить отвечали мы спросили нам сказали делать с одной стороны вроде правы но с другой нормальные ремонтники обычно говорят что лучше уже новый прибор купить чем за такие деньги ремонтировать старый на вопрос где чеки хотя бы на з ч отвечали что мы частные лица и чеков у нас нет и вообще это наше право говорить сколько стоит запчасть и сколько брать за работу короче это не сервис а обычное нае лово в лице двух бессовестных молодых людей видят что перед ними наивный пожилой человек но все равно жажда халявы берет верх действуя по их логике можно пригласить их отремонтировать например стиралку и самому решить сколько заплатить за их работу и запчасти чеков то все равно нет прошу простить за многабукав но я впервые встречаю таких бессовестных людей,2018-10-29 11:11:00,55342106,[]
1229,информируем,2018-10-29 10:35:07,55342106,[]
1230,в севастополе сегодня утром столкнулись два авто,2018-10-29 09:40:03,55342106,[]
1231,севастополь,2018-10-29 08:19:00,55342106,[]
1232,первый в истории,2018-10-28 21:22:00,55342106,[]
1233,горжусь своим крестником,2018-10-28 20:19:06,55342106,[]
1234,если вам надоел севастополь прогуляйтесь по нему во время урагана,2018-10-28 19:21:00,55342106,[]
1235,когда занят перепиской с девушкой,2018-10-28 18:21:00,55342106,[]
1236,открытие аллеи за тц особенно впечатлили большие ростовые куклы в виде трансформеров,2018-10-28 17:41:12,55342106,[]
1237,ретро севастополь,2018-10-28 16:21:00,55342106,[]
1238,сейчас на аллеи за тц симолл праздник в самом разгаре,2018-10-28 16:05:27,55342106,[]
1239,уеду в севастополь новая песня и клип посвященная городу герою,2018-10-28 15:12:00,55342106,[]
1240,симолл готов принять гостей,2018-10-28 14:03:27,55342106,[]
1241,местный респект,2018-10-28 12:14:00,55342106,[]
1242,разместите ссылку пожалуйста сделайте доброе дело для приюта бездомных животных им реально тяжело выгребать без нашей помощи приют для животных бим в севастополе,2018-10-28 11:14:00,55342106,[]
1243,а вот и крым в крыму,2018-10-28 09:55:40,55342106,[]
1244,когда разбудили рано утром в воскресенье,2018-10-28 08:56:36,55342106,[]
1245,в севастополе снизилась смертность от болезней органов дыхания,2018-10-27 22:32:00,55342106,[]
1246,афиша открытия новой аллеи тц,2018-10-27 21:31:00,55342106,[]
1247,севастопольцы не спешат писать о любви в соцсетях,2018-10-27 20:19:00,55342106,[]
1248,,2018-10-27 19:00:02,55342106,
1249,на детской площадке в комсомольском парке сломана лестница порван канат лежат осколки шифера и торчат гвозди,2018-10-27 17:33:00,55342106,[]
1250,севастопольцам могут запретить остекление балконов,2018-10-27 16:07:00,55342106,[]
1251,ваши любимые места в севастополе,2018-10-27 15:04:00,55342106,[]
1252,наконец то в севастополе осень,2018-10-27 13:17:00,55342106,[]
1253,решила порадовать вас запустив веселый,2018-10-27 12:00:05,55342106,[]
1254,за то как от пешеходов требовать соблюдение пдд так водителя первые анон плз,2018-10-27 11:03:01,55342106,[]
1255,новость фейк,2018-10-27 10:32:23,55342106,[]
1256,совет фифа признал чм в россии лучшим в истории гордимся,2018-10-26 23:07:00,55342106,[]
1257,лайфхак применив такой фон наши телеканалы станут интереснее,2018-10-26 21:19:00,55342106,[]
1258,очередь на автобус на северную,2018-10-26 20:34:00,55342106,[]
1259,глава крыма просит фсб вернуть выданные на взятки миллионы,2018-10-26 20:02:03,55342106,[]
1260,,2018-10-26 19:00:03,55342106,
1261,в севастополе открывается новая благоустроенная зона отдыха,2018-10-26 18:28:00,55342106,[]
1262,в продолжение темы реновации в севастополе ломать не строить,2018-10-26 18:00:18,55342106,[]
1263,сегодня в севастополе начинается отопительный сезон,2018-10-26 17:18:00,55342106,[]
1264,севастопольского школьника жестоко избили из за толстовки,2018-10-26 16:24:00,55342106,[]
1265,разрушительный удар стихии наводнение в туапсе и сочи унесло жизни человек,2018-10-26 15:35:00,55342106,[]
1266,в севастополе снова заговорили о строительстве метро,2018-10-26 14:19:30,55342106,[]
1267,кто виноват в перевозках и сбое оборудования опять вв,2018-10-26 13:04:00,55342106,[]
1268,шутки в сторону россиянам нужно поменять полис омс до ноября,2018-10-26 11:50:00,55342106,[]
1269,хотим поделиться очень интересным видео о барыге из донецка цыкало виталии сергеевиче помимо семьи которая представлена в репортаже в городе есть еще несколько семей страдающих от ан кристалл и этого цыкало полиция и прокуратура отказывается принимать какие либо действия просьба максимальный репост цыкало был уже осужден за мошенничество но из за наличия несовершеннолетнего ребенка боже дай бог она вырастет не в отца ему дали условное прошу не оставаться равнодушными,2018-10-26 11:17:00,55342106,[]
1270,до конца года бензин может подорожать еще на три рубля,2018-10-26 10:00:12,55342106,[]
1271,,2018-10-26 09:18:16,55342106,
1272,в крыму выпал первый снег,2018-10-26 08:00:07,55342106,[]
1273,собаки севастопольского госотлова,2018-10-25 22:03:36,55342106,[]
1274,названы имена самых богатых женщин россии,2018-10-25 20:00:08,55342106,[]
1275,,2018-10-25 19:00:07,55342106,
1276,на украине в аварийном режиме отключали четвертый блок запорожской аэс что ждет атомную отрасль украины,2018-10-25 18:30:03,55342106,[]
1277,кадры с школы,2018-10-25 18:17:00,55342106,[]
1278,в севастополе назвали дату начала отопительного сезона,2018-10-25 17:18:00,55342106,[]
1279,вторжение роботов в севастополе,2018-10-25 16:00:11,55342106,[]
1280,армагеддон в краснодарском крае поезда не ходят население эвакуировано по улицам плывут холодильники,2018-10-25 14:08:00,55342106,[]
1281,рынок на м км могут снести,2018-10-25 13:31:00,55342106,[]
1282,эвакуация школы в севастополе,2018-10-25 12:40:25,55342106,[]
1283,севастопольцы ливневки пока справляются,2018-10-25 11:48:12,55342106,[]
1284,видовая терраса и сквер георгиевского монастыря в севастополе изменены до неузнаваемости,2018-10-25 10:00:15,55342106,[]
1285,как одинокая пенсионерка сражалась с системой,2018-10-25 09:19:00,55342106,[]
1286,концепцию севастопольский метрополитен представят сегодня не пропустите,2018-10-25 09:06:04,55342106,[]
1287,наконец то современные методы обособления пешеходного перехода от проезжей части ремонт на пл восставших,2018-10-25 08:27:32,55342106,[]
1288,осенние дороги в крыму,2018-10-25 07:17:00,55342106,[]
1289,севастополь,2018-10-24 22:57:12,55342106,[]
1290,загрязняете воздух идите за урал,2018-10-24 20:00:12,55342106,[]
1291,,2018-10-24 19:00:05,55342106,
1292,будет ли в севастополе реновация с человеческим лицом,2018-10-24 18:00:15,55342106,[]
1293,молодые мечтатели и городские романтики наслаждайтесь осенними моментами в комфортных и стильных моделях от,2018-10-24 17:00:04,55342106,[]
1294,мчс предупредило о резком ухудшении погоды в крыму,2018-10-24 16:59:22,55342106,[]
1295,отдохнуть и убираться бахлыков уходит в отпуск а затем уходит совсем,2018-10-24 16:30:05,55342106,[]
1296,впервые за три года у тысяч севастопольцев появилась надежда на жилье в бывших общежитиях,2018-10-24 15:52:53,55342106,[]
1297,друзья пока погода радует нас надо гулять и познавать свой край,2018-10-24 15:17:00,55342106,[]
1298,черноморский полумарафон севастополь октября,2018-10-24 14:07:00,55342106,[]
1299,вторжение роботов в севастополе,2018-10-24 14:00:11,55342106,[]
1300,севастополь получил еще новых троллейбусов,2018-10-24 13:18:00,55342106,[]
1301,поножовщина на юмашевском рынке,2018-10-24 12:11:00,55342106,[]
1302,севастополь,2018-10-24 11:14:00,55342106,[]
1303,иск правительства севастополя к тц отозван,2018-10-24 10:12:00,55342106,[]
1304,в севастополе началось благоустройство сквера на площади пирогова и захарова,2018-10-24 09:07:00,55342106,[]
1305,,2018-10-24 08:16:01,55342106,
1306,севастополь,2018-10-23 23:31:00,55342106,[]
1307,севастопольские общественники проведут мониторинг цен в аптеках,2018-10-23 22:39:00,55342106,[]
1308,севастопольцы раскрыли человека загадку,2018-10-23 21:09:00,55342106,[]
1309,в крым и севастополь идут дожди и грозы прогноз на неделю,2018-10-23 20:04:00,55342106,[]
1310,в крыму пассажирам троллейбуса предложили расплачиваться визой и мастеркард,2018-10-23 19:04:00,55342106,[]
1311,когда уже установят пандусы на памятнике авиаторам они вынуждены объезжать ступеньки по дороге,2018-10-23 18:03:02,55342106,[]
1312,заяви о проблеме в севастополе проведут конкурс социальной рекламы,2018-10-23 17:00:11,55342106,[]
1313,родители керченского стрелка не забирают тело сына из морга,2018-10-23 16:03:00,55342106,[]
1314,осень на улицах севастополя,2018-10-23 15:08:00,55342106,[]
1315,источник в ближайшее время севастополь может столкнуться с дефицитом акушеров гинекологов,2018-10-23 14:04:00,55342106,[]
1316,привет наш будущий клиент,2018-10-23 13:00:12,55342106,[]
