1371,жене главы района на камчатке пришлось уволиться по настоянию прокуратуры,2018-11-26 09:10:24,49796420,[]
1372,на камчатке стартовала неделя бесплатного тестирования на вич,2018-11-26 09:01:54,49796420,[]
1373,циклон из охотского моря несет на камчатку сильный снег и ветер,2018-11-26 08:45:33,49796420,[]
1374,на камчатке уволили чиновницу предложившую чпокнуть инвалида дротиком как животное,2018-11-26 08:20:09,49796420,[]
1375,пьяный водитель на тойоте наехал на ограждение и скамейку,2018-11-26 07:55:14,49796420,[]
1376,на камчатке против руководителей трех ук возбудили уголовные дела,2018-11-26 06:40:25,49796420,[]
1377,летний камчатский пенсионер прострелил голову жителю алтайского края,2018-11-26 06:15:40,49796420,[]
1378,камчатцев приглашают пройти тест на вич инфекцию,2018-11-26 05:50:12,49796420,[]
1379,женщина пытаясь перекодировать платежный терминал раз перевела деньги мошеннику,2018-11-26 05:25:08,49796420,[]
1380,в петропавловске оторвавшееся колесо тягача врезалось в пенсионерку,2018-11-26 05:00:52,49796420,[]
1381,фото,2018-11-26 04:30:47,49796420,['фото']
1382,на камчатке рыбакам расскажут о безопасном поведении на льду,2018-11-26 03:20:10,49796420,[]
1383,эксперты вновь отнесли камчатку к самым пьющим регионам страны,2018-11-26 02:55:14,49796420,[]
1384,камчатский студент завоевал серебро национального чемпионата абилимпикс,2018-11-26 01:15:37,49796420,[]
1385,на камчатке сотрудники колонии тренировались искать сбежавших осужденных,2018-11-26 00:50:08,49796420,[]
1386,участник своей игры на нтв выиграл рублей на вопросе о депутате пучковском,2018-11-25 12:05:31,49796420,[]
1387,двух бабушек наградили медалью материнская слава камчатки,2018-11-25 10:25:12,49796420,[]
1388,на камчатке определились с датой открытия лыжного сезона,2018-11-25 10:02:08,49796420,[]
1389,жителей камчатки угостят галушками чак чаком и толокушей,2018-11-25 09:10:13,49796420,[]
1390,фото,2018-11-25 09:00:50,49796420,['фото']
1391,камчатским матерям сказали спасибо за мудрость и терпение,2018-11-25 08:45:23,49796420,[]
1392,к декабря в петропавловске готовят лыжню здоровья,2018-11-25 08:20:21,49796420,[]
1393,в петропавловске эвакуировали жильцов из горящей пятиэтажки,2018-11-25 07:55:17,49796420,[]
1394,фото,2018-11-25 04:30:25,49796420,['фото']
1395,на камчатке зарегистрировали новое землетрясение,2018-11-25 02:55:13,49796420,[]
1396,камчатских дачников спасли от агрессивной своры породистых собак,2018-11-24 12:05:07,49796420,[]
1397,фото,2018-11-24 09:01:36,49796420,['фото']
1398,с участников международной опг суд взыскал млн рублей преступного дохода,2018-11-24 09:01:23,49796420,[]
1399,в петропавловске начали копить снег для новогоднего городка,2018-11-24 08:45:13,49796420,[]
1400,роснедра готовы продлить газпрому лицензию по западно камчатскому участку,2018-11-24 08:20:20,49796420,[]
1401,дилеры вернут более х миллионов полученных за поставку наркотиков на камчатку,2018-11-24 07:55:06,49796420,[]
1402,фото,2018-11-24 04:30:41,49796420,['фото']
1403,статистики камчатка самый обеспеченный легковыми автомобилями регион россии,2018-11-23 13:45:14,49796420,[]
1404,в петропавловске черная жижа с запахом мазута течет во двор жилого дома,2018-11-23 12:05:18,49796420,[]
1405,жители камчатки взяли в долг у банков миллиард рублей,2018-11-23 11:16:02,49796420,[]
1406,пьяный грузчик украл из магазина на камчатке пиво шампанское и деньги,2018-11-23 11:01:12,49796420,[]
1407,индивидуальный расчет осаго тарифы на автогражданку изменятся,2018-11-23 10:53:01,49796420,[]
1408,на камчатке владельца затонувшего сухогруза проверит гострудинспекция,2018-11-23 10:51:52,49796420,[]
1409,спецгруппы будут отгонять медведей от жителей камчатки,2018-11-23 10:31:09,49796420,[]
1410,защитой жителей камчатки от медведей займутся опергруппы охотников,2018-11-23 10:25:08,49796420,[]
1411,жителей петропавловска приглашают на дегустацию национальных блюд,2018-11-23 10:15:19,49796420,[]
1412,в центре петропавловска начался монтаж новогодней елки,2018-11-23 10:02:10,49796420,[]
1413,пьяный уголовник обокрал на камчатке сельский магазин и терминал оплаты,2018-11-23 10:00:26,49796420,[]
1414,очевидцы рассказали следователям о гибели судна анатолий крашенинников,2018-11-23 09:45:34,49796420,[]
1415,на камчатке полиция ищет попавшего на видео похитителя велосипеда,2018-11-23 09:35:02,49796420,[]
1416,камчатская полиция ищет велосипедного вора засветившегося на видеокамере,2018-11-23 09:31:25,49796420,[]
1417,на камчатке отчима обвиняют в изнасиловании падчерицы в салоне джипа,2018-11-23 09:16:06,49796420,[]
1418,соцсети приглашают жителей камчатки в клуб дружеского секса,2018-11-23 09:10:09,49796420,[]
1419,в петропавловске пенсионер убил знакомую за оскорбление своей возлюбленной,2018-11-23 09:01:52,49796420,[]
1420,на камчатке экологи и студенты опробуют новую технологию воспроизводства лососей,2018-11-23 08:45:59,49796420,[]
1421,следователи допросили выживших моряков и пассажиров анатолия крашенинникова,2018-11-23 08:20:28,49796420,[]
1422,сми поддельной камчатской икрой бойко торгуют на улицах петербурга,2018-11-23 07:55:14,49796420,[]
1423,в полицию пожаловались на активистку с плакатами про пенсионеров и вексельберга,2018-11-23 06:40:25,49796420,[]
1424,житель петропавловска надругался над падчерицей в салоне внедорожника,2018-11-23 06:15:19,49796420,[]
1425,в мэрии петропавловска обещают установить елку в центре города к середине декабря,2018-11-23 05:50:19,49796420,[]
1426,,2018-11-23 05:30:00,49796420,
1427,в петропавловске мусоровоз съехал со склона во двор пятиэтажки фото,2018-11-23 05:25:09,49796420,[]
1428,житель петропавловска убил женщину и вызвал ей скорую,2018-11-23 05:00:08,49796420,[]
1429,фото,2018-11-23 04:30:18,49796420,['фото']
1430,синоптики в воскресенье к берегам камчатки подойдет новый циклон,2018-11-23 03:20:08,49796420,[]
1431,на камчатке подрядчик фонда капремонта присвоил почти миллиона рублей,2018-11-23 02:55:16,49796420,[]
1432,в петропавловске заключенные приложили руку к обустройству хоккейной площадки,2018-11-23 02:05:15,49796420,[]
1433,более пар выступят на кубке главы петропавловска по танцевальному спорту,2018-11-23 01:40:06,49796420,[]
1434,камеры и прогулочный дворик ивс впечатлили камчатских школьников,2018-11-23 01:15:29,49796420,[]
1435,семей в селе мильково переедут в новый пятиэтажный дом,2018-11-23 00:52:32,49796420,[]
1436,у девяти учеников школы на камчатке диагностировали пневмонию,2018-11-22 15:50:34,49796420,[]
1437,власти петропавловска рассчитывать достроить дк срв через два три года,2018-11-22 13:15:09,49796420,[]
1438,в петропавловске на северо востоке оборудовали площадку для выгула собак,2018-11-22 13:02:26,49796420,[]
1439,жителям дальнего востока временно разрешили ввозить иномарки без эра глонасс,2018-11-22 12:32:05,49796420,[]
1440,на камчатке внимание к проблеме распространения вич привлекут концертом,2018-11-22 12:05:04,49796420,[]
1441,на границе с украиной таможенники изъяли у жителя камчатки тысяч долларов,2018-11-22 11:40:14,49796420,[]
1442,на камчатке утвердили маршрут гонки на собачьих упряжках берингия,2018-11-22 11:15:23,49796420,[]
1443,участники берингии на камчатке преодолеют километров,2018-11-22 11:02:08,49796420,[]
1444,в мэрии петропавловска показали каким будет новый дом культуры на срв фото,2018-11-22 10:50:11,49796420,[]
1445,в петропавловске открылась выставка известного живописца джона грициенко,2018-11-22 10:45:22,49796420,[]
1446,более жителей камчатского поселка оказались в транспортной блокаде,2018-11-22 10:32:00,49796420,[]
1447,в петропавловске обустроили площадку для дрессировки собак фото,2018-11-22 10:25:17,49796420,[]
1448,камчатские танцоры поспорят за кубок главы петропавловска,2018-11-22 10:16:00,49796420,[]
1449,ростелеком запустил новое приложение для камчатских гостиниц,2018-11-22 10:03:16,49796420,[]
1450,рай по китайски или как в ханчжоу любуются болотом и едят чай,2018-11-22 10:00:18,49796420,[]
1451,в камчатском селе мильково готовят к заселению новый дом на семей,2018-11-22 09:45:22,49796420,[]
1452,поселок таежный на камчатке оказался отрезанным от дорожного сообщения,2018-11-22 09:35:15,49796420,[]
1453,в порту петропавловска в результате взрыва пострадал рабочий,2018-11-22 09:30:49,49796420,[]
1454,житель петропавловска из за ревности зарезал друга,2018-11-22 09:15:49,49796420,[]
1455,на камчатке школу закрыли на карантин из за вспышки пневмонии,2018-11-22 09:10:11,49796420,[]
1456,в сгоревшем здании рыбзавода на камчатке обнаружены тела двух человек,2018-11-22 09:01:10,49796420,[]
1457,камчатского политика александра бабака выпустили на свободу,2018-11-22 08:45:15,49796420,[]
1458,в роспотребнадзоре рассказали о вспышке пневмонии в камчатской школе,2018-11-22 08:20:13,49796420,[]
1459,в морском порту петропавловска рабочий получил травмы после взрыва газового баллона,2018-11-22 07:55:13,49796420,[]
1460,житель петропавловска из за ревности убил друга,2018-11-22 05:00:18,49796420,[]
1461,фото,2018-11-22 04:30:32,49796420,['фото']
1462,в сгоревшем здании заброшенного рыбзавода на камчатке обнаружены два трупа,2018-11-22 04:10:10,49796420,[]
1463,в аварии на камчатке пострадали две пожилые женщины обзор дтп,2018-11-22 03:45:30,49796420,[]
1464,предприниматель из петропавловска лишился товара за долги,2018-11-22 03:20:05,49796420,[]
1465,стали известны подробности жизни пенсионеров которые хотели умереть в один день,2018-11-22 02:55:12,49796420,[]
1466,на камчатке алтайский матрос хотел купить запчасти но остался без товара и денег,2018-11-22 01:15:16,49796420,[]
1467,в петропавловске одиннадцать пожарных тушили подвал в доме на тушканова,2018-11-22 00:50:33,49796420,[]
1468,на камчатке военные борются со снегом в аэропорту елизова,2018-11-21 13:45:35,49796420,[]
1469,камчатскому депутату предъявили обвинение во взяточничестве,2018-11-21 13:30:15,49796420,[]
1470,с камчатки полетели чартеры в таиланд,2018-11-21 13:15:29,49796420,[]
1471,жителей камчатки призвали помочь семьям с больными детьми фруктами и канцтоварами,2018-11-21 12:31:19,49796420,[]
1472,в таможне рассказали сколько алкоголя жители камчатки смогут привезти из таиланда,2018-11-21 12:05:13,49796420,[]
1473,пенсии на камчатке за год выросли меньше инфляции,2018-11-21 11:16:21,49796420,[]
1474,камчатцев призывают присоединиться к международному дню благотворительности,2018-11-21 11:02:13,49796420,[]
1475,краевые власти рассказали сколько потратили денег из бюджета на поддержку ученых,2018-11-21 10:50:08,49796420,[]
1476,в петропавловске впервые обнаружили фальшивую купюру номиналом рублей,2018-11-21 10:45:15,49796420,[]
1477,в петропавловске спасатели сняли подростка с карниза балкона третьего этажа,2018-11-21 10:30:25,49796420,[]
1478,на камчатке впервые обнаружили фальшивую купюру номиналом рублей,2018-11-21 10:25:32,49796420,[]
1479,у берегов камчатки ожидается мощный шторм,2018-11-21 10:15:53,49796420,[]
1480,народный фотоклуб камчатка представит мгновения,2018-11-21 10:00:47,49796420,[]
1481,камчатских травматологов научат лечить переломы,2018-11-21 09:45:57,49796420,[]
1482,на скользкой дороге шевроле вынесло навстречу ленд крузеру фото видео,2018-11-21 09:35:09,49796420,[]
1483,две многодетные семьи получили квартиры в новостройке петропавловска,2018-11-21 09:31:06,49796420,[]
1484,жительница камчатки ударила мужа ножом в аэропорту и уехала домой,2018-11-21 09:15:35,49796420,[]
1485,после ремонта канализации в камчатском лицее первоклассники дышат сероводородом,2018-11-21 09:10:07,49796420,[]
1486,в вилючинске женщина на перевернулась в кювете,2018-11-21 09:02:33,49796420,[]
1487,в следственном комитете ответили на заявление арестованного депутата быкова,2018-11-21 08:45:27,49796420,[]
1488,эксперты признали камчатку не самым комфортным регионом для работы пенсионеров,2018-11-21 08:20:16,49796420,[]
1489,компании виктора вексельберга на камчатке получат новые налоговые льготы,2018-11-21 05:25:06,49796420,[]
1490,в вилючинске женщина получила травмы в перевернувшейся тойоте обзор дтп,2018-11-21 05:00:41,49796420,[]
1491,фото,2018-11-21 04:30:41,49796420,['фото']
1492,женщину ударившую мужа ножом в аэропорту обвиняют в покушении на убийство,2018-11-21 04:10:10,49796420,[]
1493,стало известно где на камчатке платят самые высокие и низкие зарплаты,2018-11-21 03:45:12,49796420,[]
1494,на камчатке председатель кооператива нажился на установке дверей,2018-11-21 03:20:16,49796420,[]
1495,в театре пройдет презентация пьесы об обороне петропавловска в крымскую войну,2018-11-21 02:55:16,49796420,[]
1496,в петропавловске многодетные семьи поселили в новые квартиры на ломоносова,2018-11-21 01:40:12,49796420,[]
1497,в селе мильково огонь уничтожил сузуки циаз и деревянные строения,2018-11-21 01:15:36,49796420,[]
1498,на всероссийском конкурсе новая звезда камчатку представит лина зибрицкая,2018-11-21 00:50:20,49796420,[]
1499,камчатские спасатели эвакуировали пострадавшего на плавбазе матроса,2018-11-20 13:00:26,49796420,[]
1500,камчатский камерный оркестр имени георгия аввакумова отметит юбилей концертом,2018-11-20 12:05:22,49796420,[]
1501,двухлетняя варвара нашлась с ней все в порядке,2018-11-20 11:40:11,49796420,[]
1502,в аэропорту на камчатке женщина из за денег ударила ножом своего мужа,2018-11-20 11:16:08,49796420,[]
1503,на камчатке раненого матроса доставили в краевую больницу,2018-11-20 10:50:23,49796420,[]
1504,на камчатке коммунисты выйдут на митинг в поддержку арестованного депутата быкова,2018-11-20 10:25:15,49796420,[]
1505,в петропавловске полицейские нашли и вернули летнюю девочку маме,2018-11-20 10:15:41,49796420,[]
1506,у берегов камчатки матрос получил серьезные травмы при падении с трапа,2018-11-20 10:00:46,49796420,[]
1507,на камчатке спасатели вылетели на вертолете к сорвавшемуся с трапа матросу,2018-11-20 10:00:12,49796420,[]
1508,жителей петропавловска приглашают на финальную игру квн,2018-11-20 09:45:13,49796420,[]
1509,пропал ребенок в петропавловске полиция и добровольцы ищут двухлетнюю варвару,2018-11-20 09:35:14,49796420,[]
1510,камчатская вокалистка участвует в телевизионном конкурсе новая звезда,2018-11-20 09:30:14,49796420,[]
1511,в петропавловске учеников школы эвакуировали из за задымления,2018-11-20 09:15:47,49796420,[]
1512,на камчатке продолжают снижаться цены на красную икру,2018-11-20 09:10:26,49796420,[]
1513,у пирса судоремонтного завода в петропавловске горел плашкоут,2018-11-20 09:01:28,49796420,[]
1514,синоптики завтра камчатку заденет циклон из тихого океана,2018-11-20 08:45:17,49796420,[]
1515,рядом с лесом в вилючинске построят новый микрорайон,2018-11-20 08:20:14,49796420,[]
1516,в петропавловске детей эвакуировали из задымленной школы,2018-11-20 07:55:13,49796420,[]
1517,компания мастер заплатит миллиона рублей за недоделки при строительстве морвокзала,2018-11-20 05:50:05,49796420,[]
1518,микроавтобус не пропустил внедорожник на паратунской трассе обзор дтп,2018-11-20 05:25:10,49796420,[]
1519,у пирса судоремонтного завода в петропавловске загорелся плашкоут,2018-11-20 05:00:24,49796420,[]
1520,фото,2018-11-20 04:30:35,49796420,['фото']
1521,полиция обнародовала видео задержания чиновника росприроднадзора,2018-11-20 03:20:17,49796420,[]
1522,в полиции рассказали подробности задержания и допроса человека с обрезом,2018-11-20 02:55:10,49796420,[]
1523,на камчатке не зарегистрировали ни одного случая гриппа,2018-11-20 02:30:08,49796420,[]
1524,авиакомпании на камчатке пока не продают билеты по новой льготной программе,2018-11-20 02:05:05,49796420,[]
1525,почти половину наград всероссийского турнира по самбо забрали камчатские спортсмены,2018-11-20 01:45:06,49796420,[]
1526,камчатские ученые изучат гуся белошея с помощью фотоловушки,2018-11-20 01:15:34,49796420,[]
1527,безработный из вилючинска попал под статью за организацию наркопритона,2018-11-20 00:50:13,49796420,[]
1528,победительницей мисс камчатка стала эвелина латыпова,2018-11-19 12:55:07,49796420,[]
1529,на камчатке чиновника федерального ведомства задержали при получении взятки,2018-11-19 12:30:24,49796420,[]
1530,морской торговый порт усть камчатска признали банкротом,2018-11-19 12:05:12,49796420,[]
1531,на камчатке при лобовом столкновении автомобилей пострадали два человека,2018-11-19 10:50:13,49796420,[]
1532,вилючинский уголовник организовал наркопритон в своей квартире,2018-11-19 10:31:18,49796420,[]
1533,на камчатке будут судить женщину которая хотела убить мужа но не помнит за что,2018-11-19 10:25:05,49796420,[]
1534,жительница камчатки не помнит за что пыталась зарезать спящего мужа,2018-11-19 10:16:05,49796420,[]
1535,вооруженный мужчина пытался проникнуть в здание правительства камчатки,2018-11-19 09:45:18,49796420,[]
1536,жителей петропавловска приглашают на студенческий капустник,2018-11-19 09:31:19,49796420,[]
1537,прокуратура разбирается в ситуации с оплатой тепла в усть камчатске,2018-11-19 09:15:45,49796420,[]
