1287,на севере бурятии населенных пунктов в мороз остались без света,2018-12-22 10:30:03,107493817,[]
1288,самым популярным автомобилем у чиновников улан удэ оказался,2018-12-22 10:10:01,107493817,[]
1289,в улан удэ торжественно откроют три главные городские елки,2018-12-22 09:49:52,107493817,[]
1290,добрый день помогите найти хаски помесь с лайкой ушел видели последний рас в квартале возле дома в,2018-12-22 09:30:03,107493817,[]
1291,только в бурятии диализные больные не получают компенсацию на проезд,2018-12-22 09:12:42,107493817,[]
1292,молоко бурятии снова в долгах,2018-12-22 06:55:00,107493817,[]
1293,в улан удэ наценки на пластиковые пакеты в супермаркетах достигают,2018-12-22 06:35:00,107493817,[]
1294,таких балерин больше нет,2018-12-22 06:15:00,107493817,[]
1295,а вы так катались в детстве с горки паравозиком,2018-12-22 06:00:04,107493817,[]
1296,в бурятии сократили квоты на процедуру эко,2018-12-22 05:46:00,107493817,[]
1297,ведется служебное расследование,2018-12-22 05:28:00,107493817,[]
1298,желающих стать мэром улан удэ прибыло,2018-12-22 05:10:00,107493817,[]
1299,мнение рядовые врачи и учителя не самые главные коррупционеры в россии,2018-12-22 04:52:00,107493817,[]
1300,жители бурятии смогут пожаловаться на грязный воздух,2018-12-22 04:34:00,107493817,[]
1301,сотрудницы росгвардии бурятии соревнуются с представительницами тувы за звание самой красивой девушки,2018-12-22 04:00:02,107493817,[]
1302,утро субботы ну и зачем я проснулся так рано,2018-12-22 03:36:00,107493817,[]
1303,с добрым субботним утром,2018-12-22 03:10:00,107493817,[]
1304,зурхай на декабря й лунный день,2018-12-22 02:45:00,107493817,[]
1305,спокойной ночи друзья,2018-12-21 17:00:11,107493817,[]
1306,куда пойти с детьми на новогодние представления,2018-12-21 16:51:00,107493817,[]
1307,в бурятии ударят сорокаградусные морозы,2018-12-21 16:45:00,107493817,[]
1308,мы делаем невозможное тайны русдрама в улан удэ на сцене и за кулисами,2018-12-21 16:34:00,107493817,[]
1309,я хотел закричать но мог только стоять и смотреть,2018-12-21 16:15:01,107493817,[]
1310,взял крестьянскую страну а оставил ее с ядерной бомбой в улан удэ отметили день рождения сталина,2018-12-21 16:00:14,107493817,[]
1311,уже завтра открытие новой грандиозной мультимедийной выставки выставка ван гог оживающие полотна в гаук рб национальный музей республики бурятия по адресу улан удэ ул куйбышева,2018-12-21 14:30:00,107493817,[]
1312,музыкальный трамвай запустили в улан удэ,2018-12-21 14:18:00,107493817,[]
1313,водителям придется пересдавать теорию при замене прав,2018-12-21 14:03:02,107493817,[]
1314,в бурятии раздавили бульдозером сотни игровых автоматов,2018-12-21 13:45:00,107493817,[]
1315,общественных лесных инспекторов наградили в бурятии,2018-12-21 13:44:00,107493817,[]
1316,жители бурятии переплатили за тепло гигантскую сумму,2018-12-21 13:27:00,107493817,[]
1317,николай будуев похвастался грамотой от президента россии,2018-12-21 13:10:00,107493817,[]
1318,мэрия улан удэ протестировала вундерваффе для борьбы со снегом,2018-12-21 12:53:00,107493817,[]
1319,жители элеватора в улан удэ боятся очередной точечной застройки,2018-12-21 12:36:00,107493817,[]
1320,дед мороз из великого устюга получает письма от маленьких улан удэнцев,2018-12-21 12:19:00,107493817,[]
1321,в бурятии бывшего полицейского уличили в подделке документов,2018-12-21 12:02:06,107493817,[]
1322,фото дня с улан удэнскими супермаркетами не пропадешь,2018-12-21 11:45:00,107493817,[]
1323,алексей цыденов открыл мфц мой бизнес,2018-12-21 11:28:00,107493817,[]
1324,в улан удэ соорудили трехметровую елку из тысячи книг,2018-12-21 11:11:00,107493817,[]
1325,в бурятии деревенских рыбаков выгнали с насиженных мест и запустили туда титановских,2018-12-21 10:55:00,107493817,[]
1326,мусор будут возить по старому,2018-12-21 10:39:00,107493817,[]
1327,власти бурятии не могут освоить деньги дорожного фонда,2018-12-21 10:22:00,107493817,[]
1328,улан удэнцев пугают разгуливающие по улицам лисы,2018-12-21 10:05:04,107493817,[]
1329,в бурятии появятся облепиховые сады,2018-12-21 09:49:00,107493817,[]
1330,дворец бракосочетания улан удэ откроется в декабре,2018-12-21 09:32:01,107493817,[]
1331,в бурятии вину за дтп сына главврача хотят свалить на пострадавшего,2018-12-21 09:16:00,107493817,[]
1332,чистая душа бабушки надежды,2018-12-21 08:59:00,107493817,[]
1333,в бурятии простого работягу признали коррупционером и осудили на пять лет,2018-12-21 08:42:00,107493817,[]
1334,ваш господин мне разрешил,2018-12-21 08:25:00,107493817,[]
1335,тамир галанов получил квартиру в подарок от земляков,2018-12-21 08:07:48,107493817,[]
1336,зачем в офисах яндекса проводят хуралы,2018-12-21 07:47:00,107493817,[]
1337,многодетные семьи смогут не вставать в очередь в детсады,2018-12-21 07:30:00,107493817,[]
1338,помогайте и будьте добрее,2018-12-21 07:12:00,107493817,[]
1339,мнение будет очень серьезная битва и за мэрское и за депутатские кресла то что происходило на выборах в народный хурал ни в какое сравнение с этими выборами не пойдет,2018-12-21 06:55:00,107493817,[]
1340,иван старчак с неба в бой,2018-12-21 06:38:00,107493817,[]
1341,госдума рф приняла новый закон о защите животных,2018-12-21 06:20:00,107493817,[]
1342,работы замечательного художника геннадия червякова гуашь карандаш мел акварель,2018-12-21 06:02:01,107493817,[]
1343,за программу по охране байкала взялась природоохранная прокуратура,2018-12-21 05:45:00,107493817,[]
1344,улан удэнец выиграл дело у тгк,2018-12-21 05:27:00,107493817,[]
1345,роспотребнадзор бурятии дал советы по выбору алкоголя к новому году,2018-12-21 05:10:00,107493817,[]
1346,в улан удэ ищут дерзкого грабителя с бутылкой ликера,2018-12-21 04:52:00,107493817,[]
1347,на трассе байкал появится шумовая разметка,2018-12-21 04:35:00,107493817,[]
1348,дом культуры в улан удэ купил экран за млн,2018-12-21 04:18:00,107493817,[]
1349,лучшие люди бурятии,2018-12-21 04:00:01,107493817,[]
1350,когда с утра высаживаешься с маршрутки,2018-12-21 03:36:00,107493817,[]
1351,доброе утро любимый город,2018-12-21 03:10:00,107493817,[]
1352,зурхай на декабря й лунный день,2018-12-21 02:45:00,107493817,[]
1353,,2018-12-20 17:00:02,107493817,
1354,новый год в улан удэ куда пойти и что посмотреть,2018-12-20 16:17:00,107493817,[]
1355,театр байкал завершил гастроли в чите,2018-12-20 16:00:18,107493817,[]
1356,к вечеру декабря температура в улан удэ упадет до градусов мороза,2018-12-20 15:42:00,107493817,[]
1357,в улан удэнском центре доверие насмерть замерзла женщина,2018-12-20 15:17:00,107493817,[]
1358,что я из улан удэ должен каждую собаку знать владимир гранат засветился на квн и помог победить юмористам из бурятии,2018-12-20 15:00:17,107493817,[]
1359,итальянцы все чаще усыновляют детей из бурятии,2018-12-20 14:42:00,107493817,[]
1360,в бурятии назвали лучшего спасателя,2018-12-20 14:25:00,107493817,[]
1361,два бурятских боксера взяли медали в краснодарском крае,2018-12-20 14:08:00,107493817,[]
1362,в улан удэ состоится ночь в театре,2018-12-20 13:51:00,107493817,[]
1363,в улан удэ просят осветить не только центральные улицы,2018-12-20 13:34:00,107493817,[]
1364,в улан удэ появятся новогодние трамваи,2018-12-20 13:17:00,107493817,[]
1365,в бурятии в дтп погибли водитель и пешеход,2018-12-20 13:00:12,107493817,[]
1366,в москве началась большая пресс конференция владимира путина онлайн трансляция,2018-12-20 12:51:32,107493817,[]
1367,федеральные журналисты выдали баунтовский нефрит за окинский,2018-12-20 12:44:00,107493817,[]
1368,в частном секторе улан удэ выросла свалка с половину площади советов,2018-12-20 12:27:00,107493817,[]
1369,руководитель росавиации такого самолета как байкал остро не хватает,2018-12-20 12:10:00,107493817,[]
1370,журналист в бурятии пытался прожить на установленный чиновниками прожиточный минимум,2018-12-20 11:53:47,107493817,[]
1371,эвенки бурятии нас хотят выжить,2018-12-20 11:36:00,107493817,[]
1372,синдром отмены рэпер хаски взял номинацию репрессия года,2018-12-20 11:19:00,107493817,[]
1373,в улан удэ накрыли подпольное казино,2018-12-20 11:02:02,107493817,[]
1374,неизлечимо больные дети в бурятии ждут новогодние подарки,2018-12-20 10:45:00,107493817,[]
1375,в бурятии создадут музей иволгинского дацана,2018-12-20 10:28:00,107493817,[]
1376,республиканская служба по тарифам должна утвердить тариф на вывоз мусора для жителей бурятии,2018-12-20 10:11:00,107493817,[]
1377,гимнастки из бурятии заняли призовые места на турнире в москве,2018-12-20 09:54:00,107493817,[]
1378,зимний байкал снятый московским фотографом оценили в,2018-12-20 09:52:47,107493817,[]
1379,в улан удэ состоялся кадетский зимний бал,2018-12-20 09:37:00,107493817,[]
1380,ничего не изменилось,2018-12-20 09:20:44,107493817,[]
1381,мэрия улан удэ назвала улицы где убирают снег,2018-12-20 09:10:00,107493817,[]
1382,предприниматель из бурятии заплатил более тысяч рублей за пиратский диск стаса михайлова и лишился бизнеса,2018-12-20 08:53:00,107493817,[]
1383,улан удэнцы нападали на автомобили с проститутками,2018-12-20 08:36:00,107493817,[]
1384,где в улан удэ можно купить новогоднюю красавицу,2018-12-20 08:18:00,107493817,[]
1385,в бурятии десятки людей угодили в денежную яму использовав средства маткапитала,2018-12-20 08:02:04,107493817,[]
1386,состоялся финальный этап кубка бурятии по спортивному туризму,2018-12-20 07:45:00,107493817,[]
1387,работы замечательного художника геннадия червякова гуашь карандаш мел акварель,2018-12-20 07:28:00,107493817,[]
1388,в бурнете начнут блокировать колумбайн сообщества и группы посвященные ауе,2018-12-20 07:10:00,107493817,[]
1389,жителям бурятии советуют давать детям отвар шиповника,2018-12-20 06:53:00,107493817,[]
1390,корпорация развития дв создаст представительства в бурятии и забайкалье,2018-12-20 06:36:00,107493817,[]
1391,прокуратура бурятии проверит платную горку на площади советов в улан удэ,2018-12-20 06:18:00,107493817,[]
1392,мандала счастья благополучия исполнения желаний,2018-12-20 06:00:02,107493817,[]
1393,в улан удэ нашлась редкая камышовая рысь пропавшая в начале лета,2018-12-20 05:46:00,107493817,[]
1394,школьник из бурятии покорил международный литературный фестиваль,2018-12-20 05:28:00,107493817,[]
1395,в трамваях улан удэ прошла акция лет нам подарки вам,2018-12-20 05:11:00,107493817,[]
1396,очень важно для наших северов,2018-12-20 04:54:00,107493817,[]
1397,в улан удэ состоялся финал программы умник,2018-12-20 04:36:00,107493817,[]
1398,что предлагают жители бурятии в нацпроекте дальний восток,2018-12-20 04:18:00,107493817,[]
1399,в году в бурятии будет сделан упор на благоустройство памятных мест,2018-12-20 04:00:01,107493817,[]
1400,когда только четверг,2018-12-20 03:36:00,107493817,[]
1401,с добрым утром друзья хорошего вам дня и настроения,2018-12-20 03:10:00,107493817,[]
1402,зурхай на декабря й лунный день,2018-12-20 02:45:00,107493817,[]
1403,доброй ночи улан удэ,2018-12-19 17:00:09,107493817,[]
1404,предприниматель из закаменска делает исконно бурятский продукт замбу,2018-12-19 16:47:00,107493817,[]
1405,декабря по бурятии местами небольшой снег,2018-12-19 16:33:00,107493817,[]
1406,сколько не жалко что подарили депутаты народного хурала детям сиротам,2018-12-19 16:17:00,107493817,[]
1407,лучшим спортсменом года в улан удэ стала кристина ткачева,2018-12-19 16:00:19,107493817,[]
1408,куда сходить в улан удэ в выходные,2018-12-19 14:30:00,107493817,[]
1409,во франции выпустили сказку о ребенке с байкала,2018-12-19 14:23:00,107493817,[]
1410,утверждены новые порядки проведения гиа и егэ,2018-12-19 14:06:00,107493817,[]
1411,улан удэнские хирурги врач обязан врач должен врач не прав а вам никто ничего не должен,2018-12-19 13:50:00,107493817,[]
1412,в бурятии борцы с коррупцией не возражали против своей ликвидации,2018-12-19 13:33:00,107493817,[]
1413,путешествие на семь братьев,2018-12-19 13:16:00,107493817,[]
1414,карнавал на лыжах пройдет в улан удэ,2018-12-19 13:00:13,107493817,[]
1415,искусствоведу из бурятии отправили золотую медаль по почте,2018-12-19 12:42:00,107493817,[]
1416,в бурятии завершили расследование уголовных дел на андрея самаринова и его соучастников,2018-12-19 12:25:00,107493817,[]
1417,в центре улан удэ ниссан врезался в трамвай,2018-12-19 12:09:00,107493817,[]
1418,лекарственные растениеводы бурятии признаны официально,2018-12-19 11:52:00,107493817,[]
1419,известный в бурятии экстремал развивает приключенческий туризм на байкале,2018-12-19 11:41:14,107493817,[]
1420,вопросы на засыпку кто остановит круговорот земли и снега в улан удэ,2018-12-19 11:35:00,107493817,[]
1421,улан удэнцам напоминают о мерах предосторожности при запуске пиротехники,2018-12-19 11:18:00,107493817,[]
1422,сиротское гетто,2018-12-19 11:01:00,107493817,[]
1423,титан открыл магазин в джидинском районе бурятии,2018-12-19 10:45:00,107493817,[]
1424,мусорная перереформа дмитрий медведев принял решения меняющие для бурятии ситуацию с вывозом отходов,2018-12-19 10:29:00,107493817,[]
1425,власти выкупят платную горку в центре улан удэ,2018-12-19 10:12:00,107493817,[]
1426,андрей самаринов встретит новый год под домашним арестом,2018-12-19 09:56:00,107493817,[]
1427,ушел из жизни создатель уникальной бурятской породы овец,2018-12-19 09:39:00,107493817,[]
1428,александр богомоев принял зожчеллендж,2018-12-19 09:23:00,107493817,['зожчеллендж']
1429,фото дня управляющая компания которая переплюнула всех,2018-12-19 09:07:00,107493817,[]
1430,дети со всей россии отправили письма бурятскому деду морозу,2018-12-19 08:51:00,107493817,[]
1431,бурятские художники удивили китайских мастеров снежной скульптуры,2018-12-19 08:35:00,107493817,[]
1432,кишечную палочку обнаружили в шаурме в улан удэ,2018-12-19 08:19:00,107493817,[]
1433,искусственную кожу производимую в бурятии будут продавать в аптеках,2018-12-19 08:03:02,107493817,[]
1434,в улан удэнском аэропорту торжественно открыли и освятили новую взлетку за четыре миллиарда рублей,2018-12-19 07:58:51,107493817,[]
1435,в сотниково появится новый дом культуры,2018-12-19 07:56:00,107493817,[]
1436,спасителей изюбря из бурятии покажут на первом канале,2018-12-19 07:40:00,107493817,[]
1437,грустный праздник,2018-12-19 07:24:00,107493817,[]
1438,в бурятии силовики массово подаются в эвенки,2018-12-19 07:08:00,107493817,[]
1439,как школьник стал легендой бурятского сыска,2018-12-19 06:52:04,107493817,[]
1440,на подсыпку дорог улан удэ израсходовали тонн песка,2018-12-19 06:35:03,107493817,[]
1441,бурятские легкоатлеты стали звездами студенческого спорта,2018-12-19 06:19:37,107493817,[]
1442,в бичуре полиция вмешивается в предвыборную кампанию,2018-12-19 06:02:01,107493817,[]
1443,уроженец бурятии умер в американском центре для мигрантов,2018-12-19 05:45:00,107493817,[]
1444,налоговики бурятии хотят потрясти индиру шагдарову,2018-12-19 05:27:00,107493817,[]
1445,тысяч жителей бурятии перевели общение с приставами в режим онлайн,2018-12-19 05:10:00,107493817,[]
1446,общественницы просят наполнить шка тулку храбрости,2018-12-19 04:53:00,107493817,[]
1447,агинские школьники поедут на кремлевскую елку,2018-12-19 04:35:00,107493817,[]
1448,ледовый городок в улан удэ будут патрулировать круглосуточно,2018-12-19 04:18:00,107493817,[]
1449,на бурятию надвигается резкое похолодание,2018-12-19 04:00:00,107493817,[]
1450,будьте осторожны на дорогах скользко,2018-12-19 03:35:00,107493817,[]
1451,с добрым утром любимый город,2018-12-19 03:10:00,107493817,[]
1452,зурхай на декабря й лунный день,2018-12-19 02:45:00,107493817,[]
1453,,2018-12-18 17:00:10,107493817,
1454,декабря по бурятии местами небольшой и умеренный снег,2018-12-18 16:20:00,107493817,[]
1455,в бурятии детсадовцы дарили подарки прохожим,2018-12-18 15:50:00,107493817,[]
1456,в бурятии прошло первенство заиграевского района по лыжным гонкам,2018-12-18 15:30:03,107493817,[]
1457,напавшего на школу в улан удэ подростка подлечат в психдиспансере,2018-12-18 15:11:00,107493817,[]
1458,в улан удэ выступит приглашенный дирижер мариинского театра,2018-12-18 14:50:00,107493817,[]
1459,друг человека улан удэнец стал героем мема благодаря собаке,2018-12-18 14:28:00,107493817,[]
1460,какие подставы чаще всего случаются на дорогах улан удэ,2018-12-18 14:09:00,107493817,[]
1461,бурятские кондитеры решили осваивать зарубежные рынки,2018-12-18 13:49:00,107493817,[]
1462,кровавую бойню в улан удэнской школе включили в число самых ужасных злодеяний года,2018-12-18 13:31:00,107493817,[]
1463,в бурятии автор криминального мини сериала объявил акцию добра,2018-12-18 13:12:00,107493817,[]
1464,члены вооруженной банды из бурятии дошли до верховного суда россии,2018-12-18 12:55:00,107493817,[]
1465,январь в бурятии будет снежным,2018-12-18 12:38:00,107493817,[]
1466,в улан удэ студентка отдала за снятие порчи все золото,2018-12-18 12:20:00,107493817,[]
1467,на улан удэнских улицах работает снегоуборочная техника,2018-12-18 12:02:05,107493817,[]
1468,герои среди нас,2018-12-18 11:45:00,107493817,[]
1469,в улан удэ выступят группа руки вверх и стас михайлов,2018-12-18 11:28:00,107493817,[]
1470,в татаурово из за чиновников три месяца пустует новое здание амбулатории,2018-12-18 11:11:00,107493817,[]
1471,ледовая переправа на мостовой в улан удэ заработает декабря,2018-12-18 10:54:00,107493817,[]
1472,что значат непонятные надписи на стенах,2018-12-18 10:37:00,107493817,[]
1473,бурятия предложила брать плату за вход в природные парки,2018-12-18 10:20:01,107493817,[]
