0,открыт парк на фиоленте,2019-02-01 21:13:00,55342106,[]
1,это что то новенькое кто знает для чего,2019-02-02 09:14:00,55342106,[]
2,,2019-02-02 08:15:31,55342106,
3,подрядчик реконструкции парка победы планирует завершить работы в срок,2019-02-01 21:19:59,55342106,[]
4,севастопольский участок трассы таврида,2019-02-01 20:13:00,55342106,[]
5,в крыму определили единые тарифы на вывоз мусора цены по районам,2019-02-01 19:00:12,55342106,[]
6,сегодня возле севгу было собрание людей и стояли троллейбусы кто знает в чем дело троллейбусы буду ходить к главному корпусу,2019-02-01 17:21:00,55342106,[]
7,в севастополе упавший на георгиевской скале крест восстановят до конца года,2019-02-01 16:52:51,55342106,[]
8,,2019-02-01 16:13:00,55342106,
9,на российском лекарственном рынке разрастается серьезный скандал из за конкуренции,2019-02-01 14:38:08,55342106,[]
10,добрый день вам снова вчера были на фиоленте глянуть как там обстановка с парком рядом с георгиевским монастырем не пустили на территорию еще шли ремонтные работы сегодня уже объявили об открытии официально вот так вот внезапно делюсь новостью и свежими фото теперь уже я думаю можно спокойно туда ехать за более подробными видами место шикарное как по мне надеюсь ваши прогулки будут уже более благоприятными а не как у нас в холостую,2019-02-01 14:04:40,55342106,[]
11,улица коммунистическая,2019-02-01 12:41:20,55342106,[]
12,в севастополе случилось лобовое со стеной фото с места инцидента,2019-02-01 12:00:14,55342106,[]
13,в севастополе начали выдавать персонифицированные карты егкс,2019-02-01 11:13:00,55342106,[]
14,в севастополе подростка подозревают в убийстве матери и бабушки,2019-02-01 10:49:43,55342106,[]
15,в кировском районе крыма поймали еще одного любителя бюджетных денег,2019-02-01 10:00:05,55342106,[]
16,план аэропорта бельбек разработает фирма из санкт петербурга,2019-02-01 09:11:00,55342106,[]
17,раннее утро в севастополе,2019-02-01 08:09:00,55342106,[]
18,севастополь вошел в число лучших регионов по капремонту домов,2019-01-31 22:58:08,55342106,[]
19,соц опрос приживется ли модная новинка в севастополе,2019-01-31 22:35:00,55342106,[]
20,на спинках сидений маршрута развешана схема проезда с ошибками в названиях улиц и остановок,2019-01-31 22:21:00,55342106,[]
21,в севастополе появился грузовой эвакуатор,2019-01-31 21:32:00,55342106,[]
22,газ угрозы о минировании не много ли для праздничного января,2019-01-31 20:41:00,55342106,[]
23,добрый день помогите пожалуйста репостом давайте все вместе подарим праздник бабушкам и дедушкам,2019-01-31 20:11:00,55342106,[]
24,о севастополе,2019-01-31 19:11:00,55342106,[]
25,под этим видео просто хотим напомнить что распродажа в в самом разгаре и количество размеров стремительно сокращается,2019-01-31 18:00:06,55342106,[]
26,севастопольские пейзажи гг,2019-01-31 17:20:55,55342106,[]
27,в севастополе ограничат движение для водителей и пешеходов с неместной пропиской,2019-01-31 16:00:12,55342106,[]
28,в некоторых районах севастополя ограничат движение из за антитеррористических учений,2019-01-31 15:30:41,55342106,[]
29,в россии вступил в силу закон об индивидуальном кредитном рейтинге,2019-01-31 14:00:10,55342106,[]
30,у севастопольцев заберут земельных участков для строительства тавриды,2019-01-31 13:00:12,55342106,[]
31,в севастополе из за аварийных работ несколько районов остались без воды,2019-01-31 12:36:23,55342106,[]
32,вытрясли миллионов с бывшего подрядчика парка победы,2019-01-31 11:06:33,55342106,[]
33,дорожная развязка возле вокзала в севастополе я помню как все очень ждали ее реконструкции,2019-01-31 09:48:34,55342106,[]
34,старик и золотая рыбка в балаклаве,2019-01-31 08:09:00,55342106,[]
35,сдать реконструкцию камышового шоссе в срок подрядчик не успеет,2019-01-30 22:39:49,55342106,[]
36,он судьбой геройской мечен,2019-01-30 21:21:00,55342106,[]
37,на северной стороне севастополя отремонтируют дороги и построят школу,2019-01-30 20:25:12,55342106,[]
38,на пешеходных переходах под севастополем установят освещение,2019-01-30 20:21:00,55342106,[]
39,севастополь моя любовь,2019-01-30 19:01:49,55342106,[]
40,реконструкция камышового шоссе в севастополе завершится с опозданием,2019-01-30 17:04:26,55342106,[]
41,сообщение о минировании в школах севастополя фото с места событий,2019-01-30 15:45:00,55342106,[]
42,кошачий дозор не дремлет,2019-01-30 15:17:00,55342106,[]
43,в севастопольскую школу поступило сообщение о минировании,2019-01-30 13:15:27,55342106,[]
44,городское кладбище гагаринского района й километр,2019-01-30 13:09:00,55342106,[]
45,чиновники виновные в срыве сроков начала капремонта школы на северной стороне понесут наказание или нет,2019-01-30 12:35:30,55342106,[]
46,многострадальную улицу на северной обещают починить к марту фото,2019-01-30 12:00:12,55342106,[]
47,февраля по марта в севастополе пройдет второй фестиваль крым на тарелке,2019-01-30 11:21:00,55342106,[]
48,севастопольские дети выступили на международных рождественских чтениях в москве фото,2019-01-30 10:30:04,55342106,[]
49,как сибирякам живется в севастополе,2019-01-30 09:21:00,55342106,[]
50,кубок по дворовому футболу в севастополе,2019-01-30 08:32:18,55342106,[]
51,в в районе готской авторынок пропала собака породы бритон на шее оранжевый ошейник с номерами телефонов просьба помочь найти собаку вознаграждение гарантируем,2019-01-30 00:58:57,55342106,[]
52,афиша,2019-01-29 21:34:00,55342106,[]
53,набережная балаклавы и генуэзская крепость чембало,2019-01-29 20:12:01,55342106,[]
54,новый молодежный тренд или кем то спланированная акция газовых отравителей,2019-01-29 19:40:00,55342106,[]
55,пьяная драка в баре закончилась жестокой поножовщиной,2019-01-29 19:12:00,55342106,[]
56,новая коллекция влюбляет в себя своими яркими красками и актуальными моделями ведь это просто стильно модно,2019-01-29 18:00:09,55342106,[]
57,на стипендии севастопольским студентам в году выделили почти млн рублей,2019-01-29 17:54:57,55342106,[]
58,минюст предложил декриминализировать коррупцию для чиновников,2019-01-29 17:30:03,55342106,[]
59,оттаял самый большой водопад полуострова учан су,2019-01-29 16:24:00,55342106,[]
60,в севастополе сбили двух мотоциклистов фото,2019-01-29 16:08:21,55342106,[]
61,на площади восставших новая разметка,2019-01-29 15:35:58,55342106,[]
62,,2019-01-29 14:11:00,55342106,
63,директор фирмы осужден за мошенничество на млн при ремонте детсада в севастополе,2019-01-29 12:03:02,55342106,[]
64,заведовать юстицией в крыму будет человек из минобороны,2019-01-29 11:37:22,55342106,[]
65,в севастополе предупредили об отключениях воды и газа адреса,2019-01-29 10:30:03,55342106,[]
66,в севастополе объявили войну самовольной рекламе,2019-01-29 09:14:00,55342106,[]
67,севастополь,2019-01-29 08:12:00,55342106,[]
68,может кто то потерял собаку находится на нахимова ищет хозяина,2019-01-28 21:51:08,55342106,[]
69,плохие новости для севастопольских причалов,2019-01-28 20:30:17,55342106,[]
70,,2019-01-28 19:00:01,55342106,
71,придумайте название для этого фото,2019-01-28 18:11:00,55342106,[]
72,лучш я м тивация кото ую я к гда либо вид л,2019-01-28 17:27:00,55342106,[]
73,обычный вечер в любимом городе,2019-01-28 16:31:01,55342106,[]
74,волна телефонного терроризма докатилась до севастополя,2019-01-28 14:57:14,55342106,[]
75,севастополь в районе го километра вот бы камеры так все поснимали и сложили в кучку,2019-01-28 13:04:01,55342106,[]
76,в году расширился спектр применения льгот по имущественным налогам,2019-01-28 12:30:03,55342106,[]
77,десятки улиц в севастополе на весь день остались без воды адреса,2019-01-28 12:00:14,55342106,[]
78,севэнерго опубликовал график отключений света на февраль,2019-01-28 11:00:13,55342106,[]
79,сезон увольнений после скандала с севморпортом можно считать открытым,2019-01-28 10:30:05,55342106,[]
80,,2019-01-28 09:57:25,55342106,
81,в севастополе утверждены новые тарифы на воду,2019-01-28 09:21:00,55342106,[]
82,севастополь,2019-01-28 08:27:05,55342106,[]
83,севастополь,2019-01-27 21:23:00,55342106,[]
84,оказывается я даже спать правильно не умею,2019-01-27 20:11:00,55342106,[]
85,детская площадка сделана добротно но дорожку внутри парка некому заасфальтировать и приходится родителям с колясками объезжать вокруг родионова макарова,2019-01-27 18:08:01,55342106,[]
86,,2019-01-27 17:00:04,55342106,
87,пранк с деньгами на приморском января,2019-01-27 15:07:11,55342106,[]
88,,2019-01-27 11:41:00,55342106,
89,что за отношение к людям маршрут в новом автобусе не потрудились снять целлофан с сидений и так сойдет,2019-01-27 10:38:43,55342106,[]
90,друзья нужна ваша помощь,2019-01-26 22:28:00,55342106,[]
91,севастопольцы в шоке от ремонта своих подъездов,2019-01-26 21:21:00,55342106,[]
92,походу что то пошло не так,2019-01-26 20:27:09,55342106,[]
93,,2019-01-26 19:00:07,55342106,
94,родители привели воришку и вернули деньги антикафе,2019-01-26 18:14:00,55342106,[]
95,красивый маршрут по каньону кок асан,2019-01-26 17:31:00,55342106,[]
96,в севастополе у парка победы пилят можжевельник,2019-01-26 16:03:05,55342106,[]
97,срочно ищем хозяев,2019-01-26 15:07:01,55342106,[]
98,бывший рыбацкий стан а теперь,2019-01-26 13:31:00,55342106,[]
99,крымский привет из севастополя,2019-01-26 11:43:50,55342106,[]
100,тличная идея,2019-01-26 10:29:00,55342106,[]
101,найдено свидетельство о рождении помогите пожалуйста найти хозяйку,2019-01-26 09:14:52,55342106,[]
102,автолюбители как вам такая новость,2019-01-25 21:11:00,55342106,[]
103,в севастополе может появиться аллея владимира высоцкого,2019-01-25 20:17:00,55342106,[]
104,туманный колокол херсонеса,2019-01-25 19:12:00,55342106,[]
105,севастопольского чиновника приговорили к колонии за взяточничество,2019-01-25 18:35:00,55342106,[]
106,найден военный билет вернем хозяину,2019-01-25 18:04:06,55342106,[]
107,собака уже часов не отходит с места видно что ждет хозяина,2019-01-25 17:03:03,55342106,[]
108,севастопольцы требуют безопасной дороги для людей и машин на фиоленте видео,2019-01-25 16:30:02,55342106,[]
109,афиша,2019-01-25 15:07:06,55342106,[]
110,главная распродажа этой зимы в самом разгаре,2019-01-25 14:00:06,55342106,[]
111,в году в севастополе отремонтируют сто километров дорог,2019-01-25 13:54:49,55342106,[]
112,севастополец алексей процко который является автором ютуб канала камни с неба общественно политический видеоблог о жизни в севастополе и о жизни в мире глазами севастопольца,2019-01-25 13:13:55,55342106,[]
113,губернатор севастополя остался без заместителя и приобрел нового главу департамента,2019-01-25 12:00:12,55342106,[]
114,что ожидает севастопольских дачников в связи с вступлением в силу нового закона,2019-01-25 11:30:03,55342106,[]
115,весь день в севастополе не будет воды на двух улицах адреса,2019-01-25 11:11:00,55342106,[]
116,в севастополе уволен заместитель губернатора михаил демиденко,2019-01-25 10:13:19,55342106,[]
117,в дтп под севастополем погибли три человека,2019-01-25 09:23:00,55342106,[]
118,вот оно счастье любимый город,2019-01-25 08:36:18,55342106,[]
119,в балаклаве появятся новые спортплощадки и скверы,2019-01-24 22:31:00,55342106,[]
120,быстро строят новый тц лаванда на ул меньшикова,2019-01-24 21:23:35,55342106,[]
121,,2019-01-24 19:39:56,55342106,
122,килограммовую серебряную монету выпустил цб,2019-01-24 18:19:00,55342106,[]
123,надоело хочу описать ситуацию с интернет провайдером ао севастополь телеком что бы мастер только перезвонил надо неделю ждать это самый плохой сервис из всех интернет провайдеров на которых я был подключен они переплюнули всех как по обману со скоростью так и с мастерами которые больше недели не звонят хотя ты им в контору по раза звонишь каждый день обещали скорость до но самое главное это их маршрутизатор который они ставят он же выдает м бит в упор зачем они людей обманывают и говорят что будет обман людей по полному перед тем как сюда написать я долго пытался с ними связаться но они не отвечают ни на интернет запрос ни на звонки только что звонил и не раз как в пресс службу данного провайдера так и в отдел по жалобам никто трубку не берет а девушки операторы ничем не могут помочь и только извиняются и каждый раз уточняют номер что бы на него никто не перезвонил это какой то беспредел прилагаю фото своей нынешней мегабитной скорости и это через свой вайфай так как они устанавливают свой который максимум выдает мегабит в упор сразу всем совет кто по несчастию попался на уловки этого оператора подключаете их вайфай к своему и норм скорость хотя естественно меньше чем заявляли если даже через кабель скорость не выше мбит,2019-01-24 18:12:00,55342106,[]
124,в севастополе на зебре сбили двух пешеходов,2019-01-24 17:17:40,55342106,[]
125,,2019-01-24 16:00:08,55342106,
126,как крымчане отметят пятую годовщину крымской весны программа,2019-01-24 15:30:03,55342106,[]
127,пожелания севастопольцев учтут при разработке проекта парка у гасфорты,2019-01-24 14:45:31,55342106,[]
128,выманивают деньги и исчезают госдума проработала механизм защиты россиян от финансовых пирамид в сети,2019-01-24 14:00:12,55342106,[]
129,жизненно про современных комментаторов,2019-01-24 13:50:31,55342106,[]
130,держитесь подальше в севастополе будут взрывать немецкую авиабомбу,2019-01-24 12:30:04,55342106,[]
131,в севастополе на двух улицах отключат воду адреса,2019-01-24 11:00:12,55342106,[]
132,югансон объявил войну херсонесу,2019-01-24 10:19:00,55342106,[]
133,в севастополе частный нотариус отжала у владельца землю стоимостью млн,2019-01-24 09:00:05,55342106,[]
134,ретро севастополь,2019-01-24 08:13:50,55342106,[]
135,может быть автор этого поста,2019-01-23 21:07:05,55342106,[]
136,активный житель севастополя вовремя оказался на месте и запечатлел варварскую гибель дерева разница между фото сутки не сухой не больной не мешающий кипарис был спилен на культурном наследии,2019-01-23 18:17:00,55342106,[]
137,парк победы застроят многоэтажками,2019-01-23 17:14:00,55342106,[]
138,на случай вдруг его будут искать сегодня в утра в маршрутке желтого цвета на остановке автовокзал в сторону города запрыгнула вместе с толпой народа черная собака похожа на лабрадора водитель спросил чья собака я не повезу ее выходите и выгоняйте собаку на что люди отвечали что никто не знает чей это пес выгнать также не удалось так как собака забилась под одно из сидений и наотрез не желала возвращаться на улицу замерзла наверное бедняжка так и доехал этот пассажир до го км дальше события неизвестны выпустил ли водитель псинку на рынке или повез по второму кругу в обратную сторону,2019-01-23 16:08:20,55342106,[]
139,как в севастополе отметят день студента,2019-01-23 15:22:06,55342106,[]
140,на пальцах что такое эскроу счета и как они не помогут российским дольщикам,2019-01-23 13:30:04,55342106,[]
141,крым начинает постепенный переход на дифференцированный тариф за воду,2019-01-23 13:00:10,55342106,[]
142,внимание,2019-01-23 12:12:00,55342106,[]
143,севастопольцев предупреждают об отключениях воды и света,2019-01-23 11:30:03,55342106,[]
144,в балаклаве сорвался со скалы мужчина фото,2019-01-23 11:00:12,55342106,[]
145,маленькие морские собачки в дождливом морском городе,2019-01-23 10:18:00,55342106,[]
146,в крыму рассматривают возможность построить новый перспективный завод,2019-01-23 09:00:06,55342106,[]
147,так и хочется уеб ть леща тем критинам которые делают ложные вызовы в пожарную скорую и тд,2019-01-22 22:21:00,55342106,[]
148,всем всем всем срочно нужна помощь всех знакомых и просто случай прочитавших очень прошу остаться не равнодушными есть такая красивая и жизнерадостная даже с таким страшным диагнозом девочка бореться и страеться не отчаиваться но этого мало нужны средства для лечения,2019-01-22 21:14:00,55342106,[]
149,новая коллекция весна лето уже в,2019-01-22 20:00:07,55342106,[]
150,севастопольский депутат выступил за отрытую работу городского парламента,2019-01-22 18:03:40,55342106,[]
151,на кота мостика похож может родня,2019-01-22 17:14:00,55342106,[]
152,в россии исключили удержание у должников соцвыплат и пенсий,2019-01-22 15:41:31,55342106,[]
153,почему вы постоянно жалуетесь и ноете,2019-01-22 15:14:00,55342106,[]
154,инициировавший обыски в правительстве чиновник подает в суд казалось бы причем тут сирия,2019-01-22 13:30:03,55342106,[]
155,севастополь впервые выходит в штатный режим проведения гиа и егэ какие нововведения ждут школьников,2019-01-22 12:30:03,55342106,[]
156,в севастополе весь день не будет воды адреса,2019-01-22 12:00:13,55342106,[]
157,в севастополе сократили количество изымаемых участков для строительства нового газопровода,2019-01-22 11:54:50,55342106,[]
158,в севастополе ограбили кофейный киоск в нахимовском районе,2019-01-22 11:11:00,55342106,[]
