0,в екатеринбурге заболели корью уже человек санитарные врачи просят срочно привиться это единственный способ профилактики,2019-01-31 13:02:02,32182751,[]
1,в свердловской области летний мужчина умер от инфаркта его родственники считают что скорая помощь ехала слишком долго об этом рассказала типичному екатеринбургу дочь погибшего,2019-02-01 17:02:03,32182751,[]
2,а таблички предупреждающие об инспекторах гибдд стали очень популярны на урале,2019-02-01 16:05:03,32182751,[]
3,посмотрите какие красивые ретро автомобили презентовали в музее автомобильной техники в верхней пышме,2019-02-01 15:04:08,32182751,[]
4,на тюменском тракте в километрах от екатеринбурга столкнулись сразу три грузовика об этом рассказал подписчик типичного екатеринбурга,2019-02-01 14:05:25,32182751,[]
5,депутат дмитрий ионин предложил снять с городка чекистов статус памятника архитектуры дело в том что жилой квартал невозможно отремонтировать,2019-02-01 13:33:00,32182751,[]
6,генеральная прокуратура рф снова взялась за расследование гибели туристов на перевале дятлова в году у всех остальных закончились полномочия расследовать дело а общественность и сми требуют раскрыть дело слишком оно непонятно,2019-02-01 12:31:00,32182751,[]
7,заводской екатеринбург,2019-02-01 12:03:04,32182751,[]
8,первоуральские школьники решили бороться с похитителями крышек от люков молодежная организация мопс нарисовала на крышках слово совесть,2019-02-01 11:02:02,32182751,[]
9,запись в школы екатеринбурга началась сегодня в полночь сначала родители будущих первоклассников штурмовали сайт госуслуг не очень успешно сервис не справлялся с нагрузкой в первые минуты работы подано сразу тысячи заявлений к шести утра поступило более тысяч,2019-02-01 10:22:00,32182751,[]
10,у нас в городе появился телеграм канал екатеринбург и на него стоит подписаться,2019-02-01 09:22:00,32182751,[]
11,сегодня в загорелся трц карнавал в районе зоны приема товара магазина ашан рассказали подписчики типичного екатеринбурга эвакуировали примерно человек,2019-02-01 08:51:28,32182751,[]
12,суровая уральская зима,2019-02-01 08:04:00,32182751,[]
13,пьяный офицер гибдд насмерть сбил мужчину около поселка каменка и скрылся с места дтп он находился за рулем в полиции узнали о случае сотрудник уволен и находится под стражей,2019-02-01 07:36:45,32182751,[]
14,доброе утро,2019-02-01 06:34:00,32182751,[]
15,родители будущих первоклассников штурмуют этой ночью сайт госуслуг наши подписчики говорят что сервис опять не справился с потоком,2019-01-31 22:17:59,32182751,[]
16,в екатеринбурге один водитель автобуса напал на другого на остановке автомобильный колледж на пр ленина сообщает портал конфликт попал на запись видеорегистраторов,2019-01-31 21:02:03,32182751,[]
17,ночной чат,2019-01-31 20:03:05,32182751,[]
18,до минус градусов ожидается в свердловской области в ближайшую неделю,2019-01-31 19:10:47,32182751,[]
19,зимняя азов гора с высоты птичьего полета одно из мест бажовских сказов расположенное в км от екатеринбурга,2019-01-31 18:05:07,32182751,[]
20,на газпромнефти новая акция скидка рубль с каждого литра при заправке,2019-01-31 17:05:05,32182751,[]
21,родственники елены подкорытовой которая погибла в горах написали заявление на спасателей они считают что сотрудники мчс виновны в гибели девушки потому что не смогли вовремя найти пропавших,2019-01-31 16:32:02,32182751,[]
22,жителей екатеринбурга и владельцев кафе зовут на благотворительное чаепитие,2019-01-31 16:03:11,32182751,[]
23,изба манси в долине между гор главного уральского хребта красота,2019-01-31 15:05:02,32182751,[]
24,в по ооо сантермо открыта вакансия менеджера по продажам,2019-01-31 14:05:03,32182751,[]
25,министр жкх свердловской области николай смирнов пытается убедить горожан в необходимости мусорной реформы пошла тяжелая артиллерия мемы в инстаграме,2019-01-31 12:01:00,32182751,[]
26,ансамбль из екатеринбурга исполнил хиты и на балалайках,2019-01-31 11:32:00,32182751,[]
27,обсуждения реконструкции октябрьской площади продолжаются сегодня свою позицию высказал владимир шахрин известный музыкант считает что в этом вопросе главное это слышать друг друга и выбранное место у театра драмы является идеальным компромиссом,2019-01-31 10:32:22,32182751,[]
28,в екатеринбурге вторая волна минирований следим за развитием событий в режиме онлайн если вас эвакуировали пишите нам и присылайте фотографии будем обновлять информацию в этом посте,2019-01-31 10:01:58,32182751,[]
29,картины екатеринбурга в творчестве художников белоснежная красота,2019-01-31 09:52:00,32182751,[]
30,только что эвакуировали уралмашзавод ул машиностроителей рассказала нам сотрудница предприятия юлия также в этом здании находятся и другие компании и офисы,2019-01-31 08:52:19,32182751,[]
31,в городах свердловской области подняли цену на проезд в общественном транспорте теперь максимальный порог рублей ранее было исключение составят города области где проезд уже стоит больше тариф не понизят до рублей,2019-01-31 08:33:00,32182751,[]
32,это антон упоров летний штангист из поселка елань он вошел в российскую сборную которая поедет на специальную олимпиаду для людей с ментальными нарушениями но поездка чуть не сорвалась потому что у уральца нет формы,2019-01-31 08:04:08,32182751,[]
33,доброе утро,2019-01-31 07:05:00,32182751,[]
34,мечтаете о современной и удобной мебели,2019-01-31 06:05:00,32182751,[]
35,нашли для вас интересный документальный сериал о работе скорой помощи екатеринбурга,2019-01-30 21:15:29,32182751,[]
36,ночной чат,2019-01-30 20:04:01,32182751,[]
37,по книге уральского писателя алексея иванова пищеблок снимут сериал новая книга иронично рассказывает о пионерах вампирах,2019-01-30 19:01:00,32182751,[]
38,зима в екатеринбурге глазами пользователей,2019-01-30 18:05:04,32182751,[]
39,что подарить девушке надоели конфеты и цветы,2019-01-30 17:05:02,32182751,[]
40,сегодня в екатеринбурге официально открылось представительство команды вконтакте столица урала стала первым региональным городом где появился свой человек от социальной сети типичный екатеринбург побывал на мероприятии и разузнал зачем екатеринбургу свое представительство вк,2019-01-30 16:02:02,32182751,[]
41,на свердловскую область обрушилась мусорная реформа у горожан и сельчан появилось множество вопросов портал поговорил с министром жкх евгением смирновым чтобы прояснить ситуацию,2019-01-30 15:01:00,32182751,[]
42,кусочки нарисованной карты екатеринбурга,2019-01-30 14:31:00,32182751,[]
43,администрация екатеринбурга выводит на линию автобус а он будет дублировать маршрут от площади года до ой новосибирской мэрия обещала что интервал движения не будет слишком большой а жителей елизавета не обидят для них должен остаться что же посмотрим как будут развиваться события,2019-01-30 14:05:03,32182751,[]
44,в екатеринбурге собираются реконструировать площадь обороны горожане могут принять участие в обсуждении проектов встреча состоится февраля в в администрации октябрьского района ул луначарского,2019-01-30 13:34:13,32182751,[]
45,фотограф евгений кудымов поделился впечатлениями о поездке на главный уральский хребет такое чувство что зима здесь длится круглый год нереальные краски белоснежный снег свежайший воздух и конечно же живые скульптуры природы,2019-01-30 12:32:01,32182751,[]
46,года лишения свободы получил убийца школьницы оли медведевой сегодня суд вынес приговор по этому резонансному делу прокурор напомним запрашивал лет,2019-01-30 11:34:00,32182751,[]
47,школы екатеринбурга официально закрыты на карантин такое решение приняла администрация города мера связана с высокой заболеваемостью орви гриппом и пневмонией,2019-01-30 11:05:10,32182751,[]
48,,2019-01-30 10:05:01,32182751,
49,снимок года это американская гостиница на углу златоустовской улицы и покровского проспекта в дореволюционном екатеринбурге было модно называть дома для приезжих в честь городов и стран,2019-01-30 09:33:00,32182751,[]
50,на вышел стендап ольги кох в эфире на пошутила про ельцин центр,2019-01-30 08:33:00,32182751,[]
51,сегодня ночью на екад вылетел в кювет автобус футбольного клуба урал к счастью наших спортсменов в этот момент там не было они сейчас находятся на кипре на сборах,2019-01-30 07:34:00,32182751,[]
52,всех детей собираются отправить на карантин сейчас в мэрии рассматривается вопрос о введении такой меры во всех школах екатеринбурга передает ура ру,2019-01-30 07:04:00,32182751,[]
53,доброе утро,2019-01-30 06:05:00,32182751,[]
54,городов экскурсионных дней часов и более посетителей и это только в году,2019-01-30 05:05:00,32182751,[]
55,группа свердловск записала специально для подписчиков типичного екатеринбурга песню на злобу дня про отмену маршрута,2019-01-29 21:01:00,32182751,[]
56,ночной чат,2019-01-29 20:05:03,32182751,[]
57,в екатеринбурге школьники раскрыли кражу велосипеда но полиция не стала помогать с задержанием подозреваемых,2019-01-29 19:03:03,32182751,[]
58,старый вокзал екатеринбурга будто терем расписной,2019-01-29 18:02:06,32182751,[]
59,у нас в городе появился телеграм канал екатеринбург и на него стоит подписаться,2019-01-29 17:02:02,32182751,[]
60,александр высокинский предложил горожанам два варианта развития событий или в екатеринбурге повысится стоимость проезда или будет запущена транспортная реформа и реформа эта которая была намечена на июля будет перенесена мэрия не успевает сделать расчеты,2019-01-29 15:54:27,32182751,[]
61,они там бьются и кричат пока не умрут,2019-01-29 15:31:00,32182751,[]
62,в екатеринбурге появилась газель которая транслирует философские мысли и дает советы фотографии прислал дмитрий антонов,2019-01-29 14:32:02,32182751,[]
63,геворга аветисяна который спас из горящего дома троих детей наградили благодарственным письмом и огнетушителем,2019-01-29 14:05:04,32182751,[]
64,из ресторана на малышева а сделали реалити шоу с участием гостей,2019-01-29 13:05:05,32182751,[]
65,в общежитие ургпу поступил звонок с сообщением о минировании но сотрудники вуза решили не эвакуировать студентов и вероятно даже не вызвали мчс,2019-01-29 12:26:35,32182751,[]
66,белоснежная зима в екатеринбурга на холстах,2019-01-29 12:03:47,32182751,[]
67,екатеринбург ждет очень непростой день урал захлестнули массовые эвакуации обновляем информацию в этом посте по мере поступления если вас эвакуировали из какого либо учреждения пишите нам и присылайте фотографии,2019-01-29 10:48:52,32182751,[]
68,женщина за рулем сбила школьницу уговорила ее не ехать в травмпункт и уехала с места дтп,2019-01-29 10:41:10,32182751,[]
69,волна минирований добралась до урала,2019-01-29 09:47:16,32182751,[]
70,зачем платить рублей за платную парковку когда есть салфетка,2019-01-29 09:31:00,32182751,[]
71,подросткам из березовского из за которых погиб дмитрий рудаков изменили статью теперь им вменяют убийство ранее шайка проходила по статье умышленное причинение тяжкого вреда здоровью по неосторожности повлекшее смерть,2019-01-29 09:05:06,32182751,[]
72,,2019-01-29 08:05:01,32182751,
73,беспощадная мусорная реформа в действии жителям поселков косулино и прохладное приходится гоняться за мусоровозом с контейнерами спецмашина останавливается похоже только на оплаченной площадке в разное время,2019-01-29 07:05:00,32182751,[]
74,доброе утро,2019-01-29 06:33:00,32182751,[]
75,вот какой саркастичный клип сняла наша подписчица анастасия пряничникова из екатеринбурга давайте оценим,2019-01-28 21:33:00,32182751,[]
76,рыбак анатолий дадайкин и трое его сыновей погибли задохнувшись угарным газом в палатке на белоярском водохранилище мужчины остались на ночь в новой палатке с газовой печкой а утром их нашли уже мертвыми,2019-01-28 21:02:02,32182751,[]
77,ночной чат,2019-01-28 20:04:02,32182751,[]
78,а мы напоминаем что типичный екатеринбург разыгрывает четыре билета на балет ромео и джульетта для участия в розыгрыше нужно сделать репост записи по ссылке,2019-01-28 19:03:02,32182751,[]
79,сегодня утром из за проезда кортежа николая цуканова в екатеринбурге случилось дтп на перекрестке машинной и щорса столкнулись сразу три автомобиля,2019-01-28 18:02:03,32182751,[]
80,нашли для вас интересный документальный сериал о работе скорой помощи екатеринбурга,2019-01-28 17:34:00,32182751,[]
81,наконец то власти екатеринбурга задумались о внедрении пересадочного тарифа в метро в мэрии заявили что постараются решить вопрос в течение двух месяцев нужно согласовать это с областными властями потому что метро находится в их компетенции,2019-01-28 16:31:00,32182751,[]
82,подготовкой праздничных мероприятий к юбилею екатеринбурга займутся семь рабочих групп планы на юбилейный год пока не раскрываются но кое какие выводы можно сделать из названия образований развитие соцсферы капитальное строительство и землепользование капремонт государственной и муниципальной собственности и объектов культурного наследия благоустройство транспорт и экология жкх развитие потребительного рынка и услуг,2019-01-28 16:05:03,32182751,[]
83,,2019-01-28 15:05:01,32182751,
84,уральские пейзажи в объективе волшебно,2019-01-28 14:31:00,32182751,[]
85,в екатеринбурге осуждены черные риелторы которые похитили мужчину чтобы продать его квартиру свою вину они полностью отрицают,2019-01-28 14:02:04,32182751,[]
86,житель екатеринбурга спас двухлетнего ребенка который чуть не выпал с четвертого этажа дома по ул ломоносова,2019-01-28 13:02:03,32182751,[]
87,в году француз кай лоранж открыл в доме п и певина первый в екатеринбурге стационарный электро театр кинематограф лоранж находился на перекрестке главного и вознесенского проспектов сегодня проспект ленина и ул к либкнехта,2019-01-28 12:33:02,32182751,[]
88,екатеринбург вошел в рейтинг толерантных к сексуальным меньшинствам городов россии и среди всех городов участвовавших в опросе наш стал одним из самых нетерпимых к лгбт я строчка из ти в исследовании агентства,2019-01-28 12:05:03,32182751,[]
89,здравствуйте мы цсб контроль федеральный дистрибьютер сервисов для бизнеса мы ждем именно тебя,2019-01-28 11:05:01,32182751,[]
90,в екатеринбурге покончил с собой прапорщик контрактник старшина роты отдельной бригады радиационной химической и биологической защиты об этом сообщает издание вечерние ведомости со ссылкой на свой источник,2019-01-28 10:31:00,32182751,[]
91,не перевелись еще рыцари на земле уральской,2019-01-28 10:02:06,32182751,[]
92,в екатеринбурге состоится митинг против мусорной реформы активисты организуют акцию февраля в на площади обороны передает в екатеринбурге за митинг будет отвечать партия яблоко,2019-01-28 09:03:03,32182751,[]
93,управляющая компания пжэк прикарманила млн рублей ук получила с года все платежи от жильцов дома по ул уральской за воду и тепло но поставщикам ресурсов деньги почему то не передала,2019-01-28 08:08:15,32182751,[]
94,екатеринбург,2019-01-28 07:05:00,32182751,[]
95,доброе утро,2019-01-28 06:32:00,32182751,[]
96,наша подписчица анастасия рассказала нам добрую историю о порядочности работников транспорта,2019-01-27 21:03:03,32182751,[]
97,доброй ночи,2019-01-27 20:00:13,32182751,[]
98,девушка разбила на перекрестке малышева мира дтп произошло сегодня вечером рассказали нам подписчики,2019-01-27 19:35:00,32182751,[]
99,в сысерти стартует масштабный проект к юбилею павла петровича бажова появился красивый ролик который рассказывает о планах творческой команды,2019-01-27 19:05:04,32182751,[]
100,на каком такси ездили последний раз,2019-01-27 18:05:01,32182751,[]
101,сегодня днем в поселке билимбай под первоуральском взорвался водный котел в жилом частном доме частично обрушилась стена,2019-01-27 17:52:09,32182751,[]
102,заснеженный мини город возле тюза,2019-01-27 17:00:10,32182751,[]
