1374,голосование уже началось очень скоро решится станет ли екатеринбург столицей экспо,2018-11-23 17:32:39,32182751,[]
1375,зима близко,2018-11-23 17:05:06,32182751,[]
1376,активная веселая очаровательная мама с искорками в глазах это победительница конкурса миссис екатеринбург в номинации главная мама о кей мама четырех детей дарья закусилова ей же достался самый желанный приз конкурса сертификат на покупки в гипермаркетах сети на сумму рублей она точно знает на что их потратить ежедневные покупки деликатесы которые раньше не могли себе позволить и новая огромная новогодняя елка на радость всей семье,2018-11-23 16:05:04,32182751,[]
1377,осторожно история не для слабонервных,2018-11-23 15:35:03,32182751,[]
1378,вечерний город вдохновляет,2018-11-23 15:05:02,32182751,[]
1379,через несколько часов в париже назовут город который примет выставку экспо екатеринбург один из основных претендентов,2018-11-23 14:05:09,32182751,[]
1380,зима будет уютной,2018-11-23 13:05:04,32182751,[]
1381,еще одна страшная авария произошла на трассе пермь екатеринбург сообщает обстоятельства происшествия полны самой черной иронии,2018-11-23 12:31:00,32182751,[]
1382,старый вокзал екатеринбурга,2018-11-23 11:31:00,32182751,[]
1383,в дегтярске компания молодых людей решила устроить ночные покатушки ну и что что прав нет,2018-11-23 10:31:00,32182751,[]
1384,каток юность откроет сезон уже сегодня вечером ноября старт в после прокат будет работать по будням с до в субботу с до в воскресенье с и также до,2018-11-23 10:02:05,32182751,[]
1385,екатерининский горный собор сейчас на этом месте площадь труда и часовня святой екатерины,2018-11-23 09:02:03,32182751,[]
1386,сегодня ночью серийный поджигатель спалил домов и бани под екатеринбургом один за другим вспыхивали строения в садах буровик огнеупорщик северный огнеупорщик южный солнечный к счастью обошлось без пострадавших,2018-11-23 08:05:06,32182751,[]
1387,,2018-11-23 07:05:03,32182751,
1388,доброе утро,2018-11-23 06:32:00,32182751,[]
1389,почему у нового памятника военным разведчикам у дома офицеров нет ягодиц,2018-11-22 21:02:01,32182751,[]
1390,ночной чат,2018-11-22 20:03:02,32182751,[]
1391,деревянные дома укутанные снегом на ул куйбышева,2018-11-22 19:05:05,32182751,[]
1392,,2018-11-22 18:05:07,32182751,
1393,новый трамвай который тестируют в екатеринбурге сломался горожане увидели как трамвай отбуксировали с пр ленина в депо для этого даже закрывали движение на проспекте на минут,2018-11-22 17:31:00,32182751,[]
1394,ледяной урал в ноябре на снимках александра пахалуева,2018-11-22 16:33:02,32182751,[]
1395,сотрудникам дома детского творчества октябрьского района запретили общаться с учениками и их родителями в соцсетях и мессенджерах,2018-11-22 16:05:15,32182751,[]
1396,,2018-11-22 15:05:04,32182751,
1397,сегодня днем в екатеринбурге мужчина умер за рулем иномарки вылетела на тротуар и врезалась в столб на ул розы люксембург,2018-11-22 14:55:49,32182751,[]
1398,отдел по расследованию особо важных дел скр провел обыски в емуп золушка которое занимается организацией питания во многих школьных столовых екатеринбурга изъяты документы идет расследование,2018-11-22 14:34:01,32182751,[]
1399,сегодня мы узнали что заброшенную больницу в зеленой роще будут охранять на объект больше не смогут проникнуть сталкеры фотографы и подростки,2018-11-22 13:36:03,32182751,[]
1400,александра коякова воюет с родителями из за желания учиться,2018-11-22 12:57:00,32182751,[]
1401,дореволюционный екатеринбург гимназическая набережная находилась на участке от главного проспекта проспект ленина до большой съезжей улицы улица антона валека,2018-11-22 12:04:51,32182751,[]
1402,легендарную заброшку екатеринбурга больницу в зеленой роще возьмут под круглосуточную охрану с января будет введен пропускной режим посторонних не пустят больница часто горит что и заставило нанять для нее охрану,2018-11-22 11:35:55,32182751,[]
1403,а вы уже видели новый трамвай в екатеринбурге как он вам,2018-11-22 10:31:00,32182751,[]
1404,владимир пузырев который сбил трех человек на ул фурманова хочет выйти из сизо ранее мужчину закрыли на время расследования по просьбе скр его апелляцию рассмотрят завтра утром,2018-11-22 10:05:16,32182751,[]
1405,земельные участки в поселке кургановский от,2018-11-22 09:05:03,32182751,[]
1406,консул армении в екатеринбурге нарек спартакян болеет за урал он разместил надпись на пляже в дубае,2018-11-22 08:33:00,32182751,[]
1407,пионерский микрорайон к новому году украсят розами их размесят на столбах на ул уральской от советской до пионеров,2018-11-22 07:31:58,32182751,[]
1408,доброе утро,2018-11-22 06:31:00,32182751,[]
1409,так екатеринбург приветствовал министра мединского который проехался по нашему городу,2018-11-21 21:56:40,32182751,[]
1410,скучали по зиме вот вам белоснежные уральские леса,2018-11-21 21:04:01,32182751,[]
1411,ночной чат,2018-11-21 20:05:04,32182751,[]
1412,пока мужчина примерял куртку в трц мегаполис его собственную верхнюю одежду случайно выставили на продажу вывесив ее вместе со всем товаром и за эти несколько минут другие посетители магазина украли из куртки телефон,2018-11-21 19:05:08,32182751,[]
1413,ищешь работу в сфере автосервиса и достойный заработок,2018-11-21 18:05:02,32182751,[]
1414,лед еще тонкий и опасный а люди гуляют по нему не надо так будьте осторожны,2018-11-21 17:32:02,32182751,[]
1415,с января года вырастет на плата за детские сады,2018-11-21 16:31:00,32182751,[]
1416,помогите найти человека,2018-11-21 16:05:03,32182751,[]
1417,накануне своего летия новосел разыгрывает рублей все по честному,2018-11-21 15:05:03,32182751,[]
1418,сотрудника почты россии решились на борьбу с системой работники сортировочного центра в кольцово судятся с начальством из за невыполнимых планов и низких зарплат с апреля они перестали укладываться в новый график работы,2018-11-21 14:05:06,32182751,[]
1419,на снимке улица декабристов которая ранее называлась александровский проспект,2018-11-21 13:32:07,32182751,[]
1420,ольга глацких вернулась в екатеринбург в ближайшее время она будет опрошена следователями по делу об огромном финансировании из бюджета детского лагеря золотое сечение несмотря на то что скр удалили новость о расследовании со своего сайта оно продолжается утверждает источник,2018-11-21 12:32:03,32182751,[]
1421,потрясающий заснеженный таганай в объективе александра осипова,2018-11-21 12:01:00,32182751,[]
1422,осталось несколько дней до судьбоносного решения ноября в париже назовут город который примет выставку экспо,2018-11-21 11:12:30,32182751,[]
1423,водонапорная башня кисти художников,2018-11-21 10:02:03,32182751,[]
1424,тюремщики провели операцию ловелас флиртуя с вором в интернете так сотрудники отдела розыска свердловского гуфсин ловили преступника на условном сроке которому из за нарушений сменили наказание на лишение свободы но он скрывался,2018-11-21 09:32:00,32182751,[]
1425,максим реванш разрисовал вагон в екатеринбургском метро,2018-11-21 08:32:02,32182751,[]
1426,несмотря на то что министр культуры владимир мединский не мог запомнить как называется аэропорт в екатеринбурге накануне он посетил наш город чиновник прилетел с другом режиссером никитой михалковым официально их появление не анонсировалось,2018-11-21 08:03:06,32182751,[]
1427,доброе утро екатеринбург,2018-11-21 07:05:03,32182751,[]
1428,в клинику лазерной косметологии лазер клиник требуется модель для отработки техники проведения процедуры лазерная диодная эпиляция все специалисты со стажем,2018-11-21 06:05:00,32182751,[]
1429,на улице бажова ради крыльца не стали уничтожать дерево такое редко увидишь,2018-11-20 21:01:00,32182751,[]
1430,ночной чат,2018-11-20 20:02:03,32182751,[]
1431,в одном черном черном городе,2018-11-20 19:02:03,32182751,[]
1432,контролер удерживал в автобусе летнюю девочку и заставил ее заплатить за проезд дважды она ехала на маршруте номер один когда зашла проверка,2018-11-20 18:05:11,32182751,[]
1433,новинки меховой моды представят жителям екатеринбурга,2018-11-20 17:05:02,32182751,[]
1434,вид на усадьбу тарасова и дом севастьянова очень качественный старый снимок,2018-11-20 16:35:00,32182751,[]
1435,жители верх исетского района возмущены опасными детскими площадками во дворе домов и по ул крауля,2018-11-20 15:33:01,32182751,[]
1436,подводим итоги розыгрыша билетов на фестиваль слова и музыка свободы в ельцин центре,2018-11-20 15:03:05,32182751,[]
1437,мэр екатеринбурга александр высокинский обидел челябинск в столице южного урала собирались строить новый аэропорт а высокинский заявил что делать этого не нужно челябинск и так недалеко от екатеринбурга с большим кольцово лучше направить деньги на строительство высокоскоростной магистрали между городами считает глава столицы среднего урала,2018-11-20 14:01:00,32182751,[]
1438,добрые рисунки на ул стрелочников,2018-11-20 13:05:06,32182751,[]
1439,,2018-11-20 12:05:03,32182751,
1440,в школе в первоуральске прямо на уроке произошел взрыв восьмиклассник играл с аккумулятором от вэйпа и предмет взорвался дымом заволокло все помещение рассказали учащиеся,2018-11-20 11:34:00,32182751,[]
1441,кажется метрополитену надоело каждый раз закрывать станции метро из за оставленных предметов,2018-11-20 11:02:04,32182751,[]
1442,признание в любви на картине алексея рыжкова,2018-11-20 10:32:01,32182751,[]
1443,фк урал подозревают в участии в договорных матчах кипрской компании расследование о таких играх выпустило издание екатеринбургский клуб находится в списке с еще командами из россии польши швейцарии чехии и других стран,2018-11-20 09:31:00,32182751,[]
1444,незрячий путешественник из екатеринбурга владимир васкевич объездил стран и городов россии о своих поездках молодой человек даже написал книгу,2018-11-20 09:05:11,32182751,[]
1445,черная пятница,2018-11-20 08:05:02,32182751,[]
1446,мексиканцев которые открыли свой бар в екатеринбурге выгнали из арендуемого помещения на ленина ребята решили остаться на урале после чм несколько месяцев готовили бар но заведение иностранцев проработало лишь две недели вечеринки мексиканцев оказались слишком шумными,2018-11-20 07:41:58,32182751,[]
1447,с утра город накрыл туман,2018-11-20 07:29:07,32182751,[]
1448,доброе утро,2018-11-20 06:32:00,32182751,[]
1449,в екатеринбурге сняли социальный ролик об аутизме,2018-11-19 21:01:00,32182751,[]
1450,спокойной ночи екатеринбург,2018-11-19 20:02:03,32182751,[]
1451,симпатичная открытка из екатеринбурга,2018-11-19 19:03:04,32182751,[]
1452,в екатеринбурге водителям разрешили ездить на красный но на одном только перекрестке для автомобилей которые поворачивают направо с ул марта на ул щорса,2018-11-19 18:05:32,32182751,[]
1453,долго собирался пора начать тренируйся с любая карта со скидкой,2018-11-19 17:05:03,32182751,[]
1454,кто мы откуда куда мы идем,2018-11-19 16:34:01,32182751,[]
1455,запущен сайт онлайн тура по исети пользователи могут посмотреть сотни панорам и почитать истории об объектах на берегах реки пролететь можно от палкино до химмаша,2018-11-19 16:02:00,32182751,[]
1456,в академическом районе опять появилась лиса бегает по детской площадке,2018-11-19 15:01:00,32182751,[]
1457,в каменске уральском мужчина напал с ножом на пассажиров автобуса по словам очевидцев пострадал как минимум один человек нападавший был пьян,2018-11-19 14:34:00,32182751,[]
1458,архивные кадры в году на центральном стадионе в екатеринбурге встретились в финале кубка россии по футболу динамо и рубин после окончания матча десятки болельщиков выбежали на поле и устроили погром,2018-11-19 13:30:03,32182751,[]
1459,двухлетнего малыша которого сбили на ул фурманова готовят к новой операции он по прежнему находится в стабильно тяжелом состоянии без сознания вопрос о пробуждении мальчика будет решаться только после второй операции передает е со ссылкой на горздрав,2018-11-19 13:02:09,32182751,[]
1460,в екатеринбурге появилось новое большое граффити на ул пушкина надпись мы станем лучше выполнил рома бантик,2018-11-19 12:05:06,32182751,[]
1461,екатеринбург избежит мусорного коллапса напомним договор на вывоз мусора выиграла спецавтобаза ее конкурент компания рифей подал в суд не согласившись с результатами конкурса на подрядчика наложили ограничение и с нового года екатеринбург должно было завалить мусором,2018-11-19 11:04:03,32182751,[]
1462,катаемся на визовском пруду,2018-11-19 10:32:08,32182751,[]
1463,в свердловской области растет количество дтп в году произошло уже тысячи аварий погибли человек почти тысячи получили травмы,2018-11-19 09:31:00,32182751,[]
1464,зимние картины александра ремезова,2018-11-19 09:01:00,32182751,[]
1465,появились рисунки новых вагонов ржд это те самые разработки с капсульными местами которые компания анонсировала ранее,2018-11-19 08:03:32,32182751,[]
1466,доброе утро любимый город,2018-11-19 07:05:07,32182751,[]
1467,надели смешные ботинки для безопасности и вперед,2018-11-19 06:05:00,32182751,[]
1468,в году вице президент сша ричард никсон посетил свердловск вместе с ним приехал фотограф журнала говард сочурек,2018-11-18 21:01:00,32182751,[]
1469,ночной чат,2018-11-18 20:01:00,32182751,[]
1470,в цпкио им маяковского стартовал конкурс поделок для деда мороза чтобы принять участие нужно принести игрушки сделанные своими руками в администрацию парка по будням с до,2018-11-18 19:31:00,32182751,[]
1471,холодный ноябрь в екатеринбурге,2018-11-18 19:02:01,32182751,[]
1472,в скором времени в свердловской области должна появиться единая социальная карта указ о ее внедрении губернатор евгений куйвашев,2018-11-18 18:31:00,32182751,[]
1473,смотрите это американские военные карты середины века на них схематично помечены важные объекты свердловска и области,2018-11-18 17:33:00,32182751,[]
1474,уральские синоптики рассказали откуда берутся ледяные медузы на реке исеть,2018-11-18 17:01:00,32182751,[]
1475,фантастические теплицы под екатеринбургом,2018-11-18 16:01:00,32182751,[]
1476,на эльмаше мужчина избил супругу а затем она выпала из окна шестого этажа женщина упала на козырек подъезда даже после таких травм екатеринбурженка выжила пишет,2018-11-18 15:02:03,32182751,[]
1477,таганайский инь ян в объективе александра осипова,2018-11-18 14:34:04,32182751,[]
1478,антон шипулин не попал в сборную россии для участия в кубке мира по биатлону екатеринбуржец будет лишь в резерве,2018-11-18 13:35:00,32182751,[]
1479,работы ильи мозги в екатеринбурге,2018-11-18 13:01:01,32182751,[]
1480,в честь дня рождения екатеринбурга музеи дарят горожанам бесплатные экскурсии,2018-11-18 12:03:03,32182751,[]
1481,пьяная компания избила врача скорой помощи реанимацию на ул суходольскую вызвали два парня и лет врач увидел что они просто пьяны медицинская помощь им не требуется но ребята решили кулаками доказать что они больны,2018-11-18 11:01:00,32182751,[]
1482,планета екатеринбург,2018-11-18 10:21:51,32182751,[]
1483,дмитрий лошагин требует свою долю наследства убитой им супруги юлии прокопьевой пишет светский фотограф отбывающий наказание за убийство подал иск на три миллиона рублей к родственникам юлии,2018-11-18 09:30:02,32182751,[]
1484,сегодня екатеринбург отмечает лет поздравляем всех горожан,2018-11-18 08:32:02,32182751,[]
1485,год корреспондент татьяна полозова записывает стендап для новостей молодого четвертого канала,2018-11-18 08:03:05,32182751,[]
1486,экстремал из екатеринбурга максим кагин совершил прогулку на канате между домами в питере он покорил высоту в этажей пройдя метров в условиях сильного ветра,2018-11-18 07:31:00,32182751,[]
1487,доброе утро,2018-11-18 06:35:00,32182751,[]
1488,возвращение с отпуска на шри ланке закончилось для жителя екатеринбурга неблагополучно на борту самолета его избили соседки по сидениям,2018-11-17 20:31:00,32182751,[]
1489,ночной чат,2018-11-17 20:01:00,32182751,[]
1490,мчс предупреждает лед охвативший уральские водоемы еще очень тонкий выходить на него крайне опасно,2018-11-17 19:01:00,32182751,[]
1491,поющие девушки свердловска екатеринбурга,2018-11-17 18:33:01,32182751,[]
