0,видео с зимних каникул на камчатке просту почувствуйте эту невероятную атмосферу,2019-01-20 14:43:55,49796420,[]
1,на камчатке сел самолет который не смог из за ветра приземлиться в магадане,2019-02-02 09:35:18,49796420,[]
2,фото,2019-02-02 09:02:02,49796420,['фото']
3,за главный приз берингии сразятся каюров,2019-02-02 06:15:28,49796420,[]
4,предложил ввести мораторий на добычу россыпного золота на камчатке,2019-02-02 05:25:07,49796420,[]
5,три компании хотят поучаствовать в строительстве краевой больницы на камчатке,2019-02-02 04:35:03,49796420,[]
6,фото,2019-02-02 04:30:14,49796420,['фото']
7,участок дороги между поселками козыревск и ключи открыли для движения,2019-02-02 03:20:21,49796420,[]
8,на трассе нагорный вулканный лихач спровоцировал массовое дтп,2019-02-02 00:50:09,49796420,[]
9,из за непогоды на камчатке закрывают движение транспорта,2019-02-02 00:25:16,49796420,[]
10,похоже нас обманули объявленное снижение цен на интернет оказалось новогодней акцией,2019-02-02 00:02:51,49796420,[]
11,на камчатке открылась ледовая переправа на реке тигиль,2019-02-01 16:40:58,49796420,[]
12,в вилючинске женщине отказывали в выплате пособия на ребенка,2019-02-01 15:25:16,49796420,[]
13,в главном аэропорту камчатки время бесплатной парковки ограничили минутами,2019-02-01 14:35:31,49796420,[]
14,в петропавловске руководству стройгеосервиса грозит статья за невыплату зарплаты,2019-02-01 13:20:31,49796420,[]
15,жителей петропавловска приглашают принять участие в фестивале гто,2019-02-01 12:31:20,49796420,[]
16,власти камчатки объявили о запуске завода по переработке мусора,2019-02-01 11:40:21,49796420,[]
17,камчатские росгвардейцы задержали угольных похитителей,2019-02-01 10:04:02,49796420,[]
18,на камчатке мусороперерабатывающий комплекс даст отходам вторую жизнь,2019-02-01 09:45:24,49796420,[]
19,синоптики циклон будет влиять на погоду в петропавловске до понедельника,2019-02-01 09:35:09,49796420,[]
20,камчатский рецидивист насмерть забил бывшего сокамерника за мусорского,2019-02-01 09:31:17,49796420,[]
21,на камчатке алкогольный бостон уклонился от уплаты млн рублей налогов,2019-02-01 09:16:01,49796420,[]
22,житель камчатки попал под статью за угрозу убить ударом жену и ее подругу,2019-02-01 09:01:40,49796420,[]
23,на камчатке сократилась добыча всех видов золота,2019-02-01 08:20:16,49796420,[]
24,мошенник из хабаровска вызвался сопровождать детей на камчатку,2019-02-01 07:30:59,49796420,[]
25,житель вилючинска пообещал убить жену и ее подругу,2019-02-01 06:15:26,49796420,[]
26,житель камчатки ранил брата и убил товарища который назвал его мусорским,2019-02-01 05:25:09,49796420,[]
27,фото,2019-02-01 04:30:27,49796420,['фото']
28,на камчатке автозимник анавгай тигиль открыли для движения грузового транспорта,2019-02-01 03:20:22,49796420,[]
29,аэрофлот пообещал вернуть бесплатный алкоголь для пассажиров экономкласса,2019-02-01 02:30:16,49796420,[]
30,мэрия петропавловска проверит качество снегоочистки на улицах города,2019-02-01 01:40:15,49796420,[]
31,прокуратура в суде оспорит решение властей камчатки о снижении выплат инвалидам,2019-02-01 01:15:20,49796420,[]
32,ркц и ужкх петропавловска имели счета в банке у которого отозвали лицензию,2019-02-01 00:50:10,49796420,[]
33,на камчатке объявлены штормовое предупреждение и лавинная опасность,2019-02-01 00:25:18,49796420,[]
34,синоптики к камчатке подходит очередной снежный циклон,2019-02-01 00:05:02,49796420,[]
35,петропавловск получит два миллиарда рублей на ремонт дорог,2019-01-31 16:40:15,49796420,[]
36,петропавловск могли бы включить в десятку самых снежных городов мира,2019-01-31 14:38:25,49796420,[]
37,женщина лишилась денег отовариваясь в несуществующем интернет магазине,2019-01-31 13:21:10,49796420,[]
38,у берегов камчатки три дня будет бушевать сильный шторм,2019-01-31 13:20:09,49796420,[]
39,цб о камчаткомагропромбанке выводили активы работали с ущербом для вкладчиков,2019-01-31 12:32:21,49796420,[]
40,на камчатке следователи раскрыли все убийства и изнасилования,2019-01-31 12:00:13,49796420,[]
41,камчатку накроет снежный циклон,2019-01-31 11:45:28,49796420,[]
42,на камчатке мигрант заплатит штраф за незаконное пересечение границы,2019-01-31 11:40:54,49796420,[]
43,внимание мама папа и ты,2019-01-31 11:00:05,49796420,[]
44,продавцов кофе в центре петропавловска накажут за незаконную торговлю,2019-01-31 10:25:12,49796420,[]
45,на камчатке вулкан шивелуч выбросил столб пепла на высоту километра,2019-01-31 10:16:10,49796420,[]
46,на камчатке объявлена лавинная опасность,2019-01-31 10:03:41,49796420,[]
47,московский аферист оставил камчатскую девушку без денег и детской коляски,2019-01-31 09:45:08,49796420,[]
48,уровень киберпреступности на камчатке за год вырос на процентов,2019-01-31 09:35:06,49796420,[]
49,новый визит центр для туристов открылся в петропавловске,2019-01-31 09:31:25,49796420,[]
50,на камчатке пассажиров по бухте будет перевозить катер на воздушной подушке,2019-01-31 09:15:37,49796420,[]
51,на камчатке наркодилер из дома сбыта работал складом,2019-01-31 09:02:57,49796420,[]
52,цб отозвал лицензию у камчатского банка который возглавляет рашид нургалиев,2019-01-31 08:20:58,49796420,[]
53,переправа к поселку лазо мильковского района стала мощнее,2019-01-31 07:30:07,49796420,[]
54,депутатам края представят проект зеленого щита петропавловска,2019-01-31 06:15:24,49796420,[]
55,в петропавловске на линию выйдет пассажирский катер на воздушной подушке,2019-01-31 05:25:04,49796420,[]
56,на камчатке спустя сутки открыли дорогу на крутоберегово,2019-01-31 04:35:04,49796420,[]
57,фото,2019-01-31 04:30:25,49796420,['фото']
58,на камчатке участник банды наркоторговцев отправится под суд,2019-01-31 02:30:27,49796420,[]
59,камчатские спасатели напомнили пенсионерам о правилах пожарной безопасности,2019-01-31 01:15:10,49796420,[]
60,жителей петропавловска приглашают отметить день воинской славы россии,2019-01-31 00:50:26,49796420,[]
61,власти не нашли подрядчика который согласился бы построить паром за миллионов,2019-01-31 00:25:07,49796420,[]
62,владельцам подсобных хозяйств на камчатке предлагают обращаться за господдержкой,2019-01-31 00:04:16,49796420,[]
63,на камчатке женская колония будет снабжать хлебом вечернюю школу и больницу,2019-01-30 16:40:38,49796420,[]
64,на красной линии в петропавловске поставят вертикальный билборд,2019-01-30 15:25:09,49796420,[]
65,детскую гонку дюлин на камчатке будет комментировать телеведущий григорий манев,2019-01-30 14:35:04,49796420,[]
66,на камчатке пройдет выставка скорость в сердце лапах и душе,2019-01-30 13:03:26,49796420,[]
67,на камчатке пенсионер на тойоте сбил женщину и скрылся с места дтп,2019-01-30 12:31:51,49796420,[]
68,на камчатке экипажи подводных лодок боролись за живучесть субмарины,2019-01-30 11:30:30,49796420,[]
69,полиция просит у жителей камчатки помощи в раскрытии кражи фото,2019-01-30 11:15:17,49796420,[]
70,на камчатке женщину оштрафовали за драку с соседкой на кухне общежития,2019-01-30 10:25:21,49796420,[]
71,камчатских джиперов зовут на снежный путь,2019-01-30 10:00:25,49796420,[]
72,камчатский пенсионер сбил женщину на переходе и скрылся с места дтп,2019-01-30 09:45:25,49796420,[]
73,камчатский бизнесмен задолжал сантехникам тысяч рублей,2019-01-30 09:31:03,49796420,[]
74,камчатская полиция устанавливает личность елизовского вора,2019-01-30 09:15:32,49796420,[]
75,на камчатке извращенец рецидивист приставал к малолетним девочкам,2019-01-30 09:00:50,49796420,[]
76,каюр из тымлата попробует повторить свой давний успех на берингии,2019-01-30 08:20:22,49796420,[]
77,в подмосковье житель камчатки выжил после наезда электрички,2019-01-30 07:30:06,49796420,[]
78,за верность камчатке власти готовы потратиться на награды на лет вперед,2019-01-30 06:15:16,49796420,[]
79,на камчатке временно закрыта дорога на аэропорт крутоберегово,2019-01-30 04:35:06,49796420,[]
80,фото,2019-01-30 04:30:34,49796420,['фото']
81,камчатские рыбаки начали год с отрицательной динамики,2019-01-30 03:20:12,49796420,[]
82,камчатские власти зарезервировали миллионов рублей на случай чс,2019-01-30 01:15:16,49796420,[]
83,жителям петропавловска покажут фотографии рыбалки и рыбаков,2019-01-30 00:50:13,49796420,[]
84,в колонии строго режима на камчатке металл будут резать плазменным аппаратом,2019-01-30 00:25:09,49796420,[]
85,на фестивале снежный путь пройдет состязание внедорожников,2019-01-30 00:02:41,49796420,[]
86,губернатор илюхин жители камчатки нуждаются в современном автовокзале,2019-01-29 16:15:07,49796420,[]
87,статистики средняя зарплата на камчатке приблизилась к рублей в месяц,2019-01-29 15:25:33,49796420,[]
88,камчатские синоптики уточнили прогноз по тихоокеанским циклонам,2019-01-29 14:35:03,49796420,[]
89,жители камчатки продолжают переводить деньги мошенникам,2019-01-29 13:20:50,49796420,[]
90,камчатцев приглашают на концерт памяти георгия аввакумова,2019-01-29 11:15:14,49796420,[]
91,внимание,2019-01-29 11:00:04,49796420,[]
92,в камчатском крае в году больше детей сирот получили квартиры,2019-01-29 10:25:08,49796420,[]
93,житель камчатки убил своего знакомого при помощи вилки и кулаков,2019-01-29 09:35:24,49796420,[]
94,на камчатке мужчина ударил собутыльника вилкой и придушил,2019-01-29 09:02:50,49796420,[]
95,камчатка попала в число регионов с недостаточным уровнем развития сми,2019-01-29 08:20:31,49796420,[]
96,ретриверы отыскали в заснеженном камчатском лесу спрятавшихся лыжников,2019-01-29 06:15:20,49796420,[]
97,на камчатке в камерах исправительных колоний установят окна с форточками,2019-01-29 05:25:04,49796420,[]
98,федеральные социальные пособия обещают проиндексировать на,2019-01-29 04:35:06,49796420,[]
99,фото,2019-01-29 04:30:21,49796420,['фото']
100,за неделю на камчатке семеро детей заболели гриппом,2019-01-29 03:20:08,49796420,[]
101,предоплаченные посылки теперь можно сдавать во всех отделениях почты россии,2019-01-29 02:30:32,49796420,[]
102,в полночь житель петропавловска избил девушку и забрал у нее телефон,2019-01-29 01:40:07,49796420,[]
103,камчатцев приглашают присоединиться к международному дню книгодарения,2019-01-29 01:15:07,49796420,[]
104,мошенник придумал сложную схему чтобы обмануть бухгалтера камчатской компании,2019-01-29 00:50:17,49796420,[]
105,ночью в товариществе мечта на камчатке сгорел трехэтажный дачный дом,2019-01-29 00:25:14,49796420,[]
106,камчатские спортсменки завоевали медали на международных соревнованиях,2019-01-29 00:00:36,49796420,[]
107,на камчатке прокуратура проверит законность освящения водопроводной воды,2019-01-28 15:25:12,49796420,[]
108,прожиточный минимум на камчатке увеличат на рублей,2019-01-28 13:20:10,49796420,[]
109,на камчатке погрузчик наехал на упавшего пешехода фото,2019-01-28 12:30:07,49796420,[]
110,инвалиды камчатки оказались должниками у государства,2019-01-28 11:15:11,49796420,[]
111,к берегам камчатки приближается циклон из тихого океана,2019-01-28 10:25:08,49796420,[]
112,на работу в камчатский край разрешили привлечь всего иностранцев из дальнего зарубежья,2019-01-28 09:35:07,49796420,[]
113,на камчатке уголовник напал на финансовый офис с серной кислотой,2019-01-28 09:30:31,49796420,[]
114,в петропавловске задержан полуночный грабитель,2019-01-28 09:15:06,49796420,[]
115,житель вилючинска попался с поддельными документами на конструктор,2019-01-28 09:00:11,49796420,[]
116,автомобилист из вилючинска попал под статью за поддельные номера и документы,2019-01-28 07:31:04,49796420,[]
117,в камчатских колониях стало больше преступников,2019-01-28 06:15:23,49796420,[]
118,на камчатке пенсионера стали получать больше,2019-01-28 05:25:06,49796420,[]
119,бандит грозил плеснуть серной кислотой в лицо сотрудницы финансовой компании,2019-01-28 04:35:08,49796420,[]
120,фото,2019-01-28 04:30:45,49796420,['фото']
121,на камчатке инспекторы гимс за неделю провели бесед с рыбаками,2019-01-28 03:20:19,49796420,[]
122,гастроли классический русский балет москвы на камчатке,2019-01-28 03:01:36,49796420,[]
123,на камчатке на одну новую машину приходится подержанных,2019-01-28 02:30:14,49796420,[]
124,стало известно какое расстояние придется пройти каюрам берингии в этом году,2019-01-28 01:15:28,49796420,[]
125,на камчатке планируют открыть пятую по счету ледовую переправу,2019-01-28 00:25:09,49796420,[]
126,в фестивале примут участие юных музыкантов из петропавловска,2019-01-27 15:25:07,49796420,[]
127,на камчатке объявили штормовое предупреждение,2019-01-27 14:36:21,49796420,[]
128,чайна таун,2019-01-27 13:57:54,49796420,[]
129,житель петропавловска наживался предлагая поддельные медкомиссии,2019-01-27 13:20:32,49796420,[]
130,сегодня на камчатке чествовали жителей блокадного ленинграда фото,2019-01-27 11:15:22,49796420,[]
131,на камчатке вулкан шивелуч выбросил пепел на километра,2019-01-27 10:25:15,49796420,[]
132,вулкан шивелуч на камчатке выбросил столб пепла на высоту километра,2019-01-27 09:15:24,49796420,[]
133,у берегов камчатки ожидается сильный шторм,2019-01-27 09:02:26,49796420,[]
134,фото,2019-01-27 09:00:35,49796420,['фото']
135,фото,2019-01-27 04:30:16,49796420,['фото']
136,фильм медведи камчатки начало жизни завоевал кинопремию золотой орел,2019-01-26 15:25:23,49796420,[]
137,ночной город,2019-01-26 14:09:44,49796420,[]
138,на камчатке мошенника из приморья наказали условным сроком,2019-01-26 09:35:15,49796420,[]
139,фото,2019-01-26 09:01:38,49796420,['фото']
140,фото,2019-01-26 04:31:03,49796420,['фото']
141,во владивостоке сейчас жарко несмотря на зиму здесь начался полуфинал конкурса лидеры россии на который собрались управленцев из регионов дальневосточного федерального округа в том числе из камчатского края чтобы в напряженной конкурентной борьбе завоевать себе право на выход в финал,2019-01-26 04:00:00,49796420,[]
142,школьников камчатки приглашают получить медицинские образование за счет бюджета,2019-01-26 00:50:15,49796420,[]
143,в петропавловске за нарушения пожарной безопасности закрывают галант сити,2019-01-26 00:25:07,49796420,[]
144,в аэропорту елизова ввели новые правила движения и парковки машин,2019-01-26 00:04:11,49796420,[]
145,полиция на камчатке снизились преступность и количество дтп,2019-01-25 16:40:39,49796420,[]
146,на остановках петропавловска появились новые таблички с расписанием автобусов,2019-01-25 15:25:17,49796420,[]
147,камчатцев предупредили о компании фантоме которая выпускает молочную продукцию,2019-01-25 13:20:25,49796420,[]
148,житель петропавловска украл у знакомой пенсионерки тысяч рублей,2019-01-25 12:31:06,49796420,[]
149,на камчатке экс руководителю поисково спасательного отряда мчс дали условный срок,2019-01-25 11:15:40,49796420,[]
150,в елизовской поликлинике ленивая медсестра ограничила прием пациентов,2019-01-25 10:46:56,49796420,[]
151,камчатского спасателя признали виновным в хищении тысяч рублей,2019-01-25 10:32:56,49796420,[]
152,на камчатке за год резко снизилось количество избирателей,2019-01-25 10:25:18,49796420,[]
153,вулкан шивелуч на камчатке отстрелялся пеплом на высоту километра,2019-01-25 10:17:10,49796420,[]
154,в петропавловске побит температурный рекорд года,2019-01-25 10:01:33,49796420,[]
155,на камчатке рынок новых легковых автомобилей вырос на процентов,2019-01-25 09:45:08,49796420,[]
156,синоптики обещают жителям петропавловска морозные выходные,2019-01-25 09:35:22,49796420,[]
157,в петропавловске ночью на северо востоке сгорел кроссовер,2019-01-25 09:30:40,49796420,[]
158,на камчатке многодетный отец забил до смерти домогавшегося его знакомого,2019-01-25 09:15:46,49796420,[]
159,на камчатке гендиректор рыбной фирмы уклонился от уплаты млн налогов,2019-01-25 09:00:11,49796420,[]
160,эксперты на камчатке рост авторынка за год превысил процентов,2019-01-25 08:20:05,49796420,[]
161,в петропавловске ночью сгорел дорогой кроссовер,2019-01-25 07:31:06,49796420,[]
162,сбой в системе мэрия признала ошибкой свои же данные о росте цен в петропавловске,2019-01-25 06:15:07,49796420,[]
163,жителя петропавловска осудят за то что до смерти забил знакомого за приставания,2019-01-25 05:25:08,49796420,[]
164,житель петропавловска забыл о долге в тысяч и остался без таиланда,2019-01-25 04:35:13,49796420,[]
165,фото,2019-01-25 04:31:09,49796420,['фото']
166,на камчатке синоптики рассказали о новом температурном рекорде,2019-01-25 03:20:16,49796420,[]
167,гастроли классический русский балет москвы на камчатке,2019-01-25 03:05:57,49796420,[]
168,на камчатке экс гендиректор витязь авто попал под статью за неуплату налогов,2019-01-25 02:55:06,49796420,[]
169,за год на камчатке произошло дтп с участием внедорожной техники,2019-01-25 02:30:52,49796420,[]
170,на камчатке вулкан шивелуч выстрелил пеплом на четыре километра,2019-01-25 02:05:07,49796420,[]
171,в библиотеках петропавловска изменились телефонные номера,2019-01-25 01:40:08,49796420,[]
172,за год камчатская таможня перечислила в бюджет больше миллиарда рублей,2019-01-25 01:15:11,49796420,[]
