2517,вечер но я приду по ваши души памяти высоцкого пройдет в пушкинском заповеднике в рамках ночи искусств,2018-10-28 15:06:14,1205247,[]
2518,в пскове ищут свидетелей наезда на девушку на октябрьском проспекте,2018-10-28 14:34:44,1205247,[]
2519,до обещают псковичам в ночь на понедельник,2018-10-28 14:14:58,1205247,[]
2520,более участников и болельщиков собрал турнир киберспорт против наркотиков,2018-10-28 13:45:37,1205247,[]
2521,в центре опочки машина упала в великую фото,2018-10-28 13:14:26,1205247,[]
2522,псковские мужчины красивы как ален делон видеоблогер из латвии,2018-10-28 12:31:18,1205247,[]
2523,псковкий тяжелоатлет установил новые рекорды на турнире в эстонии,2018-10-28 11:35:56,1205247,[]
2524,штат аппарата администрации псковской области увеличится а комитетов и управлений сократится,2018-10-28 11:07:48,1205247,[]
2525,,2018-10-28 10:16:53,1205247,
2526,день автомобилиста отмечают в россии,2018-10-28 09:50:16,1205247,[]
2527,пскович показал третий результат в сборной россии на чемпионате мира по гонкам с препятствиями,2018-10-28 09:44:37,1205247,[]
2528,только в официальной точке продаж центр при покупке х литровой канистры и вы получаете литр идентичного масла в подарок,2018-10-27 19:00:00,1205247,[]
2529,в пскове работает ганзейская комиссия,2018-10-27 12:05:05,1205247,[]
2530,сотрудник псковгу максим колпаков возглавил судейскую коллегию в программе умницы и умники на первом канале,2018-10-27 12:04:55,1205247,[]
2531,губернатор ведерников подписал указы об изменениях в структуре органов власти псковской области,2018-10-27 11:37:55,1205247,[]
2532,,2018-10-27 11:19:31,1205247,
2533,псковская полиция устанавливает личность неизвестной женщины,2018-10-27 11:08:18,1205247,[]
2534,турнир киберспорт против наркотиков пройдет сегодня в пскове,2018-10-27 10:03:12,1205247,[]
2535,скончалась ветеран педагогического труда маргарита барышнева,2018-10-27 10:02:29,1205247,[]
2536,тень выборов,2018-10-27 10:02:21,1205247,[]
2537,юрий демьяненко на пенсии сидеть не собираюсь,2018-10-27 10:02:11,1205247,[]
2538,путин пошутил над севшей в его кресло губернатором хмао уроженкой псковской области,2018-10-26 23:06:28,1205247,[]
2539,акценты донецкого ганза головного мозга поймать попрошайку и бдсм по псковски,2018-10-26 19:27:34,1205247,[]
2540,в великих луках состоялось официальное открытие фок айсберг,2018-10-26 18:05:38,1205247,[]
2541,алексея захарова сняли с должности исполняющего обязанности заместителя главы администрации пскова,2018-10-26 17:29:44,1205247,[]
2542,интерактив хлебный непроезд или особенности псковского ямочного ремонта,2018-10-26 17:06:09,1205247,[]
2543,великолукских школьников наградили медалью мчс за спасение провалившейся под лед девочки,2018-10-26 16:31:29,1205247,[]
2544,добрый псков принял участие в конференции содружества добрых городов,2018-10-26 16:00:03,1205247,[]
2545,эксперт объяснил дачникам какие дома могут снести а какие попадут под огородную амнистию,2018-10-26 15:24:49,1205247,[]
2546,без блинов и ванной как единая россия советует экономить,2018-10-26 15:07:02,1205247,[]
2547,по следам войны и мира стефана батория,2018-10-26 14:53:37,1205247,[]
2548,большой розыгрыш подарков в честь летия тц максимус состоится в субботу,2018-10-26 14:33:09,1205247,[]
2549,механические и кибернетические чудеса покажет пикник октября в пскове,2018-10-26 13:24:55,1205247,[]
2550,псков сыграет с днепром,2018-10-26 13:20:58,1205247,[]
2551,новая ферма по откорму бычков заработала в плюсском районе,2018-10-26 13:14:37,1205247,[]
2552,фотофакт зеленая лужа у инфекционной больницы,2018-10-26 12:53:37,1205247,[]
2553,михаил ведерников подписал соглашение с леруа мерлен,2018-10-26 11:59:15,1205247,[]
2554,сидишь без работы она у нас есть,2018-10-26 11:49:15,1205247,[]
2555,летним псковичам и летним псковичкам рассказали когда они выйдут на пенсию,2018-10-26 10:44:52,1205247,[]
2556,файер шоу от театра огня бор хейм завершит официальную часть пушкинского бала,2018-10-26 10:39:11,1205247,[]
2557,средства на реконструкцию стадиона машиностроитель вернули в городской бюджет,2018-10-26 10:37:34,1205247,[]
2558,сегодня в пскове пройдет вечер памяти краеведа натана левина,2018-10-26 10:04:10,1205247,[]
2559,скончался николай караченцов,2018-10-26 09:52:49,1205247,[]
2560,,2018-10-26 09:49:47,1205247,
2561,интерактив про экономию не слышали,2018-10-26 09:44:28,1205247,[]
2562,женщину доставили в больницу после пожара в доме на улице толстого в пскове,2018-10-26 09:01:29,1205247,[]
2563,дмитрий волхонов начал сбор средств на съемки документального фильма про псковских музыкантов,2018-10-26 09:01:14,1205247,[]
2564,фестиваль золотые родники в пскове входит в топ туристических событий выходных,2018-10-26 08:38:10,1205247,[]
2565,каждое воскресенье в великих луках будут проходить бесплатные тренировки по футболу,2018-10-26 08:38:06,1205247,[]
2566,за один день в невельском районе пограничники пресекли попытки незаконного ввоза на территорию рф мясной продукции и рыбы,2018-10-26 08:38:01,1205247,[]
2567,псковская пенсионерка лишилась денег поверив благотворителю,2018-10-25 21:45:19,1205247,[]
2568,псковстат стоимость минимального набора продуктов питания на месяц в регионе составила рубля,2018-10-25 21:13:00,1205247,[]
2569,мечтаете о своей квартире но не готовы переплачивать банку за ипотеку вам сюда,2018-10-25 19:40:00,1205247,[]
2570,прошу максимальный репост внимание розыск г псков,2018-10-25 19:30:58,1205247,[]
2571,,2018-10-25 19:19:59,1205247,
2572,зима близко,2018-10-25 19:18:57,1205247,[]
2573,грядущей ночью температура воздуха в псковской области опустится до минус трех градусов,2018-10-25 19:03:13,1205247,[]
2574,пенсионерам массово рассылают ложные уведомления о доплате в рублей,2018-10-25 18:47:22,1205247,[]
2575,только в официальной точке продаж центр при покупке х литровой канистры и вы получаете литр идентичного масла в подарок,2018-10-25 18:00:00,1205247,[]
2576,на время реконструкции ж д переезда ограничат автодвижение по улице генерала маргелова,2018-10-25 15:25:19,1205247,[]
2577,депутаты псковского областного собрания согласовали повышение взносов на капремонт в году,2018-10-25 15:05:07,1205247,[]
2578,латвийские авиакомпании рассмотрят возможность создания прямого рейса псков рига,2018-10-25 15:05:02,1205247,[]
2579,депутаты псковского областного собрания вновь отказались возвращать прямые выборы мэров,2018-10-25 14:32:42,1205247,[]
2580,команд заявились на участие в турнире киберспорт против наркотиков по дисциплине в пскове,2018-10-25 14:07:03,1205247,[]
2581,лет истории тц максимус инфографика,2018-10-25 13:59:26,1205247,[]
2582,,2018-10-25 13:53:49,1205247,
2583,мир труд рай,2018-10-25 13:22:32,1205247,[]
2584,супер фитнес приглашает псковичей на праздник,2018-10-25 13:15:55,1205247,[]
2585,закон о пчеловодстве принят в псковской области,2018-10-25 12:46:17,1205247,[]
2586,псковичам разрешили собирать валежник с года,2018-10-25 12:46:08,1205247,[]
2587,проект закона о наградах псковской области принят во втором чтении,2018-10-25 12:46:04,1205247,[]
2588,интерактив в дмш пскова нельзя заниматься из за растущих дыр в стенах,2018-10-25 12:36:34,1205247,[]
2589,репертуар псковского театра драмы и театра кукол на ноябрь насчитывает свыше спектаклей,2018-10-25 12:08:16,1205247,[]
2590,псковские бюджетные учреждения задолжали за жку почти млн рублей,2018-10-25 12:02:02,1205247,[]
2591,в полистовском заповеднике провели плановое наблюдение за осенним пролетом птиц,2018-10-25 11:58:21,1205247,[]
2592,выборам да фильтрам нет,2018-10-25 10:49:37,1205247,[]
2593,,2018-10-25 10:18:16,1205247,
2594,количество членов фракции единая россия в псковской городской думе увеличилось до,2018-10-25 10:14:49,1205247,[]
2595,в связи с трагическими событиями в керчи прокуратура псковской области проводит проверку в образовательных организациях,2018-10-25 09:11:55,1205247,[]
2596,псковичей предупреждают об ухудшении дорожной обстановки,2018-10-25 09:04:40,1205247,[]
2597,в великих луках подожгли гаражи,2018-10-25 08:59:51,1205247,[]
2598,из за любви гражданин грузии пытался незаконно пересечь границу с россией,2018-10-25 08:47:24,1205247,[]
2599,путин предупредил о новом витке гонки вооружений,2018-10-24 21:34:28,1205247,[]
2600,в псковской области выявлено недобросовестных перевозчиков детей,2018-10-24 20:20:06,1205247,[]
2601,центр города не должен так выглядеть иван цецерский о территории возле европарка,2018-10-24 19:50:47,1205247,[]
2602,палкой о двух концах назвал депутат законопроект о сборе валежника в псковской области,2018-10-24 19:16:32,1205247,[]
2603,открыто онлайн голосование за новое имя псковского аэропорта,2018-10-24 18:41:42,1205247,[]
2604,саженцы дубов посадили псковские активисты онф на участке сквера вдоль улицы кузнецкой,2018-10-24 17:40:22,1205247,[]
2605,зарплаты воспитателей псковской области одни из самых низких в россии,2018-10-24 17:22:11,1205247,[]
2606,оганзевшие,2018-10-24 17:09:12,1205247,[]
2607,александр кузнецов и николай киянец разъяснили механизм погашения долгов по зарплате перед работниками псковпассажиравтотранса,2018-10-24 16:37:45,1205247,[]
2608,псковские таможенники не позволили приверженцу вегетарианства ввезти семена конопли,2018-10-24 16:19:07,1205247,[]
2609,гости пушкинского бала смогут посетить салон бального этикета,2018-10-24 15:50:49,1205247,[]
2610,единый короткий номер для жалоб на пьяных водителей предложили создать в псковской области,2018-10-24 15:40:23,1205247,[]
2611,инициативу шлосберга о возвращении прямых выборов мэров отклонили в профильном комитете,2018-10-24 15:33:14,1205247,[]
2612,плохую разметку в пскове объяснили плохими дорогами,2018-10-24 15:33:10,1205247,[]
2613,девять признаков самовольных захватов земельных участков в пскове и борисовичах выявил росреестр,2018-10-24 15:33:06,1205247,[]
2614,в псковской области задержан подросток по подозрению в нарушении половой неприкосновенности малолетних,2018-10-24 15:12:46,1205247,[]
2615,дворец конгрессов дачный сарай,2018-10-24 14:43:38,1205247,[]
2616,берег великой у снетогорского монастыря хотят вывести за границы памятника природы,2018-10-24 14:30:54,1205247,[]
2617,дешевле только бесплатно успейте воспользоваться скидками середины осени от стройбазы на алмазной,2018-10-24 14:11:00,1205247,[]
2618,в ооо псковагроинвест собрали зерновые с самой высокой урожайностью среди предприятий псковского района,2018-10-24 13:55:15,1205247,[]
2619,трк акваполис приглашает в волшебную страну картонию,2018-10-24 13:09:15,1205247,[]
2620,прожиточный минимум псковских пенсионеров в году вырастет на,2018-10-24 12:35:15,1205247,[]
2621,интерактивная выставка динозавров затерянный мир откроется в субботу в пскове,2018-10-24 12:26:48,1205247,[]
2622,навязчивость попрошаек и проституток обсудили псковские депутаты,2018-10-24 12:23:00,1205247,[]
2623,с января сроки выплаты пособий по уходу за ребенком до лет изменятся,2018-10-24 10:10:54,1205247,[]
2624,,2018-10-24 10:05:26,1205247,
2625,ночью мужчина погиб при пожаре в городе печоры,2018-10-24 09:36:18,1205247,[]
2626,культурную программу псковской ганзы подробно обсудили в правительстве,2018-10-24 09:35:08,1205247,[]
2627,в псковском кремле заново возведут метра кровли,2018-10-23 22:44:14,1205247,[]
2628,изменилось расписание автобуса в пскове,2018-10-23 20:36:08,1205247,[]
2629,михаил ведерников попросил вице премьера правительства рассмотреть введение сбора за посещение псковского острова белов,2018-10-23 20:25:59,1205247,[]
2630,интерактив пьяных за рулем в суд и на зону,2018-10-23 19:09:34,1205247,[]
2631,для коммерческого транспорта по выгодной цене в центре,2018-10-23 19:00:00,1205247,[]
2632,опубликовано фото дома где псковички насиловали подругу,2018-10-23 18:41:50,1205247,[]
2633,псковские власти и авиакомпания азимут разработают дорожную карту по развитию авиасообщения и туриндустрии региона,2018-10-23 17:49:36,1205247,[]
2634,отец и сын подозреваются в занятии наркобизнесом в островском районе,2018-10-23 17:30:29,1205247,[]
2635,аквапарк акваполис приглашает школьников весело провести осенние каникулы,2018-10-23 17:18:16,1205247,[]
2636,до лет лишения свободы грозит псковичкам которые изнасиловали подругу,2018-10-23 16:57:04,1205247,[]
2637,долгая дорога в моглино,2018-10-23 16:38:11,1205247,[]
2638,когда лучше тренироваться утром или вечером,2018-10-23 16:21:34,1205247,[]
2639,ппц,2018-10-23 16:07:19,1205247,[]
2640,более полусотни вакансий открыты на псковской таможне,2018-10-23 15:56:04,1205247,[]
2641,судьба моглино покрылась черным цветом ульяна михайлова,2018-10-23 15:35:19,1205247,[]
2642,на авиарейсе псков москва изменилось расписание,2018-10-23 15:04:12,1205247,[]
2643,пустующее здание транснефти в великих луках отдадут под детский технопарк кванториум,2018-10-23 14:58:06,1205247,[]
2644,понижающие коэффициенты на патенты для ип реальная мера или профанация,2018-10-23 14:24:32,1205247,[]
2645,,2018-10-23 14:16:00,1205247,
2646,около предпринимателей которые незаконно работали в школах и детсадах вывели на чистую воду власти пскова,2018-10-23 13:36:28,1205247,[]
2647,октября виа поющие гитары выступит в псковской областной филармонии,2018-10-23 13:29:14,1205247,[]
2648,добровольцы вперед,2018-10-23 12:46:08,1205247,[]
2649,ээхх разгуляй устраивает радио шансон ноября,2018-10-23 12:44:43,1205247,[]
2650,,2018-10-23 12:06:39,1205247,
2651,перекресток улиц карла маркса кузнецкой и плехановский посад так и остается проблемным видео,2018-10-23 11:44:33,1205247,[]
2652,,2018-10-23 11:25:20,1205247,
2653,исполнительные органы госвласти псковской области предлагается переименовать,2018-10-23 11:12:38,1205247,[]
2654,сидишь без работы она у нас есть,2018-10-23 10:32:57,1205247,[]
2655,подготовить автомобиль к зиме всего за тысячу рублей предлагают псковичам,2018-10-23 10:03:15,1205247,[]
2656,псковички изнасиловавшие подругу обиделись на нее за выбор другой компании,2018-10-23 09:40:59,1205247,[]
2657,,2018-10-23 09:40:14,1205247,
2658,в первом в пскове клубном доме завершается монтаж коробки,2018-10-23 09:22:34,1205247,[]
2659,мобильная приемная прокурора области будет работать завтра в себеже,2018-10-23 09:07:00,1205247,[]
2660,псковские пограничники пресекли попытку незаконного ввоза из беларуси партии лома черного и цветного металла,2018-10-23 09:01:53,1205247,[]
2661,женщину сбили на зебре у дома детского творчества в пскове,2018-10-23 09:01:47,1205247,[]
2662,уголовную ответственность за побег с места дтп введут в рф,2018-10-23 09:01:46,1205247,[]
2663,россиянам напомнили о длинных выходных в ноябре,2018-10-23 08:11:42,1205247,[]
2664,в печерском монастыре почтили память архимандрита тихона секретарева,2018-10-22 22:05:34,1205247,[]
2665,псковская область вошла в число регионов с самыми низкими ценами на дачи,2018-10-22 21:35:24,1205247,[]
2666,псковгу приглашает старшеклассников на открытый урок по английскому языку,2018-10-22 21:11:29,1205247,[]
2667,фрагмент сосуда с головой турка в медальоне найден на мстиславском раскопе,2018-10-22 21:08:01,1205247,[]
2668,в пскове прошел турнир по стрельбе посвященный й годовщине образования подразделений вневедомственной охраны,2018-10-22 20:51:10,1205247,[]
2669,педагоги островского района рассчитывают на победу в профсоюзном проекте танцетерапия,2018-10-22 20:20:02,1205247,[]
2670,псковгу объявляет набор на программу профпереподготовки переводчик в сфере профессиональной коммуникации,2018-10-22 20:07:47,1205247,[]
2671,члены общественной палаты псковской области и собрания высшего офицерского состава псковской области познакомились с работой псковской таможни,2018-10-22 20:01:57,1205247,[]
2672,общежитие с текущей крышей мусорная площадка вместо гаражей и псковское подмостовье глава пскова совершил выезд на й округ,2018-10-22 19:35:12,1205247,[]
2673,в пскове две подруги задержаны за изнасилование знакомой,2018-10-22 19:03:15,1205247,[]
2674,с октября меняется время заезда в аэропорт автобуса,2018-10-22 18:45:42,1205247,[]
2675,проект многофункциональной спортивной площадки в черехе будет согласован с местными жителями,2018-10-22 18:42:10,1205247,[]
2676,аэропорт сиверский представит долгосрочную программу развития псковавиа,2018-10-22 18:39:44,1205247,[]
2677,участницами конкурса мини мисс могут стать еще юных псковичек,2018-10-22 18:14:39,1205247,[]
2678,победители конкурса открытка из глубинки отправятся на базу отдыха пушкиногорье,2018-10-22 16:59:10,1205247,[]
2679,,2018-10-22 16:52:04,1205247,[]
2680,создать для молодежи псковское подмостовье предложил депутат александр баев,2018-10-22 16:24:45,1205247,[]
2681,в личных подсобных хозяйствах псковского района найдены цисты картофельной нематоды,2018-10-22 15:39:33,1205247,[]
2682,владимир яников призвал областных чиновников системы образования защищать школы а не деньги,2018-10-22 15:23:14,1205247,[]
