0,на бурятию надвигаются градусные морозы,2019-02-02 09:56:18,107493817,[]
1,в бурятии выросли зарплаты но упали доходы жителей,2019-02-02 09:54:06,107493817,[]
2,бурятская семья снялась для первого канала,2019-02-02 07:46:11,107493817,[]
3,на восстановление водоснабжения в улан удэ выделено млн рублей,2019-02-02 06:55:00,107493817,[]
4,в бурятии пожарные обследовали дацаны и места проведения костров дугжууба,2019-02-02 06:38:37,107493817,[]
5,в центральной россии по требованию жителей снизили цены на топливо,2019-02-02 06:20:00,107493817,[]
6,в бурятии будет создана тор,2019-02-02 06:05:00,107493817,[]
7,в улан удэ маленьким спортсменам приходится ютиться в тесном помещении лыжной базы,2019-02-02 05:45:00,107493817,[]
8,огромные налоги в бюджет и черная энергетика за и против игорной зоны на байкале,2019-02-02 05:25:00,107493817,[]
9,житель бурятии головой разбил зеркало в отделе полиции видео,2019-02-02 05:10:00,107493817,[]
10,появились новые видео с тигром ермаком в улан удэ,2019-02-02 04:50:00,107493817,[]
11,чем займутся в бурятии святой василис и корбобо,2019-02-02 04:28:07,107493817,[]
12,когда в выходной кто то просыпается раньше тебя и не дает спать,2019-02-02 03:45:00,107493817,[]
13,доброе утро любимый город,2019-02-02 03:10:00,107493817,[]
14,зурхай на февраля й лунный день,2019-02-02 02:45:00,107493817,[]
15,спокойной ночи пусть ночь будет наполнена уютом и покоем а утро принесет светлую радость,2019-02-01 17:00:01,107493817,[]
16,температура ночью в улан удэ опустится до,2019-02-01 16:45:00,107493817,[]
17,не знаете как ответить на вопросы детей о работе внутренних органов человека а может ваш ребенок мечтает стать врачом и вы уже сбились со счета от его почему тогда советуем посетить выставку внутри человека в гаук рб национальный музей республики бурятия на куйбышева тел,2019-02-01 15:30:00,107493817,[]
18,что интересного и необычного посетить в городе в этом месяце,2019-02-01 14:30:00,107493817,[]
19,в улан удэ из за коммунальной аварии введен режим чс,2019-02-01 13:40:00,107493817,[]
20,в улан удэ приедет алла михеева из вечернего урганта,2019-02-01 13:20:00,107493817,[]
21,сестры крепыши ждут своих мам пап если вы ищите надежного охранника для дома то они те кого вы искали осталось две сестры белка и стрелка белка идеальная охранница и компаньон сообразительная скромная проявляет охранные качества стрелка верная более привязанее к людям возраст собачек около мес они еще будут расти здоровы стерилизованы по росту выше колена в холке звоните и приезжайте знакомиться без собаки вы от нас не уедете,2019-02-01 13:03:15,107493817,[]
22,в россии отменят плату за вывоз сухого мусора,2019-02-01 12:45:00,107493817,[]
23,в бурятском отделении сбербанка ожидаются кадровые изменения,2019-02-01 12:30:03,107493817,[]
24,в бурятии пьяный мужчина кусал сотрудников дпс видео,2019-02-01 12:29:14,107493817,[]
25,может обратимся к дядюшке баиру,2019-02-01 12:00:16,107493817,[]
26,масштабы коммунальной аварии в улан удэ растут с каждым часом,2019-02-01 11:45:00,107493817,[]
27,жителей бурятии рассмешила покупка снега к сагаалгану,2019-02-01 11:30:11,107493817,[]
28,детский омбудсмен бурятии поделилась редкими фото из молодости,2019-02-01 10:40:00,107493817,[]
29,ламы бурятии озвучили астрологический прогноз на год,2019-02-01 10:21:52,107493817,[]
30,в улан удэ более многоквартирных домов осталось без горячей воды,2019-02-01 10:20:09,107493817,[]
31,в улан удэ произошла крупная коммунальная авария,2019-02-01 08:46:07,107493817,[]
32,бурятские лучники с пода завоевали три медали кубка россии,2019-02-01 07:10:00,107493817,[]
33,в улан удэ на сагаалган разыграют бытовую технику,2019-02-01 06:50:00,107493817,[]
34,теннисистка дари саханова дебютирует на турнире в америке,2019-02-01 06:32:44,107493817,[]
35,юрий трутнев посетил в бурятии нефритовое производство,2019-02-01 06:27:42,107493817,[]
36,завтра в бурятии резко похолодает,2019-02-01 05:53:39,107493817,[]
37,немного расстроилась детям из бурятии не удалось выиграть миллион,2019-02-01 05:35:12,107493817,[]
38,автомобили мэрии улан удэ обслужили сотни вызовов врачей на дом,2019-02-01 04:35:00,107493817,[]
39,в школах улан удэ продлили карантин,2019-02-01 04:20:00,107493817,[]
40,в бурятии учителя устали жить в нищете и прислуживать депутатам,2019-02-01 04:00:02,107493817,[]
41,с добрым утром друзья,2019-02-01 03:10:00,107493817,[]
42,зурхай на февраля й лунный день,2019-02-01 02:45:00,107493817,[]
43,спокойной ночи друзья,2019-01-31 17:00:02,107493817,[]
44,февраля в улан удэ утром и днем небольшой снег,2019-01-31 16:37:00,107493817,[]
45,свыше тысяч улан удэнцев за январь болели орви и гриппом,2019-01-31 16:21:00,107493817,[]
46,улан удэнка шесть лет живет в квартире без отопления,2019-01-31 16:05:10,107493817,[]
47,чиновники правительства бурятии подставили алексея цыденова,2019-01-31 15:48:00,107493817,[]
48,в развитие улан удэ планируют вложить более миллиардов,2019-01-31 15:30:03,107493817,[]
49,улан удэнский силач выпустил видео где бьет очередные рекорды,2019-01-31 15:15:01,107493817,[]
50,обычное явление максим отреагировал на забастовку таксистов в улан удэ,2019-01-31 14:58:12,107493817,[]
51,улан удэнским школьникам не станут продлевать внеплановые каникулы,2019-01-31 14:57:23,107493817,[]
52,к главе бурятии приставят росгвардию,2019-01-31 12:26:35,107493817,[]
53,нам нужен руководитель без лишних политических амбиций михаил гергенов рассказал каким должен быть мэр улан удэ,2019-01-31 11:42:00,107493817,[]
54,мошенники добрались до клиентов сбербанка,2019-01-31 11:25:00,107493817,[]
55,ученые бурятии разработали в японии инновации для сельского хозяйства,2019-01-31 11:08:02,107493817,[]
56,в бурятии к сагаалгану ламы освятили белую пищу,2019-01-31 10:51:00,107493817,[]
57,жителей улан удэ приглашают на ярмарку белый месяц,2019-01-31 10:34:00,107493817,[]
58,ежемесячную денежную выплату проиндексируют на с февраля,2019-01-31 10:17:00,107493817,[]
59,покалечившие детей в бурятии здания минобороны не торопятся сносить,2019-01-31 10:00:17,107493817,[]
60,иван ургант пошутил про инцидент с противогазами в бурятии,2019-01-31 09:44:38,107493817,[]
61,фильм о походе на коньках по льду байкала величайшего озера на нашей планете,2019-01-31 09:27:01,107493817,[]
62,сотниково суд на стороне сирот,2019-01-31 08:40:00,107493817,[]
63,сагаалган с бадма хандой,2019-01-31 08:21:00,107493817,[]
64,жители иволги бьются за право выбирать главу района,2019-01-31 08:16:05,107493817,[]
65,уроженец бурятии претендует на звание самого красивого в мире,2019-01-31 07:55:00,107493817,[]
66,врачи сказали никакого спорта но без него я не был собой,2019-01-31 07:40:00,107493817,[]
67,в бурятии разворачивается битва за столицу республики,2019-01-31 07:25:00,107493817,[]
68,в бурятии ударят градусные морозы,2019-01-31 07:06:31,107493817,[]
69,праздник буузы в бурятии вошел в топ гастрособытий февраля,2019-01-31 06:45:00,107493817,[]
70,в улан удэ бизнесмен открыл спортклуб за миллионов,2019-01-31 06:30:01,107493817,[]
71,этих событий могло не быть детский омбудсмен из бурятии раскрыла подробности громкого скандала в улан удэнской школе,2019-01-31 06:14:46,107493817,[]
72,бурятия получила еще машин скорой помощи,2019-01-31 05:21:00,107493817,[]
73,в пригороде улан удэ насмерть сбили пешехода,2019-01-31 05:04:00,107493817,[]
74,мнение вполне возможно будет такая же история как и всегда нас опять лишат выборов,2019-01-31 04:47:00,107493817,[]
75,бест плюс могут призвать к ответу за смерть летнего парня,2019-01-31 04:30:00,107493817,[]
76,в бурятии супружеская пара отметила золотой юбилей,2019-01-31 04:12:00,107493817,[]
77,в бурятии предложили построить мини заводы по переработке мусора,2019-01-31 03:54:29,107493817,[]
78,с добрым утром город,2019-01-31 03:10:00,107493817,[]
79,зурхай на января й лунный день,2019-01-31 02:45:00,107493817,[]
80,спокойной ночи любимый улан удэ,2019-01-30 17:00:02,107493817,[]
81,супермаркеты обяжут разделять на полках молочные и псевдомолочные продукты,2019-01-30 16:40:04,107493817,[]
82,в улан удэ продлили внеплановые школьные каникулы до февраля,2019-01-30 16:29:00,107493817,[]
83,в разгар эпидемии гриппа в бурятии активизировались антипрививочники,2019-01-30 16:10:00,107493817,[]
84,куда сходить в будни в улан удэ на выставку ван гога,2019-01-30 14:30:00,107493817,[]
85,в промпарке бурятии в году запустят семь новых производств,2019-01-30 14:25:00,107493817,[]
86,десятки семей пострадавшие в страшном пожаре в квартале в улан удэ вынуждены искать временное жилье,2019-01-30 14:10:00,107493817,[]
87,января по бурятии местами слабые метели,2019-01-30 13:56:00,107493817,[]
88,за какую рекламу улан удэнцы могут получить штраф,2019-01-30 13:39:00,107493817,[]
89,отделившаяся от сибири бурятия будет торговать лесом на бирже,2019-01-30 13:22:00,107493817,[]
90,красота зимнего байкала впечатляет,2019-01-30 13:05:09,107493817,[]
91,девушка из бурятии лидирует в конкурсе краса сибирской росгвардии,2019-01-30 12:49:44,107493817,[]
92,более предложений от жителей бурятии поступило в программу развития дальнего востока,2019-01-30 12:30:03,107493817,[]
93,будет жарко николай будуев анонсировал встречу со звездами бурятской теплоэнергетики,2019-01-30 12:13:24,107493817,[]
94,улан удэ может получить в дар от москвы старые трамваи,2019-01-30 11:34:00,107493817,[]
95,известный невролог из москвы провела в бурятии консультации для родителей особенных детей,2019-01-30 11:17:00,107493817,[]
96,в бурятии девочка получила травму в школе,2019-01-30 11:00:12,107493817,[]
97,силач из улан удэ метит в книгу рекордов гиннеса и меняет мир вокруг себя,2019-01-30 10:42:00,107493817,[]
98,в дацане амарлин обсудили создание первой детской летней школы боевых искусств,2019-01-30 10:26:00,107493817,[]
99,в бурятии вновь взялись за опасное фенольное озеро,2019-01-30 10:12:00,107493817,[]
100,всем здравствуйте,2019-01-30 10:07:29,107493817,[]
101,кедровый орех становится невозобновляемым ресурсом,2019-01-30 09:46:00,107493817,[]
102,звезда полицейского с рублевки станцевала на льду байкала,2019-01-30 09:29:00,107493817,[]
103,глава бурятии вручил сертификат на жилье светлане пежемской спасшей на пожаре человек,2019-01-30 09:12:00,107493817,[]
104,в бурятии торги на ремонт правительственных машин признали недействительными,2019-01-30 08:55:00,107493817,[]
105,отставка мэра улан удэ возможно произойдет уже в марте,2019-01-30 08:39:00,107493817,[]
106,человек с трудной судьбой,2019-01-30 08:22:00,107493817,[]
107,на скандал с противогазами в улан удэ отреагировала детский омбудсмен россии,2019-01-30 08:05:07,107493817,[]
108,гигантская свинья начала проявляться с столице бурятии,2019-01-30 07:46:55,107493817,[]
109,баир дышенов мы должны договориться и найти общий язык,2019-01-30 07:39:00,107493817,[]
110,полицейские на байкале спасли замерзающую косулю,2019-01-30 07:22:00,107493817,[]
111,замминистра строительства бурятии проведет в сизо еще три месяца,2019-01-30 07:05:00,107493817,[]
112,в бурятии пенсионерка с сыновьями инвалидами замерзает в доме который ей построил депутат,2019-01-30 06:48:54,107493817,[]
113,я байкал,2019-01-30 06:30:01,107493817,[]
114,программа сагаалгана,2019-01-30 06:14:00,107493817,[]
115,молодых семей получат сертификаты на жилье в году,2019-01-30 05:54:51,107493817,[]
116,дапп монды временно закрывается на три дня,2019-01-30 05:41:46,107493817,[]
117,кандидаты на пост мэра улан удэ множатся на глазах,2019-01-30 04:12:19,107493817,[]
118,правительство рф выделяет бурятии млрд рублей на приобретение зданий детсадов,2019-01-30 03:36:43,107493817,[]
119,с добрым утром любимый город,2019-01-30 03:10:00,107493817,[]
120,зурхай на января й лунный день,2019-01-30 02:45:00,107493817,[]
121,спокойной ночи пусть ночь будет наполнена уютом и покоем а утро принесет светлую радость,2019-01-29 17:00:10,107493817,[]
122,когда у родного тебе человека что то болит лучше бы болело у тебя,2019-01-29 16:30:03,107493817,[]
123,в улан удэ родителей штрафуют за ненадлежащее исполнение родительских обязанностей,2019-01-29 16:05:13,107493817,[]
124,в дар чудесные щенки,2019-01-29 15:56:44,107493817,[]
125,кто ответственен в улан удэ за опасные сосульки с крыш,2019-01-29 15:47:00,107493817,[]
126,служба крови бурятии начала выездные дни донора,2019-01-29 15:30:02,107493817,[]
127,января по бурятии местами снег,2019-01-29 15:13:00,107493817,[]
128,тысяч ягнят в бурятии раздадут бесплатно в году,2019-01-29 14:56:00,107493817,[]
129,в иркутске вышли из зимней спячки сурки ехор и матильда,2019-01-29 14:39:00,107493817,[]
130,преподаватель хороший раньше таких методов себе не позволял,2019-01-29 14:21:09,107493817,[]
131,мы плакали и смеялись и все это от души фоторепортаж,2019-01-29 14:19:13,107493817,[]
132,стратегия пекина на федеральном канале рассказали о сибирском бунте против китая,2019-01-29 13:15:01,107493817,[]
133,у экс солиста иванушек олега яковлева нашелся приемный сын бурят,2019-01-29 13:00:14,107493817,[]
134,баунтовские врачи спасли жизнь роженице,2019-01-29 12:49:50,107493817,[]
135,скандал с противогазами в улан удэнской школе дошел до следственного комитета,2019-01-29 11:50:00,107493817,[]
136,кто может получать пособие по безработице,2019-01-29 11:34:00,107493817,[]
137,дамба аюшеев рассказал каким будет год желтой земляной свиньи,2019-01-29 11:16:00,107493817,[]
138,стали изменять мужьям тогда когда в отношениях произошел надлом,2019-01-29 10:56:19,107493817,[]
139,в бурятии обнаружили собаку с бешенством,2019-01-29 10:39:00,107493817,[]
140,в улан удэ из банка эвакуировали людей,2019-01-29 10:20:35,107493817,[]
141,два жителя бурятии напали на геологов угрожая железной трубой и блатными связями,2019-01-29 10:18:19,107493817,[]
142,сагаалган в улан удэ отметят с размахом,2019-01-29 09:30:04,107493817,[]
143,лыжники бурятии вошли в число лучших на чемпионате сибири и дальнего востока,2019-01-29 09:16:55,107493817,[]
144,лыжня россии пройдет в бурятии,2019-01-29 08:52:00,107493817,[]
145,из за вспышки гриппа улан удэнским школьникам продлили внеплановые каникулы,2019-01-29 08:34:00,107493817,[]
146,юмористы из бурятии готовятся штурмовать сразу две ведущих лиги квн,2019-01-29 08:17:00,107493817,[]
147,глава бурятии не вошел в новый состав госсовета россии,2019-01-29 08:00:11,107493817,[]
148,дзюдоистов бурятии отправятся на первенство дфо,2019-01-29 07:42:00,107493817,[]
149,в бурятии семьи с детьми могут воспользоваться льготной ипотекой,2019-01-29 07:25:00,107493817,[]
150,жителей улан удэ взбудоражило сообщение об угоне автомобиля с ребенком,2019-01-29 07:12:59,107493817,[]
151,приятного аппетита и вкусного обеда друзья,2019-01-29 07:08:00,107493817,[]
152,московские предприниматели из бурятии объединились в клуб,2019-01-29 06:52:00,107493817,[]
153,в улан удэ назвали причину крупного пожара на жердева,2019-01-29 06:34:00,107493817,[]
154,в улан удэ уничтожили кг литовских груш и яблок,2019-01-29 06:17:00,107493817,[]
155,завтра в бурятии завоют сирены,2019-01-29 06:00:05,107493817,[]
156,цампа пища наших предков,2019-01-29 05:42:00,107493817,[]
157,у здания народного хурала таксист устроил одиночный пикет,2019-01-29 05:25:00,107493817,[]
158,жители бурятии об очередном дтп в вахмистрово пора тросы убирать,2019-01-29 05:08:00,107493817,[]
159,бурятия находится на пике подъема заболеваемости орви и гриппом,2019-01-29 04:51:00,107493817,[]
160,наказанные улан удэнские школьники весь урок просидели в противогазах,2019-01-29 04:34:00,107493817,[]
161,стали известны места ловли омуля на байкале,2019-01-29 04:17:00,107493817,[]
162,бурятская танцовщица в японии съездила к псу хатико,2019-01-29 04:00:02,107493817,[]
163,с добрым утром друзья,2019-01-29 03:10:00,107493817,[]
164,зурхай на января й лунный день,2019-01-29 02:45:00,107493817,[]
165,спокойной ночи друзья,2019-01-28 17:00:16,107493817,[]
166,пойдем пообщаемся бурнет шокировали разборки между маленькими и большими улан удэнцами,2019-01-28 16:45:00,107493817,[]
167,на выставки с детьми можно и даже нужно ходить,2019-01-28 15:30:00,107493817,[]
168,меньше месяца осталось до закрытия мультимедийной выставки выставка ван гог оживающие полотна в гаук рб национальный музей республики бурятия по адресу улан удэ ул куйбышева категория тел,2019-01-28 14:30:00,107493817,[]
169,в улан удэ потушили пожар в доме на жердева,2019-01-28 14:14:37,107493817,[]
170,января по бурятии местами умеренный снег,2019-01-28 14:00:17,107493817,[]
171,байкал вошел в топ популярных для отдыха озер россии,2019-01-28 13:50:20,107493817,[]
172,в улан удэ сняли молодежный клип к сагаалгану,2019-01-28 12:50:00,107493817,[]
173,бурятия готовится к чемпионату россии по тхэквондо,2019-01-28 12:35:00,107493817,[]
174,в улан удэ водитель сбил ребенка на зебре и скрылся с места дтп,2019-01-28 12:20:00,107493817,[]
175,на крупном пожаре в улан удэ обгорела женщина,2019-01-28 12:03:19,107493817,[]
176,на ярыгинском турнире бурятские борицы выступали друг против друга,2019-01-28 10:17:00,107493817,[]
177,в улан удэ застопорилась сделка по продаже бурятмяспрома,2019-01-28 10:00:30,107493817,[]
178,чего ждать на рынке недвижимости бурятии в году,2019-01-28 09:17:28,107493817,[]
