1240,псковский роспотребнадзор опубликовал рекомендации по выбору качественных рыбных консервов,2018-12-12 22:30:58,1205247,[]
1241,начался прием заявок на участие в молодежном поэтическом фестивале зеленое яблоко,2018-12-12 21:01:19,1205247,[]
1242,грабитель избил поленом печорскую пенсионерку требуя денег,2018-12-12 20:29:20,1205247,[]
1243,выставка члена ассоциации русских художников парижа владимира баженова откроется в псковской галерее дар,2018-12-12 20:23:08,1205247,[]
1244,среди пассажиров микроавтобуса попавшего в дтп в пушкиногорском районе были граждане китая и эстонии,2018-12-12 20:22:59,1205247,[]
1245,нужно ли нестись в погоне за банковской ипотекой,2018-12-12 20:10:01,1205247,[]
1246,до градусов похолодает в псковской области в четверг,2018-12-12 18:18:44,1205247,[]
1247,силами мчс организована транспортировка на лечение в петербург четверых пострадавших в дтп в пушкиногорском районе фото,2018-12-12 17:50:54,1205247,[]
1248,пик приглашает на новогоднюю ярмарку подарков ручной работы,2018-12-12 17:46:27,1205247,[]
1249,в острове идут поиски настоящего родового гнезда рериха,2018-12-12 17:08:01,1205247,[]
1250,пассажирам пострадавшим в дтп в пушкиногорском районе положены страховые выплаты до млн рублей,2018-12-12 17:02:58,1205247,[]
1251,псковичи могут купить до конца декабря с двойной выгодой,2018-12-12 16:49:43,1205247,[]
1252,гибридная цензура,2018-12-12 16:43:00,1205247,[]
1253,в псковской области открылись две структуры для молодых политологов,2018-12-12 15:48:05,1205247,[]
1254,временные фрагменты ограждения советского моста в пскове заменят на кованые к ганзе,2018-12-12 15:47:45,1205247,[]
1255,,2018-12-12 15:46:58,1205247,
1256,в госдуму внесли законопроекты о штрафах за фейковые новости,2018-12-12 15:31:28,1205247,[]
1257,интерактив якобы полицейские звонят ночью и предостерегают от мошенничества,2018-12-12 15:11:13,1205247,[]
1258,под матрасом пытался провезти мачете следовавший из эстонии водитель,2018-12-12 14:28:36,1205247,[]
1259,пожарные и инспекторы гибдд проверили в пскове возможность подъезда к многоквартирным домам,2018-12-12 14:20:56,1205247,[]
1260,фотофакт на советском мосту восстановили фрагменты поврежденного пешеходного ограждения,2018-12-12 14:09:28,1205247,[]
1261,псковичей приглашают спастись от праздничной суеты в романтике холмов и долин южной эстонии,2018-12-12 13:57:05,1205247,[]
1262,задержан еще один участник нападения на псковских десантников,2018-12-12 13:48:13,1205247,[]
1263,в дно мужчина зарубил топором пенсионерку которая застала его за кражей,2018-12-12 13:48:07,1205247,[]
1264,продолжается поиск свидетелей дтп в куньинском районе где погиб водитель автобуса,2018-12-12 13:08:33,1205247,[]
1265,в великих луках декабря прошло посвящение в кадеты,2018-12-12 12:53:35,1205247,[]
1266,охотник плюс все что нужно настоящему мужчине,2018-12-12 12:41:21,1205247,[]
1267,вертолет доставит в петербург четверых пострадавших в автоаварии с микроавтобусом в пушкиногорском районе,2018-12-12 12:06:09,1205247,[]
1268,сургутнефтегазбанк продлил срок действия потребительского кредита акционный,2018-12-12 12:01:33,1205247,[]
1269,год театра торжественно откроют в пскове декабря,2018-12-12 11:25:50,1205247,[]
1270,власти пскова для каждого россиянина конституция стала гарантом прав и свобод,2018-12-12 11:22:29,1205247,[]
1271,гдовский музей удастся капитально отремонтировать в рамках грантовой поддержки,2018-12-12 11:09:03,1205247,[]
1272,,2018-12-12 10:52:48,1205247,
1273,в опочке будут судить молодого человека который из за воспоминаний об умершей сожительнице сжег квартиру,2018-12-12 10:43:18,1205247,[]
1274,прокуратура взяла под контроль ход расследования дела по факту наезда пьяного водителя на детей в опочке,2018-12-12 10:33:31,1205247,[]
1275,звук создан богом интересных фактов о произведениях которые будут звучать декабря и их авторах,2018-12-12 10:26:31,1205247,[]
1276,александр котов основываясь на духе и букве конституции мы будем двигаться вперед,2018-12-12 10:13:04,1205247,[]
1277,в радиокоманду медиахолдинга гражданская пресса требуется трафик менеджер грамотный ответственный коммуникабельный,2018-12-12 10:11:00,1205247,[]
1278,праздник русских каш соберет жителей псковской области в порхове января,2018-12-12 10:07:01,1205247,[]
1279,человек пострадали в дтп в пушкиногорском района из них студенты,2018-12-12 09:44:31,1205247,[]
1280,короткое замыкание стало причиной пожара в доме на улице белинского в пскове,2018-12-12 08:54:41,1205247,[]
1281,коммунист михайлов вернется в областное собрание депутатов,2018-12-12 08:23:59,1205247,[]
1282,сотрудников мчс и единиц техники были задействованы при тушении пожара на улице белинского в пскове,2018-12-12 00:38:43,1205247,[]
1283,власти псковской области оказывают пострадавшим в дтп в пушкиногорском районе всю необходимую помощь,2018-12-12 00:26:56,1205247,[]
1284,контракт по реконструкции стадиона машиностроитель будет заключен со стройтрансгазом,2018-12-11 23:29:15,1205247,[]
1285,под домашний арест посадили псковичку подозреваемую в продаже младенца,2018-12-11 23:26:15,1205247,[]
1286,водитель экскурсионного микроавтобуса не справился с управлением в пушкиногорском районе пострадали человек фото,2018-12-11 23:17:25,1205247,[]
1287,сбербанк может сменить название герман греф,2018-12-11 17:27:16,1205247,[]
1288,в радиокоманду медиахолдинга гражданская пресса требуется трафик менеджер грамотный ответственный коммуникабельный,2018-12-11 16:12:15,1205247,[]
1289,конституционный держите шаг,2018-12-11 15:36:50,1205247,[]
1290,голосуем за псковичей,2018-12-11 15:19:37,1205247,[]
1291,под видом дров псковичи пытались вывезти в евросоюз вьетнамцев,2018-12-11 15:11:21,1205247,[]
1292,более тысяч школьников псковской области прошли социально психологическое тестирование,2018-12-11 14:44:27,1205247,[]
1293,,2018-12-11 13:46:33,1205247,
1294,соловьи выпустили тушенку в новой упаковке,2018-12-11 13:05:54,1205247,[]
1295,сотрудников росгвардии и военнослужащих добившихся успехов в оперативно служебной деятельности чествовали в пскове,2018-12-11 12:09:11,1205247,[]
1296,мтс поможет псковским старшеклассникам подготовиться к егэ,2018-12-11 11:47:55,1205247,[]
1297,в эльва моторс можно протестировать автомобиль оперативно и по доступной цене,2018-12-11 11:21:05,1205247,[]
1298,двое школьников пострадавших в дтп на автобусной остановке в опочке переведены на амбулаторное лечение третья девочка пока находится без сознания,2018-12-11 10:36:56,1205247,[]
1299,три агентства недвижимости в пскове предоставляли клиентам займы не имея на то права,2018-12-11 10:09:02,1205247,[]
1300,псковгу представляет новую программу переподготовки государственное и муниципальное управление,2018-12-11 09:49:55,1205247,[]
1301,выставка жесть от шарипова и цветочки от жбанова открывается в пскове декабря,2018-12-11 09:31:08,1205247,[]
1302,ночью неизвестные подожгли хендай на улице бастионной в пскове,2018-12-11 08:56:28,1205247,[]
1303,псковский роспотребнадзор опубликовал рекомендации по выбору сладких новогодних подарков,2018-12-11 08:48:50,1205247,[]
1304,жителей россии могут обязать установить умные счетчики на газ подключение обойдется в миллиардов,2018-12-11 08:48:45,1205247,[]
1305,в пскове прошли региональные соревнования по рукопашному бою,2018-12-10 21:30:49,1205247,[]
1306,более участников собрал в олимпе фестиваль единоборств,2018-12-10 19:35:37,1205247,[]
1307,как стать обладателем собственного жилья не переплачивая банковскую ипотеку,2018-12-10 19:10:00,1205247,[]
1308,на улице кузнецкой в пскове сбит пешеход,2018-12-10 18:40:27,1205247,[]
1309,в пскове впервые пройдут региональные чемпионат и первенство по мма,2018-12-10 18:32:38,1205247,[]
1310,,2018-12-10 18:29:43,1205247,
1311,в пскове осудили капитана катера талабск за перевозку пассажиров вместо и без спасательных средств,2018-12-10 18:12:24,1205247,[]
1312,дождутся ли псковичи вытрезвителя,2018-12-10 17:46:47,1205247,[]
1313,закон об официальных символах псковской области внесен в областное собрание депутатов,2018-12-10 17:39:17,1205247,[]
1314,в лесах псковской области в году ожидается выявление новых очагов болезней,2018-12-10 17:25:17,1205247,[]
1315,псковские полицейские разоблачили преступную группу сбывавшую наркотики через интернет магазин,2018-12-10 17:04:45,1205247,[]
1316,любого ничего ему не объясняя можно посадить в тюрьму лет на десять,2018-12-10 16:51:48,1205247,[]
1317,профком псковпассажиравтотранса принял решение провести митинг в защиту предприятия,2018-12-10 16:18:49,1205247,[]
1318,пачек сигарет были спрятаны в матрасах и в туалете поезда москва рига,2018-12-10 16:04:12,1205247,[]
1319,утверждена программа празднования в пскове нового года и рождества,2018-12-10 15:30:57,1205247,[]
1320,декабря в пскове официально откроется кванториум,2018-12-10 14:59:59,1205247,[]
1321,волшебный зверинец,2018-12-10 14:47:50,1205247,[]
1322,михаил ведерникова подписал распоряжение об обеспечении дополнительных мер безопасности в новогодние и рождественские праздники,2018-12-10 13:47:13,1205247,[]
1323,ангелина семенова признана голосом пскова,2018-12-10 13:19:38,1205247,[]
1324,на псковичку продавшую новорожденную девочку женщине из вологды завели уголовное дело,2018-12-10 12:28:48,1205247,[]
1325,темный рейс,2018-12-10 12:14:42,1205247,[]
1326,объявлен победитель розыгрыша билетов от плн на концерт старые новые песни,2018-12-10 12:10:21,1205247,[]
1327,,2018-12-10 12:00:14,1205247,
1328,псковгу приглашает на программу переподготовки в сфере государственного и муниципального управления,2018-12-10 11:55:16,1205247,[]
1329,,2018-12-10 11:02:04,1205247,
1330,в галерее цех откроется выставка театр из чемодана,2018-12-10 10:56:29,1205247,[]
1331,завершено строительство последнего кирпичного дома жк пятый элемент на запсковье,2018-12-10 10:46:09,1205247,[]
1332,четыре медали первенства сзфо завоевали юные псковские шахматисты,2018-12-10 10:22:23,1205247,[]
1333,,2018-12-10 10:02:46,1205247,
1334,псковичей приглашают на белоснежный бал иоганна штрауса,2018-12-10 10:01:21,1205247,[]
1335,группа кипелов выступила в пскове с новым альбомом звезды и кресты фото,2018-12-10 09:59:47,1205247,[]
1336,автобус опрокинулся в кювет на дороге неелово кудрина гора печоры,2018-12-10 09:35:58,1205247,[]
1337,к новому году ассортимент фирменных магазинов соловьи пополнился аппетитными новинками,2018-12-10 09:10:13,1205247,[]
1338,псковский боксер валерий брудов проиграл бельгийцу джоэлу тамбвэ джеко,2018-12-10 09:01:49,1205247,[]
1339,мерседес подожгли неизвестные злоумышленники на улице инженерной в пскове,2018-12-10 08:57:23,1205247,[]
1340,бюст героя советского союза петра шлюйкова установлен в его родной великолукской деревне,2018-12-10 08:32:14,1205247,[]
1341,в любой стране которая активно развивает опк и создает новые технологии есть отдельный финансовый институт,2018-12-10 08:10:12,1205247,[]
1342,псков занял общекомандное место в пробеге тишино остров,2018-12-09 21:29:07,1205247,[]
1343,в псковской области продолжают искать мужчину с двумя ожогами на груди,2018-12-09 15:15:36,1205247,[]
1344,пскович игорь кисарин уже год работает над созданием механического устройства для скашивания жесткой водной растительности есть чертеж есть видение как все это должно быть но не хватает денег для реализации задуманного молодой человек объявил сбор средств на реализацию проекта на краудфандинговой платформе поддержим земляка,2018-12-09 14:36:37,1205247,[]
1345,концерт юные дарования псковщины состоялся в бкз фото,2018-12-09 14:26:56,1205247,[]
1346,в пскове прошел митинг посвященный дню героев россии,2018-12-09 14:15:28,1205247,[]
1347,на свалку мусора у загса жалуется псковичка,2018-12-09 13:15:29,1205247,[]
1348,псковичам напоминают об изменениях в пдд,2018-12-09 13:15:21,1205247,[]
1349,опубликовано расписание занятости ледовой арены пскова на следующей неделе,2018-12-09 13:15:15,1205247,[]
1350,подготовительное отделение псковского государственного университета приглашает на индивидуальные занятия по подготовке к егэ,2018-12-09 12:32:01,1205247,[]
1351,игры и конкурсы ждут гостей праздника зажжения огней на новогодней елке в пскове,2018-12-09 12:26:09,1205247,[]
1352,интерактив бывший зять угрожает расправой полиция бездействует,2018-12-09 10:50:23,1205247,[]
1353,в овсищах откроется магазин соловьи,2018-12-09 09:17:42,1205247,[]
1354,день героев отечества отмечают в псковской области,2018-12-09 09:15:15,1205247,[]
1355,,2018-12-07 17:40:36,1205247,
1356,фотофакт дыра в полу псковского автобуса,2018-12-07 16:51:49,1205247,[]
1357,элитный дом на пароменской в пскове сдан в эксплуатацию,2018-12-07 15:13:32,1205247,[]
1358,экономический форум опера мариинки и кинофестиваль опубликована предварительная программа ганзы в пскове,2018-12-07 15:00:24,1205247,[]
1359,новые объекты социальной инфраструктуры в псковской области инфографика,2018-12-07 14:54:40,1205247,[]
1360,в наше время очень важно не быть черствым николай хондзинский об идее декабрьского концерта звук создан богом,2018-12-07 14:42:32,1205247,[]
1361,николай баринов вступил в должность начальника угх пскова,2018-12-07 14:35:54,1205247,[]
1362,спасатели проверили толщину льда на реке великой и в псковском озере,2018-12-07 14:23:20,1205247,[]
1363,в пскове стартуют продажи квартир в жк новые афины,2018-12-07 14:08:12,1205247,[]
1364,временные посты по предупреждению рыбаков будут организованы в псковском районе,2018-12-07 13:01:23,1205247,[]
1365,билеты на концерт юные дарования псковщины еще есть в продаже,2018-12-07 12:32:57,1205247,[]
1366,константина вилкова обязали заплатить тик опочецкого района тыс рублей в качестве компенсации судебных расходов,2018-12-07 12:28:21,1205247,[]
1367,узнать александра братчикова с другой стороны смогут сегодня слушатели радио эхо москвы в пскове,2018-12-07 12:08:52,1205247,[]
1368,псковским работодателям напоминают что график отпусков должен быть составлен за две недели до наступления года,2018-12-07 11:28:46,1205247,[]
1369,псковский депутат алексей федоров предлагает законодательно запретить выгул лошадей в парках и скверах,2018-12-07 11:27:38,1205247,[]
1370,в себежском районе выявлен новый очаг бешенства,2018-12-07 10:27:36,1205247,[]
1371,предновогодние скидки на сухую доску и евровагонку объявило псковское деревообрабатывающее предприятие,2018-12-07 10:14:08,1205247,[]
1372,пройти диспансеризацию можно будет на следующей неделе в мобильном фапе на запсковье,2018-12-07 10:10:02,1205247,[]
1373,подготовительное отделение псковгу приглашает на индивидуальные занятия по подготовке к егэ,2018-12-07 09:59:36,1205247,[]
1374,акцию салон красоты проводят в декабре тайные покупатели компании,2018-12-07 09:32:38,1205247,[]
1375,пожилые пушкиногорцы в надежде получить компенсацию за лекарства стали жертвой мошенников,2018-12-07 09:30:21,1205247,[]
1376,пропавшего лет назад мужчину ищут в пскове,2018-12-07 09:24:54,1205247,[]
1377,на зебре в центре пскова сбили женщину,2018-12-07 08:50:06,1205247,[]
1378,декабря на телеканале звезда стартует вокальный конкурс новая звезда в котором примет участие великолучанка,2018-12-07 08:49:42,1205247,[]
1379,интерактив так теперь выглядит транспортная доступность,2018-12-07 08:30:25,1205247,[]
1380,меняется режим работы смотровой площадки власьевской башни,2018-12-06 19:41:04,1205247,[]
1381,мандарины шампанское и новая квартира,2018-12-06 19:12:15,1205247,[]
1382,супер фитнес поможет быстро прийти в форму к новому году,2018-12-06 18:44:26,1205247,[]
1383,небольшой снег возможен завтра в псковской области,2018-12-06 18:38:05,1205247,[]
1384,в поисках каменного тура,2018-12-06 17:37:00,1205247,[]
1385,молодежная избирательная комиссия псковской области провела первое заседание,2018-12-06 17:36:55,1205247,[]
1386,товарищ я канта не в силах читать,2018-12-06 16:20:37,1205247,[]
1387,и о директора псковавтодора назначен владимир шаляев,2018-12-06 15:30:03,1205247,[]
1388,бесплатную проверку системы запуска и зарядки автомобиля предлагают псковичам в эльва моторс,2018-12-06 15:06:25,1205247,[]
1389,гимн герб и флаг псковской области единогласно одобрены геральдическим советом,2018-12-06 13:50:31,1205247,[]
1390,новогоднее поролон шоу откроет череду зимних праздников в трк акваполис,2018-12-06 13:02:35,1205247,[]
1391,окончательного решения по поводу цен на проездные в пскове до сих пор не принято,2018-12-06 13:00:51,1205247,[]
1392,исторический парк в пскове может появиться на четырех углах а не на месте снесенного дворца пионеров,2018-12-06 12:25:36,1205247,[]
