774,представители студенческой медиа группы мгту приняли участие в фестивале репост,2017-10-10 15:19:58,42564785,[]
775,правоохранительными органами адыгеи задержан и водворен в изолятор подозреваемый в убийстве местной жительницы,2017-10-09 20:16:45,42564785,[]
776,глава адыгеи провел встречу с президентом союза мма россии федором емельяненко,2017-10-09 15:18:13,42564785,[]
777,чп на канатной дороге в адыгее,2017-10-09 11:17:31,42564785,[]
778,полиция майкопского района просит оказать помощь в розыске водителя совершившего наезд на летнюю велосипедистку,2017-10-07 12:15:37,42564785,[]
779,полицией майкопа задержана подозреваемая в угоне дорогой иномарки,2017-10-06 18:18:12,42564785,[]
780,в майкопе разыграли приз главы адыгеи в конном спорте,2017-10-06 12:14:56,42564785,[]
781,в адыгее прошла церемония гашения почтовой марки из серии герои россии,2017-10-05 20:16:53,42564785,[]
782,адыгею посетили представители адыгской диаспоры,2017-10-05 18:21:43,42564785,[]
783,глава адыгеи поздравил жителей с й годовщиной со дня образования республики,2017-10-04 20:15:03,42564785,[]
784,житель белореченска открыл в адыгее подпольный игровой салон,2017-10-04 18:15:55,42564785,[]
785,в адыгее осудили жителя краснодара укравшего млн рублей,2017-10-04 11:18:18,42564785,[]
786,поиск грибов закончился поиском грибника,2017-10-04 05:15:07,42564785,[]
787,с братским визитом,2017-10-03 19:15:00,42564785,[]
788,приглашение на скачки,2017-10-03 17:17:02,42564785,[]
789,глава адыгеи поздравил работников сферы образования с наступающим профессиональным праздником,2017-10-02 19:16:31,42564785,[]
790,три лучших муниципалитета адыгеи получат гранты,2017-10-02 17:18:51,42564785,[]
791,адыгейский республиканский стадион официально открыт после реконструкции,2017-10-02 11:16:44,42564785,[]
792,трое жителей адыгеи задержаны по подозрению в сбыте фальшивых денег,2017-10-01 00:13:22,42564785,[]
793,мурат кумпилов принял участие в веломарафоне в честь дня республики адыгея,2017-09-30 20:14:05,42564785,[]
794,глава адыгеи поздравил жителей карачаево черкесии с летием республики,2017-09-30 18:14:28,42564785,[]
795,главный госавтоинспектор адыгеи александр курпас поздравил юных пешеходов первоклассников,2017-09-29 20:17:36,42564785,[]
796,студенты мгту провели акцию спасем лес,2017-09-29 18:15:41,42564785,[]
797,в адыгее отмечают день национального костюма,2017-09-28 20:15:56,42564785,[]
798,в адыгее двоих пешеходов сбили на зебре,2017-09-28 13:17:07,42564785,[]
799,верховный суд адыгеи подтвердил приговор вынесенный заместителю начальника больницы для осужденных,2017-09-27 22:17:03,42564785,[]
800,глава адыгеи принял участие в заседании правительственной комиссии по региональному развитию,2017-09-27 18:18:30,42564785,[]
801,в майкопе бывшего полковника полиции приговорили к условному сроку за мошенничество,2017-09-27 13:17:34,42564785,[]
802,пожарные спасатели мчс адыгеи дважды оказывали помощь пострадавшим в дтп,2017-09-27 12:20:35,42564785,[]
803,мурат кумпилов поставил задачи по снижению неформальной занятости населения,2017-09-26 22:12:15,42564785,[]
804,глава адыгеи поздравил с избранием депутатов эдуарда цеева и романа подлегаева,2017-09-26 16:15:19,42564785,[]
805,фгуп почта россии нарушает правила оказания услуг почтовой связи,2017-09-26 13:17:00,42564785,[]
806,дмитрий медведев провел в адыгее совещание о ходе сезонных полевых работ в году,2017-09-25 19:15:14,42564785,[]
807,глава адыгеи провел встречу с лидерами религиозных конфессий,2017-09-25 14:17:58,42564785,[]
808,глава адыгеи утвердил дорожную карту по ремонту проблемных школ и детских садов в майкопском районе,2017-09-23 11:14:23,42564785,[]
809,дмитрий медведев провел в адыгее совещание о ходе сезонных полевых работ в году,2017-09-22 19:14:23,42564785,[]
810,в адыгее почти на выросла число преступлений совершенных несовершеннолетними,2017-09-22 16:13:52,42564785,[]
811,в адыгее сохраняется высокая пожароопасность,2017-09-21 22:13:12,42564785,[]
812,правительство рф одобрило выделение средств на завершение строительства водозабора в адыгее,2017-09-21 19:15:55,42564785,[]
813,в адыгее объявлен самый высокий уровень пожароопасности,2017-09-21 17:16:21,42564785,[]
814,глава теучежского района отчитался о ходе исполнения поручений руководителя республики,2017-09-21 16:15:03,42564785,[]
815,глава адыгеи вместе с другими руководителями регионов принял участие во встрече с президентом,2017-09-20 21:11:28,42564785,[]
816,пожарные спасатели гу мчс россии по ра приняли участие в тактико специальном антитеррористическом учении,2017-09-20 14:17:16,42564785,[]
817,в адыгее прошли тактико специальные антитеррористические учения,2017-09-19 21:14:09,42564785,[]
818,первокурсники мгту приняли участие во всероссийской акции,2017-09-19 20:12:46,42564785,[]
819,глава адыгеи навестил участницу вов и передал ей поздравление президента рф с летием,2017-09-19 18:14:10,42564785,[]
820,в адыгее мошенники обманули банк и оформили кредит в млн рублей,2017-09-19 14:13:26,42564785,[]
821,в майкопе сотрудники росгвардии обеспечат охрану общественного порядка на массовых мероприятиях во время празднования дня города,2017-09-18 18:12:37,42564785,[]
822,летний житель адыгеи убил свою жену из за ревности,2017-09-18 17:14:23,42564785,[]
823,потерялась во время сбора грибов,2017-09-18 16:13:00,42564785,[]
824,полиция информирует об ограничении движения транспорта на некоторых улицах в майкопе,2017-09-18 14:14:53,42564785,[]
825,в адыгее в суд направлено уголовное дело в отношении двоих мужчин обвиняемых в подкупе полицейского,2017-09-17 04:13:26,42564785,[]
826,полиция информирует об ограничении движения транспорта в майкопе при проведении праздничных мероприятий,2017-09-16 23:11:43,42564785,[]
827,за вклад в развитие столицы адыгеи отмечены жители майкопа,2017-09-15 20:10:29,42564785,[]
828,помощь пожарных спасателей мчс потребовалась в двух дтп,2017-09-15 15:15:26,42564785,[]
829,глава адыгеи проинспектировал работы по благоустройству дворовых территорий в майкопе,2017-09-15 14:15:59,42564785,[]
830,да будет газ жительница адыгеи задала вопрос полпреду президента рф в юфо фото,2017-09-15 10:16:37,42564785,[]
831,на территории школы п цветочный появится открытая спортплощадка,2017-09-14 13:13:05,42564785,[]
832,открыта новая трасса связывающая адыгею и краснодарский край,2017-09-13 19:16:27,42564785,[]
833,состоялся оргкомитет по подготовке празднования летию республики адыгея,2017-09-13 13:13:58,42564785,[]
834,избран новый глава республики,2017-09-12 23:11:38,42564785,[]
835,сотрудники уфсин россии по республике адыгея перекрыли канал поставки наркотиков в исправительное учреждение,2017-09-12 14:16:18,42564785,[]
836,в адыгее будут судить местного жителя напавшего на таксиста,2017-09-12 13:13:25,42564785,[]
837,кумпилов назначил сенатором от адыгеи экс главу уфсб селезнева,2017-09-12 00:10:39,42564785,[]
838,представители ер приняли участие в онлайн марафоне ночь выборов,2017-09-11 23:10:36,42564785,[]
839,мурат кумпилов стал главой адыгеи,2017-09-11 14:15:51,42564785,[]
840,избранный глава республики адыгея мурат кумпилов принес присягу на верность многонациональному народу адыгеи,2017-09-10 18:11:44,42564785,[]
841,избран глава республики адыгея,2017-09-10 15:13:21,42564785,[]
842,в адыгею с официальным визитом прибыл президент абхазии,2017-09-10 01:11:40,42564785,[]
843,полиция информирует об изменении схемы организации движения через железнодорожный переезд по улице адыгейской в майкопе,2017-09-08 16:14:24,42564785,[]
844,полицией адыгеи завершено расследование уголовного дела по факту разбойного нападения на пенсионера,2017-09-08 06:12:53,42564785,[]
845,спасатели адыгеи участвуют в проведении аварийно восстановительных работ в кабардино балкарии,2017-09-07 21:13:11,42564785,[]
846,мэрия майкопа проводит конкурс для нко на получение грантов для молодежных проектов,2017-09-07 16:11:30,42564785,[]
847,руководитель адыгеи собирается в гости для нас не может быть чужих проблем фото,2017-09-06 20:13:52,42564785,[]
848,полиция адыгеи просит оказать помощь в розыске без вести пропавшей несовершеннолетней девочки,2017-09-06 16:12:22,42564785,[]
849,пожар в гиагинском районе,2017-09-06 14:14:54,42564785,[]
850,федеральный центр поможет адыгее в строительстве объездной дороги,2017-09-06 02:09:44,42564785,[]
851,ученый совет мгту провел первое в новом учебном году заседание,2017-09-05 16:13:25,42564785,[]
852,мурат кумпилов дал интервью информагентству тасс,2017-09-05 11:16:28,42564785,[]
853,студент мгту установил новый мировой рекорд по пауэрлифтингу,2017-09-04 19:12:38,42564785,[]
854,как в горах адыгеи прошли соревнования по догтрекингу,2017-09-04 16:14:52,42564785,[]
855,за парты сентября в адыгее сели более тысяч первоклассников,2017-09-01 17:12:36,42564785,[]
856,поздравление начальника гу мчс россии по республике адыгея полковника султана хацукова с праздником курбан байрам,2017-09-01 12:13:16,42564785,[]
857,помощь пожарных спасателей потребовалась в дтп,2017-08-31 19:14:16,42564785,[]
858,мурат кумпилов поручил минздраву ра провести проверки в больницах назвав ситуацию с платными койко местами циничной,2017-08-31 18:13:30,42564785,[]
859,инициативы адыгеи получили поддержку министерства культуры рф,2017-08-31 17:12:00,42564785,[]
860,пожар в майкопе,2017-08-31 12:13:55,42564785,[]
861,заключенным колонии в адыгее пытались передать мобильные телефоны,2017-08-30 19:12:51,42564785,[]
862,владимир путин встретился с муратом кумпиловым,2017-08-30 18:14:29,42564785,[]
863,трое в лодке спасательной,2017-08-30 17:14:03,42564785,[]
864,жители адыгеи собирали деньги на лечение несуществующего ребенка,2017-08-30 12:14:09,42564785,[]
865,курбан байрам в адыгее объявлен выходным днем,2017-08-29 15:12:46,42564785,[]
866,в адыгее курбан байрам объявлен выходным днем,2017-08-29 14:12:56,42564785,[]
867,мурат кумпилов пообщался с молодежью в неформальной обстановке у костра,2017-08-29 01:10:56,42564785,[]
868,в майкопе после капремонта открыли шовгеновский путепровод,2017-08-28 17:12:07,42564785,[]
869,сотрудника весового контроля поймали на взятке,2017-08-28 15:12:52,42564785,[]
870,горно туристический кластер адыгеи получит новые мощности к концу года,2017-08-27 02:10:15,42564785,[]
871,адыгея в числе регионов лидеров по количеству спортивных объектов строящихся по госпрограмме,2017-08-26 05:11:45,42564785,[]
872,мурат кумпилов и главы районов вместе с талантливой молодежью отправились в поход к горе фишт,2017-08-25 16:13:30,42564785,[]
873,в гиагинском районе планируют отремонтировать км внутрипоселковых дорог,2017-08-25 12:12:35,42564785,[]
874,в адыгее скорректирована госпрограмма ра развитие экономики до года,2017-08-25 10:12:45,42564785,[]
875,в ик уфсин россии по республике адыгея предотвращена попытка передачи запрещенных предметов,2017-08-24 20:10:45,42564785,[]
876,форум посвященный вопросам демографии прошел в адыгее,2017-08-24 16:14:02,42564785,[]
877,из бюджета адыгеи дополнительно выделят млн рублей на лекарственное обеспечение больных сахарным диабетом,2017-08-23 17:12:18,42564785,[]
878,день города майкопчане будут праздновать дня,2017-08-23 13:12:54,42564785,[]
879,более сотрудников мвд будут обеспечивать безопасность в адыгее в день знаний,2017-08-23 01:10:27,42564785,[]
880,первоклассники адыгеи в день знаний получат подарки,2017-08-22 15:12:22,42564785,[]
881,курсанты из адыгеи вступили в ряды юнармии,2017-08-22 11:15:50,42564785,[]
882,безусловный бренд в адыгее состоялся большой праздник адыгейского сыра,2017-08-21 20:11:09,42564785,[]
883,за выходные полиция адыгеи задержала нетрезвых водителей,2017-08-21 11:12:58,42564785,[]
884,представлены кандидаты на должность главы республики адыгея,2017-08-21 10:13:11,42564785,[]
885,военного оштрафовали за сломанную ногу беременной женщины,2017-08-20 21:09:07,42564785,[]
886,за семь месяцев текущего года полицией адыгеи зарегистрировано фактов угрозы убийством,2017-08-20 20:09:40,42564785,[]
887,полицией майкопа разыскивается подозреваемый в совершении грабежа в отношении пенсионерки,2017-08-18 15:12:53,42564785,[]
888,за дежурные сутки пожарные спасатели мчс трижды реагировали на дтп,2017-08-18 11:12:38,42564785,[]
889,житель адыгеи убивший супругов соседей из за собаки проведет год за решеткой,2017-08-17 18:10:23,42564785,[]
890,сотрудниками полиции адыгеи задержаны участники организованной преступной группы занимавшейся сбытом синтетических наркотиков,2017-08-17 17:13:44,42564785,[]
891,подшефный уфсин россии по республике адыгея военно патриотический клуб вертикаль представляет республику в финале всероссийской военно спортивной игры победа,2017-08-17 02:08:43,42564785,[]
892,в адыгее держат на контроле ситуацию связанную с экологической безопасностью около предприятия киево жураки апк,2017-08-16 20:10:55,42564785,[]
893,следственным управлением по республике адыгея возбуждено уголовное дело в отношении сотрудников полиции,2017-08-15 23:08:37,42564785,[]
894,полицией устанавливаются обстоятельства дтп с тяжкими последствиями в тахтамукайском районе,2017-08-15 20:09:43,42564785,[]
895,в ближайшие три года реконструируют километров трассы майкоп армавир,2017-08-15 16:11:28,42564785,[]
896,работа над ошибками минздрав адыгеи принял во внимание замечания онф фото,2017-08-15 14:11:41,42564785,[]
897,за выходные дни два пожара,2017-08-14 18:12:45,42564785,[]
898,роспотребнадзор в адыгее открыл горячую линию для отдыхавших в турции,2017-08-14 17:11:52,42564785,[]
899,в аварии с тремя автомобилями в тахтамукайском районе погибли два человека,2017-08-14 12:15:28,42564785,[]
900,передовикам жатвы в адыгее вручили награды,2017-08-11 19:10:03,42564785,[]
901,несчастный случай на воде в тахтамукайском районе,2017-08-11 13:15:12,42564785,[]
902,в адыгее отремонтируют и построят три участка дамб протяженностью километров,2017-08-10 23:10:54,42564785,[]
903,газопровод прокладывают к самому отдаленному поселку адыгеи,2017-08-10 20:09:56,42564785,[]
904,адыгея вошла в число регионов лидеров по исполнению программы капремонта многоквартирных домов,2017-08-10 19:11:22,42564785,[]
905,в гиагинском районе утонул ребенок,2017-08-10 13:10:07,42564785,[]
906,архиерейское богослужение в неделю девятую по пятидесятнице,2017-08-09 21:09:30,42564785,[]
907,начальник колонии в адыгее осужден за превышение должностных полномочий,2017-08-09 19:11:33,42564785,[]
908,двое жителей адыгеи осуждены за подделку документов на земельный участок,2017-08-09 14:13:35,42564785,[]
909,в адыгее создадут ассоциацию недропользователей,2017-08-09 13:13:10,42564785,[]
910,работы по расширению моста вдоль плотины майкопской гэс планируют ускорить,2017-08-08 20:10:03,42564785,[]
911,в республике адыгея продолжается доследственная проверка по факту исчезновения малолетнего мальчика,2017-08-08 19:12:34,42564785,[]
912,в адыгее мужчина угрожал убийством подростку,2017-08-08 14:11:37,42564785,[]
913,практически все пострадавшие от майского паводка получили положенные выплаты,2017-08-08 11:12:14,42564785,[]
914,детей были сняты с турмаршрута спасателями из адыгеи,2017-08-07 18:10:18,42564785,[]
915,из горного лагеря в адыгее эвакуировали детей и взрослых,2017-08-07 15:13:13,42564785,[]
916,в республике адыгея состоялся митинг посвященный передаче символов комплексного международного комбинированного пробега посвященного летию досааф россии делегатам от адыгейской республиканской оборонной организации для направления в волгоград,2017-08-07 14:14:53,42564785,[]
917,в теучежском районе депутата осудили за присвоение чужого имущества,2017-08-07 11:18:39,42564785,[]
918,мэрия майкопа по просьбе прихожан обустроила остановочный комплекс напротив свято георгиевского храма,2017-08-06 09:09:33,42564785,[]
919,делегация российского минздрава побывала в адыгее с рабочим визитом,2017-08-05 07:14:43,42564785,[]
920,мурат кумпилов указал властям тахтамукайского района на проблемные точки,2017-08-04 14:12:47,42564785,[]
921,в адыгее стартовал финал соревнований по легкой атлетике летней спартакиады учащихся россии,2017-08-04 11:13:21,42564785,[]
922,потерявшихся туристов обнаружили и доставили на турбазу пихтовый бор,2017-08-03 18:12:56,42564785,[]
923,в адыгее начались выплаты пострадавшим от майского паводка,2017-08-03 14:13:41,42564785,[]
924,заслуженный тренер россии по гандболу виктор лавров погиб в дтп на трассе лабинск майкоп,2017-08-03 11:18:00,42564785,[]
925,полицией устанавливаются обстоятельства дтп с тяжкими последствиями в теучежском районе,2017-08-02 18:10:25,42564785,[]
