1836,в волгограде площадь центрального рынка превратят в арт пространство,2018-10-24 14:45:15,140865189,[]
1837,покупка внедорожника волгоградским заводом попала в индекс расточительности от онф,2018-10-24 14:31:31,140865189,[]
1838,часы на здании волгоградского вокзала готовы к переводу стрелок,2018-10-24 14:15:10,140865189,[]
1839,в котово во время пожара в частном доме погибла пожилая пара,2018-10-24 14:01:37,140865189,[]
1840,составлен народный рейтинг самых доходных и престижных профессий в россии,2018-10-24 13:45:12,140865189,[]
1841,булатовы компенсировали моральный ущерб но домой к маме с папой рената не отпустили,2018-10-24 13:30:49,140865189,[]
1842,врач нейрохирург игорь шошинов быть доктором это не работа это образ жизни,2018-10-24 13:15:26,140865189,[]
1843,конкурс,2018-10-24 13:09:30,140865189,[]
1844,горе мать утопившая под волгоградом своего новорожденного ребенка идет под суд,2018-10-24 13:04:11,140865189,[]
1845,в стенах горьковки устроят разбор творческого пути максима горького,2018-10-24 13:04:08,140865189,[]
1846,в волгограде тепло получают уже жилых домов,2018-10-24 13:04:07,140865189,[]
1847,в волгограде поджигателя машин директоров коммерческих фирм ищут по видео,2018-10-24 13:04:03,140865189,[]
1848,лжесотрудницы газовой службы похитили у волгоградки тысяч рублей,2018-10-24 13:04:00,140865189,[]
1849,трое разбойников получили лет за попытку вскрыть банкомат в селе под волгоградом,2018-10-24 13:03:59,140865189,[]
1850,на первом заседании по делу булатова подсудимого тщательно охраняют от журналистов,2018-10-24 13:03:58,140865189,[]
1851,под волгоградом фура протащила по трассе ладу выехавшую на перекресток,2018-10-24 13:03:56,140865189,[]
1852,волгоградская студентка заплатила за а получила по почте кассетный плеер,2018-10-24 13:03:55,140865189,[]
1853,они заплатят в волгограде концессии водоснабжения не смогли оспорить крупный штраф,2018-10-24 13:03:53,140865189,[]
1854,в волгограде поджоги дорогих авто стали ежедневными горят машины директоров фирм,2018-10-24 13:02:05,140865189,[]
1855,ученые волгоградского вуза получили рекордное число грантов на исследования,2018-10-24 12:59:56,140865189,[]
1856,роспотребнадзор выявил в регионе огурцы и томаты с превышением пестицидов,2018-10-24 12:56:10,140865189,[]
1857,муниципалитетам поручено обеспечить поддержку людей пожилого возраста,2018-10-24 12:52:35,140865189,[]
1858,лихачеву показали ремонт дороги на улице пельше,2018-10-24 12:49:30,140865189,[]
1859,два мира две пенсии как живут пенсионеры в чехии и россии,2018-10-24 12:43:53,140865189,[]
1860,волгоградский аэропорт готов к работе по местному времени,2018-10-24 12:35:16,140865189,[]
1861,в волгограде водитель сбил на переходе летнего школьника,2018-10-23 12:01:58,140865189,[]
1862,результаты конкурса репостов,2018-10-23 11:46:37,140865189,[]
1863,до молочной продукции на волгоградских прилавках не соответствуют нормам,2018-10-23 11:45:09,140865189,[]
1864,в волгограде при резкой остановке автобуса мать уронила месяного младенца,2018-10-23 11:33:22,140865189,[]
1865,волжский расчленитель масленников застрял на этапе по дороге из москвы в волгоград,2018-10-23 11:15:37,140865189,[]
1866,в волжском отопительный сезон начнется октября,2018-10-23 11:00:56,140865189,[]
1867,в дзержинском районе ночью неизвестные сожгли дотла две иномарки,2018-10-23 10:45:46,140865189,[]
1868,продавцы окон вводили волгоградцев в заблуждение пятисекундной рекламой,2018-10-23 10:31:55,140865189,[]
1869,волгоградцам обещают дожди сильный ветер и похолодание до с,2018-10-23 10:15:33,140865189,[]
1870,обладателями премии бизнес дона стали лучшие бизнесмены,2018-10-23 10:00:19,140865189,[]
1871,в урюпинске устанавливают причину пожара на маслоэкстракционном заводе,2018-10-23 09:30:13,140865189,[]
1872,в волгограде на улице кропоткина закончена укладка асфальта,2018-10-22 18:30:06,140865189,[]
1873,двое волгоградцев попались на закладках наркодоз в двух городских районах,2018-10-22 17:45:20,140865189,[]
1874,волгоградская область собирается экспортировать медицинские услуги,2018-10-22 17:30:18,140865189,[]
1875,облсуд отправил на лет в колонию за взятку экс руководителя филиала бмсэ,2018-10-22 17:15:43,140865189,[]
1876,в волгограде к столетию комсомола запустят специальный трамвай,2018-10-22 17:02:09,140865189,[]
1877,в волгограде обнаружен труп с оторванными кистями и развороченной грудной клеткой,2018-10-22 16:45:12,140865189,[]
1878,не отходя от кассы ротор открыл продажу билетов на матч с тамбовом,2018-10-22 16:30:19,140865189,[]
1879,апелляция не помогла экс председателю думы краснослободска смягчить приговор,2018-10-22 16:15:17,140865189,[]
1880,эксперт российская налоговая система разрушает промышленность в стране,2018-10-22 16:00:29,140865189,[]
1881,в волгограде наградили лучших молодых предпринимателей,2018-10-22 15:45:06,140865189,[]
1882,волгоградские бегуны выйдут на старт под ритмы осеннего вальса,2018-10-22 15:30:24,140865189,[]
1883,топ авто для волгоградской зимы,2018-10-22 15:15:11,140865189,[]
1884,бухгалтера тсж уволили за разглашение госжилнадзору тайны вывоза мусора,2018-10-22 15:03:09,140865189,[]
1885,в волжском семеро студентов из благополучных семей организовали наркокартель,2018-10-22 14:45:07,140865189,[]
1886,за сломанную челюсть знакомой летнему волгоградцу дали год колонии,2018-10-22 14:30:15,140865189,[]
1887,причина смерти пропавшего в волгограде работника облздрава навсегда останется тайной,2018-10-22 14:15:21,140865189,[]
1888,в большинстве районов волгоградской области началась подача отопления,2018-10-22 14:00:47,140865189,[]
1889,роскомнадзор накажет издания за непроверенную информацию о трагедии в керчи,2018-10-22 13:45:27,140865189,[]
1890,футбольным патриотам мордовии не понравилась волгоград арена,2018-10-22 13:30:49,140865189,[]
1891,в волгоградском парке появятся авиационные солнечные часы,2018-10-22 13:15:03,140865189,[]
1892,в регионе ушло пять месяцев на разъяснение волгоградцам тарифов жкх,2018-10-22 13:01:06,140865189,[]
1893,в волгограде задержан серийный угонщик похищавший автомобили просто покататься,2018-10-22 12:46:00,140865189,[]
1894,жилья нет но есть надежда инспектор мвд разберется в сносе дома волгоградки,2018-10-22 12:31:17,140865189,[]
1895,почему женщины выбирают,2018-10-22 12:16:00,140865189,[]
1896,собачья жизнь в волгограде оказалась дешевой,2018-10-22 12:01:17,140865189,[]
1897,еврохим лидер по объемам инвестиций в развитие российской промышленности,2018-10-22 11:45:53,140865189,[]
1898,в волгограде капитан речного танкера пытался сбыть налево тонн нефти,2018-10-22 11:30:07,140865189,[]
1899,в волгограде подожгли заброшенное здание рядом с оживленным рынком,2018-10-22 11:15:13,140865189,[]
1900,в котово водитель гранты задавил на зебре летнюю женщину,2018-10-22 11:02:15,140865189,[]
1901,в волгограде официально стартовал отопительный сезон,2018-10-22 10:45:11,140865189,[]
1902,в волгоградской области в массовом дтп пострадал пожилой автомобилист,2018-10-22 10:31:26,140865189,[]
1903,до октября продолжается прием предложений по вопросу переименования аэропорта в г волгограде уже проводятся опросы и делаются вбросы позволим себе тоже запилить своеобразное голосование по некоторым инициативам,2018-10-22 10:25:59,140865189,[]
1904,волгоградская область заняла е место по доступности газа для населения,2018-10-22 10:15:23,140865189,[]
1905,сми узнали о возможном прекращении работы российских авиакомпаний,2018-10-22 09:45:37,140865189,[]
1906,итоги недели трагедия в керчи социальные льготы футбол и суровый приговор врачу,2018-10-22 07:15:31,140865189,[]
1907,в полночь небо над волгоградом озарится метеорным потоком ориониды,2018-10-21 20:30:18,140865189,[]
1908,волгоградские медики не успели спасти авиапассажира из антальи,2018-10-21 20:15:23,140865189,[]
1909,в волгограде пройдет акция памяти к пятилетию со дня теракта в автобусе,2018-10-21 15:31:12,140865189,[]
1910,росгвардия введет новую обязанность для граждан имеющих оружие,2018-10-21 13:45:22,140865189,[]
1911,в волгограде молодая автоледи устроила тройное дтп и раскидала иномарки по дороге,2018-10-21 13:15:31,140865189,[]
1912,волгоградский ротор снова первый в фнл по посещаемости,2018-10-21 13:01:08,140865189,[]
1913,не ротором единым,2018-10-21 12:00:09,140865189,[]
1914,волгоградская область ухудшила позиции в рейтинге регионов по развитию науки,2018-10-21 11:45:18,140865189,[]
1915,на пожаре в многоэтажке на юге волгограда погибла женщина,2018-10-21 11:30:39,140865189,[]
1916,туманная погода в начале недели ждет волгоградцев,2018-10-21 10:45:30,140865189,[]
1917,главный тренер ротора устал отвечать на необоснованную критику,2018-10-20 22:30:40,140865189,[]
1918,шаг назад ротор сыграл вничью с мордовией и опустился на место,2018-10-20 21:01:47,140865189,[]
1919,начался матч между ротором и мордовией,2018-10-20 16:45:23,140865189,[]
1920,более россиян высказались за проведение конкурса лидеры россии,2018-10-20 15:45:47,140865189,[]
1921,на аллее героев пожилой водитель сбил пешехода проехав на красный свет,2018-10-20 14:30:05,140865189,[]
1922,карма нарушителя под волгоградом водитель ваза уходил от дпс и разбился,2018-10-20 13:31:52,140865189,[]
1923,в волгограде недовольный размером пенсии пожилой мужчина организовал наркопритон,2018-10-20 12:30:53,140865189,[]
1924,два фазана в одни руки в волгоградской области открыт сезон охоты на дичь,2018-10-20 12:15:26,140865189,[]
1925,для болельщиков пустят дополнительные трамваи и троллейбусы на матч ротора,2018-10-20 12:01:49,140865189,[]
1926,в волгоградской области женщин на тысяч больше чем мужчин,2018-10-20 11:31:52,140865189,[]
1927,волгоградские дворы подсветят светодиодными фонарями,2018-10-20 11:16:01,140865189,[]
1928,целая выставка к памятнику гаситель добавятся бтр гаубица и зенитная пушка,2018-10-20 10:50:08,140865189,[]
1929,в волгограде задержаны авиарейсов из за плотного тумана,2018-10-20 10:15:51,140865189,[]
1930,волжская управкомпания заплатит тысяч рублей за поврежденный фасад дома,2018-10-19 18:45:23,140865189,[]
1931,в волгограде стартовал конкурс на лучшее название парка в советском районе,2018-10-19 18:30:16,140865189,[]
1932,волгоградская область возвращет славу всеросссийского огорода,2018-10-19 18:15:47,140865189,[]
1933,налаживается футбольные дела ротора идут в гору,2018-10-19 18:02:41,140865189,[]
1934,в волгоградской области открылось новое пожарное депо,2018-10-19 17:45:33,140865189,[]
1935,под дамокловым кирпичом в волгограде над социальным центром рушится балкон,2018-10-19 17:31:10,140865189,[]
1936,желание пользоваться электронными деньгами лишило волгоградку сбережений,2018-10-19 17:15:45,140865189,[]
1937,в волгограде наградили волонтеров участников конкурса доброволец россии,2018-10-19 17:00:26,140865189,[]
1938,эксперт минфина волгоградская область преодолела сложный финансовый период,2018-10-19 16:45:27,140865189,[]
1939,как в сирии после бомбежки волгоградцы в сети обсуждают состояние й горбольницы,2018-10-19 16:30:50,140865189,[]
1940,волжских автомобилистов поздравили с праздником,2018-10-19 16:15:08,140865189,[]
1941,с пистолетами костылями и в маске в котово задержан налетчик на ювелирный магазин,2018-10-19 16:00:53,140865189,[]
1942,волгоградские ватерполистки начали чемпионат россии с двух побед,2018-10-19 15:45:13,140865189,[]
1943,бочаров обсудил с командующим вдв вопросы по перевооружению десантников,2018-10-19 15:31:21,140865189,[]
1944,в шести районах волгограда заменят светофорное оборудование на перекрестках,2018-10-19 15:15:29,140865189,[]
1945,занятие для,2018-10-19 15:00:59,140865189,[]
1946,апелляционный суд ужесточил приговор в отношении марсело нтире,2018-10-19 14:45:40,140865189,[]
1947,волгоградские чиновники поделились опытом поддержки малого бизнеса,2018-10-19 14:30:49,140865189,[]
1948,марсело нтире выступил с последним словом и сказал что стал жертвой несправедливости,2018-10-19 14:15:05,140865189,[]
1949,из волжской колонии сбежали двое зеков находившихся без охраны,2018-10-19 14:02:00,140865189,[]
1950,пропала вся мотивация как в волгограде сокращают реальные зарплаты учителей,2018-10-19 13:45:40,140865189,[]
1951,волгоградский охотник поплатится за лысух,2018-10-19 13:30:54,140865189,[]
1952,губернатор волгоградской области провел встречу с заместителем министра науки,2018-10-19 13:15:26,140865189,[]
1953,полиция предупредила волгоградцев о ходящих по квартирам лжекоммунальщиках,2018-10-19 13:00:47,140865189,[]
1954,не остались в стороне волгоградцы провели акцию памяти о жертвах трагедии в керчи,2018-10-19 12:45:08,140865189,[]
1955,волгоградские зеки сделали для облздрава фельдшерско акушерских пунктов,2018-10-19 12:30:13,140865189,[]
1956,администрация волгоградской области закупила бензин на млн рублей,2018-10-19 12:15:53,140865189,[]
1957,на заседании по делу марсело нтире участники ожидают окончальный вердикт облсуда,2018-10-19 12:01:23,140865189,[]
1958,в волгоград с проектом о неигровом кино приехал режиссер сергей мирошниченко,2018-10-19 11:45:43,140865189,[]
1959,троим волгоградцам грозит по лет тюрьмы за угон трактора с поля,2018-10-19 11:30:22,140865189,[]
1960,в тесноте и в обиде на каждого волгоградца приходятся всего квадрата жилья,2018-10-19 11:15:09,140865189,[]
1961,прекрасная осенняя пора в выходные в волгограде ожидается до с,2018-10-19 11:00:11,140865189,[]
1962,поликлиники волгоградской области получают деньги на модернизацию,2018-10-19 10:45:39,140865189,[]
1963,волгоградскую агрофирму атк наказали за полив овощей мутной водой,2018-10-19 10:31:26,140865189,[]
1964,волгоградская облдума подарила газовикам миллиард рублей,2018-10-19 10:15:49,140865189,[]
1965,в волгограде по горячим следам задержан убийца женщины в парке им гагарина,2018-10-19 10:01:46,140865189,[]
1966,волгоградцы сыграют в интеллектуальный квиз в стиле,2018-10-18 23:45:40,140865189,[]
1967,в волгограде в парке им гагарина прохожую убили ударом ножа в сердце,2018-10-18 23:30:28,140865189,[]
1968,на субботний матч ротора с мордовией продано тысяч билетов,2018-10-18 19:01:45,140865189,[]
1969,в волжском директор фирмы подрядчика сел на восемь лет за откат в млн,2018-10-18 18:45:10,140865189,[]
1970,с прошлого года пассажиропоток общественного транспорта увеличился в раза,2018-10-18 18:15:47,140865189,[]
1971,генпрокуратура проверит охрану в учебных заведениях после трагедии в керчи,2018-10-18 18:00:36,140865189,[]
1972,по дороге на юг на севере волгограда обосновалась стая лебедей,2018-10-18 17:45:44,140865189,[]
1973,ростелеком представил мобильное приложение для удаленной идентификации граждан,2018-10-18 17:31:24,140865189,[]
1974,дзержинский загс в ноябре встретит молодоженов с новым парадным входом,2018-10-18 17:15:17,140865189,[]
1975,под волгоградом военные солнцепеками сожгли колонну техники противника,2018-10-18 17:00:41,140865189,[]
1976,в волгоградской области прожиточный минимум пенсионера увеличили на рубля,2018-10-18 16:45:13,140865189,[]
1977,в горьковской библиотеке расскажут о литературных пародиях,2018-10-18 16:31:03,140865189,[]
1978,полиция задержала волжанку собиравшую с граждан деньги для мошенника,2018-10-18 16:15:51,140865189,[]
1979,волгоградские общественники поддержали расширение социальных льгот,2018-10-18 16:01:08,140865189,[]
1980,волгоградские семьи начали получать электронные сертификаты на маткапитал,2018-10-18 15:45:21,140865189,[]
1981,суд арестовал только два из трех автомобилей геберта о которых заявило обвинение,2018-10-18 15:30:13,140865189,[]
1982,госдума ввела штрафы за злоупотребление митингами,2018-10-18 15:15:50,140865189,[]
1983,в волгограде отменили все культурно массовые мероприятия в память о погибших в керчи,2018-10-18 15:01:12,140865189,[]
1984,облдума единогласно приняла предложенные губернатором два пакета социальных льгот,2018-10-18 14:45:25,140865189,[]
1985,налетчиком убившим мать двоих детей оказался студент волгоградского вуза,2018-10-18 14:31:01,140865189,[]
1986,в волгограде черные мусорщики напали на гражданского активиста алексея ульянова,2018-10-18 14:15:05,140865189,[]
1987,в волгоградской облдуме вновь предлагают приватизировать гупы,2018-10-18 14:01:20,140865189,[]
1988,после миллионного иска вдовы брудного геберта могут лишить всех автомобилей,2018-10-18 13:45:47,140865189,[]
1989,в облбюджете прогнозируется превышение расходов над доходами на млн рублей,2018-10-18 13:31:22,140865189,[]
1990,в волгограде организатор казино в частном доме может сесть на четыре года,2018-10-18 13:16:00,140865189,[]
1991,музей заповедник старая сарепта обрел партнера по археологической деятельности,2018-10-18 13:00:37,140865189,[]
1992,в волжском ночью гаишники задержали двух бывших зеков угнавших шестерку,2018-10-18 12:45:52,140865189,[]
