2557,более млн рублей направят в адыгее на развитие предпринимательства,2015-01-16 20:06:37,42564785,[]
2558,летнюю пенсионерку в адыгее обманули телефонные мошенники,2015-01-16 17:03:06,42564785,[]
2559,полицией адыгеи разыскивается без вести пропавшая летняя жительница майкопа,2015-01-15 23:00:13,42564785,[]
2560,в майкопе вновь изъяли поддельную денежную купюру,2015-01-15 22:35:30,42564785,[]
2561,следственным отделом по городу майкопу возбуждено уголовное дело по факту убийства женщины ее дочерью,2014-04-15 13:07:26,42564785,[]
2562,в адыгее завершено расследование громкого дела о заказном убийстве главы красногвардейского района мурата кудаева,2014-04-14 22:00:05,42564785,[]
2563,тотальный диктант впервые провели в майкопе,2014-04-14 17:04:53,42564785,[]
2564,запланировано учение,2014-04-14 16:07:00,42564785,[]
2565,итоги совещания по вопросам налогообложения доходов физических лиц подвели в подмосковье,2014-04-14 12:09:39,42564785,[]
2566,глава республики проинспектировал ход строительства детских садов,2014-04-11 03:01:35,42564785,[]
2567,из за аварии на водоводе подача воды в столицу адыгеи будет ограничена,2014-04-10 17:07:38,42564785,[]
2568,аслан тхакушинов побывал на строящемся инвестобъекте,2014-04-10 13:02:11,42564785,[]
2569,глава адыгеи побывал в учреждениях культуры,2014-04-10 12:09:06,42564785,[]
2570,сотрудник дпс адыгеи вымогал деньги с водителей с помощью неисправного алкотестера,2014-04-10 03:00:36,42564785,[]
2571,метод нестандартный результаты обнадеживающие,2014-04-09 12:02:40,42564785,[]
2572,в адыгее полицейскими задержан транспорт незаконно перевозивший около х тонн спирта,2014-04-09 04:00:41,42564785,[]
2573,аслан тхакушинов провел рабочую встречу с сенатором вячеславом шверикасом,2014-04-08 16:02:01,42564785,[]
2574,казаков добровольцев из адыгеи оказывали помощь крыму в обеспечении правопорядка,2014-04-07 20:04:43,42564785,[]
2575,полицией адыгеи по факту причинения тяжкого вреда здоровью возбуждено уголовное дело,2014-04-07 15:04:41,42564785,[]
2576,глава адыгеи принял участие в общегородском субботнике,2014-04-07 13:04:58,42564785,[]
2577,в адыгее задержаны участников встречи криминальных авторитетов,2014-04-07 04:00:21,42564785,[]
2578,глава адыгеи провел ряд рабочих встреч,2014-04-06 05:00:37,42564785,[]
2579,в адыгее пресечена сходка криминальных авторитетов адыгеи и кабардино балкарии видео,2014-04-04 23:00:52,42564785,[]
2580,информация о состоянии озимых и посадок плодовых культур после заморозков г г в республике адыгея,2014-04-04 19:01:51,42564785,[]
2581,в майкопе полиция задержала участников криминальной сходки из адыгеи и кбр,2014-04-04 16:04:38,42564785,[]
2582,премьер министр республики провел личный прием граждан,2014-04-03 18:03:58,42564785,[]
2583,экскаваторщик рывший улицу в п яблоновском обнаружил артиллерийский снаряд,2014-04-03 01:00:19,42564785,[]
2584,в адыгее планируется провести семь избирательных кампаний,2014-04-02 18:02:37,42564785,[]
2585,глава адыгеи провел рабочую встречу с министром внутренних дел по ра,2014-04-01 10:04:10,42564785,[]
2586,премьер министр адыгеи посетил шовгеновский район,2014-03-31 20:00:05,42564785,[]
2587,глава адыгеи поздравил работников культуры с профессиональным праздником,2014-03-31 19:01:44,42564785,[]
2588,премьер министр адыгеи оценил санитарное состояние населенных пунктов шовгеновского района,2014-03-30 22:00:37,42564785,[]
2589,глава адыгеи принял руководство регионального народного фронта,2014-03-29 02:01:07,42564785,[]
2590,адыгея готовится к спортивно туристским играм интерралли белая,2014-03-28 18:06:10,42564785,[]
2591,в адыгее задержали наркоторговца с кг метамфетамина и г афганского гашиша,2014-03-27 14:06:22,42564785,[]
2592,удебные приставы исполнители провели рейд на городском рынке майкопа,2014-03-27 11:06:56,42564785,[]
2593,в адыгее полицией выявлены факты присвоения земельных участков по поддельным документам,2014-03-26 18:04:15,42564785,[]
2594,научил несовершеннолетнего,2014-03-26 16:06:49,42564785,[]
2595,житель адыгеи самостоятельно демонтировал лежачего полицейского,2014-03-26 12:04:12,42564785,[]
2596,шесть тысяч майкопчан отметили шествием подписание договора о включении крыма в состав россии,2014-03-26 11:06:56,42564785,[]
2597,депутаты адыгеи обсудили ситуацию на украине поддержали ряд обращений и законопроектов,2014-03-12 19:00:46,42564785,[]
2598,пьяный водитель сбивший человека и скрывшийся с места происшествия получил условный срок,2014-03-12 16:00:51,42564785,[]
2599,сегодня отмечается день работника уголовно исполнительной системы,2014-03-12 12:02:10,42564785,[]
2600,в адыгее сотрудниками полиции разысканы пропавшие воспитанницы школы интерната,2014-03-11 21:00:14,42564785,[]
2601,прокуратура передала в суд материалы по невыплате зарплаты на сумму более тыс рублей,2014-03-11 11:03:27,42564785,[]
2602,в адыгее прошла акция в поддержку народа украины и жителей крыма,2014-03-11 02:06:47,42564785,[]
2603,дилерский центр в майкопе,2014-03-11 01:03:07,42564785,[]
2604,глава адыгеи поздравил женщин республики с марта,2014-03-08 19:00:37,42564785,[]
2605,в республике готовятся к празднованию летия образования адыгейской областной комсомольской организации,2014-03-07 20:01:08,42564785,[]
2606,министр внутренних дел по адыгее в торжественной обстановке вручил представительницам прекрасного пола водительские удостоверения,2014-03-07 18:02:04,42564785,[]
2607,в доме правительства адыгеи вручили госнаграды,2014-03-07 15:02:26,42564785,[]
2608,глава адыгеи принял бывшего и нового руководителя адыгейского педколледжа им х андрухаева,2014-03-06 02:00:38,42564785,[]
2609,в адыгее вынесен приговор обвиняемому в причинении огнестрельного ранения и незаконном хранении оружия,2014-03-05 12:05:07,42564785,[]
2610,полицией адыгеи инициативно выявлено тяжкое преступление совершенное около двух лет назад,2014-03-05 11:06:38,42564785,[]
2611,в адыгее завершено расследование уголовного дела по фактам мошенничества,2014-03-05 10:04:00,42564785,[]
2612,аслан тхакушинов проинспектировал ход работ на республиканском стадионе,2014-03-05 02:00:37,42564785,[]
2613,строим молодежную политику сами,2014-03-04 09:04:17,42564785,[]
2614,полицией адыгеи задержан подозреваемый в совершении разбойного нападения,2014-03-04 01:01:35,42564785,[]
2615,сбор молодежных лидеров юга россии,2014-03-04 00:01:06,42564785,[]
2616,в анапе обсудили приоритеты молодежной политики на юге россии,2014-03-03 13:05:40,42564785,[]
2617,глава адыгеи провел заседание антинаркотической комиссии ра,2014-02-28 19:01:53,42564785,[]
2618,на олимпиаде в сочи нальмэс выступал на бис,2014-02-28 13:04:33,42564785,[]
2619,премьер министр адыгеи провел ряд рабочих совещаний,2014-02-28 07:01:23,42564785,[]
2620,в адыгее ищут преступников пытавшихся незаконно оформить на себя землю в туристической зоне,2014-02-27 13:01:07,42564785,[]
2621,прокуратура города майкопа выступила с инициативой создания в городе добровольных формирований по охране общественного порядка,2014-02-27 12:03:35,42564785,[]
2622,глава адыгеи провел рабочую встречу с заместителем руководителя роструда иваном шкловцом,2014-02-26 18:02:14,42564785,[]
2623,по итогам года заработная плата учителей сложилась на уровне тыс рублей,2014-02-25 23:00:49,42564785,[]
2624,глава адыгеи заслушал отчет председателя контрольно счетной палаты ра,2014-02-25 20:00:36,42564785,[]
2625,полицией адыгеи задержаны члены организованной преступной группы промышлявшей угонами автомобилей на территории республики,2014-02-25 15:02:17,42564785,[]
2626,в адыгее к девяти годам колонии приговорен мужчина до смерти избивший своего знакомого,2014-02-25 11:01:41,42564785,[]
2627,полицией адыгеи установлена причастность организованной преступной группы к еще одной краже,2014-02-24 15:01:14,42564785,[]
2628,в майкопе полицейские и юные инспекторы движения провели патриотическую акцию,2014-02-24 14:04:30,42564785,[]
2629,мвд по адыгее информирует абитуриентов о наборе на учебу в вузы системы мвд россии,2014-02-24 13:05:05,42564785,[]
2630,за сутки полицией в адыгее выявлено более нарушений правил дорожного движения,2014-02-24 05:00:50,42564785,[]
2631,полиция адыгеи разыскивает лиц совершивших кражу дорогостоящих запчастей с дорожной техники,2014-02-20 20:00:52,42564785,[]
2632,сотрудники офмс россии по республике адыгея приняли участие в торжественной церемонии возложения,2014-02-20 19:03:42,42564785,[]
2633,цветы к мемориалу,2014-02-19 22:01:05,42564785,[]
2634,глава адыгеи в прямом эфире ответил на вопросы жителей республики,2014-02-19 13:03:03,42564785,[]
2635,полицией адыгеи задержан подозреваемый в дерзком ограблении пенсионера,2014-02-14 16:05:31,42564785,[]
2636,участники игр фишта провели первые в этом году соревнования,2014-02-13 23:00:37,42564785,[]
2637,состоялось заседание государственного совета хасэ республики адыгея,2014-02-13 12:05:14,42564785,[]
2638,суд оставил в силе обвинительный приговор надежде цапок,2014-02-12 22:01:23,42564785,[]
2639,в хасавюртовском районе дагестана силовики проводят спецоперацию,2014-02-12 17:03:55,42564785,[]
2640,глава адыгеи прокомментировал черкесский вопрос,2014-02-12 13:05:44,42564785,[]
2641,на эльбрусе спасатели эвакуируют упавшего в горную трещину туриста,2014-02-12 11:05:48,42564785,[]
2642,в ростове на дону из за падения ледяной глыбы с крыши общежития вуза погибла женщина,2014-02-11 20:02:55,42564785,[]
2643,адвокаты царнаева просят начать судебный процесс в сентябре года,2014-02-11 13:05:51,42564785,[]
2644,в астрахани в результате дтп с участием маршрутки пострадал ребенок,2014-02-11 11:03:34,42564785,[]
2645,в азербайджане произошло землетрясение магнитудой,2014-02-11 10:02:41,42564785,[]
2646,очередной конфликт в белом виновна ли администрация,2014-02-10 18:04:18,42564785,[]
2647,управление россельхознадзора по краснодарскому краю и республике адыгея к встрече олимпийских гостей готово,2014-02-07 17:01:56,42564785,[]
2648,глава адыгеи встретился с представителями хатажукайского сельского поселения,2014-02-06 18:02:08,42564785,[]
2649,в майкопе встретили эстафету олимпийского огня,2014-02-05 13:04:46,42564785,[]
2650,символы олимпиады теперь в музее,2014-02-05 11:08:21,42564785,[]
2651,трунов отказ учителей краснодара от участия в эстафете может повлиять на их работу,2014-02-05 03:01:07,42564785,[]
2652,майкоп столица эстафеты олимпийского огня,2014-02-04 10:02:43,42564785,[]
2653,в адыгее полицейские обеспечили правопорядок во время эстафеты олимпийского огня сочи,2014-02-03 22:00:50,42564785,[]
2654,факелоносцы на старте,2014-02-03 19:00:22,42564785,[]
2655,встречаем эстафету олимпийского огня,2014-02-03 14:02:13,42564785,[]
2656,адыгею посетил руководитель оао россети,2014-02-03 02:11:28,42564785,[]
2657,адыгея готовится к встрече олимпийского огня,2014-01-31 20:01:06,42564785,[]
2658,в кабардино балкарии на территории баксана введен режим кто,2014-01-31 13:04:16,42564785,[]
2659,у двух жителей кабардино балкарии изъяты наркотики и боеприпасы,2014-01-31 10:05:41,42564785,[]
2660,еспч присудил тысяч евро компенсации по делу о похищении людей в чечне,2014-01-30 23:00:38,42564785,[]
2661,движение на участке транскама запрещено из за опасности схода лавин,2014-01-30 18:02:12,42564785,[]
2662,федеральные чиновники оценили работу по устранению последствий стихии в адыгее,2014-01-30 11:04:00,42564785,[]
2663,молодогвардейцы адыгеи участвуют во встрече олимпийского огня,2014-01-30 10:05:16,42564785,[]
2664,глава адыгеи встретился с заместителями министра регионального развития рф,2014-01-29 21:03:50,42564785,[]
2665,в республике адыгея вынесен приговор мужчине причинившему своему знакомому тяжкие телесные повреждения повлекшие его смерть,2014-01-10 19:01:41,42564785,[]
2666,майкопским районным судом осужден житель ст абадзехской за умышленное причинение тяжкого вреда здоровью опасного для жизни человека повлекшее по неосторожности смерть потерпевшего,2014-01-10 17:04:12,42564785,[]
2667,спасатели нашли живыми украинских туристов сорвавшихся при восхождении на эльбрус,2014-01-10 00:00:04,42564785,[]
2668,в убийствах водителей на ставрополье подозреваются трое жителей кабардино балкарии,2014-01-09 21:02:16,42564785,[]
2669,полицией адыгеи по горячим следам задержан подозреваемый в умышленном причинении тяжкого вреда здоровью,2014-01-09 16:05:04,42564785,[]
2670,в ставропольском крае произошел взрыв у места обнаружения машины с телом мужчины,2014-01-08 22:00:04,42564785,[]
2671,в волгограде под домашний арест переведен фигурант дела о хищении млн рублей в сфере жкх,2014-01-08 17:02:25,42564785,[]
2672,в карачаево черкесии спасатели эвакуировали пострадавшего парапланериста,2014-01-08 16:01:36,42564785,[]
2673,в адыгее памятникам меотской культуры грозит уничтожение заявляют археологи,2014-01-08 15:06:14,42564785,[]
2674,православные на северном и южном кавказе отмечают рождество христово,2014-01-07 21:02:40,42564785,[]
2675,делегация мвд по адыгее приняла участие в митинге на мемориале майкопского гарнизона,2014-01-04 08:21:11,42564785,[]
2676,в больницах волгограда остаются пострадавших в результате терактов,2014-01-03 00:00:49,42564785,[]
2677,жители сочи встречали новый год дома из за боязни терактов,2014-01-02 21:00:48,42564785,[]
2678,в волгограде похоронены жертвы теракта на вокзале маковкин хакимова и тюняева,2014-01-02 20:00:50,42564785,[]
2679,елена исинбаева признана спортивными журналистами лучшей спортсменкой европы,2014-01-02 19:01:48,42564785,[]
2680,террористические акты совершенные террористами смертниками на территории рф,2014-01-01 16:02:21,42564785,[]
2681,новогодние теракты в волгограде твитт трансляция смертников взорвутся до рождества,2014-01-01 08:11:06,42564785,[]
2682,за убийство женщины осужден житель ст кужорская,2013-12-31 15:23:48,42564785,[]
2683,в волгограде число погибших от взрыва в троллейбусе возросло до человек,2013-12-31 12:01:24,42564785,[]
2684,глава адыгеи провел совещание с руководителями правоохранительных органов министрами и главами муниципальных образований,2013-12-30 18:01:20,42564785,[]
2685,нак убитые в кабардино балкарии причастны к нападению на сотрудников уфсин,2013-12-30 16:06:20,42564785,[]
2686,полиция адыгеи переведена на усиленный вариант несения службы,2013-12-30 12:07:00,42564785,[]
2687,следствие разыскивает двоих подозреваемых в организации взрыва в пятигорске,2013-12-29 23:00:52,42564785,[]
2688,число погибших при взрыве в волгограде достигло четырех человек,2013-12-29 17:02:20,42564785,[]
2689,в дагестане в кизилюртовском районе введен режим кто,2013-12-29 12:02:49,42564785,[]
2690,конфедерация профсоюзов азербайджана обещает выплатить семье совершившего самосожжение гасанова денежную компенсацию,2013-12-29 09:01:24,42564785,[]
2691,в дагестане произошел взрыв в заблокированном силовиками доме,2013-12-28 17:01:20,42564785,[]
2692,глава адыгеи озвучил инвестиционное послание госсовету хасэ республики,2013-12-28 16:01:26,42564785,[]
2693,в адыгее планируют финансировать дорожную безопасность за счет штрафов,2013-12-27 19:01:54,42564785,[]
2694,в кошехабльском районе адыгеи открыли два новых фапа,2013-12-27 14:06:55,42564785,[]
2695,семьям адыгов вернувшихся из сирии раздали гуманитарную помощь и новогодние подарки,2013-12-26 23:01:36,42564785,[]
2696,в дагестане прокуратура опротестовала распоряжение главы мвд региона о проведении операции аптека,2013-12-26 18:05:52,42564785,[]
2697,в адыгее состоялся всероссийский турнир по дзюдо,2013-12-26 13:07:05,42564785,[]
2698,адыгея вошла в первую двадцатку экологического рейтинга субъектов,2013-12-26 02:01:43,42564785,[]
2699,пожар в торговом центре бина в баку потушен,2013-12-25 23:00:20,42564785,[]
2700,на сегодня в разных городах россии намечены акции поддержки эколога из краснодарского края евгения витишко,2013-12-25 16:08:43,42564785,[]
2701,аслан тхакушинов принял участие в заседании госсовета рф,2013-12-25 12:09:07,42564785,[]
2702,глава адыгеи встретился с министром образования рф д ливановым,2013-12-25 02:01:29,42564785,[]
2703,хоровод у главной елки,2013-12-24 22:01:56,42564785,[]
2704,мобилизация протеста в дагестане,2013-12-24 15:05:24,42564785,[]
2705,главный прокурор грузии был судим за разбой заявил мэр тбилиси гиги угулава,2013-12-24 11:04:15,42564785,[]
2706,перед парламентом армении проходит акция протеста против ратификации армяно российских соглашений,2013-12-23 20:01:36,42564785,[]
2707,в адыгее детей собирают новогодние елки главы республики,2013-12-23 12:25:00,42564785,[]
2708,национальному турпродукту дорогу,2013-12-22 20:34:46,42564785,[]
2709,дмитрий медведев заслушал руководителей регионов по вопросам развития мфц,2013-12-05 06:01:08,42564785,[]
