3532,в министерство просвещения поступило обращение инициативной группы с просьбой пересмотреть школьные программы по физике и информатике,2018-08-14 13:04:48,140865189,[]
3533,накануне на территории рабочего поселка городище в ходе оперативно розыскных мероприятий сотрудники полиции задержали летнюю жительницу волгограда делавшую закладки с синтетическим наркотиком,2018-08-14 12:48:05,140865189,[]
3534,главный приз в компетенции малярные и декоративные работы престижного национального чемпионата рабочих профессий забрала волгоградка анастасия логоза,2018-08-14 12:33:00,140865189,[]
3535,сегодня губернатор андрей бочаров провел выездное совещание по ремонту дорожной сети на улице шурухина в волгограде он проверил состояние объекта который был восстановлен в рамках проекта безопасные и качественные дороги и обозначил дальнейшие приоритеты в данной сфере,2018-08-14 12:17:39,140865189,[]
3536,обитель птиц примет питомцев зоосада свято духова монастыря,2018-08-14 12:00:33,140865189,[]
3537,сегодня утром резкое ухудшение состояния здоровья одного из водителей едва не привело к трагедии,2018-08-14 11:44:03,140865189,[]
3538,более тысяч жителей волгоградской области не имеют постоянного доступа к качественной питьевой воде такие данные озвучило региональное управление роспотребнадзора в специальном отчете,2018-08-14 11:28:11,140865189,[]
3539,на календаре августа этот день был особенным в народном календаре у славян а затем стал летним церковным праздником посвященном памяти происхождения честных древ животворящего креста,2018-08-14 11:12:21,140865189,[]
3540,в период с по августа намечен визит военной делегации вооруженных сил республики индии в камышинскую отдельную десантно штурмовую бригаду дислоцированную в волгоградской области,2018-08-14 10:56:07,140865189,[]
3541,награды и оценки кроссовера со стороны профессионалов авторынка,2018-08-14 10:40:08,140865189,[]
3542,мэрия волгограда приняла решение расширить план дорожных работ на текущий год несколько улиц в дзержинском краснооктябрьском советском и тракторозаводском районах отремонтируют за счет денег сэкономленных в ходе предыдущих аукционов по восстановлению дорог,2018-08-14 10:24:05,140865189,[]
3543,минэкономразвития предложило в следующем году провести индексацию тарифов жкх в два этапа начиная с января ранее повышение коммунальных платежей проходило в июле,2018-08-14 10:08:05,140865189,[]
3544,возможность выпускать непокрытые аккредитивы получили корпоративные клиенты альфа банка сведения предоставила пресс служба кредитно финансовой организации,2018-08-14 09:36:04,140865189,[]
3545,в понедельник в сми снова стали появляться версии причин убийства известного телеведущего владислава листьева журналист был убит в марте года а преступление до сих пор не раскрыто,2018-08-13 21:36:06,140865189,[]
3546,глава города волжского игорь воронин провел личный прием граждан общение проходило в присутствии руководителей структурных подразделений администрации чтобы можно было сразу решить какие то вопросы,2018-08-13 19:12:05,140865189,[]
3547,арбитражный суд волгоградской области принял к рассмотрению иск от регионального комитета транспорта и дорожного хозяйства к компании ао волгомост комитет требует чтобы подрядчик за свой счет устранил нарушения допущенные при строительстве путепровода на шоссе авиаторов,2018-08-13 17:36:04,140865189,[]
3548,прокуратура волгоградской области в понедельник представило итоги проверки в регионе соблюдения требований федерального законодательства о противодействии коррупции количество выявленных нарушений оказалось более трехсот,2018-08-13 17:20:21,140865189,[]
3549,вслед за исчезновением летнего волгоградца который совершал восхождение в одиночку и сегодня рано утром исчез на высоте около метров на эльбрусе произошел очередной инцидент,2018-08-13 17:04:15,140865189,[]
3550,вместе с посетителями в музее заповеднике отметят праздник по всем традициям,2018-08-13 16:39:43,140865189,[]
3551,танкисты мотострелкового соединения южного военного округа юво дислоцированного в волгоградской области провели ночные стрельбы на общевойсковом полигоне прудбой,2018-08-13 16:16:46,140865189,[]
3552,сегодня в волгограде были экстренно эвакуированы посетители и сотрудники торгового центра акварель несколько сотен человек срочно покинули здание из за сработавшей пожарной сигнализации,2018-08-13 16:00:09,140865189,[]
3553,волгоградстат зафиксировал в регионе не только обычное для середины лета снижение цен на плодоовощную продукцию но и подорожание по отдельным ее видам,2018-08-13 15:44:09,140865189,[]
3554,искусствоведы приглашают волгоградцев на арт проект сон в летнюю ночь ставший традиционным на исходе лета,2018-08-13 15:28:03,140865189,[]
3555,аграрии волгоградской области на прошлой неделе преодолели важный рубеж собрав уже миллиона тонн зерновых,2018-08-13 15:12:03,140865189,[]
3556,в волгограде состоялся брифинг председателя региональной избирательной комиссии виктора черячукина посвященный подготовке к единому дню голосования сентября руководитель икво рассказал журналистам как проходит кампания перед выборами в городские думы волгограда волжского и камышина,2018-08-13 14:56:07,140865189,[]
3557,в волжском автоинспекторы вместе с сотрудниками городского транспортного предприятия автоколонна обсудили дальнейшую реализацию совместного проекта вместе за безопасность,2018-08-13 14:40:52,140865189,[]
3558,августа в парке коломенское в москве состоится межрегиональный творческий фестиваль славянского искусства русское поле в нем примут участие и представители волгоградской области,2018-08-13 14:24:02,140865189,[]
3559,в котельниковском районе раскрыты два циничных преступления совершенных в течение получаса по похожему сценарию потерпевшие подвергались сексуальному насилию причем в одном из случаев преступник похитил сумку жертвы нападения,2018-08-13 14:08:04,140865189,[]
3560,в российских городах где перед чемпионатом мира футболу были построены новенькие стадионы уже сейчас задумываются о том как им придется содержать арены которые государство передает на баланс регионов,2018-08-13 13:52:14,140865189,[]
3561,сотрудники уголовного розыска отдела полиции ворошиловского района задержали дерзких грабителей избивших случайного прохожего и отобравших у него крупную сумму денег,2018-08-13 13:36:05,140865189,[]
3562,сегодня волгоградцы проводили в последний путь директора музея заповедника сталинградская битва руководителя реготделения российского военно исторического общества депутата областной думы алексея васина,2018-08-13 13:21:08,140865189,[]
3563,соответствующие задачи поставил глава администрации виталий лихачев на заседании организационного комитета,2018-08-13 12:48:03,140865189,[]
3564,сегодня губернатор волгоградской области андрей бочаров проинспектировал городскую больницу глава региона поручил предпринять шаги по дальнейшему развитию учреждения и его превращению в современный медицинский центр,2018-08-13 12:17:01,140865189,[]
3565,появились данные о личности молодого водителя который поздно вечером августа на трассе в среднеахтубинском районе выехал на встречку и спровоцировал страшное дтп,2018-08-13 12:02:04,140865189,[]
3566,жители города услышат любимые песни лидера группы кино который остается кумиром для нескольких поколений российских любителей рок музыки,2018-08-13 11:44:05,140865189,[]
3567,в понедельник августа доллар вновь показал свой рост на торгах московской биржи,2018-08-13 11:28:02,140865189,[]
3568,онлайн магазины изобрели новый способ нажиться на доверчивых покупателях пользуясь любовью россиян к скидкам они предлагают им приобрести по акции несуществующие товары чаще всего такие махинации осуществляются при продаже бытовой техники,2018-08-13 11:12:08,140865189,[]
3569,сегодня около утра спасатели обслуживающие территорию у подножия эльбруса а также высокогорные участки получили информацию об исчезновении туриста,2018-08-13 10:56:05,140865189,[]
3570,в минувшее воскресенье в кировском районе волгограда едва не погибли в своей квартире летний местный житель со своей престарелой родственницей,2018-08-13 10:40:36,140865189,[]
3571,переписка пользователей мессенджера теперь станет доступна для спецслужб,2018-08-13 10:24:12,140865189,[]
3572,в рособрнадзоре намерены уже в недалеком будущем перейти к автоматизированной проверке единого государственного экзамена егэ,2018-08-13 10:08:03,140865189,[]
3573,в минувшее воскресенье на аэродроме мариновка летчики волгоградского авиаполка провели праздничные мероприятия посвященные дню военно воздушных сил россии,2018-08-13 09:36:10,140865189,[]
3574,информационное агентство новостиволгограда ру подводит итоги прошедшей недели напоминая о наиболее значимых региональных событиях которые освещались на ленте новостей,2018-08-13 07:28:03,140865189,[]
3575,в м туре первенства фнл ротор гостил в ярославле у местного шинника команды не очень выразительно начали сезон но если у хозяев в активе были уже две победы то волгоградцы только однажды добыли три очка да и то в домашнем матче,2018-08-13 00:20:09,140865189,[]
3576,накануне в хуторе верхнерубеженский в октябрьском районе произошло дтп в результате которого пострадали не только люди но и крупный рогатый скот,2018-08-12 13:20:26,140865189,[]
3577,в российской столице на скалодроме цска стартовало первенство мира по скалолазанию,2018-08-12 13:04:18,140865189,[]
3578,директора музея заповедника сталинградская битва председателя регионального отделения российского военно исторического общества похоронят на центральном димитриевском кладбище волгограда,2018-08-12 12:00:46,140865189,[]
3579,накануне поздно вечером врачи скорой прибыли по вызову в один из домов по ул районной в советском районе волгограда,2018-08-12 11:12:07,140865189,[]
3580,леонид жданов являющийся единственным фигурантом уголовного дела возбужденного по ч ст ук рф нарушение правил безопасности движения водного транспорта повлекшее по неосторожности гибель двух или более лиц останется под домашним арестом до ноября,2018-08-12 10:24:05,140865189,[]
3581,трагическая новость пришла сегодня на м году жизни скоропостижно скончался директор музея заповедника сталинградская битва депутат волгоградской областной думы алексей васин,2018-08-11 20:33:51,140865189,[]
3582,в регионах выборные кампании перешли в свою активную фазу агитационную а это значит что по всей стране выдвижения кандидатов завершены и можно подводить некоторые итоги,2018-08-11 15:28:03,140865189,[]
3583,появилась новая информация о жутком дтп которое унесло жизни семьи перчиевых из волжского,2018-08-11 13:20:24,140865189,[]
3584,дтп с массовой гибелью людей произошло накануне около,2018-08-11 12:17:12,140865189,[]
3585,в регионе фиксируется увеличение заболеваний связанных с укусами клещей,2018-08-11 12:00:06,140865189,[]
3586,режим ограничения пребывания граждан в лесах и въезда в них транспортных средств в регионе продлен с до августа,2018-08-11 09:36:11,140865189,[]
3587,с августа в волгоградской области открывается сезон охоты на болотно луговую полевую и степную дичь с собаками и ловчими птицами при том с одной собакой могут охотиться не более трех человек,2018-08-11 08:48:05,140865189,[]
3588,основные мероприятия состоятся и сентября а вообще отмечать годовщину волгограда горожане будут в течение двух недель,2018-08-11 08:35:06,140865189,[]
3589,стало известно что на годовое содержание стадиона необходимо порядка миллионов рублей в администрации региона разрабатывают план как сделать его самоокупаемым,2018-08-10 17:42:14,140865189,[]
3590,человек заявили о своем желании участвовать в предстоящих сентября выборах в волжскую городскую думу наряду с волгоградом и камышином это одна из самых масштабных избирательных кампаний в регионе,2018-08-10 17:20:07,140865189,[]
3591,на этой неделе в арбитражный суд волгоградской области поступило сразу исковых заявления от комитета по управлению государственным имуществом волгоградской области ответчиком в обоих случаях выступает ооо пересвет регион дон характер исков экономические споры по гражданским правоотношениям,2018-08-10 16:48:07,140865189,[]
3592,для малых и средних предприятий которые являются корпоративными клиентами альфа банка значительно упростилась процедура получения данных о статусе срочного платежа произведенного в рублях информирует финансовая организация,2018-08-10 16:33:21,140865189,[]
3593,августа центризбирком россии признал законными еще две формулировки вопроса для референдума против повышения пенсионного возраста,2018-08-10 16:16:49,140865189,[]
3594,в волгограде из за реконструкции центральной набережной проезжую часть на ее нижней террасе отгородили от стройплощадки защитным забором единственный пешеходный переход оказался недоступен,2018-08-10 15:28:02,140865189,[]
3595,необычная церемония состоялась на днях в сизо расположенном в красноармейском районе волгограда здесь прошло бракосочетание одного из подследственных со своей избранницей,2018-08-10 15:12:04,140865189,[]
3596,в субботу августа землян ожидает очередное солнечное затмение оно завершит так называемый коридор затмений в котором мы сейчас живем,2018-08-10 14:40:55,140865189,[]
3597,координатор проекта народная оценка качества общероссийского народного фронта онф виктор рожков предложил законодательно закрепить расположение некоторых кабинетов в медучреждениях на первом этаже,2018-08-10 13:52:04,140865189,[]
3598,в минувший четверг в волгограде во время совместного рейда сотрудников гибдд и судебных приставов был выявлен должник три с половиной года уклонявшийся от уплаты штрафов за нарушения дорожных правил,2018-08-10 13:20:09,140865189,[]
3599,в городе котельниково приступили к подготовительным работам на строительной площадке первого из трех спортивных объектов работы по проектированию современного спортивного центра на территории жилого района дубовая роща выполнила компания еврохим волгакалий,2018-08-10 13:04:21,140865189,[]
3600,рабочие приступили к заключительному этапу работ установив кабинок на долгожданном аттракционе,2018-08-10 12:32:55,140865189,[]
3601,в пятницу августа курс доллара показал новый максимум с августа года когда он превышал отметку в рублей,2018-08-10 11:44:02,140865189,[]
3602,сентября в волгограде пройдет фестиваль фейерверков приуроченный к ой годовщине города на радость публики небо раскрасят более тысяч салютных залпов,2018-08-10 11:28:02,140865189,[]
3603,в текущем году по инициативе минобороны на будут увеличены пособия на ритуальные расходы а также на приобретение памятников для сотрудников российских силовых структур,2018-08-10 11:12:08,140865189,[]
3604,небольшая передышка от жары для волгоградцев заканчивается принесенная северным ветром прохлада к выходным уйдет и к концу недели солнце снова будет припекать вовсю,2018-08-10 10:56:03,140865189,[]
3605,летие урюпинска дата солидная и отмечать ее будут с размахом на праздничном концерте который состоится сентября на площади ленина выступят сразу несколько звезд отечественной эстрады,2018-08-10 10:40:10,140865189,[]
3606,понедельник августа вдвойне окажется тяжелым для жителей дзержинского района волгограда у которых в этот день будет прекращено водоснабжение,2018-08-10 10:08:06,140865189,[]
3607,танкисты юво устроят показательное выступление с преодолением преград под водой,2018-08-09 18:40:31,140865189,[]
