4330,следователи со по светлоярскому району су скр региона завершили расследование уголовного дела по ч ст ук рф фальсификация доказательств по гражданскому делу,2018-07-05 14:40:08,140865189,[]
4331,новый сезон фнл стартует уже июля первый матч в волгограде ротор проведет июля с сегодняшнего дня на этот матч уже можно купить билет а также приобрести абонемент на весь сезон,2018-07-05 14:10:10,140865189,[]
4332,каждый месяц любой из нас непременно оплачивает счета за коммунальные услуги у кого то этот процесс занимает пару минут тогда как другим приходится платить за жкх не только деньгами но и собственным временем,2018-07-05 14:01:27,140865189,[]
4333,более тысячи иностранных болельщиков обратились в туристско информационные центры и специализированный колл центр за время проведения матчей чм в волгограде,2018-07-05 13:50:05,140865189,[]
4334,студенческие бригады проводников обслуживают поезда курсирующие в направлении москвы санкт петербурга и черноморского побережья,2018-07-05 13:40:06,140865189,[]
4335,в преддверии четвертьфинального матча чм между сборными россии и хорватии хорватское издание опубликовало статью в которой проанализировало экономические эффекты чемпионата,2018-07-05 13:20:09,140865189,[]
4336,в четверг июля волгоградский областной суд вынес свое окончательное решение по жалобе троих волжан осужденных за незаконную банковскую деятельность,2018-07-05 13:11:56,140865189,[]
4337,известный волгоградский музыкант композитор валерий турбин спел песню про знаменитую мошку,2018-07-05 13:00:43,140865189,[]
4338,инспекторы россельхознадзора вместе с таможенниками и сотрудниками транспортной прокуратуры обнаружили в одном из волгоградских магазинов фунт мяса запрещенную к ввозу в страну сельхозпродукцию,2018-07-05 12:50:06,140865189,[]
4339,известный волгоградский музыкант валерий турбин спел настоящий гимн мошке,2018-07-05 12:40:15,140865189,[]
4340,волгоградская область вошла в число субъектов рф где отмечается невысокий уровень первичной заболеваемости психическими расстройствами по количеству вновь выявленных психически больных на тысяч человек населения регион относится к категории наименее проблемных,2018-07-05 12:30:04,140865189,[]
4341,в четверг южный региональный центр мчс сообщил о введении в волгоградской области режима чрезвычайной ситуации из за сильной засухи,2018-07-05 12:20:08,140865189,[]
4342,завод по производству лент капельного орошения эмиттерного типа откроется в волгограде в году соответствующее инвестиционное соглашение уже заключено между администрацией региона и компанией ооо зеленый рост,2018-07-05 12:13:27,140865189,[]
4343,вот уже неделю родственники безуспешно пытаются разыскать летнего юрия петрова,2018-07-05 12:12:23,140865189,[]
4344,волгоградская госавтоинспекция разъяснила в каких случаях автомобилисты могут самостоятельно оформить дорожно транспортное происшествие по европротоколу,2018-07-05 10:50:11,140865189,[]
4345,аналитический центр левада центр выяснил какие событий за последний месяц наиболее всего запомнились россиянам,2018-07-05 10:20:02,140865189,[]
4346,более тысячи волонтеров участвовали в организации чемпионата мира по футболу в волгограде об этом накануне заявила анна губина ведущий специалист по работе с волонтерами волгоградского подразделения оргкомитета чм,2018-07-05 10:10:02,140865189,[]
4347,в волгоградскую область снова вернулась африканская чума свиней ачс на этот раз вспышка опасного для животных инфекционного заболевания выявлена в станице березовской даниловского района,2018-07-05 09:20:20,140865189,[]
4348,в триумфальном матче позволившем сборной россии продолжить выступление на домашнем чемпионате мира зрителей впечатлили игра вратаря акинфеева и жующее трио мужчин в кокшниках,2018-07-04 22:40:07,140865189,[]
4349,сервис бронирования жилья представил в среду рейтинг самых гостеприимных городов организаторов чемпионата мира по футболу,2018-07-04 18:01:24,140865189,[]
4350,июля года на пригородном вокзале ст волгоград в пройдет час пассажира посвященный дню семьи любви и верности,2018-07-04 17:31:32,140865189,[]
4351,трагически закончился отдых на воде для летнего жителя райцентра иловля накануне днем мужчина вместе с другом и двумя женщинами пришел на берег реки чтобы охладиться в зной,2018-07-04 17:21:06,140865189,[]
4352,снос старого пятиэтажного жилого фонда в москве названный красивым словом реновация критикуют как сами жители столицы так и эксперты среди них архитектор алексей кротов считающий что этот процесс экономически не оправдан,2018-07-04 16:50:08,140865189,[]
4353,после завершения группового этапа чм в многофункциональных центрах волгограда подсчитали сколько горожан воспользовались автопропусками для проезда в зону так называемой последней мили,2018-07-04 16:40:04,140865189,[]
4354,правительство рф внесло на рассмотрение государственной думы законопроект цель которого усовершенствовать систему осаго,2018-07-04 16:20:06,140865189,[]
4355,новоаннинский мрсо су скр региона завершил расследование уголовного дела в отношении летнего местного жителя который еще в году надругался над сыном своей приятельницы,2018-07-04 15:40:16,140865189,[]
4356,российская система качества роскачество объявила о начале масштабной проверки в стране качества арбузов одной из любимых сезонных ягод в россии,2018-07-04 15:00:23,140865189,[]
4357,в июне на горячую линию управления роспотребнадзора по волгоградской области поступило обращение меньше чем за предыдущие месяцы волгоградцы стали реже жаловаться на продажу некачественных товаров и кажется окончательно позабыли о клещах,2018-07-04 14:40:18,140865189,[]
4358,в среду июля волгоградский областной суд рассмотрел апелляционную жалобу ранее осужденного за мошенничество летнего председателя профсоюза работников народного образования и науки города камышина валерия радченко,2018-07-04 14:30:05,140865189,[]
4359,после вчерашнего заседания областной думы в волгограде разгорается полномасштабный скандал в ходе обсуждения вопроса о поддержке пенсионной реформы депутат александр осипов перешел на оскорбления в адрес другого парламентария михаила таранцова,2018-07-04 14:20:06,140865189,[]
4360,на въезде в ближайший к волгограду районный центр андрей бочаров лично осмотрел мост находящийся в аварийном состоянии,2018-07-04 14:00:44,140865189,[]
4361,руководство сети строительных гипермаркетов леруа мерлен временно отстранила от должности директора галину панину причиной такого решения стал скандал из за публикации сотрудницей в соцсети фейковой новости о футбольных болельщиках и названии россиян ватой на манер украинских националистов,2018-07-04 13:50:06,140865189,[]
4362,европейские болельщики вернувшиеся из россии после матчей чемпионата мира по футболу наперебой делятся впечатлениями в соцсетях и сми почти все иностранцы остались довольны пребыванием в россии они рассказывают о дружелюбной полиции приветливых местных жителях и качественной мобильной связи,2018-07-04 13:30:10,140865189,[]
4363,вот и подошел к концу наш конкурс время подвести итоги,2018-07-04 13:12:12,140865189,[]
4364,самая популярная в дни чм площадка города ушла на двухдневный отдых,2018-07-04 12:50:11,140865189,[]
4365,в среду июля центрального районного суда вынес приговор экс директору регионального филиала московского финансово юридического университета мфюа оксане коломок бравшей взятки со студентов,2018-07-04 12:10:13,140865189,[]
4366,туристическая полиция в волгограде помогла гостю из японии приехавшему в наш город на чм вернуть утерянный кошелек,2018-07-04 12:01:11,140865189,[]
4367,известный российский политик назвал фаворитов во всех оставшихся матчах чм по его мнению в борьбе за кубок участвуют не самые сильные команды,2018-07-04 11:30:07,140865189,[]
4368,в волгограде разработчики и дизайнеры транспортной карты волна решили изготовить ее мини вариант похожий на брелок для ключей,2018-07-04 11:20:10,140865189,[]
4369,депутаты волгоградской облдумы поддержали проект федерального закона об организации оказания первой помощи детям в образовательных учреждениях до прибытия скорой,2018-07-04 11:00:49,140865189,[]
4370,губернатор андрей бочаров поддержал предложение депутатов волгоградской областной думы об учреждении в регионе памятного знака за участие в подготовке и проведении чемпионата мира по футболу с соответствующей инициативой изначально выступили члены местного политсовета единой россии,2018-07-04 10:50:05,140865189,[]
4371,дополнительные средства в размере млн рублей будут направлены на финансирование сферы здравоохранения в волгоградской области такое решение было принято на вчерашнем заседании регионального парламента,2018-07-04 09:50:04,140865189,[]
4372,в россии почти азс недоливают бензин автомобилистам к такому выводу пришла федерация автовладельцев россии фар в результате проверки количества приобретенного топлива на заправках в субъектах рф,2018-07-04 09:30:19,140865189,[]
4373,находящийся на территории волгоградской области природный парк эльтонский претендует на включение в реестр всемирно известных биосферных резерватов,2018-07-04 09:10:09,140865189,[]
4374,во вторник июля в управлении роспотребнадзора по волгоградской области начала работу горячая линия по противодействию коррупции,2018-07-04 09:00:44,140865189,[]
4375,один из самых интересных матчей чм ожидает зрителей сегодня вечером в на стадионе открытие арена встретятся сборные англии и колумбии,2018-07-03 18:20:05,140865189,[]
4376,в честь праздника инспекторов дорожного движения сервис авито авто провел опрос среди водителей волгоградской области речь в опросе шла о поведении на дорогах автомобилистов чаще всего штрафуют за превышение скорости не пристегнутый ремень безопасности и разговоры по телефону,2018-07-03 18:00:56,140865189,[]
4377,на минувшей неделе в москве состоялось награждение лауреатов отраслевого конкурса предприятие горно металлургического комплекса высокой социальной эффективности который проводится при участии минпромторга рф почетное первое место в номинации развитие персонала занял волгоградский алюминиевый завод ок русал,2018-07-03 17:50:11,140865189,[]
4378,депутаты волгоградской областной думы не пришли к единому решению насчет того одобряют ли они предложенную правительством пенсионную реформу в поддержку законопроекта высказались только представители единой россии,2018-07-03 17:32:01,140865189,[]
4379,губернатор волгоградской области андрей бочаров совершил рабочую поездку в алексеевский район где реализуется важный инвестпроект по строительству завода ооо ньюбио после запуска производства предприятие по глубокой переработке кукурузного зерна сможет выпускать тысяч тонн продукции в год,2018-07-03 17:00:53,140865189,[]
4380,за время чм болельщики посетили центральную набережную более тысяч раз,2018-07-03 16:31:11,140865189,[]
4381,заказчик громкого убийства авторитетного бизнесмена сергея брудного летний александр геберт пойдет под суд в волгограде областная прокуратура уже утвердила обвинительное заключение по уголовному делу в его отношении,2018-07-03 16:20:03,140865189,[]
4382,во вторник июля всероссийский центр изучения общественного мнения вциом опубликовал результаты исследования социального самочувствия россиян в июне года,2018-07-03 16:01:21,140865189,[]
4383,несчастный случай со смертельным исходом произошел накануне на одном из химических предприятий волжского в результате происшествия летний рабочий погиб а его напарнику потребовалась срочная медицинская помощь,2018-07-03 15:50:04,140865189,[]
4384,волгоградский областной суд оставил в силе приговор вынесенный летнему гражданину азербайджана магомеду наджафову совершавшему разбойные нападения на женщин и его пособнику летнему соотечественнику замигу рагимову,2018-07-03 15:01:30,140865189,[]
4385,управление федеральной антимонопольной службы по волгоградской области вновь оштрафовало фгуп вгтрк за распространение некорректной рекламы биологически активной добавки офтальмин на радио россии ранее телерадиокомпания уже привлекалась к ответственности за аналогичные нарушения,2018-07-03 14:50:07,140865189,[]
4386,конкурс на выбор названия для обновленного мемориального парка у подножия мамаева кургана объявленный губернатором андреем бочаровым вызвал большой интерес у волгоградцев горожане предложили уже более различных вариантов от парка россии до парка чемпионов,2018-07-03 14:20:10,140865189,[]
4387,сегодня в волгоградском областном суде продолжились слушания по делу волжского расчленителя александра масленникова который осенью прошлого года убил двух молодых жительниц города волжского,2018-07-03 14:00:50,140865189,[]
4388,у россии есть все необходимое чтобы создать альтернативный интернет если запад продолжит политику насаждения двойных стандартов,2018-07-03 13:30:33,140865189,[]
4389,за лет в нашей стране по данным росстата закрылось тысяч школ большинство на селе где из за проводимой оптимизации перестали существовать тыс образовательных учреждений причем этот процесс приводит к исчезновению и самих деревень утверждают эксперты,2018-07-03 13:00:33,140865189,[]
4390,в среду июля три улицы краснооктябрьского района волгограда на шесть часов останутся без воды,2018-07-03 12:31:04,140865189,[]
4391,депутаты волгоградской городской думы собираются в конце весенней сессии вновь внести поправки в бюджет на текущий год,2018-07-03 12:00:10,140865189,[]
4392,после победы сборной россии над испанией в финала чм некоторые болельщики от безумной радости буквально сходили с ума и нарушали общепринятые нормы общественного поведения,2018-07-03 11:50:02,140865189,[]
4393,хотя футбол игра по большей части светская и приземленная время от времени здесь можно наблюдать божественное вмешательство как и все чудеса происходит оно в ключевые моменты матчей,2018-07-03 11:10:04,140865189,[]
4394,во вторник июля краснослободский районный суд признал виновным в покушении на мошенничество с использованием служебного положения ч ст ч ст ук рф теперь уже бывшего председателя местной думы андрея бондарева,2018-07-03 10:40:15,140865189,[]
4395,накануне осьминога оракула предсказывавшего результаты сборной японии на чемпионате мира по футболу его владелец кисуо абэ безжалостно пустил под нож,2018-07-03 10:10:10,140865189,[]
4396,накануне в красноармейском районе фирма подрядчик приступила к демонтажу старого тротуарного покрытия на территории парка юбилейного,2018-07-03 09:30:30,140865189,[]
4397,команда роберта евдокимова продолжает готовиться к началу нового сезона фнл на этот раз ротор оказался сильнее долгопрудного,2018-07-03 09:20:13,140865189,[]
4398,болельщикам расскажут о том как важно заботиться об экологии и бережно хранить природные достопримечательности региона,2018-07-03 09:00:08,140865189,[]
4399,супружеская пара из челябинска не пережила мундиаль к счастью со здоровьем уральцев все нормально но семейный очаг оказался погашен случилось это во время матча аргентина нигерия,2018-07-02 21:50:07,140865189,[]
4400,настоящим спасением от душного и сухого волгоградского лета станут кратковременные дожди на этой неделе,2018-07-02 18:20:11,140865189,[]
4401,прокуратура волгоградской области предложила депутатам регионального парламента принять дополнительные меры по ограничению распространения электронных сигарет в подростковой среде,2018-07-02 18:00:41,140865189,[]
