0,волгоград арена это не только про футбол,2019-01-30 09:42:43,140865189,[]
1,мы опросили жителей волгограда и выделили топ проблем города,2019-02-01 15:52:37,140865189,[]
2,второй день в волгоградском областной суде продолжается аттракцион не слыханного человеколюбия и снисходительности к обвиняемым,2019-02-01 15:40:30,140865189,[]
3,есть только две бесконечные вещи вселенная и глупость хотя насчет вселенной я не уверен альберт эйнштейн,2019-02-01 14:28:20,140865189,[]
4,завтра пройдут мероприятия посвященные годовщине сталинградской битвы,2019-02-01 14:10:08,140865189,[]
5,тупость сложно измерить,2019-02-01 13:27:12,140865189,[]
6,телевидение как достоверный источник информации уже давно ушел в прошлое говорящим головам верят все меньше населения,2019-02-01 12:11:20,140865189,[]
7,вот этот герой сейчас находится в ворошиловском районе у комитета по делам территориальных образований,2019-02-01 11:14:05,140865189,[]
8,волна минирований продолжается,2019-02-01 10:07:13,140865189,[]
9,в волгограде начались официальные мероприятия в честь летия победы в сталинградской битве возложение цветов к вечному огню в зале воинской славы на мамаевой кургане,2019-02-01 09:23:35,140865189,[]
10,в волгограде остаются только самые стойкие,2019-02-01 08:56:15,140865189,[]
11,доброе утро волгоград и с пятницей,2019-02-01 08:25:03,140865189,[]
12,в волгоградском роторе может появиться первый легионер,2019-01-31 21:30:53,140865189,[]
13,глава тпп рф назвал условие продвижения брендов малых городов и поселений,2019-01-31 18:50:16,140865189,[]
14,флешмоб победа молодежь волгограда по своему отметит подвиг сталинградцев,2019-01-31 18:31:51,140865189,[]
15,житель волгоградской области может сесть в тюрьму из за случайно найденной конопли,2019-01-31 18:10:33,140865189,[]
16,питание школьников не только источник постоянной головной боли для их родителей но и прибыльный бизнес операторы питания зарабатывают сотни миллионов рублей на обслуживании учреждений и ради госконтрактов готовы на все,2019-01-31 17:37:36,140865189,[]
17,мэрия обещает,2019-01-31 17:00:00,140865189,[]
18,компания газпром межрегионгаз волгоград нашла оригинальный способ побудить горожан к заключению договоров на техобслуживание,2019-01-31 15:25:14,140865189,[]
19,есть вещи которые мы повторяем ежемесячно и настолько привыкли что не замечаем,2019-01-31 14:42:50,140865189,[]
20,казалось бы простой аспект жизни школьное питание,2019-01-31 14:22:28,140865189,[]
21,эвакуированы так же европа сити молл парк хаус и пирамида,2019-01-31 13:00:45,140865189,[]
22,губернатор посетил кванториум открывшийся в декабре и лично убедился как проходят занятия у молодых ученых,2019-01-31 12:59:27,140865189,[]
23,мы вчера напоминали вам что опг это не только про е,2019-01-31 11:31:34,140865189,[]
24,волгоград сити так же эвакуирован,2019-01-31 10:35:17,140865189,[]
25,в краснооктябрьском районе в две школы поступили заявления о бомбе,2019-01-31 10:09:52,140865189,[]
26,жительница города петров вал нашла пачку поддельных пятитысячных купюр,2019-01-31 09:49:05,140865189,[]
27,ииииии к новостям погоды,2019-01-31 09:01:42,140865189,[]
28,доброе утро волгоград,2019-01-31 08:56:05,140865189,[]
29,акцию по обмену монет на банкноты проведет в волгограде альфа банк,2019-01-30 18:50:27,140865189,[]
30,ск взялся за клан арашуковых построивших империю на хищениях в газпроме,2019-01-30 18:32:25,140865189,[]
31,февраля на улицы сталинграда вновь выйдет взвод девушек регулировщиц,2019-01-30 18:10:07,140865189,[]
32,пройдет зима настанет лето,2019-01-30 16:11:01,140865189,[]
33,сенатор от карачаево черкесии рауф арашуков и его отец депутат парламента республики рауль арашуков задержаны,2019-01-30 15:32:24,140865189,[]
34,общая закредитованность населения вызывает опасения,2019-01-30 13:58:22,140865189,[]
35,зимние пожары не прекращаются,2019-01-30 13:01:07,140865189,[]
36,нам обещают много качественных овощей из ультрасовременных нанотеплиц,2019-01-30 11:50:50,140865189,[]
37,бордели до сих пор в голове представляются чем то где непременно есть кан как и бурлеск,2019-01-30 10:37:32,140865189,[]
38,центральную набережную скоро перекроют из за празднования годовщины победы в сталинградской битве,2019-01-30 08:36:33,140865189,[]
39,,2019-01-30 07:51:22,140865189,
40,в центре волгограда детей из задымленного подъезда спасали с помощью автолестницы,2019-01-29 23:31:14,140865189,[]
41,в волгограде облсуд вынес важное решение по акциям завода красный октябрь,2019-01-29 18:54:41,140865189,[]
42,волгоградцы пробегут километров за сталинград,2019-01-29 18:30:16,140865189,[]
43,более волгоградских семей наблюдают за своим домом с помощью сервиса ростелекома,2019-01-29 18:10:16,140865189,[]
44,мы продолжаем внимательно следить за ситуацией на красном октябре,2019-01-29 17:01:08,140865189,[]
45,два брата руководители фирм уклонялись от налогов на сумму миллионов рублей,2019-01-29 13:47:32,140865189,[]
46,продолжается подготовка к празднованию годовщины победы в сталинградской битве,2019-01-29 12:41:46,140865189,[]
47,левый фронт кпрф яблоко сторонники навального,2019-01-29 11:58:07,140865189,[]
48,итоги нашего конкурса прямо перед вами,2019-01-29 10:33:42,140865189,[]
49,ростелеком в волгограде выступил партнером праздничного мероприятия посвященного дню российского студенчества татьянин лед которое состоялось на ледовом катке волчок,2019-01-29 10:13:44,140865189,[]
50,подорожание затронуло и новостройки,2019-01-29 09:55:20,140865189,[]
51,дорожники отдуваются после прихотей погоды,2019-01-29 08:58:37,140865189,[]
52,,2019-01-29 07:34:12,140865189,
53,пересчитают но не всем и по разному волгоградцам обещают компенсацию за горы мусора,2019-01-28 22:10:43,140865189,[]
54,на первом демо дне акселератора сбербанк представит лучших стартапов,2019-01-28 21:50:30,140865189,[]
55,лет как одна жизнь волгоградский алюминиевый отметил юбилей,2019-01-28 19:10:05,140865189,[]
56,в году портфель привлеченных средств физлиц альфа банка вырос на,2019-01-28 18:50:33,140865189,[]
57,врукопашную против наркотиков подростки волгограда забрали кубок отряда спецназа,2019-01-28 18:30:14,140865189,[]
58,благодаря новобранцу ротор одержал победу на сборе над балтикой,2019-01-28 18:10:07,140865189,[]
59,на улицах и дорогах города лежит снег значительно затрудняющий передвижение и повышающий вероятность аварий,2019-01-28 16:01:22,140865189,[]
60,говорят книга лучший подарок,2019-01-28 14:07:11,140865189,[]
61,типичная ситуация для грядущего месяца,2019-01-28 12:55:08,140865189,[]
62,волгоград студенческий город,2019-01-28 11:15:26,140865189,[]
63,если вам кажется что сегодня неплохая погода ну так это не надолго,2019-01-28 10:37:30,140865189,[]
64,со следующего месяца а он уже через дня повысятся пособия,2019-01-28 10:06:24,140865189,[]
65,подвели итоги прошедшей недели января волгоград тонет в мусоре дороги в снегу а гололед убивает людей,2019-01-28 09:36:02,140865189,[]
66,доброе утро город герой,2019-01-28 07:32:03,140865189,[]
67,на кубке сталинграда лидеры отечественной легкой атлетики подтвердили свой статус,2019-01-27 21:20:25,140865189,[]
68,подвели итоги прошедшей недели января волгоград тонет в мусоре дороги в снегу а гололед убивает людей,2019-01-27 18:20:05,140865189,[]
69,в волгоградской области военные освободили из снежного плена две деревни,2019-01-27 16:20:12,140865189,[]
70,на юге волгограда после страшного лобового удара разворотило машину такси и,2019-01-27 13:20:07,140865189,[]
71,волгоградских водителей предупредили о возможном осложнении дорожной обстановки,2019-01-27 11:40:16,140865189,[]
72,рабочая неделя в волгограде начнется со снега и ледяного дождя,2019-01-27 11:20:13,140865189,[]
73,дня горя и мужества в волгограде отмечают летие снятия блокады ленинграда,2019-01-27 11:00:08,140865189,[]
74,в прошлом году зарплаты волгоградцев увеличились в среднем на,2019-01-27 10:40:26,140865189,[]
75,волгоградский мусорный регоператор заплатит млн рублей за аренду грузовиков,2019-01-27 10:03:27,140865189,[]
76,волгоградцы завидуют волжанам из за расчистки улиц от гололеда,2019-01-26 16:40:10,140865189,[]
77,в волгоградской области безграмотные чиновники собираются среди зимы удолять камыш,2019-01-26 14:20:11,140865189,[]
78,трассы волгоградской области очищают от снега более трехсот спецмашин,2019-01-26 14:01:36,140865189,[]
79,в волгограде маршрутка с пассажирами влетела в грузовик двое раненых,2019-01-26 12:40:31,140865189,[]
80,кому я должен всем прощаю волгоградские депутаты резво заплатили все налоги,2019-01-26 12:20:12,140865189,[]
81,волгоградцев заранее готовят к необходимости работать на пенсии,2019-01-26 11:40:50,140865189,[]
82,надуманные поборы единороссы не поддержали идею о платной регистрации телефонов,2019-01-26 11:20:13,140865189,[]
83,в волгограде культурно отпразднуют летие победы в сталинградской битве,2019-01-26 10:20:20,140865189,[]
84,нашли каждого бобра в волгоградской области экологи пересчитали мохнатых пловцов,2019-01-26 10:04:01,140865189,[]
85,бензовоз и камаз насмерть сбили человека на трассе в волгоградской области,2019-01-26 09:40:13,140865189,[]
86,нужен лом новые машины не справляются с толстой неледью на волгоградских тротуарах,2019-01-26 07:20:20,140865189,[]
87,бессовестные мошенницы до нитки обокрали волгоградского пенсионера долгожителя,2019-01-25 18:50:26,140865189,[]
88,куры на взлет хлеб на очереди после нового года цены на продукты пошли вверх,2019-01-25 18:30:44,140865189,[]
89,молодые клиенты втб стали в шесть раз активнее использовать мобильное приложение,2019-01-25 18:10:30,140865189,[]
90,танки как известно грязи не боятся,2019-01-25 15:35:27,140865189,[]
91,сегодня стартовал прием детей в первые классы школ,2019-01-25 14:25:24,140865189,[]
92,привычная к сожалению для нас вещь,2019-01-25 13:23:26,140865189,[]
93,возможно возможно но еще не точно нас спасут от гололеда,2019-01-25 12:29:49,140865189,[]
94,управляющих компаний за прошлый год лишились лицензий,2019-01-25 11:17:59,140865189,[]
95,очередной пожар и в очередной раз дети,2019-01-25 10:33:27,140865189,[]
96,спустя сутки после начала метели движение на всех трассах удалось восстановить,2019-01-25 09:10:20,140865189,[]
97,доброе утро волгоград сегодня пятница поэтому ловите котов и порадуйтесь последнему рабочему дню,2019-01-25 06:59:39,140865189,[]
98,по итогам года портфель втб лизинг по направлению автолизинг увеличился на до тысячи единиц техники всего юридические лица и индивидуальные предприниматели получили в лизинг порядка тысяч транспортных средств,2019-01-25 06:43:00,140865189,[]
99,втб повысил на п п ставки по двум вкладам в рублях при размещении на срок от до дней,2019-01-24 22:43:00,140865189,[]
100,выехали на подмогу экипажи дпс направлены на сложные участки трассы под волгоградом,2019-01-24 22:10:10,140865189,[]
101,на севере волгоградской области спецмашин ведут расчистку автодорог от снега,2019-01-24 18:50:17,140865189,[]
102,в волгограде водителей и пешеходов просят проявлять бдительность и осторожность,2019-01-24 18:31:48,140865189,[]
103,инициатива не наказуема в волгограде поддержат молодых предпринимателей и студентов,2019-01-24 18:10:06,140865189,[]
104,метель продолжается,2019-01-24 16:31:07,140865189,[]
105,госдума приняла в первом чтении законопроект о штрафах за распространение фейковых новостей,2019-01-24 15:00:08,140865189,[]
106,переплата в миллион рублей за три года,2019-01-24 13:31:42,140865189,[]
107,впервые с года количество россиян уменьшилось все последующие года число населения непременно росло,2019-01-24 12:24:03,140865189,[]
108,в городе ставят депутатские остановки произведенные на заводе одного из депутатов города,2019-01-24 11:24:49,140865189,[]
109,вы видели эти многочисленные объявления о материнском капитале со скользкими формулировками об обналичивании,2019-01-24 10:58:35,140865189,[]
110,машин очищают областные дороги от снега,2019-01-24 10:16:49,140865189,[]
111,ремонт центральной набережной идет полным ходом,2019-01-24 09:37:39,140865189,[]
112,,2019-01-24 08:24:09,140865189,
113,хотели праздника волгоградских студентов прокатят на татьянин день,2019-01-23 18:50:15,140865189,[]
114,елку на площади павших борцов разобрали,2019-01-23 18:49:30,140865189,[]
115,свет камера гол в волгограде проходят съемки документального кино о футболе,2019-01-23 18:31:05,140865189,[]
116,волгоградский ротор летит в турцию на второй сбор с новым тренером и без молодежи,2019-01-23 18:10:30,140865189,[]
117,в калмыкии смогли,2019-01-23 16:50:18,140865189,[]
118,у гололеда сковавшего город уже есть жертвы,2019-01-23 15:04:06,140865189,[]
119,итак не секрет что обслуживанием города занимаются концессионеры,2019-01-23 13:12:26,140865189,[]
120,волгоград потратил миллиардов на продукты в прошлом году,2019-01-23 12:41:54,140865189,[]
121,волгоградцы организовали сбор средств для матери одиночки чей двухлетний сын погиб в пожаре,2019-01-23 12:04:26,140865189,[]
122,банк втб стал победителем в номинации прорыв года в розничном финансовом бизнесе х ежегодной премии которую вручает журнал за достижения в области финансового бизнеса в россии,2019-01-23 11:05:05,140865189,[]
123,хакер из иловлинского района попробовал взломать сайт правительства,2019-01-23 10:17:53,140865189,[]
124,те фирмы которые чуть ли не силой пытались заставить установить новые счетчики теперь будут оправдываться сами,2019-01-23 09:21:53,140865189,[]
125,доброе скользкое утро волгоград,2019-01-23 08:28:36,140865189,[]
126,спасти волгоградские дворы от обледенения призвана муниципальная техника,2019-01-22 18:50:24,140865189,[]
127,в волгограде бывший следователь за миллионную взятку отправится в колонию на лет,2019-01-22 18:30:08,140865189,[]
128,власти готовы отдать волгоградским предпринимателям почти две тысячи участков земли,2019-01-22 18:10:52,140865189,[]
129,если вы простудились или не выспались то банкомат вас может и не признать,2019-01-22 15:57:53,140865189,[]
130,волгоград сковал гололед а сегодня утром гололед стал еще опаснее город простоял в пробках все утро,2019-01-22 14:41:47,140865189,[]
131,новый конкурс,2019-01-22 14:06:56,140865189,[]
132,в день студента студенты и татьяны могут посетить музей россия моя история бесплатно тем более там тоже будет день студента,2019-01-22 13:28:28,140865189,[]
133,в краснослободске произошел пожар погиб двухлетний ребенок,2019-01-22 12:53:55,140865189,[]
134,шагает по миру и в рамках этого челленджа сравнили наши заголовки из года с современным положением дел,2019-01-22 12:20:37,140865189,[]
135,на поддержку инвалидов до го года потратят миллиона,2019-01-22 10:27:22,140865189,[]
136,сегодня было пусть и холодное скользкое утро зато красивое,2019-01-22 10:02:43,140865189,[]
137,после дождя и нового уровня гололеда город встал в пробках,2019-01-22 08:57:35,140865189,[]
138,,2019-01-22 07:37:08,140865189,
139,дорожники волгоградской области готовятся к сложным метеоусловиям,2019-01-21 23:31:33,140865189,[]
140,в домах жк норд в ростове на дону обнаружили трещины,2019-01-21 21:31:54,140865189,[]
141,волгоград застрял в ых у остановки дом техники решили не менять название,2019-01-21 19:32:25,140865189,[]
142,легкоатлеты на старт олимпийские чемпионы и юниоры поспорят за кубок сталинграда,2019-01-21 18:50:07,140865189,[]
143,волгоградский коммерсант нафантазировал целый склад ради крупного кредита,2019-01-21 18:30:26,140865189,[]
144,лет спустя в музее панораме волгоградцам вновь покажут символы победы,2019-01-21 18:10:13,140865189,[]
145,тем временем траншеи разрытые в конце лета начале осени отпраздновали новый год и продолжают жить и дальше,2019-01-21 16:57:01,140865189,[]
146,мы много пишем о проблемах города весь январь то про лед то про мусор,2019-01-21 14:13:02,140865189,[]
147,семен набиркин осужденный по статье насильственные действия сексуального характера дал нам интервью,2019-01-21 12:46:06,140865189,[]
148,на проблему мусора обратил внимание даже губернатор,2019-01-21 12:11:02,140865189,[]
149,ротор один из пяти самых посещаемых клубов в россии,2019-01-21 11:35:11,140865189,[]
150,до весны еще долго,2019-01-21 10:25:16,140865189,[]
151,а вот и итоги нашего конкурса,2019-01-21 09:19:29,140865189,[]
152,банк втб помогает сельскому хозяйству области,2019-01-21 08:57:43,140865189,[]
153,доброе утро волгоград помните пока вы на работе ваши коты дома и в тепле,2019-01-21 08:01:45,140865189,[]
154,концессии теплоснабжения нагреют цирк на млн рублей,2019-01-20 23:20:03,140865189,[]
155,итоги недели мусор во дворах гололед на улицах новые назначения и крещение,2019-01-20 19:40:24,140865189,[]
156,в праздник крещения в перинатальном центре волгограда на свет появились детей,2019-01-20 12:03:24,140865189,[]
