1553,в россии проходит единый день голосования,2016-09-18 13:11:18,42564785,[]
1554,глава адыгеи встретился с членами мониторинговой группы совета при президенте рф по развитию гражданского общества и правам человека,2016-09-18 10:15:49,42564785,[]
1555,аслан тхакушинов призвал жителей адыгеи к участию в едином дне голосования,2016-09-16 18:14:23,42564785,[]
1556,аслан тхакушинов дал интервью российской газете,2016-09-15 18:10:12,42564785,[]
1557,в адыгее ищут подозреваемого в незаконных операциях с наркотиками,2016-09-15 12:13:57,42564785,[]
1558,в адыгее обсудили проблемы высшего образования,2016-09-14 18:10:05,42564785,[]
1559,команда из майкопа одержала победу на фестивале детского футбола,2016-09-14 17:08:53,42564785,[]
1560,глава республики направил обращение к участникам парада российского студенчества в адыгее,2016-09-13 21:11:20,42564785,[]
1561,в выходные дни на территории адыгеи сухая трава горела более раз,2016-09-13 14:14:35,42564785,[]
1562,в майкопе бухгалтер госучреждения обманным путем заработала более миллионов рублей,2016-09-12 20:08:05,42564785,[]
1563,мусульмане адыгеи отмечают курбан байрам,2016-09-12 15:11:19,42564785,[]
1564,поздравление начальника главного управления мчс россии по республике адыгея полковника султана хацукова с праздником курбан байрам,2016-09-12 13:15:38,42564785,[]
1565,производство гипсовых материалов обсудили на конференции в майкопе,2016-09-10 15:11:23,42564785,[]
1566,в адыгее выросло количество зарегистрированных преступлений,2016-09-10 13:09:27,42564785,[]
1567,возгорания сухой травы ликвидированы,2016-09-09 14:12:23,42564785,[]
1568,шпаклевку и штукатурку из гипса которые раньше завозили из финляндии теперь производят российские предприятия,2016-09-09 13:14:50,42564785,[]
1569,глава адыгеи принял участие в международной научно практической конференции по гипсу,2016-09-08 20:08:10,42564785,[]
1570,берегись автомобиля,2016-09-08 13:08:50,42564785,[]
1571,кубань и адыгея подписали соглашение о сотрудничестве в сфере туризма,2016-09-07 20:08:06,42564785,[]
1572,в адыгее в аварии с маршруткой погибли три человека,2016-09-07 13:15:17,42564785,[]
1573,причиной возгорания стало замыкание электропроводки,2016-09-06 20:07:35,42564785,[]
1574,глава республики принял муфтия адыгеи и краснодарского края,2016-09-06 19:08:21,42564785,[]
1575,в адыгее прошла акция кавказ без опасности,2016-09-06 10:10:44,42564785,[]
1576,житель адыгеи вырастил во дворе дома кустов конопли,2016-09-05 18:12:49,42564785,[]
1577,за выходные спасатели семь раз выезжали на тушение сухой травы,2016-09-05 17:09:15,42564785,[]
1578,баталина выплата в пять тысяч рублей закроет обязательства перед пенсионерами в текущем году,2016-09-05 14:12:08,42564785,[]
1579,дмитрий козак провел в майкопе рабочее совещание,2016-09-03 20:07:52,42564785,[]
1580,мурат псеунов стал заслуженным тренером адыгеи,2016-09-02 12:12:15,42564785,[]
1581,спасатель с большой буквы,2016-09-02 11:08:00,42564785,[]
1582,глава адыгеи поздравил жителей республики с днем знаний,2016-09-01 16:13:22,42564785,[]
1583,глава адыгеи вручил олимпийским чемпионам беслану мудранову и виктории калининой государственные награды и денежные премии,2016-08-31 19:09:08,42564785,[]
1584,вышли на свет,2016-08-31 15:10:28,42564785,[]
1585,моцарелла блечепсин душистый чай и хорошее настроение,2016-08-31 02:07:09,42564785,[]
1586,участники свадебного кортежа допустившие грубые нарушения пдд в адыгее будут наказаны,2016-08-30 19:10:40,42564785,[]
1587,подарок к юбилею республики,2016-08-30 11:08:38,42564785,[]
1588,в прокуратуре республики адыгея продолжает работу мобильная приемная,2016-08-29 20:12:13,42564785,[]
1589,праздник адыгейского сыра открывается сегодня на площадке тк графская поляна в районе станицы даховской,2016-08-29 19:10:28,42564785,[]
1590,отвечающий всем нормам экологической безопасности гипсовый завод волма майкоп открыл в адыгее производство импортозамещающей продукции,2016-08-29 18:10:31,42564785,[]
1591,глава адыгеи встретился с лидером группы любэ,2016-08-27 15:07:23,42564785,[]
1592,в майкопе страхового агента обвиняют в мошенничестве,2016-08-26 15:07:26,42564785,[]
1593,известный альпинист адыгеи сумел покорить пик победы,2016-08-26 14:10:24,42564785,[]
1594,глава адыгеи принял участие в заседании совета старейшин ра,2016-08-26 12:15:10,42564785,[]
1595,кубаньэнерго обеспечило техприсоединение гипсового завода волма в адыгее,2016-08-25 11:08:36,42564785,[]
1596,в адыгее отметили день флага россии,2016-08-24 15:12:44,42564785,[]
1597,торопитесь медленно,2016-08-24 11:07:39,42564785,[]
1598,происшествие на воде,2016-08-23 15:11:16,42564785,[]
1599,из глубины веков,2016-08-22 17:08:25,42564785,[]
1600,в выходные дни пожарные спасатели участвовали в ликвидации последствий трех дтп,2016-08-22 15:07:53,42564785,[]
1601,экстренное предупреждение,2016-08-21 15:06:05,42564785,[]
1602,аслан тхакушинов принял участие в открытии распределительных центров южный и адыгея,2016-08-19 21:07:34,42564785,[]
1603,новый руководитель наркоконтроля в адыгее дал первую пресс конференцию,2016-08-19 15:09:47,42564785,[]
1604,приглашаем на день черкесской груши,2016-08-19 12:14:47,42564785,[]
1605,выпускника из адыгеи получили целевые направления в медвузы россии,2016-08-18 19:09:48,42564785,[]
1606,спасатели адыгеи предупреждают о сильных ливнях с грозами и градом,2016-08-18 14:09:46,42564785,[]
1607,по факту жестокого обращения с девочкой сиротой в адыгее возбудили дело,2016-08-18 12:09:56,42564785,[]
1608,в г майкопе житель города сочи осужден к лишению свободы за сбыт поддельных банковских купюр,2016-08-18 11:08:38,42564785,[]
1609,полиция республики проведет рейды по выявлению нетрезвых водителей,2016-08-17 16:08:56,42564785,[]
1610,школы в адыгее завершают подготовку к новому учебному году,2016-08-17 12:11:37,42564785,[]
1611,летняя жительница адыгеи погибла при падении в шестого этажа,2016-08-16 19:08:25,42564785,[]
1612,председатель цик ра доложил главе адыгеи о ходе подготовки к единому дню голосования,2016-08-16 11:09:12,42564785,[]
1613,объявление о проведении квалификационного экзамена для лиц желающих заниматься нотариальной деятельностью,2016-08-16 04:05:48,42564785,[]
1614,глава адыгеи обсудил с руководителями правоохранительных органов вопросы обеспечения безопасности в период выборов,2016-08-16 00:06:53,42564785,[]
1615,в агробизнес инкубатор адыгеи начали впускать арендаторов на конкурсной основе,2016-08-15 19:07:01,42564785,[]
1616,ректор мгту принимает поздравления с днем рождения,2016-08-12 16:08:03,42564785,[]
1617,в майкопе лжецелительницы обманывали доверчивых старушек,2016-08-12 13:07:18,42564785,[]
1618,глава адыгеи встретился с представителями армянской диаспоры,2016-08-11 19:07:15,42564785,[]
1619,в горах адыгеи прошла патриотическая акция,2016-08-11 14:15:46,42564785,[]
1620,в адыгее вора укравшего мобильник приговорили к годам колонии,2016-08-10 17:30:07,42564785,[]
1621,в адыгее сохраняется высокая пожароопасность,2016-08-10 14:12:15,42564785,[]
1622,в адыгее впервые ливанские школьники прошли обучающий курс по русскому языку,2016-08-10 13:11:00,42564785,[]
1623,с помощью служебной собаки в адыгее нашли тайник с наркотиками,2016-08-09 17:10:32,42564785,[]
1624,золото беслана,2016-08-09 11:09:21,42564785,[]
1625,в адыгее участились случаи мошенничества через интернет,2016-08-08 20:19:04,42564785,[]
1626,глава адыгеи проинспектировал ход реконструкции дорог в республиканской столице,2016-08-08 19:16:15,42564785,[]
1627,руководство и жители адыгеи поздравили беслана мудранова с победой,2016-08-08 16:16:39,42564785,[]
1628,беслан мудранов первое золото в рио выпускник майкопского агу факультет ифк дзюдо,2016-08-07 16:12:28,42564785,[]
1629,огнестрел с летальным исходом в майкопском районе,2016-08-05 18:12:09,42564785,[]
1630,в школах адыгеи появятся медицинские классы,2016-08-05 17:26:37,42564785,[]
1631,глава адыгеи встретился с ректором юго осетинского госуниверситета,2016-08-04 18:17:13,42564785,[]
1632,фестиваль игры фишта стартует в адыгее,2016-08-04 15:33:18,42564785,[]
1633,в майкопе осужден водитель по вине которого погибли человека,2016-08-03 17:20:22,42564785,[]
1634,долгожителя адыгеи получат в августе поздравление от владимира путина с юбилеем,2016-08-03 12:10:50,42564785,[]
1635,аслан тхакушинов вручил паспорт гражданина рф известной велогонщице бывшей жительнице донецкой области,2016-08-02 21:09:41,42564785,[]
1636,стали известны подробности гибели мальчика на карьере в косинове,2016-08-02 12:13:47,42564785,[]
1637,в майкопе произошла авария есть пострадавший,2016-08-01 21:06:29,42564785,[]
1638,там где всегда ждут,2016-08-01 20:10:56,42564785,[]
1639,августа адыгея отметит день репатрианта,2016-07-31 22:06:26,42564785,[]
1640,в адыгее пропала летняя пенсионерка,2016-07-29 18:08:06,42564785,[]
1641,глава адыгеи принял участие в открытии нового памятника в краснодаре,2016-07-29 13:11:20,42564785,[]
1642,успешно сдали сессию,2016-07-28 13:09:05,42564785,[]
1643,глава адыгеи встретился с представителями репатриантов,2016-07-28 12:18:32,42564785,[]
1644,житель адыгеи убил топором собственного сына,2016-07-27 17:45:16,42564785,[]
1645,пенсионер из адыгеи убил топором собственного сына,2016-07-27 12:12:40,42564785,[]
1646,глава адыгеи дал ряд поручений по подготовке празднования летия республики,2016-07-26 19:12:34,42564785,[]
1647,в адыгее лжесоцработница обобрала пенсионерку на тысяч рублей,2016-07-26 15:11:54,42564785,[]
1648,итоги подведены задачи поставлены,2016-07-26 14:12:34,42564785,[]
1649,состоялось заседание коллегии прокуратуры республики адыгея посвященное итогам работы за полугодие года,2016-07-25 17:10:08,42564785,[]
1650,расширенное заседание коллегии прокуратуры республики адыгея,2016-07-25 16:09:07,42564785,[]
1651,глава адыгеи принял участие в запуске электроподстанции которая запитает два крупных инвестобъекта,2016-07-22 19:10:07,42564785,[]
1652,в адыгее перекрыт канал поставки наркотиков в одну из колоний фото,2016-07-22 09:18:32,42564785,[]
1653,в адыгее директор лицея получал зарплату за несуществующих работников,2016-07-21 19:23:14,42564785,[]
1654,в адыгее поддержали идею создания ассамблеи черноморско кавказских народов,2016-07-21 14:13:52,42564785,[]
1655,премьер министр адыгеи не доволен работой ведомств по улучшению инвестиционного климата в регионе,2016-07-20 21:08:01,42564785,[]
1656,утонул ребенок,2016-07-20 13:19:32,42564785,[]
1657,адыгея примет финал чемпионата россии по автогонкам,2016-07-19 20:14:48,42564785,[]
1658,жители региона вправе ожидать повышения эффективности работы полиции,2016-07-19 16:20:43,42564785,[]
1659,за минувшие выходные в адыгее утонуло человека,2016-07-18 20:18:18,42564785,[]
1660,в связи с сухой жаркой погодой в адыгее объявлен третий класс пожарной опасности,2016-07-18 18:24:36,42564785,[]
1661,премьер министр республики встретился с ребятами летнего лагеря отдыха на турбазе горная,2016-07-18 17:19:40,42564785,[]
1662,в ханской при пожаре пострадал один человек,2016-07-18 13:29:44,42564785,[]
1663,в турции произошла попытка государственного переворота хроника,2016-07-16 16:19:36,42564785,[]
1664,премьер министр адыгеи посетил детский оздоровительный лагерь горный,2016-07-15 23:15:22,42564785,[]
1665,глава адыгеи принял участие в церемонии вручения знамени уфсин россии по ра,2016-07-15 16:08:39,42564785,[]
1666,поздравления главе адыгеи,2016-07-15 08:08:43,42564785,[]
1667,двух мужчин осудили за разбойное нападение на офисы микрозаймов в адыгее,2016-07-14 14:12:31,42564785,[]
1668,валентина матвиенко поздравила главу адыгеи с днем рождения,2016-07-13 22:06:55,42564785,[]
1669,единая россия выдвинула списки кандидатов в госсовет хасэ адыгеи,2016-07-13 15:12:37,42564785,[]
1670,премьер министр адыгеи потребовал установить жесткий контроль за качеством ремонта дорог,2016-07-12 18:33:10,42564785,[]
1671,житель адыгеи обвиняется в убийстве односельчанина,2016-07-12 15:11:28,42564785,[]
1672,глава адыгеи принял участие во втором этапе конференции аро партии единая россия,2016-07-11 20:14:44,42564785,[]
1673,в майкопском районе полиция задержала конокрадов,2016-07-11 16:23:49,42564785,[]
1674,прокуратура принимает меры к устранению нарушений закона в деятельности автошкол,2016-07-11 15:29:50,42564785,[]
1675,в адыгее стали известны победители соревнований школа безопасности,2016-07-11 14:28:41,42564785,[]
1676,студенческий лидер,2016-07-09 01:11:23,42564785,[]
1677,курс на результат,2016-07-08 15:09:58,42564785,[]
1678,единая россия в адыгее готовится к выдвижению кандидатов на выборы в госсовет хасэ республики,2016-07-08 11:16:13,42564785,[]
1679,в адыгее впервые проходит окружной этап всероссийского конкурса студенческий лидер,2016-07-07 21:16:34,42564785,[]
1680,жительницу адыгеи осудили за ложный донос,2016-07-07 14:11:17,42564785,[]
1681,поздравление султана хацукова с праздником ураза байрам,2016-07-06 13:06:00,42564785,[]
1682,перекрестков майкопа оборудуют тактильной плиткой для слабовидящих,2016-07-05 21:11:05,42564785,[]
1683,госавтоинспекция отметила летие,2016-07-05 15:07:44,42564785,[]
1684,глава адыгеи поздравил сотрудников гибдд,2016-07-04 19:09:20,42564785,[]
1685,в адыгее создадут региональное отделение изборского клуба,2016-07-04 15:16:12,42564785,[]
1686,работа на результат,2016-07-02 08:05:24,42564785,[]
1687,в столице адыгеи ликвидируют последствия стихии,2016-07-01 22:09:12,42564785,[]
1688,июня по майкопу пронесся ливневый ураган,2016-07-01 14:18:15,42564785,[]
1689,в адыгее ожидаются ливневые дожди,2016-06-30 20:18:26,42564785,[]
1690,ураза байрам в адыгее объявлен нерабочим днем,2016-06-30 17:09:37,42564785,[]
1691,в адыгее летний мальчик умер от теплового удара,2016-06-30 15:10:02,42564785,[]
1692,в столице адыгеи изменятся некоторые маршруты общественного транспорта,2016-06-30 12:10:17,42564785,[]
1693,в адыгее утонула летняя девочка,2016-06-29 19:07:56,42564785,[]
1694,судебные приставы взыскали со строительной фирмы более полумиллиона рублей,2016-06-29 16:08:11,42564785,[]
1695,в адыгее мужчина подозревается в убийстве отца пенсионера,2016-06-29 14:05:35,42564785,[]
1696,страхование здоровья,2016-06-28 22:15:57,42564785,[]
1697,полицией майкопа задержан водитель сбивший несовершеннолетнего и скрывшийся с места аварии,2016-06-28 14:18:22,42564785,[]
1698,в адыгее взят под стражу коллектор угрожавший взорвать детский сад,2016-06-28 13:25:16,42564785,[]
1699,аслан тхакушинов и наталья стадченко торжественно открыли новое здание тфомс республики адыгея,2016-06-27 19:34:40,42564785,[]
1700,прокуратура республики проверила законность деятельности летних детских лагерей в майкопском районе,2016-06-27 12:06:36,42564785,[]
1701,в г майкопе перед судом предстанут члены организованной группы обвиняемые в незаконном обороте кг золота,2016-06-27 11:07:33,42564785,[]
1702,фгуп почта россии нарушает порядок вручения,2016-06-26 16:12:43,42564785,[]
1703,фгуп почта россии нарушает порядок выемки письменной корреспонденции из почтовых ящиков в западно кубанском почтамте осп уфпс краснодарского края,2016-06-24 21:08:34,42564785,[]
1704,в адыгее убили летнего мальчика,2016-06-24 14:11:26,42564785,[]
1705,сегодня в майкопе состоится хх отчетно выборная конференция артооп федерация профсоюзов республики адыгея,2016-06-23 20:09:54,42564785,[]
1706,в адыгее задержали подозреваемых в вымогательстве,2016-06-23 18:09:12,42564785,[]
1707,июня ровно в четыре часа,2016-06-23 16:22:01,42564785,[]
1708,в памяти сердца храним,2016-06-22 18:11:53,42564785,[]
1709,финиш первого тура,2016-06-22 17:12:14,42564785,[]
1710,жители адыгеи зажгут свечу в окне в память о героях вов,2016-06-21 22:13:06,42564785,[]
1711,в адыгее педофил распространял детскую порнографию прямо из колонии,2016-06-21 15:29:36,42564785,[]
1712,глава карелии не подтвердил гибель детей на сямозере,2016-06-20 19:09:25,42564785,[]
1713,визит председателя союза молодежи рф павла красноруцкого в адыгею,2016-06-20 13:13:31,42564785,[]
1714,глава адыгеи поддержал инициативу создания адыгейского регионального отделения российского союза молодежи,2016-06-17 22:09:43,42564785,[]
1715,глава адыгеи встретился с участниками пресс тура,2016-06-17 17:07:44,42564785,[]
1716,дворец культуры открыли в ауле шенджий,2016-06-17 14:09:49,42564785,[]
1717,состоялось координационное совещание руководителей правоохранительных органов региона под председательством прокурора республики адыгея,2016-06-16 18:07:00,42564785,[]
1718,премьер министр адыгеи принимает участие в юбилейном петербургском международном экономическом форуме,2016-06-16 14:17:24,42564785,[]
1719,жителю адыгеи грозит до лет лишения свободы за попытку угона с применением ножа,2016-06-15 17:06:30,42564785,[]
1720,жителя ханской будут судить за нападение на женщину таксиста,2016-06-15 14:10:35,42564785,[]
1721,глава адыгеи и руководство тепличного комбината курганинский подписали инвестиционное соглашение,2016-06-15 13:08:54,42564785,[]
